id,video_id,trending_date,title,channel_title,category_id,publish_time,tags,views,likes,dislikes,comment_count,thumbnail_link,comments_disabled,ratings_disabled,video_error_or_removed,description
15824,EW3KD4kqqug,2018-02-03,Rose McGowan Talks Alleged Sexual Misconduct By Harvey Weinstein | The View,The View,29,2018-01-30 16:39:00+00:00,"Rose McGowan|""Rose's Army""|""MeToo""|""Time's Up""|""The View""|""feminism""|""women's rights""|""hot topics""|""Harvey Weinstein""|""Hollywood""",225711,2275,449,1172,https://i.ytimg.com/vi/EW3KD4kqqug/default.jpg,False,False,False,
15803,ElKPnh0Q8pU,2018-02-03,A Boogie Wit Da Hoodie - Somebody feat. Don Q [Official Music Video],A-Boogie Wit Da Hoodie,1,2018-02-01 17:02:19+00:00,"A Boogie|""A Boogie Wit Da hoodie""|""Somebody""|""Don Q""|""The Bigger Artist""|""Artist""|""TBA""|""Highbridge""|""Highbridge The Label""|""Atlantic Records""|""Hip Hop""|""Rap""|""New York""|""Bronx""",297112,16677,196,1032,https://i.ytimg.com/vi/ElKPnh0Q8pU/default.jpg,False,False,False,A Boogie Wit Da Hoodie – Somebody (feat. Don Q)\nDownload/Stream: https://Atlantic.lnk.to/TheBiggerArtistID \n \nFollow A Boogie\nInstagram - https://www.instagram.com/ArtistHBTL/\nTwitter - http://twitter.com/ArtistHBTL\nFacebook - https://www.facebook.com/ArtistHBTL\nSpotify - https://open.spotify.com/artist/31W5EY0aAly4Qieq6OFu6I\nSoundcloud - https://soundcloud.com/a-boogie-wit-da-hoodie\n\nFollow High Bridge\nFacebook: https://www.facebook.com/HighBridgeOfficial\nTwitter: https://twitter.com/Highbridgelabel\nInstagram: https://www.instagram.com/highbridgethelabel/\nSoundcloud: https://soundcloud.com/user-939666509
15967,EsdjC5dsOTM,2018-02-03,Novak Djokovic v Hyeon Chung match highlights (4R) | Australian Open 2018,Australian Open TV,17,2018-01-22 13:02:49+00:00,"AusOpen|""Australian Open""|""tennis""|""men's singles""|""tournament""|""round four""|""hyeon chung""|""ausopen 2018""|""association of tennis professionals""|""melbourne park""|""singles""|""kor""|""ausopen""|""ao2018""|""atp""|""srb""|""fourth round""|""2018""|""ao 2018""|""novak djokovic""|""melbourne""|""round 4""|""atp world tour""|""ao""|""men's tennis""|""australia""|""australian open""|""australian open 2018""|""australian open tournament""|""slam""|""5716550508001""|""2018 AO Match Highlights""",901734,4663,190,1089,https://i.ytimg.com/vi/EsdjC5dsOTM/default.jpg,False,False,False,What an amazing match between Novak Djokovic and Hyeon Chung here are the highlights from the Australian Open 2018.
15956,FB64ez0kf1c,2018-02-03,Megyn Kelly: I Have No Regrets About My Question To Jane Fonda | Megyn Kelly TODAY,TODAY,25,2018-01-22 15:35:41+00:00,"The TODAY Show|""TODAY Show""|""TODAY""|""NBC""|""NBC News""|""Celebrity Interviews""|""TODAY Show Recipes""|""Fitness""|""Lifestyle""|""TODAY Show Interview""|""Ambush Makeover""|""Kathie Lee and Hoda""|""KLG and Hoda""|""megyn kelly today""|""megyn kelly""|""megyn kelly jane fonda""|""jane fonda plastic surgery""|""plastic surgery""|""megyn kelly jane fonda plastic surgery""|""jane fonda""|""under the knife""|""work done""|""wrinkles""|""aging""|""botox""|""jane fonda megyn kelly""|""robert redford""|""our souls at night""|""megyn kelly on jane fonda""",557099,2556,3005,1888,https://i.ytimg.com/vi/FB64ez0kf1c/default.jpg,False,False,False,"TODAY’s Megyn Kelly responds to Jane Fonda’s recent issues with her questions about plastic surgery while appearing on Megyn Kelly TODAY. Kelly explains why she has no “regrets asking the question.”\n\n» Subscribe to TODAY: http://on.today.com/SubscribeToTODAY\n» Watch the latest from TODAY: http://bit.ly/LatestTODAY\n\nAbout: TODAY brings you the latest headlines and expert tips on money, health and parenting. We wake up every morning to give you and your family all you need to start your day. If it matters to you, it matters to us. We are in the people business. Subscribe to our channel for exclusive TODAY archival footage & our original web series.  \n\nConnect with TODAY Online!\nVisit TODAY's Website: http://on.today.com/ReadTODAY\nFind TODAY on Facebook: http://on.today.com/LikeTODAY\nFollow TODAY on Twitter: http://on.today.com/FollowTODAY\nFollow TODAY on Google+: http://on.today.com/PlusTODAY\nFollow TODAY on Instagram: http://on.today.com/InstaTODAY\nFollow TODAY on Pinterest: http://on.today.com/PinTODAY\n\nMegyn Kelly: I Have No Regrets About My Question To Jane Fonda | Megyn Kelly TODAY"
15926,FOLQlEh1D20,2018-02-03,Lil Wayne - Bloody Mary feat. Juelz Santana (Official Audio) D6 Reloaded,Lil Wayne,10,2018-01-25 01:00:03+00:00,"hollyweezy|""cash money""|""juelz santana""|""birdman""|""bloody mary""|""young money""|""d6""|""weezy wednesday""|""wayne""|""dwayne carter""|""hollygrove""|""hiphop""|""lil wayne dedication""|""dedication""|""dedication 6 reloaded""|""In Tune We Trust""|""hot boys""|""lil wayne 2017""|""dedication 6""|""reloaded""|""d6 reloaded""|""jul""|""2 chainz""|""lil wayne dedication 6""|""tha carter""|""ymcmb""|""dedication reloaded""|""lil wayne bloody mary""|""lil wayne""|""lil wayne dedication 6 reloaded""|""weezy""|""lil wayne juelz santana""|""wayne carter""",1065325,27452,620,5093,https://i.ytimg.com/vi/FOLQlEh1D20/default.jpg,False,False,False,"Bloody Mary by Lil Wayne feat. Juelz Santana, off the Dedication 6 Reloaded mixtape.\n\nListen to the full mixtape: https://www.youtube.com/playlist?list=PLXcRV4ZzG8t1wspbC5dnpD0JPf99BdVLp\n\nClick to subscribe to Lil Wayne's YouTube channel for exclusive footage! http://bit.ly/WayneYTSub\n\nWatch Lil Wayne's Exclusive Series and Footage:\nWeezy Wednesdays: http://bit.ly/WeezyWeds\nLil Wayne Exclusive Tracks: http://bit.ly/WayneExclusives\nLil Wayne Official Music Videos: http://bit.ly/WayneVideos\n\nLil Wayne on Twitter: http://www.twitter.com/LilTunechi\nLil Wayne on Facebook: http://www.facebook.com/LilWayne\nYoung Money on Facebook: http://www.facebook.com/youngmoneyent"
15818,FQUmz9QxtFc,2018-02-03,Jack Whitehall Teaches His Dad About YouTube,Jack Whitehall,23,2018-01-30 16:00:01+00:00,"jack whitehall the o2|""jack whitehall o2""|""jack whitehall stand up""|""king of comedy""|""comedy awards""|""Jack Whitehall live""|""jack whitehall show""|""jack whitehall comedy""|""jack whitehall standup""|""jack whitehall comedian""|""jack whitehall gets around""|""comedy""|""jack whitehall fresh meat""|""stand up comedian""|""comedy videos""|""jack whitehall videos""|""funny videos""|""jack whitehall king of comedy""|""subscribe""|""how to subscribe""|""michael whitehall""|""jack whitehall dad""|""dad""",224505,9950,109,614,https://i.ytimg.com/vi/FQUmz9QxtFc/default.jpg,False,False,False,"Worth noting, this was all recorded pre-Sidemen (or PS, as we now refer to it).\nJack Whitehall has a tough time trying to teach his dad how to subscribe to this YouTube channel...\nSUBSCRIBE: http://bit.ly/1iKGKjq\nFOLLOW JACK ON TWITTER: https://twitter.com/jackwhitehall"
15833,FTldNZ7V8ls,2018-02-03,Jimmy Kimmel & Stormy Daniels Watch Trump’s State of the Union,Jimmy Kimmel Live,23,2018-01-31 03:55:27+00:00,"jimmy|""jimmy kimmel""|""jimmy kimmel live""|""late night""|""talk show""|""funny""|""comedic""|""comedy""|""clip""|""comedian""|""mean tweets""|""stormy daniels""|""donald trump""|""porn star""|""adult film star""|""state of the union""|""#SOTU""|""cold open""|""sex scandal""",164891,1210,408,250,https://i.ytimg.com/vi/FTldNZ7V8ls/default.jpg,False,False,False,"Jimmy and Stormy Daniels watch Donald Trump’s State of the Union address together before the show.\n\nTrump and Jay-Z Feud https://youtu.be/Yl3B4wZMwoA \n \nSUBSCRIBE to get the latest #KIMMEL: http://bit.ly/JKLSubscribe\n \nWatch Mean Tweets: http://bit.ly/KimmelMT10\n \nConnect with Jimmy Kimmel Live Online:\n \nVisit the Jimmy Kimmel Live WEBSITE: http://bit.ly/JKLWebsite\nLike Jimmy Kimmel on FACEBOOK: http://bit.ly/KimmelFB\nLike Jimmy Kimmel Live on FACEBOOK: http://bit.ly/JKLFacebook\nFollow @JimmyKimmel on TWITTER: http://bit.ly/KimmelTW\nFollow Jimmy Kimmel Live on TWITTER: http://bit.ly/JKLTwitter\nFollow Jimmy Kimmel Live on INSTAGRAM: http://bit.ly/JKLInstagram\n \nAbout Jimmy Kimmel Live:\n \nJimmy Kimmel serves as host and executive producer of Emmy-winning Jimmy Kimmel Live, ABC's late-night talk show.\n\nJimmy Kimmel Live is well known for its huge viral video successes with 5.6 billion views on YouTube alone.\nSome of Kimmel's most popular comedy bits include - Mean Tweets, Lie Witness News, Jimmy's Twerk Fail Prank, Unnecessary Censorship, YouTube Challenge, The Baby Bachelor, Movie: The Movie, Handsome Men's Club, Jimmy Kimmel Lie Detective and music videos like I (Wanna) Channing All Over Your Tatum and a Blurred Lines parody with Robin Thicke, Pharrell, Jimmy and his security guard Guillermo.\nNow in its sixteenth season, Kimmel's guests have included: Johnny Depp, Meryl Streep, Tom Cruise, Halle Berry, Harrison Ford, Jennifer Aniston, Will Ferrell, Katy Perry, Tom Hanks, Scarlett Johansson, Channing Tatum, George Clooney, Larry David, Charlize Theron, Mark Wahlberg, Kobe Bryant, Steve Carell, Hugh Jackman, Kristen Wiig, Jeff Bridges, Jennifer Garner, Ryan Gosling, Bryan Cranston, Jamie Foxx, Amy Poehler, Ben Affleck, Robert Downey Jr., Jake Gyllenhaal, Oprah, and unfortunately Matt Damon.\n\nJimmy Kimmel & Stormy Daniels Watch Trump’s State of the Union\nhttps://youtu.be/FTldNZ7V8ls"
15828,FtX7GY_iPok,2018-02-03,The Voice 2018 - Never Underestimate the Power of Kelly Clarkson (Promo),The Voice,24,2018-01-29 21:10:42+00:00,"nbc the voice|""watch the voice video""|""the voice season 14""|""the voice 2018""|""kelly clarkson coach""|""alicia keys coach""|""adam levine coach""|""blake shelton coach""|""never underestimate kelly clar""|""the voice season premiere""|""the voice feb 26""|""the voice season 14 premiere""|""the voice""|""the voice nbc""|""the voice new season""|""The Voice 2018""|""The Voice USA""|""The voice winners""|""adam levine""|""Alicia Keys""|""Kelly Clarkson""|""blake shelton""|""carson daly""|""the voice auditions""",598930,8040,168,692,https://i.ytimg.com/vi/FtX7GY_iPok/default.jpg,False,False,False,"Three-time Grammy winner Kelly Clarkson joins Coaches Alicia Keys, Adam Levine and Blake Shelton when The Voice returns to NBC for Season 14 on Monday, February 26 at 8/7c.\n» Get The Voice Official App: http://bit.ly/TheVoiceOfficialApp\n» Subscribe for More: http://bit.ly/TheVoiceSub\n» The Voice Returns Monday February 26 8/7c on NBC!\n» Watch Full Episodes: http://bit.ly/TheVoiceFullEpisodes\n\nTHE VOICE ON SOCIAL:\nLike The Voice: http://Facebook.com/NBCTheVoice\nFollow The Voice: https://Twitter.com/NBCTheVoice\nThe Voice Tumblr: http://nbcTheVoice.Tumblr.com/\nFollow The Voice on Instagram: https://instagram.com/nbcthevoice/\n\nNBC’s The Voice follows the strongest vocalists from across the country and invites them to compete in this season's blockbuster vocal competition.\n\nFind The Voice trailers, full episode highlights, previews, promos, clips, and digital exclusives here.\n\nNBC ON SOCIAL:\nNBC YouTube: http://www.youtube.com/nbc\nLike NBC: http://Facebook.com/NBC\nFollow NBC: http://Twitter.com/NBC\nNBC Tumblr: http://nbctv.tumblr.com/\nNBC Google+: https://plus.google.com/+NBC/posts\nNBC Instagram: http://instagram.com/nbc\n\nABOUT THE VOICE\nThe Voice 2018 USA YouTube channel features exclusive content with The Voice coaches, highlights from The Voice auditions, interviews with The Voice winners, as well as The Voice recaps and results. Learn more about The Voice contestants, The Voice tour, the eliminations, and follow your favorite performers all the way to the finale. In season 14, Kelly Clarkson joins returning coaches Adam Levine, Blake Shelton, and welcomes back Alicia Keys as celebrity musician coaches, while Carson Daly continues to serve as host. The show’s innovative format features five stages of competition: the first begins with the blind auditions, followed by the battle rounds, the knockouts, the live playoffs and finally, the live performance shows.\n\nThe Voice 2018 - Never Underestimate the Power of Kelly Clarkson (Promo)\nhttps://youtu.be/FtX7GY_iPok\n\nThe Voice\nhttp://www.youtube.com/user/nbcthevoice"
15879,GJTtiYMdMtk,2018-02-03,"Mabel, Not3s - Fine Line (Official Video)",MabelVEVO,10,2018-01-25 08:00:00+00:00,"Mabel|""Not3s""|""Fine""|""Line""|""Polydor""",1508181,34982,862,1185,https://i.ytimg.com/vi/GJTtiYMdMtk/default.jpg,False,False,False,"Stream / Download Fine Line: https://Mabel.lnk.to/FineLineID \n\nGet tickets to Mabel's 2018 tour: http://www.mabelofficial.com/live \n\nFollow Mabel:\nInstagram http://po.st/MabelIG\nFacebook http://po.st/MabelFB\nTwitter http://po.st/TWMabel\nSpotify http://po.st/MabelSP\nWebsite http://po.st/MabelWS\n\nSign up to the mailing list http://po.st/MabelSignUp\n\nDirected by Adriaan Louw \nProduced by The Swank Group \n\nMusic video by Mabel, Not3s performing Fine Line. (C) 2018 Polydor Records, a division of Universal Music Operations Limited\n\nhttp://vevo.ly/NzIIbM"
15910,GWMKelv5Bmw,2018-02-03,MIRANDA vs. IPHONE X FACE ID,Colleen Ballinger,23,2018-01-24 20:00:02+00:00,"colleen ballinger|""colleen""|""ballinger""|""psychosoprano""|""miranda sings""|""no lipstick""|""vlog""|""vlogging""|""singing""|""without lipstick""|""comedy""|""how to""|""tutorial""|""silly""|""funny""",2020478,69724,2622,5189,https://i.ytimg.com/vi/GWMKelv5Bmw/default.jpg,False,False,False,Come see me on tour!\nhttp://www.mirandasings.com\n\nFollow me on all the things! \nTwitter - http://www.twitter.com/ColleenB123\nFacebook - https://www.facebook.com/ColleenB1234\nyoutube - http://www.youtube.com/psychosoprano\nInstagram - http://instagram.com/colleen\nSnapchat - ColleenB123\n\nBusiness inquiries - msingsbranding@gmail.com
15821,Gc71AmT_b2k,2018-02-03,Bazzi - Mine (Official Video),Bazzi,10,2018-01-31 14:00:01+00:00,"Bazzi|""MIne""|""Beautiful""|""Bazzi Music""|""Andrew Bazzi""|""You So Fucking Precious When You Smile""|""You So Fucking Precious""|""Bazzi Official""|""Atlantic Records""|""ZZZEntertainment""|""Warner Music Group""|""Official Audio""|""Bazzi Official Audio""|""Official Video""|""Bazzi Mine""|""Bazzi ALone""|""Hands On Your Body""|""Mine""|""Pop""|""love galore""|""You So Precious""|""Memes""|""Wholesome Memes""|""Justin Beiber""|""Post Malone Music""|""Justin Beiber Music""|""Precious When You""|""Funny Memes""|""nkhnni7xgJk""",514456,46973,268,3595,https://i.ytimg.com/vi/Gc71AmT_b2k/default.jpg,False,False,False,Stream + download Mine: https://Bazzi.lnk.to/MineID\n\nFollow B A Z Z I: \nhttps://www.instagram.com/bazzi\nhttps://twitter.com/bazzi\nhttps://www.facebook.com/BazziWorldwide\n\nSubscribe to my channel: https://goo.gl/C6KC1m
15797,HEVonh8bjC0,2018-02-03,DISOBEDIENCE | Official Trailer | In theaters April 27,Bleecker Street,1,2018-02-01 20:02:16+00:00,"bleecker street|""bleecker street media""|""bleecker street films""|""bleecker street movies""|""movies""|""film""|""entertainment""|""bleeker street""",656541,4949,1127,1208,https://i.ytimg.com/vi/HEVonh8bjC0/default.jpg,False,False,False,"Official Site: http://www.Disobedience.Movie\nLIKE us on Facebook: http://www.facebook.com/DisobedienceMovie\nFOLLOW us on Twitter: http://www.twitter.com/BleeckerStFilms\nFOLLOW us on Instagram: http://www.instagram.com/BleeckerStFilms\n--\n\nLove is an act of defiance.\nWatch the official trailer for DISOBEDIENCE, starring Rachel Weisz and Rachel McAdams. In select theaters April 27."
15829,HI-mXMr8glQ,2018-02-03,Migos - Stir Fry (Official),MigosVEVO,10,2018-01-29 04:00:00+00:00,"Migos|""Culture""|""Culture 2""|""Culture II""|""Stir Fry""|""Quavo""|""Takeoff""|""Offset""|""Pharrell""|""Pharrell Williams""|""Video""|""Official Video""|""Official""",6665991,216260,8577,20766,https://i.ytimg.com/vi/HI-mXMr8glQ/default.jpg,False,False,False,"Listen to Culture II everywhere now: https://Migos.lnk.to/Culture2YD\n\nPurchase exclusive Migos merch featured from their official store: https://Migos.lnk.to/StoreYD\n\nFollow Migos:\nhttps://facebook.com/THEMigosAtl\nhttps://twitter.com/migos\nhttps://instagram.com/migos\n\nMusic video by Migos performing Stir Fry. (C) 2017 Quality Control Music, LLC and UMG Recordings, Inc.\n\nhttp://vevo.ly/KKHf5B"
15898,HuJkBDBloa0,2018-02-03,Jumanji! 1995 Vs 2017,WatchMojo.com,24,2018-01-25 01:00:01+00:00,"Top 10|""List""|""Movies""|""Film""|""Jumanji""|""Jumanji: Welcome to the Jungle""|""Game""|""Robin Williams""|""Dwayne Johnson""|""Kevin Hart""|""Jack Black""|""Karen Gillan""|""Nick Jonas""|""game""|""play""|""funny""|""action""|""scene""|""hilarious""|""versus""|""vs""|""better""|""worse""|""WatchMojo""",430943,6895,1038,1753,https://i.ytimg.com/vi/HuJkBDBloa0/default.jpg,False,False,False,"Jumanji! 1995 Vs 2017\nSubscribe: http://goo.gl/Q2kKrD // \nHave a Top 10 idea? Submit it to us here! http://watchmojo.com/my/suggest.php\n\nJumanji: Welcome to the Jungle is a certified hit at the box office, but how does it compare to the original Robin Williams led romp from 1995? WatchMojo puts the two movies head to head to find out which one is best? But which film will claim victory? Watch to find out!\n\nWatch on WatchMojo: http://www.WatchMojo.com\n\nHave an idea for our next video? Submit your suggestion here: http://www.watchmojo.com/my/suggest.php\n\nOur Magazine!! Learn the inner workings of WatchMojo and meet the voices behind the videos, articles by our specialists from gaming, film, tv, anime and more. VIEW INSTANTLY: http://goo.gl/SivjcX\n\nWatchMojo's Social Media Pages\nhttp://www.Facebook.com/WatchMojo\nhttp://www.Twitter.com/WatchMojo \nhttp://instagram.com/watchmojo \n\nGet WatchMojo merchandise at shop.watchmojo.com\n\nWatchMojo’s ten thousand videos on Top 10 lists, Origins, Biographies, Tips, How To’s, Reviews, Commentary and more on Pop Culture, Celebrity, Movies, Music, TV, Film, Video Games, Politics, News, Comics, Superheroes. Your trusted authority on ranking Pop Culture."
15935,IIS1M7m9tw8,2018-02-03,I have something to tell you..,Daisy Marquez,22,2018-01-25 22:10:48+00:00,"Daisy Marquez|""DaisyMarquez""|""Daisy Marques""|""Deisy Marquez""|""Deisy Marques""|""daisymarquez_""|""DeisyMarques""|""marquez.daisy""",639775,25489,2426,2730,https://i.ytimg.com/vi/IIS1M7m9tw8/default.jpg,False,False,False,"►SUBSCRIBE http://bit.ly/SUBdaisy\n\nhttps://www.youtube.com/watch?v=EktxevGQ_MQ\n\n- - - - - - - - - - - - - - - - - - - - - - - - - - - - - - - - - - - - - - - - - - - - - - - - -\n ► LET'S BE FRIENDS\nSNAP: marquez.daisy\nINSTA: http://bit.ly/2eMl5wC\nTWITTER: http://bit.ly/2eMl3Vw\n- - - - - - - - - - - - - - - - - - - - - - - - - - - - - - - - - - - - - - - - - - - - - - - - -\n🤑🤑SAVE SOME MONEY🤑🤑\nOFRA - DAISY30\nMUDDYBODY - DAISY10\nVANITYPLANET - DAISY7\nTHEMAKEUPSHACK -DAISY\nLAURA’S BOUTIQUE - DAISY\nMESHKI BOUTIQUE - DAISY10\nBEBELLACOSMETICS - DAISYXO\nARTIST COUTIRE - daisymarquez\nLILLY LASHES - DAISY\nKMYNX LASHES - daisy\n\n ►Music: Epidemic Sound Lauren Giraldo - So Cool\n ►Camera Canon 70D\n\nThank you so much for watching, I love you my little flowers🌼💞\nXOXO"
15939,IVW7-k7pHE4,2018-02-03,Armin VLOG #33: The Upside Down,Armin van Buuren,10,2018-01-25 16:14:29+00:00,"Armin|""van""|""Buuren""|""Armada""|""Music""|""Trance""|""State""|""Of""|""Radio""|""Episode""|""Armin van Buuren""|""Above & Beyond""|""The Upside Down""|""dj booth""|""upside down""",73066,2205,44,161,https://i.ytimg.com/vi/IVW7-k7pHE4/default.jpg,False,False,False,Want to see how I actually DJ-ed in a dj booth… UPSIDE DOWN?\n\nClick here for all the A State Of Trance episodes: https://ASOTEpisodes.lnk.to/PL\nSubscribe to Armin van Buuren: http://bit.ly/SubscribeArmin\n\nTRACKLIST\n[00:00] BT - Yahweh: Out Friday!\n[01:56] Ruben de Ronde X Rodg - Little Drummer: https://STM208.lnk.to/LDYA\n[03:56] Armin van Buuren feat. Trevor Guthrie - This Is What It Feels Like: http://armadamusic.lnk.to/TIWIFL  \n[05:43] Armin van Buuren feat. Kensington - Heading Up High (First State Remix): https://AvB.lnk.to/HeadingUpHighRYA \n[07:24] Omnia & Alex Sonata - Titans: Out Friday!
15912,If75XsbYCZw,2018-02-03,The LAST Last Jedi Debate - MOVIE FIGHTS!!,Screen Junkies,1,2018-01-26 01:42:01+00:00,"screenjunkies|""screen junkies""|""movie fights""|""scott mantz""|""jenny nicholson""|""the last jedi""|""last jedi""|""honest trailers""|""honest trailer""|""star wars the last jedi""|""star wars 8""|""oscars 2018""|""academy awards 2018""|""oscar nominations""|""oscar snub""|""awards snub""|""2018 worst""|""luke skywalker""|""rian johnson""|""star wars 2017""|""star wars solo""|""kylo ren""|""snoke""|""justice league""|""dc movies""",173512,3795,1403,1898,https://i.ytimg.com/vi/If75XsbYCZw/default.jpg,False,False,False,Fighters: Scott Mantz vs Jenny Nicholson\n\nHost: Hal Rudnick\nFact Checker: Dan Murrell\nSocial Media Ambassador: Danielle Radford\n\nQUESTIONS:\n\n1. Star Wars The Last Jedi: Great or not great?\n2. What was the biggest snub from the 2018 Oscar nominations?\n3. Blind Fight!!\n\n HOW TO VOTE ON YOUTUBE WHEN LIVE: \n 1) Either: a - Refresh the page OR b - Turn your annotations off and back on (do this by clicking the gear icon on the bottom right of video's progress bar) \n 2) Scroll over the white circle with an i in the middle (aka The iCard) and cast your vote! You can change your vote as the round progresses! \n3) Repeat each round! \n\nDownload the audio version on iTunes! at our RSS Feed ►► http://apple.co/1Mw3boz \nBecome a Screen Junkie! ► http://bit.ly/sjsubscr \nGot a tip? Email us ► feedback@screenjunkies.com \nFollow us on Twitter ► http://twitter.com/screenjunkies \nLike us on Facebook ► http://www.fb.com/screenjunkies \nDownload our iPhone App! ►► http://bit.ly/SJAppPlus \nDownload our Android App! ►►http://bit.ly/SJPlusGoogleApp
15981,IiRmtBZu0pM,2018-02-03,COMING OUT TO MY LESBIAN MOMS,Andrew Lowe,23,2018-01-21 00:41:08+00:00,"andrew|""lowe""|""coming out""|""lesbian moms""|""andrew lowe coming out""|""gay""|""moms""|""gay moms""|""andrew lowe gay""",885342,43947,9252,8584,https://i.ytimg.com/vi/IiRmtBZu0pM/default.jpg,False,False,False,Surprise! Another gay\n\nNew videos every Wednesday and Saturday starting NOW! SUBSCRIBE! \n\nExplaining some things you may be wondering about this past year in my next video. \n\nWATCH ME:\nMain Channel: http://goo.gl/OYjWoJ\nSecond Channel: http://goo.gl/gdTu2q\n\nMERCH: goo.gl/fxeSNR\n\nFOLLOW ME:\nTwitter: http://goo.gl/AZrTi9\nSnapchat: lowecow\nInstagram: http://goo.gl/ewmhFh\nFacebook: http://goo.gl/2rvEcT\nTumblr: http://goo.gl/yYVPDl\nVine: Andrew Lowe\n\nBUSINESS INQUIRIES ONLY:\ncontactandrewlowe@gmail.com\n\nDon't forget to thumbs up! Let's see if we can get this video to enough likes for me to feel validation of my worth in this cold world. Fingers crossed!
15812,IkV5VpEROW0,2018-02-03,73 Questions With Donatella Versace | Vogue,Vogue,22,2018-01-31 13:00:16+00:00,"73 questions|""celebrity""|""donatella versace""|""fashion""|""gianni versace""|""luxury""|""versace""|""vogue""|""73 questions interview""|""versace dress""|""gianni""|""donatella versace versace""|""donatella""|""donatella versace interview""|""gianni versace murder""|""gianni versace sister""|""donatella versace style""|""donatella versace clothing""|""donatella versace 73""|""donatella versace 73 questions""|""vogue 73""|""versace 73 questions""|""versace versace versace""|""vogue.com""",917469,32407,691,2358,https://i.ytimg.com/vi/IkV5VpEROW0/default.jpg,False,False,False,"Fashion designer Donatella Versace invites Vogue into her beautiful Milan apartment (previously owned by the late Gianni Versace) and answers 73 questions. As Donatella takes us through the rooms of her family's home, she talks about the legacy of Gianni Versace, the future of fashion, and the most common misconceptions about her.\n\nStill haven’t subscribed to Vogue on YouTube? ►► http://bit.ly/vogueyoutubesub\n \nABOUT VOGUE\nVogue is the authority on fashion news, culture trends, beauty coverage, videos, celebrity style, and fashion week updates. \n\n73 Questions With Donatella Versace | Vogue\n\nCreated By: Joe Sabia"
15802,JVDyowAzBrU,2018-02-03,Pabllo Vittar - Então Vai (Feat. Diplo) (Videoclipe Oficial),Pabllo Vittar,10,2018-02-02 17:25:58+00:00,"#pabllo|""#vittar""|""#pabllo vittar""|""#pv""|""diplo""|""entao""|""vai""|""brazil""|""drag""|""queen""|""pabllo""|""vittar""|""oficial""|""clipe""",2964416,341256,28125,44629,https://i.ytimg.com/vi/JVDyowAzBrU/default.jpg,False,False,False,"FICHA TÉCNICA - ENTÃO VAI\n\nDireção: Hick Duarte\nAssistente de direção: Gianluca Misiti\nDireção de Fotografia: Hick Duarte e Renato Pagliacci\nProdução Executiva: David Jensen e Patrícia Veneziano (WBORN)\nPlatô: Jeferson Hulk\nCâmera: Marco Frossard\nLogger: Leo Mendes\nStyling: Victor Miranda\nAssit. Styling: André Philipe\nDireção de arte: Laura Taylor e Otávio Françoso (Manmade)\nBeleza: Dindi Hojah\nProdução de casting: Julia Gameiro\nTalentos: Camila de Alexandre, Juan Falcón, Danielle Aguiar, Catherine Silva, Mateus Trindade, Urias\nProdutora de Locação: Flávia Santos\nAgradecimentos especiais: Comunidade de Araçatiba, Rio de Janeiro"
