id,video_id,trending_date,title,channel_title,category_id,publish_time,tags,views,likes,dislikes,comment_count,thumbnail_link,comments_disabled,ratings_disabled,video_error_or_removed,description
15836,V69XYIRjKww,2018-02-03,Tom Clancy’s Jack Ryan – Super Bowl Commercial [HD] | Prime Video,Prime Video,24,2018-01-30 18:49:51+00:00,"Amazon|""amazon prime""|""amazon video""|""trailer""|""streaming""|""Amazon Original Series""|""Prime Video""|""jack ryan""|""jack ryan john krasinski""|""jack ryan amazon video""|""jack ryan amazon prime""|""jack ryan series""|""jack ryan trailer""|""john krasinski""|""tom clancy""|""13 hours""|""rainbow six""|""jack ryan prime""|""super bowl""|""super bowl ad""|""super bowl 2018""|""Super Bowl LII""|""super bowl 52""|""jack ryan super bowl""|""official trailer""|""jack ryan official trailer""|""jim office""|""jim halpert""|""Super Bowl Commercial""",3244952,581,63,105,https://i.ytimg.com/vi/V69XYIRjKww/default.jpg,False,False,False,"Follow the money, save the world. A first look at the much-anticipated CIA thriller centered on the famed and lauded Tom Clancy hero as he transforms from analyst to super-agent.\n» Stream Tom Clancy's Jack Ryan August 2018, exclusively with your Prime membership: http://bit.ly/TomClancysJackRyanPrimeVideo\n» SUBSCRIBE: http://bit.ly/PrimeVideoSubscribe\n\nAbout Tom Clancy's Jack Ryan:\nWhen CIA analyst Jack Ryan stumbles upon a suspicious series of bank transfers his search for answers pulls him from the safety of his desk job and catapults him into a deadly game of cat and mouse throughout Europe and the Middle East, with a rising terrorist figurehead preparing for a massive attack against the US and her allies.\n\nGet More Prime Video: \nStream Now: http://bit.ly/WatchMorePrimeVideo\nFacebook: http://bit.ly/PrimeVideoFB\nTwitter: http://bit.ly/PrimeVideoTW\nInstagram: http://bit.ly/PrimeVideoIG\n\nAbout Prime Video:\nWant to watch it now? We've got it. This week's newest movies, last night's TV shows, classic favorites, and more are available to stream instantly, plus all your videos are stored in Your Video Library. Over 150,000 movies and TV episodes, including thousands for Amazon Prime members at no additional cost.\n\nTom Clancy’s Jack Ryan – Super Bowl Commercial [HD] | Prime Video\nhttps://youtu.be/S3r7A2Evw2k\n\nPrime Video\nhttps://www.youtube.com/PrimeVideo"
15816,V6wWKNij_1M,2018-02-03,Hereditary | Official Trailer HD | A24,A24,1,2018-01-30 13:59:54+00:00,"a24|""a24 films""|""a24 trailers""|""independent films""|""trailer""|""official""|""movie""|""a24 movies""|""oscar winner""|""academy award winner""|""Hereditary""|""Hereditary trailer""|""Hereditary 2018""|""Hereditary A24""|""a24 horror films""|""horror trailers""|""2018 horror trailers""|""horror movies""|""a24 hereditary""|""Ari Aster""|""Toni Collette""|""Gabriel Byrne""|""Alex Wolff""|""Milly Shapiro""|""thriller trailer""|""thriller films""|""Official Trailer""|""Hereditary Official Trailer""|""a24 Official Trailer""|""8_rTIAOohas""|""u7KZrt_cHH0""",2061459,14370,592,1340,https://i.ytimg.com/vi/V6wWKNij_1M/default.jpg,False,False,False,"SUBSCRIBE: http://bit.ly/A24subscribe\n\nFrom Ari Aster and starring Toni Collette, Gabriel Byrne, Alex Wolff, and Milly Shapiro – Coming June 8, 2018.\n\nRELEASE DATE: June 8, 2018\nDIRECTOR: Ari Aster\nCAST: Toni Collette, Gabriel Byrne, Alex Wolff, and Milly Shapiro\n\nVisit Hereditary WEBSITE: http://bit.ly/HereditaryMovie\nLike Hereditary on FACEBOOK: http://bit.ly/HereditaryFB\nFollow Hereditary on TWITTER: http://bit.ly/HereditaryTW\nFollow Hereditary on INSTAGRAM: http://bit.ly/HereditaryIG\n\n------\n\nABOUT A24:\nOfficial YouTube channel for A24, the studio behind Ex Machina, Amy, Room, The Witch, The Lobster, Moonlight, 20th Century Women & more.\n\nComing Soon: A Prayer Before Dawn, Lean on Pete, Slice\n\nSubscribe to A24's NEWSLETTER: http://bit.ly/A24signup\nVisit A24 WEBSITE: http://bit.ly/A24filmsdotcom\nLike A24 on FACEBOOK: http://bit.ly/FBA24\nFollow A24 on TWITTER: http://bit.ly/TweetA24\nFollow A24 on INSTAGRAM: http://bit.ly/InstaA24"
15823,VXvu5rtJNd4,2018-02-03,The Crown | Growing Up Royal | Netflix,Netflix,24,2018-01-31 19:16:52+00:00,"Netflix|""Trailer""|""Netflix Original Series""|""Netflix Series""|""television""|""movies""|""streaming""|""movies online""|""television online""|""documentary""|""comedy""|""drama""|""08282016NtflxUSCAN""|""watch movies""|""The Crown""|""royal family""|""matt smith""|""netflix""|""claire foy""|""british""|""the queen""|""queen elizabeth""|""empire""|""british monarchy""|""princess margaret""|""season 2""|""winston churchill""|""prince philip""|""queen elizabeth ii""|""PLvahqwMqN4M1uQ5JITdkmNrxZnwtUG-DP""|""PLvahqwMqN4M1yf6iG-es1g_QqubL8N8do""",42056,830,37,57,https://i.ytimg.com/vi/VXvu5rtJNd4/default.jpg,False,False,False,"Prince Charles followed in the footsteps of his father by attending the same school in Scotland, but life was far from easy for the young heir to the throne.\n\nWatch The Crown on Netflix: https://www.netflix.com/title/80025678\n\nSUBSCRIBE: http://bit.ly/29qBUt7\n\nAbout Netflix:\nNetflix is the world’s leading Internet television network with over 117 million members in over 190 countries enjoying more than 125 million hours of TV shows and movies per day, including original series, documentaries and feature films. Members can watch as much as they want, anytime, anywhere, on nearly any Internet-connected screen. Members can play, pause and resume watching, all without commercials or commitments.\n\nConnect with Netflix Online:\nVisit Netflix WEBSITE: http://nflx.it/29BcWb5\nLike Netflix Kids on FACEBOOK: http://bit.ly/NetflixFamily\nLike Netflix on FACEBOOK: http://bit.ly/29kkAtN\nFollow Netflix on TWITTER: http://bit.ly/29gswqd\nFollow Netflix on INSTAGRAM: http://bit.ly/29oO4UP\nFollow Netflix on TUMBLR: http://bit.ly/29kkemT\n\nThe Crown | Growing Up Royal | Netflix\nhttp://youtube.com/netflix"
15984,WAwRrtH-4Lg,2018-02-03,My Horibal Speling,TheOdd1sOut,23,2018-01-20 17:15:48+00:00,"spelling|""school""|""teacher""|""speech""|""audiobooks""|""speech impediment""|""dyslexia""|""spelling test""|""mrs koolaid""|""bees""|""reading""|""writting""|""raindrop""|""battle of the books""|""book""|""cartoon""|""animation""|""funny""|""lol""|""theoddonesout""|""theoddisout""|""tj""",8647514,400091,5097,83843,https://i.ytimg.com/vi/WAwRrtH-4Lg/default.jpg,False,False,False,hOI guis!!1! Thx 4 wathcing my vid abuot my horibal speling!  AS u can c im vewy gud at spelin now (heart emoji) Member 2 wore ur setblts!  \nSecond Channel ➤ https://www.youtube.com/channel/UC0GLNhtTu7yI8rl6ZZGeezw\n\nTwitter ➤ https://twitter.com/Theodd1sout\nMerch ➤ http://store.theodd1sout.com/\n\nMy Speech Impediment: Day 2 ➤ https://www.youtube.com/watch?v=2YhYEGuAWT0\n\nColorers ➤\n\nRush light invader ➤https://www.youtube.com/user/RushLightInvader\n\nPajamaParty Doodles ➤ https://www.youtube.com/channel/UCR0O-1cvuPNxDosvSDLpWHg\n\nVopsea ➤ https://www.youtube.com/user/fantsycat\n\nAntiDarkHeart ➤ https://twitter.com/AntiDarkHeart\n\nGetMadz ➤ https://www.youtube.com/c/Madz\n\n\nListen to FREE (public domain) audio books ➤ https://librivox.org/
15889,WB8ozD7l02w,2018-02-03,FIFA 18 - FUT Champions Cup Barcelona - Day 1,EA SPORTS FIFA,20,2018-01-27 00:50:20+00:00,"fifa|""fifa ultimate team""|""fut""|""fifa pack opening""|""fifa xbox""|""fifa ps4""|""fifaeas""|""FIFA 18""|""FIFA 18 Ultimate Team""|""FIFA 18 XBOX""|""FIFA 18 PS4""",799496,19454,904,225,https://i.ytimg.com/vi/WB8ozD7l02w/default.jpg,False,False,False,Day 1 of the FUT Champions Cup Barcelona featuring 128 player Swiss Group Play
15987,WXzA0pfvO6w,2018-02-03,Daniel Cormier Sets Hard Date in 2019 for Retirement from MMA,MMAFightingonSBN,17,2018-01-22 19:29:01+00:00,"mmafighting.com|""mma""|""fighting""|""mmafightingonsbn""|""mma fighting""|""the mma hour""|""mma hour""|""Daniel Cormier""|""interview""|""ariel helwani""|""show""|""Volkan Oezdemir""|""UFC 220""|""light heavyweight""|""sports""|""combat sports""|""jon jones""|""retirement""",45194,687,27,370,https://i.ytimg.com/vi/WXzA0pfvO6w/default.jpg,False,False,False,"Daniel Cormier speaks to Ariel Helwani on The MMA Hour about his technical knockout win over Volkan Oezdemir at UFC 220, defending the light heavyweight title, what's next for his career, retirement, and much more.\n\nSubscribe: http://www.youtube.com/subscription_center?add_user=mmafightingonsbn\n\nCheck out our full video catalog: http://www.youtube.com/mmafightingonsbn/videos\nVisit our playlists: http://www.youtube.com/mmafightingonsbn/playlists\nLike MMAF on Facebook: http://www.facebook.com/mmafighting\nFollow on Twitter: http://www.twitter.com/mmafighting\nRead More: http://www.mmafighting.com"
15805,Wg-HTE1WbeI,2018-02-03,Facebook Removes Black Panther Sabotage Event - Movie Talk,ColliderVideos,24,2018-02-02 18:34:33+00:00,"tobeornottobethatisthequestion|""Black Panther""|""Facebook""|""Alt-Right""|""Black Panther Facebook""|""Black Panther Petition""|""Octavia Spencer""|""Super Mario Bros""|""Super Mario""|""Mario Brothers""|""Minions""|""Illumination Entertainment""|""F. Gary Gray""|""Men in Black""|""Will Smith""|""Men in Black Spinoff""|""MIB""|""Leonardo DiCaprio""|""Leonardo Da Vinci""|""John Logan""|""Da Vinci Movie""|""Biopic""|""The Week Of""|""Adam Sandler""|""Chris Rock""|""Netflix""|""Movie News""|""Movie Fans""|""Movie Talk""|""Entertainment News""",44558,2062,260,1337,https://i.ytimg.com/vi/Wg-HTE1WbeI/default.jpg,False,False,False,"On this episode of Collider Movie Talk (Friday, February 2nd, 2018) Mark Ellis, Dennis Tzeng, Perri Nemiroff, and John Rocha discuss the following:\n\n1) Facebook removes Black Panther sabotage event \n\n2) Octavia Spencer plans to buy out Mississippi screening of 'Black Panther' for underserved\n\n3) Animated Super Mario Bros. Movie in the Works at Illumination Entertainment\n\n4) F Gary Gray in Talks to Direct Men in Black Spin-off\n\n5) Leonardo DiCaprio Sets John Logan to Adapt Leonardo Da Vinci Biography\n\n6) ‘The Week Of’ Trailer Reveals Adam Sandler’s New Netflix Movie with Chris Rock\n\n7) Live Twitter Questions\n\nThe same Facebook group that took credit for rigging the Rotten Tomatoes audience score of Star Wars: The Last Jedi, set their sights on trying to sabotage the score of the upcoming Marvel film Black Panther – with threats that they were also planning on doing the same for Solo: A Star Wars Story and Avengers Infinity War. \n\nOctavia Spencer took to her Instagram account to announce that she’s planning to buy out a movie theatre in Mississippi to offer screenings of Black Panther to “underserved communities.”  The actress plans on being in Mississippi the weekend of February 16th.\n\nAGREE / DISAGREE\n\nNintendo announced yesterday that it is partnering up with Universal Pictures’ Illumination Entertainment to develop a Mario movie, confirming earlier reports that a movie was in the works. Details at this time are slim, but the film will be based on the world of Super Mario Bros. and will star Mario as the main character. \n\nDeadline reports that Straight Outta Compton and Fate of the Furious helmer F Gary Gray is in negotiations to direct a new Men In Black film that will relaunch the franchise for Sony and Amblin. The studio has been trying to crack a new series of films after the original pairing of Tommy Lee Jones and Will Smith ended its run after the 2012 third installment. \n\nDeadline reports that Leonardo DiCaprio and his Appian Way banner has tapped the Oscar-nominated screenwriter of Skyfall and The Aviator, John Logan, to write the script for a Da Vinci movie based on Walter Isaacson’s biography: Leonardo da Vinci. \n\nNetflix has released the first trailer for The Week Of, the latest collaboration between the streaming service and Adam Sandler. The film marks the feature directorial debut of Robert Smigel, best known as the voice of Triumph the Insult Comic Dog, who also co-wrote the movie with Sandler.  \n\nLIVE TWITTER QUESTIONS\n\nFollow us on Twitter: https://twitter.com/ColliderVideo\nFollow us on Instagram: https://instagram.com/ColliderVideo\nFollow us on Facebook: https://facebook.com/colliderdotcom\n \nAs the online source for movies, television, breaking news, incisive content, and imminent trends, Collider is more than an essential destination. Visit Collider: http://collider.com\n \nFollow the site on Twitter: https://twitter.com/Collider\n\nSubscribe to the SCHMOES KNOW channel: https://youtube.com/schmoesknow\n\nAnd for even more great Collider Video content, check out our weekly schedule below and follow the links to peruse episodes both old and new. We’re your go-to destination for all things fandom.\n\nCOLLIDER MOVIE TALK - Weekdays 12PM ET / 9AM PT\nEntertainment News, Roundtable discussion and debate\nhttp://bit.ly/29BRtOO\n\nCOLLIDER HEROES  - Mondays & Wednesdays 5PM ET / 2PM PT\nThe latest news and speculation in the world of comic book movies, television, and graphic novels\nhttp://bit.ly/29F4Job\n\nCOLLIDER JEDI COUNCIL - Thursdays 5PM ET / 2PM PT\nWhat's new in the Star Wars universe and what we can expect from all the upcoming movies, novels, comics and more\nhttp://bit.ly/29v5wVi\n\nMOVIE TRIVIA SCHMOEDOWN - Tuesdays & Fridays 5PM ET / 2PM PT\nHead-to-head game show that turns trivia into a fierce competition\nhttp://bit.ly/29C2iRV\n\nPlus MOVIE & TV REVIEWS, INTERVIEWS, EDITORIALS, MAILBAG, MOVIE COMMENTARIES, VR GAMING, COMIC BOOK SHOPPING, THE TOP 50 SUPERHERO MOVIES OF ALL TIME, and much more each week. Subscribe today! http://bit.ly/2z80n4O"
15955,WrcwcMIYpQg,2018-02-03,FLOWER BOY: a conversation,"Tyler, The Creator",27,2018-01-22 15:33:36+00:00,"tyler the creator|""jerrod carmichael""|""scum fuck flower boy""|""sffb""|""flower boy""|""interview""|""grammys""|""two furry chairs""|""send one your love""|""see you again""|""golf wang""|""911""|""i aint got time""|""musiq 143""|""cortex samba""|""justin senorita""|""pharrell smile""|""garden shed""|""boredom""",1121077,70379,441,5103,https://i.ytimg.com/vi/WrcwcMIYpQg/default.jpg,False,False,False,Jerrod Carmichael / Tyler Okonma\n\nDirected By: Wolf Haley\nDP: Luis Panch Perez\nProduction: Happy Place\nSet Design: GOLF* home\nBackdrop: Brendon Burton
15911,XIZmIl9SsXk,2018-02-03,People Try The New Diet Coke Flavors,BuzzFeedVideo,22,2018-01-25 02:00:01+00:00,"BuzzFeed|""BuzzFeedVideo""|""BuzzFeed Video""|""diet coke""|""coke""|""coca cola""|""flavors""|""try""|""test""|""taste test""|""millennials""|""blood orange""|""ginger lime""|""twisted mango""|""fiesty cherry""|""new""|""release""|""2018""|""we try""|""people try""|""new diet coke flavors""|""soda""|""pop""|""diet""|""diet soda""|""zesty""|""zesty blood orange""|""citrus""|""vanilla""|""ginger""|""lime""|""orange""|""ginger ale""|""spice""|""millennial""|""gen x""|""black cherry""|""fruit""|""drink""|""mango""|""melon""|""cola""|""taste""|""for the first time""",697748,10681,1305,1193,https://i.ytimg.com/vi/XIZmIl9SsXk/default.jpg,False,False,False,"Do millennials love spicy things?\n\nCheck out more awesome videos at BuzzFeedVideo!\nhttps://bit.ly/YTbuzzfeedvideo\nhttps://bit.ly/YTbuzzfeedblue1\nhttps://bit.ly/YTbuzzfeedviolet\n\nGET MORE BUZZFEED:\nhttps://www.buzzfeed.com\nhttps://www.buzzfeed.com/videos\nhttps://www.youtube.com/buzzfeedvideo\nhttps://www.youtube.com/boldly\nhttps://www.youtube.com/buzzfeedblue\nhttps://www.youtube.com/buzzfeedviolet\nhttps://www.youtube.com/perolike\nhttps://www.youtube.com/ladylike\n\nBuzzFeedVideo\nBuzzFeed Motion Picture’s flagship channel. Sometimes funny, sometimes serious, always shareable. New videos posted daily!\n\nMUSIC\nLicensed via Audio Network\nSFX Provided By AudioBlocks\n(https://www.audioblocks.com)\n\nCredits: https://www.buzzfeed.com/bfmp/videos/44730"
15842,XY8QQmFswmA,2018-02-03,Tekken Mobile - iOS/Android - Rodeo's journey (Character Reveal Trailer),BANDAI NAMCO Entertainment Europe,20,2018-01-31 15:00:17+00:00,"bandai namco Entertainment|""bandai namco""|""namco bandai""|""namco""|""videogames""|""gaming""|""games""|""Videogame""|""jeu video""|""jeux videos""|""videospiel""|""spiele""|""videogioco""|""gioco""|""videojuego""|""juego""|""trailer""|""video""|""teaser""|""tekken""|""mobile""|""rodeo""|""ios""|""android""|""play store""|""apple store""",39793,321,52,151,https://i.ytimg.com/vi/XY8QQmFswmA/default.jpg,False,False,False,"Brand new TEKKEN character Rodeo joins Tekken Mobile! The two-star Rodeo will be released for free to all players to celebrate the launch on March 1st!\n\nBo Rodeo Montana is a former All-State Football Champion and US Marine. While on a secret mission, Rodeo and his unit was ambushed by Revenant, draining his and all his comrades physical strength and training. In order save his comrades he must defeat Revenant and recover his powers. \n\nRodeo features long reach and massive HP, with a fighting style comprised of military techniques mixed with MMA training. Although he is a new character to the TEKKEN franchise, he is a driven, loyal fighter whose training and fight style rival the most powerful existing fighters. \n\nLike us: https://www.facebook.com/tekkenmobile\nFollow us: https://twitter.com/tekkenmobile\nVisit us: https://www.bandainamcoent.eu"
15891,Xz3GEsF-VKA,2018-02-03,Pharrell Meets Ellen's Favorite Kid Trainer Demarjay,TheEllenShow,24,2018-01-25 14:01:11+00:00,"pharrell|""williams""|""pharrell williams""|""demarjay""|""music icon""|""kid trainer""|""Ellen""|""degeneres""|""ellen degeneres""|""the ellen show""|""ellen fans""|""ellen tickets""|""ellentube""|""ellen audience""|""n.e.r.d""|""nerd""|""lemon""|""happy""|""demarjay smith""|""young""|""kid""|""talented""|""spoken word""|""inspiring""|""11""|""motivational""|""speech""|""audience""",1530403,38531,812,0,https://i.ytimg.com/vi/Xz3GEsF-VKA/default.jpg,True,False,False,"Music icon Pharrell Williams met Ellen's favorite fitness trainer Demarjay Smith for the first time, and the 11-year-old gave a motivational speech you'll never forget."
15982,Y-iFgDK_D5s,2018-02-03,The Smallest Bird you have ever seen,A Chick Called Albert,15,2018-01-21 00:10:07+00:00,"wren|""baby bird""|""incubating""|""nest""|""birdnest""|""hatching""|""incubator""|""sweet bird""|""little bird""|""little egg""|""egg""|""incubating eggs""|""einstein""|""smal bird""|""smallest bird""",5041752,161453,2807,16393,https://i.ytimg.com/vi/Y-iFgDK_D5s/default.jpg,False,False,False,By accident I got hold of two of the smallest eggs I have ever seen.\nShould I incubate them?\nWould I be able to raise a baby bird that would hatch from it?\n\nThe little bird is called a Wren. In my country it is the second smallest bird species there is.\n\nIt hatched so fast that I missed it.\nThe feeding was hard with my big human hands and very time-consuming. It took me about 80 feeding rounds per day to keep him healthy.\nBut in the end it worked.\n\n\nMore stories soon     cool if you subscribe\n\nThe incubator I used is a MS incubator\nMS incubators (made in Holland)\nhttps://www.broedmachine.nl/\nAnd in English \nhttps://www.broedmachine.nl/?___store=english&___from_store=dutch\n\nFor filming I used a canon EOSD7 and an I-phone 5s\n\nAll our music comes from audionetwork.com\nMusic in this video:\nCopos De Nieve by Christopher Slaski (PRS)\nFree Falling by Richard Kimmings (PRS) | Chris Egan (PRS)\nIn the Beginning by Paul Mottram (PRS)\nTime To Dream by Patrick Hawes (PRS)\nBoulevard Stroll by Keith Beauvais (PRS)\nLa Vie En Paris by Emily Lim (PRS)\n\nThank's for watching
15965,YNpCXG66_PA,2018-02-03,We Share Our Home With 14 Bears | BEAST BUDDIES,Barcroft Animals,15,2018-01-23 00:00:03+00:00,"amazing news|""amazing stories""|""amazing story""|""amazing""|""barcroft animals""|""barcroft tv""|""film""|""video""|""documentary""|""Barcroftmediaanimalstag""|""Beast Buddies""|""bears""|""grizzly bears""|""Bearadise Ranch""|""Florida""|""black bears""|""polar bears""|""pets""|""unconventional""|""dangerous""|""pet bears""|""bear family""|""attack""|""Walt Disney""|""dangerous animals""|""wild animals""|""family legacy""|""tradition""|""bears living with humans""|""supersize pet""|""unusual""|""Barcroft Animals""|""236348""",78985,1506,41,169,https://i.ytimg.com/vi/YNpCXG66_PA/default.jpg,False,False,False,"SUBSCRIBE to Barcroft Animals: http://bit.ly/2ceCJY0\n\nA DARING mother and son duo have hand-raised 14 bears in their back garden. In the heart of Bearadise Ranch, Florida, Monica Welde and her son, Johnny IV, spend their days rolling around with bears that weigh up to 1,000lbs. The Welde family have looked after grizzly bears, black bears and polar bears for the last 91 years – using their license to provide for those in need of a home. But the family tradition came under threat last year when Monica’s husband, Johnny III, died of a heart attack just after he turned 60. But with the help of her son, a devastated Monica has put her loss to one side so she can concentrate on continuing the family legacy and caring for their beloved pet bears.\n\nVideo Credits:\nVideographer / director: Rodrigo Gomez\nProducer: Danny Baggot, Ruby Coote  \nEditor: Sonia Estal \n\nBarcroft TV: https://www.youtube.com/user/barcroftmedia/featured\nBarcroft Animals: https://www.youtube.com/barcroftanimals/featured\nBarcroft Cars: https://www.youtube.com/user/BarcroftCars/featured\n\nFor more of the amazing side of life:\n\nFor the full story, visit ANIMALS.BARCROFT.TV: http://animals.barcroft.tv/\nLike @BarcroftAnimals on Facebook: https://www.facebook.com/BarcroftAnimals/\nFollow @BarcroftAnimals on Twitter: https://twitter.com/BarcroftAnimals\nCheck out more videos: https://www.youtube.com/barcroftanimals/videos\n\nDownload the Barcroft TV iOS app: https://itunes.apple.com/us/app/barcroft-tv/id1287734327?mt=8\n\nDownload Barcroft TV on Android: https://play.google.com/store/apps/details?id=com.recipe.barcroft&hl=en"
15904,YWVylysTNIA,2018-02-03,German Shepherd being a great attack dog,Pomegranate Sunshine,15,2018-01-23 22:55:42+00:00,"gsd|""german shepherd""|""apollo""|""shepherd""|""attack dog""|""big dog""|""protective""|""funny""|""apollo the german shepherd""|""scared""",112906,816,28,55,https://i.ytimg.com/vi/YWVylysTNIA/default.jpg,False,False,False,"Oh wait, no he isn't."
15846,ZurW-Uc6Lc0,2018-02-03,HORMONES | The Weekly #4 | LIFESTYLE,Sprinkleofglitter,26,2018-01-28 09:00:03+00:00,"Louise Pentland|""Sprinkle Of Glitter""|""Sprinkleofglitter""|""Mummy Vlogger""|""Mummy Blogger""|""Mom Vlogger""|""Mom Blogger""|""Motherhood""|""UK Parenting Channel""|""MumLife""",539045,22927,460,2870,https://i.ytimg.com/vi/ZurW-Uc6Lc0/default.jpg,False,False,False,"A week postpartum and hormones have kicked in!\nLast week introducing baby Pearl - http://bit.ly/2DTQHxF\nLike my episodes? Maybe like my book! - http://amzn.to/2mTHyuh\n\nThe milk formula dispenser pot I talked about - * http://amzn.to/2DGztR8\n\nThe bottle steriliser I have - * http://amzn.to/2FqhP4t\n\nMore Me :\n\nTwitter - https://twitter.com/LouisePentland\nInstagram - https://www.instagram.com/louisepentl...\nFaceBook - https://www.facebook.com/louisepentland/\nRobin Wilde - http://louisepentlandnovel.com/\n\n***PO Box*** \n(this is strictly for business/PR. If you are a viewer, please do NOT send gifts because I'd like you to spend your pennies on yourself. Cards and letters are welcome)\nFAO Louise Pentland\nGleam Futures\n6 Floor, 60 Charlotte Street\nLondon\nW1T 2NU\n\nBusiness Contact - Charlotte@GleamFutures.com\n\nAbout Me ::\n\nHi, I'm Louise! I started this channel in 2009 after readers of my blog (called Sprinkle of Glitter) suggested I give YouTube a try. I was instantly hooked and have found my internet playground on here. I make videos about beauty & fashion, positive living, motherhood, lifestyle and occasionally have special guests (friends, kittens or my sweet Daughters Darcy 6, and Pearl, newborn). Hit the subscribe button to never miss a video again! \n\nI try to upload every Wednesday 5pm and Sunday 9am!\n\nI chat every day on my other social media (linked above) so do come and say hi! \n\nBig hugs, \n\nLouise xxx\n\n* Links with a * are affiliate links. This means I may receive a revenue from clicks and purchases on these links. It does not cost you anything and if you feel uncomfortable using the links you can always open a new tab and google it yourself, no pressure xxx"
