id,video_id,trending_date,title,channel_title,category_id,publish_time,tags,views,likes,dislikes,comment_count,thumbnail_link,comments_disabled,ratings_disabled,video_error_or_removed,description
15866,jm_mZqqL40M,2018-02-03,83. You + Me,Will Darbyshire,1,2018-01-28 18:53:29+00:00,"willdarbyshire|""film""|""will darbyshire""|""william darbyshire""|""Brussels""|""Belgium""",108986,13269,78,429,https://i.ytimg.com/vi/jm_mZqqL40M/default.jpg,False,False,False,"With thanks to the Brussels Tourism Board, \nGo visit guys, it was lovely.\n\nMusic by the wonderful Flatsound:\nhttps://www.flatsound.org\n\nFind me here:\nhttp://twitter.com/willdarbyshire\nhttp://willdarbyshire.tumblr.com\nhttp://instagram.com/willdarbyshire"
15863,kKk6vEqFFOA,2018-02-03,BLACK PANTHER Movie Clip Killmonger Vs T'Challa + Trailer NEW (2018) Superhero Movie HD,MovieAccessTrailers,24,2018-01-30 05:15:52+00:00,"black panther trailer|""black panther""|""trailer""|""2018""|""new""|""new trailer""|""official""|""official trailer""|""hd trailer""|""superhero""|""movie""|""film""|""hd""",84253,975,128,391,https://i.ytimg.com/vi/kKk6vEqFFOA/default.jpg,False,False,False,"BLACK PANTHER Movie Clip Killmonger Vs T'Challa + Trailer NEW (2018) Superhero Movie HD\n\nSubscribe To MovieAccessTrailers To Catch Up All The New Movie Trailer, Movie Clips, TV Spots & Trailer Compilation Just For You. Subscribe Now and Turn The Notification On To Never Miss Any Official 2018 Movie Trailer From Us."
15880,lfIhBu0TZBs,2018-02-03,Moving on from Beme,CaseyNeistat,22,2018-01-25 14:58:16+00:00,[none],2571601,77025,7721,7662,https://i.ytimg.com/vi/lfIhBu0TZBs/default.jpg,False,False,False,this is hard for me.  i rerecorded this video a dozen times.  there is a lot to say.  this is a huge chapter in my life coming to a close.  please give Matt's blog post a read.  He says it better than i ever could. https://medium.com/@mhkt/d275c15ff702
15852,li6f_0x0IGE,2018-02-03,Meet My BABY GIRL! | Fleur De Force,Fleur DeForce,26,2018-01-28 17:00:07+00:00,"fleurdeforce|""fleur de force""|""fleurdevlog""|""fleur de vlog""|""baby""|""name""|""reveal""|""baby name reveal""|""meet my baby""|""fleur de force baby""|""mother""|""parent""|""post partum""|""pregnancy""|""mum vlogger""|""baby girl""|""baby name""",657043,41794,693,7226,https://i.ytimg.com/vi/li6f_0x0IGE/default.jpg,False,False,False,"Im so excited for you guys to meet my little girl ❤️ Thanks so much for all your lovely comments and your support during my pregnancy and over the past few weeks of being a new mum ❤️ EXPAND this little box for more info, links etc xo \n \nALSO Find Me Here…\nVLOG Channel: http://www.youtube.com/fleurdevlog \nTwitter: @fleurdeforce\nBlog: http://www.fleurdeforce.com\nInstagram: @FleurDeForce\nFacebook: https://www.facebook.com/fleurdeforce\n\nMy eyelash range for Eylure: http://po.st/VoQGZG\nMy BROW range for Eylure: http://bit.ly/2n9HBk7\nOrder my BOOK here: http://bit.ly/FDFTheLuxeLife\nMY MAKEUP LINE! http://www.feelunique.com/brands/fleu...\n\nOTHER VIDEOS YOU MIGHT LIKE\nNursery Tour: https://www.youtube.com/watch?v=yI2k6OKsSVw \nProduct Empties: https://www.youtube.com/watch?v=J4DKqWlk8DE \nWhat’s In My Hospital Bag: https://www.youtube.com/watch?v=MLfDK7Ot3x4 \n\nThis video is not sponsored. All proceeds from the views on this video will be donated charity. The funds will be split equally between Tommy’s (in aid of research into stillbirth, miscarriage and premature birth - https://www.tommys.org) and the Stand Up Foundation (an anti-bullying charity - http://www.standupfoundation-uk.org)"
15857,lpzJNwur6Zk,2018-02-03,SUZY (수지) 'HOLIDAY (Feat. DPR LIVE)' M/V,jypentertainment,10,2018-01-29 09:00:04+00:00,"JYP Entertainment|""JYP""",2047442,106054,2608,6962,https://i.ytimg.com/vi/lpzJNwur6Zk/default.jpg,False,False,False,SUZY (수지) 'HOLIDAY (Feat. DPR LIVE)' M/V\n\n1.29 MON 6PM HOLIDAY (Feat. DPR LIVE) : https://melon.do/IkaJIbs2J\n1.22 MON 6PM 다른사람을 사랑하고 있어 : https://melon.do/ybJQM96sJ\n\nSuzy Official Twitter: https://twitter.com/jypesuzy\nSuzy Official Facebook: http://www.facebook.com/JYPESuzy\nSuzy Official Fan's: http://fans.jype.com/Suzy\nSuzy Official Homepage: http://suzy.jype.com\nJYPnation Official Twitter: http://www.twitter.com/jypnation\n\nCopyrights 2018 ⓒ JYP Entertainment. All Rights Reserved.
15947,m0HN1TB-Jcw,2018-02-03,THERAPY Q&A: UNDERSTANDING TRAUMA & EATING ISSUES | GRACE,Grace F Victory,22,2018-01-24 08:16:31+00:00,"grace|""victory""|""gracie francesca""|""mixed race beauty fashion guru""|""plus size""|""curly hair""|""therapy""|""q&a""|""eating disorder""|""trauma""|""mental health""",11300,606,19,105,https://i.ytimg.com/vi/m0HN1TB-Jcw/default.jpg,False,False,False,"Buy my book - http://amzn.to/2nRy6tn\n\nI answer your Instagram questions about therapy. Enjoy x\n\n🎥 LAST VIDEO\n- - - - - - - - - - - - - - - - - - - - \nhttps://www.youtube.com/watch?v=OJoR1qElA0Q&t=1138s\n\n📷 NEWEST POST\n- - - - - - - - - - - - - - - - - - - - \nhttp://www.graciefrancesca.com/2018/01/pitch-brands-collaborations.html\n\n📝 OTHER LINKS MENTIONED\n- - - - - - - - - - - - - - - - - - - - \nThe Recover Clinic @RecoverClinic\ntherecoverclinic.co.uk\nhttp://www.therecoverclinic.co.uk/category/blog/\nBeat @BeatED\nbeateatingdisorders.co.uk\nhttps://www.nhs.uk/conditions/eating-disorders/\nhttps://www.mind.org.uk\n\n🎥 FILMING EQUIPMENT\n- - - - - - - - - - - - - - - - - - - - \nMain Videos Camera - http://bit.ly/29btOXL\nLens - http://bit.ly/1FTCg56\nVlogging Camera - http://bit.ly/2c4jiRG\nLighting - Ring Light http://fave.co/1KOW3bZ\nEditing - FCPX 10\n\n💜 FOLLOW ME\n- - - - - - - - - - - - - - - - - - - - \n💻 BLOG: www.graciefrancesca.com\n🐤 TWITTER: gracefvictory\n📷 INSTAGRAM: gracefvictory\n\n🌍 CONTACT\n- - - - - - - - - - - - - - - - - - - - \n💌 SPONSORSHIP & COLLABS: james@freefocus.co.uk\n💌 OTHER BUSINESS: enquiries@graciefrancesca.com\n\n🙈 DISCLAIMER\n- - - - - - - - - - - - - - - - - - - - \nAll opinions and views are my own. As of August 2013 all items that have been sent to me for an interest in a review, as a gift, or with discount specifically for me only will be marked with an asterix (*) This video is not sponsored. Some of the above links may be affiliate links and if they are, I will earn a small amount of commission when something is purchased through them. This is a great way to support me as so that I can make more fashion content for you on here & my blog. If you're not comfortable with that, then its cool babes."
15986,mA4NVRV1FGU,2018-02-03,"Plastic Surgery, Transgender History & MORE with Amanda Lepore | Gigi",Gigi Gorgeous,26,2018-01-22 10:39:13+00:00,"gigi|""gigigorgeous""|""gregory""|""gorgeous""|""gregorygorgeous""|""beauty""|""fashion""|""guru""|""Amanda Lepore""|""David LaChapelle""|""nightlife""|""gay""|""transgender history""|""paris is burning""|""plastic surgery""|""transformation""|""botched""|""trans""|""gigi and amanda""|""heatherette""|""the blonds""|""living legend""|""inspirational""|""positivity""",258380,8899,612,836,https://i.ytimg.com/vi/mA4NVRV1FGU/default.jpg,False,False,False,"I am sooo happy Amanda and I found the time to sit down recently when I was in New York City so we could have a drink (obvi Marilyn Monroe inspired: champagne mixed with a splash of vodka hehe) to discuss everything from our crazy club experiences, transgender history, the progression of the LGBTQ+ community over the years, our thoughts on plastic surgery, body image, confidence & SO MUCH MORE! I hope you enjoy getting to know her as much as I did and still do… She truly has a heart of gold and has such a pure, kind soul.\n\nDear Amanda,\nI can’t thank you enough for changing my life and opening my eyes to things I would have never seen before. Making me think outside of the box and helping me to block the haters out and to just BE. Realizing the truth within myself at such an early age was honestly inspired by your strength and I can’t thank you enough. You've helped me to see the world in a much more unique and beautiful way, even though we are constantly surrounded by negativity and hate, it’s a trailblazer like you, Amanda, that brings light through the darkness. XO\n\nALSO! GET AMANDA’S MERCH HERE!!!!!\nhttps://www.dragqueenmerch.com/collections/amanda-lepore\n\n----------------------------------------­----------------------------------------­-------\n\n‪Follow me on Twitter!‬\n‪http://www.twitter.com/thegigigorgeous\n\n‪INSTAGRAM‬\n‪http://instagram.com/gigigorgeous\n\n‪Friend me on Facebook!‬\n‪http://www.facebook.com/gigigorgeous"
15979,mTKCKBu8CLI,2018-02-03,The Fall - Repetition,Kill All Hippies!,10,2011-02-18 00:54:52+00:00,"The|""Fall""",62012,536,10,51,https://i.ytimg.com/vi/mTKCKBu8CLI/default.jpg,False,False,False,Bingo-Master's Break-Out! [EP] 1978
15874,mXfyOYAdCUc,2018-02-03,WHAT AM I?,KickThePj,1,2018-01-27 22:03:43+00:00,"kickthepj|""pjthekick""|""robot""|""short film""|""short story""|""story""|""steampunk""",79970,16566,74,1573,https://i.ytimg.com/vi/mXfyOYAdCUc/default.jpg,False,False,False,"the story of a confused robot whose primary purpose has lead it to feel something.\nsupport the patreon! https://patreon.com/kickthePJ\ntwitter! http://twitter.com/kickthepj \ninstagram! http://instagram.com/kickthepj\n\nmusic by http://disasterpeace.com/\n\nmy shop! buy sum stuff! http://kickthepjshop.com/\nside channel! http://youtube.com/pjthekick\n\ntumblr! http://kickthepj.tumblr.com\nfacebook, yo! http://facebook.com/kickthepj\n\nother places to get my music! \nhttp://kickthepj.bandcamp.com\nhttps://itunes.apple.com/gb/album/stories-from-somewhere/id471198058"
15861,nIPt7dJrSXw,2018-02-03,HOW TO FIND THE PERFECT SUIT,Jim Chapman,26,2018-01-28 19:00:04+00:00,"jim chapman|""vlog""|""fun""|""funny""|""british""|""youtuber""|""vlogger""|""United Kingdom (Country)""|""Video Blog (Website Category)""|""jim""|""chapman""|""daily""|""main channel""|""main""|""channel""|""daily vlog""|""fashion""|""style""|""men""|""baking""",20276,1595,25,102,https://i.ytimg.com/vi/nIPt7dJrSXw/default.jpg,False,False,False,HOW TO FIND THE PERFECT SUIT\nLINK TO BUY MY BOOK: http://amzn.to/2oGqw1I\n\n•Please leave me a comment and give a thumbs up. It means a lot\n•SUBSCRIBE http://bit.ly/1kV3htg\n\n•WEBSITE http://jimchapman.co.uk\n•TWITTER https://twitter.com/jimchapman\n•INSTAGRAM https://instagram.com/JimChapman\n•SNAPCHAT JimChapman\n•FACEBOOK http://facebook.com/OfficialJimChapman\n\n•ADDRESS\nGleam Futures\n6th Floor\n60 Charlotte Street\nLondon W1T 2NU\n\n•BUSINESS ENQUIRIES millie@gleamfutures.com
15952,nQ7mhC5_Rys,2018-02-03,Altwork 1 Minute Video,altwork,28,2017-01-21 00:12:02+00:00,[none],58215,0,0,0,https://i.ytimg.com/vi/nQ7mhC5_Rys/default.jpg,True,True,False,
15960,nrB7aqfRzyE,2018-02-03,Eagles Fan Gets Wrecked by Pole,494ta,1,2018-01-22 07:23:29+00:00,[none],650790,817,39,148,https://i.ytimg.com/vi/nrB7aqfRzyE/default.jpg,False,False,False,"ORIGINAL POST! I shot this video. \n\nEagles fan runs into pole.\nWhat a hit. Someone invite that pillar to training camp. \n\nEagles game on 1/21/18.\n\n* Jukin Media Verified *\nFind this video and others like it by visiting https://www.jukinmedia.com/licensing/view/982532\nFor licensing / permission to use, please email licensing(at)jukinmedia(dot)com."
15917,oEtEBOy0ys8,2018-02-03,THINGS WE ALL DID IN BRITISH SECONDARY SCHOOL,Luke Birch,24,2018-01-25 20:41:17+00:00,"British Secondary School|""Things we all did in Secondary School""|""Things we all did in British Secondary School""|""Things we all did in High School""|""Things everyone does in Secondary School""|""Secondary School""|""British secondary school exposed""|""Secondary School memories""|""Day In The Life British Secondary School""|""British vs American High School""|""Types of British Secondary Schools""|""British school fights""|""Things that happen in British schools""|""British public vs Private school""",118280,10333,119,2178,https://i.ytimg.com/vi/oEtEBOy0ys8/default.jpg,False,False,False,A few relatable things that we all do in British Secondary School/British High School... \n• All My Social Media Links •\nTWITTER: https://twitter.com/LukeBirch_   \nINSTAGRAM: http://instagram.com/lukebirch_\nSNAPCHAT: lukebirch.26 \nFACEBOOK: https://www.facebook.com/TheLukeBirch\n\nBusiness Enquires: thelukebirch@outlook.com  \n------------------------------------------------------------------------------------------------\nWatch my short film 'The Not Bucket List' here: https://www.youtube.com/watch?v=GY1Gcv7wRig&t=501s\n\nCOMING OUT TO MY PARENTS: https://www.youtube.com/watch?v=jlv7O6AYNJM\n\nDAY IN THE LIFE OF A UNIVERSITY STUDENT: https://www.youtube.com/watch?v=K8wsBcYvu1E&t=28s \n\nMY COMING OUT STORY: https://www.youtube.com/watch?v=x2kX8mbxwj4&t=766s\n\nPACIFIC SUN by Nicolai Heidlas Music https://soundcloud.com/nicolai-heidlas\nCreative Commons — Attribution 3.0 Unported— CC BY 3.0 \nhttp://creativecommons.org/licenses/b...\nMusic promoted by Audio Library https://youtu.be/kbqmEJTr3nU
15881,oWjxSkJpxFU,2018-02-03,Suicide: Be Here Tomorrow.,Logan Paul Vlogs,29,2018-01-24 18:30:01+00:00,"logan paul vlog|""logan paul""|""logan""|""paul""|""logan paul youtube""|""logan paul suicide""|""suicide prevention awareness""|""suicide prevention""|""5 steps""|""suicide hotline""|""suicide lifeline""|""national""|""kevin hines""|""golden gate bridge""|""survival""|""be here tomorrow""",25434829,2025470,519137,679564,https://i.ytimg.com/vi/oWjxSkJpxFU/default.jpg,False,False,False,"National Suicide Prevention Lifeline\nCall 1-800-273-8255\nCrisis Textline, Free 24/7 Support: Text 741741\n\nLearn how you can #BeThe1To save a life. Help someone in crisis at:\nhttp://bit.ly/2FbwLU6\n\nSpecial Thanks to Kevin Hines. Learn about his story: http://bit.ly/2GevTiw\nFollow Kevin on IG: http://bit.ly/2F6oLUb\nFollow Kevin on Twitter: http://bit.ly/2n6UJt0\nCheck out his movie “Suicide: The Ripple Effect”: http://bit.ly/2n8DOW9\n17th and Montgomery Productions: http://bit.ly/2Dv7fZf\n\nSpecial Thanks to Bob Forrest:\nLearn about Alo House Recovery Centers: http://bit.ly/2n94ZA3\nLearn more about Bob: http://bit.ly/2DIAjzZ\n\nSpecial Thanks to Dr. John Draper:\nLearn more about the Suicide Prevention Lifeline: http://bit.ly/2Braxe9\n\nSpencer Taylor:\nhttps://www.instagram.com/vybesource/"
15959,p5HH2UfZ2wE,2018-02-03,DOG TRIES TO WAKE UP SLEEPING PIG,Newsflare,15,2018-01-23 17:11:43+00:00,"WAKE UP SLEEPING PIG|""SLEEPING PIG""|""DOG TRIES TO WAKE UP""|""wake up dog""|""dog wakes up pig""|""home in California""|""pig""|""lazy pig""|""lazy pet pig""|""most hilarious friendship ever""|""hilarious friendship""|""dog""|""sleeping""|""sleepy""|""lazy""|""friends""|""animal""|""friendship""|""pet""|""newsflare""|""news""|""dog and pig friends""|""waking up""|""alarm""",723192,16318,195,1226,https://i.ytimg.com/vi/p5HH2UfZ2wE/default.jpg,False,False,False,"This dog tries to wake up a sleeping pig but the lazy pet pig doesn't want to get up, in hilarious footage captured at a home in California.\n\nThe is the most hilarious friendship ever, and the dog is extremely keen to wake up its buddy so they can play outside.  \n\nSubscribe: http://bit.ly/newsflare\nAnimals rule the internet. From derp cats to crazy doggos, this is your home for magical and downright hilarious pet moments caught on camera.\n\nWith amazing videos being uploaded daily, make Newsflare your home for the latest and greatest viral news content. \n\nWe bring contributors together from all over the world and tell their stories to a global audience. \n\nFrom OMG moments to hilarious happenings, our channel shows what is lighting up the planet right now.\n\nGot a video to share? Submit your video here: http://bit.ly/NewsflareSubmit\nLIKE us on FACEBOOK: http://bit.ly/NewsflareFB\nFOLLOW us on TWITTER: http://bit.ly/NewsflareTwitter"
15844,p5N6tFob_Rw,2018-02-03,MY SKIN STORY,ThatcherJoe,23,2018-01-28 18:00:10+00:00,"new|""thatcherjoe""|""joe sugg""|""vlog""|""2018""|""Skin""|""Acne""|""Medication""|""Roaccutane""|""Spots""|""Treatment""|""Treat""|""Doctor""|""Medicine""|""Before""|""After""|""Hormones""|""Teenage""|""Skincare""",1353947,85895,575,4729,https://i.ytimg.com/vi/p5N6tFob_Rw/default.jpg,False,False,False,►Bit of a switch up on the ol' content this week everyone.. I've decided to talk a bit about my skin story and hopefully it will help some of you who may be affected by acne. Also.. I've realised from this that I'm not the best speaker/storyteller so apologies for saying UMM so often.. \n►MORE INFO ON ACNE: https://www.nhs.uk/conditions/Acne/\n►KATIE SNOOKS' CHANNEL: https://www.youtube.com/user/snooksy\n►CAROLINE HIRON'S CHANNEL: https://www.youtube.com/channel/UCyzKg_t3tPv8Aa_7JL2xXZA\n►MORE INFO ON ROACCUTANE: https://beta.nhs.uk/medicines/isotretinoin-capsules/\n\n►GET YOUR SUGG LIFE MERCH HERE! - https://www.sugglife.com\n►GRAB A COPY OF MY NEW BOOK USERNAME:UPRISING!\n►http://usernameuprising.hodder.co.uk/\n►Subscribe to me (click on the subscribe button IT'S FREE!)
15945,p9zTSvEpt_8,2018-02-03,Bill is Dead The Fall,georgegargan,10,2007-06-25 06:50:45+00:00,"the|""fall""|""Bill""|""is""|""dead""|""snub""|""tv""",98417,609,12,136,https://i.ytimg.com/vi/p9zTSvEpt_8/default.jpg,False,False,False,Bill Is Dead from Snub Tv by the mighty Fall
15810,pj6k-EFxqAI,2018-02-03,"Hailee Steinfeld, BloodPop® - Capital Letters",FiftyShadesVEVO,10,2018-01-31 17:00:04+00:00,"Hailee|""Steinfeld""|""BloodPop®""|""Capital""|""Letters""|""Republic/Universal/FSF""|""Soundtrack""|""Hailee Steinfeld Fifty Shades Freed""|""Hailee Steinfeld new song""|""Bloodpop Fifty Shades Freed""|""Bloodpop new song""|""Fifty Shades Freed songs""|""Fifty Shades Soundtrack""|""Fifty Shades movie""",2681106,127971,1312,4523,https://i.ytimg.com/vi/pj6k-EFxqAI/default.jpg,False,False,False,"Capital Letters (Official Video)\nSong available on the Fifty Shades Freed Original Motion Picture Soundtrack\nhttps://FiftyShadesFreed.lnk.to/ForYouYD  \n \nFifty Shades Freed, in theaters February 9.\nWatch the trailer, and book tickets now: http://unvrs.al/FSFTix\n \nDirected by Hannah Lux Davis\nProduced by Andrew Lerios\nExecutive Produced by Luga Podesta & Brandon Bonfiglio\nFor London Alley Entertainment\n \nFollow Hailee Steinfeld\nInstagram - http://instagram.com/haileesteinfeld\nTwitter - http://twitter.com/haileesteinfeld\nFacebook - http://www.facebook.com/haileesteinfeld\n \nFollow BloodPop®:\nWebsite - http://bloodpop.com  \nSpotify - http://smarturl.it/BloodPop_Spotify  \nFacebook - http://smarturl.it/BloodPop_Facebook  \nTwitter - http://smarturl.it/BloodPop_Twitter  \nInstagram - http://smarturl.it/BloodPop_Instagram  \nSoundcloud - http://smarturl.it/BloodPop_Soundcloud\n \nMusic video by Hailee Steinfeld & Bloodpop® performing Capital Letters. © 2018 Universal Studios\n\nhttp://vevo.ly/9A3EuD"
15875,pjTj-_55WZ8,2018-02-03,"Rudimental - These Days feat. Jess Glynne, Macklemore & Dan Caplen [Official Video]",Rudimental,10,2018-01-25 12:00:16+00:00,"rudimental|""rudimentaluk""|""official video""|""cover""|""session""|""live""|""remix""|""feel the love""|""bloodstream""|""waiting all night""|""sun comes up""|""ed sheeran""|""james arthur""|""we the generation""|""these days""|""macklemore""|""jess glynne""|""dan caplen""|""ella eyre""|""anne-marie""|""annie mac""|""bbc radio 1""",6146346,117526,1684,1890,https://i.ytimg.com/vi/pjTj-_55WZ8/default.jpg,False,False,False,"Download or stream now at: https://atlanti.cr/thesedays\n\nThis is the official video for our new single These Days featuring Jess Glynne, Macklemore and Dan Caplen - out now everywhere!\n\nClick here to subscribe: http://bit.ly/SubscribeToRudimental\n\nFollow Rudimental\nhttp://www.rudimental.co.uk \nhttp://www.facebook.com/rudimentaluk \nhttp://www.twitter.com/rudimentaluk \nhttp://www.instagram.com/rudimentaluk\nhttp://www.soundcloud.com/rudimentaluk\n\nFollow Jess Glynne\nhttp://jessglynne.co.uk\nhttps://www.facebook.com/JessGlynne\nhttps://twitter.com/jessglynne\nhttps://www.instagram.com/jessglynne\n\nFollow Dan Caplen\nhttp://dancaplen.com\nhttps://www.facebook.com/dancaplen\nhttps://twitter.com/dancaplen\nhttps://www.instagram.com/dancaplen\n\nFollow Macklemore\nhttp://macklemore.com\nhttps://www.facebook.com/macklemore\nhttps://twitter.com/macklemore\nhttps://www.instagram.com/macklemore\n\nDirector | Johnny Valencia\nExecutive Producer | Honna Kimmerer\nProducer | Shabana Mansuri\nProduction Designer | John Lavin\nCinematographer | Justin Henning\nEditor | Jason Koenig & Johnny Valencia\nVideo Commissioner | Dan Curwin\n\nLYRICS:\nI know you moved onto someone new\nHope life is beautiful\nYou were the light for me to find my truth\nI just wanna say, thank you\n\nLeaving to find my soul\nTold her I had to go\nAnd I know it ain't pretty\nWhen our hearts get broke\nToo young to feel this old\nWatching us both turn cold\nOh, I know it ain't pretty\nWhen two hearts get broke\nYeah, I know it ain't pretty\nWhen two hearts get broke\n\nI hope someday\nWe'll sit down together\nAnd laugh with each other\nAbout these days, these days\nAll our troubles\nWe'll lay to rest\nAnd we'll wish we could come back to these days\nThese days\nThese days, these days\nThese days, these days\n \nThree years of ups and downs\nNothing to show for it now\nAnd I know it ain't pretty when the fire burns out\nCalling me when I'm drunk remind me of what I've done\nAnd I know it ain't pretty when you're trying to move on, yeah\n\nI hope someday\nWe'll sit down together\nAnd laugh with each other\nAbout these days, these days\nAll our troubles\nWe'll lay to rest\nAnd we'll wish we could come back to these days, these days\n\nOh I know, I know\nOh I know, I know\nOh I know, I know\nThese days, these days\nOh I know, I know\nOh I know, I know\nOh I know, I know\nTo these days, these days\n \nCigarettes in the ashtray\nReminiscing on those past days\nI thought you’d end up with my last name\nBut that changed\nAnd I travelled around the world\nThink where you living at now?\nI heard you moved to Austin\nGot an apartment and settled down\nAnd every once in a while\nI start texting\nWrite a paragraph\nBut then I delete the message\nThink 'bout you like a past time\nI could cry you a river\nGet you baptised or\nI wasn't ready to act right\nUsed to always think I'd get you back, right\nThey say that things fall apart\nWe were gonna move to Brooklyn\nYou were gonna study Art\nLove is just a tool\nTo remind us who we are\nAnd that we are not alone\nAnd we're walking in the dark\n \nI hope someday\nWe'll sit down together\nAnd laugh with each other\nAbout these days, these days\nAll our troubles\nWe'll lay to rest\nAnd we'll wish we could come back to these days, these days\nWe'll wish we could come back to these days, these days"
15869,pvxIoue1Qpw,2018-02-03,Henry Cavill Channels His Inner Superman Against Tom Cruise | The Graham Norton Show,The Graham Norton Show,24,2018-01-26 19:33:08+00:00,"Graham Norton|""Graham Norton Show Official""|""Entertainment""|""Chat Show""|""graham norton watch online""|""graham norton full episodes""|""graham norton clips""|""watch the graham norton show""|""graham norton 2017""|""graham norton new""|""Tom cruise""|""Henry Cavill""|""Rebecca Ferguson""|""mission impossible""|""Simon Pegg""|""Star Wars""",804768,7584,333,542,https://i.ytimg.com/vi/pvxIoue1Qpw/default.jpg,False,False,False,Henry Cavill has a phenomenal moustache right now.\nSubscribe for weekly updates: http://www.youtube.com/subscription_center?add_user=officialgrahamnorton
