id,video_id,trending_date,title,channel_title,category_id,publish_time,tags,views,likes,dislikes,comment_count,thumbnail_link,comments_disabled,ratings_disabled,video_error_or_removed,description
8447,ZvdPvq4dX78,2017-12-26,Sports Journalist Bomani Jones (Extended Cut),Desus & Mero,24,2017-12-21 05:30:01+00:00,"Desus & Mero|""Desus""|""Desus Nice""|""Mero""|""The Kid Mero""|""VICELAND""|""VICE""|""Late Night""|""Talk Show""|""Late Night Talk Show""|""Action Bronson""|""Eddie Huang""|""Bodega Boys""|""podcast""|""Bodega Boys podcast""|""Comedy""|""Funny""|""Humor""|""TV""|""television""|""TV show""|""sports""|""politics""|""music""|""hip hop""|""the Bronx""|""Bodega Hive""|""The Brand is Strong""|""The Art""|""BX""|""first class""|""flying""|""coach""|""Bomani Jones""|""nigeria""|""africa""|""espn""|""Pablo Torre""|""miami""",60810,962,41,86,https://i.ytimg.com/vi/ZvdPvq4dX78/default.jpg,False,False,False,"We talk to returning guest Bomani Jones about leaving the Miami warmth, not going back to coach, his friendship and new show with Pablo Torre, and living in Nigeria.\n\nWATCH NEXT: The Cussing Pastor - http://bit.ly/2kPa1k2\n\nSubscribe Now: http://bit.ly/2dvkxK0\n\nFollow Desus & Mero:\n\nVICELAND.com | https://www.viceland.com\nFacebook | https://www.facebook.com/desusandmero\nTwitter | https://twitter.com/desusandmero\nInstagram | https://www.instagram.com/desusandmero"
8538,a7NJ6Gek9v4,2017-12-26,ALL TIME GREATEST AIRPLANE SEAT - Emirates First Class Suite,CaseyNeistat,22,2017-12-11 23:45:03+00:00,Emirates first class,7451886,292747,8094,14799,https://i.ytimg.com/vi/a7NJ6Gek9v4/default.jpg,False,False,False,MY DOPE MERCH - https://shopcaseyneistat.com/\n\nMusic mixed by http://youtube.com/dyalla \nfilmed this video in 4k on this -- http://amzn.to/2sTDnRZ\nwith this lens -- http://amzn.to/2rUJOmD\nbig drone - http://tinyurl.com/h4ft3oy\nOTHER GEAR ---  http://amzn.to/2o3GLX5\nSony CAMERA http://amzn.to/2nOBmnv\nOLD CAMERA; http://amzn.to/2o2cQBT\nMAIN LENS; http://amzn.to/2od5gBJ\nBIG SONY CAMERA; http://amzn.to/2nrdJRO\nBIG Canon CAMERA; http://tinyurl.com/jn4q4vz\nBENDY TRIPOD THING; http://tinyurl.com/gw3ylz2\nYOU NEED THIS FOR THE BENDY TRIPOD; http://tinyurl.com/j8mzzua\nWIDE LENS; http://tinyurl.com/jkfcm8t\nMORE EXPENSIVE WIDE LENS; http://tinyurl.com/zrdgtou\nSMALL CAMERA; http://tinyurl.com/hrrzhor\nMICROPHONE; http://tinyurl.com/zefm4jy\nOTHER MICROPHONE; http://tinyurl.com/jxgpj86\nOLD DRONE (cheaper but still great);http://tinyurl.com/zcfmnmd\n\nfollow me; on http://instagram.com/caseyneistat\non https://www.facebook.com/cneistat\non https://twitter.com/CaseyNeistat
8453,aP0izmLk-Q8,2017-12-26,Ellen Is in Justin Bieber’s 'Mistletoe',TheEllenShow,24,2017-12-19 14:00:00+00:00,"ellen|""ellen degeneres""|""the ellen show""|""ellen fans""|""ellen tickets""|""ellentube""|""ellen audience""|""justin bieber""|""justin""|""bieber""|""mistletoe""|""beliber""|""funny""|""music video""|""christmas""|""holidays""|""holiday""|""songs""|""song""|""spoof""|""esmms""|""show me more""|""show me more show""|""show""|""me""|""more""",490615,22479,309,706,https://i.ytimg.com/vi/aP0izmLk-Q8/default.jpg,False,False,False,Guess who snuck into Justin Bieber’s music video?
8593,aj8mN_7Apcw,2017-12-26,Alita: Battle Angel | Official Trailer [HD] | 20th Century FOX,20th Century Fox,1,2017-12-08 19:30:09+00:00,"Trailer|""alita""|""battle angel""|""alita: battle angel""|""james cameron""|""Robert Rodriguez""|""Avatar""|""Sin City""|""Rosa Salazar""|""Christoph Waltz""|""Keean Johnson""|""Jon Landau""|""Yukito Kishiro""|""manga""|""Michelle Rodriguez""|""Jackie Earle Haley""|""Eiza González""|""Mahershala Ali""|""Ed Skrein""|""Casper Van Dien""|""Jeff Fahey""",6686262,57972,8015,12712,https://i.ytimg.com/vi/aj8mN_7Apcw/default.jpg,False,False,False,"From visionary filmmakers James Cameron and Robert Rodriguez. \n#Alita Battle Angel is in theaters July 20, 2018.\n\nDirected by: Robert Rodriguez\n\nScreenplay by: James Cameron and Laeta Kalogridis and Robert Rodriguez\n\nBased on the Graphic Novel (Manga) Series: Gunnm By Yukito Kishiro\n\nProduced by: James Cameron and Jon Landau\n\nCast: Rosa Salazar, Christoph Waltz, Jennifer Connelly, Mahershala Ali, Ed Skrein, Jackie Earle Haley, Keean Johnson\n\nSUBSCRIBE: http://bit.ly/FOXSubscribe\n\nConnect with Alita: Battle Angel Online:\nVisit the Official Site Here: http://AlitaBattleAngel.com\nLike Alita: Battle Angel on FACEBOOK: http://facebook.com/AlitaMovie\nFollow Alita: Battle Angel on TWITTER: http://twitter.com/AlitaMovie\nFollow Alita: Battle Angel on INSTAGRAM: http://instagram.com/AlitaMovie\n\n#Alita\n\nAbout 20th Century FOX:\nOfficial YouTube Channel for 20th Century Fox Movies. Home of Avatar, Aliens, X-Men, Die Hard, Deadpool, Ice Age, Alvin and the Chipmunks, Rio, Peanuts, Maze Runner, Planet of the Apes, Wolverine and many more.\n\nConnect with 20th Century FOX Online:\nVisit the 20th Century FOX WEBSITE: http://bit.ly/FOXMovie\nLike 20th Century FOX on FACEBOOK: http://bit.ly/FOXFacebook\nFollow 20th Century FOX on TWITTER: http://bit.ly/TwitterFOX\n\nAlita: Battle Angel | Official Trailer [HD] | 20th Century FOX\nhttp://www.youtube.com/user/FoxMovies"
8419,alRtHXnZMOI,2017-12-26,The Ginger Ed Man,Spotify,10,2017-12-20 17:02:12+00:00,"spotify|""free""|""music""|""ed sheeran""|""ed""|""sheeran""|""teddy""|""teddys photos""|""gingerbread""|""cookies""|""cute""|""funny""|""comedy""|""holidays""|""happy holidays""|""christmas""",108639,3348,155,217,https://i.ytimg.com/vi/alRtHXnZMOI/default.jpg,False,False,False,"Congratulations to Ed Sheeran, the most-streamed artist of 2017. Listen to all the year's top hits at http://spotify.com/2017"
8414,ao7JzzfIqVE,2017-12-26,My Conversation With Theorist Shane Dawson,Bobby Burns,24,2017-12-20 20:14:49+00:00,"film|""movie""|""review""|""bobby""|""burns""|""teenage""|""funny""|""comedy""|""2016""|""youtube""|""My Conversation With Shane Dawson""|""youtuber""|""talking""|""nathan burns""|""shane dawson""|""theory""|""vlogger""|""2017""",1622790,120165,2797,12211,https://i.ytimg.com/vi/ao7JzzfIqVE/default.jpg,False,False,False,New Merch Here: https://www.thebobbyburns.com/\nNathan's Video: https://www.youtube.com/watch?v=cInfbT_uWDA&t=54s\nShane's Video: https://www.youtube.com/watch?v=fcQ-dUkXNFM\nSUPPORT THIS CHANNEL ON PATREON:  https://www.patreon.com/BobbyBurns\nTWITTER: https://twitter.com/thebobbyburns\nINSTAGRAM: http://instagram.com/thebobbyburns\nBusiness Inquires Contact: bobbyburnscontact@gmail.com
8483,bUMWiiOlee4,2017-12-26,[몬채널][S] 몬스타엑스(MONSTA X) - 그놈의 크리스마스 (Lonely Christmas),MONSTA X,10,2017-12-18 09:00:02+00:00,"MONSTAX|""MX""|""MONSTA X""|""MONSTA""|""LONELY CHRISTMAS""|""MERRY CHRISTMAS""|""CHRISTMAS""|""MONBEBE""|""CHMX""|""MV""|""SPECIAL CLIP""|""SHOWNU""|""WONHO""|""MINHYUK""|""KIHYUN""|""HYUNGWON""|""JOOHEON""|""IM""|""몬스타엑스""|""몬엑""|""몬베베""|""시즌송""|""그놈의크리스마스""|""그놈의 크리스마스""|""크리스마스""|""캐롤""|""셔누""|""원호""|""민혁""|""기현""|""형원""|""주헌""|""아이엠""|""창균""|""뮤비""|""뮤직비디오""|""스페셜클립""|""녹음실""|""메이킹""",331120,46699,69,2490,https://i.ytimg.com/vi/bUMWiiOlee4/default.jpg,False,False,False,iTunes Download ▶https://itunes.apple.com/us/album/그놈의-크리스마스-lonely-christmas-single/1326744105\n\n▶More information\n\nMONSTA X Official Fan cafe : http://cafe.daum.net/monsta-x\nMONSTA X Official Twitter : http://www.twitter.com/OfficialMonstaX\nMONSTA X Official Facebook : http://www.facebook.com/OfficialMonstaX\nMONSTA X Official Weibo : http://www.weibo.com/monstax
8394,bi1wcqsFoCs,2017-12-26,"CHRISTMAS Rewind 2017 ft. Jake Paul, Taylor Swift Despacito Bruno Mars Katy Perry",Screen Team,24,2017-12-24 16:03:21+00:00,"Christmas Parody|""Christmas Medley""|""Christmas Songs""|""Funny Christmas Songs""|""Christmas Songs for Kids""|""Christmas songs 2017""|""Jake Paul song""|""Jake Paul Christmas""|""Taylor Swift Parody""|""Feel It Still Parody""|""That's What I Like Parody""|""Ready For It Parody""|""Swish Swish Parody""|""Havana parody""|""camila cabello""|""Be Humble Parody""|""Young Dumb & broke parody""|""Strip that down parody""|""Despacito Christmas""|""Despacito Parody""|""Rockstar Parody""|""Post Malone Parody""|""I'm the One Parody""",130181,6937,1532,1022,https://i.ytimg.com/vi/bi1wcqsFoCs/default.jpg,False,False,False,"ALL MONEY FROM ADS ON THIS VIDEO WILL BE DONATED TO CHARITY!\nSUBSCRIBE► http://bit.ly/ScreenTeam \nPlaylist of ALL the Christmas Medleys: https://goo.gl/iEiTdH\nDownload the Christmas parody►► https://goo.gl/WByAVh\nIts our annual Christmas Rewind Medley! Featuring Taylor Swift, Jake Paul, Camila Cabello, Despacito, Katy Perry, & MORE! \nThank you guys for making our 2017 awesome!\nMay you all have a happy holiday season & a happy new year :)\n\nSong List\nFeel It Still by Portugal, The Man\nReady For It by Taylor Swift\nThat's What I Like by Bruno Mars\nSwish Swish by Katy Perry\nHumble by Kendrick Lamar\nEveryday Bro by Jake Paul\nRockstar by Post Malone\nHavana by Camila Cabello\nLook What You Made Me Do by Taylor Swift\nYoung Dumb & Broke, by Khalid\nStrip That Down by Liam Payne\nThe One by DJ Khalid w/ Justin Bieber\nDespacito by Luis Fonsi\nSomething Just Like This by The Chainsmokers\n\nIf you like our video, Hulk Smash the Like Button!\n \nFacebook: https://www.facebook.com/TheScreenTeam\nTwitter: http://twitter.com/TheScreenTeam\niTunes: http://goo.gl/1FWSih\nInstagram: http://www.instagram.com/imangiegriffin\n\nWrite us! \nScreen Team\nPO Box 21791\nBakersfield, CA 93390\n\nFeel It Still\nHappy Holidays to myself\nPull the reindeer out, put up the Elf on the Shelf\nTime to hang up all my lights and the wreath\nAnd i’m decorating the tree\nHoooo ooooo getting ready for this Christmas\n\nAre You Ready For It\nAre you ready for it?\nJingle Bells. Jingle Bells. \nBaby, let Christmas begin. Let Christmas begin. Let Christmas begin. \nBaby, let Christmas begin. Let Christmas begin. Let Christmas begin. \n\nThat’s What I Like\nWhat’chu want this Christmas?\nPresents for the children\nCandy canes and ribbons\nSomething for the Misses\nI got it if you want it, got, got it if you want it. \nLeave some milk and cookies, just, leave some milk and cookies. \nJump in the Sleigh again. \nFlying through the skies on it.\nAll around the world. \nRudolph put some miles on it. \nYou deserve it, baby, you deserve it all. \nAnd i’m gonna bring it to you. \nNew toys so shiny and bright. \nHow ‘bout a playset with lights?\nLucky for me, that’s what you like. That’s what you like. \nLucky for me, that’s what you like. That’s what you like. \n\n\n\nSwish Swish\nThis Christmas. Another gift in the stocking\nThis Christmas. Another gift for unboxing\nThey know what they want. \nBut they don’t know what they got. \nThey know what they want. \nBut they don’t know what they got\nHow ‘bout socks? \n\nBe Humble\nNo getting paid from me\nJust get away from me\nPaaaaaaaid (yeah, yeah)\nAy, i will pay you seven cents and you get no allowances\nThis season is for consumers and beggars, you get none of this\n99 percent don’t matter, take it for the business\nAnd have a Merry Christmas, tell ‘em \nBah Humbug \nSit down\nBah Humbug\nSit down\n\n\n\nHavana\nDear Santa, falala\nI want some Gucci and some Prada, na na na\nI’ll take some Dolce and Gabana \nA trip down to Havana\nDear Santa, falala\n\nLook What You Made Me Do\nOoooh, you got me a cork screw\nYou got me some cashews\nYou got me, oh look what you got me\nIt’s a brand new broom. (BROOM!)\nYou got me some gym shoes\nYou got me some shampoo\nYou got me, oh look what you got me\nIt’s a new kazoo….\n\n\n\n\n\n\n\n\n\n\n\n\n\n\n\nJake Paul Everyday Bro\nBlah Blah Blah\n\n\nRockstar\nDasher, Dancer, Prancer, Vixen\nFlyin’ like a Reindeer\nComet, Cupid, Donner, Blitzen\nFlyin’ like a Reindeer\nFog came in, they couldn’t see and they all failed Santa\nRudolph came along to guide the sleigh on to your roof toooop. \n\nYoung Dumb & Broke \nNo gift. No gift, i’m broke\nNo gift. No gift, i’m broke\nNo gift. No gift, i’m broke\nDumb, broke, ain’t got no gifts. \nFa la la la la la la la\nFa la la la la la\nFa la la la la la la la\nDumb, broke ain’t got no gifts. \n\n\nI’m The One\nEvery night we’ll light a candle on the Menorah, now\nHanukkah yeah. Hanukkah. \nEverybody gather ‘round, and we’ll dance the hora\nHanukkah yeah. Hanukkah. \nYeah, 8 days full of peace and celebration\nTaking part in the Feast of Dedication\nGather ‘round it’s time to spin the dreidel\nHanukkah yeah.\n\n\nStrip That Down\nYou know i love it when the tree is fresh \nCome and chop that down for me. Baby. \nIt’s getting colder, i can see my breath.\nBut only you can chop for me. \nSo put your hands on the handle \nAnd swing that axe for me. Baby. \nYou know i love it when it’s nice and tall, \nCome on let’s chop down the tree.\nYeah yeah yeah yeah\nChop that down, girl\nLook out when it hits that ground girl. \nYeah yeah yeah yeah\nChop that down, girl\nLook out when it hits that ground\n\nDespacito\nLet it…. Snow\nOh the weather outside is frightful\nBut the fire is so delightful\nAnd since we have no place to goooo \nLet It Snow. \nThe fire is slowly dying.\nAnd my dear we’re still goodbying.\nBut as long as you love me sooooo. \nLet It Snow. \n\n\n\nSomething Just Like This\nWhere we wanna go?\nWe can’t go on like this\nWe have to come together if we really wanna to live. \nWell, these people say no. \nAnd these people say yes. \nThere has to be a maybe, so we can co-exist\nCome together for Christmas"
8440,bwi9BNyKTcU,2017-12-26,"The New Day vs. Rusev & Aiden English: SmackDown LIVE, Dec. 19, 2017",WWE,17,2017-12-20 03:54:37+00:00,"wwe|""world wrestling entertainment""|""wrestling""|""wrestler""|""wrestle""|""superstars""|""कुश्ती""|""पहलवान""|""डब्लू डब्लू ई""|""मैच""|""सुपरस्टार""|""व्यावसायिक कुश्ती""|""مصارعه""|""SmackDown LIVE""|""Kofi Kingston""|""Xavier Woods""|""Big E""|""Rusev""|""Aiden English""|""New Day""|""sp:ty=high""|""sp:st=wrestling""|""sp:scp=athlete_in_match""|""sp:dt=2017-12-19T20:00:00-04:00""|""sp:ev=wwe-smack""|""sp:ath=wwe-rusev""|""sp:ath=wwe-aien""|""sp:ath=wwe-xawo""|""sp:ath=wwe-koki""|""sp:ath=wwe-bige""|""day""|""smackdown""|""wwe smackdown""|""wwe smackdown live""|""the new day""",546144,10075,723,681,https://i.ytimg.com/vi/bwi9BNyKTcU/default.jpg,False,False,False,The New Day look to end the Rusev Day festivities early and get back to their Christmas celebration.\nGet your first month of WWE Network for FREE: http://wwenetwork.com\nSubscribe to WWE on YouTube: http://bit.ly/1i64OdT\nVisit WWE.com: http://goo.gl/akf0J4\nMust-See WWE videos on YouTube: https://goo.gl/QmhBof
8562,c84hT_DseRg,2017-12-26,Shy Glizzy - Take Me Away [Official Video],Glizzy Gang,10,2017-12-12 15:50:42+00:00,"shy glizzy|""take me away""|""tm88""|""rap""|""hip hop""|""300""|""300 entertainment""|""glizzy gang""|""glizzy""|""lyric video""|""lyric""|""take""|""me""|""away""|""music""|""music video""|""take me away lyric video""|""The Tonight Show""|""Jimmy Fallon""|""GoldLink""|""Brent Faiyaz""|""Crew""|""NBC""|""NBC TV""|""Television""|""Funny""|""Talk Show""|""comedic""|""snl""|""Fallon Stand-up""|""Fallon monologue""|""tonight""|""show""|""funny video""|""interview""|""talent""|""celebrities""|""video""|""the roots""|""D'Anthony Carlos""|""The God Complex""|""rapper""|""jefe""|""young jefe""",804571,12478,411,0,https://i.ytimg.com/vi/c84hT_DseRg/default.jpg,True,False,False,Shy Glizzy - Take Me Away (Prod by TM88)\nDownload & Stream Quiet Storm http://flyt.it/ShyGlizzyQuietStorm\n\n►Spotify: http://flyt.it/ShyGlizzyTakeMeAwaySp\n►iTunes: http://flyt.it/ShyGlizzyTakeMeAwayiT\n►Apple Music: http://flyt.it/ShyGlizzyTakeMeAwayAp\n►Google Play Music: http://flyt.it/ShyGlizzyTakeMeAwayGpm\n►Amazon Music: http://flyt.it/ShyGlizzyTakeMeAwayAMU\n►Soundcloud: http://flyt.it/ShyGlizzyTakeMeAwaySC\n►YouTube:\n--\n►Instagram: https://www.instagram.com/jefe/\n►Twitter: https://twitter.com/ShyGlizzy\n►Facebook: https://www.facebook.com/JefeOfficial/\n►Subscribe On YouTube: https://www.youtube.com/user/GlizzyGangTV/featured\n►Follow On Spotify: https://open.spotify.com/artist/1DvtabXAjfrMihPP6JQdHs
8488,cL5oCP0VIEI,2017-12-26,Top 10 Reasons Why The Last Jedi Made Me ANGRY!,AngryJoeShow,20,2017-12-16 19:47:53+00:00,"angryjoe|""angryjoeshow""|""angry rant""|""rant""|""spoilers""|""discussion""|""top reasons""|""the last jedi""|""star wars""|""disney""|""luke skywalker""|""kylo ren""|""rey""|""the last jedi sucks""",1461755,60930,12245,28592,https://i.ytimg.com/vi/cL5oCP0VIEI/default.jpg,False,False,False,"While I did enjoy The Last Jedi overall I wanted to organize all the problems the film had into one list to help explain why this is one of the most divisive Star Wars Films yet. \nIts not about its new direction, we are on board for that, just because this film makes some Bold New Choices doesnt excuse it from how they treated older legendary characters, dropped certain plot points, wasted time with a terrible subplot and finally created a few plot holes along the way!\n\nFull List of Reasons Featured in Video:\n1. The Death of Luke\n2. Luke’s Legacy & Behavior\n3. The Death of Snoke\n4. Finn & Rose’s Subplot\n5. Rey’s Parents are Nobody\n6. Death & Return of Leia\n7. Death of Phasma\n8. Humor & Tone Issues\n9. Dropped Force Awakens Subplots\n10. Plot Holes\n11. First Order Fleet Chases instead of Destroys\n12. Vice Admiral Holdo Sucks\n13. A Single X-Wing can Destroy a Dreadnought\n14. Why didnt Kylo notice Luke Projection\n15. Knights of Ren Dropped\n16. Kylo Ren & Vader Relationship Dropped\n17. Rey Perfect Saber Techniques with No Training\n18. Snoke doesnt know his ship can track the enemy?\n19. Yoda looks weird! (and can control lighting?)\n20. Rey happens to be at correct spot to save everyone and lifts all rocks with no training.\n21. Why was Finn hurt if it has no ramifications?\n22. Rose Falling in Love with Finn was Stupid!\n\nClips from Force Awakens & one of the Better Star Wars Channels: \nStar Wars Theory: https://www.youtube.com/watch?v=94ZZQEjgIss"
8400,cMD63TwzB1o,2017-12-26,SZA - The Weekend (Official Video),SZAVEVO,10,2017-12-22 05:00:01+00:00,"R&B|""SZA""|""The Weekend""|""Top Dawg Entertainment/RCA Records""",2990740,116055,14346,17287,https://i.ytimg.com/vi/cMD63TwzB1o/default.jpg,False,False,False,SZA's CTRL available on:\nApple Music - http://smarturl.it/iCTRL\nSpotify - http://smarturl.it/sCTRL\nSoundcloud - http://smarturl.it/scCTRL\nTidal - http://smarturl.it/tCTRL\nAmazon Music - http://smarturl.it/aCTRL\nGoogle Play - http://smarturl.it/gCTRL\n\nFollow SZA:\nhttp://szactrl.com\nhttp://instagram.com/sza\nhttp://twitter.com/sza\nhttp://facebook.com/sza\n\nhttp://vevo.ly/aw0jSv
8444,cntsqw7XOF0,2017-12-26,Dashboard Confessional: We Fight [OFFICIAL VIDEO],Fueled By Ramen,10,2017-12-20 15:00:35+00:00,"Dashboard Confessional|""Dashboard""|""Chris Carrabba""|""Chris Caraba""|""Chris Carraba""|""Dashboard Music""|""Dashbaord Band""|""New Dashboard Confessional Song""|""New Song""|""new single""|""We Fight""|""Crooked Shadows""|""We Fight Song""|""official video""|""We fight our way in""|""we fight our way out""|""Fueled By Ramen""|""FBR""|""DC""|""New FBR signing""|""fueled by""|""dashboard signs with FBR""|""New Dashboard Record""|""New Dashboard Confessional""|""New Dashboard Album""|""New Dashboard Confessional Album""|""New dashboard track""|""emo""",125497,6427,283,462,https://i.ytimg.com/vi/cntsqw7XOF0/default.jpg,False,False,False,"Dashboard Confessional's official music video for their single 'We Fight' from their upcoming album Crooked Shadows - available February 9, 2018 via Fueled By Ramen. http://smarturl.it/WeFight\n\nStream/Download 'We Fight' now on:\n\nSpotify: http://smarturl.it/WeFight_sp\nApple Music: http://smarturl.it/WeFight_am\nAmazon: http://smarturl.it/WeFight_az\niTunes: http://smarturl.it/WeFight_it\nGoogle Play: http://smarturl.it/WeFight_gp\n\nConnect with Dashboard Confessional on:\nFacebook: http://www.facebook.com/dashboardconfessional\nTwitter: https://twitter.com/dashboardmusic\nInstagram: https://www.instagram.com/dashboardconfessional\nYouTube: https://www.youtube.com/dashboardconfessional \n\nDirected By: David Mack\nArt & Animation Editor, Animator: Zu Orzu\nInvisible Friend Production House\n\nLYRICS\n\nWe were the kids\nThat left home\nProlly too young\n \nBut we took our share\nAnd maybe then some\n \nTired of beatings\nAnd battles\nAnd being sewn up\n \nBut that made us grow up\nAnd that made em scared\n \nCause\nWe never learned to keep our voices down\nNo\nWe only learned to shout\nSo\nWe fight our way in\nAnd\nWe fight our way out\n \nAnd\nWe earned what we could\nFrom the ground up\nAnd tried to lift the whole damn crowd\nUp\nSo we fight our way in\nAnd\nWe fight our way out\n \nAnd there's still a kid\nSomewhere\nThat needs to hear this\n \nThat somebody cares\nThat somebody knows\n \nWho's\ntired of bleeding\nAnd battered\nAnd being torn up\n \nJust pick yourself up\nIt's time to go\n \nCause\nWe never learned to keep our voices down\nNo\nWe only learned to shout\nSo\nWe fight our way in\nAnd\nWe fight our way out\n \nAnd\nWe earned what we could\nFrom the ground up\nAnd tried to lift the whole damn crowd\nUp\nWe fight our way in\nAnd\nWe fight our way out\n \nMaybe we found a way to make some tracks.\nWe didn't snicker and turn our backs.\nWe just keep digging in and giving back.\n \nCause\nWe never learned to keep our voices down\nNo\nWe only learned to shout\nSo\nWe fight our way in\nAnd\nWe fight our way out\n \nAnd\nWe earned what we could\nFrom the ground up\nAnd tried to lift the whole damn crowd\nUp\nWe fought our way in\nAnd\nWe fight our way out\n \nCause\nWe never learned to keep our voices down\nNo\nWe only learned to shout\nSo\nWe fight our way in\nAnd\nWe fight our way out\n \nWe fight our way in\nWe fight our way in\n \nWe fight our way out\nWe fight our way out"
8457,d5w7iCkHvaU,2017-12-26,Darya Folsom and caller LAUGH! at diddy move to buy Panthers..( He look like he just smoke a blunt),Peter Parker Tube,22,2017-12-18 20:57:53+00:00,"diddy|""panthers""|""steph curry""|""buy panthers""|""nfl""|""new station""|""remarks""|""he looks high""|""2017""|""December 18""|""everyday struggle""|""breakfast club""|""matter""|""bad remarks""",53089,35,80,46,https://i.ytimg.com/vi/d5w7iCkHvaU/default.jpg,False,False,False,"December 18, 2017"
8408,dCROpIx2s0g,2017-12-26,Reggaeggs,Sunset Television,23,2010-05-19 19:55:06+00:00,"reggaeggs|""sunset television""|""reggae""|""eggs""|""cinebeasts""|""vintage""|""breakfast""|""commercial""",70430,877,30,110,https://i.ytimg.com/vi/dCROpIx2s0g/default.jpg,False,False,False,An irie island breakfast.\n\nfrom Sunset Television Episode 5: Tropical\nmore at http://www.sunsettelevision.com
8495,dGaX8AuGiuk,2017-12-26,"ECS CS:GO S4 Finals Day 2: Group Finals, Lower Bracket",FACEIT,20,2017-12-17 06:57:33+00:00,"FACEIT|""CSGO""|""Counter-Strike:""|""Global""|""Offensive""|""ddk""|""bardolph""|""ecs""|""esports""|""cs:go""|""gaming""|""competitive""|""mlg""|""esl""|""gfinity""|""dreamhack""|""eleague""|""e-sports""|""video-games""|""sports""|""pro-gamer""|""pro""|""player""|""awp""|""league""",785276,7502,2166,53,https://i.ytimg.com/vi/dGaX8AuGiuk/default.jpg,False,False,False,ECS Season 4 Finals: Cancun (timestamps)\n\nLuminosity vs Mousesports - Train 1:07:08\nLuminosity vs Mousesports - Nuke 2:14:23\nCloud9 vs Liquid - Mirage 3:32:32\nCloud9 vs Liquid - Inferno 4:43:59\nOptic vs Mousesports - Nuke 6:26:02\nOptic vs Mousesports - Train 7:19:36\nFaZe vs Cloud9 - Mirage 8:52:42\nFaZe vs Cloud9 - Overpass 9:47:01\n\nBrought to you by https://www.faceit.com\n\nTo get your FACEIT LOOT\n1. Go to http://gaming.youtube.com/faceit\n2. Click the orange 'GET LOOT' button \n3. Sign in to link your FACEIT account\n4. Watch ECS and be in for a chance to win FACEIT points!\nNeed Help? - https://support.faceit.com/hc/en-us/articles/115001852390-ECS-drops-on-YouTube-Gaming\n\nDon't forget to subscribe and to ring the bell to be notified when we go live or post fresh video.\n\nFollow us on Twitter: Twitter.com/faceit\nECS S4 Details: http://www.csgoleague.com\nECS Merchandise: http://shop.csgoleague.com
8503,dRvKm__GrqU,2017-12-26,EVERY DAY Official Trailer (2018),Orion Pictures,1,2017-12-14 20:00:23+00:00,"romantic comedy|""comedy""|""romance""|""lgbtq""|""teen drama""|""drama""|""book""|""adaptation""|""every day book""|""david levithan""|""debby ryan""|""angourie rice""|""justice smith""|""owen teague""|""mgm""|""orion pictures""|""everything everything""|""if i stay""|""before i fall""|""me before you""|""the vow""",2508936,8667,899,1338,https://i.ytimg.com/vi/dRvKm__GrqU/default.jpg,False,False,False,"This February, love has no limits. Based on the best-selling novel, watch the official trailer for EVERY DAY, in theaters Feb 23. #EveryDayMovie"
