id,video_id,trending_date,title,channel_title,category_id,publish_time,tags,views,likes,dislikes,comment_count,thumbnail_link,comments_disabled,ratings_disabled,video_error_or_removed,description
8498,INHVfx05Sy8,2017-12-26,Will Smith on His Competitive Friend Michael Jordan,Jimmy Kimmel Live,24,2017-12-15 10:00:01+00:00,"jimmy|""kimmel""|""live""|""late""|""night""|""talk""|""show""|""funny""|""comedic""|""comedy""|""clip""|""comedian""|""will""|""smith""|""michael""|""jordan""|""chicago""|""bulls""|""basketball""|""tiger""|""woods""|""golf""|""friendship""|""competition""|""will smith""|""michael jordan""|""tiger woods""",751415,7403,150,266,https://i.ytimg.com/vi/INHVfx05Sy8/default.jpg,False,False,False,"Will talks about an old photo that he took with Michael Jordan, describes what their friendship is like and reveals that Michael is extremely competitive even when he's not playing sports.\n\nJimmy Kimmel Interviews Rose Parade Hosts Cord & Tish https://youtu.be/xWeZbHUNmUI\n \nSUBSCRIBE to get the latest #KIMMEL: http://bit.ly/JKLSubscribe\n \nWatch Mean Tweets: http://bit.ly/KimmelMT10\n \nConnect with Jimmy Kimmel Live Online:\n \nVisit the Jimmy Kimmel Live WEBSITE: http://bit.ly/JKLWebsite\nLike Jimmy Kimmel on FACEBOOK: http://bit.ly/KimmelFB\nLike Jimmy Kimmel Live on FACEBOOK: http://bit.ly/JKLFacebook\nFollow @JimmyKimmel on TWITTER: http://bit.ly/KimmelTW\nFollow Jimmy Kimmel Live on TWITTER: http://bit.ly/JKLTwitter\nFollow Jimmy Kimmel Live on INSTAGRAM: http://bit.ly/JKLInstagram\n \nAbout Jimmy Kimmel Live:\n \nJimmy Kimmel serves as host and executive producer of Emmy-winning Jimmy Kimmel Live, ABC's late-night talk show.\n\nJimmy Kimmel Live is well known for its huge viral video successes with 5.6 billion views on YouTube alone.\nSome of Kimmel's most popular comedy bits include - Mean Tweets, Lie Witness News, Jimmy's Twerk Fail Prank, Unnecessary Censorship, YouTube Challenge, The Baby Bachelor, Movie: The Movie, Handsome Men's Club, Jimmy Kimmel Lie Detective and music videos like I (Wanna) Channing All Over Your Tatum and a Blurred Lines parody with Robin Thicke, Pharrell, Jimmy and his security guard Guillermo.\nNow in its fifteenth season, Kimmel's guests have included: Johnny Depp, Meryl Streep, Tom Cruise, Halle Berry, Harrison Ford, Jennifer Aniston, Will Ferrell, Katy Perry, Tom Hanks, Scarlett Johansson, Channing Tatum, George Clooney, Larry David, Charlize Theron, Mark Wahlberg, Kobe Bryant, Steve Carell, Hugh Jackman, Kristen Wiig, Jeff Bridges, Jennifer Garner, Ryan Gosling, Bryan Cranston, Jamie Foxx, Amy Poehler, Ben Affleck, Robert Downey Jr., Jake Gyllenhaal, Oprah, and unfortunately Matt Damon.\n\nWill Smith on His Competitive Friend Michael Jordan\nhttps://youtu.be/INHVfx05Sy8"
8450,INRXOIgmNUU,2017-12-26,A Festive Effortless Chat with TimH - COLLABMAS DAY 10!,Daniel J. Layton,22,2017-12-20 19:49:41+00:00,"vlog|""vlogger""|""comedy""|""christmas""|""vlogmas""",24042,2206,9,63,https://i.ytimg.com/vi/INRXOIgmNUU/default.jpg,False,False,False,The ghost of Christmas Past and I talk all things festive.\n\nFOLLOW ME from a safe distance and preferably not in person:\nTWITTER: http://twitter.com/DanielJLayton\nFACEBOOK: http://facebook.com/DJLActor\nTUMBLR: http://danieljlayton.tumblr.com\nINSTAGRAM: http://instagram.com/danieljlayton\n\nMusic by EpidemicSound.
8403,ItL6vcUrpUs,2017-12-26,MACKLEMORE FEAT DAVE B & TRAVIS THOMPSON - CORNER STORE (Official Music Video),Macklemore LLC,10,2017-12-21 17:00:20+00:00,"Mackelmore|""Thrift Shop""|""Cant Hold Us""|""Can't Hold Us""|""Same Love""|""Seattle""|""Downtown""|""Macklemore Downtown""|""Macklemore & Ryan Lewis""|""Ryan Lewis""|""White Walls""|""Glorious""|""Music Video""|""Marmalade""|""marmelade""|""Lil Yachty""|""Yachty""|""Yahcty""|""Lil' Yachty""|""Lil Boat""|""The Heist""|""Heist""|""Hiest""|""Unruly Mess""|""Dance Off""|""Kesha""|""tik tok""|""offset""|""skylar""|""Ed Sheeran""|""Taylor Swift""|""G-Eazy""|""Logic""",2050620,89151,2271,3720,https://i.ytimg.com/vi/ItL6vcUrpUs/default.jpg,False,False,False,"GEMINI - AVAILABLE NOW\nhttp://smarturl.it/MacklemoreGemini\n\nDIRECTED BY - Johnny LeFlare\n\nWRITTEN BY\nBen Haggerty & Johnny LeFlare\n\nCINEMATOGRAPHY BY  \nMitchell Overton \n\nSTARRING \nMacklemore \nDave B\nTravis Thompson\n\nPRODUCED BY\nHonna Kimmerer\n\nEDITED BY\nMitchell Overton, Johnny LeFlare, Ben Haggerty\n\nASSISTANT EDITOR \nPhil Harvey \n\n1st ASSISTANT DIRECTOR \nPaul Dahlke\n\nHAIR & MAKEUP \nJennifer Popochock\nShawn Shelton\nLuce Cousineau\n\nSTYLIST\nTherese Lefebvre\n\nFEATURING \nIsaac Sims Porter \nRiley O’Donnell\n\nPRODUCTION MANAGER\nNicola Kirkpatrick \n\nART DEPT \nKarl LeFevre\nDarcey Zoller \n\nCAMERA DEPT \nDP - Mitchell Overton - \nSteadicam - Chris Duerkopp\n1st AC - Coty James \n2nd AC - Kyle Petitjean\nTecho Crane - Ryan Haug / Sam Nuttman - Motion State\n\nGRIP & ELECTRIC \nVince Klimek\nMichael LePard\nShaun Bowlby\nChris Taranto\nMark Bueing\n\nSTUNT \nStunt Double - Bryan Riggins \nCoordinator - Tyson Cecka \n\nCOLOR  \nBryan Smaller - Company 3\n\nAUDIO \nSteve Becktold\n\nSOUND DESIGN\nJohn Buroker - HEARby\n\nPRODUCTION ASSISTANTS \nAntone Patterson\nLiam Cheskov-Dahlke \nKeaton Kinnaman \nCameron Sage\nJake Magraw \n\nPLAYBACK\nTyler Dopps\n\nCRAFTY \nJustina Renoud\nScott Schoening\n\nMOHO\nDave Nugent\nBobbi Gerlick\n\nEXTRAS \nMyles Gouveia, Dane Hilts, Gadisa Margarsa, Francesco Anichini, Dulce Montalvo\nChole Landrieu Murphy, Sterling Pearl, Manuel Perez, Kiana Kim Wyld, Jacob Allen\n\nSPECIAL THANKS TO: Roger & Anne Kinnaman, Warsame, Shelton Harris, Tricia Davis, Ben Secord, Jim Mosey, Roy Merca, Kristina Rodgers, Debbie Crofts, Ron Leamon, Taylor Durand-Skaggs, Chris Swenson, City of Seattle Office of Film & Music, Seattle Police Department, Seattle Parks Dept, Sam & Summit Public House, Go 4 Nuge, Motion State, Koerner Camera, Jongchul Kim, Joshua Kim, Nigel Beauty, Mario Castro, Nannette Buroker, and Grady Chapman.\n\nMacklemore Managed by Zach Quillen & Josh Dick\n\nCORNER STORE SONG CREDITS\n\nMacklemore \nCorner Store feat. Dave B & Travis Thompson\n\nPerformed by Macklemore, Dave B and Travis Thompson\nCo-Produced by Tyler “Damn Dude” Dopps, Jake One and Sam Wish\n\nWritten by: B. Haggerty; D. Bowman; T. Thompson; J. Dutton; T. Dopps; J. Karp\n\nLyrics by Ben Haggerty, David Bowman and Travis Thompson \nSynth by Jake One\nDrum Programming by Tyler “Damn Dude” Dopps\nBass Programming by Tyler “Damn Dude” Dopps\nHorns by Joshua Karp\nAdditional vocals by Tyler Andrews\n\nMixed by Jon Castelli at The Gift Shop, DTLA\nMastered by Dale Becker\nMastering Assistant – Mandy Adams\nEngineered by Tyler Dopps \nEngineer for Mix Ingmar Carlson \n\nBengal Yucky (BMI) \nDavid Bowman (BMI) \nTravis Thompson (BMI) \nJacob Dutton (ASCAP) / Momo Elena Music (ASCAP) / Warner Chappell \nTyler Matthews Dopps (BMI) \nGutterfunk (ASCAP) \nSamuel Benjamin Wishkoski (ASCAP) / Swish You Were Here Music (ASCAP)\n\n© 2017 Bendo, LLC. All rights reserved."
8480,J4DKqWlk8DE,2017-12-26,PRODUCT EMPTIES - December 2017 | Fleur De Force,Fleur DeForce,26,2017-12-17 17:00:02+00:00,"fleurdeforce|""fleur de force""|""fleurdevlog""|""fleur de vlog""|""beauty""|""fashion""|""beauty blogger""|""empties""|""product empties""|""products ive used""|""used products""|""finished products""|""skincare""|""makeup""|""make up""|""haircare""|""body""|""de force""|""fleur""",101781,3038,87,144,https://i.ytimg.com/vi/J4DKqWlk8DE/default.jpg,False,False,False,"I haven’t done a product empties video in AGES! These are some of the things I’ve finished up recently! EXPAND this little box for more info, links etc xo \n\nPRODUCTS FEATURED: \nBatiste Dry Shampoo & Conditioner: http://bit.ly/2B72Ldu \nDrybar Triple Sec: http://bit.ly/2BXftbp \nDrybar Detangler: http://bit.ly/2BY89fV \nMane N Tale Hair Strengthener: http://bit.ly/2iTZtzw \nMorrocan Oil: http://bit.ly/2ANJGu9 \nOribe Dry Texturizing Spray: http://bit.ly/2BVVnyc \nRituals Shanti Shower Gel: http://bit.ly/2ANKZcx \nKiehls Oil Body Cleanser: http://bit.ly/2AOD52D \nSoaper Duper Body Wash: http://bit.ly/2mVMOAX \nCostes Shower Gel: http://bit.ly/2BVZIkY \nPalmers Cocoa Butter for Stretch marks: http://bit.ly/2AicJ8p \nAerin Tangier Vanille: http://bit.ly/2Bj0uMg \nSarah Chapman Skinesis: http://bit.ly/2yXlTcc  \nChanel Gel Touch Foundation: http://bit.ly/2Bgro7C \nCharlotte Tilbury Eyeliner: http://bit.ly/2BYd8gD \nGuerlain Eyeliner: http://bit.ly/2BZM7cx \nYSL Mascara: http://bit.ly/2BXamId \nTom Ford Mascara: http://bit.ly/2BX3quO \n \nALSO Find Me Here…\nVLOG Channel: http://www.youtube.com/fleurdevlog \nTwitter: @fleurdeforce\nBlog: http://www.fleurdeforce.com\nInstagram: @FleurDeForce\nFacebook: https://www.facebook.com/fleurdeforce\n\nMy eyelash range for Eylure: http://po.st/VoQGZG\nMy BROW range for Eylure: http://bit.ly/2n9HBk7\nOrder my BOOK here: http://bit.ly/FDFTheLuxeLife\nMY MAKEUP LINE! http://www.feelunique.com/brands/fleu...\n\nOTHER VIDEOS YOU MIGHT LIKE:\nGifts For HIM: https://www.youtube.com/watch?v=Djxjmq9pvrM&t=25s \nGifts for HER: https://www.youtube.com/watch?v=6epjkX1sr2M&t=244s \nStocking Filler Gifts: https://www.youtube.com/watch?v=AuTBFhgSvCg&t=25s \n\nThis video is not sponsored but some links may be affiliate links."
8452,JRAOdRq-1lw,2017-12-26,HOSTILES ON THE HILL — A Bad Lip Reading of The Empire Strikes Back,Bad Lip Reading,23,2017-12-18 15:44:42+00:00,"star wars|""last jedi""|""bad lip reading""|""lip sync""|""lip dub""|""comedy""|""song""|""music""|""luke rap""|""snowspeeder""|""hoth""",1629040,63584,1314,4700,https://i.ytimg.com/vi/JRAOdRq-1lw/default.jpg,False,False,False,"An extended version of Luke's snowspeeder rap, originally seen here: https://youtu.be/UkiI2vM2lfA Brought to you by GEICO\nFollow on Twitter! http://twitter.com/badlipreading\nFollow on Instagram: @badlipreading\nLike on Facebook! http://www.facebook.com/badlipreading"
8568,KKwmGuQaMfo,2017-12-26,EPIC DIY Gingerbread House for Cats!,Cole and Marmalade,15,2017-12-12 18:48:24+00:00,"Cole and Marmalade|""Cats""|""Cat Videos""|""Funny""|""Gingerbread House""|""DIY""|""How To""|""Cat crafts""|""Crafting""|""Hacks""|""Nifty""|""Christmas Tree""|""Christmas""|""Santa Claus""|""Elf""|""meow""|""purring""|""cats vs christmas""|""Catmas""|""Night Before christmas""|""Cute""|""adorable""|""Cat Bubbles""|""Catnip""|""Snow""|""Cat Reaction""|""Presents""|""Epic""|""gingerbread man""",228115,12359,105,1459,https://i.ytimg.com/vi/KKwmGuQaMfo/default.jpg,False,False,False,"Meowy Catmas! … We can no longer have a Christmas tree (Marmalade destroys them) so we have to get creative :)\n\nCole and Marmalade Ugly Christmas Sweater: http://www.uglychristmassweater.com/product/meowy-catmas-cole-marmalade-ugly-christmas-sweater/\n\n*Purrlease be sure to use CAT SAFE materials for the decorations, we used colored paper and plastic Easter eggs for the candy \n\nSUBSCRIBE - https://www.youtube.com/user/chrispoole20?sub_confirmation=1\nSHOP - https://shop.coleandmarmalade.com\n\nFacebook: https://www.facebook.com/ColeandMarmalade\nInstagram: https://instagram.com/coleandmarmalade/\nTwitter: http://twitter.com/coletheblackcat\n\nHave a question? Contacts us at: coleandmarmalade@gmail.com\n\nMusic - My Apology - Epidemic Music\n\nChristmas Rap Kevin MacLeod (incompetech.com)\nLicensed under Creative Commons: By Attribution 3.0 License\nhttp://creativecommons.org/licenses/by/3.0/"
8576,KP0r5LSbWL4,2017-12-26,Charli XCX - Unlock It (feat. Kim Petras and Jay Park)[Official Audio],officialcharlixcx,10,2017-12-11 17:05:38+00:00,"charlie|""charli""|""xcx""|""boys""|""jay park""|""unlock it""|""out of my head""|""kim petras""|""a.g cook""|""pc music""|""k pop""|""pop2""|""pop""|""music""|""mixtape""",353658,16980,272,1613,https://i.ytimg.com/vi/KP0r5LSbWL4/default.jpg,False,False,False,💜POP 2 OUT NOW 💜\nListen: http://atlanti.cr/pop2\n\n►Subscribe to channel: http://goo.gl/D8kLMn\n►Twitter - https://twitter.com/charli_xcx\n►Facebook - https://www.facebook.com/charlixcxmusic\n►Instagram - https://www.instagram.com/charli_xcx/\n►Website: https://xcx.world\n\n►Snapchat: xcxworld
8519,KjHan6D3O3g,2017-12-26,Sam Smith - Have Yourself A Merry Little Christmas in the Live Lounge,BBCRadio1VEVO,10,2017-12-13 18:00:16+00:00,"Sam Smith|""Have Yourself A Merry Little Christmas""|""BBC""|""Radio 1""|""Live Lounge""|""The Thrill Of It All""",380738,6144,366,245,https://i.ytimg.com/vi/KjHan6D3O3g/default.jpg,False,False,False,Sam Smith performs Have Yourself A Merry Little Christmas in the BBC Radio 1 Live Lounge\n\nhttp://vevo.ly/a0opFg
8455,Ku-WC1EaPXI,2017-12-26,BHAD BHABIE - Mama Don't Worry (Still Ain't Dirty) Official Music Video | Danielle Bregoli,Bhad Bhabie,10,2017-12-18 16:33:22+00:00,"danielle bregoli|""cash me ousside""|""cash me outside""|""dr phil""|""how bow dah""|""catch me outside""|""catch me ousside""|""hi bich""|""what you know""|""watch know""|""watch now""|""heaux""|""these heaux""|""these hoes""|""hi bich music video""|""these heaux 2017""|""these hoes 2017""|""music""|""new music""|""hip hop""|""white horse""|""hi bich song""|""hi bitch video""|""new danielle bregoli""|""bhadbhade""|""bhad barbie""|""lyrics""|""broccoli""|""barbie""|""bad barbie""|""bhad bharbie""|""did all this dirt""|""still aint dirty""",6590684,279837,33861,36999,https://i.ytimg.com/vi/Ku-WC1EaPXI/default.jpg,False,False,False,"U know my name , now u know my story. ..i did all this dirt & still aint dirty👩‍👧⏳ STREAM Mama Don't Worry (Still Ain't Dirty) by BHAD BHABIE 🔥now➡🎵  https://lnk.to/MamaDontWorry check the lyrics⬇️⬇️⬇️  | Danielle Bregoli - Song produced by https://www.instagram.com/djchose/\n\n👯‍♀️ I GOT IT music video - https://youtu.be/WlZu4RmD_oU\n👋🏻Hi Bich / Whachu Know music video -  https://youtu.be/1NyMSWqIJDQ \n💵STREAM I Got It ➡️  https://lnk.to/IGotIt\n🚨STREAM Hi Bich ➡️   https://Atlantic.lnk.to/hibich  🖤💀🎤🔥 \n🔥STREAM Whachu Know ➡️  https://Atlantic.lnk.to/whachuknow\n\nSubscribe Perscribe ▶️  http://drop.lk/subscribehoes 🚨 \n\nfollow mee\nMERCH - http://www.Bhaddest.com\nInstagram- https://www.instagram.com/bhadbhabie\nTwitter- https://twitter.com/BhadBhabie\nFacebook- https://www.facebook.com/realbhadbhabie/\nYouTube- http://drop.lk/BhadBhabieYT\nSnapchat- http://drop.lk/BhadBhabieSnap\nSpotify - https://open.spotify.com/artist/7DuTB...\nSoundcloud- https://soundcloud.com/bhadbhabie\n\nLYRICS:\n\nI was out there on the hustle I know \nYou remember me\nNo more sleepin on the floor \nI got some money finally\nMama dont worry,  mama dont worry\nI did all this dirt and still aint dirty\n\nDid all this dirt and still aint dirty\nI came through popped up on the first day\nShe say she love me cause im worthy\nI did all this dirt and still aint dirty\n\n11 years old I was sittin on the block \nYeah my family had a little \nSo I hid it in my sock \nSold them pills like they was skittles \nYeah I always made a lot \nI was always dodgin 12,\nPutting work in off the clock \n\nAlmost got cuffed \nIt was too much \nIt was a lot of drama \nIt was da streets \nThat rais-ing me \nHad to be dad and mama\n\nI was young \nHead strong \nWasn't lettin up \nDisrespectful my demeanor \nDidn’t know who to trust \n\nNow my mama straight \nI Ain't gotta push no weight \nI came from the dirt \nNow I'm living great \nSaid I wasn't gone make it \nLook they hard they hat-ed \nWe never had enough \nAnd now the bank We break it\n( we break it bitch) \n\nDid all this dirt and still aint dirty\nBaby I’m outchea so dont worry\nIm in da field without no jersey\nDid all this dirt and still aint dirty\n\nEscaped the belly of the beast \nWithout a stain on me \nWent from fighting now \nMy fist it got that ring on it \nBoynton Beach out to the hills \nHow far I came from it\nNow the whole world sneaking pictures for the fame of it \nWreckless \nOn that show \nMan that's old news \n120 On the ranch \nOn my own two \nI did that crime\nI beat that case\nKept paying my dues \nI did my time \nI made a way \nAnd now I can't lose"
8442,L9hwGZFPSmw,2017-12-26,Half in the Bag: The Last Last Jedi Review,RedLetterMedia,24,2017-12-19 16:49:33+00:00,"redlettermedia|""red letter media""|""red""|""letter""|""media""|""plinkett""|""half in the bag""|""mike stoklasa""|""jay bauman""|""rich evans""|""star wars""|""last jedi""|""last jedi review""",918306,40128,2128,15288,https://i.ytimg.com/vi/L9hwGZFPSmw/default.jpg,False,False,False,"* we weren't really sponsored by Fandango...\n\nIn this special episode Rich, Mike, and Jay talk about the Last Jedi. A movie that's complex, but subtle. Beautiful, yet awkward, clunky and unfunny. Good, yet very bad.\n\nAlso while discussing the bombing raid on the Dreadnought. Mike talks about a Star Trek Voyager episode coincidentally called Dreadnought. Please comment about that below... if you were cool enough to know that awesome fact!!!"
8520,LFhT6H6pRWg,2017-12-26,PSA from Chairman of the FCC Ajit Pai,Daily Caller,22,2017-12-13 22:52:57+00:00,"thedc|""dc""|""washington dc""|""washington""|""the district of columbia""|""swamp""|""drain the swamp""|""trump""|""ajit pai""|""FCC""|""federal communications commision""|""net neutrality""|""net""|""neutrality""|""news""|""politics""|""commentary""|""meme""|""viral""|""republican""|""democrat""|""cable companies""|""fiber optic""|""free internet""|""free speech""|""media""|""daily caller""|""The Daily Caller""",1300201,10254,248713,32491,https://i.ytimg.com/vi/LFhT6H6pRWg/default.jpg,False,False,False,"Ajit Pai has been at the heart of the net neutrality debate and he would like to take this time to address all of the internet trolls with a PSA.\n\nSubscribe to our channel! https://goo.gl/UGHkXA\n\nWant to see more? visit: https://goo.gl/3gcbEL\n\nDailyCaller.com is a news website that cuts through the liberal bias of the mainstream media and brings you the unadulterated truth. If you want to hear the scoop that they're afraid to utter on the over censored, corporatized cable news, tune into https://www.dailycaller.com\n\nCheck out our twitter: https://goo.gl/fnYe4v\n\nAnd Facebook: https://goo.gl/W5junb\n\nOr follow Instagram: https://goo.gl/mhVr1Y\n\nAnd don't forget to subscribe here: https://goo.gl/sjqhR7"
8566,LHDHdyB0A5o,2017-12-26,「未来のミライ」特報,東宝MOVIEチャンネル,1,2017-12-13 07:30:00+00:00,"東宝|""ゴジラ""|""特撮""|""アニメ""|""細田守""|""未来""|""ミライ""|""バケモノの子""|""おおかみこども""|""おおかみこどもの雨と雪""|""サマーウォーズ""|""時をかける少女""|""映画""",383743,0,0,1,https://i.ytimg.com/vi/LHDHdyB0A5o/default.jpg,False,True,False,公開日：2018年7月20日全国ロードショー\n公式サイト：http://mirai-no-mirai.jp/\n(C)スタジオ地図
8421,LPsRp7uUXUk,2017-12-26,Gender Wars: The Last Snowflake,Sargon of Akkad,25,2017-12-20 19:27:36+00:00,"star wars|""feminism""|""the last jedi""|""tlj""|""sjws""|""social justice""|""progressive""|""race""|""gender""|""sexuality""",522178,35298,3505,13324,https://i.ytimg.com/vi/LPsRp7uUXUk/default.jpg,False,False,False,Spoiler: The Nazis win and this video is full of spoilers. \n\nFollow me on:\n\nMinds: https://www.minds.com/Sargon_of_Akkad\nFacebook: https://www.facebook.com/sargonofakkad100/\nGab: https://gab.ai/Sargonofakkad100\nReddit: https://www.reddit.com/r/SargonofAkkad/\n\nCredits and Sources\n\nIntro by Undoomed: https://www.youtube.com/channel/UCTrecbx23AAYdmFHDkci0aQ\nOutro Music: https://www.youtube.com/watch?v=etDon1LH1vA\n\nSources: https://www.minds.com/blog/view/790298919277596672
8398,LmOPXhFensg,2017-12-26,STAR WARS - Sc. 38  Reimagined (Unofficial short scene) Teaser Trailer,FXitinPost,1,2017-12-22 19:12:09+00:00,"star wars battlefront 2|""darth vader""|""lego star wars""|""starwars""|""star wars battlefront""|""Obi-Wan Kenobi""|""A New Hope""|""Video Copilot""|""Rey""|""Finn""|""Kylo Ren""|""Luke Skywalker""|""Anakin Skywalker""|""Death Star""|""Dark Side""|""Lightsaber""|""Lightsaber duel""|""The Last Jedi""|""Empire Strikes Back""|""Christopher Clements""|""Philip J Silvera""",700133,19336,280,1513,https://i.ytimg.com/vi/LmOPXhFensg/default.jpg,False,False,False,"This is a small teaser for a reimagining of the Vader vs Kenobi fight from A New Hope that I am VFX Supervising.  More to come soon!\n\nFull scene coming in 2018.\n\nFor questions, email me at FXitinPost@gmail.com\n\nDISCLAIMER: This is an unofficial, non-profit\n“REIMAGINED SHORT SCENE”, not intended for commercial use. This was made strictly for Entertainment purposes, as well as VFX & Camera testing. All story, characters, likeness & sound are the property of Walt Disney/LucasFilm’s."
8431,M0X3jVSVzao,2017-12-26,Avicii - You Be Love (Original Video) ft. Billy Raffoul,AviciiOfficialVEVO,10,2017-12-20 14:00:06+00:00,"Avicii|""You""|""Be""|""Love""|""Universal""|""Music""|""Dance""",1165906,59314,1399,2508,https://i.ytimg.com/vi/M0X3jVSVzao/default.jpg,False,False,False,Listen to the EP here: http://avicii.lnk.to/AVICI \n\nAgency: Black Dalmatian Films/OPA PEOPLE\nProduction Company: DIKTATOR\n\nDirector: TNT\n\nProducer: Simon Hernadi\nExecutive Producer: Manga Minja\nVisual Effects Supervisor: Petter Lindholm\nVFX & 3D: Chimney Pot - Los Angeles
8428,MFWF9dU5Zc0,2017-12-26,OCEAN'S 8 - Official 1st Trailer,Warner Bros. Pictures,24,2017-12-19 12:00:02+00:00,"Ocean's 8|""Ocean's 8 Movie""|""Sandra Bullock""|""Cate Blanchett""|""Anne Hathaway""|""Mindy Kaling""|""Sarah Paulson""|""Awkwafina""|""Rihanna""|""Helena Bonham Carter""|""James Corden""|""Gary Ross""|""Summer 2018""|""June 2018""|""Movies""|""Film""|""Comedy""|""Heist""|""Crime""|""Action""|""Warner Bros Pictures""|""Village Roadshow Pictures""|""Warner Bros""|""WB Pictures""|""WB""",9039407,89974,46609,30516,https://i.ytimg.com/vi/MFWF9dU5Zc0/default.jpg,False,False,False,"In theaters June 8th, 2018\n--\nEvery con has its pros. Starring Sandra Bullock, Cate Blanchett, Anne Hathaway, Mindy Kaling, Sarah Paulson, Awkwafina, with Rihanna and Helena Bonham Carter.\n--\nhttp://www.oceans8movie.com\nhttp://facebook.com/oceans8movie\nhttp://twitter.com/oceans8movie\nhttp://instagram.com/oceans8movie"
8583,MVyJZfFH9GI,2017-12-26,The Adventures of Kesha & Macklemore,kesha,10,2017-12-11 15:00:08+00:00,[none],25259,1622,23,142,https://i.ytimg.com/vi/MVyJZfFH9GI/default.jpg,False,False,False,Get in line for the Adventures of Kesha & Macklemore Tour Presale here: tnspk.co/MKZi9WM ⭐🦊🐼⭐
8517,McenDl9NdYE,2017-12-26,Off Camera Secrets | Final Fantasy VII - Boundary Break,Shesez,20,2017-12-15 16:01:37+00:00,"yazoo|""cloud strife""|""lightning""|""halloween""|""shiva""|""steampunk""|""aerith""|""ps1""|""hd""|""remake""|""remastered""|""leviathan""|""cloud ps1""|""glitches""|""informative""|""FF7""|""Final Fantasy 7""|""exvius cloud""",227742,7880,190,868,https://i.ytimg.com/vi/McenDl9NdYE/default.jpg,False,False,False,"A quick informative video about the playstation 1 classic Final Fantasy 7! Also it was a total coincidence that Final Fantasy Brave EXVIUS released Cloud Strife the same day.\n\n\n\nCHRONO TRIGGER EPISODE - https://youtu.be/2Ja3TdujlDg?list=PLYfhW_P-MkU7vBmWwwyqdIWNDzXfEZwnO\n\nEARTHBOUND EPISODE - https://youtu.be/zQOkQbHKjMo?list=PLYfhW_P-MkU7vBmWwwyqdIWNDzXfEZwnO\n\nMARIO RPG EPISODE - https://youtu.be/Q5K--_z5NBg?list=PLYfhW_P-MkU7vBmWwwyqdIWNDzXfEZwnO\n\n\n\nNINTENDO FORCE CONTEST -\n https://gleam.io/competitions/ksGrF-nintendo-force-giveaway\n\n\n\n\nANIMATOR: https://www.youtube.com/user/SorcererLance\n\nTOOL CREATOR: https://www.youtube.com/user/Rockreaper1255\n\nKeep me company on Twitter! We have fun there: https://twitter.com/BoundaryBreak\n\nI dont plug my patreon in the videos because I want to keep the content pure and timeless. However currently I am accepting for support in the early months as i recently quit my day job to push this series as far as it can go. If you visit the patreon page, there is a video that explains my whole story. https://www.patreon.com/BoundaryBreak\n\nFans have made a discord chat room if you guys like that stuff. Heres a link: https://discord.gg/f8mw39s\n\nLogo by rainbowcupcakemonster.com (https://twitter.com/RCM_Art), pixel design by Clay Burton: www.clayburton.ca\nOutro art sourced and repurposed from Startropics, animated by Clay Burton: www.clayburton.ca"
8507,Mdm8rpv045U,2017-12-26,Mark Hamill Hurts,Fundamental Disappointment,24,2017-12-15 21:10:01+00:00,"Luke Skywalker|""Mark Hamill""|""Jar Jar Abrams""|""Star Wars""|""The Last Jedi""|""Episode VIII""|""Hurt""|""Original Trilogy""|""I Hurt Myself Today""|""Disney""|""Bob Iger""|""Kathleen Kennedy""|""JJ Abrams""|""Luke Jedi""|""Luke""|""Fundamentally Disagree""|""TLJ""|""SW""",560438,22051,853,5146,https://i.ytimg.com/vi/Mdm8rpv045U/default.jpg,False,False,False,"Mark Hamill was so invested in the character of Luke Skywalker and the universe of Star Wars. You can see his enthusiasm in the way he speaks. This was more than a job or a paycheck. He signed on for the sequel trilogy only because he believed George Lucas, Harrison Ford, and Carrie Fischer would be with him to continue their characters' stories. \n\nSadly, Disney took Star Wars from George Lucas after the three actors were signed to contracts."
8511,MvIwx0JThsk,2017-12-26,"Taylor Swift, BloodPop® - …Ready For It? (BloodPop® Remix)(Lyric Video)",TaylorSwiftVEVO,10,2017-12-14 16:00:02+00:00,"Taylor Swift|""…Ready For It?""|""BloodPop®""|""Remix""|""reputation""",3898194,195556,5909,10170,https://i.ytimg.com/vi/MvIwx0JThsk/default.jpg,False,False,False,Get “…Ready For It? (BloodPop® Remix)” here!:\nhttp://taylor.lnk.to/RFIBloodPop
