id,video_id,trending_date,title,channel_title,category_id,publish_time,tags,views,likes,dislikes,comment_count,thumbnail_link,comments_disabled,ratings_disabled,video_error_or_removed,description
8592,iCXQwI2Luw8,2017-12-26,“Santa Baby” ft. Ciara | TARAJI’S WHITE HOT HOLIDAYS,Empire,24,2017-12-12 19:26:50+00:00,"Taraji White Hot Holiday|""Empire""|""Christmas""|""Kaitlin Doubleday""|""Taraji P. Henson""|""Grace Gealey""|""Trai Byers""|""Bryshere Gray""|""Jussie Smollett""|""Terrence Howard""|""lucious lyon""|""hakeem lyon""|""Jamal Lyon""|""Lee Daniels""|""Anika""|""soap opera""|""Gabourey Sidibe""|""Serayah""|""Kelly Rowland""|""lyon family""|""Danny Strong""|""mogul""|""CEO""|""Tiana""|""Camilla""|""Valentina""|""Laura""|""ALS""|""Tasha Smith""|""Carol Holloway""|""Andre Royo""|""Marisa Tomei""|""Mimi Whiteman""|""Santa Baby""|""Performance""|""saucy holiday""|""holiday song""|""Eartha Kitt""",30703,705,10,38,https://i.ytimg.com/vi/iCXQwI2Luw8/default.jpg,False,False,False,"A new spin on the saucy holiday song, Santa Baby.\n\nSubscribe now for more Empire clips: ‪http://fox.tv/SubscribeEMPIRE\n\nWatch Empire Season 4 videos: http://fox.tv/EmpireSeason4Playlist\nCatch full episodes now: http://fox.tv/WATCHempire\n\nSee more of Empire on our official site: http://fox.tv/Empire\nLike Empire on Facebook: http://fox.tv/Empire_FB\nFollow Empire on Twitter: http://fox.tv/Empire_Twitter\nFollow Empire on Instagram: http://fox.tv/Empire_IG\nFollow Empire on Tumblr: http://fox.tv/Empire_Tumblr\n\nLike FOX on Facebook: http://fox.tv/FOXTV_FB\nFollow FOX on Twitter: http://fox.tv/FOXTV_Twitter\nAdd FOX on Google+: http://fox.tv/FOXPlus\n\nEMPIRE returns at a new time on Wednesday, Sept. 27 (8:00-9:00 PM ET/PT) on FOX. On the Season Four premiere, Lucious makes his first public appearance after the explosion in Las Vegas, while all members of the Lyon family have their own interests in Lucious regaining his physical and mental faculties. Academy Award- and Golden Globe-winning actor, director and producer Forest Whitaker (“The Last King of Scotland,” “Arrival,” “Lee Daniels’ The Butler”) will guest-star in a multi-episode arc on EMPIRE, beginning this fall on FOX. Whitaker will play “Uncle Eddie,” a charismatic music icon and bonafide hitmaker, who gave an unknown Lucious (Terrence Howard) his first radio airplay. Decades later, Eddie steps up for Lucious at a critical moment during his rehabilitation, and a grateful Cookie (Taraji P. Henson) invites him to produce a song in celebration of Empire Entertainment’s 20th anniversary.\n\nEMPIRE is a powerful drama about a family dynasty set within the glamorous and sometimes dangerous world of hip-hop music. The show revolves around the Lyon family and their media company, Empire Entertainment. The founder, LUCIOUS LYON (Terrence Howard), is the king of hip-hop, but his company and reign are constantly threatened by his family, including his ex-wife, COOKIE LYON (Taraji P. Henson); his sons, JAMAL (Jussie Smollett), HAKEEM (Bryshere “Yazz” Gray) and ANDRE (Trai Byers); and a volatile and competitive music industry.\n\n“Santa Baby” ft. Ciara | TARAJI’S WHITE HOT HOLIDAYS\nhttps://www.youtube.com/EMPIREonFOX"
8466,ibI5-k5sin8,2017-12-26,Cut for Time: New Year’s Kiss - SNL,Saturday Night Live,24,2017-12-18 18:05:24+00:00,"SNL|""Saturday Night Live""|""SNL Season 43""|""Episode 1734""|""Kevin Hart""|""Beck Bennett""|""Kyle Mooney""|""New Year's Eve""|""s43""|""s43e9""|""episode 9""|""live""|""new york""|""comedy""|""sketch""|""funny""|""hilarious""|""late night""|""host""|""music""|""guest""|""laugh""|""impersonation""|""actor""|""improv""|""musician""|""Jumanji""|""Central Intelligence""|""Ride Along""|""Ride Along 2""|""Grudge Match""|""Get Hard""|""Think Like A Man Too""|""Foo Fighters""|""David Grohl""|""concrete and gold""|""the pretender""|""best of you""|""cut for time""",720033,9780,817,641,https://i.ytimg.com/vi/ibI5-k5sin8/default.jpg,False,False,False,One man (Beck Bennett) searches for his friends (Kyle Mooney) on New Year's Eve.\n\n#SNL #SNL43\n\nGet more SNL: http://www.nbc.com/saturday-night-live\nFull Episodes: http://www.nbc.com/saturday-night-liv...\n\nLike SNL: https://www.facebook.com/snl\nFollow SNL: https://twitter.com/nbcsnl\nSNL Tumblr: http://nbcsnl.tumblr.com/\nSNL Instagram: http://instagram.com/nbcsnl \nSNL Pinterest: http://www.pinterest.com/nbcsnl/
8489,ifkRhaEDzzo,2017-12-26,TRYING ON ENGAGEMENT RINGS (no proposal),PointlessBlogVlogs,24,2017-12-16 17:00:08+00:00,"pointlessblog|""pointlessblogtv""|""pointlessblogvlogs""|""games""|""gaming""|""daily""|""vlog""|""zoe""|""sugg""|""funny""|""zoella""|""zozeebo""|""new""|""house""|""nala""|""cute""|""puppy""|""british""|""teen""|""couple""|""zalfie""|""ring""|""rings""|""engagement""|""proposal""|""diamond""|""london""|""vlogmas""|""shopping""|""christmas""|""tanya""|""jim""|""chapman""|""drunk""|""party""",520879,27375,763,264,https://i.ytimg.com/vi/ifkRhaEDzzo/default.jpg,False,False,False,► TRYING ON ENGAGEMENT RINGS\n► 20% Off PB Merch • http://bit.ly/New-PBMerch\n► 20% Off PB Merch • http://bit.ly/New-PBMerch\n----------------------------------------­­­­­­­----------------------------------­-­-­-­\n• Zoe •\nhttp://www.youtube.com/Zoella\n----------------------------------------­­­­­­­----------------------------------­-­-­-­\n• My Links •\nMain Channel • http://youtube.com/pointlessblog \nGaming Channel • http://youtube.com/AlfieGames \nTwitter • https://twitter.com/pointlessblog \nFacebook • http://fb.com/PointlessBlogTv \nTumblr • http://pointlessblogtv.tumblr.com \nSnapChat • PointlessBlog\n----------------------------------------­­­­­­­----------------------------------­-­-­-­-\n• Music •\nAndrew Applepie\nHexCougar\n----------------------------------------­­­­­­­----------------------------------­-­-­-­-\n• Contact • Enquiries@PointlessBlog.co.uk\n----------------------------------------­­­­­­­----------------------------------­-­-­-­-
8580,ii3n7hYQOl4,2017-12-26,SPIDER-MAN: INTO THE SPIDER-VERSE - Official Teaser Trailer,Sony Pictures Entertainment,24,2017-12-09 18:38:08+00:00,"SONY PICTURES|""SPIDER-MAN""|""SPIDER-MAN: INTO THE SPIDER-VERSE""|""Shameik Moore""|""Mahershala Ali""|""SPIDER-MAN: INTO THE SPIDER-VERSE OFFICIAL TRAILER""|""Phil Lord""|""Chris Miller""|""Miles Morales""|""Peter Parker""|""Spider-man: Homecoming""|""Spider-man animated""|""Spiderman""|""Marvel Cinematic Universe""|""Marvel""|""Stan Lee""|""Black Spider-man""|""Spider-man cartoon""|""Sony Pictures Animation""|""Animated Movie""|""Animation""|""Liev Schreiber""|""Ultimate Spider-man""|""Spiderverse""|""Spider-man sequel""",10323830,177393,14932,29881,https://i.ytimg.com/vi/ii3n7hYQOl4/default.jpg,False,False,False,"Enter a universe where more than one wears the mask #SpiderVerse\n\nIn Theaters Christmas 2018.\n\nFollow us on Social:\nFacebook: www.facebook.com/SpiderVerseMovie\nTwitter: www.twitter.com/SpiderVerse\nInstagram: www.instagram.com/SpiderVerseMovie\n\nSubscribe to Sony Pictures for exclusive content: http://bit.ly/SonyPicsSubscribe\n\nPhil Lord and Christopher Miller, the creative minds behind The Lego Movie and 21 Jump Street, bring their unique talents to a fresh vision of a different Spider-Man Universe, with a groundbreaking visual style that’s the first of its kind. “Spider-Man: Into the Spider-Verse” introduces Brooklyn teen Miles Morales, and the limitless possibilities of the Spider-Verse, where more than one can wear the mask."
8510,iiWm8AxvWtw,2017-12-26,73 Questions With Sean “Diddy” Combs | Vogue,Vogue,24,2017-12-14 13:00:54+00:00,"73 qs|""73 questions""|""biggie smalls""|""diddy""|""love""|""p diddy""|""puff daddy""|""sean combs""|""sean diddy combs""|""puffy""|""sean john""|""73 questions interview""|""brother love""|""sean combs interview""|""diddy interview""|""dirty money""|""diddy dirty money""|""diddy biggie""|""diddy on biggie""|""sean combs 73""|""diddy 73""|""diddy rapper""|""sean combs rap""|""sean combs son""|""diddy son""|""sean combs fashion""|""diddy fashion""|""celebrity""|""homes""|""style""|""celeb style""|""vogue""|""vogue.com""",392673,11233,233,810,https://i.ytimg.com/vi/iiWm8AxvWtw/default.jpg,False,False,False,"Rapper, producer, clothing designer, and entrepreneur Sean “Diddy” Combs invites Vogue into his Los Angeles home and answers 73 questions. In this episode, Diddy (who refers to himself as “Love”) talks about his biggest weakness, Biggie’s legacy, and his greatest inspiration.\n\nStill haven’t subscribed to Vogue on YouTube? ►► http://bit.ly/vogueyoutubesub\n \nABOUT VOGUE\nVogue is the authority on fashion news, culture trends, beauty coverage, videos, celebrity style, and fashion week updates. \n\n73 Questions With Sean “Diddy” Combs | Vogue\n\nCreated By: Joe Sabia"
8555,jNStfcyNrOI,2017-12-26,Cheat Codes - Feels Great ft. Fetty Wap & CVBZ [Official Video],Cheat Codes,10,2017-12-12 17:02:04+00:00,"Cheat|""Codes""|""cheat codes""|""tell me you love me""|""demi lovato""|""fetty wap""|""cvbz""|""feels great""|""feels great mothafucka""|""new music""|""pop""|""edm""|""party""|""dance music""|""music video""|""motorcycles""|""dirt bikes""|""dirt""|""mylifeaseva""|""flares""|""fun music""|""fun music video""|""fetty wap cheat codes feels great""|""feels great cheat codes""|""no promises cheat codes demi lovato""|""camila cabello havana""|""wolves marshmello""|""post malone rockstar""|""bebe rexha meant to be""|""g-eazy halsey him & i""|""demi lovato sorry not sorry""",772817,17717,482,613,https://i.ytimg.com/vi/jNStfcyNrOI/default.jpg,False,False,False,"Here is the official music video for our song Feels Great with Fetty Wap and CVBZ.\n\nGet the song here: http://cheatcodes.is/FeelsGreatYT\n\nFollow Cheat Codes:\nFacebook: https://www.facebook.com/cheatcodesmusic\nTwitter: https://twitter.com/cheatcodesmusic\nInstagram: https://www.instagram.com/cheatcodesm...\nSnapchat: cheatcodesmusic\n\nFollow CVBZ\nTwitter: @cvbzmvzic \nInstagram: @cvbzmvzic\nFacebook: https://www.facebook.com/cvbzmvzic/\nSpotify: spotify:artist:0pt7PX4Hftlg8mV1ySU84Q\n\n/////\n\n Lyrics:\n[Verse 1]\nGrowing up in the golden age\nThrowing rocks at your window pane\nKiss me once and I'll float away\nBut that ain't me anymore\nWell I don't mind if I sell my soul\nTo get a song on the radio\nCredit cards and my student loans\nThat's so millennial\n\n[Chorus]\nDo you remember how it feels to be young?\nDo you remember?\nWe could be anyone\nNow I miss the view from the floor of your room\nSeptember came way too soon\nDo you remember how it feels to be young?\nIt feels great, mothafucka, yeah\nIt feels great, mothafucka, yeah\nIt feels great, mothafucka, yeah\n\n[Verse 2]\nRemember cutting class we would smoke and chill\nIt was only gym and lunch\nWe thought it was real\nI was even failing math, I ain't even care\nYeah just to be around you made it worth it\nI dropped out, but you still said I'm perfect\nI remember at the prom you was perfect\nI remember you were walking on graduation day\nI never got the chance to say\nThat I remember all the time that we spent\nAnd I remember you were really my friend\nAnd I remember you were really my friend\nAnd I remember when they all looked and laughed\nNow it's crazy how they all on yo ass\n\n[Bridge]\nIt feels great, mothafucka, yeah baby yeah\nIt feels great, mothafucka, yeah\nIt feels great, mothafucka, yeah\nIt feels great, mothafucka, yeah\n\n[Chorus]\nDo you remember how it feels to be young?\nDo you remember?\nWe could be anyone\nNow I miss the view from the floor of your room\nSeptember came way too soon\nDo you remember how it feels to be young?\nIt feels great, mothafucka, yeah\nIt feels great, mothafucka, yeah\nIt feels great, mothafucka, yeah"
8451,jbeEE0RaEeA,2017-12-26,Spoiler Mode - Star Wars Episode VIII The Last Jedi,Easy Allies,20,2017-12-21 08:34:27+00:00,"Easy Allies|""Star Wars""|""The Last Jedi""|""Episode VIII""|""spoilers""",19993,896,88,903,https://i.ytimg.com/vi/jbeEE0RaEeA/default.jpg,False,False,False,"After seeing one of the most divisive Star Wars films ever, the allies have lots of opinions. Some of us loved the way it steered the story in a radically new direction, others weren't fans of the humor or sub-plots. Can they find balance?\n\nSupport us through Patreon: https://www.patreon.com/EasyAllies\nSchedule: http://easyallies.com/\nMerchandise: http://shop.spreadshirt.com/easyallies\n\nLive streams - https://www.twitch.tv/easyallies\nStream archives - https://www.youtube.com/easyalliesplays\nhttps://twitter.com/easyallies\nhttps://www.facebook.com/easyallies"
8590,jxbDvIXcW_Y,2017-12-26,-FROZEN- Duke: Like a chicken with the face of a monkey!,Mizzy Marp,23,2014-03-24 00:20:23+00:00,[none],17401,22,4,4,https://i.ytimg.com/vi/jxbDvIXcW_Y/default.jpg,False,False,False,"This is from the movie, Frozen.\n\n\n\n\nThis movie doesn't belong to me. It belongs to it's rightful owners."
8454,jyTqvjvj8sM,2017-12-26,Home For Christma(saurus)!,Carrie Hope Fletcher,24,2017-12-20 00:32:47+00:00,"carrie hope fletcher|""christmas""|""the addams family""|""singapore""|""travel""|""london""|""shopping""|""vlog""|""christmasaurus""|""tom fletcher""|""giovanna fletcher""|""matt willis""|""busted""|""mcfly""|""mcbusted""|""songs""|""singing""|""acting""|""theatre""|""hammersmith apollo""|""musical theatre""|""family""|""fletchers""",87429,4351,37,216,https://i.ytimg.com/vi/jyTqvjvj8sM/default.jpg,False,False,False,♥ Concert ♥\nclub11.london/chf2018 \n\n♥ Eugenius ♥\nhttp://www.theotherpalace.co.uk\n\n♥ The Hopeful Shop ♥\nhttp://www.thehopefulshop.com\n\n♥ The Christmasaurus ♥\nhttps://www.eventimapollo.com/events/detail/the-christmasaurus-live-on-stage#b5SQlTifHpqlRdkQ.97\n\nAmazon: http://po.st/ChristmasaurusAmazon\nTesco: http://po.st/ChristmasaurusTesco\nWaterstones: http://po.st/ChristmasaurusWaterstones\nWHSmith: http://po.st/ChristmasaurusWHSmith\n \n\n♥ PO Box ♥ \nCarrie Hope Fletcher C/O Helen Clarkson\nHaymarket House\n28-29 Haymarket\nLondon SW1Y 4SP\n\n♥ MY SOCIAL MEDIA ♥\nTwitter: http://twitter.com/Carriehfletcher\nSnapchat: ItsWayPastMyBed\nTumblr: http://www.carriehopefletcher.com\nFacebook: http://www.facebook.com/itswaypastmyb...\nInstagram: http://instagram.com/carriehopefletcher\nBlog: http://www.AllIKnowNow.com\n\n♥ OTHER CHANNELS ♥\nSecond channel: http://www.youtube.com/twentythirtytwo
8439,k_JTFUEp7mw,2017-12-26,The Reason Why Kylo Ren Was Shirtless In The Last Jedi,Looper,24,2017-12-19 20:51:58+00:00,"the last jedi|""last jedi""|""star wars last jedi""|""star wars the last jedi""|""last jedi kylo""|""last jedi kylo ren""|""last jedi kylo ren shirtless""|""the last jedi kylo""|""the last jedi kylo ren""|""the last jedi kylo ren shirtless""|""star wars kylo""|""star wars kylo ren""|""star wars last jedi kylo""|""star wars the last jedi kylo""|""star wars kylo ren shirtless""|""star wars last jedi kylo ren shirtless""|""star wars the last jedi kylo ren""|""star wars the last jedi kylo ren shirtless""|""kylo ren shirtless""",439872,6080,557,1413,https://i.ytimg.com/vi/k_JTFUEp7mw/default.jpg,False,False,False,"If you're new, Subscribe! → http://bit.ly/Subscribe-to-Looper\n\nWarning: This Video Contains Spoilers For Star Wars: The Last Jedi\n\nApparently, being locked in a lifelong struggle between the dark and light sides of the Force is really good for your pecs...\n\nRead more here → http://www.looper.com/101228/kylo-ren-shirtless-last-jedi/\n\nStar Wars Lists and Features\nhttps://www.youtube.com/playlist?list=PLOzaghBOlEsdDlwtP3upIeNTZDFISIdM3\n\n10 Star Wars Mistakes That Slipped Right By You\nhttps://youtu.be/4XedBn6wlBE?list=PLOzaghBOlEsdDlwtP3upIeNTZDFISIdM3\n\nThe Lost Star Wars Movie We Never Got To See\nhttps://youtu.be/vrzhi24kijo?list=PLOzaghBOlEsdDlwtP3upIeNTZDFISIdM3\n\nHere's Who Should Play Young Princess Leia\nhttps://youtu.be/jfacwg0uQr4?list=PLOzaghBOlEsdDlwtP3upIeNTZDFISIdM3\n\nWhat Only Die-Hard Fans Know About Darth Vader\nhttps://youtu.be/wvHT9bG2mzE?list=PLOzaghBOlEsdDlwtP3upIeNTZDFISIdM3\n\nThe One Star Wars Scene That Still Makes Mark Hamill Angry\nhttps://youtu.be/jZuqyc_0Tp4?list=PLOzaghBOlEsdDlwtP3upIeNTZDFISIdM3\n\nHow Daisy Ridley Got Ripped For The Last Jedi\nhttps://youtu.be/hjTRR4RGL5o?list=PLOzaghBOlEsdDlwtP3upIeNTZDFISIdM3\n\nWebsite → http://www.looper.com/\nLike us → https://facebook.com/loopermoviestv/\nInstagram → https://instagram.com/looperhq/\n\nLooper is the go-to source for the movies, TV shows and video games we all love. We're addicted to all things superhero and Star Wars, but we're not afraid to binge watch some reality TV when the mood strikes. Whether it's revealing Easter eggs and secrets hidden in your favorite films, exposing movie mistakes, highlighting the best deleted scenes, or uncovering the truth about reality TV's strangest stars, Looper has endless entertainment for the discerning YouTube viewer."
8550,khPLWaBioOs,2017-12-26,Logan Paul - SANTA DISS TRACK (Official Music Video),Logan Paul Vlogs,24,2017-12-10 21:32:44+00:00,"logan paul vlog|""logan paul""|""logan""|""paul""|""olympics""|""logan paul youtube""|""vlog""|""daily""|""comedy""|""hollywood""|""parrot""|""maverick""|""bird""|""maverick clothes""|""logan paul music""|""santa diss track""|""roast""|""diss track""|""best diss track""|""logan paul diss track""|""santa""|""christmas""|""christmas gifts""|""maverick merch""|""red merch""|""red drop""|""be a maverick""|""santa music""|""christmas diss track""|""christmas music""",28403017,1139917,161732,203716,https://i.ytimg.com/vi/khPLWaBioOs/default.jpg,False,False,False,"MAVERICK MERCH IS WHERE IT'S AT ► https://ShopLoganPaul.com/\nSorry, Santa... I had to do it.\nSUBSCRIBE FOR DAILY VLOGS! ► http://bit.ly/Subscribe2Logan\n\nLISTEN ON\n[Spotify] - http://open.spotify.com/album/1mvvwLzmUYKtN3XAHNI385\n[iTunes] - http://bit.ly/SantaDissTrack\n\nBeat produced by Kid Zeta:\nYoutube Channel: https://www.youtube.com/user/KidZetaBeats\nInstagram: @kidzetabeats\n\nWatch The Vlog  ► https://youtu.be/yZW6nP0ZKzo\n\nADD ME ON:\nINSTAGRAM: https://www.instagram.com/LoganPaul/\nTWITTER: https://twitter.com/LoganPaul\n\nI’m a 22 year old kid living in Los Angeles. I make comedy vids, travel a lot, I have a pretty colorful parrot named Maverick and a savage dog named Kong. This is my life.\nhttps://www.youtube.com/LoganPaulVlogs"
8549,kwraJAssyuE,2017-12-26,The National - 'Sleep Well Beast',The National,10,2017-12-14 17:07:47+00:00,"The National|""Sleep Well Beast""|""Homecoming""|""Cincinnati""",82909,1311,116,82,https://i.ytimg.com/vi/kwraJAssyuE/default.jpg,False,False,False,"http://www.americanmary.com  |  http://www.4AD.com\nSleep Well Beast, out now: http://4ad.co/SleepWellBeast\n\nDirectors: Casey Reas, Graham MacIndoe\nDP: Graham MacIndoe\nEditor: Matthew Miller"
8536,lYEj9snU838,2017-12-26,"Boy speaks out on viral bullying video, mom addresses backlash",CBS This Morning,25,2017-12-12 12:58:41+00:00,"video|""cbs""|""news""|""Keaton Jones""|""Tennessee""|""Facebook video""|""bullying""|""social media backlash""",1532989,10064,18685,10589,https://i.ytimg.com/vi/lYEj9snU838/default.jpg,False,False,False,"Keaton Jones, a Tennessee middle schooler, is speaking out after an emotional Facebook video about being bullied. In the widely-shared video, he describes how fellow students poured milk on him and stuffed food in his clothes. Now, his mother is addressing backlash on social media over some other posts which show her and her son with Confederate flags. Mark Strassmann reports.\n\nSubscribe to the CBS This Morning Channel HERE: http://bit.ly/1Q0v2hE\nWatch CBS This Morning HERE: http://bit.ly/1T88yAR\nWatch the latest installment of Note to Self, only on CBS This Morning, HERE: http://cbsn.ws/1Sh8XlB\nFollow CBS This Morning on Instagram HERE: http://bit.ly/1Q7NGnY\nLike CBS This Morning on Facebook HERE: http://on.fb.me/1LhtdvI\nFollow CBS This Morning on Twitter HERE: http://bit.ly/1Xj5W3p\nFollow CBS This Morning on Google+ HERE: http://bit.ly/1SIM4I8\n\nGet the latest news and best in original reporting from CBS News delivered to your inbox. Subscribe to newsletters HERE: http://cbsn.ws/1RqHw7T\n\nGet your news on the go! Download CBS News mobile apps HERE: http://cbsn.ws/1Xb1WC8\n\nGet new episodes of shows you love across devices the next day, stream local news live, and watch full seasons of CBS fan favorites anytime, anywhere with CBS All Access. Try it free! http://bit.ly/1OQA29B\n\n\nDelivered by Norah O’Donnell and Gayle King, CBS This Morning offers a thoughtful, substantive and insightful source of news and information to a daily audience of 3 million viewers. The Emmy Award-winning broadcast presents a mix of daily news, coverage of developing stories of national and global significance, and interviews with leading figures in politics, business and entertainment. Check local listings for CBS This Morning broadcast times."
8415,l_lblj8Cq0o,2017-12-26,"G-Eazy - No Limit REMIX ft. A$AP Rocky, Cardi B, French Montana, Juicy J, Belly",GEazyMusicVEVO,10,2017-12-19 20:00:05+00:00,"BPG/RVG/RCA Records|""G-Eazy feat. A$AP Rocky""|""Cardi B""|""French Montana""|""Juicy J & Belly""|""No Limit REMIX""|""Rap""",21993346,520225,27146,35134,https://i.ytimg.com/vi/l_lblj8Cq0o/default.jpg,False,False,False,New Album ‘The Beautiful & Damned’ Available Everywhere http://smarturl.it/TBAD\nGet exclusive TB&D bundles here: http://smarturl.it/TBAD/officialstore\nSubscribe for more exclusive G-Eazy footage: http://bit.ly/GEazyYTSub\nG-Eazy Official Site: http://g-eazy.com/\nG-Eazy On Twitter: https://twitter.com/G_Eazy\nG-Eazy On Facebook: https://www.facebook.com/G.Eazy\nG-Eazy on Instagram: https://www.instagram.com/g_eazy
8546,lw_KFCgcvA4,2017-12-26,3 EVERYDAY LOOKS | Samantha Maria,Samantha Maria,26,2017-12-13 17:00:04+00:00,"samantha|""maria""|""sammi""|""beautycrush""|""three""|""everyday""|""looks""|""high""|""street""|""2017""|""autumn""|""winter""|""outfits""",70497,4430,102,170,https://i.ytimg.com/vi/lw_KFCgcvA4/default.jpg,False,False,False,"3 Autumn/winter looks, Some were filmed before it got super cold so obviously chuck a coat over top!\nMy Vlog channel! - http://www.youtube.com/thesammimariashow\nMy Blog - http://www.samanthamariaofficial.com\nInstagram - http://instagram.com/samanthamariaofficial\nTwitter - https://twitter.com/samanthamaria \nFacebook - https://www.facebook.com/SammiMaria\nSnapchat - sammi.maria\n\nContact me:\nBusiness & Collaboration Enquiries - Sammi@gleamfutures.com\nPR Enquiries - Beautycrushpersonal@gmail.com\n____________________________________\n\nOUTFIT ONE\nJumper - Weekday http://bit.ly/2AtUL6P\nJeans - Topshop http://bit.ly/2zcjnNh\nJacket - Allsaints http://bit.ly/2AugrQe\nBoots - GANNI (Similar - http://bit.ly/2Awai64)\nBag - YSL\n\nOUTFIT TWO\nTop - &Otherstories http://bit.ly/2AtbKWO\nScarf - ASOS http://bit.ly/2yfUFcU\nJeans - Topshop http://bit.ly/2zcjnNh\nBoots - &Otherstories http://bit.ly/2Av4eLa\nJacket - RESERVED\nBag - Allsaints http://bit.ly/2Avykyk\n\nOUTFIT THREE\nJumper - &Otherstories http://bit.ly/2AvLUla\nTrousers - Topshop http://bit.ly/2zQqyOr\nShoes - Adidas http://bit.ly/2AvM9N6\nBag - Balenciaga\nSunnies - CELINE via. Worlddutyfree http://uk.worlddutyfree.com/ukm_en/celine-cl-41450-s-1.html\n\nAffiliate Disclaimer - Some links are affiliate links, meaning I receive a small percentage from a sale via that link. This does not affect my opinion or choice on any item being featured."
