id,video_id,trending_date,title,channel_title,category_id,publish_time,tags,views,likes,dislikes,comment_count,thumbnail_link,comments_disabled,ratings_disabled,video_error_or_removed,description
8523,--uXQQ0h-yQ,2017-12-26,Paul McCartney - Pipes of Peace,PonteFractus,24,2008-11-24 17:59:52+00:00,"ww1|""great""|""war""|""trenches""|""tommies""",26299,234,3,11,https://i.ytimg.com/vi/--uXQQ0h-yQ/default.jpg,False,False,False,Paul McCartney - Pipes of Peace
8473,-A9rYcBmBFo,2017-12-26,Star Wars: The Last Jedi - SPOILER Review,Jeremy Jahns,24,2017-12-17 20:26:29+00:00,"Star Wars|""the last jedi""|""SPOILER Talk""|""episode 8""|""episode VIII""|""kylo ren""|""rey""|""luke""|""snoke""|""lucasfilm""|""movie""|""review""|""Awesometacular""|""jeremy jahns""",750136,30695,2263,13690,https://i.ytimg.com/vi/-A9rYcBmBFo/default.jpg,False,False,False,"Star Wars Episode VIII is out, so let's talk about wasted characters, plot lines, and other things that raise questions....and possibly problems.\n\n\nSee more videos by Jeremy here: http://www.youtube.com/user/JeremyJahns\n\nFollow Jeremy on Twitter: https://twitter.com/JeremyJahns\n\nFriend Jeremy on Facebook: http://www.facebook.com/RealJeremyJahns"
8474,-mZZAvIHMvQ,2017-12-26,What REALLY Happened to SNOKE in The Last Jedi (SPOILERS) - Star Wars Theory Explained,Star Wars Theory,24,2017-12-17 17:00:00+00:00,"jedi|""snoke""|""spoilers""|""star wars""|""the last jedi""|""kylo ren""|""star wars the last jedi""|""luke skywalker""|""star wars theory""|""star wars episode 8""|""yoda""|""the last jedi trailer""|""star wars explained""|""darth vader""|""star wars 8""|""snoke theory""|""star wars the last jedi trailer""|""anakin skywalker""|""episode 8""|""the last jedi review""|""star wars the last jedi spoilers""|""star wars trailer""|""snoke the last jedi""|""What REALLY Happened to SNOKE in The Last Jedi (SPOILERS)""|""the last jedi ending explained""",1295981,59324,2461,36530,https://i.ytimg.com/vi/-mZZAvIHMvQ/default.jpg,False,False,False,"In Star Wars the Last Jedi Snoke ends up (???) where Kylo Ren fulfills his destiny in the throne room. I know many think this scene is how it really is, but I'm here to explain why it IS NOT. Man it's really hard to explain things in the title and description without spoilers :D\n\nI hope you all enjoyed the film. I thought Mark Hamill played Luke Skywalker very well, however I would have liked to see the old Luke, the powerful one to train Rey.\n\nLet me know what you thought, good luck in the lightsaber contest (ends Dec 25) and may the force be with YOU...ALWAYS!!!!!\n\nHIGH GROUND T-SHIRT - https://teespring.com/high-ground \n\nLIVE CHAT/FORUMS/WEBSITE - https://www.StarWarsTheory.com\n\nFacebook - https://www.facebook.com/starwarstheoryToos/\n\nTwitter - https://twitter.com/SWTheory66\n\nInstagram - https://www.instagram.com/star.wars.theory/?hl=en\n \nGaming Channel - https://www.youtube.com/channel/UCMI5ojH8j_CqftUjCjfgd-A \n\nPatreon - https://www.patreon.com/StarWarsTheory\n\nMerch -https://shop.spreadshirt.com/SWTheory\n\n*************************************\n\nDarth Vader ANNIHILATES Clone Troopers After Order 66 \nhttps://www.youtube.com/watch?v=BV2N-RUOajo\n\nHow Darth Vader Went to the Jedi Council’s Secret Prison\nhttps://www.youtube.com/watch?v=13_CYZMt-y8&t=15s\n\nWhy Didn't Obi-Wan Remember R2-D2? - https://www.youtube.com/watch?v=CoLZ6xzLjuY&t=2s\n\nHow Darth Vader Found Out The Jedi Council's BIGGEST Secret  - https://youtu.be/2bFPYAC4xUA\n\nHow Darth Vader Saved Palpatine From Death \nhttps://www.youtube.com/watch?v=_QLCGUc55XA\n \nALL of Darth Vader’s Injuries and His Thoughts About Them\nhttps://www.youtube.com/watch?v=BjT4M...\n\nWhat if Anakin WAS Granted the Rank of Master - \nhttps://www.youtube.com/watch?v=JiL_w...\n\nAnakin's Thoughts While Being Burned on Mustafar and Turning Into Darth Vader -  \nhttps://www.youtube.com/watch?v=GydVi... \n\n8 Jedi Master Who Became Sith Lords - \nhttps://www.youtube.com/watch?v=6RRc7...\n\nHow Did Anakin Kill All Jedi at the Temple During Order 66? Revenge of the Sith -Star Wars Explained \nhttps://www.youtube.com/watch?v=nkD2P...\n\nWhat if Order 66 Failed? Star Wars Theory \nhttps://youtu.be/Vt4lFLRsK9w\n \n \nTHANK YOU LUCAS KING \nMusic - Lucas King - https://www.youtube.com/user/LucasKingPiano"
8586,-pOSRBAqUdM,2017-12-26,【Live】WRESTLE KINGDOM 12 IN TOKYO DOME: Press Conference,新日本プロレスリング株式会社,17,2017-12-12 06:51:31+00:00,"新日本プロレス|""g1""|""プロレス""|""後藤洋央紀""|""ケニー・オメガ""|""G1クライマックス26""|""優勝決定戦""|""CHAOS""|""BULLET CLUB""|""January 4 Dome Show""|""Fights""|""NJPW""|""IWGP""|""New Japan Pro Wrestling (Organization)""|""Tokyo Dome (Sports""|""Facility)""|""東京ドーム""|""新日本""|""プロレスリング""|""WRESTLE KINGDOM""|""レッスルキングダム""|""オカダ""|""Kazuchika Okada (Person)""|""Hiroshi Tanahashi (Person)""|""棚橋""|""okada""|""オカダ・カズチカ""|""NEWJAPAN""|""タイガーマスクW""|""tigermaskW""|""飯伏""|""飯伏幸太""|""内藤哲也""|""Tetsuya Naito""|""Hirooki Goto""|""LIJ""|""kenny omega""|""THE ELITE""|""Katsuyori Shibata""|""柴田勝頼""|""髙橋ヒロム""|""Hiromu Takahashi""|""Shinsuke Nakamura""|""中邑真輔""|""AJ Styles""",100236,1274,20,297,https://i.ytimg.com/vi/-pOSRBAqUdM/default.jpg,False,False,False,【Live】WRESTLE KINGDOM 12 IN TOKYO DOME: Press Conference\n\n【生放送】WRESTLE KINGDOM 12 IN TOKYO DOME: 記者会見
8482,0VsgQmCPgoI,2017-12-26,SURPRISE TRIP TO FINLAND!!,Estée Lalonde,22,2017-12-17 17:30:01+00:00,"essiebutton|""Estée Lalonde""|""Estee Lalonde""|""Essie Button""|""Essie""|""No Makeup Makeup""|""Drugstore Makeup Tutorial""|""Fashion""|""Cute Outfits""|""Makeup Tutorials""|""Healthy Foods""|""Eye Makeup""|""Outfit Ideas""|""Natural Makeup""|""Easy Healthy Recipes""|""Skin Care Products""|""Best Makeup""|""FINLAND""|""travel""|""vlog""|""winter""|""ice""|""cold""|""husky""|""sledding""|""puppies""|""snowmobile""|""snowshoe""|""friends""|""li0nsmane""|""birthday""|""surprise""|""trip""",89282,4096,73,436,https://i.ytimg.com/vi/0VsgQmCPgoI/default.jpg,False,False,False,Check out my Christmas Gift Guide for some last minute ideas! \nhttps://youtu.be/zX1_qEVop0Q\n\n_______________\n\n\nWHAT I WORE:\n\nRED SWEATER\n(Similar) http://bit.ly/2k8giYr\n\nGREY BEANIE \n(Similar) http://bit.ly/2kEzJHX\n\nWINTER BOOTS http://bit.ly/2k6yXnE\n(OMG THESE ARE EVEN BETTER) http://bit.ly/2kC7TMo\n\nBLACK PARKA \n(Similar) http://bit.ly/2k6GbI5\n\nEAR FLAP HAT \nhttp://bit.ly/2kEqvLQ\n\nGREY WOOL SWEATER\n(Similar) http://bit.ly/2k6G4fD\n\nRAINBOW STRIPED SWEATER\nhttp://madeleine-thompson.com/\n\n_______________\n\n\nWHERE WE STAYED:\nhttps://nellim.fi/\n\n_______________\n\n\nMY LINKS »\nSECOND CHANNEL → http://www.youtube.com/EverydayEstee\nWEBSITE → http://www.esteelalonde.com/\nTWITTER → http://twitter.com/EsteeLalonde\nINSTAGRAM → http://www.instagram.com/EsteeLalonde\nFACEBOOK → https://www.facebook.com/EsteeLalonde\nTUMBLR → http://esteelalonde.tumblr.com/\nPINTEREST → https://www.pinterest.com/esteelalonde\n\nSUBSCRIBE TO ASLAN→https://www.youtube.com/user/theworktop\nASLAN’S INSTAGRAM→https://www.instagram.com/li0nsmane/\n\n___________\n\n\nI have a brand new PODCAST! \n👉🏼 Radio Wolfgang: http://wolfga.ng/tattoOs\n👉🏼 iTunes: http://wolfga.ng/taTtoos\n👉🏼 Audioboom: http://wolfga.ng/tAttoos\n👉🏼 Stitcher: http://bit.ly/2fRfpl8\n👉🏼  Spotify: http://spoti.fi/2fypeYm\n👉🏼 My Blog: http://www.esteelalonde.com/podcast/\n\nSTAY UP TO DATE WITH US ON SOCIAL MEDIA! \n\nINSTAGRAM: https://www.instagram.com/theheartofi...\nTWITTER: https://twitter.com/THEHEARTOFITPOD\nFACEBOOK: https://www.facebook.com/theheartofit/\n\n_______________\n\nMUSIC: \nLSOW: https://soundcloud.com/lsowtunes\nEpidemic Sound: http://www.epidemicsound.com/ \n\n_______________\n\nThis video is not sponsored. This trip was not a press trip. Some of the above links may be affiliate links.
8527,0gLsukihjVg,2017-12-26,It's time for the Jedi to end (I'm sorry),Dash Star,20,2017-12-15 02:31:47+00:00,"dash star|""star wars""|""star wars episode 8""",145646,8948,792,3567,https://i.ytimg.com/vi/0gLsukihjVg/default.jpg,False,False,False,»Check out my website Dash's Website - http://dashstarwars.com/\n»Check out these Tee's https://www.teepublic.com/stores/dash-star-wars\n\n¤Become a Part of The Exalted¤\n»Facebook - https://www.facebook.com/DashStarWars\n»Tweet me up! - http://twitter.com/dashstarwars\n\nPLAY GAMES WITH DASH\nJoin my Guild to chat at: http://neongrind.com/swtor\nFind me on SWTOR - DashStar on Harbinger Server Emp\nJedi Academy name Dash Star - Server I frequent  EXO- KR - JAWA -AZ\nBattlefront Origin Tag - DashStarWars\nFind me on Steam - [NEON] Dash\n\n» Star Wars Origins Playlist - http://goo.gl/qQdgv5\n» Star Wars Force Awakens News - http://goo.gl/tgy9rh
8420,0gv90B5DIPo,2017-12-26,George Lucas Being Blamed for The Last Jedi Backlash,Hybrid Network,24,2017-12-22 22:20:03+00:00,"Hybrid Network|""the last jedi""|""star wars the last jedi""|""the last jedi george lucas""|""the last jedi mark hamill""|""the last jedi critics vs audiences""|""the last jedi ending explained""|""the last jedi fan backlash""|""the last jedi deleted scenes""|""mark hamill hurts""|""george lucas the last jedi""",53199,981,140,1104,https://i.ytimg.com/vi/0gv90B5DIPo/default.jpg,False,False,False,"The fans have now turned on Star Wars creator George Lucas, regarding the controversial choices made in The Last Jedi.\n\n★Subscribe Here: https://goo.gl/eMyqR8\n\nHelp us make better content by joining our Patreon!\n►https://www.patreon.com/HybridNetwork\n\n\nRoyalty free music provided by bensound.com\n\nConnect with Hybrid Network!\n►Website: https://www.hybridnetworkyt.com\n►Facebook: https://www.facebook.com/HybridNetworkYT \n►Twitter: https://www.twitter.com/HybridNetwork_\n►Soundcloud: https://soundcloud.com/hybridnetworkyt\n\nHybrid Network is a community delivering the best content in pop culture whether it be news, speculation, reviews, podcasts, rumors, & more! We deliver educational & entertaining content leaving each viewer informed on any franchise we cover. Hybrid Network is pop culture annotated. \n\n-------------------------------------------------------------------------------------------------------\n\nCopyright Disclaimer Under Section 107 of the Copyright Act 1976, allowance is made for fair use for purposes such as criticism, comment, news reporting, teaching, scholarship, and research. Fair use is a use permitted by copyright statute that might otherwise be infringing. Non-profit, educational or personal use tips the balance in favor of fair use."
8524,2-bTbRjqjoE,2017-12-26,Star Wars: The Last Jedi SPOILER TALK!!!,Tyrone Magnus,24,2017-12-15 06:31:52+00:00,"reaction|""tyrone magnus""|""Star Wars: The Last Jedi""",90697,2480,290,1432,https://i.ytimg.com/vi/2-bTbRjqjoE/default.jpg,False,False,False,"Get Your New Magnus of Steel Ball Caps HERE:  http://www.midnight-hype.com/mag-of-steel-baseball-cap/\n\nGet your Tyrone Magnus BIRTHDAY SHOUTOUTS, PERSONALIZED SHOUTOUTS ALL TYPES OF SHOUTOUTS BY CLICKING THE LINK BELOW!!!\nhttps://www.bookcameo.com/v/59dbc108a18b7b003beda6f2\n\nJOIN ME ON MY JOURNEY TO 10 MILLION SUBSCRIBERS!!!\nDONT' FORGET TO LIKE, SUBSCRIBE, COMMENT AND SHARE!!!\n\nWATCH MY NETFLIX & VRV LIVE STREAM REACTIONS ON RIFF.TV:  https://www.riff.tv/tyronemagnus\n\nORDER YOUR GAMEFACE T-SHIRT NOW!!!  http://www.midnight-hype.com/\n\nMY BACKUP CHANNEL: https://www.youtube.com/channel/UCguQbsO3YPWgI_0m3JodqLQ\n\nSUBSCRIBE TO MY GAMING CHANNEL:  https://www.youtube.com/channel/UC5db...\n\nIMDb:  http://www.imdb.me/tyronemagnus\n\nLIKE ME ON FACE BOOK!!! http://www.facebook.com/TyroneMagnus\n\nFOLLOW ME ON TWITTER!!!  https://twitter.com/TheTyroneMagnus\n\nINSTAGRAM:  http://instagram.com/tyronemagnus\n\nFOLLOW ME ON YOUNOW:  https://www.younow.com/TheTyroneMagnus\n\nFOLLOW ME ON SNAPCHAT:  Tmagnusss\n\nGET YOUR MAGNUS MERCHANDISE HERE:  http://493672.spreadshirt.com/\n\nWHERE I GET MY OTHER T-SHIRTS!!!:  \nTeeblox.com Use Promo Code TYRONETBX for 10% OFF!!!\nhttp://www.midnight-hype.com\nwww.CrazyDogTshirts.com\nwww.TheStyleStage.com\nwww.liveinspiredclothing.com\nshop.ekriptik.com\nteenoevil.com\n\nNEED A SECURITY SYSTEM?!!  THEN GET THE ONLY HOME SECURITY COMPANY TYRONE MAGNUS TRUSTS!!!:  https://adtreferral.com/accept/?EID=1...\n\nWant to send me a reaction video or ask a question?!!:  Post it in the comments section or you can click on the About tab on my main channel page and then click Send Message  If that does not work, send a message on my Facebook Fanpage http://www.facebook.com/TyroneMagnus\n\nALSO BE SURE TO CHECK IF I ALREADY DID A REACTION TO THE VIDEO YOU WANT BEFORE YOU REQUEST IT\n\nANY EMAILS SENT TO MY BUSINESS INQUIRY EMAIL THAT IS NOT BUSINESS WILL NOT BE READ AND IMMEDIATELY DELETED!!!\n\nMAILING ADDRESS:\n\nTyrone Magnus, LLC\n41 Riverwalk Blvd \nOFC 2\nBurlington Township, NJ 08016"
8481,21jcP-1w4DA,2017-12-26,WHAT I GOT FOR MY BIRTHDAY | Lily Pebbles,Lily Pebbles,26,2017-12-17 09:30:01+00:00,"lily|""lilypebbles""|""pebbles""|""beauty""|""makeup""|""haul""|""shopping""|""london""|""style""|""what i got for my birthday""|""birthday""|""home decor""|""interior""|""maria black""|""sezane""|""vans""|""cox & cox""|""rockett st george""|""lucia franca""|""asos""|""urban outfitters""|""made.com""|""books""",113677,3943,203,157,https://i.ytimg.com/vi/21jcP-1w4DA/default.jpg,False,False,False,"In this video I'm showing you guys the lovely and thoughtful gifts I got this year from my family and friends! I'm so so grateful for them all. I had the best birthday and the presents were just a bonus! \nClick 'SHOW MORE' below\n\nSubscribe here http://lpebbles.uk/rHpKla\nI'm currently uploading Sundays at 9.30am UK time and occasionally Wednesdays at 6.30pm. \n\nI'm wearing:\n+ The White Company Jumper http://bit.ly/2B0Z2vD\n\n+ *Maria Black Ring http://bit.ly/2kt8Y9a\n+ *Black Leather Vans http://bit.ly/2AZynPQ\n+ *Sezane Necklace http://bit.ly/2kudwfx\n+ Cox & Cox Large Mirror http://lpebbles.uk/eMZ62z\n+ Rockett St George Desk Mirror http://lpebbles.uk/ol16R7\n+ *Lucia Franca Cashmere Jumper http://bit.ly/2ktfCfy\n+ ASOS Pjs\n+ *Amazon Echo Dot http://amzn.to/2j4OPpT\n+ *Urban Outfitters Boobs Mug http://bit.ly/2B0LSig\n+ Blush Pink Velvet Pouffe http://lpebbles.uk/vMFcEP\n+ Therapie Illuminate Oil\n+ *The Little Book of Life Hacks http://bit.ly/2krIVzp\n+ Lisa Roukin Cookbook http://lpebbles.uk/PYR41h\n+ Candle Snuffer http://lpebbles.uk/A7vcDk\n+ Candle Wick Trimmer http://lpebbles.uk/LvnymT\n+ Bloom & Wild http://bit.ly/2AYzLC5\n\n\n\n\nWatch my wedding video here http://lpebbles.uk/Z1hCsZ\n\n\nFIND ME:\nSubscribe - http://bit.ly/10dYuIf\nBlog - http://bit.ly/1kL8Qd6\nInstagram - http://instagram.com/lilypebbles\nTwitter - https://twitter.com/lilypebbles\nFacebook - https://www.facebook.com/lilypebbles\n\nMusic by Epidemic Sound (http://www.epidemicsound.com)\nThumbnail by Smukkeberg http://lpebbles.uk/iTdQuf\n\nDisclaimer: \nThis video is not an advertisement. \n*Affiliate links\nIf you purchase something using one of the marked links, I make a small percentage from that sale. This doesn't affect my opinions. Thanks for your support. \n--------------------------------------------------------------------------------­-----------------\nHow to contact me:\n\nlily@lilypebbles.co.uk\n\nLily Pebbles\nGleam Futures\n6th Floor\n60 Charlotte Street\nLondon W1T 2NU"
8405,2cosj7UeQoY,2017-12-26,Cardi B talks on how she wanted to quit rapping when a famous rapper took her verse off his song,Emcee Rapology,10,2017-12-19 09:01:53+00:00,"Cardi b|""Tmz""|""Tmz news""|""Bodak""|""Bodak yellow""|""Nicki minaj""|""Azelia banks""|""Dj khaled""|""Vlad""|""Rap news""|""Young thug""|""Boosie""|""Rap""|""Hot 97""|""Lil kim""|""Da brat""|""The art of dialogue""|""The migos""|""Migos""|""Offset""|""Qua""",74708,820,151,400,https://i.ytimg.com/vi/2cosj7UeQoY/default.jpg,False,False,False,
8468,2pVHOaT9CZ4,2017-12-26,Sesame Street Puppeteers Explain How They Control Their Puppets | WIRED,WIRED,24,2017-12-18 20:00:24+00:00,"big bird|""elmo""|""jim henson""|""muppets""|""puppets""|""sesame street""|""muppet""|""rudy""|""puppeteering""|""puppeteer""|""abby cadabby""|""mr. snuffleupagus""|""jim henson puppet""|""puppeteers""|""snuffleupagus""|""sesame street bts""|""sesame street behind the scenes""|""how to puppeteer""|""how puppets are controlled""|""how muppets""|""how to puppet""|""how muppets work""|""puppetry""|""puppets explained""|""cast of sesame street""|""cast of sesame st""|""sesame st""|""puppet""|""voices""|""sesame street puppets""|""ss""|""wired""|""wired.com""",285787,9356,117,668,https://i.ytimg.com/vi/2pVHOaT9CZ4/default.jpg,False,False,False,"Ever wonder how the puppets on Sesame Street operate? The puppeteers for some of Sesame Street's most famous characters share their insights on how they bring their iconic characters to life. The puppeteers for Elmo, Big Bird, Mr. Snuffleupagus, Abby Cadabby, and Rudy explain the various functions and features of their Muppets.\n\nYou can catch Snuffy and all his friends in the new season of Sesame Street on HBO or everyday on HBO Family or PBS Kids.\n\nStill haven’t subscribed to WIRED on YouTube? ►► http://wrd.cm/15fP7B7 \n\n\nABOUT WIRED\nWIRED is where tomorrow is realized. Through thought-provoking stories and videos, WIRED explores the future of business, innovation, and culture.\n\nSesame Street Puppeteers Explain How They Control Their Puppets | WIRED"
8396,3ATQvgkXT9E,2017-12-26,"Farruko, Nicki Minaj, Travis Scott - Krippy Kush (Remix) ft. Bad Bunny, Rvssian",FARRUKOVEVO,10,2017-12-22 23:00:01+00:00,"Farruko|""Nicki Minaj""|""Bad Bunny""|""Travis Scott""|""Rvssian""|""Official Video""|""Video Oficial""|""Nuevo Video""|""New Video""|""Krippy Kush (Remix)""|""Krippy Kush (Remix) Official Video""|""Krippy Kush (Remix) Official Remix Video""|""Krippy Kush (Remix) Single""|""Single""|""Krippy Kush (Remix) new song""|""Krippy Kush (Remix) nueva canción""|""nuevo sencillo""|""musica en espanol""|""musica en español""|""nueva balada de Farruko""|""Travis Scott remix""|""travis scott krippy remix""",6788182,273393,30255,21750,https://i.ytimg.com/vi/3ATQvgkXT9E/default.jpg,False,False,False,"The vaporizer used in this Krippy video provided by Mig Vapor vape pen, See it here http://bit.ly/MigVapor_Herb-e\n\nFarruko, Nicki Minaj & Travis Scott feat. Bad Bunny & Rvssian - Krippy Kush (Remix)[Official Music Video]\nKrippy Kush (Remix) is now available!\nLinkfire: https://SML.lnk.to/KrippyKushR\niTunes: http://smarturl.it/KrippyKushR\nApple Music: http://smarturl.it/KrippyKushRa\nSpotify: http://smarturl.it/KrippyKushRs\nAmazon Music: http://smarturl.it/KrippyKushRam\nGoogle Play: http://smarturl.it/KrippyKushRgp\n \nFollow Farruko!\nOfficial Site: http://farruko.com\nFacebook: http://www.facebook.com/FarrukoOfficial\nInstagram: http://www.instagram.com/farrukoofficial\nTwitter: http://twitter.com/FarrukoOfficial\nOfficial Music video by Farruko, Nicki Minaj & Travis Scott feat. Bad Bunny & Rvssian Krippy Kush (Remix). (C) 2017 Sony Music Entertainment US Latin LLC"
8529,3_keXD1yV3E,2017-12-26,EVENING SKINCARE ROUTINE WITH ESTÉE! | Vlogmas Day 13,Amelia Liana,26,2017-12-14 17:05:04+00:00,"amelialiana|""amelia liana""|""evening skincare routine""|""Estée Lalonde""|""vlogmas""|""vlogmas 2017""|""inthefrow""|""uk vloggers""|""vlogger""|""daily vlogger""|""skincare routine""|""acne""",72654,2126,63,158,https://i.ytimg.com/vi/3_keXD1yV3E/default.jpg,False,False,False,Hanging out with my favourite girls at Sketch & going to the Cotswolds to see Estée & Aslan for some downtime + our evening skincare routine!\n\n↓↓↓ SUBSCRIBE HERE for new videos every Monday & Thursday! http://bit.ly/1pm8SkR\n____________________________________________________________________\n\n\nOUTFIT OF THE DAY:\n\nFaux Fur Coat:\nhttp://bit.ly/2BhkaQH\n\nPink Jumper:\nhttp://bit.ly/2iaH7xn\n\nJeans:\nhttp://bit.ly/2nXgPRh\n\nBox Bag:\nhttp://bit.ly/2yl9pay\n\nVelvet Boots:\nhttp://bit.ly/2noQXxN\n\n\nTRAVEL OUTFIT:\n\nWhite Bobble Sleeve Jumper:\nhttp://bit.ly/2iZHBDy\n\nPink Scarf:\nhttp://bit.ly/2BjjZEE\n\nLeggings (similar):\nhttp://bit.ly/2BZEOBF\n\nBlack Bag:\nhttp://bit.ly/2BgXDU5\n\nPrescription Glasses:\nhttp://bit.ly/2wYZb2Q \n(in black): http://bit.ly/2y0Y4gg\n\n\nBEAUTY PRODUCTS I MENTIONED:\n\nCharlotte Tilbury Lip Cheat in Pillow Talk: http://bit.ly/2ylvS7m\nCharlotte Tilbury English Beauty Lipstick: http://bit.ly/2l3KQ17\nDolce & Gabbana The One: http://bit.ly/2z6U2WU\nClarins Gentle Eye Makeup Remover: http://bit.ly/2kqKzRT\nOrveda Rich Brew Botanical Cream: http://bit.ly/2yrfXof\nMarie Veronique Pre+Probiotic Daily Mist: http://bit.ly/2kqHst9\nOrveda Deep Cleansing Bio-Fermented Rich Balm: http://bit.ly/2ChaymJ\nMV Organics Gentle Cream Cleanser: http://bit.ly/2j1ETgI\nPai Instant Calm Redness Serum: http://bit.ly/2j3aJti\nPai Echium & Argan Gentle Eye Cream: http://bit.ly/2AFXCJS\nAntipodes Avocado Pear Nourishing Night Cream: http://bit.ly/2C5O8UF\nMV Organics Rose Plus Booster: http://bit.ly/2BnH7la\nPai Copaiba Deep Cleanse AHA Mask: http://bit.ly/2CiD0ED\nFresh Sugar Face Polish: http://bit.ly/2C5mE1B\nFresh Rose Face Mask: http://bit.ly/2j0UIEl\nCharlotte Tilbury Dry Sheet Mask: http://bit.ly/2j0UPjf\nGarnier Micellar Cleansing Water: http://bit.ly/2ChLUT5\nNail Polish: OPI Yank My Doodle: http://bit.ly/2gLqFTw\n\n\nJEWELLERY I WEAR:\n\nCoin necklaces: http://bit.ly/2yVaha1 \nStacking Rings: http://bit.ly/2x7GiHx\nEvil Eye Rings: http://bit.ly/2tRiPu0\nTrinity Ring: http://bit.ly/2x7IBuc\nRed String Bracelet: http://bit.ly/2qUqLf8\nBangle: http://bit.ly/2vLLUrE\n____________________________________________________________________\n\n\nPEOPLE IN THE VLOG:\n\nEstée: https://www.youtube.com/user/essiebutton\nAslan: https://www.youtube.com/user/theworktop\nVictoria: https://www.youtube.com/user/inthefrow\nSammi: https://www.youtube.com/user/beautycrush\nCarly: https://www.youtube.com/user/Carlyrowena\nEm: https://www.youtube.com/user/Emshelx\n\n____________________________________________________________________\n\n\nSketch: https://sketch.london/\nLog House Holidays: https://loghouseholidays.co.uk/\n____________________________________________________________________\n\n\nDON’T FORGET TO ENTER MY GIVEAWAY! \n\nHow to enter:\n\nFollow me on Instagram → http://instagram.com/amelialiana \nLike my latest picture \nComment on my latest picture using #AmeliaLianaVlogs\n\nWinner: @mirkins11\n____________________________________________________________________\n\n\nEQUIPMENT:\n\nCanon Vlog Camera: http://bit.ly/2f6R1vq\nCanon Big Camera: http://bit.ly/2xcsoba (with this lens): http://bit.ly/2eII9vj\n____________________________________________________________________\n\n\nWanna see more? Follow me on my social media... \nBlog (for weekly posts) → https://amelialiana.com/\nTwitter (great for youtube polls about videos & more!) → https://twitter.com/amelialiana_ \nINSTAGRAM (featuring lots of Instagram lives!) → http://instagram.com/amelialiana \nSNAPCHAT → amelia.liana \n____________________________________________________________________\n\n\nLATEST VIDEOS:\n\nPamper Evening & Beauty Storage Clearout: https://youtu.be/meVppVeNtVI\nSnow Excitement in London! https://youtu.be/Q0bnKMOTnTU
8508,3a3vMfOCb3Q,2017-12-26,Lonzo Ball RUNS AWAY FROM LEBRON JAMES DUNK - LeBron James vs Lonzo Ball - Cavaliers vs Lakers,CliveNBAParody,17,2017-12-15 02:41:42+00:00,"nba|""clivenbaparody""|""sports""|""basketball""|""lonzo ball""|""lebron james""|""lebron james lonzo ball dunk""|""lebron james vs lonzo ball""|""lebron""|""lonzo""|""nba highlights""|""lakers vs cavaliers""|""cavaliers vs lakers""|""cavaliers""|""lakers""|""lebron james lonzo ball""|""lonzo ball runs""|""lonzo ball runs from lebron james""|""lonzo ball lebron james""|""lonzo ball runs from dunk""|""lonzo ball dunk""|""lebron james dunk""|""lebron dunk""|""lonzo ball vs lebron james""|""lonzo vs lebron""|""lebron vs lonzo""|""lebron james dunk on lonzo ball""",103233,826,132,271,https://i.ytimg.com/vi/3a3vMfOCb3Q/default.jpg,False,False,False,Lonzo Ball RUNS AWAY FROM LEBRON JAMES DUNK - LeBron James vs Lonzo Ball - Cavaliers vs Lakers\nInstagram: https://www.instagram.com/calvindrake1998/?hl=en\nSoundcloud: https://soundcloud.com/user-101845475\n\nThis channel is partnered with BBTV NBA Playmakers.
8458,3mUtNE82ZV4,2017-12-26,Christian Bale: Division Is Not The Way To Go,BUILD Series,24,2017-12-18 22:25:08+00:00,"AOL Advertising|""BUILDseriesNYC""|""AOL Inc""|""AOL""|""AOLBUILD""|""#Aolbuild""|""build speaker series""|""build""|""aol build""|""content""|""aolbuildlive""|""BUILDSeriesNYC""|""Rosamund Pike""|""2017""|""entertainment""|""Wes Studi""|""RickyC""|""cheyenne""|""chief""|""war""|""horses""|""western""|""drama""|""Rosalie Quaid""|""costar""|""actor""|""actress""|""acting""|""film""|""movie""|""adventure""|""dramatic""|""Chief Yellow Hawk""|""1892""|""Army captain""|""Le Grisbi Productions""|""Waypoint Entertainment""|""Entertainment Studios Motion Pictures""|""stars""|""role""|""Christian Bale""|""Scott Cooper""|""director""|""star""",5963,51,27,31,https://i.ytimg.com/vi/3mUtNE82ZV4/default.jpg,False,False,False,The actor says our culture will be richer when we can stop saying it's old white dudes who are running things.
