id,video_id,trending_date,title,channel_title,category_id,publish_time,tags,views,likes,dislikes,comment_count,thumbnail_link,comments_disabled,ratings_disabled,video_error_or_removed,description
10829,f7kPSYWU1JA,2018-01-07,[FULL STREAM] Open doors training session,FC Barcelona,24,2018-01-05 12:40:32+00:00,"barça|""traning""|""session""|""fc barcelona""|""lionel""|""messi""|""luis""|""suarez""|""ousmane""|""dembele""|""open""|""doors""|""fans""|""miniestadi""",113087,4962,86,108,https://i.ytimg.com/vi/f7kPSYWU1JA/default.jpg,False,False,False,Live stream
10794,gA-NDZb29I4,2018-01-07,Justin Timberlake - Filthy (Official Video),justintimberlakeVEVO,10,2018-01-05 05:00:01+00:00,"Filthy|""Justin Timberlake""|""Pop""|""RCA Records Label""",9583159,190740,41411,23746,https://i.ytimg.com/vi/gA-NDZb29I4/default.jpg,False,False,False,Man Of The Woods – An Album By Justin Timberlake - February 2nd – Pre-Order Now:\niTunes - http://smarturl.it/jMOTW/itunes?IQid=yt\nAmazon - http://smarturl.it/jMOTW/az?IQid=yt\nSpotify Pre-Save - http://smarturl.it/jMOTW/spotifypresave?IQid=yt\nTarget - http://smarturl.it/jMOTW/target?IQid=yt \nGoogle Play - http://smarturl.it/jMOTW/googleplay?IQid=yt \nMore Options - http://smarturl.it/jMOTW?IQid=yt\n\nStream “Filthy”:\nApple Music - http://smarturl.it/jFILTHY/applemusic?IQid=yt\nSpotify - http://smarturl.it/jFILTHY/spotify?IQid=yt\nAmazon Music - http://smarturl.it/jFILTHY/az?IQid=yt\nDeezer - http://smarturl.it/jFILTHY/deezer?IQid=yt\n\nFollow Justin Timberlake:\nWebsite: https://www.justintimberlake.com/\nFacebook: https://www.facebook.com/justintimberlake \nTwitter: https://twitter.com/jtimberlake\nInstagram: https://www.instagram.com/justintimberlake/\nSpotify: http://smarturl.it/JTimberlakeSpotify
10797,hU_oxkN9wsw,2018-01-07,Keyshia Cole Would F*** Up Nick Cannon's Car | Wild 'N Out | #Wildstyle,MTV,17,2018-01-05 05:00:00+00:00,"mtv|""video""|""online""|""official""|""tv""|""television""|""watch""|""Wild 'N Out""|""Nick Cannon""|""freestyle""|""comedy""|""improv""|""comedians""|""battle""|""Anthony""|""Chico""|""Conceited""|""DC Young Fly""|""DJ D-Wrek""|""Darren Brand""|""DeRay Davis""|""Hitman Holla""|""Karlous Miller""|""Matt Rife""|""Justina Valentina""|""Obama""|""St. Nick""|""Christmas""|""Holidays""|""Santa Claus""|""Serayah""|""wildstyle""|""Santa""|""Season 10""|""actress""|""model""|""Empire""|""Tiana Brown""|""Keyshia Cole""|""Smokepurpp""",861390,24479,273,1304,https://i.ytimg.com/vi/hU_oxkN9wsw/default.jpg,False,False,False,"Things get heated between Keyshia Cole and Nick Cannon on this week’s Wildstyle. \n\n#MTV #WildNOut #WNO \n\nSubscribe to MTV: http://goo.gl/NThuhC\n\nWild 'N Out is your home for freestyle comedy. Watch as Nick Cannon and an A-list celebrity lead a team of improv comedians in a battle to see who’s the best.\n\nMore from MTV:\nOfficial MTV Website: http://www.mtv.com/\nLike MTV: https://www.facebook.com/MTV\nFollow MTV: https://twitter.com/MTV\nMTV Google+: http://goo.gl/OGY79b\nMTV on Tumblr: http://mtv.tumblr.com/\nMTV Instagram: http://instagram.com/mtv\nMTV on Pinterest: http://www.pinterest.com/mtv/\n\n#MTV is your destination for the hit series Wild 'N Out, Siesta Key, The Challenge, MTV Floribama Shore, Teen Mom and much more!"
10851,iLZwZX39FXU,2018-01-07,Holly Holm vs Cris Cyborg | HIGHLIGHTS | UFC 219,UFC ON FOX,17,2017-12-31 08:09:48+00:00,"ufc|""mma""|""fox sports""|""fox""|""fs1""|""ufc 219""|""holly holm""|""cris cyborg""|""highlights""|""title fight""|""vegas""|""khabib nurmagomedov""|""edson barboza""|""Holly Holm vs Cris Cyborg Breakdown""|""219""|""Nevada""|""Reno""|""Las Vegas""|""highlight""|""move of the fight""|""metro pcs""",3882261,9386,2216,3049,https://i.ytimg.com/vi/iLZwZX39FXU/default.jpg,False,False,False,"The UFC on FOX crew breaks down Cris Cyborg's unanimous decision victory over Holly Holm at UFC 219.\n\nSUBSCRIBE for more from UFC ON FOX: http://foxs.pt/SubscribeUFCONFOX\n\n►Watch the latest content UFC on FOX content: http://foxs.pt/TheLatestonUFCONFOX\n►Watch the latest from UFC Tonight: http://foxs.pt/UFCTonightonUFCONFOX\n►TUF Talk: http://foxs.pt/TUFTalkonUFCONFOX\n \n►FOX Sports YouTube channel: http://foxs.pt/SubscribeFOXSPORTS\n►The Ultimate Fighter’s YouTube channel: http://foxs.pt/SubscribeTUF\n \nAbout UFC ON FOX:\nThe official FOX Sports home of UFC coverage. We see every punch, kick and submission attempt and share it with you, THE FAN. Our talent includes past and current UFC fighters such as Daniel Cormier, Michael Bisping, Dominick Cruz, Kenny Florian, Rashad Evans and more. \n\nUFC ON FOX content includes highlights, press conferences, weigh-ins and analysis from all PPV events and Fight Nights on FOX and FS1. You’ll also find clips from UFC Tonight, UFC Ultimate Insider, The Ultimate Fighter and the best from the top athletes in MMA.\n\nHolly Holm vs Cris Cyborg | HIGHLIGHTS | UFC 219\nhttps://youtu.be/iLZwZX39FXU\n\nUFC ON FOX\nhttps://www.youtube.com/user/UFCONFOXofficial"
10801,iRinktgcrcw,2018-01-07,Half in the Bag Episode 138: 2017 Movie Catch-up (part 1 of 2),RedLetterMedia,24,2018-01-06 14:06:29+00:00,"redlettermedia|""red letter media""|""red""|""letter""|""media""|""plinkett""|""half in the bag""|""mike stoklasa""|""jay bauman""|""rich evans""",291992,14250,209,2338,https://i.ytimg.com/vi/iRinktgcrcw/default.jpg,False,False,False,Mike and Jay talk about a bunch of movies they saw last year. This is only half of them! This video includes discussions of:\n\n(1:09) Split\n(7:48) Kong: Skull Island\n(11:14) I Don't Feel at Home in This World Anymore\n(16:40) Raw\n(18:43) Brad's Status\n(23:25) Ingrid Goes West\n(30:32) War For the Planet of the Apes\n(34:50) The Belko Experiment\n(36:54) Mayhem\n(40:13) Colossal\n(45:27) Wish Upon
10989,ibI5-k5sin8,2018-01-07,Cut for Time: New Year’s Kiss - SNL,Saturday Night Live,24,2017-12-18 18:05:24+00:00,"SNL|""Saturday Night Live""|""SNL Season 43""|""Episode 1734""|""Kevin Hart""|""Beck Bennett""|""Kyle Mooney""|""New Year's Eve""|""s43""|""s43e9""|""episode 9""|""live""|""new york""|""comedy""|""sketch""|""funny""|""hilarious""|""late night""|""host""|""music""|""guest""|""laugh""|""impersonation""|""actor""|""improv""|""musician""|""Jumanji""|""Central Intelligence""|""Ride Along""|""Ride Along 2""|""Grudge Match""|""Get Hard""|""Think Like A Man Too""|""Foo Fighters""|""David Grohl""|""concrete and gold""|""the pretender""|""best of you""|""cut for time""",824072,10451,868,668,https://i.ytimg.com/vi/ibI5-k5sin8/default.jpg,False,False,False,One man (Beck Bennett) searches for his friends (Kyle Mooney) on New Year's Eve.\n\n#SNL #SNL43\n\nGet more SNL: http://www.nbc.com/saturday-night-live\nFull Episodes: http://www.nbc.com/saturday-night-liv...\n\nLike SNL: https://www.facebook.com/snl\nFollow SNL: https://twitter.com/nbcsnl\nSNL Tumblr: http://nbcsnl.tumblr.com/\nSNL Instagram: http://instagram.com/nbcsnl \nSNL Pinterest: http://www.pinterest.com/nbcsnl/
10886,jTyx-Ep_LBg,2018-01-07,Unreal Engine 4 [4.18.1] Diddy Kong Racing 64 + Download link,CryZENx,20,2017-12-30 21:33:54+00:00,[none],68105,1826,91,313,https://i.ytimg.com/vi/jTyx-Ep_LBg/default.jpg,False,False,False,Subscribe ► http://goo.gl/jf55Lc | Patreon Support ► https://www.patreon.com/CryZENx https://www.instagram.com/cryzenx/\nhttps://twitter.com/CryZENx  / \nhttps://www.facebook.com/CryZENx/\n\nSongs by Jukeremix :\nhttps://soundcloud.com/jukeremix\n\nDownload link :\nhttps://drive.google.com/open?id=1ICj5cCz4dFpXKYOQ2OSvsoN7W-y6pXwK\n\nControll list :\nDriving : Arrows\nDrifting : S\n\ngamepad not supporting right now \n\n\n=================== PC HARDWARE SPECS =========================\n╔►CPU: i7-4790K @ 4.8Ghz 1.32Vc + Thermaltake Ultimate 3.0 Watercooler\n╔►GPU: 2x EVGA GTX 1080Ti SLI Founders Edition\n╔►MB: Asrock Z97 Extreme 4\n╔►Ram: 32GB (4x 8192MB) HyperX Savage RED DDR3-2400 DIMM CL11 Quad Kit\n╔►HDD: 1000 GB Sata 3.0 6 Gb/s Harddrive + 2TB hdd\n╔►PSU: EVGA SUPERNOVA 850Watt G2\n╔►Case: NZXT Phantom 630 White Edition
10975,jbeEE0RaEeA,2018-01-07,Spoiler Mode - Star Wars Episode VIII The Last Jedi,Easy Allies,20,2017-12-21 08:34:27+00:00,"Easy Allies|""Star Wars""|""The Last Jedi""|""Episode VIII""|""spoilers""",24982,1063,101,844,https://i.ytimg.com/vi/jbeEE0RaEeA/default.jpg,False,False,False,"After seeing one of the most divisive Star Wars films ever, the allies have lots of opinions. Some of us loved the way it steered the story in a radically new direction, others weren't fans of the humor or sub-plots. Can they find balance?\n\nSupport us through Patreon: https://www.patreon.com/EasyAllies\nSchedule: http://easyallies.com/\nMerchandise: http://shop.spreadshirt.com/easyallies\n\nLive streams - https://www.twitch.tv/easyallies\nStream archives - https://www.youtube.com/easyalliesplays\nhttps://twitter.com/easyallies\nhttps://www.facebook.com/easyallies"
10974,jyTqvjvj8sM,2018-01-07,Home For Christma(saurus)!,Carrie Hope Fletcher,24,2017-12-20 00:32:47+00:00,"carrie hope fletcher|""christmas""|""the addams family""|""singapore""|""travel""|""london""|""shopping""|""vlog""|""christmasaurus""|""tom fletcher""|""giovanna fletcher""|""matt willis""|""busted""|""mcfly""|""mcbusted""|""songs""|""singing""|""acting""|""theatre""|""hammersmith apollo""|""musical theatre""|""family""|""fletchers""",98183,4634,38,221,https://i.ytimg.com/vi/jyTqvjvj8sM/default.jpg,False,False,False,♥ Concert ♥\nclub11.london/chf2018 \n\n♥ Eugenius ♥\nhttp://www.theotherpalace.co.uk\n\n♥ The Hopeful Shop ♥\nhttp://www.thehopefulshop.com\n\n♥ The Christmasaurus ♥\nhttps://www.eventimapollo.com/events/detail/the-christmasaurus-live-on-stage#b5SQlTifHpqlRdkQ.97\n\nAmazon: http://po.st/ChristmasaurusAmazon\nTesco: http://po.st/ChristmasaurusTesco\nWaterstones: http://po.st/ChristmasaurusWaterstones\nWHSmith: http://po.st/ChristmasaurusWHSmith\n \n\n♥ PO Box ♥ \nCarrie Hope Fletcher C/O Helen Clarkson\nHaymarket House\n28-29 Haymarket\nLondon SW1Y 4SP\n\n♥ MY SOCIAL MEDIA ♥\nTwitter: http://twitter.com/Carriehfletcher\nSnapchat: ItsWayPastMyBed\nTumblr: http://www.carriehopefletcher.com\nFacebook: http://www.facebook.com/itswaypastmyb...\nInstagram: http://instagram.com/carriehopefletcher\nBlog: http://www.AllIKnowNow.com\n\n♥ OTHER CHANNELS ♥\nSecond channel: http://www.youtube.com/twentythirtytwo
10802,k2NskGo6x40,2018-01-07,Danielle Bregoli Rejects Logan Paul's Apologies Over Suicide/Hanging Video | TMZ,TMZ,24,2018-01-03 16:00:04+00:00,"TMZ2016FS11221|""TMZ""|""Hollywood""|""Celebrity""|""Entertainment""|""Famous""|""Hollywood News""|""Fame""|""Entertainment News""|""2017TMZ""|""2017""|""danielle bregoli""|""danielle bregoli fight""|""danielle bregoli age""|""danielle bregoli interview""|""danielle bregoli tmz""|""cash me ousside""|""cash me ousside girl""|""cash me ousside how bout dat""|""catch me outside""|""catch me outside girl""|""logan paul""|""logan paul tmz""|""logan paul suicide""|""logan paul video""|""logan paul youtube""|""tmz 2017""|""raw video""",5547553,114335,25427,35208,https://i.ytimg.com/vi/k2NskGo6x40/default.jpg,False,False,False,"Danielle Bregoli thinks Logan Paul should be ashamed of himself for posting a video of a dead man in which Logan appears to laugh at the situation ... and she doesn't accept his apology one bit.\n\nSUBSCRIBE: http://po.st/TMZSubscribe\n\nAbout TMZ:\nTMZ has consistently been credited for breaking the biggest stories dominating the entertainment news landscape and changed the way the public gets their news. Regularly referenced by the media, TMZ is one of the most cited entertainment news sources in the world. \n\nSubscribe to TMZ on YouTube for breaking celebrity news/ gossip and insight from the newsroom staff (TMZ Chatter & TMZ News), the best clips from TMZ on TV, Raw & Uncut TMZ paparazzi video (from TMZ.com) and the latest video from TMZ Sports and TMZ Live! \n\nKeeping Up with Our YouTube Exclusive Content:\nTMZ Chatter: TMZ newsroom staff insight and commentary from stories/ photos/ videos on TMZ.com \nTMZ News: The latest news you need to know from TMZ.com\nRaq Rants: Raquel Harper talks to a celebrity guest with ties to the hip hop and R&B communities.\nBehind The Bar Podcast: TMZ's lawyers Jason Beckerman and Derek Kaufman loiter at the intersection of law and entertainment, where they look closely at the personalities, events and trends driving the world of celebrity — and how the law affects it all.\n\nWe love Hollywood, we just have a funny way of showing it.\n\nNeed More TMZ?\nTMZ Website: http://po.st/TMZWebsite\nLIKE TMZ on Facebook! http://po.st/TMZLike\nFOLLOW TMZ on Twitter! http://po.st/TMZFollow\nFOLLOW TMZ on Instagram! http://po.st/TMZInsta\nTMZ on TV & TMZ Sports on FS1 Tune In Info: http://po.st/TMZOnAir\nTMZ is on iOS! http://po.st/TMZiOS\nTMZ is on Android! http://po.st/TMZonAndroid\n\nGot a Tip?\nContact TMZ: http://po.st/TMZTip\n\nCheck out TMZ Live, TMZ Sports and toofab!\nTMZ Live: http://po.st/TMZLiveWebsite\nSubscribe! TMZ Live: http://po.st/TMZLiveSubscribe\nTMZ Sports: http://po.st/TMZSportsWebsite\nSubscribe! TMZ Sports: http://po.st/TMZSportsSubscribe\nToofab: http://po.st/toofabWebsite\nSubscribe! toofab: http://po.st/toofabSubscribe\n\nhttps://www.youtube.com/c/TMZ"
10837,kQQZ2hje42E,2018-01-07,Cooking With Your Mouth | Christmas Turkey,Nathan C,26,2017-12-23 00:23:13+00:00,"christmas|""turkey""|""stuffing""|""recipe""|""food""|""cooking""|""cooking with your mouth""|""cooking on the frankston line""|""nathan ceddia""|""nowness""|""jamie oliver""|""how to make""|""turkey stuffing""|""gross""|""splosh""|""disgusting""|""shocking""|""yuck""|""raw food""|""feed me""|""spitting""|""chewing with your mouth open""|""sucking""|""licking""|""gaging""|""gage""|""spit""|""egg""|""onion""|""loud eating""|""asmr""|""rezept""|""food fetish""|""sexy lady""|""sexy""|""food porn""|""food tube""|""food hacks""|""food asmr""|""food blog""|""food blogger""|""food documentary""|""food diary""|""food design""",52871,224,245,139,https://i.ytimg.com/vi/kQQZ2hje42E/default.jpg,False,False,False,How to make a Christmas Turkey Stuffing using the safety and comfort of your own mouth.\n\nDirector     Nathan Ceddia               https://www.nathanceddia.com/\nCamera     Nina Raasch                   https://www.ninaraasch.com/\nHost          Riva Godfrey                   https://twitter.com/Riva_Godfrey\nMusic        Haraldur Thrastarson https://www.facebook.com/magneamusic   \nLocation   Blogfabrik Berlin             http://blogfabrik.de/en/
10964,k_JTFUEp7mw,2018-01-07,The Reason Why Kylo Ren Was Shirtless In The Last Jedi,Looper,24,2017-12-19 20:51:58+00:00,"the last jedi|""last jedi""|""star wars last jedi""|""star wars the last jedi""|""last jedi kylo""|""last jedi kylo ren""|""last jedi kylo ren shirtless""|""the last jedi kylo""|""the last jedi kylo ren""|""the last jedi kylo ren shirtless""|""star wars kylo""|""star wars kylo ren""|""star wars last jedi kylo""|""star wars the last jedi kylo""|""star wars kylo ren shirtless""|""star wars last jedi kylo ren shirtless""|""star wars the last jedi kylo ren""|""star wars the last jedi kylo ren shirtless""|""kylo ren shirtless""",690271,8884,703,1936,https://i.ytimg.com/vi/k_JTFUEp7mw/default.jpg,False,False,False,"If you're new, Subscribe! → http://bit.ly/Subscribe-to-Looper\n\nWarning: This Video Contains Spoilers For Star Wars: The Last Jedi\n\nApparently, being locked in a lifelong struggle between the dark and light sides of the Force is really good for your pecs...\n\nRead more here → http://www.looper.com/101228/kylo-ren-shirtless-last-jedi/\n\nStar Wars Lists and Features\nhttps://www.youtube.com/playlist?list=PLOzaghBOlEsdDlwtP3upIeNTZDFISIdM3\n\n10 Star Wars Mistakes That Slipped Right By You\nhttps://youtu.be/4XedBn6wlBE?list=PLOzaghBOlEsdDlwtP3upIeNTZDFISIdM3\n\nThe Lost Star Wars Movie We Never Got To See\nhttps://youtu.be/vrzhi24kijo?list=PLOzaghBOlEsdDlwtP3upIeNTZDFISIdM3\n\nHere's Who Should Play Young Princess Leia\nhttps://youtu.be/jfacwg0uQr4?list=PLOzaghBOlEsdDlwtP3upIeNTZDFISIdM3\n\nWhat Only Die-Hard Fans Know About Darth Vader\nhttps://youtu.be/wvHT9bG2mzE?list=PLOzaghBOlEsdDlwtP3upIeNTZDFISIdM3\n\nThe One Star Wars Scene That Still Makes Mark Hamill Angry\nhttps://youtu.be/jZuqyc_0Tp4?list=PLOzaghBOlEsdDlwtP3upIeNTZDFISIdM3\n\nHow Daisy Ridley Got Ripped For The Last Jedi\nhttps://youtu.be/hjTRR4RGL5o?list=PLOzaghBOlEsdDlwtP3upIeNTZDFISIdM3\n\nWebsite → http://www.looper.com/\nLike us → https://facebook.com/loopermoviestv/\nInstagram → https://instagram.com/looperhq/\n\nLooper is the go-to source for the movies, TV shows and video games we all love. We're addicted to all things superhero and Star Wars, but we're not afraid to binge watch some reality TV when the mood strikes. Whether it's revealing Easter eggs and secrets hidden in your favorite films, exposing movie mistakes, highlighting the best deleted scenes, or uncovering the truth about reality TV's strangest stars, Looper has endless entertainment for the discerning YouTube viewer."
10804,kn073_61fpc,2018-01-07,SOMETHING TO TELL YOU! TRUTHS I LEARNT IN 2017 ad,Patricia Bright,26,2018-01-05 21:27:50+00:00,"online fashion|""best online fashion shops""|""Fenty""|""online store review""|""summer fashion""",182884,12743,230,1309,https://i.ytimg.com/vi/kn073_61fpc/default.jpg,False,False,False,"Ok guys its a new year and today I wanted to share with you some of the things I learnt from 2017, it was a year of highs and lows but many lessons. Hopefully these tips are super useful.\nThanks to Google for sponsoring this video make sure you check out the Google Home mini when you can!\n\nFollow me on instagram - https://www.instagram.com/thepatriciabright/\nTwitter: https://twitter.com/PattyOLovesU\n\nFor business and sponsorship opportunities please contact patstrueworld@gmail.com\n\n* Some links are affiliate, meaning that if you care to purchase any of the products with the link in the description box, I make a small commission, it does not change the price in any way, however it enables me making more content without having to do as many sponsored videos. I am not paid or asked  to use these links."
10884,lE2iJ7ftB_g,2018-01-07,WRESTLE KINGDOM 12 Preview Show : Talking all about January 4th!,NEW JAPAN PRO-WRESTLING,17,2017-12-29 22:43:14+00:00,"young bucks|""nick jackson""|""matt jackson""|""kenny omega""|""the elite""|""bullet club""|""njpw""|""new japan pro wrestling""|""roh""|""ring of honor""|""wrestling""|""tna""|""impact""|""wwe""|""nxt""|""codyrhodes""|""rhodes""|""cody""|""being""|""the""|""elite""|""beingtheelite""|""theelite""|""matthardy""|""brokenhardys""",59037,1840,21,303,https://i.ytimg.com/vi/lE2iJ7ftB_g/default.jpg,False,False,False,"With WRESTLE KINGDOM 12 just 5DAYS away, catch up with Kevin Kelley, Mark Warzecha and Rocky Romero as they review the entire match lineup for the Tokyo Dome spectacular on January 4th! (Filmed on-site in Los Angeles from a secret, yet to be disclosed location.)\n■ Sign up for NJPWWorld▶︎ https://goo.gl/Gd5xvP\n■ Full Card & Tickets info▶︎ https://www.njpw1972.com/wk12/"
10870,lERhNXw6FaQ,2018-01-07,Everything Wrong With Despicable Me 3,CinemaSins,1,2017-12-28 17:47:12+00:00,"despicable me|""despicable me 3""|""everything wrong with""|""eww""|""cinemasins""|""cinema sins""|""movie""|""mistakes""|""review""",2044337,49914,1748,6366,https://i.ytimg.com/vi/lERhNXw6FaQ/default.jpg,False,False,False,"Well, they keep making these things, so we'll keep sinning them. Not that we have much fun doing it, since this movie is awful.\n\nNext week: 2017 adventure sins, & animated sins.\n\nRemember, no movie is without sin! Which movie's sins should we expose next?!\n\nPodcast: http://soundcloud.com/cinemasins\nSins Video Playlist: http://www.youtube.com/watch?v=wy-v4c4is-w&list=PLMWfZxj1nTkQBy4AeRGG4xH5d2IIApNPj\nTweet us: http://twitter.com/cinemasins\nReddit with us: http://reddit.com/r/cinemasins\nTumble us: http://cinema-sins.tumblr.com\nCall us: 405-459-7466\nJeremy's book: http://theablesbook.com"
10937,l_lblj8Cq0o,2018-01-07,"G-Eazy - No Limit REMIX ft. A$AP Rocky, Cardi B, French Montana, Juicy J, Belly",GEazyMusicVEVO,10,2017-12-19 20:00:05+00:00,"BPG/RVG/RCA Records|""G-Eazy feat. A$AP Rocky""|""Cardi B""|""French Montana""|""Juicy J & Belly""|""No Limit REMIX""|""Rap""",64406891,856546,53543,48160,https://i.ytimg.com/vi/l_lblj8Cq0o/default.jpg,False,False,False,New Album ‘The Beautiful & Damned’ Available Everywhere http://smarturl.it/TBAD\nGet exclusive TB&D bundles here: http://smarturl.it/TBAD/officialstore\nSubscribe for more exclusive G-Eazy footage: http://bit.ly/GEazyYTSub\nG-Eazy Official Site: http://g-eazy.com/\nG-Eazy On Twitter: https://twitter.com/G_Eazy\nG-Eazy On Facebook: https://www.facebook.com/G.Eazy\nG-Eazy on Instagram: https://www.instagram.com/g_eazy
10889,lojZXnH_978,2018-01-07,THE LAST JEDI Rant,The Rageaholic,24,2017-12-28 04:06:18+00:00,"The Last Jedi|""Star Wars""|""Luke Skywalker""|""Lucasfilm""|""The Rageaholic""|""RazörFist""",198658,10199,1079,2942,https://i.ytimg.com/vi/lojZXnH_978/default.jpg,False,False,False,The rant is strong with this one.
10962,lwzfPL-rJqA,2018-01-07,The Voice 2017 Brooke Simpson and Sia - Finale: Titanium,The Voice,24,2017-12-20 03:31:17+00:00,"the voice|""the voice nbc""|""the voice season 13""|""watch voice video""|""the voice live finale""|""team adam""|""adam levine""|""team miley""|""miley cyrus""|""team jennifer""|""jennifer hudson""|""team blake""|""blake shelton""|""brooke simpson""|""sia""|""titanium""|""the voice new season""|""The Voice 2017""|""The Voice USA""|""The Voice Season 13""|""The voice winners""|""carson daly""|""the voice auditions""|""NBC""|""tv""",1855250,54255,541,2170,https://i.ytimg.com/vi/lwzfPL-rJqA/default.jpg,False,False,False,"Brooke Simpson and Sia perform Titanium during the live finale.\n» Get The Voice Official App: http://bit.ly/TheVoiceOfficialApp\n» Subscribe for More: http://bit.ly/TheVoiceSub\n» Watch Full Episodes: http://bit.ly/TheVoiceFullEpisodes\n\nTHE VOICE ON SOCIAL:\nLike The Voice: http://Facebook.com/NBCTheVoice\nFollow The Voice: https://Twitter.com/NBCTheVoice\nThe Voice Tumblr: http://nbcTheVoice.Tumblr.com/\nFollow The Voice on Instagram: https://instagram.com/nbcthevoice/\n\nNBC’s The Voice follows the strongest vocalists from across the country and invites them to compete in this season's blockbuster vocal competition.\n\nFind The Voice trailers, full episode highlights, previews, promos, clips, and digital exclusives here.\n\nNBC ON SOCIAL:\nNBC YouTube: http://www.youtube.com/nbc\nLike NBC: http://Facebook.com/NBC\nFollow NBC: http://Twitter.com/NBC\nNBC Tumblr: http://nbctv.tumblr.com/\nNBC Google+: https://plus.google.com/+NBC/posts\nNBC Instagram: http://instagram.com/nbc\n\nABOUT THE VOICE\nThe Voice 2017 USA YouTube channel features exclusive content with The Voice coaches, highlights from The Voice auditions, interviews with The Voice winners, as well as The Voice recaps and results. Learn more about The Voice contestants, The Voice tour, the eliminations, and follow your favorite performers all the way to the finale. In season 13, Jennifer Hudson joins returning coaches Adam Levine, Blake Shelton, and welcomes back Miley Cyrus as celebrity musician coaches, while Carson Daly continues to serve as host. The show’s innovative format features five stages of competition: the first begins with the blind auditions, followed by the battle rounds, the knockouts, the live playoffs and finally, the live performance shows.\n\nThe Voice 2017 Brooke Simpson and Sia - Finale: Titanium\nhttps://youtu.be/lwzfPL-rJqA\n\nThe Voice\nhttp://www.youtube.com/user/nbcthevoice"
10807,mBrdEYW0Vno,2018-01-07,Charlie Puth - If You Leave Me Now (feat. Boyz II Men) [Official Audio],Charlie Puth,10,2018-01-04 18:10:57+00:00,"Charlie Puth|""If You Leave Me Now""|""Boyz II Men""|""Charlie Puth - If You Leave Me Now""|""If You Leave Me Now - Charlie Puth""|""If You Leave Me Now (feat. Boyz II Men) - Charlie Puth""|""Charlie Puth - If You Leave Me Now (feat. Boyz II Men)""|""Boyz 2 Men""|""Boys 2 Men""|""Boys II Men""|""If You Leave Me Now feat. Boyz II Men""|""If You Leave Me Now Charlie Puth""|""Charlie Puth If You Leave Me Now""|""If You Leave Me Now by Charlie Puth""|""puth if you leave me now""|""puth leave me now""|""charlie leave me""",2389842,136074,2038,8261,https://i.ytimg.com/vi/mBrdEYW0Vno/default.jpg,False,False,False,Download & Stream If You Leave Me Now: https://Atlantic.lnk.to/IYLMNID\n\nPre-Order: Voicenotes: https://Atlantic.lnk.to/VoicenotesID\n\nExclusive VoiceNotes Merchandise Bundles Available Here: http://smarturl.it/VoiceNotesD2CYT\n\nFollow Charlie:\nhttp://www.charlieputh.com \nhttp://www.twitter.com/charlieputh \nhttp://www.facebook.com/charlieputh \nhttp://www.instagram.com/charlieputh
