id,video_id,trending_date,title,channel_title,category_id,publish_time,tags,views,likes,dislikes,comment_count,thumbnail_link,comments_disabled,ratings_disabled,video_error_or_removed,description
10958,XQ0sKCp_NZA,2018-01-07,Pitch Perfect 3 Cast Recaps The First Two Pitch Perfect Movies in 7 Minutes | Vanity Fair,Vanity Fair,24,2017-12-21 21:31:00+00:00,"pitch perfect|""pitch perfect 2""|""pitch perfect 3""|""anna kendrick""|""rebel wilson""|""brittany snow""|""anna camp""|""chrissie fit""|""hana mae lee""|""ester dean""|""the bellas pitch perfect""|""the barden bellas""|""pitch perfect 3 cast""|""pitch perfect 3 movie""|""pitch perfect recap""|""pitch perfect 2 recap""|""pitch perfect 3 interview""|""pitch perfect 3 preview""|""pitch perfect 3 sneak peek""|""pitch perfect bellas""|""vanity fair""|""vanity fair magazine""|""vf""",505044,10823,121,387,https://i.ytimg.com/vi/XQ0sKCp_NZA/default.jpg,False,False,False,"The Pitch Perfect 3 cast comprised of Anna Kendrick, Rebel Wilson, Brittany Snow, Anna Camp, Chrissie Fit, Hana Mae Lee, and Ester Dean get you up to speed on The Barden Bellas with this quick recap of Pitch Perfect and Pitch Perfect 2 in seven minutes. Pitch Perfect 3 in theaters December 22.\n\nStill haven’t subscribed to Vanity Fair on YouTube? ►► http://bit.ly/2z6Ya9M\n\nABOUT VANITY FAIR\nArts and entertainment, business and media, politics, and world affairs—Vanity Fair’s features and exclusive videos capture the people, places, and ideas that define modern culture. \n\nPitch Perfect 3 Cast Recaps The First Two Pitch Perfect Movies in 7 Minutes | Vanity Fair"
10931,XcSMdhfKga4,2018-01-07,Mamma Mia! Here We Go Again - Trailer,Universal Pictures,24,2017-12-21 08:30:22+00:00,"Mamma Mia|""Mamma Mia 2""|""Mamma Mia Movie""|""Mamma Mia Musical""|""Meryl Streep""|""Mamma Mia Trailer""|""Mamma Mia Movie Trailer""|""Amanda Seyfried""|""cher""|""colin firth""|""lily james""|""Christine Baranski""|""Pierce Brosnan""|""Stellan Skarsgard""|""Dame Julie Walters""|""Andy Garcia""|""Colin Firth""|""Dominic Cooper""|""Jeremy Irvine""|""Alexa Davies""|""Josh Dylan""|""Hugh Skinner""|""Jessica Keenan Wynn""|""Judy Craymer""|""ABBA""|""Dancing Queen""",4264309,48946,4264,4445,https://i.ytimg.com/vi/XcSMdhfKga4/default.jpg,False,False,False,"Mamma Mia, here we go again! Watch the first trailer for #MammaMia2, coming to theaters summer 2018. \n--\nFacebook:http://po.st/MM2FB\nTwitter: http://po.st/MM2TW\nInstagram: http://po.st/MM2IG \nWebsite: http://www.mammamiamovie.com/\n--\nGet ready to sing and dance, laugh and love all over again.\n\nTen years after Mamma Mia! The Movie grossed more than $600 million around the world, you are invited to return to the magical Greek island of Kalokairi in an all-new original musical based on the songs of ABBA.  With the film’s original cast returning and new additions including Lily James (Cinderella, Baby Driver), the musical comedy will open on July 20, 2018.\n\nMamma Mia! Here We Go Again is produced by Judy Craymer and Gary Goetzman, producers of the original film.  Craymer is also the creator and producer of the worldwide smash-hit stage musical.  \n\nOl Parker, writer of The Best Exotic Marigold Hotel, writes and directs the sequel from a story by Catherine Johnson, Richard Curtis and Parker.  Benny Andersson and Björn Ulvaeus return to provide music and lyrics and serve as executive producers.  Tom Hanks, Rita Wilson, Phyllida Lloyd, Richard Curtis and Nicky Kentish Barnes also serve as executive producers.\n\nReprising their roles from Mamma Mia! The Movie are Academy Award® winner Meryl Streep as Donna, Julie Walters as Rosie and Christine Baranski as Tanya.  Amanda Seyfried and Dominic Cooper reunite as Sophie and Sky, while Pierce Brosnan, Stellan Skarsgård and Oscar® winner Colin Firth return to play Sophie’s three possible dads: Sam, Bill and Harry.\n\nAs the film goes back and forth in time to show how relationships forged in the past resonate in the present, James will play the role of Young Donna.  Filling the roles of Young Rosie and Young Tanya are Alexa Davies (A Brilliant Young Mind) and Jessica Keenan Wynn (Broadway’s Beautiful).  Young Sam will be played by Jeremy Irvine (War Horse), while Young Bill is Josh Dylan (Allied) and Young Harry is Hugh Skinner (Kill Your Friends)."
10898,XvondF0gfro,2018-01-07,Top 10 BEST Movies 2017,Jeremy Jahns,24,2017-12-26 14:00:04+00:00,"Top 10|""best movies""|""2017""|""favorite""|""logan""|""top 10 best movies 2017""|""movie""|""review""|""Awesometacular""|""jeremy jahns""",1143450,43302,2677,10013,https://i.ytimg.com/vi/XvondF0gfro/default.jpg,False,False,False,"The 2017 movie going year comes to an end, so here's my list of the TOP 10 BEST MOVIES OF 2017!\n\n\nSee more videos by Jeremy here: http://www.youtube.com/user/JeremyJahns\n\nFollow Jeremy on Twitter: https://twitter.com/JeremyJahns\n\nFriend Jeremy on Facebook: http://www.facebook.com/RealJeremyJahns"
10849,YfWSMMPnTiI,2018-01-07,How Timbaland Revolutionized R&B + Hip-Hop and then Reinvented Himself After Addiction | Blueprint,Complex,24,2018-01-01 16:00:02+00:00,"sneakerhead|""complex""|""complex originals""|""sneakers""|""news""|""entertainment""|""current affairs""|""young man""|""culture""|""cool""|""edgy""|""funny""|""complex tv""|""complex media""|""Timbaland""|""Missy Elliott""|""GInuwine""|""Jay-Z""|""Jimmy Iovine""|""noah callahan-bever""|""blueprint the show""|""music labels""|""music business""|""hip-hop""|""blueprint""|""interview""|""music""|""hip hop""|""r&b""|""music producer""|""justin timberlake""",265147,7221,323,849,https://i.ytimg.com/vi/YfWSMMPnTiI/default.jpg,False,False,False,"A master of rhythm and melody, Timbaland always knew he had a gift when it came to music. He'd put it to good use in producing a number of groundbreaking works for the likes of Missy Elliott, Ginuwine, Jay-Z and Justin Timberlake. But with fame came delusion and addiction, which trumped his extreme talent. Now, sober and revitalized, Timb has fallen in love with the art form again and set his sights on a new goal: create a classic that will mark the next chapter in his career, just as Quincy Jones did with Thriller. \n\nSubscribe to Complex on YouTube: https://goo.gl/43ac5w\nCheck out more of Complex here:\nhttp://www.complex.com\nhttps://twitter.com/Complex\nhttps://www.facebook.com/complex\nhttp://instagram.com/complex\nhttps://plus.google.com/+complex/\n\nCOMPLEX is a community of creators and curators, armed with the Internet, committed to surfacing and sharing the voices and conversations that define our new America. Our videos exemplify convergence culture, exploring topics that include music, sneakers, style, sports and pop culture through original shows and Complex News segments. Featuring your favorite celebrities, authoritative commentary, and a unique voice, our videos make culture pop."
10856,Z5UcSC2lWQ0,2018-01-07,15 BOOKS I READ IN 2017 | MY RECOMMENDATIONS,Estée Lalonde,22,2017-12-31 17:00:08+00:00,"essiebutton|""Estée Lalonde""|""Estee Lalonde""|""Essie Button""|""Essie""|""No Makeup Makeup""|""Drugstore Makeup Tutorial""|""Makeup Tutorials""|""Outfit Ideas""|""Natural Makeup""|""Skin Care Products""|""Best Makeup""|""book recommendation""|""book""|""best books""|""2017""|""read""|""new year""|""resolution""|""reading""|""rupi kaur""|""a little life""|""review""|""when breath becomes air""|""milk and honey""|""the sun and her flowers""|""oprah""|""what i know for sure""|""life lesson""|""self help""|""meditation""|""wellness""|""joan didion""|""durga chew bose""",95883,5600,73,487,https://i.ytimg.com/vi/Z5UcSC2lWQ0/default.jpg,False,False,False,Read my 2017 book related posts! \n-\nhttp://www.esteelalonde.com/summer-reading-list/\n-\nhttp://www.esteelalonde.com/books-reading-list/\n\n_______________\n\nA LITTLE LIFE - HANYA YANAGIHARA \nhttp://amzn.to/2AXDB1F\n\nWHEN BREATH BECOMES AIR - PAUL KALANITHI \nhttp://amzn.to/2AE7nEl\n\nMILK AND HONEY - RUPI KAUR\nhttp://amzn.to/2yJt9oD\n\nTHE SUN AND HER FLOWERS - RUPI KAUR\nhttp://amzn.to/2AIPNyY\n\nTOO MUCH AND NOT THE MOOD - DURGA CHEW-BOSE\nhttp://amzn.to/2yJ34WJ\n\nTHE YEAR OF MAGICAL THINKING - JOAN DIDIONhttp://amzn.to/2j64KEh\n\nMEN WITHOUT WOMEN - HARUKI MURAKAMI\nhttp://amzn.to/2CHrWS1\n\nEXIT WEST - MOHSIN HAMID \nhttp://amzn.to/2CHeo8X\n\nHOW TO STOP TIME - MATT HAIG\nhttp://amzn.to/2AXE4kz\n\nTHE KITE RUNNER - KHALED HOSSEINI \nhttp://amzn.to/2CHdrgT\n\nSWEETBITTER - STEPHANIE DANLER\nhttp://amzn.to/2j7OhiX\n\nWHAT I KNOW FOR SURE - OPRAH WINFREY\nhttp://amzn.to/2CHYMlC\n\nTHE GIRLS - EMMA CLINE\nhttp://amzn.to/2k1u9Qm\n\n-\n\nI FORGOT TO MENTION: \n\nSTAY WITH ME - AYÒBÁMI ADÉBÁYÒ\nhttp://amzn.to/2CJSe5V\n\nTHE MOTHERS - BRIT BENNETT\nhttp://amzn.to/2keJ49O\n\nAUTUMN - ALI SMITH \nhttp://amzn.to/2CJFZXh\n\n_______________\n\nWHAT I WORE\n\nWHITE FRILLY TOP\n(Similar) http://bit.ly/2kH0YBK\n\nGOLD NECKLACE\nhttp://bit.ly/2kHd6m0\n\nHOOP EARRINGS\nhttps://blondesolace.com/\n\nGOLD RING \nhttp://bit.ly/2z5yyv3\n\nGOLD BRACELET\nhttp://bit.ly/2keJ75I\n\nLIPSTICK 'Natural Rose' \nhttp://bit.ly/2keymQV\n\nFENTY LIP GLOSS \nhttp://bit.ly/2keJRb0\n\nLANCÔME MONSIEUR BIG MASCARA  \nhttp://bit.ly/2kHEvEq\n\n_______________\n\nMY LINKS »\nSECOND CHANNEL → http://www.youtube.com/EverydayEstee\nWEBSITE → http://www.esteelalonde.com/\nTWITTER → http://twitter.com/EsteeLalonde\nINSTAGRAM → http://www.instagram.com/EsteeLalonde\nFACEBOOK → https://www.facebook.com/EsteeLalonde\nTUMBLR → http://esteelalonde.tumblr.com/\nPINTEREST → https://www.pinterest.com/esteelalonde\n\nSUBSCRIBE TO ASLAN→https://www.youtube.com/user/theworktop\nASLAN’S INSTAGRAM→https://www.instagram.com/li0nsmane/\n\n___________\n\n\nI have a brand new PODCAST! \n👉🏼 Radio Wolfgang: http://wolfga.ng/tattoOs\n👉🏼 iTunes: http://wolfga.ng/taTtoos\n👉🏼 Audioboom: http://wolfga.ng/tAttoos\n👉🏼 Stitcher: http://bit.ly/2fRfpl8\n👉🏼  Spotify: http://spoti.fi/2fypeYm\n👉🏼 My Blog: http://www.esteelalonde.com/podcast/\n\nSTAY UP TO DATE WITH US ON SOCIAL MEDIA! \n\nINSTAGRAM: https://www.instagram.com/theheartofi...\nTWITTER: https://twitter.com/THEHEARTOFITPOD\nFACEBOOK: https://www.facebook.com/theheartofit/\n\n_______________\n\nThis video is not sponsored. Some of the above links may be affiliate links.
10986,ZQ8ir66M5XU,2018-01-07,Roz Rants Against 'The Last Jedi' | STAR WARS,ET Canada,24,2017-12-18 20:42:02+00:00,"entertainment|""news""|""et canada""|""review""|""reaction""|""the last jedi""|""star wars""|""laura dern""|""carrie fisher""|""leia flying""|""the force""|""luke tossing lightsaber""|""luke skywalker""|""yoda""|""rey's parents""",403283,22630,1625,5336,https://i.ytimg.com/vi/ZQ8ir66M5XU/default.jpg,False,False,False,"Now that they've both seen Star Wars: The Last Jedi, Roz Weston tells Graeme O'Neil all his issues with the latest installment. Do you agree? SPOILERS AHEAD\n \nSUBSCRIBE to our channel:\n\nhttps://www.youtube.com/user/ETCanadaOfficial\n\nFOLLOW us here:\n\nhttp://www.etcanada.com\n\nFacebook: https://www.facebook.com/etcanada\n\nTwitter: http://www.twitter.com/etcanada\n\nInstagram: http://www.instagram.com/etcanada\n\nSnapchat: https://www.snapchat.com/add/etcanada"
10845,ZdtobM01EHM,2018-01-07,"HUNCHO JACK, Travis Scott, Quavo - Eye 2 Eye (Audio) ft. Takeoff",HunchoJackVEVO,10,2017-12-29 05:00:03+00:00,"Huncho|""Jack""|""Travis""|""Scott""|""Quavo""|""Eye""|""Quality""|""Control""|""Music""|""LLC""|""Hip""|""Hop""",217212,2972,76,98,https://i.ytimg.com/vi/ZdtobM01EHM/default.jpg,False,False,False,"Get the new album from Huncho Jack (Quavo & Travis Scott) here: https://HunchoJack.lnk.to/HJJHYD\n\nFollow Quavo:\nhttps://www.instagram.com/quavohuncho/\nhttps://twitter.com/QuavoStuntin\nhttps://www.instagram.com/migos/\nhttps://twitter.com/Migos\nhttps://www.facebook.com/THEMigosAtl/\n\nFollow Travis Scott:\nhttps://www.instagram.com/travisscott/\nhttps://twitter.com/trvisxx\nhttps://www.facebook.com/travisscottlaflame/\n\nMusic video by Huncho Jack, Travis Scott, Quavo performing Eye 2 Eye. (C) 2017 Quality Control Music, LLC and UMG Recordings, Inc.\n\nhttp://vevo.ly/dAmU0A"
10872,ZzO3DCW4LXw,2018-01-07,All 50+ times Mark Hamill tried to subtly warn us about last jedi/force awakens and bashed Disney,Red boy,22,2017-12-28 21:46:18+00:00,"mark hamill warned us last jedi|""mark hamill not happy with star wars""|""mark hamill regrets""|""mark hamill new star wars""|""mark hamill on star wars episode 8""|""mark hamill hates the force awakens""|""mark hamill last jedi interview""",362619,9543,666,3373,https://i.ytimg.com/vi/ZzO3DCW4LXw/default.jpg,False,False,False,"Mark Hamill regrets everything he said about not being happy with star wars the last jedi, saying he regrets having said anything. He now says the film is an all time great which is suspiciously counter to everything he's said in the past about the new star wars films. If anything Hamill has always come off like he hates the force awakens and the last jedi in countless press screenings, and interviews etc...It has seemed as if hamill was trying to warn us? Is this real regret or an order from the heads of disney?? I have 50+ clips that support the latter...\n\n\n\n\n\n\nCopyright Disclaimer - Under Section 107 of the Copyright Act 1976, allowance is made for fair use for purposes such as criticism, comment, news reporting, teaching, scholarship, and research. Fair use is a use permitted by copyright statute that might otherwise be infringing. Non-profit, educational or personal use tips the balance in favor of fair use.\n\n\n\n\n\n\n\nParts of this video was made with the site pixton.com check it out"
10939,_t0LX_Of33U,2018-01-07,FLOBOTS RESPOND TO LOGAN PAUL NO HANDLEBARS,Flobots,10,2017-12-20 23:16:01+00:00,"logan paul|""flobots""|""handlebars""|""no handlebars""|""nohandlebars""|""disstrack""|""response track""|""rap""|""hip-hop""|""battle""|""misogyny""|""metoo""|""parody""|""satire""|""handle bars""|""no handle bars""|""bike song""|""bike""|""music""|""logan""|""paul""|""jonny 5""|""jonny5""|""flowbots""|""johhny""|""#metoo""|""hiphop""",1916164,172545,4297,14424,https://i.ytimg.com/vi/_t0LX_Of33U/default.jpg,False,False,False,"► FLOBOTS RESPOND TO LOGAN PAUL “NO HANDLEBARS”\n► “Handle Your Bars” Track: https://soundcloud.com/flobotsofficial/flobots-handle-your-bars-1\n\n► Flobots Merch Holiday Sale stores.portmerch.com/flobots/\n\nLyrics: Jonny 5\nAdditional vocals: The Miracle Sisters (Lady Larea & Chrissy G)\nFIND FLOBOTS ON:\nINSTAGRAM: https://www.instagram.com/flobotsmusic/\nTWITTER: https://twitter.com/flobots\nFACEBOOK: https://www.facebook.com/theflobots\n\nWatch the Original Video for “Handlebars” \n► https://www.youtube.com/watch?v=HLUX0y4EptA\n\nFlobots On Tour -- tickets @ https://www.flobots.com\n12.31 Marquis Theater Denver, CO\n1.9 Waiting Room Omaha, NE +\n1.10 Turf Club St. Paul, MN +\n1.11 City Winery Chicago, IL\n1.12 Bell's Eccentric Cafe Kalamazoo Ave +\n1.13 HiFi Indianapolis, IN +\n1.14 Magic Bag Theatre Ferndale, MI +\n1.16 Beachland Ballroom Cleveland, OH\n1.17 Horseshoe Tavern Toronto, ON +\n1.18 The Haunt Ithaca, NY +\n1.19 Debonair Music Hall Teaneck, NJ +\n1.20 Coda Philadelphia, PA +\n1.21 Rough Trade New York, NY +\n1.23 Rex Theater Pittsburgh, PA ^\n1.24 Skully's Music Diner Columbus, OH ^\n1.25 Headliners Music Hall Louisville, KY ^\n1.26 The Grey Eagle Asheville, NC ^\n1.27 Southgate House Revival Newport, KY ^\n+ w/ special guest Tropidelic\n^ w/ special guest McLovins\n\nTo use this video in a commercial player or in broadcasts, please email licensing@storyful.com"
10938,aeMv9uKpAZg,2018-01-07,Bitcoin Commercial: What Is It and How Does It Work?,Late Night with Seth Meyers,23,2017-12-22 11:00:00+00:00,"Late Night|""Seth Meyers""|""Bitcoin""|""Commercial""|""What Is It and How Does It Wor""|""NBC""|""NBC TV""|""television""|""funny""|""talk show""|""comedy""|""humor""|""stand-up""|""parody""|""snl seth meyers""|""host""|""promo""|""seth""|""meyers""|""weekend update""|""news satire""|""satire""|""cryptocurrency""|""litecoin""|""internet""|""central bank""|""cryptography""|""block chain""|""stocks""|""satoshi nakamoto""",448774,8300,198,625,https://i.ytimg.com/vi/aeMv9uKpAZg/default.jpg,False,False,False,"Seth takes a moment to share a commercial he recently saw that explains what Bitcoin is and how it works.\n» Subscribe to Late Night: http://bit.ly/LateNightSeth\n» Get more Late Night with Seth Meyers: http://www.nbc.com/late-night-with-seth-meyers/\n» Watch Late Night with Seth Meyers Weeknights 12:35/11:35c on NBC.\n\nLATE NIGHT ON SOCIAL\nFollow Late Night on Twitter: https://twitter.com/LateNightSeth\nLike Late Night on Facebook: https://www.facebook.com/LateNightSeth\nFind Late Night on Tumblr: http://latenightseth.tumblr.com/\nConnect with Late Night on Google+: https://plus.google.com/+LateNightSeth/videos\n\nLate Night with Seth Meyers on YouTube features A-list celebrity guests, memorable comedy, and topical monologue jokes.\n\nNBC ON SOCIAL \nLike NBC: http://Facebook.com/NBC\nFollow NBC: http://Twitter.com/NBC\nNBC Tumblr: http://NBCtv.tumblr.com/\nNBC Pinterest: http://Pinterest.com/NBCtv/\nNBC Google+: https://plus.google.com/+NBC\nYouTube: http://www.youtube.com/nbc\nNBC Instagram: http://instagram.com/nbctv\n\nBitcoin Commercial: What Is It and How Does It Work?- Late Night with Seth Meyers\nhttps://youtu.be/aeMv9uKpAZg\n\n\nLate Night with Seth Meyers\nhttp://www.youtube.com/user/latenightseth"
10908,agmPDVtPEc8,2018-01-07,"Hideo Itami vs. Gentleman Jack Gallagher: WWE 205 Live, Dec. 26, 2017",WWE,17,2017-12-27 04:18:22+00:00,"wwe|""world wrestling entertainment""|""wrestling""|""wrestler""|""wrestle""|""superstars""|""कुश्ती""|""पहलवान""|""डब्लू डब्लू ई""|""मैच""|""सुपरस्टार""|""व्यावसायिक कुश्ती""|""مصارعه""|""WWE 205 Live""|""Hideo Itami""|""Gentleman Jack Gallagher""|""jack""|""itami""|""gallagher""|""gentleman""|""hideo""|""205""|""#205live""|""cruiserweights""|""205 live""|""wwe 205""|""cruiserweight""|""205 live winners""|""wwe 205 live results""|""205 wwe""|""205 live highlights""|""wwe 205 highlights""|""highlights""|""wwe 205 live highlights""|""205 live clips""|""205 live match""|""jack gallagher""",123006,2379,166,294,https://i.ytimg.com/vi/agmPDVtPEc8/default.jpg,False,False,False,"After The Brian Kendrick sustained an injury during his battle with Hideo Itami on Raw, Gentleman Jack Gallagher aims to unleash his own cruelty on the Japanese Superstar.\nGet your first month of WWE Network for FREE: http://wwenetwork.com\nSubscribe to WWE on YouTube: http://bit.ly/1i64OdT\nVisit WWE.com: http://goo.gl/akf0J4\nMust-See WWE videos on YouTube: https://goo.gl/QmhBof"
10948,alRtHXnZMOI,2018-01-07,The Ginger Ed Man,Spotify,10,2017-12-20 17:02:12+00:00,"spotify|""free""|""music""|""ed sheeran""|""ed""|""sheeran""|""teddy""|""teddys photos""|""gingerbread""|""cookies""|""cute""|""funny""|""comedy""|""holidays""|""happy holidays""|""christmas""",953106,4412,195,302,https://i.ytimg.com/vi/alRtHXnZMOI/default.jpg,False,False,False,"Congratulations to Ed Sheeran, the most-streamed artist of 2017. Listen to all the year's top hits at http://spotify.com/2017"
10946,ao7JzzfIqVE,2018-01-07,My Conversation With Theorist Shane Dawson,Bobby Burns,24,2017-12-20 20:14:49+00:00,"film|""movie""|""review""|""bobby""|""burns""|""teenage""|""funny""|""comedy""|""2016""|""youtube""|""My Conversation With Shane Dawson""|""youtuber""|""talking""|""nathan burns""|""shane dawson""|""theory""|""vlogger""|""2017""",1861666,130157,3128,13116,https://i.ytimg.com/vi/ao7JzzfIqVE/default.jpg,False,False,False,New Merch Here: https://www.thebobbyburns.com/\nNathan's Video: https://www.youtube.com/watch?v=cInfbT_uWDA&t=54s\nShane's Video: https://www.youtube.com/watch?v=fcQ-dUkXNFM\nSUPPORT THIS CHANNEL ON PATREON:  https://www.patreon.com/BobbyBurns\nTWITTER: https://twitter.com/thebobbyburns\nINSTAGRAM: http://instagram.com/thebobbyburns\nBusiness Inquires Contact: bobbyburnscontact@gmail.com
