id,video_id,trending_date,title,channel_title,category_id,publish_time,tags,views,likes,dislikes,comment_count,thumbnail_link,comments_disabled,ratings_disabled,video_error_or_removed,description
10875,-3VBPAZPTQI,2018-01-07,NEW YEAR'S EVE MAKEUP TUTORIAL | JAMIE GENEVIEVE,Jamie Genevieve,22,2017-12-29 15:11:23+00:00,"jamie genevieve|""bblogger""|""youtuber""|""makeup""|""tutorial""|""how to""|""vlog""|""makeup tutorial""|""new years eve makeup""|""hogmanay makeup""|""party makeup""|""new years eve makeup tutorial""|""NYE makeup""",372957,15261,298,837,https://i.ytimg.com/vi/-3VBPAZPTQI/default.jpg,False,False,False,"Subscribe and join the fam! http://www.youtube.com/jamiegenevieve\n\nHey guys! Hope you like this makeup tut I made for New Year's Eve, a super glam Jamie G classic. I realised after editing that my body highlight/contour part was a bit crap so I'll film an in-depth version soon. Can't wait to get some different stuff created for you guys in 2018! Huge love to you all. J xxx\n\nPRODUCTS\n\nU Tan And Tone Coconut Water - http://bit.ly/2AShGFI\n\nYSL All Hours Primer - http://bit.ly/2Dx6b6R\n\nYSL All Hours Foundation - http://bit.ly/2CldIGn\n\nTarte Shape Tape - http://tartecosmetics.com/EU/en_GB/shape-tape/shape-tape-contour-concealer/846733016129-UN.html?gclid=CjwKCAiA7JfSBRBrEiwA1DWSG-DORBVsC2LpLQ7QH6CYC_IHZmUZ3W08NiWpk2-ayQae67gUFq6gBRoCQNQQAvD_BwE\n\nMac Laying Low - https://www.maccosmetics.co.uk/product/13840/1573/products/makeup/eyes/eyeshadow/pro-longwear-paint-pot?cm_mmc=GoogleBase-_-ShoppingFeed-_-Eyes-_-Eyeshadow&gclid=CjwKCAiA7JfSBRBrEiwA1DWSG2MDnvEWa7fd8oWY1p5fWoU_8E-HxtmtKlUS6qGVQdeIXAiB0LLYexoCTswQAvD_BwE&gclsrc=aw.ds&dclid=CKDx5J23r9gCFc63GwodR-4BCw#/shade/Layin%E2%80%99_Low\n\nKat Von D Translucent Blotting Powder - http://bit.ly/2Cn9GO1\n\nMAC X Patrick Starrr Setting Powder - http://bit.ly/2DvVL7H\n\nMac Dark Tan Bronzer - https://www.maccosmetics.co.uk/product/13849/30734/products/makeup/face/powder/mineralize-skinfinish-natural?cm_mmc=GoogleBase-_-ShoppingFeed-_-Face-_-Powder&gclid=CjwKCAiA7JfSBRBrEiwA1DWSG9WVX9_mr1F2sA4tvnA0e7GCZ0vjLkX6mp1KJ09AEeHVT2L2B9VBahoCn2sQAvD_BwE&gclsrc=aw.ds&dclid=CMbi9Kq3r9gCFbIw0wodvlEPhQ#/shade/Dark_Tan\n\nKat Von D Shade & Light Palette - http://bit.ly/2DwUq0n\n\nUrban Decay All Nighter Setting Spray - http://bit.ly/2DuTpWo\n\nDose Of Colors Sassy Siennas Palette - http://bit.ly/2CmGir3\n\nTarte Chrome Paint Shadow Pot - http://tartecosmetics.com/EU/en_GB/makeup/eyes/eyeshadow-palettes/chrome-paint-shadow-pot/1109.html\n\nUrban Decay Midnight Cowboy Glitter - http://bit.ly/2Ck3uGh\n\nNYX Glitter - http://bit.ly/2CnGtT0\n\nMac Oh Darling Highlighter - https://www.maccosmetics.co.uk/product/13849/21865/products/makeup/face/powder/extra-dimension-skinfinish#/shade/Glow_With_It\n\nLily Lashes In Mykonos - http://bit.ly/2DwXmdp\n\nTarte Gifted Mascara - https://tartecosmetics.com/EU/en_GB/makeup/eyes/gifted-amazonian-clay-smart-mascara/237.html\n\nGlossier Boy Brow - http://bit.ly/2DwjG6O\n\nBenefit Precisely My Brow Pencil - http://bit.ly/2DweRdz\n\nBleach London Lip Kit - http://bit.ly/2DuUXjk\n\nIconic London Illuminator - http://bit.ly/2Cp6gdt\n\nFAVE EVER BRUSHES\n\nEYES & BROWS\nZoeva Complete Eye Set - http://bit.ly/2uGWKg9\nZoeva 224 - http://bit.ly/2upoieJ\nZoeva Shader - http://bit.ly/2uGJxUZ\nZoeva Pencil - http://bit.ly/2uGl5mD\nMorphe M507 - http://bit.ly/2uppCOJ\nMAC 224 - http://bit.ly/2uGoD88\nDose of Colors Concealer Brush - http://bit.ly/2uGM9lB\nDose of Colors Shader Brush - http://bit.ly/2up6QXU\n\nFACE\nZoeva Complete Face Set - http://bit.ly/2uGUhT6\nZoeva Powder Fusion - http://bit.ly/2uGnL3s\nCharlotte Tilbury Blush Brush - http://bit.ly/2upQazr\nCharlotte Tilbury Powder & Sculpt Brush - http://bit.ly/2uGgXD6\nBlank Canvas Buffing Brush - http://bit.ly/2uGTz8o\nPro Beauty Blender - http://bit.ly/2upF7q9\nMorphe M407 - http://bit.ly/2uH1YJ0\n\nMakeup Artist Starter Set - http://bit.ly/2upOZ35\nSmith Brushes - https://www.smithcosmetics.com/collections/brushes\n\n\nEQUIPMENT\nNew Filming Camera: http://bit.ly/2AlWN5k\nOld Filming Camera (bit cheaper but still good) :  http://bit.ly/2A7iHbG\nPhoto/Vlog Camera: http://bit.ly/2zkiVPh\nComputer: http://bit.ly/2t7EpwJ\nLaptop: http://bit.ly/2s87bs8\nRing Light: http://amzn.to/2kFz36Y\nSoft Boxes: http://amzn.to/2jUzeY0\nEditing Software: Final Cut Pro\n\n\nBE MY FRIEND:\nInstagram - http://www.instagram.com/jamiegenevieve\nTwitter - http://www.twitter.com/jamie_genevieve\nYouTube - http://www.youtube.com/jamiegenevieve\nSnapchat - jamie_genevieve\n\nDISCLAIMER:  Some of the above links are affiliate links, which means that if you click and make a purchase I may receive a small commission. This helps support my channel and allows me to continue to make videos like this! Thank you so much for the support.\n\nThis video was not sponsored.\n\nJ x"
10853,-tjucPZlcgc,2018-01-07,F&F Active | #whatsstoppingyou,F&F Clothing,26,2018-01-01 11:34:32+00:00,"fitness|""active""|""activewear""|""Davina Mccall""",3571,5,49,9,https://i.ytimg.com/vi/-tjucPZlcgc/default.jpg,False,False,False,"What's stopping you this January? We've got everything you need to get up, get out and beat your excuses with the F&F Active range. Seen on Davina Mccall, Naomi Shimada, Fran Bacon, Rachel Peru and Katie Ellison."
10907,-z2EqJTyAiU,2018-01-07,Dimitri Vegas & Like Mike vs Steve Aoki ft Abigail Breslin – We Are Legend,Dimitri Vegas & Like Mike,1,2017-12-26 17:00:13+00:00,"Dimitri Vegas & Like Mike|""Dimitri Vegas""|""Like Mike""|""Tomorrowland""|""Smash The House""|""Tomorrowworld""|""Tomorrowland Brasil""|""EDC""|""UMF""|""TML""|""Electro House""|""Bringing The Madness""|""Madness""|""EDM""|""Electro""",1453683,57193,787,2579,https://i.ytimg.com/vi/-z2EqJTyAiU/default.jpg,False,False,False,"DOWNLOAD THIS TRACK NOW FOR FREE. GO TO  http://chat.dimitrivegasandlikemike.com AND USE THE HASHTAG #WeAreLegend\n\nWhen Dimitri Vegas, Like Mike and Steve Aoki first combined forces for the most epic supergroup ‘3 Are Legend’ in dance music, fans knew that expectations for main stage live spectacles and in-studio tracks that slay would be more than surpassed. From smashing ULTRA Miami to Tomorrowland, Creamfields to Ushuaia Ibiza, their presence explodes and entrances in equal measure and now, as a Christmas thankyou, the unstoppable trio are giving you, their wildest and dearest fans, a free download of their monster collaboration ‘We Are Legend’.\n\nSome fans might even recognise the featured vocalist, Abigail Breslin. The Oscar nominated star of Little Miss Sunshine, who has also appeared in Hollywood movies Zombieland, Signs, Enders Game and was also cast in August: Osage County, the film adaptation of the Pulitzer Prize-winning play of the same name, alongside Julia Roberts, Benedict Cumberbatch and Meryl Streep. Abigail’s collaboration on the track isn’t her first foray into the world of music, releasing her own album ‘The World Now’ back in 2013, but this is her first time being the feature vocalist on a dance record – and it’s fair to say she has completely made this record her own!\n\nFollow Dimitri Vegas & Like Mike on Spotify:\nhttp://dimitrivegasandlikemike.com/spotify\n\nRelive the MADNESS with these exclusive Spotify playlists:\nBringing The Madness Playlist:\nhttp://dimitrivegasandlikemike.com/spotifymadness\nThe Official Tomorrowland Playlist:\nhttp://tomorrowland.com/spotify\nThe Smash The House Radio Playlist:\nhttp://smashthehouse.com/spotify\n\nSubscribe yourself for more Tomorrowland Music on: \nhttps://www.youtube.com/user/SmashTheHouse\n\nFollow us on social media:\nhttp://www.facebook.com/dimitrivegasandlikemike\nhttp://www.twitter.com/dimitrivegas\nhttp://www.twitter.com/likemike\nhttp://www.instagram.com/dimitrivegasandlikemike\nhttp://www.soundcloud.com/dimitrivegasandlikemike\n\nSign up: http://eepurl.com/b3xUuf"
10936,0gv90B5DIPo,2018-01-07,George Lucas Being Blamed for The Last Jedi Backlash,Hybrid Network,24,2017-12-22 22:20:03+00:00,"Hybrid Network|""the last jedi""|""star wars the last jedi""|""the last jedi george lucas""|""the last jedi mark hamill""|""the last jedi critics vs audiences""|""the last jedi ending explained""|""the last jedi fan backlash""|""the last jedi deleted scenes""|""mark hamill hurts""|""george lucas the last jedi""",128538,1614,359,1767,https://i.ytimg.com/vi/0gv90B5DIPo/default.jpg,False,False,False,"The fans have now turned on Star Wars creator George Lucas, regarding the controversial choices made in The Last Jedi.\n\n★Subscribe Here: https://goo.gl/eMyqR8\n\nHelp us make better content by joining our Patreon!\n►https://www.patreon.com/HybridNetwork\n\n\nRoyalty free music provided by bensound.com\n\nConnect with Hybrid Network!\n►Website: https://www.hybridnetworkyt.com\n►Facebook: https://www.facebook.com/HybridNetworkYT \n►Twitter: https://www.twitter.com/HybridNetwork_\n►Soundcloud: https://soundcloud.com/hybridnetworkyt\n\nHybrid Network is a community delivering the best content in pop culture whether it be news, speculation, reviews, podcasts, rumors, & more! We deliver educational & entertaining content leaving each viewer informed on any franchise we cover. Hybrid Network is pop culture annotated. \n\n-------------------------------------------------------------------------------------------------------\n\nCopyright Disclaimer Under Section 107 of the Copyright Act 1976, allowance is made for fair use for purposes such as criticism, comment, news reporting, teaching, scholarship, and research. Fair use is a use permitted by copyright statute that might otherwise be infringing. Non-profit, educational or personal use tips the balance in favor of fair use."
10831,12B8DNBoYRA,2018-01-07,Mad Skillz - Murda Gram (Uncle Murda Diss),Hip Hop N More,10,2018-01-03 17:07:18+00:00,"mad skillz|""mad skillz uncle murda diss""|""mad skillz murda gram""|""uncle murda""|""Mad Skillz - Murda Gram (Uncle Murda Diss)""",89409,1871,100,878,https://i.ytimg.com/vi/12B8DNBoYRA/default.jpg,False,False,False,Mad Skillz - Murda Gram (Uncle Murda Diss)
10816,18thGW1YjRM,2018-01-07,Emmerdale - The New Adam Barton,Emmerdale,24,2018-01-02 20:10:31+00:00,"Emmerdale|""emmerdale adam""|""Emmerdale Belle""|""Emmerdale Aaron""|""Emmerdale Robert""|""emmerdale kiss""|""emmerdale kisses""|""emmerdale fight""|""emmerdale fights""|""emmerdale crash""|""emmerdale crashes""|""Drama - Topic""|""Soaps - Topic""|""Soap Operas - Topic""|""Soap Opera - Topic""",183511,1818,134,0,https://i.ytimg.com/vi/18thGW1YjRM/default.jpg,True,False,False,"Subscribe now for more! http://bit.ly/1Kyx8Ja \n\nNew year, new Adam! As the show must go on, meet the newly re-casted Adam Barton #Emmerdale\n\nLike, follow and subscribe to the official Emmerdale YouTube channel!\n\nWebsite: http://bit.ly/1E5Pc8w \nFacebook: http://on.fb.me/1IPeasP \nTwitter: http://bit.ly/1PahlPe \nInstagram: http://bit.ly/2fjDejU\n\nGet all the latest news from the Emmerdale village on the official YouTube channel and ITV website. You can also watch clips from the show and get previews on new episodes! We'll also have exclusive interviews from the Emmerdale cast, behind the scenes videos and more! Subscribe and make sure you don't miss out.\n\nhttp://www.itv.com\nhttp://www.stv.tv"
10922,1Wo6WEBhBBw,2018-01-07,"Syrian War Report – December 25, 2017: Army Cuts Off Key Militant Supply Line In Beit Jinn Pocket",South Front,25,2017-12-25 14:08:40+00:00,"Syrian War Report|""Syrian War Update""|""Syrian War video""|""Syrian war map""|""Syrian civil war""|""Syrian war""|""Syrian conflict""|""Syrian Army""|""Assad regime""|""Assad forces""|""Assad regime forces""|""Russian intervention in Syria""|""Turkey intervention in Syria""|""Eastern Ghouta""|""Beit Jinn pocket""|""al-Qaeda in Syria""|""Hayat Tahrir al-Sham""",37617,1006,40,230,https://i.ytimg.com/vi/1Wo6WEBhBBw/default.jpg,False,False,False,"If you’re able, and if you like our content and approach, please support the project. Our work wouldn’t be possible without your help: PayPal: southfront@list.ru, http://southfront.org/donate/ or via: https://www.patreon.com/southfront, BTC: 13iYp9CDYZwgSnFXNtpEKgRRqaoxHPr2MH, BCH: 1NE49pQW8yCegnFCMvKuhLUnuxvTnxNUhf, ETH: 0x962b312a9d41620f9aa0d286f9d7f8b1769bfae6\n\nSubscribe our channel!: https://www.youtube.com/channel/UCaV101EM1QayFkP0E7zwXCg?sub_confirmation=1\n\nVisit us: http://southfront.org/\n\nFollow us on Social Media:\nhttps://www.facebook.com/SouthFrontENTwo\nhttps://twitter.com/southfronteng\nhttps://steemit.com/@southfront\n\nOur Infopartners:\nhttp://www.globalresearch.ca/\nhttp://thesaker.is\nhttp://www.sott.net/\nhttp://in4s.net\n\nUnofficial translations of SF videos to Russian: https://www.youtube.com/user/Rom4eggPopov"
10809,24-AhdoN_Nk,2018-01-07,Slender Man Trailer #1 (2018) | Movieclips Trailers,Movieclips Trailers,1,2018-01-03 16:31:18+00:00,"Creepy|""Dark""|""Disturbing""|""Scary""|""Victim""|""Slender Man""|""Slender Man trailer""|""Slender Man movie trailer""|""Slender Man trailer 2018""|""Slender Man official trailer""|""trailer""|""trailers""|""movie trailers""|""2018 trailers""|""Slender Man trailer 1""|""movie clips trailers""|""movie clips""|""fandango""|""Slender Man Sony Pictures""|""Sony Pictures""|""Slender Man Columbia Pictures""|""Columbia Pictures""|""horror""|""slender man joey king""|""slender man julia goldani""|""slender man annalise basso""",973537,15186,3776,4560,https://i.ytimg.com/vi/24-AhdoN_Nk/default.jpg,False,False,False,"Slender Man Trailer #1 (2018): Check out the new trailer starring Joey King, Julia Goldani Telles, and Annalise Basso! Be the first to watch, comment, and share trailers and movie teasers/clips dropping soon @MovieclipsTrailers. \n\n► Buy Tickets: https://www.fandango.com/slender-man-208536/movie-overview?cmp=MCYT_YouTube_Desc\n\nWatch more Trailers: \n► HOT New Trailers Playlist: http://bit.ly/2hp08G1\n► What to Watch Playlist: http://bit.ly/2ieyw8G\n► Even More on COMING SOON: http://bit.ly/H2vZUn\n\nTerror strikes when unsuspecting victims cross paths with a tall, thin, horrifying figure known as the Slender Man.\n\nAbout Movieclips Trailers:\n► Subscribe to TRAILERS:http://bit.ly/sxaw6h\n► We’re on SNAPCHAT: http://bit.ly/2cOzfcy \n► Like us on FACEBOOK: http://bit.ly/1QyRMsE \n► Follow us on TWITTER:http://bit.ly/1ghOWmt \n\nThe Fandango MOVIECLIPS Trailers channel is your destination for hot new trailers the second they drop. The Fandango MOVIECLIPS Trailers team is here day and night to make sure all the hottest new movie trailers are available whenever, wherever you want them."
10925,2cosj7UeQoY,2018-01-07,Cardi B talks on how she wanted to quit rapping when a famous rapper took her verse off his song,Emcee Rapology,10,2017-12-19 09:01:53+00:00,"Cardi b|""Tmz""|""Tmz news""|""Bodak""|""Bodak yellow""|""Nicki minaj""|""Azelia banks""|""Dj khaled""|""Vlad""|""Rap news""|""Young thug""|""Boosie""|""Rap""|""Hot 97""|""Lil kim""|""Da brat""|""The art of dialogue""|""The migos""|""Migos""|""Offset""|""Qua""",183219,1701,526,644,https://i.ytimg.com/vi/2cosj7UeQoY/default.jpg,False,False,False,
10902,2dls8iCoQTI,2018-01-07,Cooking with Marshmello: How To Make Strawberry Santas (Christmas Edition),marshmello,26,2017-12-26 17:00:00+00:00,"marshmello|""marshmallow""|""cooking""|""Cooking with Marshmello: Strawberry Santas (Christmas Edition)""|""how-to cook""|""how to cook""|""christmas cooking""|""santa claus""|""papa noel""|""christmas""|""christmas edition""|""xmas""|""chef""|""chef tips""|""cooking tips""|""silence""|""cooking vlog""|""marshmelllo""|""mellogang""|""take it back""|""holiday cooking""|""xmas cooking""|""santa""|""santas""|""marshmallow santa""|""chocolate santa""|""feliz navidad""|""cooking show""|""маршмеллоу""",942362,49016,1299,3647,https://i.ytimg.com/vi/2dls8iCoQTI/default.jpg,False,False,False,Get your NEW Mello™️ by Marshmello gear HERE ▶ http://shop.marshmellomusic.com\n\nWatch every episode of Cooking with Marshmello HERE ▶ http://youtube.com/playlist?list=PLcYK4PlHbZQtXROf5fnrr4dO4ruWiv7ts\n\nWATCH TAKE IT BACK MUSIC VIDEO ▶ https://youtu.be/P9Ijqa_2eu0\nWATCH SILENCE MUSIC VIDEO ▶ https://youtu.be/Tx1sqYc3qas\nWATCH BLOCKS MUSIC VIDEO ▶ https://youtu.be/5E4ZBSInqUU\nWATCH YOU & ME MUSIC VIDEO ▶ https://youtu.be/fiusxyygqGk\nWATCH FIND ME MUSIC VIDEO ▶ https://youtu.be/ymq1WdGUcw8\nWATCH MOVING ON MUSIC VIDEO ▶ https://youtu.be/yU0tnrEk8H4\nWATCH SUMMER MUSIC VIDEO ▶ https://youtu.be/2vMH8lITTCE\nWATCH ALONE MUSIC VIDEO ▶ https://youtu.be/ALZHF5UqnU4\nWATCH KEEP IT MELLO MUSIC VIDEO ▶ https://youtu.be/_J_VpmXAzqg\n\nSUBSCRIBE HERE ▶ http://youtube.com/marshmellomusic?sub_confirmation=1\n\nMARSHMELLO: \nSpotify | http://spoti.fi/Marshmello\nSoundCloud | http://soundcloud.com/marshmellomusic\nInstagram | http://instagram.com/marshmellomusic\nTwitter | http://twitter.com/marshmellomusic\nFacebook | http://facebook.com/marshmellomusic\nMerch | http://shop.marshmellomusic.com/\n\nCredits:\nAgency: MGX Creative\nDirector: Daniel Malikyar\nDP: Tehillah De Castro\nEditor: Troy Charbonnet\nColorist: Dylan Hagemen\n\nCooking with Marshmello: Strawberry Santas (Christmas Edition)\n#Cooking
10803,2eoEctPNGNw,2018-01-07,Jimmy Ma SP 2018 US Nationals,Yarotska,17,2018-01-05 04:14:04+00:00,[none],319216,1400,86,162,https://i.ytimg.com/vi/2eoEctPNGNw/default.jpg,False,False,False,Score Executed Elements Factored Program Components Deductions\n75.28 39.07 36.21 0.00\n\nJimma Ma Short Program 2018 Prudential U.S. Figure Skating Championships NBC HD 720p60 60fps
10979,2pVHOaT9CZ4,2018-01-07,Sesame Street Puppeteers Explain How They Control Their Puppets | WIRED,WIRED,24,2017-12-18 20:00:24+00:00,"big bird|""elmo""|""jim henson""|""muppets""|""puppets""|""sesame street""|""muppet""|""rudy""|""puppeteering""|""puppeteer""|""abby cadabby""|""mr. snuffleupagus""|""jim henson puppet""|""puppeteers""|""snuffleupagus""|""sesame street bts""|""sesame street behind the scenes""|""how to puppeteer""|""how puppets are controlled""|""how muppets""|""how to puppet""|""how muppets work""|""puppetry""|""puppets explained""|""cast of sesame street""|""cast of sesame st""|""sesame st""|""puppet""|""voices""|""sesame street puppets""|""ss""|""wired""|""wired.com""",467183,14362,161,974,https://i.ytimg.com/vi/2pVHOaT9CZ4/default.jpg,False,False,False,"Ever wonder how the puppets on Sesame Street operate? The puppeteers for some of Sesame Street's most famous characters share their insights on how they bring their iconic characters to life. The puppeteers for Elmo, Big Bird, Mr. Snuffleupagus, Abby Cadabby, and Rudy explain the various functions and features of their Muppets.\n\nYou can catch Snuffy and all his friends in the new season of Sesame Street on HBO or everyday on HBO Family or PBS Kids.\n\nStill haven’t subscribed to WIRED on YouTube? ►► http://wrd.cm/15fP7B7 \n\n\nABOUT WIRED\nWIRED is where tomorrow is realized. Through thought-provoking stories and videos, WIRED explores the future of business, innovation, and culture.\n\nSesame Street Puppeteers Explain How They Control Their Puppets | WIRED"
10921,3ATQvgkXT9E,2018-01-07,"Farruko, Nicki Minaj, Travis Scott - Krippy Kush (Remix) ft. Bad Bunny, Rvssian",FARRUKOVEVO,10,2017-12-22 23:00:01+00:00,"Farruko|""Nicki Minaj""|""Bad Bunny""|""Travis Scott""|""Rvssian""|""Official Video""|""Video Oficial""|""Nuevo Video""|""New Video""|""Krippy Kush (Remix)""|""Krippy Kush (Remix) Official Video""|""Krippy Kush (Remix) Official Remix Video""|""Krippy Kush (Remix) Single""|""Single""|""Krippy Kush (Remix) new song""|""Krippy Kush (Remix) nueva canción""|""nuevo sencillo""|""musica en espanol""|""musica en español""|""nueva balada de Farruko""|""Travis Scott remix""|""travis scott krippy remix""",22919692,487317,58890,33929,https://i.ytimg.com/vi/3ATQvgkXT9E/default.jpg,False,False,False,"The vaporizer used in this Krippy video provided by Mig Vapor vape pen, See it here http://bit.ly/MigVapor_Herb-e\n\nFarruko, Nicki Minaj & Travis Scott feat. Bad Bunny & Rvssian - Krippy Kush (Remix)[Official Music Video]\nKrippy Kush (Remix) is now available!\nLinkfire: https://SML.lnk.to/KrippyKushR\niTunes: http://smarturl.it/KrippyKushR\nApple Music: http://smarturl.it/KrippyKushRa\nSpotify: http://smarturl.it/KrippyKushRs\nAmazon Music: http://smarturl.it/KrippyKushRam\nGoogle Play: http://smarturl.it/KrippyKushRgp\n \nFollow Farruko!\nOfficial Site: http://farruko.com\nFacebook: http://www.facebook.com/FarrukoOfficial\nInstagram: http://www.instagram.com/farrukoofficial\nTwitter: http://twitter.com/FarrukoOfficial\nOfficial Music video by Farruko, Nicki Minaj & Travis Scott feat. Bad Bunny & Rvssian Krippy Kush (Remix). (C) 2017 Sony Music Entertainment US Latin LLC"
10993,3db2XrU3__0,2018-01-07,"Star Wars: The Last Jedi Rant...do or do not, see for yourself",Talk Nerdy With Me,22,2017-12-16 02:28:16+00:00,"star wars|""the last jedi""|""rant""|""nerdy girls""|""movies""|""discussions""|""film""",117970,4323,325,2881,https://i.ytimg.com/vi/3db2XrU3__0/default.jpg,False,False,False,"This is my raw 100% raw opinion on Star Wars: The Last Jedi.\nI live and bleed Star Wars, so this is just my viewpoint on the latest installment. Feel free to comment & we can constructively talk."
10982,3mUtNE82ZV4,2018-01-07,Christian Bale: Division Is Not The Way To Go,BUILD Series,24,2017-12-18 22:25:08+00:00,"AOL Advertising|""BUILDseriesNYC""|""AOL Inc""|""AOL""|""AOLBUILD""|""#Aolbuild""|""build speaker series""|""build""|""aol build""|""content""|""aolbuildlive""|""BUILDSeriesNYC""|""Rosamund Pike""|""2017""|""entertainment""|""Wes Studi""|""RickyC""|""cheyenne""|""chief""|""war""|""horses""|""western""|""drama""|""Rosalie Quaid""|""costar""|""actor""|""actress""|""acting""|""film""|""movie""|""adventure""|""dramatic""|""Chief Yellow Hawk""|""1892""|""Army captain""|""Le Grisbi Productions""|""Waypoint Entertainment""|""Entertainment Studios Motion Pictures""|""stars""|""role""|""Christian Bale""|""Scott Cooper""|""director""|""star""",6277,53,29,33,https://i.ytimg.com/vi/3mUtNE82ZV4/default.jpg,False,False,False,The actor says our culture will be richer when we can stop saying it's old white dudes who are running things.
10832,3pxyo7eSknc,2018-01-07,"THE BEST OF THE BEST 🙌🏽 2017 | FASHION, BEAUTY, NETFLIX etc",Samantha Maria,26,2018-01-03 10:00:00+00:00,"samantha|""maria""|""sammi""|""the""|""best""|""if""|""beautycrush""|""of""|""year""|""2017""",117063,4235,94,199,https://i.ytimg.com/vi/3pxyo7eSknc/default.jpg,False,False,False,My top things from 2017! Hope you enjoy! \nMy Vlog channel! - http://www.youtube.com/thesammimariashow\nMy Blog - http://www.samanthamariaofficial.com\nInstagram - http://instagram.com/samanthamariaofficial\nTwitter - https://twitter.com/samanthamaria \nFacebook - https://www.facebook.com/SammiMaria\nSnapchat - sammi.maria\n\nContact me:\nBusiness & Collaboration Enquiries - Sammi@gleamfutures.com\nPR Enquiries - Beautycrushpersonal@gmail.com\n____________________________________\n\nMY TOP\nSold out but the dress version of my top - Topshop http://bit.ly/2CU0CPM\n\nIN THIS VIDEO\n\nBOOK\nThe subtle art of not giving a f**k - Mark Manson - https://www.amazon.co.uk/Subtle-Art-Not-Giving-Counterintuitive/dp/0062457713/ref=sr_1_1?ie=UTF8&qid=1513887408&sr=8-1&keywords=the+subtle+art+of+not+giving+a+f\n\nFASHION\nBoots - Topshop http://bit.ly/2CS1lAM\nJW Anderson Logo bag http://bit.ly/2CUruif\nTopshop jeans - http://bit.ly/2BMy9vF\n\nHAIR\nOrbe wave & shine spray http://bit.ly/2CRxvwe\nBumble & Bumble Dry oil finishing spray - http://bit.ly/2CTALHF\n\nBODYCARE \nGlossier Body hero body perfecting cream - http://bit.ly/2BL17fl\n\nPERFUME \nJo Malone Peony & Blush suede - https://www.jomalone.co.uk/product/11563/27028/fragrances/the-collections/floral/peony-blush-suede/peony-blush-suede-cologne\n\nMAKEUP \nHourglass vanish foundation stick - http://bit.ly/2BKfIYH\nMarc Jacobs Coconut highlighting gel - http://bit.ly/2BLGIXS\nCharlotte Tilbury pillow talk lipliner - http://bit.ly/2CTkbaK\nMAC Boldly bare lipliner - https://www.maccosmetics.co.uk/product/13852/340/products/makeup/lips/lip-pencil/lip-pencil?cm_mmc=GoogleBase-_-ShoppingFeed-_-Lips-_-LipPencil&gclid=CjwKCAiA1O3RBRBHEiwAq5fD_G4h_0anJFp8NZxs-viH6glA7CMjibC994atnBKGqqF7V_Os_VijqhoCtusQAvD_BwE&gclsrc=aw.ds&dclid=CLnC35X4m9gCFQSl7Qod730GMw\nLa Mer Lip balm \nMarc Jacobs Bronzer \nBobbi brown tinted eye brightener \nNARS Complete concealer - http://bit.ly/2BK70tf\nEyeko Brow gel - http://bit.ly/2BKSq4N\nGlossier Boy brow - http://bit.ly/2CU33BP\nTom Ford Contour palette - http://bit.ly/2CRGjCn\n\nSKINCARE\nMV Organic Gentle cream cleanser - http://bit.ly/2CQqDiP\nGlam Glow Hydrating mask - http://bit.ly/2BN5Nl7\n\nYOUTUBE\nNerdwriter - https://www.youtube.com/channel/UCJkMlOu7faDgqh4PfzbpLdg\nStyleLikeu  https://www.youtube.com/channel/UCw7FSgzdHFeaIKk4qUD_nEA\n\nTV\nMind hunter - https://www.youtube.com/watch?v=7gZCfRD_zWE\nThe handmaids tale - https://www.youtube.com/watch?v=PJTonrzXTJs
