id,video_id,trending_date,title,channel_title,category_id,publish_time,tags,views,likes,dislikes,comment_count,thumbnail_link,comments_disabled,ratings_disabled,video_error_or_removed,description
36753,gkemkf8vs0Q,2018-06-03,Tyron Woodley Breaks Down Potential Snoop Dogg vs. Wiz Khalifa MMA Fight | The Hollywood Beatdown,TMZSports,17,2018-06-01 20:52:51+00:00,"TMZ|""TMZ Sports""|""TMZ Sports Channel""|""Celebrity""|""Sports""|""Athletes""|""TMZ News""|""Famous""|""Hall of Fame""|""Sports News""|""wiz khalifa""|""snoop dogg""|""wiz khalifa mma""|""snoop dogg mma""|""snoop dogg music""|""wiz khalifa music""|""nick diaz arrested""|""nick diaz mug shot""|""nick diaz domestic violence""|""nick diaz next fight""|""diaz brothers""|""nate diaz""|""snoop""|""cyborg""|""cyborg next fight""|""cris cyborg""|""tyron woodley""|""ufc""|""ufc highlights""",42275,349,43,188,https://i.ytimg.com/vi/gkemkf8vs0Q/default.jpg,False,False,False,"UFC Welterweight Champion Tyron Woodley broke down a tale of the tape between two fighters who don't even fight! Wiz Khalifa and Snoop Dogg, primarily known for the rap game, not the fight game, have been training seriously over the past few weeks and Tyron takes a look at the footage before going over the potential for the two to enter the ring or octagon. You don't want to miss this edition of The Hollywood Beatdown. Who would win a potential fight: Snoop Dogg or Wiz? SUBSCRIBE -- http://po.st/TMZSportsSubscribeAbout TMZ Sports:Some of the best stories in sports have been off the field and we’re reporting on athletes from NFL, NBA, UFC, WWE, MLB and more!  Subscribe to TMZ Sports on YouTube for the latest news, exclusive interviews, clips from TMZ Sports on FS1 and videos of your favorite athletes and celebs. Need More TMZ?TMZ Sports Website: http://po.st/TMZSportsWebsiteLIKE TMZ Sports on Facebook!http://po.st/TMZSportsLikeFOLLOW TMZ on Twitter! http://po.st/TMZFollowFOLLOW TMZ on Instagram! http://po.st/TMZInstaTMZ on TV & TMZ Sports on FS1 Tune In Info: http://po.st/TMZOnAirTMZ is on iOS! http://po.st/TMZiOSTMZ is on Android! http://po.st/TMZonAndroidGot a Tip?Contact TMZ: http://po.st/TMZTipCheck out TMZ, TMZ Live, and toofab!TMZ: http://po.st/TMZWebsiteSubscribe! TMZ: http://po.st/TMZSubscribeTMZ Live: http://po.st/TMZLiveWebsiteSubscribe! TMZ Live: http://po.st/TMZLiveSubscribeToofab: http://po.st/toofabWebsiteSubscribe! toofab: http://po.st/toofabSubscribehttps://www.youtube.com/c/tmzsports"
36751,hHaUQh6Gx-Q,2018-06-03,"Mustard, Nick Jonas - Anywhere",MustardVEVO,10,2018-05-22 12:00:02+00:00,"Mustard|""Nick""|""Jonas""|""Anywhere""|""10""|""Summers""|""Interscope""|""PS""|""Pop""",1223732,37943,617,1053,https://i.ytimg.com/vi/hHaUQh6Gx-Q/default.jpg,False,False,False,"Anywhere Out Now! http://smarturl.it/AnywhereMustardxNJFollow Mustard:https://www.instagram.com/Mustardhttps://www.twitter.com/Mustardhttps://www.facebook.com/DJMustardOnTheBeatMusic video by Mustard, Nick Jonas performing Anywhere. © 2018 10 Summers Records LLC/Interscope Recordshttp://vevo.ly/S9fFms"
36770,hq1ijbMabsM,2018-06-03,Monét X Change - Soak It Up (feat. Bob The Drag Queen),Monét X Change,10,2018-05-25 01:15:00+00:00,"soak it up|""dance""|""rpdr""|""rupaul's drag race""|""pop""|""gay""|""lgbt""|""drag""|""drag queen""",656985,29814,1222,3419,https://i.ytimg.com/vi/hq1ijbMabsM/default.jpg,False,False,False,Buy Monét X Change's 'SOAK IT UP' now! Monét X Change feat. Bob The Drag Queen performing Soak It Up© 2018 Monét X ChangeDirector:  Assaad YacoubProducer: Alex Lampsos Director of Photography:  Ilya ChegodarEditors:  Nick Landa & Coco Jeanquier1st AC:  Adriana Ledesma2nd AC:  Jonathan WongGaffer:  Steven TalentsKey Grip:  David Grother IIGrip:  Alejandro RojasDIT:  Charlie ClarkSound:  Cory Baker CAST Monique Heart Boomer BanksThe Kiss BoysMONET X CHANGE / SOAK IT UPNEW SINGLE / OUT NOWiTunes:  https://itunes.apple.com/us/album/soak-it-up-single/1386981975Apple Music:  https://itunes.apple.com/us/album/soak-it-up-single/1386981975Spotify:  https://open.spotify.com/album/2pJbUeVzXT2f7HGB8H0H2FGoogle Play:  https://play.google.com/store/music/album/Mon%C3%A9t_X_Change_Soak_It_Up?id=Bf437sn637ggkvginfwcn47jr7iAmazon:  https://www.amazon.com/dp/B07D5QKV57Tidal:  https://tidal.com/album/89122338FOLLOW MONET X CHANGE:http://www.facebook.com/likemonetxchangehttp://www.twitter.com/monetxchangehttp://www.instagram.com/monetxchangehttp://www.monetxchange.com
36836,igT1QKKm2GE,2018-06-03,James Bay - Slide (Live),JamesBayVEVO,10,2018-05-10 16:00:02+00:00,"James|""Bay""|""Slide""|""Republic""|""Records""|""Alternative""",7398484,45588,1588,857,https://i.ytimg.com/vi/igT1QKKm2GE/default.jpg,False,False,False,"Slide (Live Video)Song Available on the new album Electric Light (Pre-Order Today)https://JamesBay.lnk.to/ElectricLightYD Connect With James Bay:http://jamesbay.com https://www.facebook.com/jamesbaymusic https://instagram.com/jamesbaymusic https://soundcloud.com/jamesbaymusic https://twitter.com/JamesBayMusic Directed & Produced by Jackson DucasseMusic video by James Bay performing Slide. © 2018 Republic Records, a division of UMG Recordings, Inc.http://vevo.ly/GgOBsv"
36785,j26WyjSo1dE,2018-06-03,Fun Swimming Video,Gus Johnson,23,2018-05-24 13:54:45+00:00,"fun swimming video|""fun swim video""|""adult swim""|""gus""|""gus johnson""|""gustoonz""|""gus swim""|""bad swimming""|""sven""|""sven johnson""|""eddy burback""|""meme""|""new meme""|""meme 2018""|""short funny video""|""trending""|""trending v""|""ian kung""|""ian kung video""|""vine""|""new vines""|""vines that saved my life""|""vine compilation""|""best vine""|""ian kung meme""|""gus ian kung""|""fail""|""swim fail""|""swimsuit fail""",176560,10111,744,971,https://i.ytimg.com/vi/j26WyjSo1dE/default.jpg,False,False,False,"- Please subscribe so I can eat: http://bit.ly/21Xhy2m↓FOLLOW GUS OR WHATEVER↓- Twitter: https://twitter.com/Gusbuckets- Facebook: https://www.facebook.com/gustoonz- Reddit: https://www.reddit.com/r/gusjohnson/- Snapchat: motherxteresa- Instagram: instagram.com/johnsongus- Patreon: http://bit.ly/1TVIYyA- PayPal: gustoonz@gmail.com- Download my new album here: http://bit.ly/2gRsJUQMy album is available for download here: http://www.nimbitmusic.com/gusjohnsonCheck out the merch store! http://gustoonz.cottoncart.com/This is a very fun swimming video.I am Gus Johnson. I make music, I put out bad skits. Thanks for your time, internet stranger. Sometimes I go by gustoonz.Thanks for watching and sharing! Don't stab people. I'll see you later."
36766,kFMZUxX6K6o,2018-06-03,Live It Up - Nicky Jam feat. Will Smith & Era Istrefi (2018 FIFA World Cup Russia) (Official Audio),NickyJamTV,10,2018-05-25 04:00:21+00:00,"Nicky Jam|""NickyJamPR""|""latin""|""will smith""|""Era Istrefi""|""fifa world cup 2018""|""fifa world cup russia 2018""|""world cup 2018""|""russia 2018""|""fifa world cup""|""equis""|""diplo""|""era istrefi""|""ultra music""|""la industria inc""|""manuel turizo""|""valentino""|""alikilados""|""brytiago""|""jbalvin""|""maluma""|""bad bunny""|""ozuna""|""cancion del mundial 2018""|""cancion fifa 2018""|""shakira""|""waka waka""|""ricky martin""|""la copa de la vida""|""james rodriguez""|""cristiano ronaldo""|""messi""|""neymar""",13626008,246021,43988,34315,https://i.ytimg.com/vi/kFMZUxX6K6o/default.jpg,False,False,False,Nicky Jam feat. Will Smith & Era Istrefi - Live It Up (Official Song 2018 FIFA World Cup Russia) [Audio] Prod by DiploMaking the song : https://www.youtube.com/watch?v=PKuCid_SUHQ&feature=youtu.beAvailable on these digital platforms:Linkfire: https://sml.lnk.to/LiveItUpSpotify: http://smarturl.it/LiveItUpSiTunes: http://smarturl.it/LiveItUpiTApple Music: http://smarturl.it/LiveItUpAMusic video by Nicky Jam feat. Will Smith & Era Istrefi - Live It Up (Official Song 2018 FIFA World Cup Russia) (C) 2018 Sony Music Entertainment US Latin LLC
36847,l884wKofd54,2018-06-03,Enrique Iglesias - MOVE TO MIAMI (Official Video) ft. Pitbull,EnriqueIglesiasVEVO,10,2018-05-09 07:00:01+00:00,"Enrique Iglesias feat. Pitbull|""MOVE TO MIAMI""|""Pop""|""RCA Records/Sony Music International/Sony Music Latin""",21200886,241443,11567,9413,https://i.ytimg.com/vi/l884wKofd54/default.jpg,False,False,False,NEW SONG - MOVE TO MIAMI feat. Pitbull (Click SHOW MORE below)Watch on YouTube: http://smarturl.it/MTMvEnrique?iQid=yt  - Shazam to Unlock an exclusive video!Listen on Spotify: http://smarturl.it/EnriqueMTM/spotify?iQid=yt  Apple Music: http://smarturl.it/EnriqueMTM/applemusic?iQid=yt  iTunes: http://smarturl.it/EnriqueMTM/itunes?iQid=yt  Google Play: http://smarturl.it/EnriqueMTM/googleplay?iQid=yt  Amazon: http://smarturl.it/EnriqueMTM/az?iQid=yt  Deezer: http://smarturl.it/EnriqueMTM/deezer?iQid=yt  Choose Your Platform!: http://smarturl.it/EnriqueMTM?iQid=yt  ENRIQUE ON TOUR (Tickets): https://enriqueiglesias.com/events  FOLLOW ENRIQUE: Instagram: http://www.instagram.com/enriqueiglesias Facebook: http://www.facebook.com/enriqueiglesias Twitter: http://www.twitter.com/enriqueiglesias Snapchat: enriqueSign up to http://www.enriqueiglesias.com for exclusive access and offers.http://vevo.ly/UTblhE
36776,mQ055hHdxbE,2018-06-03,John Mayer - New Light (Premium Content!),John Mayer,10,2018-05-24 13:42:02+00:00,"John Mayer|""New Light""|""Music Video""|""Official""|""Premium Content""|""Funny""|""Comedy""",3962295,147430,3091,12348,https://i.ytimg.com/vi/mQ055hHdxbE/default.jpg,False,False,False,“New Light” available now: http://johnmayer.com(C) 2018 Snack Money
36834,mdWcaWBxxcY,2018-06-03,"Rita Ora - Girls ft. Cardi B, Bebe Rexha & Charli XCX (Official Lyric Video)",Rita Ora,24,2018-05-11 09:23:16+00:00,"Rita Ora|""Rita""|""Ora""|""Your Song""|""Anywhere""|""Official Video""|""Rita Ora Girls""|""Girls""",18769449,329158,34734,28732,https://i.ytimg.com/vi/mdWcaWBxxcY/default.jpg,False,False,False,"Rita Ora 'Girls' ft. Cardi B, Bebe Rexha & Charli XCX is out now: http://atlanti.cr/girls Video by Everyone's Favourite: http://everyonesfavourite.net ----► Follow Rita Orahttp://www.ritaora.comhttp://youtube.com/ritaorahttp://twitter.com/ritaorahttp://facebook.com/ritaorahttp://instagram.com/ritaorahttp://www.ritaora.com/"
36835,mzB1VGEGcSU,2018-06-03,Juice Wrld - Lucid Dreams (Dir. by @_ColeBennett_),Cole Bennett,24,2018-05-11 02:05:33+00:00,"Juice Wrld|""Lucid Dreams""|""Music Video""|""Hip Hop""|""Rap""|""All Girls Are The Same""|""Lyrical Lemonade""|""Cole Bennett""|""lucid dreams juice wrld""|""lucid dreams cole bennett""|""lucid dreams lyrical lemonade""|""cole bennett lucid dreams""|""lucid dreams official""|""lucid dreams 2018""|""lucid dreams official music video""|""lucid dreams music video""|""juice wrld official""|""juice wrld 2018""|""juice wrld music""|""cole bennett official""|""lyrical lemonades official""",12804208,325973,5672,29389,https://i.ytimg.com/vi/mzB1VGEGcSU/default.jpg,False,False,False,"Juice Wrld - Lucid DreamsJuice WRLD's Channel: http://bit.ly/Juice_WRLDhttp://smarturl.it/LucidDreamsJWSong Produced by Nick MiraDirected + Edited by Cole BennettDirector of Photography: Cole SchwartzSteadicam by Bayley Pokorney--Official Channel of Cole Bennett / Lyrical LemonadeSubscribe for updates on music videos, interviews, performance videos, etc.Cole Bennetthttp://www.twitter.com/_colebennett_http://www.instagram.com/_colebennett_Lyrical Lemonadehttp://www.twitter.com/lyricalemonadehttp://www.instagram.com/lyricalemonadehttp://www.lyricallemonade.com"
36767,nah07N01UF0,2018-06-03,DragRace Makeover & Spilling Tea (ft Monét X Change),Tyler Oakley,24,2018-05-25 18:39:58+00:00,"tyler oakley|""tyleroakley""|""youtuber""|""vlog""|""vlogger""|""lgbtq""|""lgbt""|""gay""|""vlogging""|""upload""|""Q&A""|""question""|""answer""|""funny""|""lol""|""cc""|""captioned""|""monet x change""|""rupaul's drag race""|""drag""|""anthony padilla""|""kingsley""|""chester see""|""aquaria""|""rupaul""|""raymond braun""|""spilling tea""|""reading challenge""|""frankie grande""|""ariana grande""|""makeover""|""miss fame""|""trixie mattel""|""bob the drag queen""",500267,24052,546,1196,https://i.ytimg.com/vi/nah07N01UF0/default.jpg,False,False,False,"Watch my BIG announcement here: https://youtu.be/6P8SGHIoYv8I cannot believe I kept this secret for this long… but I WAS ON RUPAUL’S DRAG RACE!!! On the latest episode of the show, five other social media “kings” and I were paired up with the remaining queens and given a “family” themed makeover! I got paired up with my new fav, Monét X Change and we served looks & reads the entire episode. As soon as I filmed I KNEW I wanted to work with Monét again, so watch as we talk drag, do a Short Change makeover redo, and spill TEA on our episode… enjoy ladies!  Like & Comment your favorite moment of the episode! We wanna see your fan art!! Use #XChangeFamilyPortrait Watch my last video where I talk about my thoughts on Drag Race Season 10: https://youtu.be/da_nB5kr0-YWatch my last Drag transformation with Miss Fame: https://youtu.be/kVkL0TILo7UWatch our episode of Drag Race:http://www.vh1.com/episodes/n8amjr/rupauls-drag-race-social-media-kings-into-queens-season-10-ep-1010Watch Untucked:http://www.vh1.com/episodes/i3gj11/rupauls-drag-race-untucked-social-media-kings-into-queens-season-10-ep-910FIND MONÉThttps://www.instagram.com/monetxchangehttps://twitter.com/monetxchangehttps://www.monetxchange.com/https://www.youtube.com/channel/UCuuJK_HAOYiayR6TNjWC3xA/featuredSPECIAL THANKSRuPaul’s Drag Race // World of WonderMonét X ChangeYouTube Space New YorkHair: Gypsy WigzCostumes: Whitney NewmanJoin our Twitter family: http://twitter.com/tyleroakleyCome to YouTuber Summer Camp: http://gocamp17.comBinge (book): http://amazon.com/dp/1501117696Snervous (documentary): http://bit.ly/SnervousiTunesPsychobabble (podcast): http://itunes.com/psychobabbleWatch the podcast: http://fullscreen.com/psychobabbleUse promo code Psychobabble for a free 30 day trial! Find Tyler:Snapchat: snaptyleroakleyVideos: http://youtube.com/tyleroakleyTwitter: http://twitter.com/tyleroakleyTumblr: http://tyleroakley.tumblr.comFacebook: http://facebook.com/thetyleroakleyT-Shirts: http://districtlines.com/tyleroakleyInstagram: http://instagram.com/tyleroakleyBusiness inquiries: lisa@flipmgmt.com"
36884,nhs0fuubs1I,2018-06-03,LIBERATO - INTOSTREET,LIBERATO,10,2018-05-02 10:00:35+00:00,"liberato|""intostreet""|""9maggio""|""maggio""|""lettieri""|""napoli""|""francesco""|""video""|""videoclip""|""music video""|""official""|""trap""|""hip-hop""|""anonimato""|""sonar""|""anonimo""|""ultras""|""anonymous""|""secret""|""identity""|""baccalà""|""naples""",4490208,54104,3324,2708,https://i.ytimg.com/vi/nhs0fuubs1I/default.jpg,False,False,False,"Facebook : http://bit.ly/2DDhMF3INTOSTREET O Spotify: https://spoti.fi/2wkgSe9Scopri il nuovo video JE TE VOGLIO BENE ASSAJE: http://bit.ly/2K2SfF8regia di: FRANCESCO LETTIERIcon: ADAM JENDOUBI, DEMETRA AVINCOLA, GELSOMINA ARCURO, GIOACCHINO NARDI, FIORE BORRIELLO, CIRO MAGLIONE, REGGIO SAITOV, ROBBIE SAITOVscritto da: FRANCESCO LETTIERI e DANIELE SCHETTINOdirettore della fotografia: GIANLUCA PALMAorganizzazione generale: ANGELA MOCERINO e LAURA BASILEscenografa: MARCELLA MOSCAcostumista: ANTONELLA MIGNOGNAmontaggio: VALERIA SAPIENZAaiuto regista: YLENIA AZZURRETTIoperatore: PIETRO COMINIassistente operatore: FABIO FARINAROD.I.T.: ELENA BERTELLIispettori di produzione: DANIELE DEL PLAVIGNANO, ALESSANDRO PEPEsegretario di produzione: LUCA CIRIELLOcapo elettricista: STEFANO BERTOLDIelettricista: FRANCESCO CRUCIANItruccatrice: LUANA FORMICOLAparrucchiera: ANASTASIA COPPOLAassistentI alla regia: CECILIA VECCHIO, STEFANO ROMANOassistente costumista: GIORGIA AMENDOLAassistente scenografa: VINCENZO AQUILONEfotografi di scena: GLAUCO CANALIS, ILARIA D'ATRIcasting: MARCELLO ANGELINOamministratrice: CHIARA BUDANOcolor correction: ALESSIO ZANARDIgrafiche: R.M.fixer: SAVIO WURZBURGERcameracar: ALFONSO FERRARA, GIANMARIA IORIOservice mdp: D-VISIONmateriali elettricisti e macchinisti: CAMERADUEtrasporti: ROMANA GRUPPI ELETTROGENI CINEMATOGRAFICIcatering: ANTONIO FRATTIANI CINECATERINGmedia partner: NSS MAGAZINEforniture costumi e props: LONDON STORE, SINGOLARE.IT, RO.CA.GI DI RUSSO CATELLO, ACK, ALPHA INDUSTRIES, BOB SDRUNK, CALVIN KLEIN JEANS, CARHARTT WIP, EMANUELE BICOCCHI JEWELS, FANTABODY, MANINCUORE, MIU MIU, RETROSUPERFUTURE, SIAMESE BORSE, TOMMY JEANSun grazie speciale a: FILM COMMISSION REGIONE CAMPANIA, ARCHAEO DI RICCARDO DI DOMENICO, HOSTARIA LA VELA, URBAN JUNGLE, VILLA LUCREZION SNC, OTTICA D'ABUNDO, CHALET ROSSO, TEATRO POSILLIPO, IDNTY SALON, ESTETICA IN FORMA, MARINA MOSCA, ANTONIO FRATIANNI, ALESSIA FRATIANNI, MARIA INDRIO, SERGIO MANNAGO, ALESSANDRO IANNONE, ENZO RICCIO, GIANNI DI PRISCO, ANTONIO FARINA, FRANCESCA MARINA, BIAGIO FORESTIERI, FABIO CUORE, SALVIO SOLOMBIRNO, MARIA BIRRA, ENZO ROMANO, IVANO COLETTA, GIANMARCO BALDINI, ANDREA MIGNOGNA, SARA PASTORE, GIULIO MARTINO, CATERINA VECCHIO, MARIA ANNA D'APRILE, MONICA DI ROCCO, MICHELE LUBRANO LAVADERA, PEPPE MANCINO, DANILO SCHIANO, FEDERICO ALLEGRETTA, ROSSANA CICCARIELLO, FEDERICO LETTIERI,A TUTTO IL CALCIO NAPOLI, A CHI SI É IMPEGNATO, A CHI CI HA CREDUTO, A CHI CE CRER' ANCOR'prodotto da: 9 MAGGIOproduzione esecutiva: 5e6 SRLin collaborazione con: NSS FACTORYpowered by CONVERSE"
36823,niviooakBLs,2018-06-03,Years & Years - If You're Over Me (Official video),YearsAndYearsVEVO,10,2018-05-14 23:01:00+00:00,"Years|""If""|""You're""|""Over""|""Me""|""Polydor""|""Records""|""Electronic""",2979674,67859,2222,1978,https://i.ytimg.com/vi/niviooakBLs/default.jpg,False,False,False,"Stream/Download: https://YearsandYears.lnk.to/IYOMIDPalo Santo. The new album, out 6th July 2018. Pre-order via the official store for exclusive ticket access to forthcoming UK and US shows: https://YearsandYears.lnk.to/PaloSantoIDStandby for Incoming Transmissions: https://YearsandYears.lnk.to/PSENsIDConnect with Years & Years:http://www.facebook.com/YearsAndYears/http://www.instagram.com/yearsandyears/ http://twitter.com/yearsandyearshttp://yearsandyears.comMusic video by Years & Years performing If You're Over Me. © 2018 Universal Music Operations Limitedhttp://vevo.ly/OaLRH6"
36817,nkWn5vKCZj4,2018-06-03,Joe Rogan Shuts Down Steven Tyler's Conspiracy Theories,Joe Rogan Fan Page,22,2018-05-17 00:56:43+00:00,"joe rogan|""steven tyler""|""joe rogan conspiracy theories""|""joe rogan aliens""|""joe rogan ufos""|""aliens""|""bigfoot""|""ufo""|""steven tyler interview""|""steven tyler aliens""|""joe rogan bigfoot""|""joe rogan experience""|""joe rogan podcast""|""jre""|""jre 1116""|""joe""|""rogan""|""joe rogan comedy""|""joe rogan stand up""|""joe rogan funny""|""joe rogan ufc""|""joe rogan comedian""|""comedy""|""funny""|""conspiracy theories joe rogan""|""joe rogan steven tyler""",1377597,10256,2496,12369,https://i.ytimg.com/vi/nkWn5vKCZj4/default.jpg,False,False,False,"Joe Rogan and Steven Tyler talk about conspiracy theories, aliens, ancient humans, bigfoot etc. From The Joe Rogan Experience Podcast, JRE #1116. Full podcast - https://www.youtube.com/watch?v=0HqLk_ZbHmIJoe Rogan Shuts Down Steven Tyler's Conspiracy Theorieshttps://www.youtube.com/watch?v=nkWn5vKCZj4"
36883,o6XERmXsP-U,2018-06-03,Arrested Development: Star Wars with Ron Howard! | The Star Wars Show,Star Wars,24,2018-05-02 19:56:29+00:00,"The Star Wars Show|""Star Wars Show""|""Andi Gutierrez""|""Anthony Carboni""|""Lucasfilm""|""Star Wars""|""Solo: A Star Wars Story""|""Ron Howard""|""Arrested Development""",672442,21622,292,1023,https://i.ytimg.com/vi/o6XERmXsP-U/default.jpg,False,False,False,"Solo: A Star Wars Story director Ron Howard narrates the story of Star Wars: A New Hope, Arrested Development style, in this sketch from The Star Wars Show.Vote for The Star Wars Show in the Telly Awards: http://strw.rs/6007DbglzWatch more of The Star Wars Show at https://www.youtube.com/playlist?list=PL148kCvXk8pBjG-JOhlIU6rWzLyA2O2anVisit Star Wars at http://www.starwars.comSubscribe to Star Wars on YouTube at http://www.youtube.com/starwarsLike Star Wars on Facebook at http://www.facebook.com/starwarsFollow Star Wars on Twitter at http://www.twitter.com/starwarsFollow Star Wars on Instagram at http://www.instagram.com/starwarsFollow Star Wars on Tumblr at http://starwars.tumblr.com/Star Wars: The Digital Collection, Star Wars: The Force Awakens, Rogue One A Star Wars Story, Star Wars Rebels, Star Wars: The Last Jedi and Star Wars: The Clone Wars available on iTunes. Solo: A Star Wars Story in theaters May 25, 2018."
36859,oWw1BcFhk-k,2018-06-03,Liam Payne & J Balvin - Familiar (Official Video),LiamPayneVEVO,10,2018-05-04 11:00:07+00:00,"Liam|""Payne""|""Familiar""|""Capitol""|""Pop""",48252823,581787,19581,22302,https://i.ytimg.com/vi/oWw1BcFhk-k/default.jpg,False,False,False,"Familiar, the brand new single from Liam Payne & J Balvin. Download or stream the track now: http://liamp.co/FamiliarSingleIDJ Balvin ManLiam Payne, Ma GWoah It's simple, you dip lowYour hips roll you do the calypsoAn intro is all that I needOh yeahYo empiezo, primeroTu sabes lo que me refieroDe cero, sabes que estoy pa ti Oh ooh I just wanted to get your nameBut if it's cool I wanna get inside your brain Can we get famili famili famili familiarI'm feelin' I'm feelin’ I'm feelin’ I'm feelin’ yaWhat's on your mind for later tonight?Let me be the one to fill it upCan we get famili famili famili familiarI'm feelin' I'm feelin’ I'm feelin’ I'm feelin’ yaWhat's on your mind for later tonight?Let me be the one to fill it upCan we getYour waistline, the bass lineIn real life don’t wanna no FaceTimeCos great minds they think just the sameYou're shaped like vibratoA model or some kinda bottleWell pour up cos I want a taste, a taste Oh ooh I just wanted to get your nameSolo queria tu nombre babyBut if it's cool I wanna get inside your brainCan we get famili famili famili familiar I'm feelin' I'm feelin’ I'm feelin’ I'm feelin’ ya What's on your mind for later tonight?Let me be the one to fill it upCan we get famili famili famili familiarI'm feelin' I'm feelin’ I'm feelin’ I'm feelin’ yaWhat's on your mind for later tonight?Let me be the one to fill it upCan we getAh Ah Ah AhFamiliarAh Ah Ah Ah, Ah AhAh Ah Ah AhFamiliarLet me be the one to fill it upCan we get Ah Ah Ah AhFamiliarAh Ah Ah Ah, Ah AhAh Ah Ah AhFamiliarLet me be the one to fill it upCan we get Quisiera que tu y yo nos familiarizemosUn poco de quimica y el party prendemosolvida las criticas si nos entedemosQue tu cree si en tu mente nos metemosSeñorita Que necesitaSeria mucho mejor si participas Asi de lejos no mejor cerquita Yo voy hacerte todo lo que me permitasY sabes que lo que te pones te queda bienY me caes mucho mejor que un billete de, Cien! Can we get famili famili famili familiarI'm feelin' I'm feelin' I'm feelin' I’m feelin’ yaWhat's on your mind for later tonight?Let me be the one to fill it upCan we get famili famili famili familiarI'm feelin' I'm feelin' I'm feelin' I’m feelin’ yaWhat's on your mind for later tonight?Let me be the one to fill it upCan we getAh Ah Ah AhFamiliarAh Ah Ah Ah, Ah AhAh Ah Ah AhFamiliarLet me be the one to fill it upCan we getAh Ah Ah AhFamiliarAh Ah Ah Ah, Ah AhAh Ah Ah AhFamiliarLet me be the one to fill it upCan we getFollow Liam onFacebook http://liamp.co/FacebookTwitter http://liamp.co/Twitter Instagram http://liamp.co/InstagramSnapchat  @liampayneWebsite http://liamp.co/OfficialMusic video by Liam Payne performing Familiar. © 2018 Hampton Records Limited, under exclusive licence to Capitol Records, a division of Universal Music Operations Limitedhttp://vevo.ly/0DAxJY"
36851,ouWuzQb9vNg,2018-06-03,Introducing: The Players! - Super Smash Bros. Invitational 2018,Nintendo,20,2018-05-09 12:00:08+00:00,"nintendo|""play""|""play nintendo""|""game""|""gameplay""|""fun""|""video game""|""kids""|""action""|""adventure""|""rpg""|""nintendo switch""|""pro controller""|""joy con""|""super smash bros""|""super smash bros 2018""|""super smash bros invitational 2018""|""competition""|""bracket""|""challengers""|""mkleo""|""zero""|""armada""|""abadango""|""plup""|""mr. r""|""lucky""|""mango""|""exhibition""|""belasco theater""|""la""|""los angeles""|""esports""|""nintendo versus""|""e3""|""e3 2018""",1473934,40406,2631,10659,https://i.ytimg.com/vi/ouWuzQb9vNg/default.jpg,False,False,False,"Watch as some of the top Super Smash Bros. players from around the globe battle it out on Nintendo Switch. Tune in June 12th to catch all of the excitement, including exhibition matches with invited guests!Get the latest E3 news! https://e3.nintendo.com#NintendoSwitch #SuperSmashBrosSubscribe for more Nintendo fun! https://goo.gl/09xFdPVisit Nintendo.com for all the latest! http://www.nintendo.com/Like Nintendo on Facebook: http://www.facebook.com/NintendoFollow us on Twitter: http://twitter.com/NintendoAmericaFollow us on Instagram: http://instagram.com/NintendoFollow us on Pinterest: http://pinterest.com/NintendoFollow us on Google+: http://google.com/+Nintendo"
