id,video_id,trending_date,title,channel_title,category_id,publish_time,tags,views,likes,dislikes,comment_count,thumbnail_link,comments_disabled,ratings_disabled,video_error_or_removed,description
36772,7a6irhXRudo,2018-06-03,"Trump Cancels NK Summit, Pushes Crazy Spy Claim: A Closer Look",Late Night with Seth Meyers,23,2018-05-25 01:05:35+00:00,"Late|""Night""|""with""|""Seth""|""Meyers""|""seth meyers""|""late night with seth meyers""|""steven wolf""|""ocean's 8""|""NBC""|""NBC TV""|""television""|""funny""|""talk show""|""comedy""|""humor""|""stand-up""|""parody""|""snl seth meyers""|""host""|""promo""|""seth""|""meyers""|""weekend update""|""news satire""|""satire""|""North korea""|""Summit""|""Singapore""|""border wall""|""Anthony Scaramucci""|""People's Sexiest Man Alive""|""Russia investigation""|""conspiracy theory""|""Donald Trump Jr.""|""Russia""|""Rudy Giuliani""|""Devin Nunes""|""House Intel Committee""",1830463,17374,1333,2105,https://i.ytimg.com/vi/7a6irhXRudo/default.jpg,False,False,False,"Seth takes a closer look at the president canceling his summit with North Korea and pushing a baseless conspiracy theory about the Russia probe.» Subscribe to Late Night: http://bit.ly/LateNightSeth» Get more Late Night with Seth Meyers: http://www.nbc.com/late-night-with-seth-meyers/» Watch Late Night with Seth Meyers Weeknights 12:35/11:35c on NBC.LATE NIGHT ON SOCIALFollow Late Night on Twitter: https://twitter.com/LateNightSethLike Late Night on Facebook: https://www.facebook.com/LateNightSethFind Late Night on Tumblr: http://latenightseth.tumblr.com/Connect with Late Night on Google+: https://plus.google.com/+LateNightSeth/videosLate Night with Seth Meyers on YouTube features A-list celebrity guests, memorable comedy, and topical monologue jokes.NBC ON SOCIAL Like NBC: http://Facebook.com/NBCFollow NBC: http://Twitter.com/NBCNBC Tumblr: http://NBCtv.tumblr.com/NBC Pinterest: http://Pinterest.com/NBCtv/NBC Google+: https://plus.google.com/+NBCYouTube: http://www.youtube.com/nbcNBC Instagram: http://instagram.com/nbctvTrump Cancels NK Summit, Pushes Crazy Spy Claim: A Closer Look- Late Night with Seth Meyershttps://youtu.be/7a6irhXRudoLate Night with Seth Meyershttp://www.youtube.com/user/latenightseth"
36729,8JnfIa84TnU,2018-06-03,Clean Bandit - Solo feat. Demi Lovato [Official Video],Clean Bandit,10,2018-05-31 09:00:13+00:00,"clean bandit|""solo""|""demi lovato""|""I do it solo""|""Official Video""|""I Miss You""|""Julia Michaels""|""Symphony""|""Zara Larsson""|""Rockabye""|""Anne-Marie""|""Sean Paul""|""Tears""|""Louisa Johnson""|""Rather Be""|""Jess Glynne""|""Real Love""|""Extraordinary""|""Stronger""|""Come Over""|""New Eyes""",3731285,184478,3434,7250,https://i.ytimg.com/vi/8JnfIa84TnU/default.jpg,False,False,False,Our new single Solo feat. Demi Lovato is out now https://atlanti.cr/soloWARNING: THIS VIDEO CONTAINS FLASHING LIGHTS WHICH MAY NOT BE SUITABLE FOR PHOTOSENSITIVE EPILEPSY. Click here to subscribe: http://bit.ly/SubscribeToCleanBanditFollow us:Website: http://cleanbandit.co.uk/Facebook: http://www.facebook.com/cleanbandit Twitter: http://www.twitter.com/cleanbandit Instagram: http://instagram.com/cleanbanditSoundcloud: http://www.soundcloud.com/cleanbanditSpotify: http://www.atlre.co.uk/CleanBanditSpotify
36827,8XBLuU_4Qgo,2018-06-03,John Cena On His Split From Nikki Bella: ‘I Had My Heart Broken Out Of Nowhere’ | TODAY,TODAY,25,2018-05-14 15:29:50+00:00,"The TODAY Show|""TODAY Show""|""TODAY""|""NBC""|""NBC News""|""Celebrity Interviews""|""TODAY Show Recipes""|""Lifestyle""|""TODAY Show Interview""|""Ambush Makeover""|""Kathie Lee and Hoda""|""KLG and Hoda""|""john cena nikki bella""|""john cena nikki bella break up""|""nikki bella""|""john cena""|""wwe""|""bella twins""|""total bellas""|""john cena nikki bella breakup""|""john cena total bellas""|""john cena girlfriend""|""john cena interview""|""john cena on nikki bella""|""john cena on breakup""|""john cena breakup""",1948658,22322,1074,4078,https://i.ytimg.com/vi/8XBLuU_4Qgo/default.jpg,False,False,False,"Kathie Lee Gifford and Hoda Kotb welcome special guest co-host John Cena, who speaks frankly about his split with his fiancée, Nikki Bella. “I had my heart broken out of nowhere,” he says. “I still love Nicole.” But he adds that he’s grateful for his six years by her side.» Subscribe to TODAY: http://on.today.com/SubscribeToTODAY» Watch the latest from TODAY: http://bit.ly/LatestTODAYAbout: TODAY brings you the latest headlines and expert tips on money, health and parenting. We wake up every morning to give you and your family all you need to start your day. If it matters to you, it matters to us. We are in the people business. Subscribe to our channel for exclusive TODAY archival footage & our original web series.  Connect with TODAY Online!Visit TODAY's Website: http://on.today.com/ReadTODAYFind TODAY on Facebook: http://on.today.com/LikeTODAYFollow TODAY on Twitter: http://on.today.com/FollowTODAYFollow TODAY on Google+: http://on.today.com/PlusTODAYFollow TODAY on Instagram: http://on.today.com/InstaTODAYFollow TODAY on Pinterest: http://on.today.com/PinTODAYJohn Cena On His Split From Nikki Bella: ‘I Had My Heart Broken Out Of Nowhere’ | TODAY"
36841,8h--kFui1JA,2018-06-03,Sam Smith - Pray (Official Video) ft. Logic,SamSmithWorldVEVO,10,2018-05-09 17:00:00+00:00,"Sam|""Smith""|""Pray""|""Capitol""|""Pop""",18603707,346879,8945,12194,https://i.ytimg.com/vi/8h--kFui1JA/default.jpg,False,False,False,"Stream, Download and Listen to Pray feat. Logic now: http://samsmith.world/LogicPrayID They never knew my struggleRose above the rubbleRather live inside their bubble Than go through the troubleOf having their double double vision correctedThey just neglect it and I’ve been thinking latelyWill the Devil take me?Or will God protect me?I know I ain’t perfectBut you should respect meThey don’t want me happyThey don’t wanna let me live I’m young and I’m foolishI make bad decisionsI block out the newsTurn my back on religionDon’t have no degreeI’m somewhat naïveI have made it this far on my own But lately that shit ain’t been getting me higherI lift up my head and the world is on fireThere’s dread in my heartAnd fear in my bonesI just don’t know what to say Maybe I’ll prayPrayMaybe I’ll prayI have never believed in you, noBut I’m gonna pray I am meI’m a manI’m a sinnerBut understandAren’t we all?So when it comes to passing judgementsI don’t think that you’re the one to make the callHeaven want to cast me out for being me I know theres others like me there to break the fall I know you hater Motherfuckers just can’t relate at  If I’m the first one to the line that’s fineI’ll take it allBut Logic he gon’ let ‘em knowI ain’t perfectBut I’m worth itI’m aliveI deserve itI’ve been praying I ain’t playingI don’t think you hear the words that I’m saying I don’t think you know the weight on my shouldersThat gets heavier as I get olderCalling anybodyCalling anybodyCan you hear me?I pray that you hear meI pray that you hear me Maybe I’ll prayPrayMaybe I’ll prayI’ve never believed in you, noBut I’m gonna Won’t you call me?Can we have a one on one please?Let’s talk about freedomEveryone prays in the endEveryone prays in the endOh, won’t you call me?Can we have a one on one please?Let’s talk about freedomEveryone prays in the endEveryone prays in the end Oh, I’m gonnaPrayI’m gonnaPrayI’m gonnaPrayPray for a glimmer of hopeMaybe I’ll prayPrayMaybe I’ll prayI’ve never believed in you, noBut I’m gonna pray Follow Sam Smith:http://samsmithworld.com http://facebook.com/samsmithworld http://instagram.com/samsmithworld http://twitter.com/samsmithworld Director : Joe ConnorProducer : Colin OfflandItaly Production : Dom MergiaPM : Georgie WinterDOP : Patrick MellorEdit : Ian McLaughlin @ The OutpostGrade : George K @ MPCAgent : Alexa Haywood"
36801,8nWw8q3zEpw,2018-06-03,GIANT 15 POUND LOBSTER MUKBANG! 먹방 (EATING SHOW!),Kim Thai,22,2018-05-20 22:42:02+00:00,"kim thai|""mukbang""|""seafood boil""|""15 pound lobster""|""15 lb lobster""|""eating show""|""korean eating show""|""bloveslife""|""먹방""|""kim thai mukbang""|""vietnamese food""|""speaking vietnamese""",301358,7469,653,1767,https://i.ytimg.com/vi/8nWw8q3zEpw/default.jpg,False,False,False,"WHERE I BOUGHT THIS 15 POUND LOBSTER: https://www.mainelobsternow.com/giant-lobsters/10-lb-15-lb-north-atlantic-live-lobsterMY SEAFOOD DIPPING SAUCE:1. SALT - 1 TABLE SPOON 2. SUGAR - 1 TABLE SPOON3. KNORR CHICKEN FLAVORED BROTH MIX POWDER - TO YOUR LIKING 4. HUY FONG CHILI GARLIC SAUCE - TO YOUR LIKING/DEPENDS ON LEVEL OF SPICY 5. 1-2 LEMONS - DEPENDS ON YOU This sauce really depends a lot on your personal preference, so add as much or as little as you want and mix it to accommodate to your taste buds! _ _ _ _ _ _ _ _ _ _ BUY MY LION-HEARTED + AUDACIOUS LASHES HERE: https://www.cakefacebeauty.comMORPHE BRUSHES » http://morphebrushes.comDiscount Code: KIMTHAI This discount code does NOT expire. It can be used online and in their Burbank, California store. Make sure you use all CAPS at check out. JOUER COSMETICS » https://www.jouercosmetics.com15% Discount Code: KIMTHAIThis discount code does NOT expire. _ _ _ _ _ _ _ _ _ _ BUSINESS INQUIRIES » kkimthai@yahoo.comINSTAGRAM » https://www.instagram.com/kkimthaiTWITTER » https://twitter.com/kkimthaiPOSHMARK » @kkimthaiMY ADDRESS »Kim Thai Nguyen P.O. Box 11810Westminster CA 92685_ _ _ _ _ _ _ _ _ _"
36831,8pfXS-SwbTw,2018-06-03,[King of masked singer] 복면가왕 - 'unicorn' Identity 20180513,MBCentertainment,24,2018-05-13 09:28:26+00:00,"MBC|""예능""|""일요예능""|""일밤""|""복면""|""가왕""|""복면가왕""|""김성주""|""김구라""|""20180513""|""153회""|""정체공개""|""유니콘""|""라이언레이놀즈""|""King of masked singer""|""King""|""masked""|""singer""|""Mask""|""Mask King""|""Identity""|""unicorn""|""Ryan Reynolds""",4218412,70487,571,3496,https://i.ytimg.com/vi/8pfXS-SwbTw/default.jpg,False,False,False,"'unicorn' Identity▶ Playlist for THIS episodes → https://www.youtube.com/playlist?list=PLtqYizcPqxZTgnC5cRunCVf0risGo8oFs▶ More ‘Mask King’ clips are available↓↓↓↓↓↓↓↓↓↓↓↓【Mask King】.‘Mask King’ is a competition between 8 celebrities compeletely hidden from mask while they sing. The program focuses on the stars singing abilities and guesses whose faces are hidden behind a mask. Reported by 'Mask King' team, the line up or singer casting will be kept as a secret for each week.★★★More Mask king clips are available★★★YouTube     https://www.youtube.com/MBCbentertainmentFacebook    https://www.facebook.com/mbcmasksingersNaver         http://tvcast.naver.com/maskDaum         http://tvpot.daum.net/mypot/View.do?ownerid=45x1okb1If50&playlistid=5158402Homepage   http://www.imbc.com/broad/tv/ent/sundaynight"
36839,9_LIP7qguYw,2018-06-03,Hidden Meanings Behind Childish Gambino's 'This Is America' Video Explained,INSIDER,24,2018-05-09 16:19:16+00:00,"INSIDER|""this is america""|""childish gambino""|""music video""|""music video analysis""|""black lives matter""|""charleston shooting""",13515434,226383,21422,22520,https://i.ytimg.com/vi/9_LIP7qguYw/default.jpg,False,False,False,Childish Gambino's 'This Is America' has become an overnight cultural phenomenon. The internet was quick to point out tons of hidden messages throughout the piece. Here's some you've might have missed.Read more analysis on 'This Is America': http://www.thisisinsider.com/this-is-america-music-video-meaning-references-childish-gambino-donald-glover-2018-5The INSIDER team believes that life is an adventure! Subscribe to our channel and visit us at: https://thisisinsider.comINSIDER on Facebook: https://www.facebook.com/thisisinsider/INSIDER on Instagram: https://www.instagram.com/thisisinsider/INSIDER on Twitter: https://twitter.com/thisisinsiderProduced by: Alana Yzola
36830,9flG5EqRPSc,2018-06-03,Netta ('Toy' Israel) wins Eurovision after dramatic public vote! - Eurovision Song Contest 2018,BBC,24,2018-05-12 23:48:30+00:00,"Eurovision|""2018""|""BBC Eurovision""|""competition""|""singing competition""|""eurovision 2018 israel""|""Netta israel""|""eurovision 2018 clips""|""eurovision stage invader""|""Netta Toy""|""Eurovision Israel 2018""|""eurovision 2018 result""|""eurovision 2018 vote""|""eurovision 2018 winner""|""eurovision 2018 controversial""|""netta toy live""|""netta wins eurovision""|""israel is the winner""|""eurovision winner 2018""|""netta toy official""",7699397,48616,62610,25190,https://i.ytimg.com/vi/9flG5EqRPSc/default.jpg,False,False,False,"SUBSCRIBE for more BBC highlights: https://bit.ly/2IXqEInWatch the Eurovision Song Contest on the BBC. https://bbc.in/2rA9CWf  See the moment Netta (#Israel) was crowned winner of the Eurovision Grand Final 2018 with 'Toy', written by Doron Medalie, Stav Beger.Graham Norton introduces live coverage of the #Eurovision Song Contest from Lisbon, Portugal. Eurovision Song Contest 2018 | Grand Final | BBC One"
36882,9mQk7Evt6Vs,2018-06-03,[MV] (G)I-DLE ((여자)아이들) _ LATATA,1theK (원더케이),10,2018-05-02 09:00:02+00:00,"Kpop|""1theK""|""원더케이""|""loen""|""로엔""|""뮤비""|""티져""|""MV""|""Teaser""|""신곡""|""new""|""song""|""한류""|""hallyu""|""ロエン""|""ミュージック""|""ミュージックビデオ""|""ケーポップ""|""韓国の歌""|""アイドル""|""韓流""|""韓国""|""아이돌""|""idol""|""(여자)아이들""|""아이들""|""LATATA""|""(G)I-DLE""",16891169,496384,13071,37650,https://i.ytimg.com/vi/9mQk7Evt6Vs/default.jpg,False,False,False,"[MV] (G)I-DLE ((여자)아이들) _ LATATA *English subtitles are now available. :D(Please click on 'CC' button or activate 'Interactive Transcript' function)[Notice] 1theK YouTube is also an official channel for the MV, and music shows will count the views from this channel too.[공지] 1theK YouTube는 MV를 유통하는 공식 채널로, 1theK에 업로드된 MV 조회수 또한 음악방송 순위에 반영됩니다.:: iTunes : https://itunes.apple.com/album/i-am-ep/1378887583?l=ko&ls=1&app=itunes▶1theK FB  : http://www.facebook.com/1theK▶1theK TW : https://twitter.com/1theK▶1theK Kakao : https://goo.gl/otRpZc"
36742,B663R7kgxEA,2018-06-03,Sergio Ramos y Demarco Flamenco - Otra estrella en tu corazón (Videoclip Oficial) #VAMOSESPAÑA,La Roja,22,2018-06-01 08:00:01+00:00,"sergio ramos|""demarco flamenco""|""otra estrella en tu corazon""|""videoclip oficial""|""video oficial""|""la roja""|""himno""|""seleccion""|""vamos españa""|""alza tu voz""|""grita con fuerza""|""grita ese gol""|""sergio ramos salah""|""himno oficial""|""federacion española""|""sergo ramos""|""iniesta""|""pique""|""isco""|""jordi alba""|""asensio""|""teaser""",1823558,70401,7365,4300,https://i.ytimg.com/vi/B663R7kgxEA/default.jpg,False,False,False,"¡Nueva canción de La Selección Española! Sergio Ramos y Demarco Flamenco - Otra estrella en tu corazón (Videoclip Oficial) #VAMOSESPAÑA #otraestrellaentucorazónYa disponible en: https://WarnerMusicSpain.lnk.to/otraestrellaentucorazon[LETRA]Nunca olvidemos lo que pudimos sentirAquel camino a la victoria fue vivir“No rendirnos jamás”, siempre nos guiaráAbre tus alas y prepárate a volarCierra los ojos y recuerda ese lugarY él te llevará, tu corazón te llevará (Estribillo)Vamos España, alza tu vozGrita con fuerza, grita ese golJuntos podemos poner corazón Todos soñamos con esa ilusión Vamos España, alza tu vozGrita con fuerza, grita ese golEn nuestra piel reside el valorPon otra estrella en tu corazón Pensando en grande alcanzaremos lo mejorLuchando juntos hacia la estrella con honorTenemos que intentar que la roja brille más. (Puente)(Estribillo)(Coda)Mirando al cielo te quiero escucharY que tu alma nos lleve a ganar… y a ganarA cantar Otra estrella en tu corazón con nuestra versión KaraokeMúsica: Demarco FlamencoLetra: Sergio Ramos & DemarcoSigue a Sergio Ramos en:https://www.facebook.com/SergioRamosOficial/https://www.instagram.com/sergioramos/?hl=enhttps://twitter.com/SergioRamos?ref_src=twsrc%5Egoogle%7Ctwcamp%5Eserp%7Ctwgr%5EauthorSigue a Demarco Flamenco en: https://www.facebook.com/DemarcoFlamencoOficial/https://www.instagram.com/demarco_flamenco/?hl=eshttps://twitter.com/Demarcoflamenco?ref_src=twsrc%5Egoogle%7Ctwcamp%5Eserp%7Ctwgr%5EauthorProducción musical: Gustavo OlmedoProducción artística: J.A. Velasco ‘Maki’ (Piter Music Spain)Guitarra Flamenca: Sergio GallardoGuitarras acústicas y eléctricas: Daniel CortésCoros: Laura Marchena y José PalmaGrabado en Estudios Selene (Sevilla)  por Gustavo Olmedo y en Black Betty Studios (Madrid) por Jose Nortes"
36805,BZt0qjTWNhw,2018-06-03,The Cat Who Caught the Laser,AaronsAnimals,15,2018-05-18 13:00:04+00:00,"aarons animals|""aarons""|""animals""|""cat""|""cats""|""kitten""|""kittens""|""prince michael""|""prince""|""michael""|""laser""|""olympics""|""red""|""dream""",1444957,35816,1287,2453,https://i.ytimg.com/vi/BZt0qjTWNhw/default.jpg,False,False,False,The Cat Who Caught the Laser - Aaron's Animals
36821,BgR_HJ7aGDY,2018-06-03,[MV]SEVENTEEN - CALL CALL CALL! MV,SEVENTEEN Japan official Youtube,22,2018-05-16 08:00:00+00:00,"SEVENTEEN|""セブンティーン""|""세븐틴""|""SVT""|""セブチ""|""せぶち""",5803668,309206,1400,24983,https://i.ytimg.com/vi/BgR_HJ7aGDY/default.jpg,False,False,False,SEVENTEEN JAPAN 1ST MINI ALBUM 'WE MAKE YOU'2018.05.30 Release#SEVENTEEN #CALLCALLCALL! #WE_MAKE_YOU #20180530
36833,BspHjvU11y4,2018-06-03,Kelly Clarkson - Meaning of Life [Official Video],Kelly Clarkson,10,2018-05-13 13:00:41+00:00,"Kelly Clarkson|""Meaning of Life""|""mol""|""Official Video""|""love so soft""|""i dont think about you""|""idtay""|""kelly""|""clarkson""|""the voice""|""atlantic""|""atlantic records""|""pop music""",2180958,48173,1114,2486,https://i.ytimg.com/vi/BspHjvU11y4/default.jpg,False,False,False,MEANING OF LIFE available now: https://Atlantic.lnk.to/MeaningoflifeIDShop “I Don’t Think About You” Merch: http://smarturl.it/IDTAYMerchFollow Kelly Clarkson: https://kellyclarkson.com/https://www.facebook.com/kellyclarksonhttps://twitter.com/kelly_clarksonhttps://www.instagram.com/kellyclarkson/
36749,CE7SkcoyVAI,2018-06-03,The Last Jedi and the 7 Basic Questions of Narrative Drama,Just Write,1,2018-05-31 12:25:24+00:00,"4-4-18|""Star Wars""|""The Last Jedi""|""Rey""|""Finn""|""Poe""|""Kylo Ren""|""Ben Solo""|""Luke Skywalker""|""The First Order""|""Canto Bight""|""Fan Service""|""Character Arcs""|""Film Crit Hulk""|""Film""|""Film Criticism""|""Storytelling""|""Writing""|""Phasma""|""Hux""|""Snoke""|""Wants""|""Needs""|""Conflict""|""The Force""|""Lightsabers""|""May the force be with you""",113011,11376,2645,3166,https://i.ytimg.com/vi/CE7SkcoyVAI/default.jpg,False,False,False,"Use my link http://vrv.co/justwrite to get a 30-day ad-free trial of VRV Premium!Help me make more videos: https://www.patreon.com/justwriteFar from being the “worst movie ever” Star Wars: The Last Jedi has some solid character work, even in its weaker plotlines. In this video, I take a look at Film Crit Hulk’s 7 Basic Questions of Narrative Drama as a way to examine the character arcs of Rey, Finn and Poe. Film Crit Hulk’s essay: https://birthmoviesdeath.com/2013/07/03/film-crit-hulk-man-of-steelWebsite ▶ https://www.justwritemedia.comTwitter ▶ https://www.twitter.com/SageHydenFacebook ▶ http://ow.ly/6u9Z30iyp8JBooks: Creating Character Arcs, by K.M. Weiland: https://amzn.to/2slqAISThe Anatomy of Story: https://amzn.to/2xAO9COMusic: “I’m Going for a Coffee” by Lee ROsevere. Music For Podcasts 3. http://freemusicarchive.org/music/Lee_Rosevere/Music_For_Podcasts_3/02_Im_Going_for_a_CoffeeThe Seven Questions:WHAT DOES THIS CHARACTER WANT?WHAT DOES THIS CHARACTER NEED?HOW DO THOSE WANTS AND NEEDS CONFLICT WITH EACH OTHER WITHIN THE CHARACTER?HOW DO THEY CONFLICT WITH THE OUTSIDE WORLD?HOW DO THEY CONFLICT WITH OTHER CHARACTERS?HOW DOES THE CHARACTER CHANGE THROUGH THOSE CONFLICTS AND HOW DOES THE RESOLUTION AFFECT THEM?WHAT IMPACT DOES THAT CHANGE HAVE ON EVERYONE ELSE?"
36865,CX11yw6YL1w,2018-06-03,Céline Dion - Ashes (from the Deadpool 2 Motion Picture Soundtrack),CelineDionVEVO,10,2018-05-03 12:45:00+00:00,"Ashes|""Columbia""|""Céline Dion""|""Soundtracks""",28859035,591547,13073,35256,https://i.ytimg.com/vi/CX11yw6YL1w/default.jpg,False,False,False,"Celine Dion “Ashes” (From the Deadpool 2 Motion Picture Soundtrack)Get the song and soundtrack here: http://smarturl.it/CDashesGet tickets to Deadpool 2, in theaters May 18, here: http://deadpool.com  Follow Céline Dion:Website: http://celinedion.comFacebook: http://facebook.com/CelineDionTwitter:  http://twitter.com/CelineDionInstagram: http://instagram.com/CelineDion Follow Deadpool:Website: http://deadpool.com Facebook: http://facebook.com/DeadpoolMovieTwitter:  http://twitter.com/DeadpoolMovieInstagram: http://instagram.com/DeadpoolMovie#Deadpool2 LYRICS What’s left to say?These prayers ain’t working anymoreEvery word shot down in flamesWhat’s left to do with these broken pieces on the floor?I’m losing my voice calling on you‘Cause I’ve been shaking, I’ve been bending backwards ‘till I’m brokeWatching all these dreams go up in smokeLet beauty come out of ashesLet beauty come out of ashesAnd when I pray to God all I ask is Can beauty come out of ashes?Can you use these tears to put out the fires in my soul?‘Cause I need you here, oh‘Cause I’ve been shaking, I’ve been bending backwards ‘till I’m brokeWatching all these dreams go up in smokeLet beauty come out of ashesLet beauty come out of ashesAnd when I pray to God all I ask isCan beauty come out of ashesCan beauty come out of ashes"
36765,CZkUNPBlJIQ,2018-06-03,Carpool Karaoke w/ Adam Levine,The Late Late Show with James Corden,24,2018-05-25 05:43:21+00:00,"The Late Late Show|""Late Late Show""|""James Corden""|""Corden""|""late night""|""late night show""|""comedy""|""comedian""|""celebrity""|""celeb""|""celebrities""|""CBS""|""joke""|""jokes""|""funny""|""funny videos""|""funny video""|""humor""|""hollywood""|""famous""|""carpool""|""karaoke""|""carpool karaoke""",7408918,174784,2893,9031,https://i.ytimg.com/vi/CZkUNPBlJIQ/default.jpg,False,False,False,"James and Adam Levine cruise around Los Angeles singing some of Maroon 5's biggest songs before Adam proves to James he can balance anything on his face, and the two compete in a race on a proper track.More Late Late Show:Subscribe: http://bit.ly/CordenYouTubeWatch Full Episodes: http://bit.ly/1ENyPw4Facebook: http://on.fb.me/19PIHLCTwitter: http://bit.ly/1Iv0q6kInstagram: http://bit.ly/latelategramWatch The Late Late Show with James Corden weeknights at 12:35 AM ET/11:35 PM CT. Only on CBS.Get new episodes of shows you love across devices the next day, stream live TV, and watch full seasons of CBS fan favorites anytime, anywhere with CBS All Access. Try it free! http://bit.ly/1OQA29B---Each week night, THE LATE LATE SHOW with JAMES CORDEN throws the ultimate late night after party with a mix of celebrity guests, edgy musical acts, games and sketches. Corden differentiates his show by offering viewers a peek behind-the-scenes into the green room, bringing all of his guests out at once and lending his musical and acting talents to various sketches. Additionally, bandleader Reggie Watts and the house band provide original, improvised music throughout the show. Since Corden took the reigns as host in March 2015, he has quickly become known for generating buzzworthy viral videos, such as Carpool Karaoke."
36756,CbCVIrOK2qM,2018-06-03,"Sami Zayn apologizes for insulting Bobby Lashley: Raw, May 28, 2018",WWE,17,2018-05-29 03:10:03+00:00,"wwe|""world wrestling entertainment""|""wrestling""|""wrestler""|""wrestle""|""superstars""|""कुश्ती""|""पहलवान""|""डब्लू डब्लू ई""|""मैच""|""सुपरस्टार""|""व्यावसायिक कुश्ती""|""مصارعه""|""Raw""|""Sami Zayn""|""Bobby Lashley""|""sp:ty=high""|""sp:st=wrestling""|""sp:scp=athlete_in_match""|""sp:dt=2018-05-28T20:00:00-04:00""|""sp:ev=wwe-raw""|""sp:ath=wwe-saza""|""wwe raw""|""wwe raw highlights""|""raw highlights""|""sami zayn and kevin owens""|""bobby lashley returns to wwe""|""bobby lashley wwe""|""bobby lashley wwe theme""|""bobby lashley finisher""|""bobby lashley entrance""",665122,11186,573,1165,https://i.ytimg.com/vi/CbCVIrOK2qM/default.jpg,False,False,False,Sami Zayn's sardonic public apology sets the stage for a battle with Bobby Lashley at WWE Money in the Bank.Get your first month of WWE Network for FREE: http://wwenetwork.comSubscribe to WWE on YouTube: http://bit.ly/1i64OdTVisit WWE.com: http://goo.gl/akf0J4Must-See WWE videos on YouTube: https://goo.gl/QmhBof
