id,video_id,trending_date,title,channel_title,category_id,publish_time,tags,views,likes,dislikes,comment_count,thumbnail_link,comments_disabled,ratings_disabled,video_error_or_removed,description
36880,JSXKDi3gi3g,2018-06-03,"Calvin Harris, Dua Lipa - One Kiss (Anevo Cover Remix)",MrRevillz,10,2018-05-03 22:56:24+00:00,"MrRevillz|""Deep House""|""Tropical House""|""Melodic House""|""2016""|""New Music""|""calvin harris""|""dua lipa""|""one kiss""|""anevo""|""cover""|""remix""|""calvin harris remix""|""calvin harris cover""|""one kiss remix""|""dua lipa remix""|""dance music""|""pop music""|""music""|""dance""|""pop""|""calvin harris one kiss remix""|""one kiss calvin harris remix""|""anevo remix""|""dua lipa one kiss remix""|""calvin harris dua lipa one kiss""|""calvin harris dua lipa one kiss remix""",856166,4905,238,170,https://i.ytimg.com/vi/JSXKDi3gi3g/default.jpg,False,False,False,"🎶 Spotify Playlist http://spoti.fi/1Vr9N0E📱 Instagram: http://instagram.com/MrRevillz_ 📱 Snapchat: MrRevillz🔔 Turn on notifications to stay updated with new uploads!Stream/ Download: https://fanlink.to/K8x• Follow MrRevillzYoutube - http://youtube.com/MrRevillzFacebook - http://facebook.com/MrRevillzSoundcloud - http://soundcloud.com/MrRevillzSpotify - http://spoti.fi/1UKVReLTwitter - http://twitter.com/MrRevillzInstagram - http://instagram.com/MrRevillz_Snapchat - MrRevillz• Follow AvenoFacebook - http://facebook.com/anevomusicSoundcloud - http://soundcloud.com/itsanevo• Picture by Leio McLarenhttp://unsplash.com/@leio• Get a MrRevillz T-Shirt!http://mrrevillz.bigcartel.comFor any business enquiries, photo and song submissions or anything else please do not hesitate to contact us - Info@MrRevillz.com"
36789,JtIY1Naxg0M,2018-06-03,Game of Zones - S5E7: NBA 1K,Bleacher Report,43,2018-05-24 21:00:01+00:00,"bleacher report|""br""|""nba""|""philadelphia 76ers""|""ben simmons""|""NBA 2K""|""Game of Zones""|""Utah Jazz""|""Donovan Mitchell""|""Boston Celtics""|""Jayson Tatum""|""Los Angeles Lakers""|""Lonzo Ball""|""kyle kuzma""|""malcolm brogdon""|""ronnie 2k""|""markelle fultz""|""basketball""|""comedy""|""game of thrones parody""|""cartoon""",1452779,42322,320,4079,https://i.ytimg.com/vi/JtIY1Naxg0M/default.jpg,False,False,False,NBA rookies are roasting each other over a game of NBA 1K 🎲 #GameOfZones 🗣 GET #GAMEOFZONES MERCH: https://www.gameofzonesstore.com/Find more exclusive sports coverage: http://bleacherreport.com/Subscribe: https://www.youtube.com/user/BleacherReport?sub_confirmation=1Follow us on Twitter: http://www.twitter.com/bleacherreportLike us on Facebook: http://www.facebook.com/bleacherreport
36860,KUUjtUP2CrE,2018-06-03,Carrie Underwood - Cry Pretty (Official Music Video),carrieunderwoodVEVO,10,2018-05-07 01:45:01+00:00,"Carrie Underwood|""Cry Pretty""|""new song""|""official""|""official music video""|""carrie underwood new""|""american idol""|""2018""|""new album""|""music video""|""country music""|""female country""|""pop country""|""country hits""|""summer country songs""",5136207,55692,3150,2902,https://i.ytimg.com/vi/KUUjtUP2CrE/default.jpg,False,False,False,"The official music video for the single “Cry Pretty” by Carrie Underwood, from the upcoming album Cry Pretty, releasing worldwide on September 14, 2018. Directed by Randee St. Nicholas.Download or stream here: http://strm.to/CryPrettySign up for Carrie Underwood’s official newsletter to receive new album updates here: http://bit.ly/CUOfficialNewsletterWebsite: http://www.carrieunderwoodofficial.com/Fan Club: http://www.carrieunderwood.fm/Facebook: https://www.facebook.com/carrieunderwoodInstagram: https://www.instagram.com/carrieunderwoodTwitter: https://twitter.com/carrieunderwoodMusic video by Carrie Underwood performing Cry Pretty. © 2018 UMG Recordings, Inc.http://vevo.ly/09yyaF"
36843,KUaIX_3W7GA,2018-06-03,The Greatest Achievement in Speedrunning History Might Happen Soon (Mario Kart 64 PERFECTION!),RWhiteGoose,20,2018-05-12 15:30:00+00:00,"speedrunning|""speedruns""|""speedrun""|""the-elite""|""the-elite.net""|""mariokart64""|""mario kart 64""|""nintendo 64""|""n64""|""speedgaming""|""matthias rustemeyer""|""greatest speedrun ever""|""amazing""|""beck abney""|""daniel burbank""|""mario kart""|""TAS""|""analysis""|""gamesdonequick""|""summer games done quick""|""sgqd2018""|""world record""|""mario kart shortcuts""|""speedrun history""|""gaming history""|""gaming""|""juegos""|""cringe""|""fail""|""funny""|""gaming fails""|""gaming rage""|""gaming cringe""|""speedrunning cringe""|""gaming wins""|""time trials""",196792,5520,291,564,https://i.ytimg.com/vi/KUaIX_3W7GA/default.jpg,False,False,False,"One man, Matthias Rustemeyer, is standing on the precipice of what might be the very greatest achievement in all of speedgaming history... holding the World Record on *all* 32 of Mario Kart 64's Non-Shortcut World Records.   But which records, and which fellow Mario Kart 64 gamers are standing in his way?All of Matthias' vids can be found on his Youtube channel: https://youtube.com/MK64MRMatthias' Twitch channel: https://twitch.tv/MK64MRMatthias' MK64 WR history: https://mkwrs.com/mk64/profile.php?player=MRAbney's Youtube channel: https://www.youtube.com/channel/UC4ruLe2FbXEVkbqDfZSAWlgAbney's Twitch channel: https://twitch.tv/abney317Abney's MK64 WR history: https://mkwrs.com/mk64/profile.php?player=abney317Daniel Burbank's Twitch channel:  https://twitch.tv/dansgame89Daniel Burbank's DKJP 3lap WR: https://www.youtube.com/watch?v=1KEg4YlLflkDaniel Burbank's MK64 WR history: https://mkwrs.com/mk64/profile.php?player=DanZoran Tintor's DKJP flap WR: https://www.youtube.com/watch?v=Ya6uKEKA2McZoran's MK64 WR history: https://mkwrs.com/mk64/profile.php?player=ZoranTAS footage by: https://www.youtube.com/user/weathertonhttps://twitch.tv/weathertonOther Mario Kart 64 WR videos and history can be found here: https://mkwrs.com/mk64/MK64 World Rankings: http://www.mariokart64.com/mk64/pl.cgi--As always, you can watch me live at http://twitch.tv/rwhitegooseand follow at http://twitter.com/rwhitegooseThanks for watching, and until next time, stay true!"
36886,L8IYPnnsYJw,2018-06-03,Michelle Wolf performs stand-up routine at White House Correspondent's dinner,ABC News,25,2018-04-29 04:59:03+00:00,"politics|""michelle""|""wolf""|""stand""|""up""|""comedy""|""white""|""house""|""correspondents""|""dinner""|""president""|""donald""|""trump""|""mike""|""pence""|""sarah""|""sanders""|""news""|""media""|""paul""|""ryan""|""democrats""|""republicans""|""abc""|""Michelle Wolf white house correspondents dinner""|""WHCD""|""Sarah Huckabee Sanders""|""Mike Pence""|""Trump""|""roast""|""comedy roast""|""Michelle Wolf Sarah Sanders""|""abc news""|""white house correspondents dinner 2018""|""white house correspondents dinner host""|""comedian""|""full""|""complete""|""watch full""|""Michelle Wolf speech""|""monologue""|""transcript""",1900744,29788,8187,13261,https://i.ytimg.com/vi/L8IYPnnsYJw/default.jpg,False,False,False,"Wolf's routine took shots at President Donald Trump, Vice President Mike Pence, White House press secretary Sarah Sanders and the media."
36750,LF-1zy8VII4,2018-06-03,Panic! At The Disco cover Dua Lipa's IDGAF in the Live Lounge,BBC Radio 1,10,2018-05-29 14:39:22+00:00,"Panic! At The Disco|""Dua Lipa""|""Live Lounge""|""BBC""|""Radio 1""|""IDGAF""",852641,58377,558,3201,https://i.ytimg.com/vi/LF-1zy8VII4/default.jpg,False,False,False,Panic! At The Disco cover Dua Lipa's IDGAF in the BBC Radio 1 Live Lounge
36777,LftOOM6qlJ4,2018-06-03,Liam Gallagher - I've All I Need (Official Video),Liam Gallagher,22,2018-05-25 13:57:47+00:00,"liam gallagher|""i've all i need""|""as you were""|""oasis""|""As You Were""|""Liam""|""Gallagher""|""LGx""|""Debut Album""|""Official Video""|""Noel Gallagher""|""Manchester""|""Live""|""Gig""|""Liam Gallagher Live""|""Liam Glastonbury""|""As U were""|""Paper Crown""|""Rock Music""|""Electric Guitar""|""Gallager""|""Studio Time""|""Liam Gallagher Studio""|""Live Forever""|""Live Forever Brits""|""Lyrics""|""Song Lyrics""|""New Album""|""New Video""|""LG New Video""|""Liam New Video""|""Beady Eye""",254928,11036,175,1088,https://i.ytimg.com/vi/LftOOM6qlJ4/default.jpg,False,False,False,Liam Gallagher - I've All I Need (Official Video)Liam Gallagher's solo album 'As You Were' is out now https://l-gx.com/lg_asyouwereSubscribe to Liam Gallagher’s Youtube channel: https://l-gx.com/yt_subscribeWatch Liam Gallagher’s videos: https://l-gx.com/asyouwere_ytplaylistFollow Liam Gallagher on Twitter: https://l-gx.com/twitterFacebook: https://l-gx.com/facebookInstagram: https://l-gx.com/instagramSpotify: https://wbr.ec/lgx_spotifyLyrics:I’ve all I need and moreYou hold the key for sureIf all I have is youThen darling please be trueThere’s no time for looking backThanks for all your supportSlow down all things must passTake your timeKnow the scoreTomorrow never knowsThe winds of change must blowI hibernate and singWhile gathering my wingsThere’s no time for looking backThanks for all your supportSlow down all things must passTake your timeKnow the scoreI’ve all I need and moreYou hold the keyIt’s not goodbyeSo dry your eyesCome rain or shineI’ve all I need and moreThere’s no time for looking backThanks for all your supportSlow down all things must passTake your timeKnow the scoreIt’s not goodbyeSo dry your eyesCome rain or shineI’ve all I need and moreWe hold the key for sureLightening FilmsFilmed and directed byCharlie Lightening
36826,M-E5wDgptQA,2018-06-03,How Black Panther's Visual Effects Were Made | WIRED,WIRED,24,2018-05-15 16:02:53+00:00,"avengers|""black panther""|""chadwick boseman""|""computer animation""|""danai gurira""|""design fx""|""marvel""|""marvel comics""|""michael b. jordan""|""special effects""|""visual effects""|""ryan coogler""|""okoye""|""wakanda""|""shuri""|""kilmonger""|""letitia wright""|""method studios""|""kilmonger suit""|""michael b jordan bts""|""black panther behind the scenes""|""black panther making of""|""making of black panther""|""black panther movie""|""black panther visual effects""|""black panther bts""|""wired""|""wired.com""",1782839,29426,818,2639,https://i.ytimg.com/vi/M-E5wDgptQA/default.jpg,False,False,False,"Daryl Sawchuk, Visual Effects Supervisor for Method Studios and Animation Supervisor for Black Panther, gives WIRED an exclusive look at breakdowns of the digital Black Panther and Kilmonger suits, and the final fight scene of Marvel's mega-blockbuster. Black Panther is available on Blu-Ray and DVD May 15, 2018.Read more about Black Panther on WIRED.com:Why Lighting and Makeup Were Black Panther's Secret Weapons: https://www.wired.com/story/black-panther-lighting-makeup/ Behind the Scenes of Black Panther's Afrofuturism: https://www.wired.com/story/black-panther-design/What Black Panther's Success Means for the Future of Movies: https://www.wired.com/story/black-panther-box-office-hollywood/Want More Black Panther? Here are 5 Comics to Read: https://www.wired.com/story/black-panther-reading-list/Still haven’t subscribed to WIRED on YouTube? ►► http://wrd.cm/15fP7B7 ABOUT WIREDWIRED is where tomorrow is realized. Through thought-provoking stories and videos, WIRED explores the future of business, innovation, and culture.How Black Panther's Visual Effects Were Made | WIRED"
36812,MLFQxVOvan4,2018-06-03,NEW: Jordan Peterson & Russell Brand on FREEDOM and TYRANNY,Russell Brand,25,2018-05-17 18:40:40+00:00,"Russell Brand|""Brand Russell""|""Russell Brand video""|""Russell Brand news""|""Russell Brand politics""|""Recovery""|""Jordan Peterson""|""Under The Skin with Russell Brand""|""Jordan Peterson Interview""|""Jordan Peterson and Russell Brand""|""Psychology""|""Jordan Peterson explains""|""Jordan Peterson Controvery""|""Mythology""|""Addiction""|""Self-Help""|""Jordan Person Advice""|""Russell Brand Interview""|""The Left Vs The Right""|""Liberals Vs Conservatives""|""Joe Rogan""",529308,16207,623,4419,https://i.ytimg.com/vi/MLFQxVOvan4/default.jpg,False,False,False,"Get my new book Recovery here:UK: https://amzn.to/2IWf00AUS: http://tinyurl.com/ydcwz3kdAustralia: https://t.co/Ri1XSonD2XIn this special edition of Under The Skin celebrating the paperback release of my book Recovery - clinical psychologist Dr. Jordan Peterson joins me again to discuss the nature of social hierarchies, where power lies and how to live in harmony. We also compare his 12 Rules for Life with the 12 Steps in my book Recovery.Listen to my Under The Skin podcast here https://itunes.apple.com/au/podcast/u...Subscribe to the my channel here: http://tinyurl.com/opragcgProduced & edited by Jenny May Finn / @JennyMayFinnSound Engineer: Oliver Cadman"
36871,MQIvV800Atk,2018-06-03,SUPERFLY - Official Trailer (HD),Sony Pictures Entertainment,24,2018-05-04 15:59:14+00:00,"superfly|""director x""|""trevor jackson""|""jason mitchell""|""superfly movie""|""superfly movie 2018""|""superfly teaser""|""teaser""|""movie""|""atlanta""|""original superfly""|""Superfly Trailer""|""Superfly 2018""|""#Superfly""|""Official Teaser""|""Superfly Teaser Trailer""|""Youngblood Priest""|""Lex Scott Davis""|""Andrea Londo""|""Jacob Ming-Trent""|""Omar Chaparro""|""Alex Tse""|""Return of Superfly""|""Future""|""Future Rapper""|""blaxsploitation""|""Future New Music""|""New Future Song""|""RIck Ross""|""Sony""|""Sony Pictures""",3830480,9771,1518,1767,https://i.ytimg.com/vi/MQIvV800Atk/default.jpg,False,False,False,"All hustle. No Shame. Don’t miss #Superfly only in theaters June 15.Subscribe to Sony Pictures for exclusive content: http://bit.ly/SonyPicsSubscribeFollow us on social:https://www.facebook.com/SuperflyMovie/https://www.instagram.com/superflymovie/https://twitter.com/superflymovieSuperfly – the film that helped define a genre in its characters, look, sound, and feel – is reimagined with Director X, director of legendary music videos (Drake, Rihanna), introducing it to a new generation.  The screenplay is by Alex Tse.Directed by: Director XCast:      Trevor JacksonJason MitchellMichael Kenneth WilliamsLex Scott DavisJennifer Morrison"
36754,MmPPxQnaGDY,2018-06-03,Half in the Bag: Solo: A Star Wars Story,RedLetterMedia,24,2018-05-29 13:42:59+00:00,"redlettermedia|""red letter media""|""red""|""letter""|""media""|""plinkett""|""half in the bag""|""mike stoklasa""|""jay bauman""|""rich evans""|""Solo""|""A Star Wars Story""|""Review""",713343,26093,1064,8375,https://i.ytimg.com/vi/MmPPxQnaGDY/default.jpg,False,False,False,"Mike, Jay, and Mike's drug induced hallucination name Rick Evans talk about the most unanticipated anticipation of a movie called Solo: A Solo Wars Star Wars Solo Story"
36798,N1HAMUAXzbs,2018-06-03,Kris Wu – Like That (Official Music Video),Kris Wu,10,2018-05-22 15:05:18+00:00,"Kris Wu|""Wu Yi Fan""|""吴亦凡""|""fan shi""|""wuyifan""|""kw""|""kris""|""like that""|""likethat""",12643244,77119,0,9874,https://i.ytimg.com/vi/N1HAMUAXzbs/default.jpg,False,False,False,"Special thanks to Stella Maxwell.Get “Like That”, out now: http://smarturl.it/LikeThatKWFor more:https://www.facebook.com/kriswugalaxyhttps://www.instagram.com/kriswu https://twitter.com/kriswu For updates:http://www.kriswuofficial.com"
36822,N7HFXgyTya0,2018-06-03,My Dinosaur Is a Service Animal (with Chris Pratt and Bryce Dallas Howard!),CollegeHumor,23,2018-05-15 17:30:00+00:00,"Collegehumor|""CH originals""|""comedy""|""sketch comedy""|""internet""|""humor""|""funny""|""sketch""|""chris pratt""|""bryce dallas howard""|""appearances""|""celebrities""|""Jurassic World""|""pets""|""animals""|""flying""|""dinosaurs""|""feels""|""anxiety""|""action movies""|""customer service""|""raphael chestang""|""CH Shorts""|""jurassic park""|""jurassic""|""service animals""|""service animal""|""chris pratt jurassic park""|""chris pratt jurassic park world""|""bryce dallas howard kiss""|""bryce dallas howard movies""|""chris bryce service dinosaur""|""latest""",1806118,79140,1285,3621,https://i.ytimg.com/vi/N7HFXgyTya0/default.jpg,False,False,False,Just because it’s a Velociraptor with knives for teeth doesn’t mean it’s not my best friend.FOLLOW THE CAST:ALLY: http://www.twitter.com/lilbeardsleyGRANT: http://www.twitter.com/grantobKATIE: http://www.twitter.com/katiemarovitchTRAPP: http://www.twitter.com/mikewtrappRAPH: http://www.twitter.com/chestangraphaelREKHA: http://www.twitter.com/rekhalshankarBRENNAN: https://twitter.com/brennanlmSAM: http://www.twitter.com/samreichSee more http://www.collegehumor.comLIKE us on: http://www.facebook.com/collegehumorFOLLOW us on: http://www.twitter.com/collegehumorFOLLOW us on: http://www.collegehumor.tumblr.comSIGN UP for our emails: http://bit.ly/2E6svorCASTChris PrattBryce Dallas HowardRaphael ChestangBlue - Nick CelentanoAirport Travelers - Ellie PangerRorrie TravisAntonio SalgadoDanice PageSteven LeeAndrea ClemonsJames KarroumLaura JohnstonIan SollenbergerKillian SobelCREWDirector - Ryan Anthony MartinWriter - Raphael ChestangProducer - Shane CrownProduction Coordinator - Francesca McLafferty Editor - Sam Geer
36878,OAGfx7eB3gA,2018-06-03,How to pick up a cat like a pro - Vet advice on cat handling.,Helpful Vancouver Vet,15,2018-05-01 23:13:42+00:00,"Cat|""cats""|""cat handling""|""cat safety""|""cute""|""cute cats""|""how-to""|""for kids""|""pet tips""|""pet safety""|""pet safety for kids""|""vet""|""veterinary""|""veterinarian""|""Vancouver Vet""|""Vancouver""|""Vancouver is awesome""|""vancouver veterinary""|""vancouver veterinarian""|""best vet""|""best vet in vancouver""|""best veterinarian in vancouver""|""cats of instagram""|""cats of twitter""|""pets""|""advice""|""pet advice""|""arbutus west animal clinc""|""vancouver east veterinary clinic""|""#squishthatcat""",3751027,109997,2834,9797,https://i.ytimg.com/vi/OAGfx7eB3gA/default.jpg,False,False,False,Dr.  Burstyn and his feline friends demonstrate how to pick up a cat in a way that is comfortable for the cat and safe for you.  A must watch for anyone with a feline in the family.
36790,Oqca3fl0GEQ,2018-06-03,Using the Eye of the Storm Tracker in Fortnite Battle Royale Gameplay,gattu,20,2018-05-22 13:36:18+00:00,"eye of the storm tracker|""eye of the storm tracker gameplay""|""eye of the storm tracker fortnite""|""jetpacks""|""fortnite""|""fortnite battle royale""|""how to use eye of the storm tracker""",572192,2659,864,634,https://i.ytimg.com/vi/Oqca3fl0GEQ/default.jpg,False,False,False,eye of the tracker is a cool item which launched with the jetpack.It lets you know where the next storm is going to head.What does the eye of the Storm Tracker do? if that was your question :)Like and Subscribe for more videos :)SOCIAL LINKS :SUBSCRIBE ► https://goo.gl/zVs2kmFACEBOOK  ► https://www.facebook.com/officialgattuTWITTER     ► https://twitter.com/officialgattu#fortnite #fortnitebr #fortniteupdate #fortnitejetpacks #jetpacks #eyeofthestormtracker #v4.2 Patch Notes
36861,P3iLo_JI9oY,2018-06-03,"Travis Scott - Watch (Audio) ft. Lil Uzi Vert, Kanye West",TravisScottVEVO,10,2018-05-04 06:23:05+00:00,"Ye|""Kanye""|""Travis""|""Travis Scott song""|""Travis Scott hit""|""Travis Kanye song""|""Vert""|""Lil Uzi""|""hip hop""|""Rodeo""|""Birds in the Trap Sing McKnight""|""goosebumps""|""mamacita""|""antidote""|""3500""|""butterfly effect""|""La Flame""|""#laflame""|""laflame""|""Cactus Jack""|""Trav""|""houston""|""houston rap""|""huncho jack""|""Owl Pharaoh""|""Days Before Rodeo""|""Pick Up the Phone""|""Astroworld""|""Epic/Grand Hustle""|""Hip Hop""|""Travis Scott feat. Lil Uzi Vert & Kanye West""|""Watch""",18076461,266848,12065,15653,https://i.ytimg.com/vi/P3iLo_JI9oY/default.jpg,False,False,False,Watch by Travis Scott feat. Lil Uzi Vert & Kanye West available at: http://smarturl.it/WatchTShttp://travisscott.com/musichttps://twitter.com/trvisxxhttps://instagram.com/travisscott/https://www.facebook.com/travisscottlaflame
36855,PWwvR6cSH4o,2018-06-03,Dad Jokes with Kratos,Polygon,20,2018-05-08 21:30:00+00:00,"kratos|""videogames""|""video games""|""polygon""|""god of war""|""god of war 4""|""christopher judge""|""tealc""|""kratos voice actor""|""kratos va""|""cory barlog""|""comedy""|""dad jokes""|""jokes""|""bad jokes""|""atreus""|""god of war voice actor""|""god of war voice""|""kratos dad""|""kratos father""|""kratos daddy""|""stargate""",2627233,112330,829,3807,https://i.ytimg.com/vi/PWwvR6cSH4o/default.jpg,False,False,False,"Kratos may be a dad now, but his journey to fatherhood won't be complete until he delivers some truly awful dad jokes. We teamed up with Kratos voice actor Christopher Judge to make our daddy dreams a reality.SUBSCRIBE for more videos! http://bit.ly/2B7gM6MLike us on Facebook: http://bit.ly/PolygonFBFollow us on Twitter: http://bit.ly/PolygonTwitterFollow us on Instagram: http://bit.ly/PolygonInstaAnd for more great news and coverage, check out: www.polygon.comPolygon is an entertainment website founded in 2012 in partnership with Vox Media. Our mission is to cover not only games but the artists who make them, the fans who love them, and the culture surrounding them."
36829,QW8whgmyTNU,2018-06-03,This Is America: Women's Edit,Nicole Arbour,24,2018-05-12 22:42:24+00:00,"Nicole Arbour|""World's Sexiest Comedian""|""funny""|""comedian""|""#GOTEAM""|""This Is America""|""Childish Gambino""|""Girl Power""|""#MeToo""|""Feminists""",3005690,0,0,0,https://i.ytimg.com/vi/QW8whgmyTNU/default.jpg,True,True,False,"About This Is America: Women’s EditI thought it best to respond to the misinterpretation of my video here to clarify openly.  (click show more)The purpose of my rendition was to honour the spirit of the video which absolutely moved me, by adding my and many women’s life experiences and truths to the brave and brutal truths expressed in the original. It was created with every intention of bringing a light to women’s experiences such as the shaming of mothers breast feeding, common place date rape drugging, the labels put on us of “prude or hoe,” pressures to create a family, workplace harassment, the glass ceiling, drug dependency, effects of social media on modern relationships and self, and included a nod to the cheerleaders who have come forward demanding at least min wage from the multi million dollar corporations they work for. It was a tongue in cheek way to give additional glory to what I believe is the most impactful piece of art in recent years.In retrospect, due to the sensitive nature of the original, I understand why some people are wrongly portraying this as white vs black. However, this was not the intent or theme at all. We had a very diverse cast and creative team working on project from start to finish, who signed on to honour the original while adding more truth from another perspective. I also understand my cheeky responses to hateful comments have been taken out of context, and I take full responsibility for responding to trolls in a way that could be so easily manipulated and become hurtful when reposted without context. I firmly believe the best thing that can happen in America and North America right now is for everyone to create their own version of this video and show what life is like from their side. Through this honesty, I believe we can discover a new level of empathy and understanding for each other that will ultimately and finally lead us to healing and unity that is desperately needed in society. What can we agree on? What do we have in common? Where are we hurting? Start there, then rebuild. Thanks so much for the continued support while I discover how to best express my ideas, comedy and art, and I appreciate your patience when I fumble while learning to maneuver within the awesome blessing that is having such a large voice. Love for everybody, #GOTEAM 🤘🏻Nicole"
36800,Qcj15vHJTtk,2018-06-03,Royal Wedding - SNL,Saturday Night Live,24,2018-05-20 04:58:51+00:00,"SNL|""Saturday Night Live""|""SNL Season 43""|""SNL Episode 1746""|""Tina Fey""|""Prince Harry""|""Mikey Day""|""Meghan Markle""|""Royal Wedding""|""Kate Middleton""|""Cecily Strong""|""Prince Charles""|""Beck Bennett""|""Queen Elizabeth""|""Kate McKinnon""|""Prince William""|""Alex Moffat""|""Chris Redd""|""Heidi Gardner""|""Kenan Thompson""|""Russell Brand""|""Pete Davidson""|""Elton John""|""Aidy Bryant""|""Leslie Jones""|""s43""|""s43e21""|""episode 21""|""live""|""new york""|""comedy""|""sketch""|""funny""|""hilarious""|""late night""|""host""|""music""|""guest""|""laugh""",8303192,65282,13960,8311,https://i.ytimg.com/vi/Qcj15vHJTtk/default.jpg,False,False,False,"Footage from Prince Harry's (Mikey Day) wedding reception features Kate Middleton (Cecily Strong), Prince Charles (Beck Bennett), Queen Elizabeth (Kate McKinnon), Prince William (Alex Moffat), Auntie Creepy (Tina Fey) and more.#SNL #SNL43Get more SNL: http://www.nbc.com/saturday-night-liveFull Episodes: http://www.nbc.com/saturday-night-liv...Like SNL: https://www.facebook.com/snlFollow SNL: https://twitter.com/nbcsnlSNL Tumblr: http://nbcsnl.tumblr.com/SNL Instagram: http://instagram.com/nbcsnl SNL Pinterest: http://www.pinterest.com/nbcsnl/"
