id,video_id,trending_date,title,channel_title,category_id,publish_time,tags,views,likes,dislikes,comment_count,thumbnail_link,comments_disabled,ratings_disabled,video_error_or_removed,description
36849,-DRsfNObKIQ,2018-06-03,Eleni Foureira - Fuego - Cyprus - LIVE - First Semi-Final - Eurovision 2018,Eurovision Song Contest,24,2018-05-08 20:32:32+00:00,"Eurovision Song Contest|""2018""|""Lisbon""|""Cyprus""|""Eleni Foureira""|""Fuego""|""live""|""First Semi-Final""",13836345,149162,45616,26550,https://i.ytimg.com/vi/-DRsfNObKIQ/default.jpg,False,False,False,Eleni Foureira represented Cyprus at the first Semi-Final of the 2018 Eurovision Song Contest with the song Fuego. Read more about Eleni Foureira: https://eurovision.tv/participant/eleni-foureira
36737,-VgOGzBcMIg,2018-06-03,Queer Eye | Theme Song (All Things) Feat. Betty Who | Netflix,Netflix,24,2018-06-01 02:00:00+00:00,"Netflix|""Trailer""|""Netflix Original Series""|""Netflix Series""|""television""|""movies""|""streaming""|""movies online""|""television online""|""documentary""|""comedy""|""drama""|""08282016NtflxUSCAN""|""watch movies""|""Queer Eye""|""Betty Who""|""Pride""|""Happy Pride""|""Pride Month""|""LGBTQ""|""LGBTQIA""|""Queer""|""Fab 5""|""Fab Five""|""Antoni""|""Karamo""|""Bobby""|""Tan""|""Jonathan""|""JVN""|""music video""|""Bobby Berk""|""Karamo Brown""|""Antoni Porowski""|""Jonathan Van Ness""|""Tan France""|""pop""|""dance""|""SOTS""|""song of the summer""|""PLvahqwMqN4M0_eOsCRg4rInOe-yxm0uAr""",268836,8881,1204,1028,https://i.ytimg.com/vi/-VgOGzBcMIg/default.jpg,False,False,False,"NEW EPISODES JUNE 15!Happy Pride, henny! Things just keep getting better. Betty Who has teamed up with the Fab 5 to revamp the Queer Eye Theme song.  New episodes begin streaming June 15 only on Netflix. Listen to the song: http://bettywho.lnk.to/queereyeWatch Queer Eye on Netflix: https://www.netflix.com/in/title/80160037SUBSCRIBE: http://bit.ly/29qBUt7About Netflix:Netflix is the world's leading internet entertainment service with 125 million members in over 190 countries enjoying more than 140 million hours of TV shows and movies per day, including original series, documentaries and feature films. Members can watch as much as they want, anytime, anywhere, on nearly any internet-connected screen. Members can play, pause and resume watching, all without commercials or commitments.Connect with Netflix Online:Visit Netflix WEBSITE: http://nflx.it/29BcWb5Like Netflix Kids on FACEBOOK: http://bit.ly/NetflixFamilyLike Netflix on FACEBOOK: http://bit.ly/29kkAtNFollow Netflix on TWITTER: http://bit.ly/29gswqdFollow Netflix on INSTAGRAM: http://bit.ly/29oO4UPFollow Netflix on TUMBLR: http://bit.ly/29kkemTQueer Eye | Theme Song (All Things) Feat. Betty Who | Netflixhttp://youtube.com/netflix"
36791,-bx_vG94LSo,2018-06-03,Bazzi - Beautiful (Official Video),Bazzi,10,2018-05-23 12:00:00+00:00,"Bazzi|""Bautiful""|""Mine""|""Cosmic""|""Official Audio""|""Official Video""|""Warner Music Group""|""Atlantic Records""|""Bazzi Music""|""Beautiful Angel""|""gucci looks on you amazing""|""you so fucking precious when you smile""|""VgKjHh1Y-1Y""|""Bazzi Mine""|""Bazzi Beautiful""|""Bazi""|""andrew bazzi""|""bazzi""|""myself""|""funny""|""vine""|""snapchat""|""bazzi beautiful""|""bazzi mine""|""bazi""|""cosmic""|""mine""|""bazzi cosmic""|""bazzi fantasy""|""bazzi myself""|""bazzi mine meme""|""mine meme""|""bazzi music""|""bazzi why""",1603082,73290,893,3797,https://i.ytimg.com/vi/-bx_vG94LSo/default.jpg,False,False,False,"Stream + download COSMIC: https://Bazzi.lnk.to/COSMICIDSubscribe to my channel: https://goo.gl/C6KC1mFollow Bazzi:https://www.instagram.com/bazzihttps://twitter.com/bazzihttps://www.facebook.com/BazziWorldwidehttp://bazziofficial.comDirector/VFX/Edit: Sherif HigazyProducers: Nick Ruff and Cailin LowryStarring: Renee HerbertDP: Zac Adams1st AC:  Gordon Yould2nd AC: Tristan Walczak Gaffer: Hiram BorgesProduction Designer: Jill BencsitsSet Decorator: Krista Thomas-ScottLeadman: Owen Cook 1st AD: Shelby MaloneProduction Assistant: Anthony RuffBazzi's Stylist: Andrew AndradeStylist: Melynda ChoothesaMake Up Artist: Kristine Urzua Production Company: Thermonuclear, Nova FilmsExecutive Producer: Sherif Higazy Director's Rep: Emily Sanders Video Commissioner: Shadeh Smith"
36774,-i1_jpjmdJE,2018-06-03,Blink 182 - I Miss You,Jimmy Kimmel Live,23,2018-05-24 10:00:00+00:00,"jimmy|""jimmy kimmel""|""jimmy kimmel live""|""late night""|""talk show""|""funny""|""comedic""|""comedy""|""clip""|""comedian""|""mean tweets""|""#music""|""blink-182""|""kings of the weekend""|""las vegas""|""pop punk""|""punk rock""|""alt-rock""|""alt rock""|""vegas""|""travis barker""|""mark hoppus""|""rock music""|""concert""|""live music""|""all the small things""|""take off your pants and jacket""",575672,10158,1428,1839,https://i.ytimg.com/vi/-i1_jpjmdJE/default.jpg,False,False,False,"Blink-182 perform I Miss You on Jimmy Kimmel LiveSoccer Legend Brandi Chastain on Terrible Plaque of Her Face https://youtu.be/sSLhwUosA7o SUBSCRIBE to get the latest #KIMMEL: http://bit.ly/JKLSubscribe Watch Mean Tweets: http://bit.ly/KimmelMT10 Connect with Jimmy Kimmel Live Online: Visit the Jimmy Kimmel Live WEBSITE: http://bit.ly/JKLWebsiteLike Jimmy Kimmel on FACEBOOK: http://bit.ly/KimmelFBLike Jimmy Kimmel Live on FACEBOOK: http://bit.ly/JKLFacebookFollow @JimmyKimmel on TWITTER: http://bit.ly/KimmelTWFollow Jimmy Kimmel Live on TWITTER: http://bit.ly/JKLTwitterFollow Jimmy Kimmel Live on INSTAGRAM: http://bit.ly/JKLInstagram About Jimmy Kimmel Live: Jimmy Kimmel serves as host and executive producer of Emmy-winning Jimmy Kimmel Live, ABC's late-night talk show.Jimmy Kimmel Live is well known for its huge viral video successes with 5.6 billion views on YouTube alone.Some of Kimmel's most popular comedy bits include - Mean Tweets, Lie Witness News, Jimmy's Twerk Fail Prank, Unnecessary Censorship, YouTube Challenge, The Baby Bachelor, Movie: The Movie, Handsome Men's Club, Jimmy Kimmel Lie Detective and music videos like I (Wanna) Channing All Over Your Tatum and a Blurred Lines parody with Robin Thicke, Pharrell, Jimmy and his security guard Guillermo.Now in its sixteenth season, Kimmel's guests have included: Johnny Depp, Meryl Streep, Tom Cruise, Halle Berry, Harrison Ford, Jennifer Aniston, Will Ferrell, Katy Perry, Tom Hanks, Scarlett Johansson, Channing Tatum, George Clooney, Larry David, Charlize Theron, Mark Wahlberg, Kobe Bryant, Steve Carell, Hugh Jackman, Kristen Wiig, Jeff Bridges, Jennifer Garner, Ryan Gosling, Bryan Cranston, Jamie Foxx, Amy Poehler, Ben Affleck, Robert Downey Jr., Jake Gyllenhaal, Oprah, and unfortunately Matt Damon.Blink 182 - I Miss Youhttps://youtu.be/-i1_jpjmdJE"
36731,-kxPDAiuijo,2018-06-03,Beer Yoga with Chance the Rapper | Kevin Hart: What The Fit Episode 13 | Laugh Out Loud Network,LOL Network,23,2018-05-31 17:00:04+00:00,"What the Fit|""Kevin Hart What the Fit""|""Kevin Hart""|""YouTube Originals""|""YouTube Originals Series""|""Series""|""Conan O’Brien""|""James Corden""|""Tiffany Haddish""|""Khloe Kardashian""|""Leslie Jones""|""Bill Hader""|""Rhett and Link""|""Ken Jeong""|""Jack Black""|""Chance the Rapper""|""WTF""|""Evander Holyfield""|""Joel McHale""|""Terry Crews""|""Niecy Nash""|""Rhett & Link""|""DJ Khaled""|""LOL""|""LA Rams""|""Rams""|""Chance""|""Los Angeles Rams""|""Laugh Out Loud Network""|""Fitness""|""Fun""|""Funny""|""Comedy""|""Laugh""|""Yoga""|""Basketball""",1164909,37087,416,3664,https://i.ytimg.com/vi/-kxPDAiuijo/default.jpg,False,False,False,"Kevin Hart and Chance the Rapper drink beers, FaceTime celebrities and find their inner yogi at the bar.Kevin Hart: What The Fit is a brand new unscripted comedy starring Kevin Hart and celebrity guests. In each episode, Kevin invites his friends to join him in taking on a different whacky workout from sumo wrestling with Conan O'Brien to goat yoga with Khloé Kardashian and cowboy rodeo-ing with Leslie Jones. New episode every Thursday and bonus footage every Monday!FOLLOW THE FUNNY:Facebook▶ http://bit.ly/LOLNetwork-FBTwitter▶ http://bit.ly/LOLNetwork-TWInstagram▶ http://bit.ly/LOLNetwork-IGYouTube▶ http://bit.ly/LOLNetwork-YTSnapchat▶ LOLNetworkOfficial Website▶ http://www.laughoutloud.comKevin Hart’s Laugh Out Loud Network YouTube channel is a specially-curated global platform for the NOW generation of comedians and original comedic content. It’s the ultimate destination for fans of funny. Subscribe for exclusive behind the scenes, live commentary by Kevin Hart, pranks, skits, and everything fun. Laugh Out Loud Network is a joint venture brainchild of Kevin Hart and Lionsgate.© MMXVII LIONS GATE TELEVISION, INC.ALL RIGHTS RESERVED.Executive ProducersMATT KUNITZPIP WELLSREBECCA SHUMSKY QUINNDAVID SHUMSKYMARK HARRISJEFF CLANAGANKEVIN HARTCo-Executive ProducersMATT KAYED. MAX PORISHosted ByKEVIN HARTGuest StarringCHANCE THE RAPPERDirected ByALEX VAN WAGNERSupervising ProducerDOMINIC CICCODICOLALine ProducerRACHEL KIELBORNProducersNICK ALARCONKRISTINA GOROLEVICHAMBER MIKEMARIE MITCHELLCANDICE C. WILSONEditorsJOSH BELSONJOE CAULEYComedy ProducerHARRY RATCHFORDAssociate ProducersJADA BATESSCOTT MARTINKEVIN WILSONAssociate DirectorJASON EDWARDSStage ManagerWOLFGANG DELGADODirector of PhotographyTIM MURPHYAudio SupervisorCURTIS ROHMProduction DesignerRYAN FAUGHTTalent Casting ByJB TALENTProduction ManagerMCKENZIE HANSONPost Production SupervisorLINDSAY HEMPELCamera OperatorsRUBEN AVENDANOIVAN DURANRICHARD “RICKY” MARTINEZMALCOLM SERRETTEMARQUES SMITHLead Camera AssistantJEREMIAH THORNECamera AssistantsDEANDRE GREENDAVE HAWESTERRANCE LOFTON JR.Tech SupervisorED DANIELIANTech DepartmentMIKE DELLAMONICAWALLACE DIXONDAN FERRISStill PhotographerMIKE WEAVERMedia ManagerANDREW CURTISAudio MixersANGELO CAVUOTOROBERT MATTHEWSFRANK MONTESNATE NADELLGafferAJ TAYLORBest BoyDANNY VINCENTKey GripROLAND MARTINEZElectriciansDOMINICK ADAMEERIK GONZALESJIM KIMURAGripMARVIN MEJIALead ManKEVIN MINCINSet DressersRILEY CRAPPER MARSHALL KINGProduction ManagerSTEVEN PONCEProduction AccountantSHARON PACKProduction AssociateMICHAEL A. ROWETalent ProducerASHLEY RHORERTalent ManagerDOMINICK MERONETalent AssociateMARLENA HALLERWardrobeASHLEY NORTHDARI SETTELMakeupMICHELLE DEMILTLocation ManagerCARLYN COUCHKey Assistant Location ManagerCLAY DODDERAssistant Location ManagerSHERRY ROLDANDriversJONATHAN ANDERSONCHRIS CLARK Set MedicJOHN AUSTINCraft ServicesANTONIO MARCOSLead Assistant EditorCHRIS HICKSAssistant EditorALEX GILBERTMusic SupervisorRICK KRIMBELColoristTAL, C.S.I.Online EditorJOSIAH COHENRe-Recording MixerTERRANCE DWYER, C.A.S.Music ByANDREW APPLEPIE MUSICBEAR & OWLKILLER TRACKSSIGNATURE TRACKSGraphics ByMIDNIGHT SHERPAProduction AssistantsAARON BELLCAP CREDLEKEVYN DELGADOJEFF DODSONEKKO GAHASTEPHEN GARONEJOHNNY GOMEZDAVE KERNEVAN NELSONSTEPHANIE SINGERSCOTT WHITEMANProduction LegalRAYMOND LEGAL, P.C.Special ThanksBLUEPRINT POST PRODUCTIONBRUCE’S CATERINGC-MOUNT INDSUTRIESILLUMINARLYFTMIXERS POST SOUND SERVICESTHE BOSCHETTI GROUPVER EQUIPMENT RENTALS"
36761,0URpDxIjZrQ,2018-06-03,Christopher Robin Official Trailer,Disney Movie Trailers,1,2018-05-25 19:00:02+00:00,"Christopher Robin|""Winnie the Pooh""|""Eeyore""|""Piglet""|""Tigger""|""Kanga""|""Roo""|""Owl""|""Rabbit""|""Trailer""|""Preview""|""Hundred Acre Wood""|""Live action""|""stuffed""|""adorable""|""feels""|""cry""|""sweet""|""funny""|""classic""|""Disney""|""Walt Disney""|""Many Adventures""|""Ewan McGregor""|""Walt Disney Studios""",5227761,145298,3795,16483,https://i.ytimg.com/vi/0URpDxIjZrQ/default.jpg,False,False,False,"Out of the Wood. Into the city. Watch the brand new trailer for Disney's Christopher Robin. See the film in theatres August 3.In the heartwarming live action adventure Disney’s “Christopher Robin,” the young boy who shared countless adventures with his band of lovable stuffed animals in the Hundred Acre Wood is now grown up and living in London but he has lost his way. Now it is up to his childhood friends to venture into our world and help Christopher Robin rediscover the joys of family life, the value of friendship and to appreciate the simple pleasures in life once again. Disney’s “Christopher Robin” is directed by Marc Forster from a screenplay by Alex Ross Perry and Allison Schroeder and a story by Perry based on characters created by A.A. Milne and E.H. Shepard. The producers are Brigham Taylor and Kristin Burr with Renée Wolfe and Jeremy Johns serving as executive producers. The film stars Ewan McGregor as Christopher Robin; Hayley Atwell as his wife Evelyn; Bronte Carmichael as his daughter Madeline; and Mark Gatiss as Giles Winslow, Robin’s boss. The film also features the voices of: Jim Cummings as Winnie the Pooh and Tigger; Brad Garrett as Eeyore; Toby Jones as Owl; Nick Mohammed as Piglet; Peter Capaldi as Rabbit; and Sophie Okonedo as Kanga. Facebook:        https://www.facebook.com/DisneyChristopherRobin/Twitter:           https://twitter.com/DisneyStudiosInstagram:       https://www.instagram.com/disneystudiosYoutube:          https://www.youtube.com/disneymovietrailersHashtag:          #ChristopherRobin"
36746,0fOZ4Nwm5Pg,2018-06-03,Drake's Dad Claps Back At Wendy Williams! He Calls Her RUPAUL After She Dissed Drake On Her Show,Lailah Lynn,24,2018-05-30 20:45:36+00:00,"drake|""pusha t""|""drake pusha t""|""wendy williams""|""drake dad""|""dennis graham""|""drake duppy freestyle""|""drake dad commercial""|""drake's dad interview""|""drake's dad commercial""|""drake's dad dennis""|""dennis graham social media""|""dennis graham wendy williams""|""wendy williams show""",98916,998,193,705,https://i.ytimg.com/vi/0fOZ4Nwm5Pg/default.jpg,False,False,False,"Drake's Dad, Dennis Graham, is BIG mad at Wendy Williams for her coverage of the beef between Drake and Pusha T on the Wendy Williams show today.  Drake's Dad got on Instagram and let Wendy Williams know EXACTLY how he felt!S H O P  W I T H  M E Quality Hair Extensionshttps://lailahlynn.mayvenn.com/Take 15% Off EVERYTHING using the code FLINGQuality hair extensions with a 30 day money back guaranteeA D V E R T I S E  W I T H  M EDownload my media kit here: https://lailahlynn.com/advertising/Ready? Email lailah@lailahlynn.com to get startedB E  S O C I A L IG: @lailahlynntvTWITTER: @lailahlynnWEBSITE: https://lailahlynn.comDisclaimer - Excerpts from books, blogs, social media, and public figures protected by Fair Use Clause of the Copyright Act which states - Notwithstanding the provisions of sections 106 and 106A, the fair use of a copyrighted work, including such use by reproduction in copies or phono-records or by any other means specified by that section, for purposes such as criticism, COMMENT, news reporting, teaching (including multiple copies for classroom use), scholarship, or research, is not an infringement of copyright."
36873,1Aoc-cd9eYs,2018-06-03,Cobra Kai Ep 2 - Strike First - The Karate Kid Saga Continues,Cobra Kai,24,2018-05-02 16:02:35+00:00,"Cobra Kai|""Karate Kid""|""YouTube Red Original Series""|""YouTube Red Originals""|""YouTube Red""|""Ralph Macchio""|""Billy Zabka""|""Xolo Maridueña""|""Courtney Henggeler""|""Mary Mouser""|""Tanner Buchanan""|""Ed Asner""|""karate kid series""|""johnny lawrence""|""daniel larusso""|""miyagi""|""cobra kai series""|""cobra kai youtube""|""wax on wax off""|""cobra kai karate kid""",46958977,846094,115889,82878,https://i.ytimg.com/vi/1Aoc-cd9eYs/default.jpg,False,False,True,"Present day Daniel LaRusso lives a charmed life. That is, until he sees that the Cobra Kai dojo, the source of his teenage angst and rivalry, has been reestablished by Johnny Lawrence. Struggling to launch the business, Johnny starts teaching karate to his teenage neighbor Miguel. Daniel faces his former opponent and old offenses are quickly reignited.YouTube Red Originals - http://youtube.com/Red. If you live outside the United States, Mexico, New Zealand, Australia or South Korea, click here for more details on availability in your country: https://goo.gl/UEojxv."
36857,1ce456Nnkt8,2018-06-03,BABYMETAL - Distortion (OFFICIAL),BABYMETAL,10,2018-05-07 14:59:03+00:00,"BABYMETAL|""重音部""|""ベビーメタル""|""ベイビーメタル""|""SU-METAL""|""MOAMETAL""|""YUIMETAL""|""ゆい""|""もあ""|""すぅ""|""BABYMETAL OFFICIAL""|""metal""|""kawaii""|""harajuku""|""dance""|""ダンス""|""カワイイ""|""原宿""|""メタル""|""heavy metal""|""BABYMETAL LIVE""|""BABYMETAL ライブ""|""BABYMETAL TOUR""|""BABYMETAL WORLD""",3026028,88722,2472,9491,https://i.ytimg.com/vi/1ce456Nnkt8/default.jpg,False,False,False,"We delivered our new song Distortion as a surprise digital single just before the kick off of our WORLD TOUR 2018! ▶︎「Distortion」8 May, Available!  https://BMetal.lnk.to/Distortion【Apple Music - BABYMETAL】https://itunes.apple.com/us/artist/babymetal/477101776【Spotify - BABYMETAL】http://open.spotify.com/artist/630wzNP2OL7fl4Xl0GnMWq====================================================BABYMETAL WORLD TOUR 2018 【US TOUR】 2018/5/8 (Tues) Kansas City, MO（Uptown Theater） 2018/5/10 (Thurs) Austin, TX（ACL Live at the Moody Theater） 2018/5/11 (Fri) Dallas, TX（House of Blues Dallas） 2018/5/13 (Sun) Houston, TX（Revention Music Center） 2018/5/15 (Tues) Atlanta, GA（Tabernacle Atlanta） 2018/5/17 (Thurs) Charlotte, NC（The Fillmore） 2018/5/18 (Fri) Nashville, TN（Marathon Music Works） 2018/5/20 (Sun) Rock on the Range 2018（Columbus, OH / Mapfre Stadium） 【EUROPE TOUR】 2018/6/1 (Fri) Rock am Ring 2018（Germany / Nürburg / Nürburgring） 2018/6/2 (Sat) Rock im Park 2018（Germany / Nuremberg / Zeppelinfeld） 2018/6/4 (Mon) Austria / Innsbruck（Music Hall Innsbruck） 2018/6/5 (Tues) Netherlands / Utrecht（TivoliVredenburg） 2018/6/6 (Wed) Netherlands / Utrecht（TivoliVredenburg）2018/6/9 (Sat) Download UK（UK / Derby / Donington Park）===================================================BABYMETAL Official Websitehttp://www.babymetal.com/en/http://www.babymetal.com/jp/BABYMETAL Official Twitterhttps://twitter.com/BABYMETAL_JAPANBABYMETAL Official Facebookhttps://www.facebook.com/BABYMETAL.jpBABYMETAL Official Instagramhttps://www.instagram.com/babymetal_official/"
36802,1qsRU7C_Gp0,2018-06-03,#Laurel? #Yanny? Or...,The White House,25,2018-05-17 23:26:14+00:00,[none],722366,13531,6811,4031,https://i.ytimg.com/vi/1qsRU7C_Gp0/default.jpg,False,False,False,
36840,2PH7dK6SLC8,2018-06-03,John Mayer - New Light,johnmayerVEVO,10,2018-05-10 17:00:01+00:00,"John|""Mayer""|""New""|""Light""|""Snack""|""Money""|""Pop""|""boy in your other phone""|""Pushin 40 in the friend zone""|""I want a take two""|""I wanna break through""|""I wanna know the real thing about you""|""give me just one night""",3335785,75380,1547,5485,https://i.ytimg.com/vi/2PH7dK6SLC8/default.jpg,False,False,False,"Spotify: http://radi.al/NewLightSpotifyApple: http://radi.al/NewLightAppleAmazon: http://radi.al/NewLightAMZJohn Mayer“New Light”I’m the boy in your other phoneLighting up inside your drawer at home all alonePushin 40 in the friend zoneWe talk and then you walk away every dayOh you don’t think twice bout meAnd maybe you’re right to doubt me butBut if you give me just one nightYou’re gonna see me in a new lightYeah if you give me just one nightTo meet you underneath the moonlightOh I want a take twoI wanna break throughI wanna know the real thing about youSo I can see you in a new lightTake a ride up to MalibuI just wanna sit and look at you, look at youWhat would it matter if your friends knewWho cares what other people say anywayOh we can go far from hereAnd make a new world together babe‘Cause if you give me just one nightYou’re gonna see me in a new lightYeah, if you give me just one nightTo meet you underneath the moonlightOh I want a take twoI wanna break throughI wanna know the real thing about youSo I can see you in a new lightYeah if you give me just one nightYou’re gonna see me in a new lightYeah if you give me just one nightTo meet you underneath the moonlightWhat do I do with all this, what do I do with all thisLove that's runnin through my veins for youWhat do I do with all this, what do I do with all thisLove that's runnin through my veins for youWhat do I do with all this, what do I do with all thisLove that's runnin through my veins for youWhat do I do with all this, what do I do with all this"
36741,2SJ0hgdciNE,2018-06-03,Marshmello x Juicy J - You Can Cry (Ft. James Arthur) (Official Video),Marshmello,10,2018-05-30 14:00:00+00:00,"you can cry|""you can cry music video""|""you can cry lyrics""|""you can cry lyric video""|""marshmello""|""juicy j""|""james arthur""|""marshmello you can cry""|""james arthur you can cry""|""juicy j you can cry""|""marshmello juicy j""|""marshmallow""|""pop""|""pop music""|""hip hop""|""r&b""|""hip-hop""|""marshmello wolves""|""marshmello friends""|""marshmello silence""|""anne-marie""|""selena gomez""|""columbia""|""joytime collective""|""canciones en ingles""|""musica""|""music""|""vevo""|""drake""|""childish gambino""|""diplo""|""x-factor""|""migos""|""danger""|""everyday""|""ye""|""kanye""",2625891,163793,4135,9923,https://i.ytimg.com/vi/2SJ0hgdciNE/default.jpg,False,False,False,Marshmello x Juicy J - You Can Cry (Ft. James Arthur)Download/Stream Here  ▶ http://smarturl.it/YouCanCrySubscribe Here ▶ http://youtube.com/marshmellomusic?sub_confirmation=1Get your NEW Mello™️ by Marshmello gear HERE ▶ http://shop.marshmellomusic.comWatch Cooking with Marshmello HERE ▶ http://youtube.com/playlist?list=PLcYK4PlHbZQtXROf5fnrr4dO4ruWiv7tsWATCH EVERYDAY MUSIC VIDEO ▶ https://youtu.be/bEdcJY8Emm8WATCH FLY MUSIC VIDEO ▶ https://youtu.be/oRArmtMA9AIWATCH FRIENDS MUSIC VIDEO ▶ https://youtu.be/jzD_yyEcp0MWATCH SPOTLIGHT MUSIC VIDEO ▶ https://youtu.be/7R1N-8SoqcMWATCH LOVE U MUSIC VIDEO ▶ https://youtu.be/D-pKeb6Wf4UWATCH TAKE IT BACK MUSIC VIDEO ▶ https://youtu.be/P9Ijqa_2eu0WATCH SILENCE MUSIC VIDEO ▶ https://youtu.be/Tx1sqYc3qasWATCH BLOCKS MUSIC VIDEO ▶ https://youtu.be/5E4ZBSInqUUWATCH YOU & ME MUSIC VIDEO ▶ https://youtu.be/fiusxyygqGkWATCH FIND ME MUSIC VIDEO ▶ https://youtu.be/ymq1WdGUcw8WATCH MOVING ON MUSIC VIDEO ▶ https://youtu.be/yU0tnrEk8H4WATCH SUMMER MUSIC VIDEO ▶ https://youtu.be/2vMH8lITTCEWATCH ALONE MUSIC VIDEO ▶ https://youtu.be/ALZHF5UqnU4WATCH KEEP IT MELLO MUSIC VIDEO ▶ https://youtu.be/_J_VpmXAzqgMARSHMELLO: Spotify | http://spoti.fi/MarshmelloSoundCloud | http://soundcloud.com/marshmellomusicInstagram | http://instagram.com/marshmellomusicTwitter | http://twitter.com/marshmellomusicFacebook | http://facebook.com/marshmellomusicMerch | http://shop.marshmellomusic.com/JUICY J:http://thejuicyj.comhttp://www.facebook.com/juicyjmusichttp://twitter.com/therealjuicyjhttp://instagram.com/juicyjJAMES ARTHUR:https://www.facebook.com/jamesarthurhttps://www.twitter.com/jamesarthur23https://www.instagram.com/jamesarthurinsta23/Best of James Arthur: https://goo.gl/PcpVdQSubscribe here: https://goo.gl/yM9xqjCredits:Agency: MGX CreativeDirector: Daniel MalikyarExecutive Producer: Karam GillSenior Producer: Ryan HuffmanProducer: Brian BellDP: Michael StineProduction Designer: Tyler JensenStylist: Lisa MadonnaEditor: Troy CharbonnetColorist: Kinan ChabaniCasting Director: Jake van Zyll#YouCanCry
36868,31OMf1H5Rk0,2018-06-03,"Matt Hunter, Lele Pons - Dicen",MattHunterVEVO,10,2018-05-04 04:00:02+00:00,"Matt|""Hunter""|""Lele""|""Pons""|""Dicen""|""Universal""|""Music""|""Latino""|""Latin""|""Urban""",36743339,734491,34617,36662,https://i.ytimg.com/vi/31OMf1H5Rk0/default.jpg,False,False,False,"Matt Hunter, Lele Pons - DicenSpotify: https://spoti.fi/2JPp1JwApple Music: https://apple.co/2HMJFgVVevo: http://vevo.ly/djDCteDirected by Lele Pons, Calvin Williams and Max Goodrich of Shots Studios.MATT HUNTER:Instagram | http://instagram.com/matthunter123Twitter | http:/twitter.com/matthunter123LELE PONS:Instagram | http://instagram.com/leleponsYouTube | http://youtube.com/leleponsTwitter | http://twitter.com/lelepons—————Matt Hunter is wearing a Bulova Special GRAMMY® Edition Men's Precisionist WatchClick here to Buy: https://bit.ly/2FIGwbS—————Lyrics:Quizas despues de ti yo termine siendo no masQue no te enamoras, llegue yo a escucharHay varias cosas que tenemos que intentarY queria aprovecharDame lo que quieroEscuche que tu amor es pasajeroPero me montaria en el vueloY aunque se que esto es temporalTu eres lo que quieroEscuche que eres fria como el hieloUn angel que callo del cieloY entro a la maldadDicen que tu eres malaDe ti nadie se salvaEnvuelves con tu cuerpoTodos te tienen ganasDicen que tu eres malaDe ti nadie se salvaY como una modeloTodos te tienen ganasEl trafico paraMientras cruce me mirabanCon ellos no quiero nadaSe lo digo con una miradaDicen que soy malvadaY fria como el inviernoEllos se mueren por un besoPero es dificil la jugadaQuerias comprobar porque dicen que yo soy criminalVas a ver como esto va a terminarTe queria contar queDicen que yo soy malaDe mi nadie se salvaSe que quieren mi cuerpoDe ellos no quiero nadaDicen que tu eres malaDe ti nadie se salvaY como una modeloTodos te tienen ganasTe quiero aunque no sea yo el primero Despacio que tu amor es muy ligero Permiteme un minuto mas Acostumbras a tratarlos malPero creo que conmigo eso puede cambiar Pero soloDame lo que quieroEscuche que tu amor es pasajeroPero me montaria en el vueloY aunque se que esto es temporalSabes lo que quieroMuchos como tu yo he visto pasajero Haciendome subir del sueloPor algo temporalDicen que yo soy malaDe mi nadie se salvaSe que quieren mi cuerpoDe ellos no quiero nadaDicen que tu eres malaDe ti nadie se salvaY como una modeloTodos te tienen ganasMusic video by Matt Hunter, Lele Pons performing Dicen. © 2018 UMG Recordings, Inc. / Universal Music Latino / Transcend.ent LLChttp://vevo.ly/djDCte"
