id,video_id,trending_date,title,channel_title,category_id,publish_time,tags,views,likes,dislikes,comment_count,thumbnail_link,comments_disabled,ratings_disabled,video_error_or_removed,description
2044,-Gptp_ui-Sg,2017-11-24,Announcing Pokémon GO Travel and the Global Catch Challenge,Pokémon GO,20,2017-11-19 19:06:18+00:00,"Pokémon GO Travel|""Pokémon GO""|""Pokémon Global Catch Challenge""|""Tokyo""|""Japan""|""#PokemonGOtravel""|""Pokemon""|""Pokemon GO""|""Pokemon Global Catch Challenge""|""Catch Challenge""",589604,7774,1631,2186,https://i.ytimg.com/vi/-Gptp_ui-Sg/default.jpg,False,False,False,"Join the Pokémon GO Travel Global Catch Challenge, a quest to catch 3 billion Pokémon in 7 days.\n \nFor more information: https://pokemongolive.com/travel/\n \nEver since Pokémon GO launched, we've loved hearing stories of Trainers venturing abroad and playing together with new friends from different countries. That's what inspired us to create Pokémon GO Travel, a new way to see the world through the eyes of a Pokémon Trainer. To kick things off, Pokémon GO Travel is taking a diverse group of Trainers from around the world to Japan to host our first-ever Global Catch Challenge.\n \nJoin us as we discover new places, meet new people, and work together in an attempt to catch 3 billion Pokémon in just 7 days. Play along with IHasCupquake, Coisa de Nerd, and Rachel Quirico as they travel to learn more about Japanese culture, inspire the world to play together, and update you on the amazing rewards the community unlocks along the way—including Farfetch’d appearing worldwide for a limited time!\n \nOn a trip? Venturing to a new part of town? Share your #PokemonGOtravel story with us this week on your favorite social media channels.\n \nInstagram: https://www.instagram.com/pokemongoapp/\nFacebook: https://www.facebook.com/PokemonGO/\nTwitter: https://twitter.com/PokemonGoApp\n \n#PokemonGOtravel\n\n© 2016-2017 Niantic, Inc. © 2016-2017 Pokémon. © 1995-2017 Nintendo/Creatures Inc./GAME FREAK inc."
2029,-SIp6xSP7ds,2017-11-24,Gayle King and Norah O'Donnell respond to Charlie Rose allegations,CBS This Morning,25,2017-11-21 12:35:39+00:00,"video|""cbs""|""news""|""CBS This Morning""|""Charlie Rose""|""Gayle King""|""Norah O'Donnell""|""sexual misconduct""|""allegations""|""response""|""Washington post""|""PBS""|""CBS News""",454203,2218,1016,1664,https://i.ytimg.com/vi/-SIp6xSP7ds/default.jpg,False,False,False,"CBS This Morning co-hosts Norah O'Donnell and Gayle King are responding after reports of sexual misconduct allegations against Charlie Rose. The accusations published in the Washington Post include unwanted sexual advances, groping and exposing himself to women who worked for or aspired to work for Rose's PBS program. CBS News has suspended Rose in light of the accusations.\n\nSubscribe to the CBS This Morning Channel HERE: http://bit.ly/1Q0v2hE\nWatch CBS This Morning HERE: http://bit.ly/1T88yAR\nWatch the latest installment of Note to Self, only on CBS This Morning, HERE: http://cbsn.ws/1Sh8XlB\nFollow CBS This Morning on Instagram HERE: http://bit.ly/1Q7NGnY\nLike CBS This Morning on Facebook HERE: http://on.fb.me/1LhtdvI\nFollow CBS This Morning on Twitter HERE: http://bit.ly/1Xj5W3p\nFollow CBS This Morning on Google+ HERE: http://bit.ly/1SIM4I8\n\nGet the latest news and best in original reporting from CBS News delivered to your inbox. Subscribe to newsletters HERE: http://cbsn.ws/1RqHw7T\n\nGet your news on the go! Download CBS News mobile apps HERE: http://cbsn.ws/1Xb1WC8\n\nGet new episodes of shows you love across devices the next day, stream local news live, and watch full seasons of CBS fan favorites anytime, anywhere with CBS All Access. Try it free! http://bit.ly/1OQA29B\n\n---\nDelivered by Charlie Rose, Norah O’Donnell and Gayle King, CBS This Morning offers a thoughtful, substantive and insightful source of news and information to a daily audience of 3 million viewers. The Emmy Award-winning broadcast presents a mix of daily news, coverage of developing stories of national and global significance, and interviews with leading figures in politics, business and entertainment. Check local listings for CBS This Morning broadcast times."
2010,-xt_j2aIAkg,2017-11-24,Predator Is Back,adidas Football,17,2017-11-22 09:10:18+00:00,"football|""soccer""|""fussball""|""futebol""|""football boots""|""football cleats""|""boots""|""cleats""|""skills""|""tricks""|""goals""|""adidas""|""adidas football""|""allin""|""adidas futebol""|""ace boots""|""x boots""|""messi boots""|""ace17""|""x17""|""messi17""|""nemeziz boots""|""nemesis""|""adidas nemeziz""|""copa17""|""pogba""|""predator""|""new predator""|""adidas predator""|""paul pogba""|""mesut ozil""|""adidas ad""|""preds""|""pred""",1807642,7313,1602,666,https://i.ytimg.com/vi/-xt_j2aIAkg/default.jpg,False,False,False,"Savage Control presented by Paul Pogba.\nExplore Predator now: http://a.did.as/PredatorPogba\n\nThe adidas Football channel brings you the world of cutting edge football. Gain exclusive access to our players, go behind the scenes with our teams and be the first to see the latest innovations in football. adidas Football's mission is to push the limits of the game forward, driving the performances of Messi, Pogba, Bale, James Rodríguez and Sunday League players around the world.\n\nadidas teams include: Manchester United FC, FC Bayern, Clube de Regatas do Flamengo, AC Milan, Juventus F.C., Real Madrid C.F., AFC Ajax, S.L. Benfica, FC Basel 1893, FC Kobenhaven, and FC Schalke 04. \n\nadidas sponsor some of the best footballers in the world including: Leo Messi, Paul Pogba, Luis Suárez, James Rodríguez, Gareth Bale, Arjen Robben, Müller, Özil, Oscar, Neuer, Diego Costa, Juan Mata, Benzema, Kroos, Marcelo, Dele Alli.\n\nFollow us:\n\nSnapchat - http://snapchat.com/add/adidasfootball\nTwitter - https://twitter.com/adidasfootball\nFacebook - https://facebook.com/adidasfootball\nInstagram - http://instagram.com/adidasfootball\n\nFind out more at: http://adidas.com/football"
2022,09lz1fRBBsY,2017-11-24,LIL PEEP x MONTREALITY ⌁ Interview,MONTREALITY,24,2017-11-22 18:30:52+00:00,"lil peep interview|""lil peep""|""interview""|""lil peep montreality""|""montreality interview""|""lil peep montreality interview""|""lil peep hair""|""scooby doo""|""psychedelics""|""mental health""|""romantic""|""message to the youth""|""ghostemane""|""schema posse""|""j grxxn""|""no jumper""|""lil peep live""|""lil peep show""|""lil peep concert""|""lil peep snapchat""|""beamerboy""|""awful things""|""lil peep instrumental""",325351,17810,175,2453,https://i.ytimg.com/vi/09lz1fRBBsY/default.jpg,False,False,False,"filmed april 13, 2017\nthis video is not and will not ever be monetized\n\nPeep chopped his hair off shortly after this interview\nwe intended to film another one & reflect his new look, but never got the chance\n\nwishing you Peace as you journey beyond this plane of existence\nthank you for taking the time, thank you for being you.\n\nLove,\n - MONTREALITY\n\n\nLil Peep speaks about :\n\n- jobs he had as a teenager (1:11)\n- Scooby-Doo, favorite anime series (2:12)\n- fave video games (3:14)\n- life as an 86-year-old (3:53)\n- psychedelics and mental health (5:12)\n- his love for the Atlanta rap scene (6:35)\n- Future (8:24)\n- romance & heartbreaks (9:17)\n- hentai (10:00)\n- his ultimate fetish (10:32)\n- words to someone contemplating suicide (11:20)\n- his message to the youth (12:31)\n\n\nFollow MONTREALITY\nhttps://Facebook.com/MONTREALITY\nhttps://Instagram.com/MONTREALITY\nhttps://Twitter.com/MONTREALITY\nhttps://MTLITY.com\n\nhttp://lilpeep.party\nhttps://twitter.com/Lilpeep\nhttps://instagram.com/lilpeep\nhttps://soundcloud.com/lil_peep\nhttp://youtube.com/lilpeepofficial\nhttp://facebook.com/lilpeepmusic\n\n\nDirected, Produced by : MONTREALITY\nEditor : Guillaume Landry\nSound : James Benjamin\nAnimation : Rhymezlikedimez\nMusic : Meltycanon\nClosed captions : Joseph Dexter"
2154,0ANDjPQPS_Q,2017-11-24,♡ SILVER PLAYBUTTON UNBOXING (and making it cute) ♡,Pixielocks,26,2017-11-15 15:17:28+00:00,"jillian vessey|""pixielocks""|""pink""|""silver play button""|""youtube play button""|""playbutton""|""unboxing""|""diy""",28337,3058,90,518,https://i.ytimg.com/vi/0ANDjPQPS_Q/default.jpg,False,False,False,♡ thank you for making a huge dream come true oops ♡\n\nThis video’s featured Confetti Club member is @calistainbloom on instagram!\n\n♡ PIXIELINKS:\nMerch shop: https://shop.spreadshirt.com/pixiethreads\nFacebook: https://www.facebook.com/pixielockss/\nInstagram: https://www.instagram.com/pixieelocks/\nTwitter: https://twitter.com/pixieeelocks\n \n♡  P.O BOX:\nJillian Vessey\nPO Box 99900 \nLK 725 939\nRPO Sherwood \nCharlottetown PE\nC1A 0E6
2032,0PW9MWDWLH8,2017-11-24,WHISPER CHALLENGE w/ MY MOM // Grace Helbig,Grace Helbig,22,2017-11-22 08:23:18+00:00,"itsgrace|""funny""|""comedy""|""vlog""|""grace""|""helbig""|""gracehelbig""|""dailygrace""|""daily""|""tutorial""|""diy""|""lifestyle""|""whisper challenge""|""mom""",117455,9627,50,791,https://i.ytimg.com/vi/0PW9MWDWLH8/default.jpg,False,False,False,"My mom's in town for the holidays so I forced her to make a youtube video with me trying a dumb, fun youtube challenge! \n\nSnapChat: GraceHelbig\nhttp://twitter.com/gracehelbig\nhttp://gracehelbig.tumblr.com\nhttp://instagram.com/gracehelbig\nhttp://soundcloud.com/nottoodeepwithgrace\n\nMY STYLE GUIDE: http://amzn.to/2ntNQjM\nMY SELF HELP BOOK: http://amzn.to/2ntP1jq\nMY PODCAST: http://soundcloud.com/nottoodeepwithgrace\n\nHi, if you're new. I make 3 videos a week, Monday Wednesday and Friday. You might like them, you might hate them, but you can't unsee them. Unless you have amnesia."
2123,0gwkMY-mzUQ,2017-11-24,Demi Lovato & Luis Fonsi - Echame La Culpa (Teaser),Demi Lovato,24,2017-11-15 20:11:41+00:00,"Luis Fonsi|""Demi Lovato""|""Echame La Culpa""",753920,37166,754,1830,https://i.ytimg.com/vi/0gwkMY-mzUQ/default.jpg,False,False,False,Echame La Culpa drops November 17th!
2099,1Xr-3eDioL8,2017-11-24,"At home with... Gini Wijnaldum | Primark socks, Big Shaq and scousers with 'Vuj'",Liverpool FC,17,2017-11-16 16:54:05+00:00,"Liverpool FC|""LFC""|""Liverpool""|""Anfield""|""Melwood""|""Liverpool Football Club""|""wijnaldum""|""gini wijnaldum""|""gini""|""gini liverpool""|""david vujanic""|""vuj""|""wijnaldum vuj""|""mans not hot""|""man's not hot""|""wijnaldum mans not hot""|""gini man's not hot""|""epl""|""premier league""",259001,8467,109,660,https://i.ytimg.com/vi/1Xr-3eDioL8/default.jpg,False,False,False,"David Vujanic joins Gini Wijnaldum at home to look at his life away from football as they catch up on Gini's routine off the pitch. Find out what Gini cooks (or doesn't cook), how he likes his tea and what he's watching on TV right now. \n\nWant to be notified next time Liverpool FC post on Youtube? Subscribe now: https://www.youtube.com/user/LiverpoolFC"
2106,1_Nr0hrjR24,2017-11-24,Elon Musk Unveils the Tesla Semi Truck - 2017-11-16 - Part 3 of 3,ran future,28,2017-11-17 05:12:25+00:00,"elon musk|""tesla""|""semi""|""unveil""",252550,1582,76,503,https://i.ytimg.com/vi/1_Nr0hrjR24/default.jpg,False,False,False,"Watch the New Tesla Roadster 2020 Unveil:\nhttps://youtu.be/Gd9JQAkcYak\n\nWatch all the parts of the Tesla Semi Truck Unveil:\nPart 1: https://youtu.be/WqYU6VA1Rmw\nPart 2: https://youtu.be/jhuFLky4WCU\nPart 3: https://youtu.be/1_Nr0hrjR24\nBonus: https://youtu.be/AHI4TLlO0ag\n\nThe Tesla Semi Unveil Event from the 16th of November, 2017.\n\nThis video is a recording of the live stream available on tesla.com at 8PM PT 2017-11-16"
2017,1dQEfL2BfUM,2017-11-24,How To Design A Comic Book Page,Nerdwriter1,24,2017-11-22 15:00:00+00:00,"the nerdwriter|""nerdwriter""|""youtube nerdwriter""|""nerd writer""|""nerdwriter1""|""video essays""|""maus comic""|""art spiegelman maus""|""maus art spiegelman""|""maus art spiegelman comic""|""art spiegelman""|""maus""|""maus nerdwriter""|""art spiegelman nerdwriter""|""arti spiegelman graphic novel""|""art spiegelman comix""|""maus graphic novel""|""maus comix""|""graphic novel""|""comix""|""comix maus""|""comix page""|""how to design a comix page""|""graphic novel maus""|""art spiegelman comic""|""maus case study""|""comic""|""comix art spiegelman""",197420,14144,249,716,https://i.ytimg.com/vi/1dQEfL2BfUM/default.jpg,False,False,False,"A closer look at how Art Spiegelman designed pages in his comix masterpiece Maus.\nGet 10% any purchase here: http://squarespace.com/nerdwriter\nWatch next: What The Truman Show Teaches Us About Politics: https://youtube.com/watch?v=cLJAXu5OD-c&list=PLwg4AG1KkgLwv68sdgTCCK8F8OjhSjbMl&index=1\n \nSubscribe: http://bit.ly/SubNerdwriter\nFacebook: https://facebook.com/The-Nerdwriter-314141501931192/\nTwitter: https://twitter.com/TheeNerdwriter\nPatreon: https://patreon.com/nerdwriter\n\nWatch More Nerdwriter:\nLatest Uploads: https://youtube.com/watch?v=gqlgf_q3nN4&list=PLwg4AG1KkgLxZ2RPuELOONAszjFfv5DvT\nUnderstanding Art: https://youtube.com/watch?v=cLJAXu5OD-c&list=PLwg4AG1KkgLwP5FuUIiVEy-ILMD23AN1v\nEssays About Art: https://youtube.com/watch?v=cLJAXu5OD-c&list=PLwg4AG1KkgLwv68sdgTCCK8F8OjhSjbMl\nEssays About Social Science: https://youtube.com/watch?v=hBweUnkfQ2E&list=PLwg4AG1KkgLz2pLNCT97EbZgwCgnTV_kR\nPopular Videos: https://youtube.com/watch?v=_aFo_BV-UzI&list=PLwg4AG1KkgLx18HrK7lCOjRXZFpmrdkvV\n\nSOURCES\n\nHillary Chute, History and Graphic Representation in Maus\nA Comics Studies Reader, University Press of Mississippi. (2009)\n\nArt Speigelman interview, 1991\nhttps://www.youtube.com/watch?v=BLVG3GNvHkU&t=486s\n\nNeil Gaiman and Art Spiegelman in conversation\nhttps://www.youtube.com/watch?v=wCG9XjqKkqI\n\nhttps://www.washingtonpost.com/news/comic-riffs/wp/2016/08/11/why-maus-remains-the-greatest-graphic-novel-ever-written-30-years-later/?utm_term=.1738cfa394e5\n\nRosemary V. Hathaway, Reading Art Spiegelman's Maus as Postmodern Ethnography Journal of Folklore Research, Vol. 48, No. 3 (September/December 2011), pp. 249-\n267\n\nMUSIC\n\nDivider by Chris Zabriskie is licensed under a Creative Commons Attribution license (https://creativecommons.org/licenses/by/4.0/)\nSource: http://chriszabriskie.com/divider/\nArtist: http://chriszabriskie.com/\n\nMTBRD, When I Tell You\nhttps://soundcloud.com/mtbrd/when-i-tell-you\n \nThe Nerdwriter is a series of video essays about art, culture, politics, philosophy and more."
2076,1ihTE5cxUCQ,2017-11-24,Charles Manson  - Cease To Exist,leftways,10,2015-09-29 11:03:27+00:00,"Charles Manson (Composer)|""Cease To Exist (Musical Recording)""|""Music (TV Genre)""|""The Beach Boys Lineups (Musical Artist)""|""Manson Family""",90525,723,53,212,https://i.ytimg.com/vi/1ihTE5cxUCQ/default.jpg,False,False,False,"Charles Manson's Cease To Exist, the song that would be reworked by Denis Wilson for The Beach Boys' 20/20 album."
2013,2Nlo2ekTRvI,2017-11-24,Everything Wrong With Cars 3 In 14 Minutes Or Less,CinemaSins,1,2017-11-21 16:07:26+00:00,"cars 3|""cars""|""pixar""|""everything wrong with""|""eww""|""cinemasins""|""cinema sins""|""movie""|""mistakes""|""review""",1556203,36243,1570,5692,https://i.ytimg.com/vi/2Nlo2ekTRvI/default.jpg,False,False,False,"While loads better than Cars 2, Cars 3 is still not a good movie, and whatever is good about it was already covered in the first movie anyway. Here be its sins. \n\nThursday: More 2017 animated sins.\n\nRemember, no movie is without sin! Which movie's sins should we expose next?!\n\nPodcast: http://soundcloud.com/cinemasins\nSins Video Playlist: http://www.youtube.com/watch?v=wy-v4c4is-w&list=PLMWfZxj1nTkQBy4AeRGG4xH5d2IIApNPj\nTweet us: http://twitter.com/cinemasins\nReddit with us: http://reddit.com/r/cinemasins\nTumble us: http://cinema-sins.tumblr.com\nCall us: 405-459-7466\nJeremy's book: http://theablesbook.com"
2178,2Vv-BfVoq4g,2017-11-24,Ed Sheeran - Perfect (Official Music Video),Ed Sheeran,10,2017-11-09 11:04:14+00:00,"edsheeran|""ed sheeran""|""acoustic""|""live""|""cover""|""official""|""remix""|""official video""|""lyrics""|""session""",109625533,2404512,41434,107826,https://i.ytimg.com/vi/2Vv-BfVoq4g/default.jpg,False,False,False,"🎧: https://ad.gt/yt-perfect\n💰: https://atlanti.cr/yt-album\nSubscribe to Ed's channel: http://bit.ly/SubscribeToEdSheeran\n\nFollow Ed on...\nFacebook: http://www.facebook.com/EdSheeranMusic\nTwitter: http://twitter.com/edsheeran\nInstagram: http://instagram.com/teddysphotos\nOfficial Website: http://edsheeran.com\n\nDirector | dp Jason Koenig\nProducer: Honna Kimmerer\nStarring: Ed Sheeran & Zoey Deutch \nDirector of Photography: Johnny Valencia\nProduction Company: Anonymous Content\nExec Producer: Nina Soriano\nProduction Manager: Doug Hoff\nCommissioner: Dan Curwin\nProduction Designer: John Lavin\nLead Casting: Amy Hubbard \n \nWritten by: Jason Koenig, Ed Sheeran, Jenny Koenig, Andrew Kolvet, Murray Cummings\n\nEdited by: Jason Koenig & Johnny Valencia\nVFX: Ian Hubert\nGraphic design by Chris Ballasciotes\n\nCast: Bo Valencia, Dennis Ranalta, Arthur Pauli\n \nSki Cinematography: Corey Koniniec\nSpecialty Camera op: Ryan Haug\n1st AC: Ryan Brown\n \n1st Assistant Director: Ole Zapatka\nArt Director: Klaus Hartl\nSnow fx: Lucien Stephenson\n\nGaffer: Thomas Berz\nStylist: Claudia Lajda\nHair & Makeup: Christel Thoresen\nAustrian Casting: Ursula Kiplinger\n \nAdditional VFX: Zoic\n\nSpecial Thanks to: The Hintertux Glacier, Austria;\nHohenhaus Tenne, and Hotel Neuhintertux"
2174,2Zvmi5BzDbs,2017-11-24,Tour Documentary - Episode 3,Camila Cabello,10,2017-11-14 00:00:36+00:00,"tour doc|""bruno mars""|""24k magic tour""|""world tour""|""havana""|""havana video""|""camila cabello""|""camila""|""documentary""|""tour documentary""|""youtube""",125682,21471,59,1034,https://i.ytimg.com/vi/2Zvmi5BzDbs/default.jpg,False,False,False,Here's the last episode of my Tour Doc from the 24K Magic World Tour with Bruno Mars! Big thanks to Youtube for helping me share a behind-the-scenes look at life on tour.\n\nFind Camila Here: \nTwitter: @camila_cabello\nIG: @camila_cabello \nFacebook: @97camilacabello \nWebsite: www.camilacabello.com\n\nHavana Available at:\nSpotify: http://smarturl.it/Havana_Sptfy\nApple Music: http://smarturl.it/Havana_AM\niTunes: http://smarturl.it/Havana_iT\nGoogle Play: http://smarturl.it/Havana_GP
2144,3BEpWWxPXSU,2017-11-24,A-Trak Flips Rockstar by Post Malone ft. 21 Savage,A-Trak,10,2017-11-16 19:16:06+00:00,"A-Trak|""Atrak""|""Rockstar""|""Post Malone""|""21 Savage""|""RealDJing""|""DJing""|""tone play""|""reverb""|""mixing""|""remix""|""rockstar post malone""|""post malone rockstar""|""21 savage rockstar""|""rockstar 21 savage""|""a trak rockstar""|""rockstar a trak""|""a trak""|""a track""|""rockstar remix""|""a trak post malone""|""post malone a trak""|""a trak 21 savage""|""21 savage a trak""|""a trak official""|""a trak remix""|""a trak flips""|""a trak 2017""",155849,3711,509,363,https://i.ytimg.com/vi/3BEpWWxPXSU/default.jpg,False,False,False,A-Trak flips Rockstar by Post Malone ft. 21 Savage. \n\nWATCH MORE #REALDJing: http://smarturl.it/ATrakFlips\n\nFOLLOW A-TRAK:\nFACEBOOK - https://www.facebook.com/atrak\nTWITTER - https://twitter.com/atrak\nINSTAGRAM - https://www.instagram.com/atrak
2184,3GtSorFUQhc,2017-11-24,"FULL. ASEAN Summit 2017. Opening ceremony.  November 13, 2017. Philippines, Manila.",CHANNEL90seconds newscom,22,2017-11-13 05:30:51+00:00,"31th ASEAN Summit 50|""31th ASEAN Summit 50 Manila Philippines""|""ASEAN""|""Trump attends opening ceremony of ASEAN summit in Manila""|""President Rodrigo Duterte speech in ASEAN 50 Summit 2017.""|""ASEAN Summit 2017 live""",75310,365,34,80,https://i.ytimg.com/vi/3GtSorFUQhc/default.jpg,False,False,False,"Watch: 31th ASEAN Summit 50 , Manila, Philippines .Opening ceremony. Group Photo. November 13 2017.\n\n\n31th ASEAN Summit, Manila, Philippines . Opening ceremony. Group Photo. November 13  2017.  President Trump Participates in the opening ceremony of the 31st ASEAN Summit. Cultural Center of the Philippines, Manila. November 13, 2017. President Trump visits Philippines. President Trump in Philippines. President Rodrigo Duterte  speech in ASEAN 50 Summit 2017. Canadian Prime Minister Justin Trudeau, Russia Prime Minister Dmitry Medvedev, U.S. President Donald Trump. President Trump visits Philippines. President Trump in Philippines. President Trump in Philippines.  President Trump Arrives in Manila, Philippines. November 12, 2017. 31st ASEAN Summit Philippines. President Trump in Manila. ￼President Trump ASEAN in Philippines. November 12, 2017.  31st ASEAN November 13, 2017. President Trump Attend aOpening ceremony in Manila Philippines.President Trump Attend ASEAN.  Manila, Philippines. 31th ASEAN Summit, Manila, Philippines.   Manila, Philippines. Trump to Meet Duterte as Ties Recover From Obama Dust-Up. 31th ASEAN Summit, Manila, Philippines.  President Rodrigo Duterte  Canadian Prime Minister Justin Trudeau, Russia Prime Minister Dmitry Medvedev, U.S. President Donald Trump.  President Donald Trump, Premier Li Keqiang of China, Japanese Prime Minister Shinzo Abe, President Moon Jae-in of South Korea, President Ram Nath Kovind of India, Sultan Hassanal Bolkiah of Brunei and President Halimah Yacob of Singapore. Prime Minister Najib Razak; Singapore President Tony Tan Keng Yam; Thai Prime Minister Prayut Chan-o-cha; Vietnam President Tran Dai Quang; and Indonesian President Joko Widodo.  Prime Minister of New Zealand Jacinda Kate Laurell Ardern. Trump attends opening ceremony of ASEAN summit in Manila. Duterte, at ASEAN opening. 11/13/14. President Trump Participates in the opening ceremony of the 31st ASEAN Summit.  Cultural Center of the Philippines, Manila, Philippines. 31th ASEAN Summit 50  Manila Philippines. Trump attends opening ceremony of ASEAN summit in Manila. 31 الرابطة 50 القمة عام 2017.31 ASEAN 50 hội nghị thượng Đỉnh 2017. 31 ASEAN 50 Κορυφής 2017.31 ASEAN-50-Topmødet 2017. 31 ASEAN 50 הפסגה 2017. 31 ASEAN 50 cruinniú Mullaigh 2017.31 de la ASEAN 50 Cumbre de 2017. 31 ASEAN 50 Vertice 2017. 31东盟50首脑会议2017年。 31 아세안 정상 회담 50 2017. 31 ASEAN-50 Gipfel 2017. 31. ASEAN 50 Toppmøtet i 2017. 31 آسه آن 50 نشست 2017.31 ASEAN 50 Cimeira de 2017. 2017 31 50 ASEAN Zirvesi. 31 ASEAN 50 Huippukokouksessa 2017. 31 ASEAN 50 Huippukokouksessa 2017. 31 आसियान 50 शिखर सम्मेलन 2017. 31-og samit ASEAN 50 2017. 31 ASEAN 50 Summitu 2017. 31 ASEAN 50 Toppmötet 2017. 31日ASEAN50サミットは2017年度までとする。 วันที่ 31@item:inlistbox last day of the month ASEAN 50 การประชุม 2017 น Ika-31 ng ASEAN 50 Summit 2017. Delays, confusion in world leaders' arrivals in PH for ASEAN Summit. ASEAN Summit 2017 live"
2105,3jtjkXSvuJw,2017-11-24,Try Not to Laugh at This Silly Kitten,Kitten Lady,15,2017-11-17 22:40:58+00:00,"fizz|""funniest""|""silliest""|""silly""|""funny""|""too cute""|""adorable""|""meowing""|""kittens""|""yelling""|""falling""|""blooper""",93494,6975,28,688,https://i.ytimg.com/vi/3jtjkXSvuJw/default.jpg,False,False,False,Fizz is one of the funniest kittens I've ever raised. You can keep up with him and his sister at @teamfizzday!\n\nCheck out my instructional videos here: http://bit.ly/2qwudwX\n\nFollow Kitten Lady on social media! \n\nFACEBOOK: https://www.facebook.com/kittenxlady\nINSTAGRAM: https://www.instagram.com/kittenxlady\n\nShop for Kitten Lady gear: https://kittenlady.bigcartel.com
2181,3qYt_fXdaXY,2017-11-24,Sweetie destroys Flav (Sweetie vs. Flavor Flav),Foolmarkt,24,2016-08-06 12:25:20+00:00,"flavor of love|""fighting""|""sweetie""|""flavor flav""|""vh1""|""fight""|""reality tv""|""tiffany pollard""|""best fight""",60191,727,46,218,https://i.ytimg.com/vi/3qYt_fXdaXY/default.jpg,False,False,False,episode 4
2012,44szOPIixaU,2017-11-24,Star Wars: The Last Jedi Tempt (:30),Star Wars,24,2017-11-21 17:00:00+00:00,"star wars|""the last jedi""|""rey""|""luke skywalker""|""the force awakens""|""movie""|""tv spot""|""commercial""|""trailer""|""film""",801249,16021,223,1502,https://i.ytimg.com/vi/44szOPIixaU/default.jpg,False,False,False,Choose your path. Get tickets to Star Wars: The Last Jedi now. http://fandango.com/lastjedi\n\nVisit Star Wars at http://www.starwars.com\nSubscribe to Star Wars on YouTube at http://www.youtube.com/starwars\nLike Star Wars on Facebook at http://www.facebook.com/starwars\nFollow Star Wars on Twitter at http://www.twitter.com/starwars\nFollow Star Wars on Instagram at http://www.instagram.com/starwars\nFollow Star Wars on Tumblr at http://starwars.tumblr.com/
