id,video_id,trending_date,title,channel_title,category_id,publish_time,tags,views,likes,dislikes,comment_count,thumbnail_link,comments_disabled,ratings_disabled,video_error_or_removed,description
2080,Ssvv40iz-Ls,2017-11-24,TOP 5 LUXURY HANDBAGS FOR AUTUMN WINTER,Inthefrow,26,2017-11-19 19:00:11+00:00,"Inthefrow|""In the frow""|""TOP 5 LUXURY HANDBAGS FOR AUTUMN WINTER""|""LUXURY HANDBAGS""|""AUTUMN WINTER""|""TOP 5 LUXURY HANDBAGS""|""HANDBAGS""|""LUXURY""|""designer fashion""|""luxury haul""|""luxury fashion""|""chloe faye""|""anya hindmarch""|""strathberry""|""coach grace""|""gucci marmont""|""luxury bags""|""designer handbags""|""bag collection""",51637,1843,100,152,https://i.ytimg.com/vi/Ssvv40iz-Ls/default.jpg,False,False,False,"TOP 5 LUXURY HANDBAGS FOR AUTUMN WINTER\n\nRounding up all of my current bag collection into the top five bags that will be my most used for the Autumn and Winter!\n\n\n❤ Subscribe: http://inthefrow.co/subtoitf\n❤ Catch my latest blog post: http://www.inthefrow.com\n❤ Instagram: http://www.instagram.com/inthefrow\n❤ Twitter: http://www.twitter.com/inthefrow\n❤ 10 FAQs about me: http://inthefrow.co/2ychtze\n\n\nI receive a small % of commission from anything bought via the product links below. It doesn't cost you any more and is a little thank you to me, I guess, for inspiring a possible purchase :)\n\n\nBags ❤\n\nBag 1: http://rstyle.me/n/cuggjeuige\nBag 2: http://rstyle.me/n/cuggkjuige\nBag 3: http://rstyle.me/n/cuggmauige\nBag 4: http://rstyle.me/n/cuggm8uige or build your own here: http://rstyle.me/n/cuggpeuige\nBag 5: http://rstyle.me/n/cst8rduige\n\n\nWhat I'm Wearing  ❤\n\nNavy Blouse: http://rstyle.me/~a8vBR\n\n\nBeauty Products Used ❤\n\nOn my lips CT Show girl: http://rstyle.me/n/cuggq9uige\nI said Dolly Bird in the video but I meant Show Girl :) \n\n\nFind Me ❤\n\nContact: http://www.gleamfutures.com/client-contact/victoria\n\nThank you so much for watching and for the support always! Love you guys so much ❤"
2104,TWpt-ze_cYU,2017-11-24,"You, but in emojis. (YIAY #375)",jacksfilms,23,2017-11-15 20:00:02+00:00,"jacksfilms|""yiay""|""emojis""|""emoji""|""you""",1452822,68527,667,67352,https://i.ytimg.com/vi/TWpt-ze_cYU/default.jpg,False,False,False,PREVIOUS YIAY ► https://www.youtube.com/watch?v=5Ki0FDDfrzg&list=PLiWL8lZPZ2_k1JH6urJ_H7HzH9etwmn7M&index=1\nSUBSCRIBE ► http://bit.ly/1A0Crdb\nTWITTER ► http://www.twitter.com/jacksfilms\nMERCH ► https://shop.crowdmade.com/collections/jacksfilms\nLIVE CHAT ► http://www.younow.com/jacksfilms\nSNAPCHAT ► realjacksfilms\nFACEBOOK ► http://www.facebook.com/jacksfilmsfans
2152,U4COOi4942A,2017-11-24,President Trump Delivers Remarks,The White House,25,2017-11-15 21:59:34+00:00,[none],48799,1816,139,752,https://i.ytimg.com/vi/U4COOi4942A/default.jpg,False,False,False,The White House
2046,UQHSK-kgONk,2017-11-24,Portugal. The Man - Feel It Still [2017 American Music Awards Performance],Portugal. The Man,10,2017-11-21 18:50:21+00:00,"portugal the man|""portugal. the man""|""woodstock""|""feel it still""|""american music awards""|""ama""|""john gourley""|""feel it still band""",141179,3803,39,266,https://i.ytimg.com/vi/UQHSK-kgONk/default.jpg,False,False,False,http://www.portugaltheman.com/WOODSTOCK \n\nWOODSTOCK available now!\nhttps://Atlantic.lnk.to/WoodstockID \n\nGo to http://feelitstill.com for the interactive version of the Feel it Still video. There you'll find 30 tools of #theresistance to fight apathy and injustice hidden in the film.\n\nFollow Portugal. The Man\nWebsite: http://www.portugaltheman.com/\nFB: https://www.facebook.com/portugaltheman \nIG: https://www.instagram.com/portugaltheman/\nTW: https://twitter.com/portugaltheman?lang=en\nSC: https://soundcloud.com/portugaltheman\nYT: https://www.youtube.com/user/Portugalthemanband\nTumblr: http://portugaltheman.tumblr.com/
2001,UceaB4D0jpo,2017-11-24,Post Malone - rockstar ft. 21 Savage,PostMaloneVEVO,10,2017-11-22 05:00:01+00:00,"Post Malone new music|""Stoney""|""Beer Bongs and Bentleys""|""Post Malone tour""|""rockstar song""|""Post""|""Malone""|""rockstar""|""Universal""|""Records""|""Hip""|""Hop""",11202281,686142,17999,68980,https://i.ytimg.com/vi/UceaB4D0jpo/default.jpg,False,False,False,"rockstar ft. 21 Savage (Official Video)\nSong Available Here: https://PostMalone.lnk.to/rsYD \n\nConnect with Post Malone:\nhttps://www.facebook.com/postmalone \nhttps://twitter.com/postmalone \nhttps://instagram.com/postmalone \nhttps://soundcloud.com/postmalone \nhttp://www.postmalone.com  \n\nDirector: Emil Nava\nProducer:  MaryAnn Tanedo\nDirector Of Photography: Kramer Morgenthau\nEditor: Sean Fazende\nFor Rojas Vision\n\nMusic video by Post Malone performing rockstar ft. 21 Savage.  © 2017 Republic Records, a division of UMG Recordings, Inc.\n\nhttp://vevo.ly/zMBE75"
2034,UhZ56rcWwRQ,2017-11-24,A Wrinkle in Time Official US Trailer,Disney Movie Trailers,1,2017-11-20 01:22:15+00:00,"a wrinkle in time|""movie""|""disney""|""oprah winfrey""|""reese witherspoon""|""mindy kaling""|""storm reid""|""trailer""|""HD""|""preview""|""book""|""payoff""|""official""|""tesser""|""aunt beast""|""ava duvernay""|""epic""|""whatsit""|""who""|""which""|""mrs""|""meg murry""|""chris pine""",1921050,22530,5069,5172,https://i.ytimg.com/vi/UhZ56rcWwRQ/default.jpg,False,False,False,"On March 9th, be a warrior. Watch the brand-new trailer for Disney’s A Wrinkle in Time.\n\nWebsite and Mobile site: disney.com/wrinkleintime\nLike us on Facebook: https://www.facebook.com/WrinkleinTimeMovie/\nFollow us on Twitter: https://twitter.com/WrinkleinTime\nInstagram: https://www.instagram.com/wrinkleintime/\nHashtag: #WrinkleinTime\n\nFrom visionary director Ava DuVernay comes Disney’s “A Wrinkle in Time,” an epic adventure based on Madeleine L’Engle’s timeless classic which takes audiences across dimensions of time and space, examining the nature of darkness versus light and, ultimately, the triumph of love. Through one girl’s transformative journey led by three celestial guides, we discover that strength comes from embracing one’s individuality and that the best way to triumph over fear is to travel by one’s own light.\n \nDirected by Emmy(R) winner and Oscar(R) and Golden Globe(R) nominee Ava DuVernay from a screenplay by Oscar winner Jennifer Lee based upon the beloved novel by Madeleine L’Engle, “A Wrinkle in Time” stars: two-time Academy Award(R) nominee Oprah Winfrey, Oscar and Emmy winner Reese Witherspoon, Emmy nominee Mindy Kaling, Gugu Mbatha-Raw, Michael Peňa and introducing Storm Reid, with two-time Emmy winner Zach Galifianakis and Emmy nominee Chris Pine.\n \nProduced by Jim Whitaker and Catherine Hand with Doug Merrifield serving as executive producer, the film also boasts an impressive creative team featuring some of the most talented artisans working today, including: Tobias Schliessler, ASC as director of photography, Naomi Shohan as production designer, Oscar(R)-nominee Spencer Averick as film editor, two-time Academy Award(R)-nominee Paco Delgado as costume designer and four time Emmy(R) nominee Ramin Djawadi as composer."
2093,UuCq8mtK8J4,2017-11-24,"DJ Snake, Lauv - A Different Way",DJSnakeVEVO,10,2017-11-16 05:00:01+00:00,"DJ Snake|""Lauv""|""A Different Way""|""Arc De Triomphe""|""Paris""|""DJ""|""Snake""|""Different""|""Way""|""Geffen""|""Dance""",5629932,182958,2905,5667,https://i.ytimg.com/vi/UuCq8mtK8J4/default.jpg,False,False,False,"Listen to DJ Snake’s 'A Different Way,' out now: \nhttp://smarturl.it/ADifferentWay \nSign up for updates from DJ Snake: http://smarturl.it/DJSnake.News\n\nUnlock the exclusive DJ Snake Sticker Pack on Snapchat - https://DJSnake.lnk.to/SnapStickerPack\n\nBest of DJ Snake: https://goo.gl/6tmV9z\nSubscribe here: https://goo.gl/qXjCy9\n\nMusic video by DJ Snake, Lauv performing A Different Way. (C) 2017 DJ Snake Music under exclusive license to UMG Recordings, Inc.\n\nhttp://vevo.ly/f5KLHM"
2004,V3EYjVPRClU,2017-11-24,Sia - Santa's Coming For Us,SiaVEVO,10,2017-11-22 16:00:02+00:00,Sia Santa's Coming For Us Holiday,1481114,87125,3020,9135,https://i.ytimg.com/vi/V3EYjVPRClU/default.jpg,False,False,False,"Join J.B. Smoove, Dax Shepard, Kristen Bell, Henry Winkler, Susan Lucci, Sophia Lillis, Wyatt Oleff & Caleb McLaughlin in the holiday fun with the Santa's Coming For Us video! 🎅\n\nStream/download 'Everyday Is Christmas' now: https://sia.lnk.to/christmas \n\nUpcoming tour dates - http://siamusic.net/tour \n\nSia - Everyday Is Christmas https://goo.gl/ma8XW1\nPlaylist Best of Sia https://goo.gl/99ubCj \nSubscribe for more https://goo.gl/UA7cug\n\nFollow Team Sia's Ear Candy on Spotify http://spoti.fi/1LMlB7X \nSubscribe to Sia on YouTube: http://bit.ly/1sudphS \nWebsite: http://siamusic.net \nTwitter: http://twitter.com/sia \nInstagram: http://instagram.com/SiaThisIsActing \nFacebook: http://facebook.com/siamusic \nSpotify: http://spoti.fi/1fKpbS0 \nPlaylist Best of Sia https://goo.gl/99ubCj \nSubscribe for more https://goo.gl/UA7cug\n\n\nMusic video by Sia performing Santa's Coming For Us. 2017 Monkey Puzzle Music, Inc., under exclusive license to Atlantic Recording Corporation for the United States and WEA International for the world outside of the United States."
2185,VEoOuF_cN0Q,2017-11-24,Cal Jam 17 - Good Times!,Foo Fighters,10,2017-11-13 19:50:03+00:00,[none],29126,1200,19,87,https://i.ytimg.com/vi/VEoOuF_cN0Q/default.jpg,False,False,False,"JUST ANNOUNCED! CAL JAM 18 \n10/6/18 - SAN BERNARDINO, CA\nFOO FIGHTERS & SO MUCH MORE!\nSIGN UP FOR MORE INFO: https://www.caljamfest.com/"
1999,VYzDZ1qeKEc,2017-11-24,My Explanation...,Jack Maynard,10,2017-11-23 18:27:12+00:00,"Jack Maynard|""Maynard""|""I'm a celeb""|""I'm a celebrity""|""I'm a celebrity get me out of here""|""GOAT""|""Grenade""|""First Car""|""My Explination""",965586,90288,4622,19877,https://i.ytimg.com/vi/VYzDZ1qeKEc/default.jpg,False,False,False,"I'm sorry. You all deserve answers as to what's been going on in the press recently, I have filmed a video to apologise for what I've said in the past and to thank you all for the incredible support. \n\nJack x"
2173,W187SzNVGvc,2017-11-24,IMAN FREESTYLES ON FLEX | #FREESTYLE085,HOT 97,10,2017-11-13 16:18:54+00:00,"hot97|""hot97app""|""music""|""video""|""hip hop""|""rap""|""r&b""|""hip-hop""|""New York""|""NY""|""US""|""United States""|""HOT97.com""|""iman""|""iman shumpert""|""teyana""|""teyana taylor""|""kanye west""|""fade""|""cavs""|""cavaliers""|""cleveland""",231868,5363,175,830,https://i.ytimg.com/vi/W187SzNVGvc/default.jpg,False,False,False,"Small  forward, Iman Shumpert makes it very clear that he's more than just a ball player! Reppin' Oak Park, IL, Iman comes through Funk Flex with some bars! \n\nHOT 97 App: http://www.hot97.com/hot97app\n\nYT SUBSCRIBE: http://bit.ly/12lN6vb\n\nhttp://www.hot97.com\n\nSOCIAL:\nINSTAGRAM: https://www.instagram.com/hot97\nFACEBOOK:  https://www.facebook.com/HOT97OFFICIAL\nTWITTER:    https://twitter.com/HOT97"
2065,WKcYTvyoidw,2017-11-24,Parenting Habits That Could Keep Children From Succeeding In Life,Business Insider,25,2017-11-21 20:00:02+00:00,"Business Insider|""Parenting""|""Parenting tips""|""Child development""|""Child behavior""|""Success""|""Discipline""|""Relationships""|""Science""",42024,1037,55,248,https://i.ytimg.com/vi/WKcYTvyoidw/default.jpg,False,False,False,"Raising children requires good parenting techniques as well as avoiding bad habits.  A positive body image help children develop socially. Quality time with kids also helps them in school. But just as important are avoiding mistakes that can curtail a child's social, physical, emotional and intellectual development. The following is a transcript of this video.\n\nParents of unsuccessful kids could have these 6 things in common.\n\nThey're authoritarian. Authoritarian parents discourage open communication. They make demands without explaining why. One study showed, when these parents checked children's homework it inhibited the child's overall school performance.\n\nParents who let kids watch TV when they're really young. Researchers said children who watched more TV were less likely to participate in class and had lower math scores. \n\nParents who yell at their kids a lot. Shouting, cursing and insults can have the same negative effects as physical discipline.\n\nThey're helicopter parents. Over-controlling parents have been linked to higher levels of anxiety and depression in children. Researchers found these children were less open to new ideas and more self-conscious.\n\nParents who are emotionally distant. This can contribute to: behavioral problems, insecurity, and emotional difficulties.\n\nParents who spank their kids. First graders who already had behavioral problems were even more disruptive if their parents spanked them. Spanking has also been linked to mental health problems and cognitive difficulties.\n\n--------------------------------------------------\n\nFollow BI Video on Twitter: http://bit.ly/1oS68Zs\nFollow BI on Facebook: http://bit.ly/1W9Lk0n\nRead more: http://www.businessinsider.com/\n\n--------------------------------------------------\n\nBusiness Insider is the fastest growing business news site in the US. Our mission: to tell you all you need to know about the big world around you. The BI Video team focuses on technology, strategy and science with an emphasis on unique storytelling and data that appeals to the next generation of leaders – the digital generation."
2067,WXlr35jV3cw,2017-11-24,P!nk presentation on AMAs 2017,mvt.ias,10,2017-11-20 03:10:33+00:00,"music|""chill""|""trap""|""lyrics""|""musica""|""letras""|""vaporwave""|""soft""|""suave""|""relax""|""electronic""|""sounds""|""amas""|""American Music Awards""|""amas 2017""|""AMA""|""PINK""|""Skycrapper Presentation""|""Dangerous""|""Pink""|""p!nk""",191327,3058,288,615,https://i.ytimg.com/vi/WXlr35jV3cw/default.jpg,False,False,False,Suscribe :)
2038,X5DWRXTOUD0,2017-11-24,THINGS PARENTS DO ON CHRISTMAS | MYLIFEASEVA,MyLifeAsEva,26,2017-11-21 23:32:56+00:00,"mylifeaseva|""things parents do""|""things parents do on christmas""|""things parents do on halloween""|""your parents on christmas""|""child you vs high school you""|""niki and gabi""|""laurdiy""|""eva gutowski""|""alisha marie""|""mia stammer""|""remi""|""child vs teen you""|""then vs now""|""parents on christmas""|""christmas""|""holidays""|""funny video""|""trending""|""christmas video""|""christmas funny""|""christmas diy""|""holiday diy""|""holiday funny""",637028,41968,1457,3344,https://i.ytimg.com/vi/X5DWRXTOUD0/default.jpg,False,False,False,"do your parents act like this on Christmas??!? ❄️☃️😂\n🔥🔥🔥SHOP MY CLOTHING LINE! 10-50% OFF http://www.itsallwild.com/🔥🔥🔥🔥\nLETS GET THIS VIDEO TO 300,000 LIKES!\nhttps://twitter.com/lifeaseva \ninstagram: http://instagram.com/mylifeaseva/\nfacebook: http://facebook.com/mylifeaseva/\nTUMBLR: http://calibeautyteen.tumblr.com/\n\nADAMS LINKS: \nhttps://www.youtube.com/channel/UC-1gYpX1k-gAu0Oovgt4txA\nhttps://www.instagram.com/captainbarto/\n----------------------------------------­----------------------------------------­-------------\n\nIf you see this, comment: once a year and only once, Santa comes to town"
2070,X9Gc_g638C8,2017-11-24,BTS Talks Emojis and More at the 2017 AMAs | E! Live from the Red Carpet,E! Live from the Red Carpet,24,2017-11-20 03:14:59+00:00,"2017 American Music Awards|""Awards""|""Red Carpet""|""Premieres""|""emojis""|""E! Live from the Red Carpet""|""Celebrity Gossip""|""Celebrity News""|""E! News""|""E! Entertainment""|""E!""|""Pop Culture""|""Live""|""Interviews""|""Award Show""|""Fashion""|""Beauty""|""Oscars""|""Grammys""|""Golden Globes""|""Emmys""|""Korean-pop boy""|""AMAs""|""BTS Talks Emojis""",101880,4945,22,406,https://i.ytimg.com/vi/X9Gc_g638C8/default.jpg,False,False,False,"The Korean-pop boy band opens up about their favorite emojis, getting nervous and performing at the 2017 AMAs. Watch!\n\nFull Story: http://www.eonline.com/news/894977/who-is-bts-5-things-to-know-about-the-korean-pop-boy-band-taking-over-the-2017-amas\n\nSubscribe: http://eonli.ne/RedCarpetSubscribe\n\nAbout E! Live from the Red Carpet:\nWho’s wearing what? Who’s dating who? We’re here to find out. Join E! Live from the Red Carpet at the Oscars, the Grammys, the Golden Globes, and more. Our correspondents are on the Red Carpet, ready to get the scoop from your favorite stars, musicians and personalities. Whether at a glamorous awards show, or the premiere of your favorite TV series, E! Live from the Red Carpet is the go to source for the latest beauty trends, the hottest red carpet fashion and exclusive celebrity interviews.\n\nConnect with E! Live from the Red Carpet and E! News:\nVisit the E! News WEBSITE: http://eonli.ne/enews\nFollow E! Live from the Red Carpet on TWITTER: http://eonli.ne/RedCarpetTwitter\nFollow E! News on TWITTER: http://eonli.ne/ENewsTW\nLike E! News on FACEBOOK: http://eonli.ne/ENewsFB\nCheck out E! News on INSTAGRAM: http://eonli.ne/ENewsIG\n\nBTS Talks Emojis and More at the 2017 AMAs | E! Live from the Red Carpet\nhttps://www.youtube.com/channel/UCD-1jAmL42qnEszozefaa1g"
2025,XHkAjUVoQME,2017-11-24,My Birth Father in Russia didn't know I existed - This is our bond,Alex Gilbert,22,2017-11-15 08:02:08+00:00,"alex gilbert|""birth father""|""russia""|""adopted""",242805,3236,62,201,https://i.ytimg.com/vi/XHkAjUVoQME/default.jpg,False,False,False,"http://instagram.com/alexgilbert\nhttp://facebook.com/nzalexgilbert\nhttp://twitter.com/alexgilbertnz\n\nBefore I found my Birth Father in 2013,  he didn't know I existed. When I first contacted him I don't think ever expected to have a son in New Zealand. He thanked my Mum and Dad and still does to this day. I always thank my Birth Father for letting me into his life.\n\nNote: I own all copyright for my videos. Please contact the team at contact@imadopted.org for any license details. This link can be shared or from Facebook at https://www.facebook.com/nzalexgilbert/videos/1493241727420733/ as long as I am credited from YouTube or Tagged with my Facebook Page."
2101,Y4lhAHTzbRE,2017-11-24,Is Nate Diaz vs Tyron Woodley The UFC 219 Main Card? | The Hollywood Beatdown,TMZSports,17,2017-11-17 21:56:06+00:00,"TMZ|""TMZ Sports""|""TMZ Sports Channel""|""TMZ 2017""|""TMZ Sports 2017""|""Celebrity""|""Sports""|""Athletes""|""TMZ News""|""Famous""|""Hall of Fame""|""Sports News""|""TMZ 2016""|""TMZ2016FS11221""|""The Hollywood beatdown""|""TMZ The Hollywood beatdown""|""Tyron Woodley""|""UFC Champion""|""UFC Champion Tryon Woodley""|""UFC The Chosen one""|""UFC""|""Nate Diaz""|""Tyron Woodley VS Nate Diaz""|""Tyron Woodley fights""|""Dana White""|""GSP""|""Conor Mcgregor""|""UFC Fight""|""UFC Nate Diaz""|""Rich Piana""|""Piana Death""|""People Magazine""|""People Blake Shelton""",80388,415,122,507,https://i.ytimg.com/vi/Y4lhAHTzbRE/default.jpg,False,False,False,"Every Friday on TMZ Sports UFC Welterweight Champion Tyron The Chosen One Woodley dishes on his favorite stories in the world of Hollywood and Sports. Hear what Tyron is FIRED UP about, who he wants to PUNCH IN THE FACE, and his honest take on a story we like to call On The Real, Though.\n\nSUBSCRIBE -- http://po.st/TMZSportsSubscribe\n\nAbout TMZ Sports:\nSome of the best stories in sports have been off the field and we’re reporting on athletes from NFL, NBA, UFC, WWE, MLB and more!  \n\nSubscribe to TMZ Sports on YouTube for the latest news, exclusive interviews, clips from TMZ Sports on FS1 and videos of your favorite athletes and celebs. \n\nNeed More TMZ?\nTMZ Sports Website: http://po.st/TMZSportsWebsite\nLIKE TMZ Sports on Facebook!http://po.st/TMZSportsLike\nFOLLOW TMZ on Twitter! http://po.st/TMZFollow\nFOLLOW TMZ on Instagram! http://po.st/TMZInsta\nTMZ on TV & TMZ Sports on FS1 Tune In Info: http://po.st/TMZOnAir\nTMZ is on iOS! http://po.st/TMZiOS\nTMZ is on Android! http://po.st/TMZonAndroid\n\nGot a Tip?\nContact TMZ: http://po.st/TMZTip\n\nCheck out TMZ, TMZ Live, and toofab!\nTMZ: http://po.st/TMZWebsite\nSubscribe! TMZ: http://po.st/TMZSubscribe\nTMZ Live: http://po.st/TMZLiveWebsite\nSubscribe! TMZ Live: http://po.st/TMZLiveSubscribe\nToofab: http://po.st/toofabWebsite\nSubscribe! toofab: http://po.st/toofabSubscribe\n\nhttps://www.youtube.com/c/tmzsports"
2054,YJcergNiMDQ,2017-11-24,Rainbow Six Siege: White Noise Operators Gameplay and Starter Tips | UbiBlog | Ubisoft [US],Ubisoft US,20,2017-11-19 19:58:55+00:00,"Rainbow six siege|""rainbow six siege trailer""|""rainbow six siege tips""|""pc game""|""steam""|""ps4""|""xbox one""|""ubisoft""|""ubisoft games""|""ubisoft games 2017""|""walkthrough""|""rainbow six siege gameplay""|""gameplay""|""tom clancy""|""r6s""|""single player""|""pvp""|""multiplayer""|""playstation 4""|""shooter game""|""fps""|""first person shooter""|""operators""|""new operators""|""tactical""|""trailer""|""dlc""|""white noise""|""Dokkaebi""|""Vigil""|""Zofia""|""tower""|""rainbow six siege white noise""|""r6s update""|""r6s white noise""|""korea""|""r6s ubiblog""|""ubiblog""",2044079,68361,1692,9971,https://i.ytimg.com/vi/YJcergNiMDQ/default.jpg,False,False,False,"Operation White Noise is taking Rainbow Six Siege to South Korea, where a new map called Tower will test your tolerance for heights and three new Operators - Dokkaebi, Vigil, and Zofia - will put new gadgets into play. We've got some gameplay footage of all three in action as well as tips to help you get started.\n\n#R6S\n\nPlease SUBSCRIBE: \nhttp://bit.ly/UbisoftYouTubeChannel\n\nVisit our official channels to stay up to date with Rainbow Six Siege:\nhttps://rainbow6.ubisoft.com/\nhttps://www.facebook.com/rainbow6usa/\nhttps://www.instagram.com/rainbow6gam...\nhttps://twitter.com/Rainbow6Game\nhttp://www.youtube.com/Ubisoft_US\n\nABOUT RAINBOW SIX SIEGE\nRainbow Six Siege is an exciting, new approach to the first-person shooter experience that puts tactical combat and masterful destruction at the center of the action. Lead your team of unique, counter-terrorist Rainbow operators through tense and thrilling combat scenarios, and achieve victory through smart preparation and strategic improvisation. Rainbow Six Siege is available now on Xbox One, PlayStation® 4 and PC.\n\nKey Features:\n\n-THE RULES OF SIEGE: Five versus Five. Attack versus Defend. Infiltrate versus Fortify. Team-based strategy meets intense, tactical combat.\n\n-WORLD'S ELITE COUNTER-TERRORIST OPERATORS: Choose your Operator and wield their unique ability to breach or defend the objective as a part of an elite team.\n\n-DESTRUCTION AS A TOOL: Walls can be shattered; floors and ceilings can be breached. Mastering the tactical use of destruction is the key to victory.\n\n-CLOSE-QUARTERS COMBAT: With tight spaces shaping all combat arenas, tense encounters and up-close-and-personal firefights abound within every Siege.\n\nRainbow Six Siege: White Noise Operators Gameplay and Starter Tips | UbiBlog | Ubisoft [US]\nhttp://www.youtube.com/Ubisoft_US"
2053,Yhea380bYp0,2017-11-24,Green Day - 2000 Light Years Away,Green Day,10,2017-11-21 19:02:57+00:00,"green day|""green""|""day""|""official""|""music""|""music video""",139228,17143,89,1319,https://i.ytimg.com/vi/Yhea380bYp0/default.jpg,False,False,False,Taking you on a trip down memory lane with this video of 2000 Light Years Away\n\nBlessed are those who listen to God's Favorite Band - the new greatest hits album is out everywhere now. Go stream or download the ultimate playlist of 22 hits including “Back In The USA” & “Ordinary World ft. Miranda Lambert https://greenday.lnk.to/gfb\n\nUpcoming tour dates: http://www.greenday.com/tour\n\nFOLLOW GREEN DAY\nSite - http://www.greenday.com/\nFacebook - https://www.facebook.com/GreenDay\nTwitter - https://twitter.com/GreenDay\nInstagram - https://www.instagram.com/greenday/\nSpotify - http://spoti.fi/219ZDzL\nStore - http://store.greenday.com/
2002,Z1rZAT2GtmI,2017-11-24,Expiration Dates Don't Mean What You Think,CollegeHumor,23,2017-11-22 18:30:01+00:00,"Collegehumor|""CH originals""|""comedy""|""sketch comedy""|""internet""|""humor""|""funny""|""sketch""|""adam ruins everything""|""are""|""adam ruins expiration dates""|""expiration dates don't mean anything""|""whatd do expiration dates mean""|""expiration dates fake""|""expiration dates debunked""|""adam debunks expiration dates""",1750448,41770,2502,4942,https://i.ytimg.com/vi/Z1rZAT2GtmI/default.jpg,False,False,False,"Expiration dates tell you when food tastes best, not when it isn't safe.\n\nAdam Ruins Everything - Adam Conover, CollegeHumor's resident know-it-all and major bummer, takes on society's biggest misconceptions.\n\nWatch an all-new @Adam Ruins Everything on truTV every Tuesday 10/9C! #AdamRuinsEverything\n\nSee more http://www.collegehumor.com\nLIKE us on: http://www.facebook.com/collegehumor\nFOLLOW us on: http://www.twitter.com/collegehumor\nFOLLOW us on: http://www.collegehumor.tumblr.com"
