id,video_id,trending_date,title,channel_title,category_id,publish_time,tags,views,likes,dislikes,comment_count,thumbnail_link,comments_disabled,ratings_disabled,video_error_or_removed,description
2049,DpSWgZVIfi8,2017-11-24,SZA - Go Gina (Stripped) (Vevo LIFT),SZAVEVO,10,2017-11-21 17:00:00+00:00,"SZA|""LIFT SZA""|""Vevo SZA""|""Go Gina""|""SZA Go Gina""|""SZA Ctrl""|""Ctrl""|""R&B""|""SZA R&B""|""SZA live""|""SZA videos""|""SZA music videos""|""music videos""|""vevo videos""|""streaming video""|""streaming music""",249899,22745,141,1016,https://i.ytimg.com/vi/DpSWgZVIfi8/default.jpg,False,False,False,"SZA - Go Gina (Stripped LIFT)\n\nSZA is enjoying a big blast of acclaim for 'Ctrl,' one of 2017's most inventive albums. Our newest LIFT artist performs Go Gina accompanied only by a bassist in an outdoor setting, and it almost more fierce than the studio version. See how different this spin is compared to the original.  \n\nWatch SZA Live: http://vevo.ly/1o6MnX\n\nWatch SZA on Vevo: https://www.vevo.com/artist/sza\n\nNew Music Videos: http://www.vevo.com\n\nIncoming: R&B: http://vevo.ly/gzo1tl\n\nGet the Vevo App! http://smarturl.it/vevoapps\n\nhttp://facebook.com/vevo\nhttp://twitter.com/vevo\nhttp://instagram.com/vevo\nhttp://vevo.tumblr.com\n\nSZA\nhttp://szactrl.com\nhttp://instagram.com/sza\nhttp://twitter.com/sza\nhttp://facebook.com/sza\n\nhttp://vevo.ly/H4Cs6k"
2006,EBt_88nxG4c,2017-11-24,P!nk - Beautiful Trauma (Official Video),PinkVEVO,10,2017-11-21 14:00:02+00:00,"Beautiful Trauma|""P!nk""|""Pop""|""RCA Records Label""",8464537,327503,12297,24010,https://i.ytimg.com/vi/EBt_88nxG4c/default.jpg,False,False,False,P!NK's new album 'Beautiful Trauma' featuring the singles “What About Us” and Beautiful Trauma is available now!\niTunes - http://smarturl.it/BeautifulTrauma/itunes?IQid=yt \nApple Music - http://smarturl.it/BeautifulTrauma/applemusic?IQid=yt \nSpotify - http://smarturl.it/BeautifulTrauma/spotify?IQid=yt \nAmazon - http://smarturl.it/BeautifulTrauma/amazon?IQid=yt \nGoogle Play - http://smarturl.it/BeautifulTrauma/googleplay?IQid=yt\n \nWatch the Official Video for “What About Us” - http://smarturl.it/WAU?IQid=yt\n \nConnect with P!NK:\nhttp://www.facebook.com/pink\nhttp://www.twitter.com/pink\nhttp://www.instagram.com/pink\nhttp://www.pinkspage.com
2112,EEIP1YpFXrE,2017-11-24,Our First Date,iHasCupquake,20,2017-11-15 20:00:00+00:00,"first date|""animation""|""animated""|""short""|""shorts""|""animation shorts""|""cartoon""|""ihascupquake""|""redb15""|""cupquake""|""red""|""cupquake and red first date""|""ihascupquake first date""|""funny animation""|""funny cartoon""|""funny first date""|""movies""|""jlo""|""anaconda""|""married couple""|""couple""|""gamer couple""|""our first date""|""ihascupquake animated""|""cupquake animation""|""ihascupquake animation""",1359474,48722,908,6874,https://i.ytimg.com/vi/EEIP1YpFXrE/default.jpg,False,False,False,"Here's an animation short of our First Date! We are excited to hear what you all think so it so leave a comment below! Also, what would you like to see animated next? Thanks for watching!\n\nAnimated by Kevin M! \n\nGrab our Stickers here! ► http://bit.ly/iHCStickers\nNEW Merch in my shop! ► http://bit.ly/iHCStore\n\nCheck out these Playlists!\n---------------------------------------------------------\nAnimated Shorts ► - http://bit.ly/iHCAnimatedShorts\nHusband VS Wife ► - http://bit.ly/Husband_Vs_Wife\nTop 10 Videos of the Month! ►http://bit.ly/iHCTop10\n\nFollow me\n---------------------------------------------------------\nTwitter - https://twitter.com/iHasCupquake\nFacebook - https://www.facebook.com/cupquake/\nInstagram - http://instagram.com/tiffyquake\n\nFollow Red\n-------------------------------------------------------\nYouTube - https://www.youtube.com/user/theredb15\nTwitter - https://twitter.com/redb15\nInstagram - https://www.instagram.com/redb15/"
2159,ENr6CXm1YxU,2017-11-24,Rachel Platten - Whole Heart (Audio),RachelPlattenVEVO,10,2017-11-15 08:00:01+00:00,"Columbia|""Pop""|""Rachel Platten""|""Whole Heart""",106588,2425,107,98,https://i.ytimg.com/vi/ENr6CXm1YxU/default.jpg,False,False,False,Rachel Platten -  Whole Heart (Audio Video)\nGet Whole Heart from her new album 'Waves' here: http://smarturl.it/WavesRP?IQid=wholeheartaudio \n\nFollow Rachel Platten:\nTwitter: https://twitter.com/RachelPlatten\nInstagram: http://instagram.com/rachelplatten\nFacebook: http://facebook.com/rachelplattenmusic\nBest of Rachel Platten: https://goo.gl/pFBNbL\nSubscribe here: https://goo.gl/vQGZgm
2008,EaC6LTIxBrA,2017-11-24,"Eric Cantona Interview; Mourinho, Evra & Management!",FullTimeDEVILS,17,2017-11-23 10:06:35+00:00,"Manchester United|""Manchester""|""Man Utd""|""Football""|""Soccer""|""fulltimedevils""|""Andy Tate""|""Full Time Devils""|""Manchester United News""|""Transfer News""|""United""|""Man United""|""Mourinho""|""MUFC""|""Eric""|""Cantona""|""Eric Cantona""|""interview""|""Martial""|""Pogba""|""Evra""|""Management""|""Griezmann""|""Legend""|""kick""|""kung fu kick""|""palace fan""|""my notebook""|""book""|""Alex Ferguson""|""Modric""|""Pastore""|""PSG""|""fan""|""fans""",55517,3175,35,596,https://i.ytimg.com/vi/EaC6LTIxBrA/default.jpg,False,False,False,"We ask Manchester United LEGEND Eric Cantona your questions on Mourinho, Martial, Pogba, Evra, Management, Griezmann and more! #AskEric\n\nEric spoke to us as part of his promotion of his new book! ‘My Notebook’ BUY IT HERE: https://www.amazon.co.uk/My-Notebook-Eric-Cantona/dp/147460837X\n\nSubscribe, FREE, for more MUFC: http://bit.ly/DEVILSsub\nSubscribe to The Football Republic: http://bit.ly/1Nsw8Uq\n\nAbout FullTimeDEVILS:\nWe are YouTube's largest football fan channel for Manchester United fans! Bringing you big match previews, post-match reaction and reviews, tactical analysis, player debates and much more! If you're a red, we want you to get involved; whatever you want to say about United you can say it in the comments below. And to become one of our Devil pundits and be on the shows, here's how you can get in touch:\nTwitter: https://twitter.com/FullTimeDEVILS\nFacebook: https://www.facebook.com/FullTimeDEVILS\nG+: https://plus.google.com/+FullTimeDevils"
2170,EvWPqF_AQHI,2017-11-24,DESIGNER AUTUMN HAUL! | Amelia Liana,Amelia Liana,26,2017-11-13 16:37:04+00:00,"amelialiana|""amelia liana""|""designer autumn haul""|""autumn haul 2017""|""haul unboxing try on""|""unboxing""|""luxury""|""designer""|""fashion""|""style""|""how to""|""prada""|""self portrait""",103818,2630,209,371,https://i.ytimg.com/vi/EvWPqF_AQHI/default.jpg,False,False,False,"New designer unboxing, haul & try on from mytheresa.com for fall autumn 2017! Including Prada, Fendi, Miu Miu, Aquazurra & Self Portrait! \n\n↓↓↓ SUBSCRIBE HERE for new videos every Monday & Thursday! http://bit.ly/1pm8SkR\n__________________________________________________________________\n\n\nITEMS I BOUGHT ON MYTHERESA:\n\nBook Clutch:\nhttp://bit.ly/2zUdwjd\n\nLace-up Velvet Ankle Boots:\nhttp://bit.ly/2yWB86P\n\nBlack Ankle Boots with Pearls:\nhttp://bit.ly/2zEZXkA\n\nFloral Bag Strap:\nhttp://bit.ly/2joO3Y1\n\nPink Cable-knit Sweater:\nhttp://bit.ly/2ABl8TT\n\nSilver Embellished Pumps:\nhttp://bit.ly/2ml4pSu\n\nStar Jeans:\nhttp://bit.ly/2AF2coj\n\nBlack Studded Shoulder Bag:\nhttp://bit.ly/2zCZVvE\n\nRed Dress with Cut-out Sleeves:\nhttp://bit.ly/2yxFjS6\n\nDaisy Sunglasses:\nhttp://bit.ly/2iazlk5\n(in black) http://bit.ly/2yx1tUG\n\n\nDress I’m wearing in the video: http://bit.ly/2gci88Z\nNail polish I'm wearing: OPI Yank My Doodle http://bit.ly/2zdLnlS\n\n\nJEWELLERY I WEAR:\n\nCoin necklaces: http://bit.ly/2yVaha1 http://bit.ly/2z9KGe3\nStacking Rings: http://bit.ly/2x7GiHx\nEvil Eye Rings: http://bit.ly/2tRiPu0\nTrinity Ring: http://bit.ly/2x7IBuc\nRed String Bracelet: http://bit.ly/2qUqLf8\nBangle: http://bit.ly/2vLLUrE\n__________________________________________________________________\n\n\nEQUIPMENT:\n\nCanon Vlog Camera: http://bit.ly/2f6R1vq\nCanon Big Camera: http://bit.ly/2xcsoba (with this lens): http://bit.ly/2eII9vj\n__________________________________________________________________\n\n\nWanna see more? Follow me on my social media... \nBlog (for weekly posts) → https://amelialiana.com/\nTwitter (great for youtube polls about videos & more!) → https://twitter.com/amelialiana_ \nINSTAGRAM (featuring lots of Instagram lives!) → http://instagram.com/amelialiana \nSNAPCHAT → amelia.liana \n__________________________________________________________________\n\n\nLATEST VIDEOS:\n\nMy Coat Collection: https://youtu.be/hIwRdDcQBEU\n\nCome Jewellery Shopping with Me: https://youtu.be/gdBGqp0__P8"
2171,FCdvOAcbK4s,2017-11-24,Danny MacAskill vs The Munros,EnduraOfficial,17,2017-11-08 15:15:51+00:00,"Danny MacAskill|""Cut Media""|""Scotland""|""MTB""|""mountain bike""|""Santa Cruz""|""road trip""|""bike""|""Danny""|""MacAskill""|""Ben Lawers""|""Munros""|""Munro""",129153,1950,35,47,https://i.ytimg.com/vi/FCdvOAcbK4s/default.jpg,False,False,False,Danny MacAskill heads out into the Scottish hills to tackle the mighty Ben Lawers - one of the highest mountains in Scotland - for a windy trip to the summit and sweet descent back down from the top.
2031,FTv-CE43PpM,2017-11-24,Justice League Could Lose WB Big Money - SJU,ScreenJunkies News,24,2017-11-21 19:47:18+00:00,"screen junkies news|""screenjunkies""|""screenjunkies news""|""screen junkies""|""justice league""|""justice league box office""|""justice league review""|""dc box office""|""dc comics""|""dceu""|""dc movie""|""wonder woman 2""|""aquaman""|""aquaman movie""|""wonder woman sequel""",76830,1822,172,815,https://i.ytimg.com/vi/FTv-CE43PpM/default.jpg,False,False,False,Forbes Justice League Article: https://www.forbes.com/sites/robcain/2017/11/20/warner-bros-faces-a-possible-50m-to-100m-loss-on-justice-league/#66045da25d8b\n\nPANEL: \n\nRoth Cornet \nDan Murrell \nSpencer Gilbert \nYael Tygiel\n\nSubscribe Now! ►► http://sj.plus/SJNewsSubscribe\n\nFor More ScreenJunkies News Visit:\nLike us on Facebook: http://Facebook.com/ScreenJunkiesNews\nFollow us on Twitter: http://Twitter.com/SJNews\nKeep up with us on Instagram: http://instagr.am/SJNews\nWebsite: http://www.screenjunkies.com
2020,FaxqVBYVOVU,2017-11-24,Mega Medley that was supposed to be 5 minutes but wasn't,lara6683,20,2017-11-22 02:46:07+00:00,"twitch|""games""",152289,5828,46,437,https://i.ytimg.com/vi/FaxqVBYVOVU/default.jpg,False,False,False,Broadcasted live on Twitch -- Watch live at https://www.twitch.tv/lara6683
2061,Fjdbk8kBFNA,2017-11-24,BTS interview at the American Music Awards 2017,J-14 Magazine,24,2017-11-20 18:13:05+00:00,"BTS|""Interview""|""American Music Awards""|""Liam McEwan""|""AMAs""|""K-pop""|""k pop""|""B T S""|""Bangtan""|""Beyond the Scene""|""Love Yourself""|""Her""|""Unicef""",41666,3101,11,289,https://i.ytimg.com/vi/Fjdbk8kBFNA/default.jpg,False,False,False,"J-14's Liam McEwan reunited with K-Pop megastars, BTS at the 2017 AMAs!"
2089,GWM8x6Y6cXU,2017-11-24,CD Projekt considering “games as a service” for CyberPunk 2077,Pretty Good Gaming,20,2017-11-18 08:30:01+00:00,"Witcher|""the Witcher""|""Witcher 3""|""the Witcher 3""|""cyberpunk""|""cyberpunk 2077""|""cyberpunk news""|""cyberpunk 2077 news""|""cd projekt""|""cd projekt red""|""gwent""|""gwent open beta""|""gwent beta""|""gog""|""gog.com""|""games as a service""|""microtransactions""|""cyberpunk microtransactions""|""gwent microtransactions""|""cyberpunk 2077 microtransactions""|""the witcher 3 wild hunt""|""the witcher 2""|""loot crates""|""loot boxes""|""cyberpunk info""|""gwent news""|""cyberpunk games""|""cyberpunk game""|""games as a service cyberpunk""",139039,5776,2436,2870,https://i.ytimg.com/vi/GWM8x6Y6cXU/default.jpg,False,False,False,"CD Projekt are considered to be of the best game developers around these days because of their strong belief in DRM free games and their work on the critically acclaimed Witcher series and their next game, Cyberpunk 2077, is apparently going to be better than The Witcher in every single way according to CD Projekt’s CEO. In a recent interview with financial firm, CD Projekt revealed that Cyberpunk would have a “seamless multiplayer” component and the studio has been experimenting with games as a service, Oh Dear.\n\nHosts: Mike Williams and Gareth Evans\nScript: Liam McKelvey\nEditor: Jake Kulkowski\n\nSources:\nhttp://www.pcgamer.com/cyberpunk-2077-will-include-online-elements-to-ensure-long-term-success-says-cd-projekt/\n\nCD Projekt Interview - https://www.youtube.com/watch?v=Rwx1N5BbqaY\n\nMore Videos:\nTelltale Games - https://www.youtube.com/watch?v=Ej5xV8ZawpQ\nBelgian Loot Box Investigation - https://www.youtube.com/watch?v=EdL9gqdeqBA\nCOD WW2 Issues - https://www.youtube.com/watch?v=31-tWzLVRnQ\nBattlegrounds Leak - https://www.youtube.com/watch?v=ZjvhEsa9IFg\nESRB Indies - https://www.youtube.com/watch?v=sAvgMetupnw\n\nSUPPORT US on Patreon: https://www.patreon.com/prettygoodgaming\n\nSUBSCRIBE: https://www.youtube.com/channel/UCodK-9eXEm_hWSDDfLr4QzA?sub_confirmation=1\n\nFollow Pretty Good Gaming\nTWITCH: https://www.twitch.tv/prettygoodgamingyt\nFACEBOOK: https://www.facebook.com/PrettyGoodGamingPage/\nTWITTER: https://twitter.com/PrettyBadTweets\nWEBSITE:  http://www.prettygoodgaming.com\n\nFollow us\nGareth - https://twitter.com/prettygoodgaz\nMike - https://twitter.com/MikendrickW\nJake - https://twitter.com/Theonlyjakeever\nLiam - https://twitter.com/Liam_Says_Hi"
2027,H0uvmD8CSxs,2017-11-24,LaVar Ball: What did Trump do to help me?,CNN,25,2017-11-21 04:19:07+00:00,"latest News|""Happening Now""|""CNN""|""LaVar Ball""|""President""|""Donald Trump""|""UCLA""|""basketball""|""players""|""arrested""|""shoplifting""|""Chris Cuomo""|""CNN Tonight""|""interview""|""very ungrateful""|""thank you""|""China""|""tweet""|""Chris Mo""|""politics""|""us news""|""sports""",455097,2771,1509,6544,https://i.ytimg.com/vi/H0uvmD8CSxs/default.jpg,False,False,False,"LaVar Ball, the father of one of the three UCLA basketball players held in China after they were accused of shoplifting, speaks to CNN's Chris Cuomo in a heated interview about his response to President Donald Trump's tweets about the incident."
2121,HJBqbRMUOaI,2017-11-24,Kesha - Silence (Marshmello & Khalid cover) in the Live Lounge,BBCRadio1VEVO,10,2017-11-15 19:16:59+00:00,"Kesha|""BBC""|""Radio 1""|""Live Lounge""|""silence""|""khalid""|""marshmello""",133858,4200,139,191,https://i.ytimg.com/vi/HJBqbRMUOaI/default.jpg,False,False,False,Kesha performs a cover of Marshmello & Khalid's track Silence in the BBC Radio 1 Live Lounge\n\nhttp://vevo.ly/1QDVnh
2035,HszBf-CJeVE,2017-11-24,Zendaya's Wavy-Curly Hair Tutorial,Zendaya,24,2017-11-21 17:51:10+00:00,"zendaya|""curly hair routine""|""curly hairstyles""|""curly hair tutorial""|""zendaya hair tutorial""|""zendaya hair""|""zendaya hairstyles""|""zendaya hair routine""|""zendaya makeup tutorial""|""hair tutorial""|""hair transformation""|""hair hacks""|""hair tutorial for black women""|""hair tutorial easy""|""zendaya coleman""|""zendaya replay""|""zendaya wild n out""|""zendaya and tom holland""|""zendaya and zac efron""",822215,40240,461,2287,https://i.ytimg.com/vi/HszBf-CJeVE/default.jpg,False,False,False,"Download Zendaya's app @ the App Store: https://goo.gl/MWvWfQ\n\nSubscribe for new clips from Zendaya’s app: https://goo.gl/sDxfW5\n\nFollow Zendaya on Twitter at https://twitter.com/zendaya and Facebook: www.facebook.com/Zendaya\n\nTune in regularly to get a peek at the latest videos from Zendaya’s app, or subscribe to the app to watch videos in their entirety.\n\nMore Recent Video clips:\n\nExtensions, Weaves and Wigs\nhttps://www.youtube.com/watch?v=wbld3Ct-jc0\n\nInside My 20th Birthday\nhttps://www.youtube.com/watch?v=I-ML1j1XiiQ&t=1s\n\nI Try to Make a Rainbow Cake\nhttps://www.youtube.com/watch?v=1W422UJKrNM\n\nZendaya at the Women’s March in Washington\nhttps://www.youtube.com/watch?v=_Ta7m4SHQmY&t=1s\n\nMy Watchlist!\nhttps://www.youtube.com/watch?v=6eXmVsOi7pY\n\nPerfecting Daya Series\nhttps://www.youtube.com/playlist?list=PLz6TW6ibGGmzqOY05b601zxVF2k_8qFkq"
2016,I6N-XuYllgA,2017-11-24,"Jet Packinski Touches a Hairless Rat, Rooster & Other Weird Stuff in the Fear Box | Vanity Fair",Vanity Fair,24,2017-11-22 17:00:41+00:00,"derek blasberg|""liza koshy""|""jet packinski""|""jet packinski liza koshy""|""jet packinski reaction""|""jet packinski iii""|""jet packinski funny moments""|""jet packinski best moments""|""liza koshy jet packinski""|""liza koshy jet""|""liza koshy reacting""|""liza koshy reacts""|""fear box""|""jet liza koshy""|""liza koshy funny""|""liza koshy 2017""|""liza koshy funny moments""|""liza koshy best moments""|""liza koshy fear box""|""liza koshy reaction""|""vanity fair""|""vanity fair magazine""|""vf""",1165229,57834,729,3040,https://i.ytimg.com/vi/I6N-XuYllgA/default.jpg,False,False,False,"In this episode of Derek Does Stuff with a Friend, Derek Blasberg challenges Jet Packinski (Liza Koshy) to stick his hands in the Fear Box. Packinski touches a rooster, a hairless rat, and some other weird stuff. His reactions are priceless.\n\nStill haven’t subscribed to Vanity Fair on YouTube? ►► http://bit.ly/2z6Ya9M\n\nABOUT VANITY FAIR\nArts and entertainment, business and media, politics, and world affairs—Vanity Fair’s features and exclusive videos capture the people, places, and ideas that define modern culture. \n\nJet Packinski Touches a Hairless Rat, Rooster & Other Weird Stuff in the Fear Box | Vanity Fair"
2146,IKuKZIISPE0,2017-11-24,Behind The Curtain - OFFICIAL TRAILER,todrickhall,24,2017-11-15 17:00:16+00:00,"Todrick Hall|""MTV""|""American Idol""|""Beyonce""|""Flash Mob""|""Target""|""Glee""|""90s Disney""|""Scooter Braun""|""Mashup""|""Parody""|""Ratchet""|""Ghetto""|""Grown Woman""|""Pentatonix""|""Evolution of Disney""|""Low""|""Wizard of Ahhhs""|""Mean Gurlz""|""Hungry Games""|""Reality Show""|""GAY""|""lgbt""|""documentary""|""katherine fairfax wright""|""call me kuchu""|""pride""|""race""|""pulse""|""mass shooting""|""gun violence""|""racism""|""acceptance""|""music""|""pop""|""artist""|""r&B""|""netlifx""|""itunes""|""amazon""|""hulu""|""behind the scenes""|""dance""|""indie""|""independent""",228146,4923,18,236,https://i.ytimg.com/vi/IKuKZIISPE0/default.jpg,False,False,False,"Get tickets now: http://bit.ly/2yUpuJA\nStraight Outta Oz and into the spotlight!\nBehind The Curtain is available on iTunes 12/12 & DVD 12/19!\nJoin Todrick in NY (12/6) & Dallas (12/13) for special red carpet screenings!\n\nTodrick Hall launches his most ambitious project yet: the full-scale original musical Straight Outta Oz. From a small town in Texas to big-time show business, comes an inspiring documentary of grit, perseverance and the redemptive power of art.  \n\nFollow Todrick:\nhttp://instagram.com/todrick\nhttp://facebook.com/toddyrockstar\nhttp://twitter.com/todrick\nhttp://todrickhall.com"
2163,JDDP9fY6dmI,2017-11-24,A Group Of Democrats Just Officially Moved To Impeach Donald Trump As President | TIME,TIME,25,2017-11-15 20:18:55+00:00,"democrats|""impeach""|""impeach trump""|""impeach donald trump""|""donald trump""|""impeachment""|""trump""|""politics""|""liberal""|""president""|""white house""|""republicans""|""republican""|""president donald trump""|""president trump""|""impeach donald trump now""|""impeach donald trump we the people""|""impeach donald trump petition""|""impeach donald trump news""|""Time""|""time magazine""|""magazine""|""time (magazine)""|""time.com""|""news today""|""world news""|""interview""|""science""|""technology""|""health""|""entertainment""|""business""|""breaking news""|""lifestyle""|""video""|""live""",90251,1451,577,1466,https://i.ytimg.com/vi/JDDP9fY6dmI/default.jpg,False,False,False,"A half-dozen Democrats on Wednesday introduced articles of impeachment against President Donald Trump, accusing him of obstruction of justice and other offenses, in a long-shot effort that stands little chance in the Republican-led House.\nSubscribe to TIME ►► http://po.st/SubscribeTIME\n \nGet closer to the world of entertainment and celebrity news as TIME gives you access and insight on the people who make what you watch, read and share.\nhttps://www.youtube.com/playlist?list=PL2EFFA5DB900C633F\n \nMoney helps you learn how to spend and invest your money. Find advice and guidance you can count on from how to negotiate, how to save and everything in between.\nhttps://www.youtube.com/playlist?list=PLYOGLpQQfhNKdqS_Wccs94rMHiajrRr4W\n \nFind out more about the latest developments in science and technology as TIME’s access brings you to the ideas and people changing our world.\nhttps://www.youtube.com/playlist?list=PLYOGLpQQfhNIzsgcwqhT6ctKOfHfyuaL3\n \nLet TIME show you everything you need to know about drones, autonomous cars, smart devices and the latest inventions which are shaping industries and our way of living\nhttps://www.youtube.com/playlist?list=PL2862F811BE8F5623\n \nStay up to date on breaking news from around the world through TIME’s trusted reporting, insight and access\nhttps://www.youtube.com/playlist?list=PLYOGLpQQfhNJeIsW3A2d5Bs22Wc3PHma6\n\nCONNECT WITH TIME\nWeb: http://time.com/\nTwitter: https://twitter.com/TIME\nFacebook: https://www.facebook.com/time \nGoogle+: https://plus.google.com/+TIME/videos\nInstagram: https://www.instagram.com/time/?hl=en\nMagazine: http://time.com/magazine/\nNewsletter: time.com/newsletter\n\nABOUT TIME\nTIME brings unparalleled insight, access and authority to the news. A 24/7 news publication with nearly a century of experience, TIME’s coverage shapes how we understand our world. Subscribe for daily news, interviews, science, technology, politics, health, entertainment, and business updates, as well as exclusive videos from TIME’s Person of the Year, TIME 100 and more created by TIME’s acclaimed writers, producers and editors.\n \nA Group Of Democrats Just Officially Moved To Impeach Donald Trump As President | TIME\nhttps://www.youtube.com/user/TimeMagazine"
2176,Jw1Y-zhQURU,2017-11-24,John Lewis Christmas Ad 2017 - #MozTheMonster,John Lewis,26,2017-11-10 07:38:29+00:00,"christmas|""john lewis christmas""|""john lewis""|""christmas ad""|""mozthemonster""|""christmas 2017""|""christmas ad 2017""|""john lewis christmas advert""|""moz""",8551847,63270,12403,8036,https://i.ytimg.com/vi/Jw1Y-zhQURU/default.jpg,False,False,False,"Click here to continue the story and make your own monster:\nhttp://bit.ly/2mboXgj\n\nJoe befriends a noisy Monster under his bed but the two have so much fun together that he can't get to sleep, leaving him tired by day. For Christmas Joe receives a gift to help him finally get a good night’s sleep.\n\nShop the ad\nhttp://bit.ly/2hg04Lc\n\nThe music is Golden Slumbers performed by elbow, the original song was by The Beatles. \nFind the track:\nhttps://Elbow.lnk.to/GoldenSlumbersXS\n\nSubscribe to this channel for regular video updates\nhttp://bit.ly/2eU8MvW\n\nIf you want to hear more from John Lewis:\n\nLike John Lewis on Facebook\nhttp://www.facebook.com/johnlewisretail\n\nFollow John Lewis on Twitter\nhttp://twitter.com/johnlewisretail\n\nFollow John Lewis on Instagram\nhttp://instagram.com/johnlewisretail"
2125,K6xwB8Kkce0,2017-11-24,Harry Styles - Kiwi (live in studio),HarryStylesVEVO,10,2017-11-17 13:00:02+00:00,"Columbia|""Harry Styles""|""Kiwi""|""Pop""",1110861,178151,558,7575,https://i.ytimg.com/vi/K6xwB8Kkce0/default.jpg,False,False,False,"'Harry Styles: Behind the Album - The Performances' is out now only on Apple Music: http://smarturl.it/HS-BTA-Performances?iqid=KiwiLive\n\nThe film sees Styles performing all 10 tracks from his full self-titled debut and is an extended look into the performances from 'Harry Styles: Behind the Album,' which premiered on Apple Music earlier this year: http://smarturl.it/HS-BehindTheAlbum?iqid=KiwiLive\n\nHarry Styles' self-titled debut album is available now: http://hstyles.co.uk/music\n\nBest of Harry Styles: https://goo.gl/UzwxNi\nHarry Styles - Harry Styles (Album 2017) https://goo.gl/z1GUVh\nSubscribe here: https://goo.gl/6UDD4P"
