id,video_id,trending_date,title,channel_title,category_id,publish_time,tags,views,likes,dislikes,comment_count,thumbnail_link,comments_disabled,ratings_disabled,video_error_or_removed,description
2095,ec9r9THD5eU,2017-11-24,Christmas Queens - Let It Snow [Official Video],PEG Management,10,2017-11-17 09:33:58+00:00,"Christmas Queens|""Christmas Queens 3""|""Let It Snow""|""Manila Luzon""|""Peppermint""|""Ivy Winters""|""Jinkx Monsoon""|""Sharon Needles""|""Thorgy Thor""|""Ginger Minj""|""Phi Phi O'hara""|""Jiggly Caliente""",32271,824,51,130,https://i.ytimg.com/vi/ec9r9THD5eU/default.jpg,False,False,False,"Buy Christmas Queens 3 on iTunes: \nhttp://itunes.apple.com/album/id1310212645?ls=1&app=itunes\n\nThank you to our sponsor, http://CheapUndies.com !\n\nFilmed at PEG: the Store - 453 Colyton Street, LA CA 90013\n\nProduced by:  Producer Entertainment Group & Brad Hammer Productions \nDirected by:  Brad Hammer\nExecutive Producer:  David Charpentier\nDirector of Photography:  Shawn Adeli\nEditor:  Shawn Adeli \nAssistant Director:  Nicholas Monaco\nLighting/Gaffer:  Justin Madsen\nStylist:  Natalie Garnica\nPhotographer:  Davide Laffe  (@welovequeens / http://www.davidelaffe.com )\nBehind the Scenes:  Winston Abalos\nMakeup/Hair:  Timothy Willy\n\nStarring:\nJinkx Monsoon\nSharon Needles\nPhi Phi O'Hara\nJiggly Caliente\nManila Luzon\nThorgy Thor\nIvy Winters\nGinger Minj\nPeppermint\nCheapUndies boys:  Giancarlo Annitto and Michael Silas \nMic J Rez\nChad O'Connell\nCJ Russell\nNick Sahoyah\nJeremy Fiorentino \nAlec White\nKenneth Lee\nAnn Pyne\nArisce Wagner\nMikey Cabrera\nTyler Booth\nSpiros Galanopoulos\nRubber Child\nLisa Lambaugh\nColton Iverson\nAva Minett\nLoretta Minett"
2024,fIElFIuzGLI,2017-11-24,TESTING OUT THE *NEW* KYLIE JENNER HOLIDAY MAKEUP,Kandee Johnson,26,2017-11-22 18:12:42+00:00,"kandee johnson|""kandee""|""beauty""|""how to""|""NEW""|""KYLIE JENNER""|""KYLIE LIP KIT""|""KYLIE HOLIDAY""|""makeup review""|""testing makeup""|""kylie cosmetics""|""kylie cosmetics holiday 2017""|""holiday makeup""|""holiday wet set""|""sugar lip""|""spice lip""|""kylie cosmetics review""|""testing out""|""kandy johnson""|""candy johnson""|""kylie cosmetics holiday lip kits""|""SURPRISE VIDEO""|""kylie review""",151567,4459,629,686,https://i.ytimg.com/vi/fIElFIuzGLI/default.jpg,False,False,False,"This surprise box of makeup arrived at my door and I thought that I'd unbox it with you guys and it turned out to be the NEW KYLIE JENNER 2017 Holiday Makeup Collection with her Holiday Spice Lip Kit & Holiday Sugar Lip kit, The Wet Set Palette, the Naughty Palette & The Nice Palette. I swatch and test them out with you all and hope you had fun watching!\nJOIN THE KANDEE FAMILY & Subscribe here ➜ http://bit.ly/1GoV9M8 \n\n💖SUBSCRIBE & JOIN THE KANDEE FAMILY ➜ http://bit.ly/1GoV9M8 \n\n💜💙💚💛💖COME BE MY BFF EVERYWHERE💜💙💚💛💖\n💛INSTAGRAM ➜ http://www.instagram.com/kandeejohnson\n\n💙TWITTER ➜ http://www.twitter.com/kandeejohnson\n\n💛SNAPCHAT ➜ KandeeJohnson\n\n💙FACEBOOK ➜ http://www.facebook.com/kandeejohnson\n\nDo you guys like watching the me do the live swatching of the makeup?\n\nDISLAIMER: I was NOT paid in any way to make this video. All swatching is my own. I was also not paid to have my name start with K like Kylie or have my name start with J, like Jenner.\nThis box was delivered to my door but had no name of who it was from, so this was so fun to see it was the Kylie Jenner HOliday makeup together right?!"
2083,fRj34o4hN4I,2017-11-24,"What's new, Atlas?",BostonDynamics,28,2017-11-16 21:12:25+00:00,"Robotics|""Humanoid Robots""|""Legged Locomotion""|""Dynamic robots""|""Boston Dynamics""",10775416,205630,4927,35422,https://i.ytimg.com/vi/fRj34o4hN4I/default.jpg,False,False,False,"What have you been up to lately, Atlas?"
2033,fzs6O7b9Fe0,2017-11-24,Daddy & Mummy in a sausage?,Tom Fletcher,24,2017-11-21 15:06:36+00:00,"Some kind of wonderful|""The Christmasaurus""|""marriage""|""husband""|""wife""|""kids""|""parents""|""books""|""work""|""publication""|""celebration""|""music""|""songs""|""soundtrack""|""mcfly""|""Giovanna Fletcher""|""Tom Fletcher""",55811,1805,32,134,https://i.ytimg.com/vi/fzs6O7b9Fe0/default.jpg,False,False,False,"Double publication day for me and Gi. Fun times! \nThe Christmasaurus: The Musical Edition is available here\nAmazon: http://po.st/ChristmasaurusAmazon\nTesco: http://po.st/ChristmasaurusTesco\nWaterstones: http://po.st/ChristmasaurusWaterstones\nWHSmith: http://po.st/ChristmasaurusWHSmith\n\nGi's book, Some Kind of Wonderful is available here:\nhttps://www.amazon.co.uk/Some-Kind-Wonderful-Giovanna-Fletcher/dp/1405924861\n\nTickets for The Christmasaurus LIVE are available here:\n\nhttp://www.eventim.co.uk/tickets.html?fun=erdetail&doc=erdetaila&erid=1800935&affiliate=HAL"
2175,gKo7V7nxvqE,2017-11-24,Harry Styles returns to The X Factor stage! | Live Shows | The X Factor 2017,The X Factor UK,24,2017-11-11 22:47:49+00:00,"the x factor|""x factor""|""X factor UK""|""x factor 2017""|""simon cowell""|""nicole""|""sharon""|""louis""|""talent""|""auditions""|""judges""|""season 14""|""series 14""|""X Factor UK 2017""|""X Factor 2017 audition""|""The x factor 2017""|""XFactor 2017""|""itv""",1454771,66631,715,0,https://i.ytimg.com/vi/gKo7V7nxvqE/default.jpg,True,False,False,"Visit the official site: http://itv.com/xfactor\n\nHarry Styles is home to show us how it’s done! With his first solo performance, he performed his brand new single ‘Kiwi’.\n\nSUBSCRIBE: http://bit.ly/TXFSub\nFacebook: http://bit.ly/TXFFB\nTwitter: http://bit.ly/TXFTwi\nDownload The X Factor mobile app: http://bit.ly/TXFapp\nWatch full episodes on ITV Hub (UK ONLY): http://www.itv.com/hub/the-x-factor"
2150,hXcoq5XDwyA,2017-11-24,Playing CUPHEAD with MatPat!,Butch Hartman,20,2017-11-15 22:02:34+00:00,"game theory|""film theory""|""cuphead""|""don't deal with the devil""|""gameplay""|""video game""|""matpat""|""gtlive""|""butch hartman""|""fairly oddparents""|""danny phantom""|""cartoon""|""animated""|""animation""|""nickelodeon""",75590,4716,125,558,https://i.ytimg.com/vi/hXcoq5XDwyA/default.jpg,False,False,False,"After my appearance on GTLive, MatPat (Game Theory) and I played Cuphead!\nCuphead's ODDEST Adventure (GTLive) ► https://youtu.be/T4alTnUUxbk\n\nYes, I'm the real guy. I created your childhood AKA Fairly Odd Parents, Danny Phantom, TUFF Puppy, and now...the NOOG NETWORK and Bunsen is a Beast!\n\nListen to my NEW podcast Speech Bubble...\nApple Podcasts: http://apple.co/2g3EGvH\nGoogle Play: http://bit.ly/2xqNIKB\nSoundCloud: http://bit.ly/2xrL5IH"
2191,hbmdI8A7SSo,2017-11-24,"What the heck, October? | Lex Croucher",Lex Croucher,23,2017-11-12 19:53:50+00:00,"tyrannosauruslexxx|""lexcanroar""|""lex croucher""|""comedy""|""beauty""|""fashion""|""books""",19499,1216,16,160,https://i.ytimg.com/vi/hbmdI8A7SSo/default.jpg,False,False,False,My tattoo artist: https://www.instagram.com/gabbycolledge/\n\nTwitter: http://www.twitter.com/lexcanroar | Instagram: http://instagram.com/lexcanroar | Podcast: https://soundcloud.com/makeoutwithhim | Etsy: https://www.etsy.com/uk/shop/lexandjonnypins
2119,hpapqEeb36k,2017-11-24,Pumpkin Pie - You Suck at Cooking (episode 68),You Suck At Cooking,26,2017-11-15 14:52:38+00:00,"Forest|""Cooking""|""recipe""|""chef""|""how to""|""cooking tutorial""|""you suck at cooking""|""ysac""|""pumpkin""|""pumpkin pie""|""thanksgiving""|""comedy""|""funny""|""pie""|""spices""",945652,37340,926,2002,https://i.ytimg.com/vi/hpapqEeb36k/default.jpg,False,False,False,"Pumpkins are good for literally 2 things; making pumpkin pies, and throwing them off bridges. \nWell I’m all all out of bridges. \n\nSubscribe: http://bit.ly/1HuynlY\nhttp://instagram.com/yousuckatcooking\nhttps://twitter.com/yousuckatcookin\nSnapchat: @yousuckatcookin \nhttp://facebook.com/yousuckatcooking\n\nTo make the pie:\nBuy a pie crust. Nobody has time for that and they’re like a buck or two\nTake a 13.5oz/398ml can of pure pumpkin. Not “pumpkin pie filling.” Don’t be an animal\nBut that in a bowl. It’s gonna be thick. Be prepared for that\nAdd two eggs\nAdd 3/4 cup of sugar\nAdd 1/2 teaspoon of salt \n2 1/4 teaspoons of pumpkin pie spice \n(or if you’re a real hot shot, use 1 tsp cinnamon, 1 tsp ground ginger, 1/4 tsp cloves)\nWangjangle that together until it’s smooth. \nSlowly add in 1 1/2 cups of 10% cream \nDoubt yourself because something this liquidy could never be a pie. \nPut it the undo on 425undo for 15 minutes. \nReduce it to 350. \nNow here’s where you’re gonna have to make a judgment call. Bake for 30 minutes but test the wobble. The wobble tells you everything. When the wobble is gone, the pie is ready. A deep dish crust could take an hour. There’s quite a range you can cook it in where it will still turn out great. \nTake it out and leave it for at least an hour, and admire the process of turning a liquid into a solid. \nWhip cream that son of a bitch into tomorrow."
2068,hq9SEUlkZ5s,2017-11-24,My Very POSITIVE Birth Plan | MOTHERHOOD,Sprinkleofglitter,26,2017-11-18 13:22:53+00:00,"sprinkleofglitter|""sprinkle of glitter""|""Louise Pentland""|""birth plan""|""home birth plan""|""positive birth plan""|""home birth uk""|""home birth with high bmi""|""home birth after traumatic delivery in hospital""|""delayed cord clamping""|""water birth""|""pregnant""|""pregnancy""",154215,7381,158,602,https://i.ytimg.com/vi/hq9SEUlkZ5s/default.jpg,False,False,False,"A very old school production video detailing my ideal birth plan!\nPrevious Video - http://bit.ly/2hHZppw\nSubscribe to never miss and upload again! \n\nSiobhan the greatest gift to pregnant women! (AKA Hynobirthing Queen) - https://twitter.com/thedoublemama?lang=en-gb\n\nMore of Me : \n\nTwitter - https://twitter.com/LouisePentland\nFaceBook - https://www.facebook.com/louisepentland/\nSnapchat - LouisePentland\nInsta- Louise Pentland\nRobin Wilde - http://louisepentlandnovel.com/\n\nFor business enquiries, please contact Maddie or Charlotte at my management company, Gleam Futures!\n\nAbout Me ::\n\nHi, I'm Louise! I started this channel in 2009 after readers of my blog (also called Sprinkle of Glitter) suggested I give YouTube a try. I was instantly hooked and have found my internet playground on here. I make videos about beauty & fashion, positive living, motherhood, lifestyle and occasionally have special guests (friends, kittens or my sweet Daughter Darcy). Hit the subscribe button to never miss a video again! \n\nI try to upload every Wednesday and Friday!\n\nI chat every day on my other social media (linked above) so do come and say hi! \n\nBig hugs,\n\nLouise xxx"
2078,hsLcTO2a0Ec,2017-11-24,Justice League reviewed by Mark Kermode,kermodeandmayo,1,2017-11-17 15:58:18+00:00,"Zack Snyder|""Ben Affleck""|""Gal Gadot""|""Jason Momoa""|""Ezra Miller""|""Ray Fisher""|""Justice League""|""Kermode and Mayo’s Film Review""|""BBC""|""5live""",160309,2691,392,974,https://i.ytimg.com/vi/hsLcTO2a0Ec/default.jpg,False,False,False,"Mark Kermode reviews Justice League. Batman and his new ally, Wonder Woman, enlist other super-powered people to help fight off an extraterrestrial threat to the planet.\n\nPlease tell us what you think of the film -- or Mark’s review of the film – below. We love to include your views on the show every Friday.\n\nhttp://www.bbc.co.uk/5live\nFridays at 2pm on BBC 5 live."
2133,i9EyFghIt5o,2017-11-24,How Climate Scientists Predict the Future,SciShow,27,2017-11-15 22:00:01+00:00,"SciShow|""science""|""Hank""|""Green""|""education""|""learn""|""global warming""|""climate change""|""global climate models""|""computer models""|""supercomputers""|""atmosphere""|""hindcasting""|""temperature increase""|""un reports""|""ice sheets""|""sea level rise""|""melting ice sheets""|""carbon dioxide""|""greenhouse gasses""|""greenhouse effect""|""us global change research program""|""melting ice caps""|""growing season""|""hurricanes""|""hurricane season""|""hurricane landfalls""|""irma""|""harvey""|""ocean warming""",146372,5880,356,972,https://i.ytimg.com/vi/i9EyFghIt5o/default.jpg,False,False,False,"Over the years, scientists have made a lot of predictions about how Earth's climate is changing, but they don't just pull those predictions from thin air.\n\nWe're conducting a survey of our viewers! If you have time, please give us feedback: https://www.surveymonkey.com/r/SciShowSurvey2017\n\nHosted by: Stefan Chin\n----------\nSupport SciShow by becoming a patron on Patreon: https://www.patreon.com/scishow\n----------\nDooblydoo thanks go to the following Patreon supporters: KSam Lutfi, Kevin Knupp, Nicholas Smith, Inerri, D.A. Noe, alexander wadsworth,\nسلطان الخليفي, Piya Shedden, KatieMarie Magnone, Scott Satovsky Jr, Bella Nash, Charles Southerland, Bader AlGhamdi, James Harshaw, Patrick Merrithew, Patrick D. Ashmore, Candy, Tim Curwick, charles george, Saul, Mark Terrio-Cameron, Viraansh Bhanushali, Kevin Bealer, Philippe von Bergen, Chris Peters, Fatima Iqbal, Justin Lentz\n----------\nLooking for SciShow elsewhere on the internet?\nFacebook: http://www.facebook.com/scishow\nTwitter: http://www.twitter.com/scishow\nTumblr: http://scishow.tumblr.com\nInstagram: http://instagram.com/thescishow\n----------\nSources:\nhttp://nca2014.globalchange.gov/\nhttp://s3.amazonaws.com/nca2014/low/NCA3_Full_Report_02_Our_Changing_Climate_LowRes.pdf?download=1\nhttps://history.aip.org/climate/GCM.htm\nhttps://history.aip.org/climate/impacts.htm#impacts\nhttp://www.realclimate.org/index.php/archives/2008/11/faq-on-climate-models/\nhttps://www.ncdc.noaa.gov/data-access/model-data/model-datasets/climate-prediction\nhttps://www.climate.gov/maps-data/primer/climate-models\nhttps://www.climatechangeinaustralia.gov.au/en/climate-campus/modelling-and-projections/climate-models/theory-and-physics/\nhttp://www.ucsusa.org/global_warming/science_and_impacts/science/ipcc-backgrounder.html#.WdQkdWhSyM9\nhttps://www.ipcc.ch/activities/activities.shtml\nhttps://www.ipcc.ch/news_and_events/docs/factsheets/FS_timeline.pdf\nhttps://www.sei-international.org/mediamanager/documents/A-guide-to-RCPs.pdf\nhttps://earthobservatory.nasa.gov/Features/GlobalWarming/page2.php\nhttps://earthobservatory.nasa.gov/Features/GlobalWarming/page5.php\nhttps://www.theguardian.com/world/2007/sep/03/weather.features11\nhttp://iopscience.iop.org/article/10.1088/1748-9326/7/4/044035/pdf\nhttps://www.ipcc.ch/pdf/assessment-report/ar5/wg1/WG1AR5_Chapter13_FINAL.pdf\nhttps://www.theguardian.com/environment/climate-consensus-97-per-cent/2016/jul/27/climate-models-are-accurately-predicting-ocean-and-global-warming\nhttps://www.ocean-sci.net/12/925/2016/\nhttp://www.bbc.com/future/story/20150616-what-happens-when-the-sea-swallows-a-country\n----------\nImages:\nhttps://commons.wikimedia.org/wiki/File:Olea_europaea_subsp._cuspidata01.jpg\nhttps://commons.wikimedia.org/wiki/File:GISP2_1855m_ice_core_layers.png\nhttps://commons.wikimedia.org/wiki/File:CDC_6600.jc.jpg\nhttps://commons.wikimedia.org/wiki/File:Boerderij_Arpisson_(2327m.)_boven_Gimillan_in_Cogne_Valley_(Itali%C3%AB)._Ganzen_bij_de_boerderij.jpg\nhttps://commons.wikimedia.org/wiki/File:Male-total.jpg\nhttps://commons.wikimedia.org/wiki/File:Flickr_-_Nicholas_T_-_Cloudscape_(5).jpg"
2172,ijJPFowBsBc,2017-11-24,HUGE BEAUTY FAVOURITES! AUTUMN LOVES!,Estée Lalonde,22,2017-11-12 17:00:02+00:00,"essiebutton|""Estée Lalonde""|""Estee Lalonde""|""Essie Button""|""Essie""|""No Makeup Makeup""|""Drugstore Makeup Tutorial""|""Fashion""|""Cute Outfits""|""Makeup Tutorials""|""Healthy Foods""|""Eye Makeup""|""Outfit Ideas""|""Natural Makeup""|""Easy Healthy Recipes""|""Skin Care Products""|""Best Makeup""|""beauty""|""favourites""|""favorites""|""november""|""2017""|""haul""|""new in""|""glossier""|""you""|""perfume""|""review""|""ouai""|""messy hair""|""charlotte tilbury""|""skincare""|""lancome""|""highlighter""|""glow""|""scandinavian""|""rupi kaur""|""fashion""",161892,4856,186,341,https://i.ytimg.com/vi/ijJPFowBsBc/default.jpg,False,False,False,"Come to Cambodia with me! \nhttps://youtu.be/IVRVXYCrr14\n___________\n\nMY LINKS »\nSECOND CHANNEL → http://www.youtube.com/EverydayEstee\nWEBSITE → http://www.esteelalonde.com/\nTWITTER → http://twitter.com/EsteeLalonde\nINSTAGRAM → http://www.instagram.com/EsteeLalonde\nFACEBOOK → https://www.facebook.com/EsteeLalonde\nTUMBLR → http://esteelalonde.tumblr.com/\nPINTEREST → https://www.pinterest.com/esteelalonde\n\nSUBSCRIBE TO ASLAN→https://www.youtube.com/user/theworktop\nASLAN’S INSTAGRAM→https://www.instagram.com/li0nsmane/\n\n___________\n\nI have a brand new PODCAST! \n👉🏼 Radio Wolfgang: http://wolfga.ng/tattoOs\n👉🏼 iTunes: http://wolfga.ng/taTtoos\n👉🏼 Audioboom: http://wolfga.ng/tAttoos\n👉🏼 Stitcher: http://bit.ly/2fRfpl8\n👉🏼  Spotify: http://spoti.fi/2fypeYm\n👉🏼 My Blog: http://www.esteelalonde.com/podcast/\n\nSTAY UP TO DATE WITH US ON SOCIAL MEDIA! \n\nINSTAGRAM: https://www.instagram.com/theheartofi...\nTWITTER: https://twitter.com/THEHEARTOFITPOD\nFACEBOOK: https://www.facebook.com/theheartofit/\n\n___________\n\nTHINGS MENTIONED\n\nREGGIE MERCH SWEATER\nhttp://www.wildatheartfoundation.org/buy-our-2017-sweatshirts/reggie\n\nWatch the Reggie video here! \nhttps://youtu.be/YL7VTU6iWFY\n\nTHE HEART OF IT PODCAST \nhttp://www.esteelalonde.com/podcast/\n\nGLOSSIER YOU PERFUME \nhttp://bit.ly/2zKd8U7\n\nECCENTRIC MOLECULE PERFUME\nhttp://bit.ly/2zK6NIC\n\nOUAI MATTE POMADE\nhttp://bit.ly/2ymFmjz\n\nCHARLOTTE TILBURY PALETTE\nhttp://bit.ly/2hWS82g\n\nSURRATT LIPSLIQUES (LADYBUG, BANDY, NU DE SOLEIL)\nhttp://bit.ly/2zvOEex\n\nCLE DE PEAU CONCEALER\nhttp://bit.ly/2zvMUEg\n\n*SIMILAR TO NARS CONCEALER \nhttp://bit.ly/2jdX6ea\n\nBUXOM MASCARA \nhttp://bit.ly/2hXiFfN\n\nMILANI BLUSH \nhttp://bit.ly/2hhYHLZ\n\nCAUDALIE RADIANCE SERUM\nhttp://bit.ly/2zKDwxu\n\nLANCOME CLICK & GLOW \nhttp://bit.ly/2zrmPXb\n\nFRESH INSTANT GLOW LUMINIZER\nhttp://bit.ly/2zKh1sh\n\nSCHMIDT’S DEODORANT \nhttp://bit.ly/2zs9KwA\n\nDRESS SCANDINAVIAN\nhttp://bit.ly/2zoH47X\n\nTHE SUN AND HER FLOWERS - RUPI\nhttp://bit.ly/2zt7NQO\n\nMILK AND HONEY- RUPI\nhttp://bit.ly/2zKfOB9\n\nDARLING MAGAZINE\nhttp://darlingmagazine.org/\n\nRED SCARF\n(SIMILAR) http://bit.ly/2zI2opm\n\n___________\n\nWHAT I'M WEARING\n\nWhite Top\nhttp://bit.ly/2zKdiLj\n\nGold Necklace #1\nhttp://bit.ly/2zJyr8i\n\nGold Necklace #2\nhttp://bit.ly/2zq3cia\n\nGold Bracelet \nhttp://bit.ly/2zHYa0Y\n\nLipstick \nhttp://bit.ly/2zvOEex\n\nBronzer\nhttp://bit.ly/2AoUZYs"
2103,ixxR3ZoqnF0,2017-11-24,BTS (방탄소년단) 'MIC Drop (Steve Aoki Remix)' Official Teaser,ibighit,10,2017-11-16 15:00:05+00:00,"BIGHIT|""빅히트""|""방탄소년단""|""BTS""|""BANGTAN""|""방탄""",8484137,1066852,5230,93583,https://i.ytimg.com/vi/ixxR3ZoqnF0/default.jpg,False,False,False,"BTS (방탄소년단) 'MIC Drop (Steve Aoki Remix)' Official Teaser\n\n\n'MIC Drop (Steve Aoki Remix)' MV will be released on November 24, 2017. \n\n\n\n\nConnect with BTS:\nhttp://www.ibighit.com \nhttp://twitter.com/BTS_bighit \nhttp://twitter.com/BTS_twt \nhttps://www.facebook.com/ibighit/\nhttp://www.facebook.com/bangtan.official\nhttp://instagram.com/BTS.bighitofficial\nhttp://weibo.com/BTSbighit"
2110,jG1JY0rt2Os,2017-11-24,Fall Out Boy - HOLD ME TIGHT OR DON’T,FallOutBoyVEVO,10,2017-11-15 05:00:02+00:00,"Fall Out Boy|""Hold Me Tight Or Don’t""|""Hold Me Tight""|""MANIA""|""FOB""|""Patrick Stump""|""Pete Wentz""|""Joe Trohman""|""Andy Hurley""|""Fall""|""Out""|""Boy""|""HOLD""|""ME""|""TIGHT""|""OR""|""DON’T""|""Island""|""Records""|""Alternative""",4527136,188264,5323,16272,https://i.ytimg.com/vi/jG1JY0rt2Os/default.jpg,False,False,False,"New single HOLD ME TIGHT OR DON'T out now - download/stream the song: https://falloutboy.lnk.to/holdmetight\n\nM A  N   I    A out on January 19th - preorder the album now: https://falloutboy.lnk.to/mania\n\nUpcoming tour dates: https://falloutboy.com/tour \n\nDirected by Brendan Walter and Mel Soria \n\nBest of Fall Out Boy: https://goo.gl/NQaRzd\nSubscribe here: https://goo.gl/rQoGSD\n\nhttp://falloutboy.com\nhttp://facebook.com/falloutboy\nhttp://twitter.com/falloutboy\nhttp://youtube.com/falloutboy\nhttp://instagram.com/falloutboy\nhttp://spoti.fi/T3yFgI\n\nLYRICS\n\nI never really feel a thing I’m just kinda too froze\nYou were the only one that even kinda came close\nI just pinch myself, no longer comatose\nI woke up no luck, I woke up no luck\nAnd when your stich comes loose\nI want to sleep on every piece of fuzz and stuffing that comes out of you\nI took too many hits off this memory\nI need to come down.\nAnother day goes by so hold me tight\nor don’t.\nOh no this isn’t how our story ends, so hold me tight, or don’t\nI got too high again when I realized I cant not be with you\nOr be just your friend\nI love you to death but I just cant pretend we were lovers first\nConfidants but never friends\nwere we ever friends?\nCause im past the limits\nThe distance between us, it sharpens me like a knife\n\nMusic video by Fall Out Boy performing HOLD ME TIGHT OR DON’T. (C) 2017 Island Records, a division of UMG Recordings, Inc.\n\nhttp://vevo.ly/sy8EAS"
2155,jGiqc3HSxEg,2017-11-24,A Study of So Bad It's Good Movies,Now You See It,27,2017-11-13 15:30:01+00:00,"the room|""so bad its good""|""movies that are so bad they're good""|""worst movies""|""The Room""|""sharknado""|""the disaster artist""|""the disaster artist the room""|""the princess bride""|""so bad its good movies""|""best so bad its good movies""|""video essay""|""now you see it""",280991,13729,261,661,https://i.ytimg.com/vi/jGiqc3HSxEg/default.jpg,False,False,False,"Why do we love movies that are so bad, they're good? Let's explore what these movies have in common and see that many critically acclaimed movies actually contain the phenomenon that makes So Bad, It's Good movies so appealing.\n\nTwitter: http://bit.ly/1QvLI0H\nPatreon: http://bit.ly/1UaO9MU"
2039,jH2t4Tcl3Pg,2017-11-24,Bruno Mars - Live At The Apollo Theater [Official Trailer] (November 29th on CBS),Bruno Mars,10,2017-11-20 16:14:48+00:00,"Bruno Mars|""Live At The Apollo Theater""|""Apollo Theater""|""Live""|""Bruno""|""Mars""|""24k Magic""|""24kmagic""|""Apollo Special""",687107,27235,490,1516,https://i.ytimg.com/vi/jH2t4Tcl3Pg/default.jpg,False,False,False,Tune into Bruno Mars Live At The Apollo Theater November 29th 10PM ET on CBS \n\n24k Magic out now: https://Atlantic.lnk.to/24K_MagicID\n\nConnect with Bruno:\nhttp://www.brunomars.com\nhttp://www.instagram.com/brunomars\nhttp://www.twitter.com/brunomars\nhttp://www.facebook.com/brunomars
2122,k1cA-Wh3Tc0,2017-11-24,Peephole Reverser? | 9 Pointless Tech Gadgets!,Matthias,28,2017-11-15 00:00:03+00:00,"tech|""gadgets""|""new""|""2017""|""pointless tech gadgets""|""apple""|""smart product""|""cool gadgets""|""new gadget""|""weird things online""|""tech under""|""tech invention""|""technology""|""unbox""|""unboxing""|""on amazon""|""reacting to""|""family friendly""|""inventions""|""gadgets from""|""things on amazon""|""shopping gadget""|""latest tech""|""weird tech""|""gag gift""|""gift idea""|""kids""|""gift""|""mathias""|""matthias""|""matthiasiam""|""hi5 studios""|""#M757""",955550,20888,979,6580,https://i.ytimg.com/vi/k1cA-Wh3Tc0/default.jpg,False,False,False,"Today I test out some weird gadgets and tech items that could be completely pointless, or actually useful to me! Join me as I unbox these unique gadgets, and find out if these products are as useful as they claim to be! \n\nSubscribe Now! ➡ https://www.youtube.com/user/matthiasiam?sub_confirmation=1\n\nBuy your favorite products, it helps out the channel!\n\n0:31 - Binary Clock - http://amzn.to/2xu6rDH\n2:12 - Mobile EKG System - http://amzn.to/2yw6uxe \n4:14 - Light-Up Equalizer Tie - http://amzn.to/2fFLxIc\n5:34 - UV Flashlight - http://amzn.to/2yMUUhm\n8:09 - Titanium Glow Fob - http://amzn.to/2ywcJ3V\n9:27 - Million Mile Light - http://amzn.to/2ynAkqN\n11:44 - Waterproof Keyboard - http://amzn.to/2yvBwFe\n13:40 - BattleBots Arena - http://amzn.to/2jQWb3t\n18:00 - Peephole Reverser - http://amzn.to/2yw7wt6\n\nWant your product to possibly be featured in an upcoming episode? Send your product to:\n\nMatthias “Submissions 24307 Magic Mountain Pkwy Box #617\nValencia, CA 91355\n\n⬇️ FOLLOW ME! ⬇️\n\nSNAPCHAT ➡ @MATTHIASIAM\n\nTWITTER ➡ http://bit.ly/MatthiasTwitter\n\nINSTAGRAM ➡ http://bit.ly/MatthiasInsta\n\n⬇️CHECK OUT MY OTHER SERIES⬇️\n\nTech Gadgets! ➡ https://www.youtube.com/playlist?list=PL15dtrx_ng4RZH3aop96cWRW7CZU-uqDe\n\neBay Products! ➡ https://www.youtube.com/watch?v=hTypEDOjACw&list=PL15dtrx_ng4QdiYSImFRcgPCGjz0BwMAM\n\nDOPE or NOPE! ➡ https://www.youtube.com/playlist?list=PL15dtrx_ng4QiBZll2i6v1zab_4gAGdGH\n\nStrange Chinese Products! ➡ https://www.youtube.com/playlist?list=PL15dtrx_ng4TjAqiZC57Rbt6po770koAR\n\nStrange Walmart Items ➡ https://www.youtube.com/watch?v=heIeCsyzUNc&list=PL15dtrx_ng4Sf6qE3iVX3NAj240-MY3MC\n\nStrange Amazon Products! ➡ https://www.youtube.com/playlist?list=PL15dtrx_ng4Re8uHiuotJvXd_eGCfezoy\n\nStrange Dollar Store Items ➡ https://www.youtube.com/playlist?list=PL15dtrx_ng4Tqcw2GVq08SZw7LBh_qcWX\n\n⬇️OTHER HI5 STUDIOS CHANNELS⬇️\n\nBattle Universe ➡ https://www.youtube.com/channel/UCGGlk1zXSXEeb_gP2ciY7Hg\n\nGet Good Gaming ➡ https://www.youtube.com/channel/UCJLFizUO3gCQnyiYKMYvUgg\n\nTeam Edge Gaming ➡ https://www.youtube.com/channel/UC-6Ygz2yrPcPPhl4pAobqNQ\n\nREKT ➡  https://www.youtube.com/channel/UCETEqk3eDILFcu8p6YncjQw\n\nNew videos every Tuesday, Thursday, and Saturday! Subscribe so you don't miss them!"
