id,video_id,trending_date,title,channel_title,category_id,publish_time,tags,views,likes,dislikes,comment_count,thumbnail_link,comments_disabled,ratings_disabled,video_error_or_removed,description
707,F62QpaPWXDI,2017-11-17,THE CHEAPEST & BEST EYESHADOWS?,Jamie Genevieve,22,2017-11-09 18:18:59+00:00,"jamie genevieve|""bblogger""|""youtuber""|""makeup""|""tutorial""|""how to""|""vlog""|""makeup tutorial""|""bleach london""|""louder powder""|""bleach london eyeshadows""|""cheapest eyeshadows""",123195,5376,92,317,https://i.ytimg.com/vi/F62QpaPWXDI/default.jpg,False,False,False,"Subscribe and join the fam! http://www.youtube.com/jamiegenevieve\n\nHey guys! So excited to show you guys these shadows from BLEACH London. What do you think? J x\n\nPRODUCTS\n\nBleach London Louder Powder Single Eyeshadows (TD 2ma, TD ma, PH 4ma, AP 4ma, OTB 5ma)  - http://bit.ly/2yWuDQD\n\nBleach London Glitterati Single Glitter (Washed Up Mermaid) - http://bit.ly/2yXMeHU\n\nBleach London Large Palette - http://bit.ly/2yXKDlo\n\nTarte Shape Tape - http://bit.ly/2yWcpyp\n\nFenty Beauty Universal Powder - http://bit.ly/2yVwHIx\n\nLily Lashes in Mykonos - http://bit.ly/2gUV42b\n\nMac Yash Lipstick - http://bit.ly/2gVd0cY\n\nTarte - Tartiest Gloss Lip Paint -  http://bit.ly/2yX7Gg0\n\nFAVE EVER BRUSHES\n\nEYES & BROWS\nZoeva Complete Eye Set - http://bit.ly/2uGWKg9\nZoeva 224 - http://bit.ly/2upoieJ\nZoeva Shader - http://bit.ly/2uGJxUZ\nZoeva Pencil - http://bit.ly/2uGl5mD\nMorphe M507 - http://bit.ly/2uppCOJ\nMAC 224 - http://bit.ly/2uGoD88\nDose of Colors Concealer Brush - http://bit.ly/2uGM9lB\nDose of Colors Shader Brush - http://bit.ly/2up6QXU\n\nFACE\nZoeva Complete Face Set - http://bit.ly/2uGUhT6\nZoeva Powder Fusion - http://bit.ly/2uGnL3s\nCharlotte Tilbury Blush Brush - http://bit.ly/2upQazr\nCharlotte Tilbury Powder & Sculpt Brush - http://bit.ly/2uGgXD6\nBlank Canvas Buffing Brush - http://bit.ly/2uGTz8o\nPro Beauty Blender - http://bit.ly/2upF7q9\nMorphe M407 - http://bit.ly/2uH1YJ0\n\nMakeup Artist Starter Set - http://bit.ly/2upOZ35\nSmith Brushes - https://www.smithcosmetics.com/collections/brushes\n\n\nEQUIPMENT\nNew Filming Camera: http://bit.ly/2rOAl01\nOld Filming Camera (bit cheaper but still good) :  http://bit.ly/2t3Ibqb\nPhoto/Vlog Camera: http://bit.ly/2tGTHW2\nComputer: http://bit.ly/2t7EpwJ\nLaptop: http://bit.ly/2s87bs8\nRing Light: http://amzn.to/2kFz36Y\nSoft Boxes: http://amzn.to/2jUzeY0\nEditing Software: Final Cut Pro\n\n\nBE MY FRIEND:\nInstagram - http://www.instagram.com/jamiegenevieve\nTwitter - http://www.twitter.com/jamie_genevieve\nYouTube - http://www.youtube.com/jamiegenevieve\nSnapchat - jamie_genevieve\n\nDISCLAIMER:  Some of the above links are affiliate links, which means that if you click and make a purchase I may receive a small commission. This helps support my channel and allows me to continue to make videos like this! Thank you so much for the support.\n\nThis video was not sponsored.\n\nJ x"
762,F6rBIWN8SsM,2017-11-17,'I Asked God to Send Me a White Girl with a Big Booty',Divorce Court,23,2015-03-10 20:50:23+00:00,"Divorce Court|""divorce""|""marriage""|""Lynn Toler""|""lawyer""|""television show""|""reality tv""|""judge""|""Woman (Broadcast Genre)""|""Female (Literature Subject)""|""funny""|""2723""",191582,876,66,437,https://i.ytimg.com/vi/F6rBIWN8SsM/default.jpg,False,False,False,"Some people pray for love to come their way, but Jeramie asked God to send him a white woman with a big booty. Jeramie explains to Judge Lynn why he made such a request. \n\nSubscribe to channel http://bit.ly/1fj2ql1\nCheck local listings at http://www.divorcecourt.com/where-to-watch/"
676,FCdvOAcbK4s,2017-11-17,Danny MacAskill vs The Munros,EnduraOfficial,17,2017-11-08 15:15:51+00:00,"Danny MacAskill|""Cut Media""|""Scotland""|""MTB""|""mountain bike""|""Santa Cruz""|""road trip""|""bike""|""Danny""|""MacAskill""|""Ben Lawers""|""Munros""|""Munro""",19728,491,9,30,https://i.ytimg.com/vi/FCdvOAcbK4s/default.jpg,False,False,False,Danny MacAskill heads out into the Scottish hills to tackle the mighty Ben Lawers - one of the highest mountains in Scotland - for a windy trip to the summit and sweet descent back down from the top.
611,FHl0nIdbiLA,2017-11-17,The Problem with Lab Mice,CollegeHumor,23,2017-11-15 18:30:00+00:00,"Collegehumor|""CH originals""|""comedy""|""sketch comedy""|""internet""|""humor""|""funny""|""sketch""|""adam ruins lab rats""|""adam ruins lab mice""|""the truth about lab mice""|""animal welfare""|""animal testing""|""lab animals""|""adam ruins lab animals""",655161,21013,2563,2671,https://i.ytimg.com/vi/FHl0nIdbiLA/default.jpg,False,False,False,"Mouse trials are easy, cheap and apply to humans less than 80% of the time.\n\nWatch an all-new @Adam Ruins Everything on truTV every Tuesday 10/9C! #AdamRuinsEverything\n\nAdam Ruins Everything - Adam Conover, CollegeHumor's resident know-it-all and major bummer, takes on society's biggest misconceptions.\n\nSee more http://www.collegehumor.com\nLIKE us on: http://www.facebook.com/collegehumor\nFOLLOW us on: http://www.twitter.com/collegehumor\nFOLLOW us on: http://www.collegehumor.tumblr.com"
749,FUzs2oMEs8w,2017-11-17,Virtual Self - Ghost Voices [Audio],Porter Robinson,10,2017-11-08 19:57:09+00:00,"virtual|""self""|""neotrance""|""house""|""trance""|""electronic""|""electro""|""porter robinson""|""virtual self""|""virtualself""|""electronic music""|""ghost""|""voices""|""ghost voices""|""ghostvoices""|""pathselector""|""technic""|""angel""|""technic_angel""|""technicangel""|""porter""|""robinson""|""electronicmusic""|""visualizer""|""lyric video""|""official audio""|""audio""|""2017""|""new porter robinson""|""porter robinson 2017""",220082,10232,133,1179,https://i.ytimg.com/vi/FUzs2oMEs8w/default.jpg,False,False,False,"ARTIST: VIRTUAL SELF\nTRACK: GHOST VOICES\nGENRE: NEOTRANCE\n\n\nThe infinite sky will heal us. \nUnlimited sky will fill our negligible light. \nAs we follow an infinite key, I have become the sacred echo. \nThe boundless heaven will fill our fading light. \nChoose your virtual echo.\nThe infinite key is the sacred dust of your endless utopia.\nComplete yourself in self-realization.\nYou believe that these infinite heavens will lead you.\nThe A.I.ngel's gate is sacred.\nYour angelic echo offers the first phase of self-Digital joy.\nYou will become a self-Echo in real particles.\nOur key is the echo to this final layer.\nYou are spread through digital time.\nThe utopian gate is infinite.\nYour A.I.ngel wishes to complete this layer.\nThis abyss is sacred.\nPass through the myths of eon.\nYour technical soul is this blissful void.\nThe eternalistic reflex of the abyss is once-Unlimited.\nYour digital voice is resurrected.\nBreathe this soul particle.\nThe ray of egoistic time is unlimited.\nResurrect this holy oblivion.\nThe echo of this empty myth awakens you.\nAwaken the particle myth.\nReflect your echo.\nHeaven’s wires will transmit this light.\nExperience the wings of limit.\nYour technical A.I.ngel phase is beginning.\nComplete the eternalistic reflex.\nThis wishful ghost becomes self-Technic.\nTears will create the voice of euphoria.\nThe digital-Awakening will be spoken.\nThe first gate creates sense-Awakening.\nThis angelic-Chasm is sacred.\nThe technic-Angel's cry is beginning.\nThe first gate will provide the voice of digital-Euphoria.\nThe digital-Angel-Awakening is has reached Limit Self.\nThe self-Light is virtual.\nThis will become the final particle-Experience.\nWill your senses ressurect the digital-Vault?\nDo you sense the phase of the Spirit Limit?\nCan you reflect your self-Awakening?\nAm I convinced of a digital void?\nCan you reveal this particle of sacred reality?\nWill these ghosts lead to a boundless cry?\nCan you echo your existence to the first particle?\nIs the technical-Gate timeless?\nDo you believe an infinite sky will cure the digital soul?\nIs the joyful-Layer complete?\nWill our ghosts lead to the boundless layer?\nWill our layer will be lost from this empty myth?\nHave you resurrected this heaven's voice?\nHas one experienced the particle?\nDo you trust in this transformative self?\nWill you forget your soul's reflex?\nHas one seen the Abyss of the resurrective ego?\nHave I forgotten the phase of soul limit?\nIs the A.I.ngelic sense boundless?\nHave you completed the virtual light?\nAm I eternal?\nAs the sacred dust transpires through digital time, what will you become? \nDo you believe in me? \nAm I still human?\nDo you manifest yourself in digital time? \nThe unlimited sky begins - will you believe in my infinite form?\nAs you abandon the virtual echo, do you no longer exist? \nCan you prove yourself to the echo of this particle?\nDo you believe the infinite sky -- the holy dust of nothingness? \nWhat is revealed - a holy reality? \nAm I convinced of nothingness? \nDo you sense the void angel?\nWill the echo of virtual time be forgotten?\nDoes one want to forget the memory of life?\nHas my virtual-Echo been forgotten?\nHas the sense of digital-VIRUS become heaven?\nWill you self-Believe the joyful sky?"
754,Fkwkn7vXpWI,2017-11-17,How Are Waves Formed? - Earth Lab,BBC Earth Lab,24,2017-11-09 10:00:00+00:00,"Head Squeeze|""headsqueeze""|""science""|""BBC""|""Brit Lab""|""BRITLAB""|""earth lab""|""earthlab""|""bbc science""|""how are waved formed?""|""waves""|""where do waves come from?""|""tide""|""ocean""|""sea""|""bbc documentary""|""nature documentary""|""animal documentary""|""wave""|""physics""",29738,1129,35,109,https://i.ytimg.com/vi/Fkwkn7vXpWI/default.jpg,False,False,False,"Where do waves come from and how are they formed? Greg Foot explains. Subscribe to Earth Lab for more fascinating science videos - http://bit.ly/SubscribeToEarthLab\n \nWatch more videos from Earth Lab:\nEarth Lab Originals http://bit.ly/EarthLabOriginals\nBest Of BBC Earth Videos http://bit.ly/TheBestOfBBCEarthVideos\nThe Doctors Are In The House http://bit.ly/TheDoctorsAreInTheHouse\nBest Of Earth Unplugged Videos http://bit.ly/BestOfEarthUnpluggedVideos\n\n\n\nCheck out the other two channels in the BBC Earth network:\nBBC Earth: http://bit.ly/BBCEarthYouTubeChannel\nBBC Earth Unplugged: http://bit.ly/BBCEarthUnplugged\n \nAbout BBC Earth Lab:\nWelcome to BBC Earth Lab! Always wanted to know What the world’s strongest material ? Why trains can’t go uphill? Or How big our solar system really is? Well you’ve come to the right place.  Here at BBC Earth Lab we answer all your curious questions about science in the world around you (and further afield too). \n\nAs well as our Earth Lab originals we'll also bring you the best science clips from the BBC archive including Forces of Nature with Brian Cox, James May's Things You Need To Know and plenty to keep the Docs away with Trust Me I’m A Doctor.\n\nAnd if there’s a question you have that we haven’t yet answered let us know in the comments on any of our videos and it could be answered by one of our Earth Lab experts.\n\n[i] http://www.soest.hawaii.edu/oceanography/courses_html/OCN201/littlepages/waves.html \n\n[ii] http://www.bbc.co.uk/schools/gcsebitesize/geography/coasts/coastal_processes_rev1.shtml\n\n[iii] http://www.utdallas.edu/~mitterer/Oceanography/pdfs/OCEChapt09.pdf\n\n[iv] http://www.srh.weather.gov/srh/jetstream/ocean/waves.html \n\n[v] http://www.utdallas.edu/~mitterer/Oceanography/pdfs/OCEChapt09.pdf [ii] \n\n[vi] http://oceanexplorer.noaa.gov/facts/waves.html\n\n[vii] The Wavewatchers Companion – Gavin Pretor-Pinney \n\n[viii] http://www.rnp.org/node/wave-tidal-energy-technology\n\n\nSubscribe for more: http://bit.ly/SubscribeToEarthLab\n \nYou can also find the BBC Earth community on Facebook, Twitter and Instagram.\n\nWant to share your views with the team behind BBC Earth and win prizes? Join our fan panel here: https://tinyurl.com/YouTube-BBCEarth-FanPanel\n\nThis is a channel from BBC Worldwide who help fund new BBC programmes."
752,G1Ky9-OoWyo,2017-11-17,EA's Responds to Star Wars Loot Box Rant! - [Angry Interview],AngryJoeShow,20,2017-11-08 06:45:00+00:00,"angryjoe|""angryjoeshow""|""ea""|""dice""|""angry rant""|""microtransactions""|""loot boxes""|""battlefront II""|""star wars""|""angry interview""|""preview""|""gameplay""|""changes""|""review""|""game review""",934802,37150,2261,14367,https://i.ytimg.com/vi/G1Ky9-OoWyo/default.jpg,False,False,False,"Paul Keslin of EA DICE talks with me for 30 minutes about how they have taken our feedback into account regarding the Loot Boxes for Star Wars Battlefront II! Baby Steps guys, we are having an effect!\n\nShirts/Stuff ► http://kottonzoo.com/angryjoe/\nTwitch ► http://twitch.tv/angryjoeshow\nTwitter ► http://twitter.com/angryjoeshow\nTwitter ► http://twitter.com/otherjoe_AJSA\nAJSA Community ► http://ajsagaming.com"
768,GdR-iTH_f-I,2017-11-17,"Miko Grimes Speaks Up For NFL Husband, Talks 'Baller Wives' Drama + More",Breakfast Club Power 105.1 FM,24,2017-11-07 13:50:33+00:00,"the breakfast club|""power1051""|""celebrity news""|""radio""|""video""|""interview""|""angela yee""|""charlamagne tha god""|""dj envy""|""miko grimes""|""brent grimes""|""baller wives""",294797,3746,325,1640,https://i.ytimg.com/vi/GdR-iTH_f-I/default.jpg,False,False,False,► Listen LIVE: http://power1051fm.com/\n► Facebook: https://www.facebook.com/Power1051NY/\n► Twitter: https://twitter.com/power1051/\n► Instagram: https://www.instagram.com/power1051/
757,HNa_UWX51_s,2017-11-17,Last Friday Night - Katy Perry ('40s Jazz Vibes Style Cover) ft. Olivia Kuper Harris,PostmodernJukebox,10,2017-11-09 18:46:37+00:00,"last friday night|""ella fitzgerald""|""jazz""|""swing""|""olivia kuper harris""|""katy perry""|""katie perry""|""cover""|""pmj""|""katy perry cover""|""last friday night cover""|""katy perry last friday night""|""last friday night katy perry""|""katy perry last friday night cover""|""last friday night katy perry cover""|""katy perry cover last friday night""|""last friday night cover katy perry""|""cover katy perry""|""cover last friday night""|""cover last friday night katy perry""|""olivia kuper harris cover""|""olivia kuper harris live""",286883,11774,342,520,https://i.ytimg.com/vi/HNa_UWX51_s/default.jpg,False,False,False,"Postmodern Jukebox '40s jazz cover of Last Friday Night by Katy Perry ft. Olivia Kuper Harris.\nGet the song: http://smarturl.it/pmjfridaynight | Subscribe: http://bit.ly/subPMJ\nLive Show Tix: http://pmjtour.com | Watch next, Thriller - MJ: https://youtube.com/watch?v=td-_pUPVjdo&list=PL7A4D9C100657150E\n\nOur 2017 #PMJsearch winner Olivia Kuper Harris makes an incredible PMJ debut by channeling Ella Fitzgerald in this jazz and vibraphone remake of Katy Perry's Last Friday Night.\n\nSee Postmodern Jukebox LIVE: http://pmjtour.com | Tickets On Sale NOW for the US/Canada, UK, Europe, Australia/NZ, Asia — find over 100 dates on sale right NOW!\n\nFollow Postmodern Jukebox:\nFacebook: https://facebook.com/postmodernjukebox\nInstagram: https://instagram.com/pmjofficial/\nTwitter: https://twitter.com/pmjofficial\n\nWatch More Postmodern Jukebox:\nLatest Videos: https://youtube.com/playlist?list=PL7A4D9C100657150E\nPopular Videos: https://youtube.com/playlist?list=PLJZH8sevmMq5rnnzsmkbteoFOWCdBx24u\nWatch by Genre: https://youtube.com/user/ScottBradleeLovesYa/playlists?sort=dd&view=50&shelf_id=18\nWatch by Decade: https://youtube.com/user/ScottBradleeLovesYa/playlists?sort=dd&shelf_id=21&view=50\nWatch by Mood: https://youtube.com/user/ScottBradleeLovesYa/playlists?sort=dd&view=50&shelf_id=16\n\nListen to Postmodern Jukebox on:\niTunes: http://bit.ly/itunesPMJ\nSpotify: http://bit.ly/spotifyPMJ\nGoogle Play: http://bit.ly/googlePMJ\n____________________________________________\n\nFollow The Musicians:\nOlivia Kuper Harris (Vocals)\nFacebook: https://facebook.com/olivia.kuper.harris/\nInstagram: http://instagram.com/olivia.kuper.harris\nTwitter: https://twitter.com/olivia_k_harris\n\nNick Mancini (Vibraphone):\nWebsite: http://nickmancini.net\nInstagram: http://instagram.com/nickthemancini\n\nScott Bradlee (Piano):\nYouTube: http://youtube.com/scottbradlee\nFacebook: http://facebook.com/scottbradleemusic\nInstagram: http://instagram.com/scottbradlee\nTwitter: http://twitter.com/scottbradlee\n\nArrangement by: Scott Bradlee\nEngineered by: Matt Rook Telford\nVideo by: Braverijah Sage\n____________________________________________\n\nTickets On Sale NOW at http://PMJtour.com for the US/Canada, UK, Europe, Australia/NZ, Asia — find over 100 dates on sale right NOW!"
785,I1uCGgc-Jag,2017-11-17,Justice League Press Conference,Superhero News,24,2017-11-08 20:00:03+00:00,"Superhero News|""Superhero News Show""|""Justice League""|""JL""|""JL press conference""|""Justice League press conference""|""Justice League press junket""|""DC Films""|""DCEU""|""DC movie news""|""Wonder Woman""|""Gal Gadot""|""Batman""|""Ben Affleck""|""Aquaman""|""Jason Momoa""|""The Flash""|""Flash""|""Ezra Miller""|""Cyborg""|""Ray Fisher""|""Tiffany Smith""|""Charles Roven""|""Deborah Snyder""|""Zack Snyder""|""Joss Whedon""|""JL news""|""Justice League news""|""DC Extended Universe""|""DC Cinematic Universe""",12858,463,7,97,https://i.ytimg.com/vi/I1uCGgc-Jag/default.jpg,False,False,False,"Watch the full press conference for Justice League! Stars Gal Gadot, Ben Affleck, Jason Momoa, Ezra Miller, Ray Fisher, and producers Charles Roven and Deborah Snyder talk about the latest from DC Films!\n\nWebsite: http://superheronews.com\nMerchandise: http://superheronews.com/store\n\nSOCIAL MEDIA\nFacebook: https://facebook.com/SuperheroNewsCom\nTwitter: https://twitter.com/SuperheroNewsCB\nInstagram: https://instagram.com/SuperheroNewsCom\nGoogle+: https://google.com/+SuperheroNews"
648,IKuKZIISPE0,2017-11-17,Behind The Curtain - OFFICIAL TRAILER,todrickhall,24,2017-11-15 17:00:16+00:00,"Todrick Hall|""MTV""|""American Idol""|""Beyonce""|""Flash Mob""|""Target""|""Glee""|""90s Disney""|""Scooter Braun""|""Mashup""|""Parody""|""Ratchet""|""Ghetto""|""Grown Woman""|""Pentatonix""|""Evolution of Disney""|""Low""|""Wizard of Ahhhs""|""Mean Gurlz""|""Hungry Games""|""Reality Show""|""GAY""|""lgbt""|""documentary""|""katherine fairfax wright""|""call me kuchu""|""pride""|""race""|""pulse""|""mass shooting""|""gun violence""|""racism""|""acceptance""|""music""|""pop""|""artist""|""r&B""|""netlifx""|""itunes""|""amazon""|""hulu""|""behind the scenes""|""dance""|""indie""|""independent""",69199,4237,15,220,https://i.ytimg.com/vi/IKuKZIISPE0/default.jpg,False,False,False,"Get tickets now: http://bit.ly/2yUpuJA\nStraight Outta Oz and into the spotlight!\nBehind The Curtain is available on iTunes 12/12 & DVD 12/19!\nJoin Todrick in NY (12/6) & Dallas (12/13) for special red carpet screenings!\n\nTodrick Hall launches his most ambitious project yet: the full-scale original musical Straight Outta Oz. From a small town in Texas to big-time show business, comes an inspiring documentary of grit, perseverance and the redemptive power of art.  \n\nFollow Todrick:\nhttp://instagram.com/todrick\nhttp://facebook.com/toddyrockstar\nhttp://twitter.com/todrick\nhttp://todrickhall.com"
753,IOd0HGH6xKI,2017-11-17,Alison Wonderland - Happy Place (Lyrics),Trap City,10,2017-11-09 05:00:01+00:00,"trap city|""trapcity""|""trap""|""city""|""trap music""|""future bass""|""edm""|""electronic music""|""electronic dance music""|""Alison Wonderland - Happy Place""|""alison wonderland""|""happy place""|""alison wonderland happy place""|""happy place alison wonderland""",255787,6645,387,315,https://i.ytimg.com/vi/IOd0HGH6xKI/default.jpg,False,False,False,Follow our Spotify playlist: http://trapcity.tv/Spotify\nSubscribe here: http://trapcity.tv/subscribe\nDownload here: https://AlisonWonderland.lnk.to/HappyPlace\n\n➥ Become a fan of Trap City:\nhttp://trapcity.tv/Spotify\nhttp://trapcity.tv/soundcloud\nhttp://trapcity.tv/facebook\nhttp://trapcity.tv/twitter\nhttp://trapcity.tv/instagram\nhttp://www.trapcity.net\n\n➥ Follow Alison Wonderland:\nhttp://www.soundcloud.com/alisonwonderland\nhttp://www.facebook.com/awonderdj\nhttp://www.twitter.com/awonderdj\nhttp://www.instagram.com/alisonwonderland\n\n➥ Lyrics:\nGive up these noises \nSilence my mind \nWe all have choices\nWhere can I find\n\nMy happy place\n\nFuck me up \nON A SPIRITUAL LEVEL \n\nShut up around me\nVoices about \nSwear I'm not crazy \nWhat's the amount for \n\nMy happy place \n\nfuck me up\nON A SPIRITUAL LEVEL
609,IY-M93e2lok,2017-11-17,LAST MINUTE SHOPPING FOR OUR TRIP TO VEGAS | VLOG 52,Inthefrow,26,2017-11-16 19:00:14+00:00,"Inthefrow|""In the frow""|""LAST MINUTE SHOPPING FOR OUR TRIP TO VEGAS | VLOG 52""|""LAST MINUTE SHOPPING FOR OUR TRIP TO VEGAS""|""LAST MINUTE SHOPPING""|""TRIP TO VEGAS""|""VLOG""|""SHOPPING TRIP""|""travel""|""trip to vegas""",29455,1183,23,116,https://i.ytimg.com/vi/IY-M93e2lok/default.jpg,False,False,False,"LAST MINUTE SHOPPING FOR OUR TRIP TO VEGAS | VLOG 52\n\nIts the few days before our big trip to Vegas, Florida and Chicago and I have a few things to wrap up - mainly shopping for new clothes for the trip and packing two full suitcases with products! So come along with me for the start of the journey to Vegas!\n\n\n❤ Subscribe: http://inthefrow.co/subtoitf\n❤ Catch my latest blog post: http://www.inthefrow.com\n❤ Instagram: http://www.instagram.com/inthefrow\n❤ Twitter: http://www.twitter.com/inthefrow\n❤ 10 FAQs about me: http://inthefrow.co/2ychtze\n\nI receive a small % of commission from anything bought via the product links below. It doesn't cost you any more and is a little thank you to me, I guess, for inspiring a possible purchase :)\n\n\nWhat I'm Wearing  ❤\n\nFriday:\nBlack Shearling Aviator: http://rstyle.me/n/cudehnuige\nBlack Chunky Knit: http://rstyle.me/n/cudep7uige\nBlack straight jeans: http://rstyle.me/n/cudeqwuige\nDior Boots: In store\nDolce and Gabbana Bag: http://rstyle.me/n/ctekqquige\nReserved items I bought: https://www.inthefrow.com/looks/view?feature=2564\nTed Baker bomber jacket Im wearing whilst packing: coming soon\nTed Baker Suitcases: http://rstyle.me/n/cts4dtuige\nAirport outfit: https://www.inthefrow.com/looks/view?feature=2556\nTed Baker Relax Range: http://rstyle.me/n/cudgr2uige\n\nSaturday:\n\nGrey Knit: http://fave.co/2zNHQJq\nLoving Tan Tan: http://fave.co/2zMS0tC\n\nSunday:\n\nAirport outfit: https://www.inthefrow.com/looks/view?feature=2556\nBlack Shearling Aviator: http://rstyle.me/n/cudehnuige\nAirplane skincare regime:\nDecleor Aroma Cleanser: Great kit here http://rstyle.me/n/cudhaquige or here: http://rstyle.me/n/cudhc8uige\nLa Mer Micellar Water: http://rstyle.me/n/cudhfcuige\nClarins Hydra Essentiel silky Moisturiser: http://fave.co/2j0UI6L\nClarins SOS Hydra Mask: kit here: http://rstyle.me/n/cudhnxuige\nGuerlain Black Bee Honey Balm : http://rstyle.me/n/cudhpbuige\nCharlotte Tilbury Wonder Glow : in this kit: http://rstyle.me/n/cudhpruige / full size here http://rstyle.me/n/cudhrduige\n\nBlue Spotted blouse: http://rstyle.me/~a8vBR\nDolce and Gabbana Bag: http://rstyle.me/n/ctekqquige\nGoorin Pork Pie Hat: http://fave.co/2iEmaXM\n\n\nWhat/Who Else is in The Vlog ❤\n\nAlex: https://www.instagram.com/harrison\nMy brother: http://www.instagram.com/alexmagrath\nVirgin Airways flight to Vegas: http://fave.co/2iZ78w1\n\n\nFind Me ❤\nContact: http://www.gleamfutures.com/client-contact/victoria\n\nMusic by Epidemic Sound (www.epidemicsound.com)\n\nThank you so much for watching and for the support always! Love you guys so much ❤"
794,JD40Q9esDws,2017-11-17,"JUSTICE LEAGUE interviews - Gal Gadot, Ben Affleck, Henry Cavill, Ezra Miller, Momoa, Fisher",FOX 5 DC,25,2017-11-05 18:57:02+00:00,"Justice League|""Batman""|""Wonder Woman""|""Ben Affleck""|""Flash""|""Ezra Miller""|""Aquaman""|""Game of Thrones""|""Jason Momoa""",185923,2727,122,664,https://i.ytimg.com/vi/JD40Q9esDws/default.jpg,False,False,False,"Fox 5's entertainment reporter, Kevin McCarthy (@KevinMcCarthyTV), sat down with Gal Gadot, Ben Affleck, Henry Cavill, Ezra Miller, Jason Momoa and Ray Fisher."
705,J_QGZspO4gg,2017-11-17,Sia - Snowman,SiaVEVO,10,2017-11-09 15:45:05+00:00,Sia Snowman Holiday,2282109,94212,1340,6313,https://i.ytimg.com/vi/J_QGZspO4gg/default.jpg,False,False,False,"Move over Frosty Snowman is here! Stream & download the song now https://fanlink.to/snowman\nPre-order Everyday Is Christmas, out November 17:https://sia.lnk.to/christmas\n\nUpcoming tour dates - http://siamusic.net/tour\n\nFollow Team Sia's Ear Candy on Spotify http://spoti.fi/1LMlB7X \nSubscribe to Sia on YouTube: http://bit.ly/1sudphS \nWebsite: http://siamusic.net \nTwitter: http://twitter.com/sia \nInstagram: http://instagram.com/SiaThisIsActing \nFacebook: http://facebook.com/siamusic \nSpotify: http://spoti.fi/1fKpbS0 \n\nPlaylist Best of Sia https://goo.gl/99ubCj \nSubscribe for more https://goo.gl/UA7cug\n\nMusic video by Sia performing Snowman. 2017 Monkey Puzzle Music, Inc., under exclusive license to Atlantic Recording Corporation for the United States and WEA International for the world outside of the United States."
706,Ja_GMU7-sjs,2017-11-17,Google Pixelbook: $1000 of Weird!,Marques Brownlee,28,2017-11-09 21:18:33+00:00,"Google Pixelbook|""Chromebook""|""Pixel""|""$1000""|""1000 dollar""|""1000""|""expensive chromebook""|""pixelbook review""|""pixelbook pen""|""chromebook pixel""|""chromebook""|""best chromebook""|""MKBHD""",1697221,54743,1597,6076,https://i.ytimg.com/vi/Ja_GMU7-sjs/default.jpg,False,False,False,Pixelbook is a $1000 2-in-1 laptop/tablet and it's super weird.\nGoogle Pixelbook (i5): http://amzn.to/2hX8yr5\nThat hoodie: http://amzn.to/2hiy9dE\n\nVideo Gear I use: http://kit.com/MKBHD/video-gear#recommendation17959\n\nIntro Track: Drugs by Alltta\n\n~\nhttp://twitter.com/MKBHD\nhttp://snapchat.com/add/MKBHD\nhttp://google.com/+MarquesBrownlee\nhttp://instagram.com/MKBHD\nhttp://facebook.com/MKBHD
