id,video_id,trending_date,title,channel_title,category_id,publish_time,tags,views,likes,dislikes,comment_count,thumbnail_link,comments_disabled,ratings_disabled,video_error_or_removed,description
675,ijJPFowBsBc,2017-11-17,HUGE BEAUTY FAVOURITES! AUTUMN LOVES!,Estée Lalonde,22,2017-11-12 17:00:02+00:00,"essiebutton|""Estée Lalonde""|""Estee Lalonde""|""Essie Button""|""Essie""|""No Makeup Makeup""|""Drugstore Makeup Tutorial""|""Fashion""|""Cute Outfits""|""Makeup Tutorials""|""Healthy Foods""|""Eye Makeup""|""Outfit Ideas""|""Natural Makeup""|""Easy Healthy Recipes""|""Skin Care Products""|""Best Makeup""|""beauty""|""favourites""|""favorites""|""november""|""2017""|""haul""|""new in""|""glossier""|""you""|""perfume""|""review""|""ouai""|""messy hair""|""charlotte tilbury""|""skincare""|""lancome""|""highlighter""|""glow""|""scandinavian""|""rupi kaur""|""fashion""",141308,4455,169,327,https://i.ytimg.com/vi/ijJPFowBsBc/default.jpg,False,False,False,"Come to Cambodia with me! \nhttps://youtu.be/IVRVXYCrr14\n___________\n\nMY LINKS »\nSECOND CHANNEL → http://www.youtube.com/EverydayEstee\nWEBSITE → http://www.esteelalonde.com/\nTWITTER → http://twitter.com/EsteeLalonde\nINSTAGRAM → http://www.instagram.com/EsteeLalonde\nFACEBOOK → https://www.facebook.com/EsteeLalonde\nTUMBLR → http://esteelalonde.tumblr.com/\nPINTEREST → https://www.pinterest.com/esteelalonde\n\nSUBSCRIBE TO ASLAN→https://www.youtube.com/user/theworktop\nASLAN’S INSTAGRAM→https://www.instagram.com/li0nsmane/\n\n___________\n\nI have a brand new PODCAST! \n👉🏼 Radio Wolfgang: http://wolfga.ng/tattoOs\n👉🏼 iTunes: http://wolfga.ng/taTtoos\n👉🏼 Audioboom: http://wolfga.ng/tAttoos\n👉🏼 Stitcher: http://bit.ly/2fRfpl8\n👉🏼  Spotify: http://spoti.fi/2fypeYm\n👉🏼 My Blog: http://www.esteelalonde.com/podcast/\n\nSTAY UP TO DATE WITH US ON SOCIAL MEDIA! \n\nINSTAGRAM: https://www.instagram.com/theheartofi...\nTWITTER: https://twitter.com/THEHEARTOFITPOD\nFACEBOOK: https://www.facebook.com/theheartofit/\n\n___________\n\nTHINGS MENTIONED\n\nREGGIE MERCH SWEATER\nhttp://www.wildatheartfoundation.org/buy-our-2017-sweatshirts/reggie\n\nWatch the Reggie video here! \nhttps://youtu.be/YL7VTU6iWFY\n\nTHE HEART OF IT PODCAST \nhttp://www.esteelalonde.com/podcast/\n\nGLOSSIER YOU PERFUME \nhttp://bit.ly/2zKd8U7\n\nECCENTRIC MOLECULE PERFUME\nhttp://bit.ly/2zK6NIC\n\nOUAI MATTE POMADE\nhttp://bit.ly/2ymFmjz\n\nCHARLOTTE TILBURY PALETTE\nhttp://bit.ly/2hWS82g\n\nSURRATT LIPSLIQUES (LADYBUG, BANDY, NU DE SOLEIL)\nhttp://bit.ly/2zvOEex\n\nCLE DE PEAU CONCEALER\nhttp://bit.ly/2zvMUEg\n\n*SIMILAR TO NARS CONCEALER \nhttp://bit.ly/2jdX6ea\n\nBUXOM MASCARA \nhttp://bit.ly/2hXiFfN\n\nMILANI BLUSH \nhttp://bit.ly/2hhYHLZ\n\nCAUDALIE RADIANCE SERUM\nhttp://bit.ly/2zKDwxu\n\nLANCOME CLICK & GLOW \nhttp://bit.ly/2zrmPXb\n\nFRESH INSTANT GLOW LUMINIZER\nhttp://bit.ly/2zKh1sh\n\nSCHMIDT’S DEODORANT \nhttp://bit.ly/2zs9KwA\n\nDRESS SCANDINAVIAN\nhttp://bit.ly/2zoH47X\n\nTHE SUN AND HER FLOWERS - RUPI\nhttp://bit.ly/2zt7NQO\n\nMILK AND HONEY- RUPI\nhttp://bit.ly/2zKfOB9\n\nDARLING MAGAZINE\nhttp://darlingmagazine.org/\n\nRED SCARF\n(SIMILAR) http://bit.ly/2zI2opm\n\n___________\n\nWHAT I'M WEARING\n\nWhite Top\nhttp://bit.ly/2zKdiLj\n\nGold Necklace #1\nhttp://bit.ly/2zJyr8i\n\nGold Necklace #2\nhttp://bit.ly/2zq3cia\n\nGold Bracelet \nhttp://bit.ly/2zHYa0Y\n\nLipstick \nhttp://bit.ly/2zvOEex\n\nBronzer\nhttp://bit.ly/2AoUZYs"
607,ixxR3ZoqnF0,2017-11-17,BTS (방탄소년단) 'MIC Drop (Steve Aoki Remix)' Official Teaser,ibighit,10,2017-11-16 15:00:05+00:00,"BIGHIT|""빅히트""|""방탄소년단""|""BTS""|""BANGTAN""|""방탄""",3483755,789753,2840,72376,https://i.ytimg.com/vi/ixxR3ZoqnF0/default.jpg,False,False,False,"BTS (방탄소년단) 'MIC Drop (Steve Aoki Remix)' Official Teaser\n\n\n'MIC Drop (Steve Aoki Remix)' MV will be released on November 24, 2017. \n\n\n\n\nConnect with BTS:\nhttp://www.ibighit.com \nhttp://twitter.com/BTS_bighit \nhttp://twitter.com/BTS_twt \nhttps://www.facebook.com/ibighit/\nhttp://www.facebook.com/bangtan.official\nhttp://instagram.com/BTS.bighitofficial\nhttp://weibo.com/BTSbighit"
616,jG1JY0rt2Os,2017-11-17,Fall Out Boy - HOLD ME TIGHT OR DON’T,FallOutBoyVEVO,10,2017-11-15 05:00:02+00:00,"Fall Out Boy|""Hold Me Tight Or Don’t""|""Hold Me Tight""|""MANIA""|""FOB""|""Patrick Stump""|""Pete Wentz""|""Joe Trohman""|""Andy Hurley""|""Fall""|""Out""|""Boy""|""HOLD""|""ME""|""TIGHT""|""OR""|""DON’T""|""Island""|""Records""|""Alternative""",1884763,135815,3303,12752,https://i.ytimg.com/vi/jG1JY0rt2Os/default.jpg,False,False,False,"New single HOLD ME TIGHT OR DON'T out now - download/stream the song: https://falloutboy.lnk.to/holdmetight\n\nM A  N   I    A out on January 19th - preorder the album now: https://falloutboy.lnk.to/mania\n\nUpcoming tour dates: https://falloutboy.com/tour \n\nDirected by Brendan Walter and Mel Soria \n\nBest of Fall Out Boy: https://goo.gl/NQaRzd\nSubscribe here: https://goo.gl/rQoGSD\n\nhttp://falloutboy.com\nhttp://facebook.com/falloutboy\nhttp://twitter.com/falloutboy\nhttp://youtube.com/falloutboy\nhttp://instagram.com/falloutboy\nhttp://spoti.fi/T3yFgI\n\nLYRICS\n\nI never really feel a thing I’m just kinda too froze\nYou were the only one that even kinda came close\nI just pinch myself, no longer comatose\nI woke up no luck, I woke up no luck\nAnd when your stich comes loose\nI want to sleep on every piece of fuzz and stuffing that comes out of you\nI took too many hits off this memory\nI need to come down.\nAnother day goes by so hold me tight\nor don’t.\nOh no this isn’t how our story ends, so hold me tight, or don’t\nI got too high again when I realized I cant not be with you\nOr be just your friend\nI love you to death but I just cant pretend we were lovers first\nConfidants but never friends\nwere we ever friends?\nCause im past the limits\nThe distance between us, it sharpens me like a knife\n\nMusic video by Fall Out Boy performing HOLD ME TIGHT OR DON’T. (C) 2017 Island Records, a division of UMG Recordings, Inc.\n\nhttp://vevo.ly/sy8EAS"
659,jGiqc3HSxEg,2017-11-17,A Study of So Bad It's Good Movies,Now You See It,27,2017-11-13 15:30:01+00:00,"the room|""so bad its good""|""movies that are so bad they're good""|""worst movies""|""The Room""|""sharknado""|""the disaster artist""|""the disaster artist the room""|""the princess bride""|""so bad its good movies""|""best so bad its good movies""|""video essay""|""now you see it""",244538,12392,236,598,https://i.ytimg.com/vi/jGiqc3HSxEg/default.jpg,False,False,False,"Why do we love movies that are so bad, they're good? Let's explore what these movies have in common and see that many critically acclaimed movies actually contain the phenomenon that makes So Bad, It's Good movies so appealing.\n\nTwitter: http://bit.ly/1QvLI0H\nPatreon: http://bit.ly/1UaO9MU"
703,jp9hK-jY6yY,2017-11-17,When Someone Has A Crush on You | Lilly Singh,IISuperwomanII,23,2017-11-09 22:21:13+00:00,"iisuperwomanii|""iisuperwomenii""|""superwoman""|""superwomen""|""super""|""comedy""|""comedian""|""brown""|""indian""|""desi""|""punjabi""|""hindi""|""when someone has a crush on you""|""crush""|""crush on you""|""when a crush""|""crush you""|""on you""|""someone on""|""when someone""|""llsuperwomanll""|""lilly singh""|""lily singh""|""lily sing""|""lilly sing""|""IIsuperwomanII""|""someone has""|""you crush""|""when you""|""lilly""|""singh""|""when someone likes you""|""when someone has a crush""|""that feeling when""|""someone likes you""|""someone has a crush on you""|""lilly singh crush""",3745303,219274,3601,20647,https://i.ytimg.com/vi/jp9hK-jY6yY/default.jpg,False,False,False,"You know that feeling when someone has a crush on you!! Watch Lilly Singh break down the three phases of finding out someone likes her.\nSubscribe: http://bit.ly/1HiqYG0 | Follow my FB: https://facebook.com/IISuperwomanII/\nSkits: https://youtube.com/watch?v=jyxi0rfEDnE&list=PLuBXqtS2jaLMhu9PU0tAaHbnqloWibwl0\n\nIf you want to add translations, click the gear icon and go to Subtitles/CC then to Add subtitles or CC! \n\nFollow Roscoe (my boyfriend):\nInstagram: https://instagram.com/chickenanwaffles\n\nFollow IIManjeetII:\nInstagram: https://instagram.com/iiparamjeetii/\nTwitter: https://twitter.com/iiparamjeetii/\n\nFollow IIParamjeetII: \nInstagram: https://instagram.com/iimanjeetii/\nTwitter: https://twitter.com/iimanjeetii/\n\nGet HOW TO BE A BAWSE: https://lillysinghbook.com\n\nFollow IISuperwomanII:\nFacebook: https://facebook.com/IISuperwomanII/\nInstagram: https://instagram.com/iisuperwomanii/\nTwitter: https://twitter.com/iisuperwomanii\nSuperwomanVlog Channel: https://youtube.com/user/SuperwomanVlogs\nOfficial Website: http://lillysingh.com/\n\nWatch More IISuperwomanII:\nTypes Of People: https://youtube.com/watch?v=eR_nzGqYXNw&list=PLuBXqtS2jaLMu81JnF6AOnRHzG6Csbd6y\nMy Parents: https://youtube.com/watch?v=EPHMXbZml_s&list=PLuBXqtS2jaLOGQynSYvxaqUgvNl7Ovz8x\nSkits: https://youtube.com/watch?v=jyxi0rfEDnE&list=PLuBXqtS2jaLMhu9PU0tAaHbnqloWibwl0\nThe Super Rants: https://youtube.com/watch?v=KYadw8gNOok&list=PLuBXqtS2jaLPopv899QwFphiirmD_XWdq\nLatest Uploads: https://youtube.com/user/IISuperwomanII/videos?view=0&sort=dd&shelf_id=2\n\nThanks for watching and don't forget to keep smiling. You're worth it! xoxo"
624,k1cA-Wh3Tc0,2017-11-17,Peephole Reverser? | 9 Pointless Tech Gadgets!,Matthias,28,2017-11-15 00:00:03+00:00,"tech|""gadgets""|""new""|""2017""|""pointless tech gadgets""|""apple""|""smart product""|""cool gadgets""|""new gadget""|""weird things online""|""tech under""|""tech invention""|""technology""|""unbox""|""unboxing""|""on amazon""|""reacting to""|""family friendly""|""inventions""|""gadgets from""|""things on amazon""|""shopping gadget""|""latest tech""|""weird tech""|""gag gift""|""gift idea""|""kids""|""gift""|""mathias""|""matthias""|""matthiasiam""|""hi5 studios""|""#M757""",736829,18708,794,6460,https://i.ytimg.com/vi/k1cA-Wh3Tc0/default.jpg,False,False,False,"Today I test out some weird gadgets and tech items that could be completely pointless, or actually useful to me! Join me as I unbox these unique gadgets, and find out if these products are as useful as they claim to be! \n\nSubscribe Now! ➡ https://www.youtube.com/user/matthiasiam?sub_confirmation=1\n\nBuy your favorite products, it helps out the channel!\n\n0:31 - Binary Clock - http://amzn.to/2xu6rDH\n2:12 - Mobile EKG System - http://amzn.to/2yw6uxe \n4:14 - Light-Up Equalizer Tie - http://amzn.to/2fFLxIc\n5:34 - UV Flashlight - http://amzn.to/2yMUUhm\n8:09 - Titanium Glow Fob - http://amzn.to/2ywcJ3V\n9:27 - Million Mile Light - http://amzn.to/2ynAkqN\n11:44 - Waterproof Keyboard - http://amzn.to/2yvBwFe\n13:40 - BattleBots Arena - http://amzn.to/2jQWb3t\n18:00 - Peephole Reverser - http://amzn.to/2yw7wt6\n\nWant your product to possibly be featured in an upcoming episode? Send your product to:\n\nMatthias “Submissions 24307 Magic Mountain Pkwy Box #617\nValencia, CA 91355\n\n⬇️ FOLLOW ME! ⬇️\n\nSNAPCHAT ➡ @MATTHIASIAM\n\nTWITTER ➡ http://bit.ly/MatthiasTwitter\n\nINSTAGRAM ➡ http://bit.ly/MatthiasInsta\n\n⬇️CHECK OUT MY OTHER SERIES⬇️\n\nTech Gadgets! ➡ https://www.youtube.com/playlist?list=PL15dtrx_ng4RZH3aop96cWRW7CZU-uqDe\n\neBay Products! ➡ https://www.youtube.com/watch?v=hTypEDOjACw&list=PL15dtrx_ng4QdiYSImFRcgPCGjz0BwMAM\n\nDOPE or NOPE! ➡ https://www.youtube.com/playlist?list=PL15dtrx_ng4QiBZll2i6v1zab_4gAGdGH\n\nStrange Chinese Products! ➡ https://www.youtube.com/playlist?list=PL15dtrx_ng4TjAqiZC57Rbt6po770koAR\n\nStrange Walmart Items ➡ https://www.youtube.com/watch?v=heIeCsyzUNc&list=PL15dtrx_ng4Sf6qE3iVX3NAj240-MY3MC\n\nStrange Amazon Products! ➡ https://www.youtube.com/playlist?list=PL15dtrx_ng4Re8uHiuotJvXd_eGCfezoy\n\nStrange Dollar Store Items ➡ https://www.youtube.com/playlist?list=PL15dtrx_ng4Tqcw2GVq08SZw7LBh_qcWX\n\n⬇️OTHER HI5 STUDIOS CHANNELS⬇️\n\nBattle Universe ➡ https://www.youtube.com/channel/UCGGlk1zXSXEeb_gP2ciY7Hg\n\nGet Good Gaming ➡ https://www.youtube.com/channel/UCJLFizUO3gCQnyiYKMYvUgg\n\nTeam Edge Gaming ➡ https://www.youtube.com/channel/UC-6Ygz2yrPcPPhl4pAobqNQ\n\nREKT ➡  https://www.youtube.com/channel/UCETEqk3eDILFcu8p6YncjQw\n\nNew videos every Tuesday, Thursday, and Saturday! Subscribe so you don't miss them!"
618,kgaO45SyaO4,2017-11-17,The New SpotMini,BostonDynamics,28,2017-11-13 20:09:58+00:00,"Robots|""Boston Dynamics""|""SpotMini""|""Legged Locomotion""|""Dynamic robot""",6802437,83512,3909,17281,https://i.ytimg.com/vi/kgaO45SyaO4/default.jpg,False,False,False,For more information . . . stay tuned.
683,ktQH78FNCfs,2017-11-17,"Mindy Kaling, Apu & Indian Americans by Hari Kondabolu",Hari Kondabolu,24,2015-11-09 21:30:07+00:00,"Apu Nahasapeemapetilon (TV Character)|""Mindy Kaling (TV Writer)""|""Hari Kondabolu""|""Apu""|""Simpsons""|""Racism""|""Comedy""|""Indian American (Ethnicity)""",70986,729,133,109,https://i.ytimg.com/vi/ktQH78FNCfs/default.jpg,False,False,False,"Hari Kondabolu discusses the Mindy Project, Apu and the history of Indian American identity in 2012."
614,l3xmc0pzzJI,2017-11-17,I Tried Period Yoga Pants,Safiya Nygaard,22,2017-11-15 23:46:57+00:00,"i tried period yoga pants|""period yoga pants""|""period""|""menstruation""|""period clothes""|""period leggings""|""period products""|""tampons""|""pads""|""girl""|""feminine care""|""girls""|""yoga pants""|""activewear""|""safiya nygaard""|""safiya period""|""safiya""|""safiya period videos""|""what the period""",1276326,70960,811,4293,https://i.ytimg.com/vi/l3xmc0pzzJI/default.jpg,False,False,False,"I found another strange period product and had to try it out! These are period yoga pants or period workout pants from a company called Dear Kate... After my disappointment with the period leggings, I was excited to try another period pant, and these had their ups and downs! Would you try these on your period?\n\nThis video is NOT sponsored!\n\nSafiya's Nextbeat: https://nextbeat.co/u/safiya\nIG: https://www.instagram.com/safiyany/\nTwitter: https://twitter.com/safiyajn\nFacebook: https://www.facebook.com/safnygaard/\n\nI found my leggings here: https://www.dearkates.com/collections/activewear/\n\nAssistant Editors: Emily Linden & Claire Wiley\n\nMUSIC\nMind The Gap\nvia Audio Network\n\nSFX\nvia AudioBlocks"
778,l9nGCJlDclQ,2017-11-17,After Show: Did Kate Hudson Date Brad Pitt? | WWHL,Watch What Happens Live with Andy Cohen,24,2017-11-08 17:00:01+00:00,"What What Happens live|""reality""|""interview""|""fun""|""celebrity""|""Andy Cohen""|""talk""|""show""|""program""|""Bravo""|""Watch What Happens Live""|""WWHL""|""bravo andy""|""Watch""|""What""|""Happens""|""After Show""|""During the After Show""|""Andy Cohen asks actress""|""Kate Hudson""|""Kate Hudson wwhl""|""Kate Hudson and Brad Pitt""|""Brad Pitt dating Kate Hudson""|""wwhl after show""|""watch what happens live after show""|""Kate Hudson watch what happens live""|""Colin Hanks""|""Pretty Fun Kate Hudson""|""Almost famous""|""kate hudson almost famous""",55244,189,191,83,https://i.ytimg.com/vi/l9nGCJlDclQ/default.jpg,False,False,False,"During the After Show, Andy Cohen asks actress Kate Hudson if the rumor is true that she once dated Brad Pitt and Kate gives a definitive answer.\n►► Subscribe To WWHL: http://bravo.ly/WWHLSub\n\nWatch WWHL Sun-Thu 11/10c:\nWWHL Website: http://www.bravotv.com/watch-what-happens-live\nFollow WWHL: https://twitter.com/BravoWWHL\nLike WWHL: https://www.facebook.com/WatchWhatHappensLive\nWWHL Tumblr: http://bravowwhl.tumblr.com/\n\n'Watch What Happens: Live' is Bravo's late-night, interactive talk show that features guests from the world of entertainment, politics, and pop culture. Hosted by Andy Cohen, the series includes lively debates on everything from fashion, the latest on everyone's favorite Bravolebrities, and what celebrity is making headlines that week. Past guests who have joined Cohen in the Bravo Clubhouse include Sarah Jessica Parker, Tina Fey, Khloe Kardashian, Jennifer Lopez, Liam Neeson, Kelly Ripa, Jimmy Fallon, Anderson Cooper, Jennifer Lawrence, and Lance Bass.\n\nWatch More Bravo:\nBravo Website: http://www.bravotv.com/\nBravo Youtube: http://www.youtube.com/videobybravo\nFollow Bravo: http://www.twitter.com/bravotv\nLike Bravo: https://www.facebook.com/BRAVO\nPin Bravo: http://www.pinterest.com/bravobybravo\nBravo Instagram: http://www.instagram.com/bravotv\nBravo Tumblr: http://bravotv.tumblr.com/\n\nAfter Show: Did Kate Hudson Date Brad Pitt? | WWHL"
603,lJFqvRwOiis,2017-11-17,Walking while black,Vox,25,2017-11-16 12:55:39+00:00,"vox.com|""vox""|""explain""|""race""|""poverty""|""tickets""|""investigation""|""propublica""|""pedestrian""|""infrastructure""|""walking""|""walking while black""|""profiling""|""racial profiling""|""policing""|""police""|""jacksonville""|""florida""|""duval county""|""citation""|""law enforcement""|""urban planning""|""topher sanders""|""ben conarck""|""jaywalking""|""devonte shipman""|""JSO""|""florida times-union""|""African American""|""city planning""|""pedestrian deaths""|""pedestrian safety""|""Jacksonville Sheriff's Office""|""data""|""violations""",505886,23207,5376,7030,https://i.ytimg.com/vi/lJFqvRwOiis/default.jpg,False,False,False,"Jacksonville’s enforcement of pedestrian violations raises concerns about another example of racial profiling: http://propub.li/2hCCBaE \n \nAfter watching a viral video of a Jacksonville cop stopping a young black man for jaywalking, reporters Ben Conarck and Topher Sanders examine how “walking while black” can come at a high price. In this second piece of the Vox + ProPublica collaboration, they dig into how police citations for pedestrian violations often fall along the lines of race and poverty, and introduce us to some of the people fighting these tickets.\n\nCheck out the full ProPublica/Florida Times-Union piece at http://propub.li/2hCCBaE for their in-depth reporting, and stay tuned for more stories in this collaboration! If you'd like to sign up to receive more ProPublica journalism, go here: http://propub.li/2hwf4V9\n\nAnd watch Devonte Shipman’s full video here: https://www.facebook.com/devonte.shipman/videos/1599286606749155/ \n.\n.\n.\nSubscribe to our channel! http://goo.gl/0bsAjO\n\nVox.com is a news website that helps you cut through the noise and understand what's really driving the events in the headlines. Check out http://www.vox.com to get up to speed on everything from Kurdistan to the Kim Kardashian app. \n\nCheck out our full video catalog: http://goo.gl/IZONyE\nFollow Vox on Twitter: http://goo.gl/XFrZ5H\nOr on Facebook: http://goo.gl/U2g06o"
698,lo5ERI5nPbM,2017-11-17,Sharon Needles - Andy Warhol Is Dead [Official],Sharon Needles,10,2017-11-10 18:52:40+00:00,"Sharon Needles|""Andy Warhol Is Dead""|""Battle Axe""|""sharon""|""needles""|""andy""|""warhol""|""is""|""dead""|""battle""|""axe""|""drag""",101168,5287,360,491,https://i.ytimg.com/vi/lo5ERI5nPbM/default.jpg,False,False,False,A Geek Mythology Production \n\nDirector Ben Simkins \nProducer Katelyn Simkins \nEdited by Katelyn and Ben Simkins\nStarring Sharon Needles\nDP Luke Askelson\nKey Grip Melanie Watson\nPA Michael Glod \nWigs Chad O'Connell\nExecutive Producer David Charpentier\n\nProducer Entertainment Group\n\nGet the single on iTunes:\nhttp://itunes.apple.com/album/id1309139954?ls=1&app=itunes\n\nGet the full album Battle Axe on iTunes:\nhttp://itunes.apple.com/album/id1288713669?ls=1&app=itunes
639,mJt1O3q0zKc,2017-11-17,Who's the toughest player at Chelsea? | Eden Hazard | Teammates 2.0,Soccer AM,17,2017-11-14 12:00:05+00:00,"Soccer AM|""Football""|""Soccer""|""Premier League""|""Sky Sports""|""SoccerAM""|""teammates""|""soccer am teammates""|""sky teammates""|""highlights""|""Chelsea Teammates""|""Chelsea Tubes""|""Tubes meets""|""Sky sports teammates""|""Soccer AM Teammates""|""Soccer AM Tubes""|""David Luiz""|""cesar azpilicueta""|""John Terry Chelsea""|""Frank Lampard Chelsea""|""N'Golo Kante""|""Willian""|""Pedro""|""Cesc Fabregas""|""Gary Cahill""|""Victor Moses""|""Stamford Bridge""|""Chelsea goals""|""Chelsea Highlights""|""Sky live stream""|""sky sports live""|""EPL Sky Sports""",219211,6111,109,479,https://i.ytimg.com/vi/mJt1O3q0zKc/default.jpg,False,False,False,SUBSCRIBE ► http://bit.ly/SoccerAMSub\nTubes met with Eden Hazard to find out all the info on his Chelsea teammates. Who's the funniest? Who is looking to get into management? And who's the hardest player?\n\n►FACEBOOK: http://www.facebook.com/SoccerAM\n►SNAPCHAT:  'SoccerAM'\n►INSTAGRAM: http://www.instagram.com/SoccerAM\n►TWITTER: https://www.twitter.com/SoccerAM
630,mZpGOQ7tBKE,2017-11-17,Google Pixel Buds review,The Verge,28,2017-11-16 13:00:03+00:00,"pixel buds|""google pixel buds""|""google pixel buds review""|""wireless earbuds""|""review""|""google assistant""|""airpods""|""translate""|""translation""|""the verge""|""verge""|""sean o'kane""|""google""",218153,5155,308,655,https://i.ytimg.com/vi/mZpGOQ7tBKE/default.jpg,False,False,False,"Google's Pixel Buds get a few of the basics right when it comes to wireless earbuds. Language translation via the Google Translate app is helpful in a pinch, and the Google Assistant experience is genuinely fast and fun. But these $159 earbuds are fussy, from the way that they fit in your ears to the way that they fit in the case. And not everyone will love the open design, which lets lots of outside noise in. The Pixel Buds are Google's first attempt at making wireless earbuds, and it shows.\n\nSubscribe: http://goo.gl/G5RXGs\n\nCheck out our full video catalog: http://goo.gl/lfcGfq\nVisit our playlists: http://goo.gl/94XbKx\nLike The Verge on Facebook: http://goo.gl/2P1aGc\nFollow on Instagram: http://goo.gl/7ZeLvX\nRead More: http://www.theverge.com"
644,mjBIsBPG1N8,2017-11-17,Every Snack I'm Packing for the Victoria's Secret Fashion Show | Karlie Kloss,Klossy,22,2017-11-16 15:23:10+00:00,"victoria secret fashion show|""vs fashion show""|""vsfs""|""victoria's secret""|""vs""|""karlie kloss""|""klossy""|""karlie""|""kloss""|""shanghai""|""shanghai china""|""china""|""moon juice""|""brad kale chip""|""nutritionist""|""dietitian""|""healthy snacks""|""healthy on the road""|""what's in my bag""",76491,3850,95,217,https://i.ytimg.com/vi/mjBIsBPG1N8/default.jpg,False,False,False,"This video isn't sponsored. These are all the foods I genuine love, recommend, and plan to eat while in Shanghai for the Victoria's Secret Fashion show.\n\nMolly, my nutritionist and dietitian is the best at explaining the science behind the nutrition in these snacks. Enjoy! \n\nInstant Oatmeal w Flax: https://thrivemarket.com/natures-path-organic-oatmeal-flax-plus\n\nTopbits: http://www.topbitfoods.com/\n\nJustin's Almond Butter: https://thrivemarket.com/justins-maple-almond-butter-squeeze-packs\n\nArtisana Walnut and Cashew Butter: https://thrivemarket.com/artisana-almond-butter-squeeze-packs\n\nDetox Tea: https://thrivemarket.com/catalogsearch/result/?q=detox+tea\n\nSmooth Move Tea: https://thrivemarket.com/traditional-medicinals-organic-smooth-move-tea\n\nGG's Crackers: https://www.amazon.com/GG-Scandinavian-Crispbread-3-5-Ounce-Packages/dp/B003G1ZRTY/ref=sr_1_1_a_it?ie=UTF8&qid=1510780320&sr=8-1&keywords=fiber+rich+crackers\n\nHu Kitchen Dark Chocolate: https://thrivemarket.com/hu-salty-chocolate-bar\n\nRX Bars: https://www.rxbar.com/\n\nSuper Greens Powder: https://jet.com/product/Amazing-Grass-Greens-and-Adaptogens-Powder-Beauty-Elixir-10-Ct/3f4e1bf3b35343beaa52c73c0447967b\n\nLife's Abundance Vegan Protein: \n\neBoost: https://thrivemarket.com/eboost-pink-lemonade-energy-powder\n\nMary's Gone Crackers: https://thrivemarket.com/marys-gone-crackers-organic-super-seed-crackers\n\nBrad's Kale Chips: https://jet.com/product/Brads-Raw-Chips-Kale-3-Ounce/d6a2063fb0b446a98a24ae84c02d2dd1\n\nMolly's Energy Bites: https://www.mollys-best.com/blog/protein-packed-energy-bites\n\nI ❤♡♥ your notes ⇊\n\nSuper Klossy\nP.O. Box 20191\nNew York, NY 10014\n\nsubscribe to Klossy ▻▻ https://www.youtube.com/c/karliekloss...\n\nfollow me :) \n\n➢➢\ninstagram | https://instagram.com/karliekloss\ntwitter | https://twitter.com/karliekloss\nfacebook | https://www.facebook.com/karliekloss\n➢➢\n\na movie by Karlie Kloss\nproduced and edit by Annalora von Pentz"
681,moLKl5PzZLc,2017-11-17,Benton Fenton is missing - Hitler finds out! Jesus Christ!,Mark Brown,22,2011-11-24 11:04:30+00:00,"Fenton|""benton""|""Jesus""|""Christ""",236781,1076,26,161,https://i.ytimg.com/vi/moLKl5PzZLc/default.jpg,False,False,False,Hitler finds out Fenton Benton is missing!
