id,video_id,trending_date,title,channel_title,category_id,publish_time,tags,views,likes,dislikes,comment_count,thumbnail_link,comments_disabled,ratings_disabled,video_error_or_removed,description
606,0O2IAz1E9Ts,2017-11-17,Miranda Sings Hijacks a Stranger's Tinder | Vanity Fair,Vanity Fair,24,2017-11-16 17:00:54+00:00,"miranda sings|""tinder""|""tinder takeover""|""miranda sings tinder""|""hijacks dating account""|""hijacks tinder account""|""dating profile""|""hijacks tinder""|""miranda sings funny""|""miranda sings 2017""|""colleen miranda sings""|""miranda sings challenge""|""miranda sings songs""|""mirandasings08""|""miranda""|""sings""|""tinder account""|""tinder takeover miranda sings""|""miranda sings vanity fair""|""vanity fair""|""vanity fair magazine""|""vf""",334497,12594,622,588,https://i.ytimg.com/vi/0O2IAz1E9Ts/default.jpg,False,False,False,"On the latest episode of Tinder Takeover, Miranda Sings takes over a staffer's Tinder account. Season 2 of Miranda's own scripted, original comedy “Haters, Back Off! is out on Netflix.\n\n\nStill haven’t subscribed to Vanity Fair on YouTube? ►► http://bit.ly/2z6Ya9M\n\nABOUT VANITY FAIR\nArts and entertainment, business and media, politics, and world affairs—Vanity Fair’s features and exclusive videos capture the people, places, and ideas that define modern culture. \n\nMiranda Sings Hijacks a Stranger's Tinder | Vanity Fair"
783,0Yp9WS6cJFA,2017-11-17,This Week I Learned Downhill Mountain Biking,Mike Boyd,24,2017-11-06 14:43:29+00:00,"mike boyd|""downhill""|""biking""|""mountain biking""|""mtb""|""enduro""|""bike""|""ben cathro""|""this week""|""i learned""|""race""",366991,14967,197,1675,https://i.ytimg.com/vi/0Yp9WS6cJFA/default.jpg,False,False,False,"The first 500 people to use this link will get 2 free months of Skillshare Premium: https://skl.sh/mikeboyd2\n\nCheck out Ben Cathro's behind the scenes video, or book a coaching session with him: https://www.youtube.com/watch?v=NLCfRHdi6Ig\nhttp://sickskills.co.uk/\n\nIn this episode of TWIL I learned to ride a downhill bike faster. I set my milestone at taking 10 seconds of my time.\n\nSubscribe for more Learn Quick Videos: http://bit.ly/2bR4nIH\n\nThe bike shop and track we visited, Comrie Croft:\nhttp://www.comriecroftbikes.co.uk/\n\nBio:\nMy name is Mike Boyd and I make videos documenting my process of learning stuff as quickly as I can. Subscribe for more upcoming videos and feel free to tell me what you'd like me to learn next in the comments or on Twitter (@mikeboydvideo).\n\nTwitter: https://twitter.com/mikeboydvideo\nInstagram: @mikeboydvideo\n\nBusiness enquiries:\nmikeboydvideo@gmail.com\n\n_____________________\n\nIf you enjoy this content and felt I've earned it, please consider pledging a little via Patreon to support the channel:\nhttps://www.patreon.com/mikeboyd\n\nA huge thanks to those who already support me on Patreon:\n\nRegan Xu\nLuke Lowrey\nHughTube \nChase Arviso\nCraig Jones\nChris Morrison\nRyan Daume\nEloise \nDamien Potts\nJohn Lewis\nAndre Pascal Seepel\nKeith Saffold\nTatenda Chiriseri\nAnton Lobashev\nJonathan Biggs\nPhilip Leichtfried\nSimon Andersson\nMitchell Denison\nStephen Porter\nMatthew Bafford\nDavi \nJosiah Gaskin\nEdward Platero\nJim Scott\nJamie merrill\nSam Reeder\nTim Vermeulen\nShane Gibson\nbryan pelzer\nHeavyJeffD \nMike Todasco\nAdam Mencarini\nGlenn Kaehne\nDaniel Samuels\nQplayer \nVic Jang\nMichael Cascio\nSean Gravener\nJoe Munro\nSean Baeyens\nTim Suellentrop\nVincent Barbate\nEsben Martinsen\nDan Abel\nFlorentin Le Moal\nMegan Hartley\nMichael Buchberger\nNilesy \nPatrick G Marini\nEllen Morgan\nBrian McEntire\nScott Cartier\nKyle Hefley\nJonah Reid\nMike DeLo\nMike Ledermueller\nAstroillogica \nMagnus Warvik\nAndy McBlane\nRylan Taylor\nBen Reitz\nDennis Swearer\nSam Morrison\nStephen Parsons\nJesse Wagner\nLuke Held\nRedKB \nJulian Panula\nNerdSync Productions\nScott McCracken\nIvan Espinoza\nRob Hughes\nGreg Malkin\nLeander Leirissa\nAchim Schumacher\nRyan English\nRoss Paton\nMarko Klopets\nLaura Selenke\nSneaky Beaky\nSam van den Wijngaard\nTed Stevko\nThomas Soria\nAlex Boguszewski\nNormal Universe\nJonathan Lindo\nLuke Mildenhall-Ward\nLuke Wale\nAndrew Leader\nSean Bassi\nWilliam Townsend\nStefano Vaccari\nJosh Davis\nPhilip Hartmann\nJim Bowery\nJonathan Lister\nZach Dunlap\nJeff Bloke\nAndy"
645,0gwkMY-mzUQ,2017-11-17,Demi Lovato & Luis Fonsi - Echame La Culpa (Teaser),Demi Lovato,24,2017-11-15 20:11:41+00:00,"Luis Fonsi|""Demi Lovato""|""Echame La Culpa""",531746,32749,642,1731,https://i.ytimg.com/vi/0gwkMY-mzUQ/default.jpg,False,False,False,Echame La Culpa drops November 17th!
747,1KVBFtSuCm0,2017-11-17,WiPrint: 3D Printing Your Wireless Coverage,Justin Chan,24,2015-07-17 15:27:32+00:00,"Wireless (Industry)|""3D Printing (Invention)""",586091,423,59,47,https://i.ytimg.com/vi/1KVBFtSuCm0/default.jpg,False,False,False,We wrote two papers on this:\nhttp://www.cs.dartmouth.edu/~xia/papers/buildsys17-3dprint.pdf (BuildSys '17) \nhttp://homes.cs.washington.edu/~jucha/docs/3dprint-hotw.pdf (HotWireless '15) - Hot Paper Award\n\nProject Website: \nhttp://dartnets.cs.dartmouth.edu/wiprint\n\nCollaborators:\nXi Xiong: http://www.cs.dartmouth.edu/~xi/\nEthan Yu: https://www.linkedin.com/in/ethanyu94\nNisha Kumari: https://www.linkedin.com/in/nishakumaricontact\nArdalan Amiri Sani: http://www.ics.uci.edu/~ardalan/\nChangxi Zheng: http://www.cs.columbia.edu/~cxz/\nXia Zhou: http://www.cs.dartmouth.edu/~xia/\nZiyuan Liu (actor): https://www.linkedin.com/in/ziyuanliu/\n\nFor more info about my future projects check out:\nhttp://homes.cs.washington.edu/~jucha/
738,1cgK-BIrXes,2017-11-17,#VeteransDay: Thank You for Everything,YouTube Spotlight,24,2017-11-10 15:07:13+00:00,"vets|""veterans day""|""veterans""|""youtube""|""veteransday""|""veterans day 2017""",862318,27208,2068,5276,https://i.ytimg.com/vi/1cgK-BIrXes/default.jpg,False,False,False,"This #VeteransDay, we want to say thank you to those who’ve served their country and shared their stories with the world.\n\nToday and every day, we at YouTube salute everything you have done and continue to do -- for your families, for communities, and for our nation."
779,28_tNFnMrTk,2017-11-17,Last Week I Got Burgled,DarkSquidge,22,2017-11-06 16:03:17+00:00,"tomska|""vlog""|""last week""|""darksquidge""|""thomas ridgewell""|""halloween""|""trick or treat""|""baby""|""thomas the tank engine""|""fat controller""|""squidge""|""truth bombs""|""pug""|""money""|""shave""|""beard""|""scarfdemon""|""stranger things""",84045,5843,30,931,https://i.ytimg.com/vi/28_tNFnMrTk/default.jpg,False,False,False,I don't want to be on Trending.\nLast Last Week (https://youtu.be/srYOQ0_j90o)\nGonna be releasing the backlog of sketches in its own video stop yelling at me!!! (http://Reddit.com/r/TomSka)\n\nMain Channel (http://youtube.com/tomska)\nTwitter (http://twitter.com/thetomska)\nFacebook (http://fb.com/thetomska)\nTumblr (http://thetomska.tumblr.com)\n\nEdited by Elliot Gough (http://youtube.com/elliotexplicit)\nMusic by Todd 'LilDeuceDeuce' Bryanton (http://youtube.com/lildeucedeuce)
686,2Vv-BfVoq4g,2017-11-17,Ed Sheeran - Perfect (Official Music Video),Ed Sheeran,10,2017-11-09 11:04:14+00:00,"edsheeran|""ed sheeran""|""acoustic""|""live""|""cover""|""official""|""remix""|""official video""|""lyrics""|""session""",48461709,1858753,26142,92121,https://i.ytimg.com/vi/2Vv-BfVoq4g/default.jpg,False,False,False,"🎧: https://ad.gt/yt-perfect\n💰: https://atlanti.cr/yt-album\nSubscribe to Ed's channel: http://bit.ly/SubscribeToEdSheeran\n\nFollow Ed on...\nFacebook: http://www.facebook.com/EdSheeranMusic\nTwitter: http://twitter.com/edsheeran\nInstagram: http://instagram.com/teddysphotos\nOfficial Website: http://edsheeran.com\n\nDirector | dp Jason Koenig\nProducer: Honna Kimmerer\nStarring: Ed Sheeran & Zoey Deutch \nDirector of Photography: Johnny Valencia\nProduction Company: Anonymous Content\nExec Producer: Nina Soriano\nProduction Manager: Doug Hoff\nCommissioner: Dan Curwin\nProduction Designer: John Lavin\nLead Casting: Amy Hubbard \n \nWritten by: Jason Koenig, Ed Sheeran, Jenny Koenig, Andrew Kolvet, Murray Cummings\n\nEdited by: Jason Koenig & Johnny Valencia\nVFX: Ian Hubert\nGraphic design by Chris Ballasciotes\n\nCast: Bo Valencia, Dennis Ranalta, Arthur Pauli\n \nSki Cinematography: Corey Koniniec\nSpecialty Camera op: Ryan Haug\n1st AC: Ryan Brown\n \n1st Assistant Director: Ole Zapatka\nArt Director: Klaus Hartl\nSnow fx: Lucien Stephenson\n\nGaffer: Thomas Berz\nStylist: Claudia Lajda\nHair & Makeup: Christel Thoresen\nAustrian Casting: Ursula Kiplinger\n \nAdditional VFX: Zoic\n\nSpecial Thanks to: The Hintertux Glacier, Austria;\nHohenhaus Tenne, and Hotel Neuhintertux"
679,2Zvmi5BzDbs,2017-11-17,Tour Documentary - Episode 3,Camila Cabello,10,2017-11-14 00:00:36+00:00,"tour doc|""bruno mars""|""24k magic tour""|""world tour""|""havana""|""havana video""|""camila cabello""|""camila""|""documentary""|""tour documentary""|""youtube""",113786,20376,51,995,https://i.ytimg.com/vi/2Zvmi5BzDbs/default.jpg,False,False,False,Here's the last episode of my Tour Doc from the 24K Magic World Tour with Bruno Mars! Big thanks to Youtube for helping me share a behind-the-scenes look at life on tour.\n\nFind Camila Here: \nTwitter: @camila_cabello\nIG: @camila_cabello \nFacebook: @97camilacabello \nWebsite: www.camilacabello.com\n\nHavana Available at:\nSpotify: http://smarturl.it/Havana_Sptfy\nApple Music: http://smarturl.it/Havana_AM\niTunes: http://smarturl.it/Havana_iT\nGoogle Play: http://smarturl.it/Havana_GP
741,3DflRo_Vids,2017-11-17,"CÉLINE DION FT. STEVE AOKI - MY HEART WILL GO ON (OMNIA Nightclub) | Nov. 7, 2017",The Céline Café,24,2017-11-08 12:37:08+00:00,"celine dion|""celine""|""dion""|""celine dion las vegas""|""celine dion live""|""celine dion concert""|""the celine cafe""|""celine cafe""|""my heart will go on""|""celine dion music video""|""Celine dion november 7 2017""|""steve aoki""|""steve aoki my heart will go on""|""celine dion caesars palace""|""celine dion omnia""|""celine dion omnia nightclub""|""omnia nightclub""|""celine dion my heart will go on steve aoki""|""celine dion rare""|""celine dion exclusive""|""my heart will go on remix""|""celine dion las vegas victims fund""",401951,507,112,135,https://i.ytimg.com/vi/3DflRo_Vids/default.jpg,False,False,False,"Céline Dion made a surprise performance at OMNIA Nightclub at Caesars Palace in Las Vegas after her show on November 7, 2017. Over $1 million was donated to the Las Vegas Victims' Fund\n\nVisit http://www.thecelinecafe.com for up-to-date news, full concert downloads, photos, show tickets, and more exclusive Céline content!\n\nStream Céline on Spotify: https://play.spotify.com/artist/4S9EykWXhStSc15wEx8QFK?play=true&utm_source=open.spotify.com&utm_medium=open\n\nCéline Dion on Apple Music: https://itunes.apple.com/us/artist/c%C3%A9line-dion/id63729"
682,3GtSorFUQhc,2017-11-17,"FULL. ASEAN Summit 2017. Opening ceremony.  November 13, 2017. Philippines, Manila.",CHANNEL90seconds newscom,22,2017-11-13 05:30:51+00:00,"31th ASEAN Summit 50|""31th ASEAN Summit 50 Manila Philippines""|""ASEAN""|""Trump attends opening ceremony of ASEAN summit in Manila""|""President Rodrigo Duterte speech in ASEAN 50 Summit 2017.""|""ASEAN Summit 2017 live""",63124,312,28,73,https://i.ytimg.com/vi/3GtSorFUQhc/default.jpg,False,False,False,"Watch: 31th ASEAN Summit 50 , Manila, Philippines .Opening ceremony. Group Photo. November 13 2017.\n\n\n31th ASEAN Summit, Manila, Philippines . Opening ceremony. Group Photo. November 13  2017.  President Trump Participates in the opening ceremony of the 31st ASEAN Summit. Cultural Center of the Philippines, Manila. November 13, 2017. President Trump visits Philippines. President Trump in Philippines. President Rodrigo Duterte  speech in ASEAN 50 Summit 2017. Canadian Prime Minister Justin Trudeau, Russia Prime Minister Dmitry Medvedev, U.S. President Donald Trump. President Trump visits Philippines. President Trump in Philippines. President Trump in Philippines.  President Trump Arrives in Manila, Philippines. November 12, 2017. 31st ASEAN Summit Philippines. President Trump in Manila. ￼President Trump ASEAN in Philippines. November 12, 2017.  31st ASEAN November 13, 2017. President Trump Attend aOpening ceremony in Manila Philippines.President Trump Attend ASEAN.  Manila, Philippines. 31th ASEAN Summit, Manila, Philippines.   Manila, Philippines. Trump to Meet Duterte as Ties Recover From Obama Dust-Up. 31th ASEAN Summit, Manila, Philippines.  President Rodrigo Duterte  Canadian Prime Minister Justin Trudeau, Russia Prime Minister Dmitry Medvedev, U.S. President Donald Trump.  President Donald Trump, Premier Li Keqiang of China, Japanese Prime Minister Shinzo Abe, President Moon Jae-in of South Korea, President Ram Nath Kovind of India, Sultan Hassanal Bolkiah of Brunei and President Halimah Yacob of Singapore. Prime Minister Najib Razak; Singapore President Tony Tan Keng Yam; Thai Prime Minister Prayut Chan-o-cha; Vietnam President Tran Dai Quang; and Indonesian President Joko Widodo.  Prime Minister of New Zealand Jacinda Kate Laurell Ardern. Trump attends opening ceremony of ASEAN summit in Manila. Duterte, at ASEAN opening. 11/13/14. President Trump Participates in the opening ceremony of the 31st ASEAN Summit.  Cultural Center of the Philippines, Manila, Philippines. 31th ASEAN Summit 50  Manila Philippines. Trump attends opening ceremony of ASEAN summit in Manila. 31 الرابطة 50 القمة عام 2017.31 ASEAN 50 hội nghị thượng Đỉnh 2017. 31 ASEAN 50 Κορυφής 2017.31 ASEAN-50-Topmødet 2017. 31 ASEAN 50 הפסגה 2017. 31 ASEAN 50 cruinniú Mullaigh 2017.31 de la ASEAN 50 Cumbre de 2017. 31 ASEAN 50 Vertice 2017. 31东盟50首脑会议2017年。 31 아세안 정상 회담 50 2017. 31 ASEAN-50 Gipfel 2017. 31. ASEAN 50 Toppmøtet i 2017. 31 آسه آن 50 نشست 2017.31 ASEAN 50 Cimeira de 2017. 2017 31 50 ASEAN Zirvesi. 31 ASEAN 50 Huippukokouksessa 2017. 31 ASEAN 50 Huippukokouksessa 2017. 31 आसियान 50 शिखर सम्मेलन 2017. 31-og samit ASEAN 50 2017. 31 ASEAN 50 Summitu 2017. 31 ASEAN 50 Toppmötet 2017. 31日ASEAN50サミットは2017年度までとする。 วันที่ 31@item:inlistbox last day of the month ASEAN 50 การประชุม 2017 น Ika-31 ng ASEAN 50 Summit 2017. Delays, confusion in world leaders' arrivals in PH for ASEAN Summit. ASEAN Summit 2017 live"
776,3iXwXYflCSI,2017-11-17,If only every weekend could be like this | EmilyHart,Emily Hart,23,2017-11-09 09:15:40+00:00,"emilyhart|""emily hartridge""|""vlog""|""family""|""sisters""|""10 reasons why""|""comedy""|""babies""|""funny""|""love""|""happiness""|""british""|""presenter""",11340,844,16,197,https://i.ytimg.com/vi/3iXwXYflCSI/default.jpg,False,False,False,"I had SUCH a lovely weekend and I wish EVERY weekend could be like this......I hope you all enjoyed watching it :) I ABSOLUTELY LOVE making vlogs so much, they make me so happy to make and they create such lovely memories for myself and for everyone else in my life!\n\nI know alot of you like me talking about boobs and other genital parts BUT I have grown up so my channel naturally grows up with me. That is NOT to say I won't still make 'adult content' videos because I still do enjoy that, just not every week ;)\n\nTo follow me (NOT in real life):\n\nPatreon: https://www.patreon.com/emilyhartridge\nInstagram: https://www.instagram.com/emilyhartridge/\nWebsite: http://www.emilyhartridge.com/\nTwitter: https://twitter.com/emilyhartridge\nFacebook: https://www.facebook.com/10ReasonsWhy\n\nAll music is from Epidemic Sound: http://bit.ly/2beTOhU\n\nIf you need Royalty free music for your videos I canNOT recommend Epidemic Sound more highly!!! \n\nI hope you all have a great week :) Thanks for your continual support\n\nEm xxx"
666,3s1rvMFUweQ,2017-11-17,Taylor Swift: …Ready for It? (Live) - SNL,Saturday Night Live,24,2017-11-12 06:24:44+00:00,"SNL|""Saturday Night Live""|""SNL Season 43""|""Episode 1730""|""Tiffany Haddish""|""Taylor Swift""|""Taylor Swift Ready for It""|""s43""|""s43e5""|""episode 5""|""live""|""new york""|""comedy""|""sketch""|""funny""|""hilarious""|""late night""|""host""|""music""|""guest""|""laugh""|""impersonation""|""actor""|""improv""|""musician""|""comedian""|""actress""|""If Loving You Is Wrong""|""Oprah Winfrey""|""OWN""|""Girls Trip""|""The Carmichael Show""|""Keanu""|""Reputation""|""Look What You Made Me Do""|""ready for it?""",1776127,35741,3214,3585,https://i.ytimg.com/vi/3s1rvMFUweQ/default.jpg,False,False,False,Musical guest Taylor Swift performs …Ready for It? on Saturday Night Live.\n\n#SNL #SNL43\n\nGet more SNL: http://www.nbc.com/saturday-night-live\nFull Episodes: http://www.nbc.com/saturday-night-liv...\n\nLike SNL: https://www.facebook.com/snl\nFollow SNL: https://twitter.com/nbcsnl\nSNL Tumblr: http://nbcsnl.tumblr.com/\nSNL Instagram: http://instagram.com/nbcsnl \nSNL Pinterest: http://www.pinterest.com/nbcsnl/
721,44NYFvhXmW8,2017-11-17,Thirty Seconds To Mars - Walk On Water (Official Music Video),ThirtySecondsToMarsVEVO,10,2017-11-08 13:00:00+00:00,"Thirty|""Seconds""|""To""|""Mars""|""Walk""|""On""|""Water""|""to""|""Mars/Interscope""|""Records""|""Alternative""|""Thirty Seconds To Mars""|""Thirty Seconds to Mars Ellen""|""30 seconds to mars ellen""|""mars ellen""|""ellen""|""Walk On Water""|""Thirty Seconds to Mars""|""30 seconds to mars walk on water""|""thirty seconds to mars walk on water""|""mars""|""mars walk on water""|""walk on water vid""|""30 sec to mars""|""30 secs to mars walk on water""|""walk on water video""|""official video""|""vid""",2625728,77249,3042,4932,https://i.ytimg.com/vi/44NYFvhXmW8/default.jpg,False,False,False,"Best of Thirty Seconds To Mars: https://goo.gl/c3H8id\nSubscribe here: https://goo.gl/QaW2fA\n\n\nVirtually everything you are about to see happened on a single day in the United States of America, July 4th, 2017. \n \nOver 10,000 generous and creative people submitted footage - in addition to our 92 professional crews. We filmed in all fifty states, Puerto Rico and D.C. and captured a portrait of this country that is absolutely beautiful, challenging and unforgettable. \n\nA very small selection of that footage you see here. The rest will be part of the documentary film, A DAY IN THE LIFE OF AMERICA (directed by Jared Leto), that is a companion piece to our brand new album. \n\nThe album. The film. The tour. \n\nComing #soon. \n\nThirty Seconds To Mars.\n\nMusic video by Thirty Seconds To Mars performing Walk On Water. (C) 2017 Thirty Seconds to Mars under exclusive license to Interscope Records\n\nhttp://vevo.ly/cGu2fJ"
740,4FDpjKdlIxA,2017-11-17,Waking Up with Sam Harris #103 - American Fantasies (with Kurt Andersen),Sam Harris,28,2017-11-09 23:05:42+00:00,[none],63777,923,239,1045,https://i.ytimg.com/vi/4FDpjKdlIxA/default.jpg,False,False,False,"In this episode of the Waking Up podcast, Sam Harris speaks with Kurt Andersen about the American aptitude for unfounded belief, the religious lunacy of the Puritans, populist mistrust of authority, the link between postmodernism and religious fundamentalism, the unique history of American religious entrepreneurship, the Trump phenomenon, the effect of fame on politics, and other topics.\n\nKurt Andersen is the bestselling author of the novels Heyday, Turn of the Century, and True Believers. He contributes to Vanity Fair and The New York Times, and is host and co-creator of Studio 360, the Peabody Award–winning public radio show and podcast. He also writes for television, film, and the stage. Andersen co-founded Spy magazine, served as editor in chief of New York, and was a cultural columnist and critic for Time and The New Yorker. He graduated magna cum laude from Harvard College, where he was an editor of The Harvard Lampoon. His most recent book is Fantasyland: How America Went Haywire, A 500-Year History.\n\nTwitter: @KBAndersen\n\nDiscuss this in the forums.\n\nWant to support the Waking Up podcast? \n\nPlease visit: http://www.samharris.org/support\n\nSubscribe to the podcast: http://www.youtube.com/subscription_center?add_user=samharrisorg\n\nGet Sam’s email newsletter: https://www.samharris.org/email_signup\n\nFollow Sam on Twitter: https://twitter.com/samharrisorg\n\nFollow Sam on Facebook: https://www.facebook.com/Sam-Harris-22457171014/?fref=ts\n\nFor more information about Sam Harris: https://www.samharris.org"
791,4GFAZBKZVJY,2017-11-17,Post Malone - rockstar ft. 21 Savage (Official Audio),Republic Records,10,2017-11-03 12:07:57+00:00,"Post Malone|""Post Malone rockstar""|""rockstar""|""21 Savage""|""Stoney""|""Beerbongs & Bentleys""|""Beerbongs""|""Bentleys""|""Austin post""|""rockstar post malone""|""post malone rockstar ft 21 savage""|""post malone - rockstar""|""21 savage post malone""|""post malone 21 savage""|""post malone ft 21 savage""|""Beerbongs and Bentleys""",35463645,316384,12902,0,https://i.ytimg.com/vi/4GFAZBKZVJY/default.jpg,True,False,False,The #1 hit-single by Post Malone. rockstar featuring 21 Savage. Listen everywhere: https://PostMalone.lnk.to/rsYD\n\nFollow Post Malone:\nhttp://www.postmalone.com\nhttps://twitter.com/postmalone\nhttps://instagram.com/postmalone\nhttps://facebook.com/postmalone\nhttps://youtube.com/PostMaloneVEVO
663,4SANXNco_y4,2017-11-17,Dashboard Confessional: We Fight (Official Audio),Fueled By Ramen,10,2017-11-15 17:05:36+00:00,"Dashboard Confessional|""Dashboard""|""Chris Carrabba""|""Chris Caraba""|""Chris Carraba""|""Dashboard Music""|""Dashbaord Band""|""New Dashboard Confessional Song""|""New Song""|""new single""|""We Fight""|""Crooked Shadows""|""We Fight Song""|""We fight our way in""|""we fight our way out""|""Fueled By Ramen""|""FBR""|""DC""|""New FBR signing""|""fueled by""|""dashboard signs with FBR""|""New Dashboard Record""|""New Dashboard Confessional""|""New Dashboard Album""|""New Dashboard Confessional Album""|""New dashboard track""|""emo""|""alternative""|""rock""",82048,3539,144,347,https://i.ytimg.com/vi/4SANXNco_y4/default.jpg,False,False,False,"Dashboard Confessional's official audio for their single 'We Fight' from their upcoming album Crooked Shadows - available February 9, 2018 via Fueled By Ramen. http://smarturl.it/WeFight\n\nStream/Download 'We Fight' now on:\n\nSpotify: http://smarturl.it/WeFight_sp\nApple Music: http://smarturl.it/WeFight_am\nAmazon: http://smarturl.it/WeFight_az\niTunes: http://smarturl.it/WeFight_it\nGoogle Play: http://smarturl.it/WeFight_gp\n\nConnect with Dashboard Confessional on:\nFacebook: http://www.facebook.com/dashboardconfessional\nTwitter: https://twitter.com/dashboardmusic\nInstagram: https://www.instagram.com/dashboardconfessional\nYouTube: https://www.youtube.com/dashboardconfessional \n\nLYRICS\n\nWe were the kids\nThat left home\nProlly too young\n \nBut we took our share\nAnd maybe then some\n \nTired of beatings\nAnd battles\nAnd being sewn up\n \nBut that made us grow up\nAnd that made em scared\n \nCause\nWe never learned to keep our voices down\nNo\nWe only learned to shout\nSo\nWe fight our way in\nAnd\nWe fight our way out\n \nAnd\nWe earned what we could\nFrom the ground up\nAnd tried to lift the whole damn crowd\nUp\nSo we fight our way in\nAnd\nWe fight our way out\n \nAnd there's still a kid\nSomewhere\nThat needs to hear this\n \nThat somebody cares\nThat somebody knows\n \nWho's\ntired of bleeding\nAnd battered\nAnd being torn up\n \nJust pick yourself up\nIt's time to go\n \nCause\nWe never learned to keep our voices down\nNo\nWe only learned to shout\nSo\nWe fight our way in\nAnd\nWe fight our way out\n \nAnd\nWe earned what we could\nFrom the ground up\nAnd tried to lift the whole damn crowd\nUp\nWe fight our way in\nAnd\nWe fight our way out\n \nMaybe we found a way to make some tracks.\nWe didn't snicker and turn our backs.\nWe just keep digging in and giving back.\n \nCause\nWe never learned to keep our voices down\nNo\nWe only learned to shout\nSo\nWe fight our way in\nAnd\nWe fight our way out\n \nAnd\nWe earned what we could\nFrom the ground up\nAnd tried to lift the whole damn crowd\nUp\nWe fought our way in\nAnd\nWe fight our way out\n \nCause\nWe never learned to keep our voices down\nNo\nWe only learned to shout\nSo\nWe fight our way in\nAnd\nWe fight our way out\n \nWe fight our way in\nWe fight our way in\n \nWe fight our way out\nWe fight our way out"
771,4j-ED6tL85o,2017-11-17,Chromeo - Juice (Official Video),Chromeo,10,2017-11-07 18:57:13+00:00,"chromeo|""chromeo juice""|""juice""|""head over heels""|""chromeo head over heels""|""chromeo new single""|""chromeo new song""|""chromeo new album""|""chromeo the juice""|""you got the juice""|""you've got the juice""|""chromeo juice official video""|""chromeo music video""|""juice music video""|""pressin ya""|""chromeo new music""|""chromeo you got the juice""|""chromeo you've got the juice""|""chromeo juice video""|""chromeo juice official""|""chromeo single""|""chromeo 2017 single""|""chromeo juice song""|""funklordz""",217869,6711,156,615,https://i.ytimg.com/vi/4j-ED6tL85o/default.jpg,False,False,False,Chromeo – Juice – Available Now!\nListen Here: https://Chromeo.lnk.to/JuiceID   \n \nDirected by David Wilson www.instagram.com/hidavidwilson\nProduction Company: The Directors Bureau\n \nFollow Chromeo\nhttps://facebook.com/chromeo\nhttps://instagram.com/chromeo\nhttps://twitter.com/Chromeo\nhttps://soundcloud.com/chromeo\nFunklordz Radio: https://Chromeo.lnk.to/FunklordzRadioAY
