id,video_id,trending_date,category_id,publish_time,views,likes,dislikes,comment_count,Author,Title,Artist,publish_date
8250,pNpsjMnO7mU,2017-12-25,17.0,23:42:53,38941.0,359.0,767.0,500.0,Speak For Yourself with Cowherd and Whitlock,Jason Whitlock weighs in on LaVar Ball's idea of starting a basketball league | SPEAK FOR YOURSELF,,2017-12-20
8325,pWqef6cbwzI,2017-12-25,22.0,23:05:56,3147048.0,312538.0,1892.0,65148.0,TheAngryGrandpaShow,ANGRY GRANDPA TRIBUTE VIDEO,,2017-12-12
8303,prmQgSpV3fA,2017-12-25,10.0,16:15:22,1984007.0,73042.0,740.0,12267.0,,#FREESTYLE087,BLACK THOUGHT FREESTYLES ON FLEX,2017-12-14
8347,qJKgfOUUrZo,2017-12-25,10.0,02:13:51,1091377.0,28584.0,25581.0,6134.0,,rockstar Latin remix,Post Malone Feat. Nicky Jam & Ozuna,2017-12-14
8298,r9C7Grxk4bU,2017-12-25,25.0,06:08:33,180757.0,11544.0,4020.0,5613.0,The Amazing Lucas,Star Wars Last Jedi review rant!! WORST FILM OF 2017,,2017-12-16
8382,rTKaXaPIfG8,2017-12-25,22.0,21:23:34,4724525.0,184989.0,25670.0,154928.0,Jake Paul,"Dear YouTube, We Lost A Family Member... (RIP MacKenzie)",,2017-12-09
8375,rtQXLmkeOgo,2017-12-25,27.0,20:53:05,97973.0,197.0,17.0,73.0,revoxy,BBC TV Swap Shop Opening Titles & Clips,,2007-12-03
8337,sJWu8sMMh0U,2017-12-25,10.0,19:58:29,1143350.0,29454.0,596.0,945.0,,Side Effects [Music Video],Ty Dolla $ign,2017-12-12
8361,sVfTvLm-7Ac,2017-12-25,17.0,16:33:57,22919.0,32.0,0.0,1.0,MK Dons,HIGHLIGHTS: MK Dons U18s 1-0 Cardiff City U18s,,2017-12-13
8223,szaJ5aW-LUs,2017-12-25,10.0,16:34:30,1244968.0,121754.0,1074.0,15778.0,,Feels Like Christmas,Panic! At The Disco,2017-12-20
8233,t6Bi_0q_17Y,2017-12-25,10.0,15:00:08,640115.0,138032.0,447.0,8178.0,,LAY 레이 'Goodbye Christmas (聖誕又至)' MV,SMTOWN,2017-12-22
8207,tLOl3s0uIM4,2017-12-25,10.0,05:00:03,3934624.0,169339.0,6887.0,7686.0,,"Bonita (Remix) ft. Nicky Jam, Wisin, Yandel, Ozuna","J Balvin, Jowell & Randy",2017-12-22
8264,tNoMQSvNAWE,2017-12-25,1.0,20:03:28,223527.0,15188.0,3912.0,8837.0,The Dishonoured Wolf,The Last Jedi: The Worst Star Wars Movie Ever Made,,2017-12-18
8356,tT-lTxhW7pY,2017-12-25,25.0,04:37:41,208233.0,626.0,4800.0,0.0,NBC News,Roy Moore Delivers Concession Speech From Alabama (Full) | NBC News,,2017-12-13
8391,tpF7R7ou4OY,2017-12-25,24.0,02:43:01,106330.0,3267.0,152.0,462.0,Browntable,How THOR: RAGNAROK Broke All Expectations,,2017-12-11
8309,u_OO9taOvG8,2017-12-25,10.0,05:00:02,445810.0,6313.0,177.0,963.0,,Main Title and Escape (From Star Wars: The Last Jedi/Audio Only),John Williams,2017-12-15
8378,wJ7ffCNtCKE,2017-12-25,10.0,09:00:02,137180.0,11418.0,97.0,641.0,,기우는 밤(The Night),[MV] 소유(SOYOU),2017-12-13
8319,wVy6mbSbbiA,2017-12-25,24.0,01:07:44,34954.0,2050.0,101.0,1142.0,Jody's Corner,Star Wars: The Last Jedi Epic Spoiler Rant!,,2017-12-16
8385,wujdQNW6B5c,2017-12-25,24.0,19:08:57,185798.0,7978.0,156.0,932.0,The Real Daytime,Adrienne’s Full Performance of 'The Gift',,2017-12-11
8293,wzKL-bQKcgA,2017-12-25,23.0,18:30:08,29121677.0,1074390.0,32540.0,51728.0,Lele Pons,Anitta & J Balvin - Downtown (Official Lyric Video) ft. Lele Pons & Juanpa Zurita,,2017-12-14
8287,xa2LxGIQ1DQ,2017-12-25,25.0,13:32:22,74815.0,46.0,12.0,9.0,Latest News,Barack Obama jokes with Prince Harry in sneak preview,,2017-12-17
8372,xp0m08eOD5U,2017-12-25,10.0,15:01:25,326550.0,9369.0,351.0,476.0,,Like A Motherless Child (Official Video),Moby,2017-12-11
8262,y-CvcTfcllk,2017-12-25,10.0,15:00:28,264282.0,12614.0,495.0,939.0,,My Obsession,Pale Waves,2017-12-18
8227,ydPYNo8o-lI,2017-12-25,10.0,05:00:02,1904174.0,87798.0,2129.0,4245.0,,Thunder / Young Dumb & Broke (Medley/Audio),"Imagine Dragons, Khalid",2017-12-20
8284,zXHUHx4R9kI,2017-12-25,10.0,05:00:05,3004987.0,132902.0,5671.0,8585.0,,George Jeff,Jaden Smith,2017-12-15
8216,zi_6oaQyckM,2017-12-25,10.0,03:00:02,4636300.0,323468.0,16477.0,20504.0,,TWICE Merry & Happy M/V,jypentertainment,2017-12-22
8342,zwrlJwed2mQ,2017-12-25,24.0,13:58:13,52112.0,586.0,1.0,16.0,BigCityBeats,BigCityBeats WORLD CLUB DOME Zero Gravity (Official Trailer),,2017-12-13
