id,video_id,trending_date,category_id,publish_time,views,likes,dislikes,comment_count,Author,Title,Artist,publish_date
28807,yRTRm9RrVaM,2018-04-16,24.0,14:30:05,133309.0,2610.0,137.0,452.0,BigBoyTV,"Cardi B on Her Pregnancy, Invasion of Privacy, Baby Names & A Lot More!",,2018-04-13
28933,ycy30LIbq4w,2018-04-16,10.0,04:30:01,17262285.0,551835.0,6436.0,29079.0,,Shawn Mendes Lost In Japan (Audio),Shawn Mendes,2018-03-23
28938,yvYeAdcM2Ss,2018-04-16,24.0,13:58:16,1796458.0,38088.0,984.0,5173.0,Hardwell,Hardwell LIVE at Ultra Music Festival Miami 2018,,2018-03-24
28893,z4dH6hEMuwk,2018-04-16,10.0,09:00:08,1119445.0,102690.0,412.0,9475.0,,'빛나리(Shine)' Official Music Video,PENTAGON(펜타곤),2018-04-02
28826,zT7VEhfezn8,2018-04-16,24.0,22:46:30,868648.0,22505.0,378.0,1035.0,TRL,Hennessy Carolina Surprises Cardi B w/ A Brand New Gucci Bag! | I Did It | TRL,,2018-04-10
28885,zUofr5WcdSM,2018-04-16,17.0,22:26:08,1809424.0,3023.0,473.0,3686.0,MMAnytt.se,Artem Lobov and Khabib Nurmagomedov Confrontation Ahead Of UFC 223',,2018-04-03
28902,zVc-K1kKkVk,2018-04-16,10.0,07:00:14,4036606.0,150666.0,2329.0,7271.0,,Broken Clocks,SZA,2018-03-30
