id,video_id,trending_date,category_id,publish_time,views,likes,dislikes,comment_count,Author,Title,Artist,publish_date
1408,-Gptp_ui-Sg,2017-11-21,20.0,19:06:18,387566.0,6850.0,1198.0,1830.0,Pokémon GO,Announcing Pokémon GO Travel and the Global Catch Challenge,,2017-11-19
1497,0ANDjPQPS_Q,2017-11-21,26.0,15:17:28,27834.0,3028.0,88.0,517.0,Pixielocks,♡ SILVER PLAYBUTTON UNBOXING (and making it cute) ♡,,2017-11-15
1437,0O2IAz1E9Ts,2017-11-21,24.0,17:00:54,740436.0,20185.0,1549.0,1127.0,Vanity Fair,Miranda Sings Hijacks a Stranger's Tinder | Vanity Fair,,2017-11-16
1477,0gwkMY-mzUQ,2017-11-21,24.0,20:11:41,721459.0,36683.0,740.0,1815.0,Demi Lovato,Demi Lovato & Luis Fonsi - Echame La Culpa (Teaser),,2017-11-15
1406,0oXu0XfXYYE,2017-11-21,26.0,19:04:13,903796.0,56060.0,2403.0,5554.0,Zoella,Youtube Show & Tell | Tag | Zoella,,2017-11-19
1590,1KVBFtSuCm0,2017-11-21,24.0,15:27:32,601175.0,430.0,59.0,43.0,Justin Chan,WiPrint: 3D Printing Your Wireless Coverage,,2015-07-17
1433,1Xr-3eDioL8,2017-11-21,17.0,16:54:05,236764.0,7980.0,98.0,574.0,Liverpool FC,"At home with... Gini Wijnaldum | Primark socks, Big Shaq and scousers with 'Vuj'",,2017-11-16
1439,1_Nr0hrjR24,2017-11-21,28.0,05:12:25,248290.0,1573.0,76.0,498.0,ran future,Elon Musk Unveils the Tesla Semi Truck - 2017-11-16 - Part 3 of 3,,2017-11-17
1583,1cgK-BIrXes,2017-11-21,24.0,15:07:13,913152.0,27386.0,2147.0,5294.0,YouTube Spotlight,#VeteransDay: Thank You for Everything,,2017-11-10
1481,2S2qtGisT34,2017-11-21,25.0,00:01:12,223109.0,484.0,276.0,1249.0,CNN,Migrants being sold as slaves in Libya,,2017-11-15
1527,2Vv-BfVoq4g,2017-11-21,10.0,11:04:14,82143174.0,2205826.0,34900.0,102260.0,,Perfect (Official Music Video),Ed Sheeran,2017-11-09
1520,2Zvmi5BzDbs,2017-11-21,10.0,00:00:36,122664.0,21263.0,57.0,1024.0,,Episode 3,Tour Documentary,2017-11-14
1586,3DflRo_Vids,2017-11-21,24.0,12:37:08,410560.0,520.0,113.0,141.0,The Céline Café,"CÉLINE DION FT. STEVE AOKI - MY HEART WILL GO ON (OMNIA Nightclub) | Nov. 7, 2017",,2017-11-08
1529,3GtSorFUQhc,2017-11-21,22.0,05:30:51,73366.0,357.0,33.0,78.0,CHANNEL90seconds newscom,"FULL. ASEAN Summit 2017. Opening ceremony.  November 13, 2017. Philippines, Manila.",,2017-11-13
1444,3jtjkXSvuJw,2017-11-21,15.0,22:40:58,71637.0,6306.0,16.0,626.0,Kitten Lady,Try Not to Laugh at This Silly Kitten,,2017-11-17
1526,3qYt_fXdaXY,2017-11-21,24.0,12:25:20,54150.0,629.0,45.0,196.0,Foolmarkt,Sweetie destroys Flav (Sweetie vs. Flavor Flav),,2016-08-06
1564,44NYFvhXmW8,2017-11-21,10.0,13:00:00,3294867.0,86761.0,3573.0,5360.0,,Walk On Water (Official Music Video),Thirty Seconds To Mars,2017-11-08
1584,4FDpjKdlIxA,2017-11-21,28.0,23:05:42,72757.0,997.0,262.0,1175.0,Sam Harris,Waking Up with Sam Harris #103 - American Fantasies (with Kurt Andersen),,2017-11-09
1488,4SANXNco_y4,2017-11-21,10.0,17:05:36,127324.0,4348.0,174.0,391.0,,Dashboard Confessional: We Fight (Official Audio),Fueled By Ramen,2017-11-15
1490,4zD4HPlc-BE,2017-11-21,26.0,13:13:28,18431.0,71.0,3.0,12.0,Ricky Rebel,Ricky Rebel - Time,,2017-10-30
1598,54Eae2ewc1c,2017-11-21,10.0,14:56:04,70857.0,440.0,17.0,32.0,,Bruce Springsteen 'I’m On Fire' cover/'400 Lux' mashup - 8Nov2017 Christchurch,Lorde,2017-11-08
1491,5E4ZBSInqUU,2017-11-21,10.0,17:00:00,6101361.0,256805.0,5279.0,15214.0,,Blocks (Official Music Video),Marshmello,2017-11-13
1457,5UL5wZJPLEg,2017-11-21,17.0,03:00:01,423814.0,6116.0,269.0,374.0,WWE,"Maryse goes overboard prepping for Carmella and Big Cass' arrival: Total Divas, Nov. 15, 2017",,2017-11-16
\nSubscribe to WWE on YouTube: http://bit.ly/1i64OdT,,,,,,,,,,,,
\nVisit WWE.com: http://goo.gl/akf0J4,,,,,,,,,,,,
\nMust-See WWE videos on YouTube: https://goo.gl/QmhBof,,,,,,,,,,,,
1423,5n9xafjynJA,2017-11-21,28.0,06:27:36,2043102.0,36153.0,878.0,5527.0,The Verge,Tesla Semi truck and Roadster event in 9 minutes,,2017-11-17
1462,5nEogChRGE8,2017-11-21,23.0,02:00:01,1980733.0,19348.0,1153.0,1824.0,Late Night with Seth Meyers,Donald Trump Jr. and WikiLeaks; Trump Meets Duterte: A Closer Look,,2017-11-15
1559,6RyOsIseJbk,2017-11-21,22.0,20:43:48,440613.0,5030.0,183.0,197.0,John Conforti,Reading #3,,2017-11-05
1432,6uJf2IT2Zh8,2017-11-21,10.0,09:00:03,9294823.0,530260.0,16331.0,57820.0,,Red Velvet 레드벨벳 '피카부 (Peek-A-Boo)' MV,SMTOWN,2017-11-17
1505,7-7mW9daU5E,2017-11-21,20.0,23:09:59,187482.0,981.0,66.0,588.0,ElAnalistaDeBits,SKYRIM | Switch vs PS4 vs PC vs ONE vs PS3 vs 360 | All Versions Comparison,,2017-11-14
1546,7fm7mll2qvg,2017-11-21,10.0,00:00:00,233620.0,7914.0,72.0,444.0,,Strangers (Lyric Video),Sigrid,2017-11-10
1460,8KT1UCsOE74,2017-11-21,24.0,09:43:32,1088828.0,34989.0,1773.0,10715.0,Chris Stuckmann,Justice League - Movie Review,,2017-11-15
1455,8hKbIhrb1WU,2017-11-21,24.0,14:00:02,3960643.0,55751.0,1918.0,3607.0,TheEllenShow,Kim Kardashian Lets Gender of Third Child Slip,,2017-11-15
1401,8mCcM-PUmLM,2017-11-21,22.0,21:29:25,1967661.0,107403.0,1159.0,9359.0,Safiya Nygaard,I Dressed Like It Was 1977,,2017-11-19
1589,949vJMp0v40,2017-11-21,10.0,14:57:32,44751.0,418.0,64.0,35.0,,Single out December 1st,Thunder Christmas Day Official Music Video,2017-11-10
1409,97IfPfjSaDg,2017-11-21,1.0,22:03:41,1626427.0,87876.0,3550.0,12501.0,hotdiggedydemon,A Cuphead Cartoon,,2017-11-18
1500,9CO6M2HsoIA,2017-11-21,22.0,23:55:06,1137162.0,6296.0,413.0,1306.0,Stop Autonomous Weapons,Slaughterbots,,2017-11-12
1568,9GqL1DSQDL0,2017-11-21,26.0,22:00:00,392070.0,24042.0,768.0,1548.0,makeupbymichaelfinch,GET READY WITH ME + LILY! (we're so immature bye),,2017-11-09
1459,9pbCuFxRuqs,2017-11-21,28.0,02:34:28,663450.0,24553.0,1310.0,3536.0,Jonathan Morrison,The truth about the Apple iPhone X - Review!,,2017-11-16
1533,9t9u_yPEidY,2017-11-21,10.0,15:00:00,26050027.0,303526.0,24860.0,14145.0,,"Amor, Amor, Amor (Official Video) ft. Wisin",Jennifer Lopez,2017-11-10
1570,9wg3v-01yKQ,2017-11-21,10.0,13:00:01,13070091.0,883110.0,18808.0,61797.0,,Kiwi,Harry Styles,2017-11-08
1467,A5TPOKoE1_M,2017-11-21,22.0,21:07:34,1622138.0,73314.0,5252.0,1236.0,MoreZoella,CHRISTMAS ADVERTS & HOW WE MET,,2017-11-14
1579,A8ScwhLh7uo,2017-11-21,1.0,18:00:01,3454448.0,99385.0,2938.0,7688.0,Screen Junkies,Honest Trailers - Stranger Things,,2017-11-07
1415,A_Z3AokMwWI,2017-11-21,20.0,19:12:51,1013718.0,0.0,0.0,6762.0,TeamMojang,MINECON Earth 2017 Livestream,,2017-11-18
1424,BQ_0QLL2gqI,2017-11-21,10.0,18:00:00,3460999.0,161692.0,1779.0,5019.0,,"Let Me Go ft. Florida Georgia Line, watt","Hailee Steinfeld, Alesso",2017-11-17
1440,BWX1ygwYzWc,2017-11-21,20.0,19:48:08,45084.0,1339.0,15.0,133.0,BaerTaffy,Roundtable Live! - 11/17/2017 (Ep. 108 feat. Edmund McMillen),,2017-11-18
1544,BsfhHKx6ajA,2017-11-21,24.0,11:00:00,852732.0,13657.0,2320.0,1171.0,Good Mythical Morning,Attracting An Alpaca With An Accordion | Nowhere Else,,2017-11-10
1585,CR9zYgr84QY,2017-11-21,26.0,18:30:01,142752.0,6270.0,57.0,267.0,CupcakeJemma,Chocolate Orange Autumn Cupcakes | Cupcake Jemma,,2017-11-09
1541,DIU3xPdhCBI,2017-11-21,10.0,22:26:10,1672294.0,36024.0,1259.0,1400.0,,Sam Smith surprises brides at their wedding! (At The BBC),BBC Music,2017-11-09
1454,DhwwTxTh5To,2017-11-21,28.0,14:01:40,468840.0,14974.0,1009.0,2361.0,Austin Evans,Is the Surface Book 2 a MacBook Pro Killer?,,2017-11-16
1407,Djxjmq9pvrM,2017-11-21,26.0,17:00:01,118227.0,3598.0,165.0,362.0,Fleur DeForce,What To Buy HIM: Christmas 2017 | FleurDeForce,,2017-11-19
1538,Dlwf5u2BLAg,2017-11-21,25.0,01:40:07,289249.0,1881.0,146.0,346.0,Inside Edition,"TV Reporter Interviews Alleged Bank Robber, Then Helps Police Catch Him",,2017-11-10
1552,E7ykb1geOoU,2017-11-21,25.0,13:39:47,5963.0,332.0,27.0,85.0,Novara Media,A Veteran speaks on Remembrance Day,,2017-11-11
1458,EEIP1YpFXrE,2017-11-21,20.0,20:00:00,1182553.0,45119.0,850.0,6332.0,iHasCupquake,Our First Date,,2017-11-15
1506,ENr6CXm1YxU,2017-11-21,10.0,08:00:01,97625.0,2279.0,97.0,95.0,,Whole Heart (Audio),Rachel Platten,2017-11-15
1577,EYkEshCOhEU,2017-11-21,22.0,00:24:29,332951.0,16636.0,414.0,1015.0,Nicole Guerriero,The Ultimate Red Lip Look | Nicole Guerriero,,2017-11-10
1521,EvWPqF_AQHI,2017-11-21,26.0,16:37:04,101248.0,2578.0,202.0,366.0,Amelia Liana,DESIGNER AUTUMN HAUL! | Amelia Liana,,2017-11-13
1553,F62QpaPWXDI,2017-11-21,22.0,18:18:59,130952.0,5597.0,93.0,326.0,Jamie Genevieve,THE CHEAPEST & BEST EYESHADOWS?,,2017-11-09
1512,FCdvOAcbK4s,2017-11-21,17.0,15:15:51,115992.0,1878.0,34.0,42.0,EnduraOfficial,Danny MacAskill vs The Munros,,2017-11-08
1452,FHl0nIdbiLA,2017-11-21,23.0,18:30:00,855166.0,24424.0,3294.0,3087.0,CollegeHumor,The Problem with Lab Mice,,2017-11-15
1578,FUzs2oMEs8w,2017-11-21,10.0,19:57:09,308360.0,11624.0,161.0,1257.0,,Ghost Voices [Audio],Virtual Self,2017-11-08
1410,FVwR2zK_Ahs,2017-11-21,26.0,09:00:01,136008.0,12904.0,52.0,755.0,Samantha Maria,DAILY ROUTINE | Mum & Baby,,2017-11-19
1596,Fkwkn7vXpWI,2017-11-21,24.0,10:00:00,32198.0,1184.0,37.0,115.0,BBC Earth Lab,How Are Waves Formed? - Earth Lab,,2017-11-09
1593,G1Ky9-OoWyo,2017-11-21,20.0,06:45:00,988435.0,37980.0,2376.0,14652.0,AngryJoeShow,EA's Responds to Star Wars Loot Box Rant! - [Angry Interview],,2017-11-08
1426,GWM8x6Y6cXU,2017-11-21,20.0,08:30:01,132113.0,5673.0,2360.0,2955.0,Pretty Good Gaming,CD Projekt considering “games as a service” for CyberPunk 2077,,2017-11-18
1471,HJBqbRMUOaI,2017-11-21,10.0,19:16:59,111495.0,3780.0,122.0,178.0,,Silence (Marshmello & Khalid cover) in the Live Lounge,Kesha,2017-11-15
1580,HNa_UWX51_s,2017-11-21,10.0,18:46:37,341655.0,12671.0,382.0,549.0,,Katy Perry ('40s Jazz Vibes Style Cover) ft. Olivia Kuper Harris,Last Friday Night,2017-11-09
1492,IKuKZIISPE0,2017-11-21,24.0,17:00:16,162371.0,4790.0,18.0,227.0,todrickhall,Behind The Curtain - OFFICIAL TRAILER,,2017-11-15
1595,IOd0HGH6xKI,2017-11-21,10.0,05:00:01,301204.0,7052.0,418.0,316.0,,Happy Place (Lyrics),Alison Wonderland,2017-11-09
1509,JDDP9fY6dmI,2017-11-21,25.0,20:18:55,84822.0,1387.0,565.0,1452.0,TIME,A Group Of Democrats Just Officially Moved To Impeach Donald Trump As President | TIME,,2017-11-15
1542,J_QGZspO4gg,2017-11-21,10.0,15:45:05,3195197.0,105342.0,1575.0,6527.0,,Snowman,Sia,2017-11-09
1551,Ja_GMU7-sjs,2017-11-21,28.0,21:18:33,1749650.0,55683.0,1628.0,6143.0,Marques Brownlee,Google Pixelbook: $1000 of Weird!,,2017-11-09
1523,Jw1Y-zhQURU,2017-11-21,26.0,07:38:29,8401779.0,62592.0,12147.0,7877.0,John Lewis,John Lewis Christmas Ad 2017 - #MozTheMonster,,2017-11-10
1487,L9eFkmjIIWA,2017-11-21,27.0,16:01:39,95520.0,4816.0,51.0,313.0,It's Okay To Be Smart,The Romantic Lure of Moonlight,,2017-11-15
1535,LMCuKltaY3M,2017-11-21,10.0,08:00:01,279253.0,3242.0,192.0,315.0,,Golden Slumbers (John Lewis Advert 2017),Elbow,2017-11-10
1507,MKLlDnUqho4,2017-11-21,10.0,16:30:00,42582.0,2317.0,93.0,342.0,,Dead Beat Sirah ft. Skrillex (official video),SIRAH,2017-11-14
1456,MMGrzOu1amQ,2017-11-21,24.0,23:08:18,2485722.0,104794.0,1181.0,16676.0,Simply Nailogical,HOLO CAPPUCCINO | DIY Diamond Cappuccino test (maybe don't drink this?),,2017-11-15
1511,Mmkf4zYlW4E,2017-11-21,24.0,00:31:44,105270.0,5186.0,83.0,387.0,Wong Fu Productions,Runners Music Video | Wong Fu Presents,,2017-11-16
1479,Mn-3c6of8t8,2017-11-21,24.0,13:29:28,146752.0,6988.0,543.0,1167.0,Sailor J,How to be an Aquarius,,2017-11-15
1434,Mv-CJ44KbW4,2017-11-21,24.0,19:11:57,592727.0,37072.0,936.0,183.0,PointlessBlogVlogs,SURPRISING MY FRIENDS WITH A HOLIDAY!!,,2017-11-16
1540,MyEqfBkzESU,2017-11-21,26.0,20:40:44,466991.0,10848.0,3328.0,3545.0,John Maclean,EXTREME GOLDEN TAN TRANSFORMATION,,2017-11-10
1504,N0tmF4j4K6g,2017-11-21,15.0,10:00:02,46849.0,2130.0,18.0,168.0,BBC Earth,What Does It Take To Be A Blue Planet II Cameraman? #OurBluePlanet - BBC Earth,,2017-11-15
1566,N8U2EPiEbZo,2017-11-21,22.0,21:18:34,198869.0,4205.0,310.0,347.0,Lydia Elise Millen,A PRE WEDDING PAMPER | Lydia Elise Millen,,2017-11-09
1532,NVCqz2BDfcQ,2017-11-21,10.0,17:18:13,2407124.0,58182.0,1524.0,2326.0,,Curve (ft. The Weeknd),Gucci Mane,2017-11-10
1575,NcVxrr_q3Hw,2017-11-21,26.0,07:37:46,1581.0,90.0,12.0,37.0,Official Jeremy Corbyn Channel,George Durack | Remembrance Sunday | You Can't Forget,,2017-11-12
1489,Nsw5HuVGdBI,2017-11-21,10.0,16:23:39,220777.0,7564.0,262.0,212.0,,New Rules (Dua Lipa Cover) in the Radio 1 Live Lounge,Clean Bandit,2017-11-14
1466,O3eO646jjzQ,2017-11-21,24.0,20:30:55,39746.0,370.0,14.0,28.0,The New Yorker,Professional Scrabble Players Replay Their Greatest Moves | The New Yorker,,2017-11-16
1567,OGKchfcd-5w,2017-11-21,10.0,03:53:25,140681.0,5734.0,44.0,867.0,,Freestyle #030,Big Krit Freestyle With The L.A. Leakers,2017-11-11
1534,ONQ-fAp5X64,2017-11-21,17.0,10:30:00,433573.0,11190.0,360.0,585.0,Nile Wilson,CAN BABIES DO GYMNASTICS?  **World Record**,,2017-11-11
1576,P4YJwy_T9pM,2017-11-21,22.0,03:16:36,1046511.0,44186.0,280.0,1721.0,Tyler Williams,I Picked My Girlfriend's Outfit Blindfolded,,2017-11-09
1563,P4ohTV_28Oc,2017-11-21,24.0,19:43:21,61960.0,978.0,14.0,64.0,Tu Fan,Taylor Swift Saturday Night Live Behind The Scenes,,2017-11-10
1450,PHWAZNkqwN4,2017-11-21,10.0,10:07:18,324083.0,15832.0,595.0,1465.0,,björk: blissing me,Björk,2017-11-16
1508,PUTEiSjKwJU,2017-11-21,17.0,02:30:38,97615.0,423.0,44.0,53.0,Salford City Football Club,Goals from Salford City vs Class of 92 and Friends at The Peninsula Stadium!,,2017-11-13
1554,QFfEtKvXMAs,2017-11-21,10.0,17:00:05,580811.0,57822.0,207.0,3113.0,,Too Much To Ask (Acoustic),Niall Horan,2017-11-10
1539,QOksZ8VogRw,2017-11-21,10.0,17:03:42,1425808.0,41442.0,853.0,1645.0,,World Gone Mad (from Bright: The Album) [Official Music Video],Bastille,2017-11-09
1493,Qj7DVNDb7To,2017-11-21,23.0,22:18:21,114923.0,6490.0,78.0,4216.0,Jessii Vee,Weird Things YOU DID As A Child (DON'T DENY),,2017-11-15
1411,QlnMYbtEy2A,2017-11-21,22.0,11:05:08,168490.0,8507.0,122.0,2455.0,Nasey Family,EMPTY APARTMENT TOUR!!,,2017-11-19
1499,RDP8Oh-br4Y,2017-11-21,26.0,17:00:05,118543.0,3887.0,152.0,328.0,SamanthaMariaVlogs,BRUNCH WITH GIGI & GETTING A BETTER BUM,,2017-11-14
1573,RYs08kX3Ih4,2017-11-21,26.0,01:30:00,259354.0,15740.0,432.0,1154.0,MsAaliyahJay,SECRETS REVEALED! HOW I LAY MY LACE WIGS! | AALIYAHJAY,,2017-11-10
1482,ReNY18XdFTI,2017-11-21,24.0,07:30:00,112116.0,3562.0,72.0,1765.0,Harry Main,ENDURO SKATEPARK MTB!!,,2017-11-15
1464,RrhSJzM8NLE,2017-11-21,10.0,13:10:12,507987.0,14112.0,626.0,847.0,,Pleader (Official Video),alt-J,2017-11-15
1405,S-iiG3-4FJ8,2017-11-21,26.0,09:30:00,122983.0,7566.0,110.0,707.0,Lily Pebbles,WE'RE MOVING! | Lily Pebbles,,2017-11-19
1484,ScHb-rczYbM,2017-11-21,17.0,23:04:49,332221.0,2829.0,60.0,247.0,FATV,"Neymar Jr, Willian, Coutinho in Town as England Take on Brazil | Tunnel Cam | Inside Access",,2017-11-14
1413,Ssvv40iz-Ls,2017-11-21,26.0,19:00:11,40829.0,1618.0,73.0,142.0,Inthefrow,TOP 5 LUXURY HANDBAGS FOR AUTUMN WINTER,,2017-11-19
1447,TWpt-ze_cYU,2017-11-21,23.0,20:00:02,1401048.0,67572.0,648.0,67166.0,jacksfilms,"You, but in emojis. (YIAY #375)",,2017-11-15
1496,U4COOi4942A,2017-11-21,25.0,21:59:34,46837.0,1784.0,133.0,739.0,The White House,President Trump Delivers Remarks,,2017-11-15
1399,UhZ56rcWwRQ,2017-11-21,1.0,01:22:15,1145941.0,15400.0,3484.0,3313.0,Disney Movie Trailers,A Wrinkle in Time Official US Trailer,,2017-11-20
1446,UuCq8mtK8J4,2017-11-21,10.0,05:00:01,2811422.0,133911.0,1966.0,4617.0,,A Different Way,"DJ Snake, Lauv",2017-11-16
1470,UwdLlnPaRAU,2017-11-21,17.0,17:00:36,665452.0,19849.0,227.0,1372.0,WIRED,Tony Hawk Answers Skateboarding Questions From Twitter | Tech Support | WIRED,,2017-11-15
1530,VEoOuF_cN0Q,2017-11-21,10.0,19:50:03,28312.0,1188.0,19.0,86.0,,Good Times!,Cal Jam 17,2017-11-13
1519,W187SzNVGvc,2017-11-21,10.0,16:18:54,219457.0,5173.0,173.0,820.0,,#FREESTYLE085,IMAN FREESTYLES ON FLEX,2017-11-13
1417,X9Gc_g638C8,2017-11-21,24.0,03:14:59,82874.0,4305.0,15.0,377.0,E! Live from the Red Carpet,BTS Talks Emojis and More at the 2017 AMAs | E! Live from the Red Carpet,,2017-11-20
1445,Y4lhAHTzbRE,2017-11-21,17.0,21:56:06,66849.0,380.0,112.0,488.0,TMZSports,Is Nate Diaz vs Tyron Woodley The UFC 219 Main Card? | The Hollywood Beatdown,,2017-11-17
1555,Y5MqpKlKiSM,2017-11-21,24.0,15:42:33,120348.0,5850.0,167.0,297.0,Gabriella Lindley,Decluttering My Life ✨,,2017-11-10
1587,YInRqgNMLBc,2017-11-21,17.0,18:56:43,195068.0,303.0,10.0,61.0,Lietuvos Futbolo Rinktinės Archyvas,Craziest sitter miss ever Gintra Šiauliai - Barcelona with commentary | Champions League,,2017-11-08
1402,YJcergNiMDQ,2017-11-21,20.0,19:58:55,1789280.0,64409.0,1502.0,10073.0,Ubisoft US,Rainbow Six Siege: White Noise Operators Gameplay and Starter Tips | UbiBlog | Ubisoft [US],,2017-11-19
1574,ZwIuff3270M,2017-11-21,26.0,15:02:20,50462.0,52.0,13.0,103.0,DoctorOz,Corey Haim's Mom Talks to Dr. Oz,,2017-11-10
1469,_8VHAHoCUVY,2017-11-21,20.0,14:00:02,73093.0,3007.0,90.0,701.0,Unit Lost - Great British Gaming,Overwatch News - HULK AWARD! GIANT Posters! Moira Launch INCOMING!,,2017-11-16
1524,_9wK8hVvjAU,2017-11-21,17.0,16:00:02,154376.0,8144.0,62.0,628.0,COPA90,Lampard Reveals Why England Never Won Anything | FIFA and Chill ft. Poet & Vuj,,2017-11-12
1400,_H1vcldAsP0,2017-11-21,24.0,06:44:05,1581376.0,28789.0,2465.0,6676.0,Saturday Night Live,"Eminem: Walk on Water, Stan, Love the Way You Lie (ft. Skylar Grey) (Live) - SNL",,2017-11-19
1438,aJqEx_t_9S8,2017-11-21,24.0,01:33:04,210015.0,4289.0,713.0,2736.0,Beyond The Trailer,Justice League SPOILERS Movie Review,,2017-11-17
1515,aRXgvkpMZrI,2017-11-21,22.0,18:33:12,29624.0,2754.0,11.0,162.0,Daniel J. Layton,September 2017 - Pretentious Monthly Scrapbook 2017,,2017-11-13
1441,aXWfL-1ieuE,2017-11-21,28.0,06:53:02,713127.0,4078.0,313.0,353.0,Now You Know,Roadster Test Ride,,2017-11-17
1543,b4vTZx_AtHk,2017-11-21,26.0,18:36:48,2455212.0,106332.0,13076.0,12228.0,HowToBasic,How To Dry a Shirt in 30 Seconds,,2017-11-09
1582,bxeHBBf21UY,2017-11-21,17.0,16:01:06,354899.0,18045.0,163.0,976.0,Fabio Wibmer,Game Of Stairs (Enduro Edition) |SickSeries#31,,2017-11-10
1557,cUtYh_ZUjqc,2017-11-21,24.0,00:00:02,82369.0,2065.0,217.0,348.0,British Vogue,You Know You’re British When… | The December Issue | British Vogue,,2017-11-10
1419,cmc8q2dcIMs,2017-11-21,10.0,15:00:02,1757756.0,98821.0,3959.0,6906.0,,Icon,Jaden Smith,2017-11-17
1418,coOKvrsmQiI,2017-11-21,24.0,21:15:08,13987067.0,137904.0,12199.0,25189.0,Warner Bros. Pictures,RAMPAGE - OFFICIAL TRAILER 1 [HD],,2017-11-16
1591,d8RW-WSpAhQ,2017-11-21,22.0,13:12:35,411310.0,1863.0,132.0,275.0,markthomasbuilder,Weed Killer Challenge: Vinegar 'Weed B Gone' vs HDX,,2014-06-28
1560,dwkNG9qeYIY,2017-11-21,22.0,12:50:38,5265.0,51.0,11.0,16.0,UK Bike Skills,UK Bike Skills Autumn Ladder Riding,,2017-11-11
1556,eHIY3HNNqzM,2017-11-21,10.0,08:00:03,251292.0,10619.0,135.0,370.0,,Arms Open (Acoustic) [Audio],The Script,2017-11-10
1451,eIG1Ix-3gdc,2017-11-21,24.0,16:03:13,153397.0,9858.0,36.0,689.0,On Air With Ryan Seacrest,#KIISCampus Surprise with BTS | On Air with Ryan Seacrest,,2017-11-17
1486,eQVhAN7-IAw,2017-11-21,10.0,03:43:47,822101.0,43999.0,660.0,2547.0,,The Making of a Song: “Delicate” – watch more on Taylor Swift NOW,Taylor Swift,2017-11-15
1443,ec9r9THD5eU,2017-11-21,10.0,09:33:58,28779.0,779.0,47.0,121.0,,Let It Snow [Official Video],Christmas Queens,2017-11-17
1420,fRj34o4hN4I,2017-11-21,28.0,21:12:25,9964832.0,196513.0,4589.0,33718.0,BostonDynamics,"What's new, Atlas?",,2017-11-16
1550,g5c1bk8weaQ,2017-11-21,23.0,03:43:43,4191001.0,334947.0,2766.0,12572.0,Liza Koshy,FIRST TIME IM DOING THIS! TALKS WITH LIZA.,,2017-11-10
1547,gEHCXl4J9Qo,2017-11-21,24.0,02:32:15,2979798.0,78263.0,2007.0,3645.0,ABC Television Network,Taylor Swift - “New Year’s Day” Fan Performance,,2017-11-10
1522,gKo7V7nxvqE,2017-11-21,24.0,22:47:49,1374460.0,64447.0,701.0,0.0,The X Factor UK,Harry Styles returns to The X Factor stage! | Live Shows | The X Factor 2017,,2017-11-11
1571,gSW2l1z1lKw,2017-11-21,22.0,18:00:02,120674.0,6357.0,248.0,357.0,SACCONEJOLYs,THIS WASN'T SUPPOSED TO HAPPEN!! DIY FIREWORKS SHOW,,2017-11-09
1473,gjXrm2Q-te4,2017-11-21,23.0,04:55:24,2897635.0,93025.0,1415.0,5134.0,The Tonight Show Starring Jimmy Fallon,Jimmy Fallon Pays Tribute to His Mother Gloria,,2017-11-14
1495,hXcoq5XDwyA,2017-11-21,20.0,22:02:34,71610.0,4571.0,119.0,545.0,Butch Hartman,Playing CUPHEAD with MatPat!,,2017-11-15
1537,hbmdI8A7SSo,2017-11-21,23.0,19:53:50,19058.0,1201.0,16.0,159.0,"What the heck, October?",Lex Croucher,,2017-11-12
1461,hpapqEeb36k,2017-11-21,26.0,14:52:38,889168.0,36219.0,895.0,1967.0,You Suck At Cooking,Pumpkin Pie - You Suck at Cooking (episode 68),,2017-11-15
1414,hq9SEUlkZ5s,2017-11-21,26.0,13:22:53,136549.0,6856.0,108.0,653.0,Sprinkleofglitter,My Very POSITIVE Birth Plan | MOTHERHOOD,,2017-11-18
1421,hsLcTO2a0Ec,2017-11-21,1.0,15:58:18,128480.0,2326.0,317.0,839.0,kermodeandmayo,Justice League reviewed by Mark Kermode,,2017-11-17
1478,i9EyFghIt5o,2017-11-21,27.0,22:00:01,141741.0,5761.0,352.0,961.0,SciShow,How Climate Scientists Predict the Future,,2017-11-15
1562,iNsTzqwwioY,2017-11-21,27.0,14:00:03,297984.0,11742.0,221.0,1638.0,Life Noggin,How Accurate Are Personality Tests and Horoscopes?,,2017-11-09
1518,ijJPFowBsBc,2017-11-21,22.0,17:00:02,156101.0,4754.0,183.0,330.0,Estée Lalonde,HUGE BEAUTY FAVOURITES! AUTUMN LOVES!,,2017-11-12
1448,ixxR3ZoqnF0,2017-11-21,10.0,15:00:05,7098772.0,1021297.0,4766.0,85460.0,,BTS (방탄소년단) 'MIC Drop (Steve Aoki Remix)' Official Teaser,ibighit,2017-11-16
1453,jG1JY0rt2Os,2017-11-21,10.0,05:00:02,3489656.0,172746.0,4601.0,15460.0,,HOLD ME TIGHT OR DON’T,Fall Out Boy,2017-11-15
1503,jGiqc3HSxEg,2017-11-21,27.0,15:30:01,273991.0,13463.0,253.0,649.0,Now You See It,A Study of So Bad It's Good Movies,,2017-11-13
1403,jH2t4Tcl3Pg,2017-11-21,10.0,16:14:48,301265.0,21175.0,270.0,1279.0,,Live At The Apollo Theater [Official Trailer] (November 29th on CBS),Bruno Mars,2017-11-20
1548,jp9hK-jY6yY,2017-11-21,23.0,22:21:13,3942479.0,228095.0,3686.0,20969.0,When Someone Has A Crush on You,Lilly Singh,,2017-11-09
1465,k1cA-Wh3Tc0,2017-11-21,28.0,00:00:03,914173.0,20515.0,946.0,6490.0,Matthias,Peephole Reverser? | 9 Pointless Tech Gadgets!,,2017-11-15
1516,ktQH78FNCfs,2017-11-21,24.0,21:30:07,88512.0,786.0,176.0,203.0,Hari Kondabolu,"Mindy Kaling, Apu & Indian Americans by Hari Kondabolu",,2015-11-09
1429,ky8MhqSovW4,2017-11-21,24.0,00:16:31,69816.0,2879.0,38.0,597.0,Access Hollywood,BTS Reacts To Having Niall Horan As A Fan & Their 2017 AMAs Performance | Access Hollywood,,2017-11-20
1428,lJFqvRwOiis,2017-11-21,25.0,12:55:39,984484.0,33045.0,8308.0,8803.0,Vox,Walking while black,,2017-11-16
1485,mJt1O3q0zKc,2017-11-21,17.0,12:00:05,393525.0,9310.0,171.0,627.0,Soccer AM,Who's the toughest player at Chelsea? | Eden Hazard | Teammates 2.0,,2017-11-14
1476,mjBIsBPG1N8,2017-11-21,22.0,15:23:10,188972.0,6647.0,153.0,323.0,Klossy,Every Snack I'm Packing for the Victoria's Secret Fashion Show | Karlie Kloss,,2017-11-16
1528,moLKl5PzZLc,2017-11-21,22.0,11:04:30,237287.0,1080.0,26.0,155.0,Mark Brown,Benton Fenton is missing - Hitler finds out! Jesus Christ!,,2011-11-24
1514,n1WpP7iowLc,2017-11-21,10.0,17:00:03,32109264.0,978775.0,58824.0,131495.0,,Walk On Water (Audio) ft. Beyoncé,Eminem,2017-11-10
1435,nRafaCcfrcI,2017-11-21,24.0,13:00:50,6197393.0,476724.0,4853.0,23008.0,Vogue,73 Questions With Liza Koshy | Vogue,,2017-11-16
1404,nUv22OHdjQU,2017-11-21,10.0,03:20:47,1136686.0,12260.0,3978.0,6087.0,,Whitney Houston TRIBUTE At AMA's 2017,[HD] Christina Aguilera,2017-11-20
1431,nVTNrp1RuEI,2017-11-21,24.0,02:00:03,525031.0,5292.0,1429.0,2631.0,Wendy Williams,Nicki Minaj's Paper Magazine Cover,,2017-11-17
1472,nlodY8nMw-A,2017-11-21,23.0,03:46:49,1167435.0,71909.0,484.0,5548.0,Jimmy Kimmel Live,BTS Surprises Super Fans & Their Moms on Kimmel,,2017-11-16
1572,nnrkPRApQg8,2017-11-21,24.0,14:30:53,692783.0,5708.0,211.0,477.0,E! Entertainment,KUWTK | Khloe Tries to Help Kourtney & Scott Hash Out Their Drama | E!,,2017-11-09
1565,nrXlY6gzTTM,2017-11-21,1.0,05:31:00,2907528.0,9364.0,1014.0,1412.0,20th Century Fox,The Post | Official Trailer [HD] | 20th Century FOX,,2017-11-08
1427,oSS6kGWNEeA,2017-11-21,24.0,08:35:00,906417.0,5864.0,1315.0,1818.0,The Late Show with Stephen Colbert,Ben Affleck: 'I'm Not A Superhero',,2017-11-17
1502,oddXT5uaRb8,2017-11-21,10.0,09:00:02,1508950.0,181682.0,2062.0,9854.0,,[MV] Samuel(사무엘) _ Candy(캔디),1theK (원더케이),2017-11-16
1425,p8XP7A7kvzM,2017-11-21,24.0,06:44:16,11218307.0,216489.0,8821.0,11975.0,The Late Late Show with James Corden,Spill Your Guts or Fill Your Guts w/ Kim Kardashian,,2017-11-16
1536,pHE8nIB6j2U,2017-11-21,10.0,14:00:04,15432792.0,200505.0,18491.0,8378.0,,Choka Choka (Official Video) ft. Ozuna,Chayanne,2017-11-10
1430,pOEzjT-SED0,2017-11-21,10.0,15:00:07,2943211.0,90727.0,17000.0,21891.0,,Wake Me Up ft. Lil' Kim,Remy Ma,2017-11-16
1463,pYClHihdjsE,2017-11-21,22.0,10:40:17,27197.0,2219.0,13.0,169.0,Fran Meneses,How to make a planner + FIRST SKETCHES ~ Frannerd,,2017-11-17
1531,pz95u3UVpaM,2017-11-21,10.0,05:01:00,11372481.0,346810.0,5997.0,12854.0,,Havana (Vertical Video) ft. Young Thug,Camila Cabello,2017-11-10
1581,q-WipZ9p0wk,2017-11-21,26.0,14:00:08,87721.0,2180.0,85.0,213.0,Brothers Green Eats,Three meals that cost me $1.50 each,,2017-11-09
1558,qEEtzzi1EII,2017-11-21,15.0,13:34:58,593835.0,21745.0,315.0,1020.0,Simon's Cat,Birthdays - Simon's Cat | GUIDE TO,,2017-11-09
1416,qN1_nEdly7I,2017-11-21,24.0,06:25:48,63023.0,4874.0,36.0,851.0,Entertainment Tonight,BTS Say They Don't Need Girlfriends When They Have Fan Army (Exclusive),,2017-11-20
1480,qqs3fxfmWr4,2017-11-21,28.0,22:00:02,278899.0,4513.0,126.0,314.0,INSIDER,How Pencils Are Made,,2017-11-15
1510,rIh1NW7afo4,2017-11-21,17.0,23:35:14,146856.0,1425.0,163.0,475.0,MMAFightingonSBN,"The MMA Hour: Episode 409 (w/ Swagger, Bisping, Rampage, Swanson, Bang)",,2017-11-13
1561,rL4WkebTT_U,2017-11-21,24.0,15:06:34,166520.0,9736.0,78.0,996.0,Abroad in Japan,Where is Tokyo's Greatest View?,,2017-11-09
1474,rXbrryghxAA,2017-11-21,24.0,18:00:06,41583.0,2095.0,54.0,521.0,Verne Troyer,Saving Dogs From The Asian Dog Meat Trade! (Emotional),,2017-11-15
