id,video_id,trending_date,category_id,publish_time,views,likes,dislikes,comment_count,Author,Title,Artist,publish_date
14864,tP_Dk81f9fg,2018-01-29,10.0,16:23:55,80283.0,333.0,2.0,24.0,,Jeffrey Lewis The Legend of The Fall,Dav hum,2007-03-05
14971,tTlxjhG7SOI,2018-01-29,10.0,17:00:07,1224480.0,32555.0,699.0,1035.0,,Ex ft. YG [Music Video],Ty Dolla $ign,2018-01-18
14938,uCNXhk4jFXY,2018-01-29,17.0,22:51:35,558493.0,6410.0,245.0,3122.0,UFC - Ultimate Fighting Championship,UFC 25th Anniversary Series Press Conference,,2018-01-19
14894,uUCdUCxTjyI,2018-01-29,10.0,14:55:04,305104.0,3665.0,153.0,1019.0,,"The End is Near… Slayer to make its exit with one, final world tour.",Slayer,2018-01-22
14829,utsPTIL0ACE,2018-01-29,24.0,12:00:08,54736.0,1710.0,65.0,467.0,IGN,Blade Runner 2049 Director Answers 9 WTF Questions,,2018-01-26
14936,vAh7jTAkCKc,2018-01-29,10.0,21:52:00,5095166.0,163739.0,5274.0,10262.0,,No Drama (Official Video) ft. Offset,Tinashe,2018-01-18
14826,vecSVX1QYbQ,2018-01-29,10.0,09:00:03,5503993.0,420536.0,3606.0,49338.0,,‘사랑을 했다(LOVE SCENARIO)’ M/V,iKON,2018-01-25
14891,wqS9QwOIH3s,2018-01-29,26.0,22:00:05,140943.0,8072.0,88.0,378.0,Jessica Clements,Natural Defined Instagram Makeup | Jessica Clements,,2018-01-24
14882,wrpeEitIEpA,2018-01-29,1.0,17:05:24,1915926.0,62005.0,3224.0,4284.0,LastWeekTonight,Last Week Tonight: Season 5 Official Trailer (HBO),,2018-01-22
14874,xPsEiZAOb_I,2018-01-29,24.0,17:09:00,302331.0,42171.0,408.0,2901.0,Caspar,GIVING AWAY MY YOUTUBE ADSENSE,,2018-01-22
14836,xVhnfTwh1OA,2018-01-29,24.0,04:42:38,6596913.0,280235.0,4975.0,23221.0,Cole Bennett,YBN Nahmir - Bounce Out With That (Dir. by @_ColeBennett_),,2018-01-24
14942,xnZA52oTp6M,2018-01-29,10.0,16:47:18,60465.0,1603.0,46.0,97.0,,'Walk It Back',The National,2018-01-20
14989,yBXcNcBnImc,2018-01-29,2.0,19:28:07,291742.0,9107.0,199.0,5708.0,Car Throttle,The Most Expensive Countries To Buy Cool Used Cars,,2018-01-17
14802,yKVAhDbSito,2018-01-29,26.0,17:48:13,2749622.0,193673.0,5801.0,46713.0,jeffreestar,BLOOD SUGAR ❤️ PALETTE & LOVE SICK COLLECTION REVEAL | Jeffree Star Cosmetics,,2018-01-26
14816,yN7N0P2TxHQ,2018-01-29,10.0,17:00:07,769375.0,43811.0,1811.0,5022.0,,Dangerous Night (Audio),Thirty Seconds To Mars,2018-01-25
14854,ycPdNnpVE08,2018-01-29,10.0,01:36:50,24187.0,18.0,7.0,26.0,,Elena Poulou makes excuses for Mark E Smith,Jiro Czech,2011-11-04
14963,yl2GaxVGUaI,2018-01-29,10.0,10:00:03,1602639.0,53712.0,782.0,1569.0,,Dreamer (Official Video) ft. Trevor Guthrie ft. Trevor Guthrie,Axwell /\ Ingrosso,2018-01-19
14880,ymrTNoGnP5Q,2018-01-29,24.0,14:07:34,130714.0,1114.0,56.0,142.0,Gap,Gap Logo Remix Collection (:60) - Full,,2018-01-24
14941,yo8cCV0_zCg,2018-01-29,24.0,20:00:03,31327.0,43.0,0.0,2.0,Radio Times,Maisie Williams is going to be Game of Thrones co-star Sophie Turner's bridesmaid!,,2018-01-21
14984,ypcmAXSKrLQ,2018-01-29,24.0,10:20:29,1019083.0,42406.0,654.0,1580.0,Mnet K-POP,[CHUNG HA - Roller Coaster] Comeback Stage | M COUNTDOWN 180118 EP.554,,2018-01-18
14946,zMLfhTnyPVs,2018-01-29,1.0,15:23:27,39117.0,423.0,59.0,167.0,kermodeandmayo,The Post reviewed by Mark Kermode,,2018-01-19
14800,zkG4Xpz6t68,2018-01-29,10.0,14:00:05,15924122.0,542010.0,98636.0,67599.0,,Trap (Official Video) ft. Maluma,Shakira,2018-01-26
