id,video_id,trending_date,category_id,publish_time,views,likes,dislikes,comment_count,Author,Title,Artist,publish_date
9432,qZwEZOuSEI8,2017-12-31,10.0,21:00:02,80756.0,6286.0,38.0,411.0,,Something Foreign ft. ScHoolboy Q,SiR,2017-12-27
9455,qdSUlpc67YM,2017-12-31,27.0,18:31:03,37749.0,1573.0,86.0,679.0,IDR Labs,Is Daisy Ridley Right That Calling Rey a Mary Sue Is Sexist?,,2017-02-07
9559,r9C7Grxk4bU,2017-12-31,25.0,06:08:33,215828.0,14396.0,4444.0,6571.0,The Amazing Lucas,Star Wars Last Jedi review rant!! WORST FILM OF 2017,,2017-12-16
9442,ryr75N0nki0,2017-12-31,10.0,03:30:08,13196225.0,624768.0,31912.0,58404.0,,Walk On Water (Official Video) ft. Beyoncé,Eminem,2017-12-24
9420,s9EE_r0WRMk,2017-12-31,26.0,17:00:11,252955.0,9917.0,195.0,462.0,Fleur DeForce,What I Got For CHRISTMAS! | Fleur De Force,,2017-12-27
9453,sXP6vliZIHI,2017-12-31,22.0,05:00:02,12368624.0,320814.0,17554.0,26772.0,Cardi B,Cardi B - Bartier Cardi (feat. 21 Savage) [Official Audio],,2017-12-22
9446,sm7_baYCIkQ,2017-12-31,10.0,12:32:39,2306134.0,109883.0,767.0,5792.0,,‘하루하루(HARU HARU)’ + ‘REALLY REALLY’ in 2017 SBS Gayodaejun,WINNER,2017-12-25
9489,sn_Sgcxg5PQ,2017-12-31,24.0,01:37:04,218759.0,3306.0,110.0,836.0,TrekGenius News ertainment,Seth macfarlane as teenager in star trek fan film with his friends,,2017-12-01
9490,szaJ5aW-LUs,2017-12-31,10.0,16:34:30,1649659.0,136018.0,1500.0,16525.0,,Feels Like Christmas,Panic! At The Disco,2017-12-20
9419,tAn7wxn2Atk,2017-12-31,24.0,11:55:39,764234.0,13347.0,1405.0,1896.0,TBS,Drop the Mic: Pentatonix vs Bell Biv Devoe - FULL BATTLE | TBS,,2017-12-27
9462,tLOl3s0uIM4,2017-12-31,10.0,05:00:03,9006878.0,218198.0,10744.0,9275.0,,"Bonita (Remix) ft. Nicky Jam, Wisin, Yandel, Ozuna","J Balvin, Jowell & Randy",2017-12-22
9527,tNoMQSvNAWE,2017-12-31,1.0,20:03:28,483317.0,29898.0,8428.0,16209.0,The Dishonoured Wolf,The Last Jedi: The Worst Star Wars Movie Ever Made,,2017-12-18
9569,u_OO9taOvG8,2017-12-31,10.0,05:00:02,583437.0,7491.0,232.0,1161.0,,Main Title and Escape (From Star Wars: The Last Jedi/Audio Only),John Williams,2017-12-15
9427,u_SA2QkZd24,2017-12-31,10.0,19:06:04,6952956.0,398593.0,7092.0,22175.0,,Havana (SING OFF vs. My Little Sister),Camila Cabello,2017-12-25
9441,wV8HedOp17k,2017-12-31,10.0,18:01:21,1139590.0,24997.0,1221.0,3369.0,,5 Star ft Nicki Minaj [Dedication 6] (WORLD PREMIERE!),Lil Wayne,2017-12-25
9581,wVy6mbSbbiA,2017-12-31,24.0,01:07:44,49766.0,2821.0,135.0,1457.0,Jody's Corner,Star Wars: The Last Jedi Epic Spoiler Rant!,,2017-12-16
9551,xa2LxGIQ1DQ,2017-12-31,25.0,13:32:22,75729.0,48.0,14.0,7.0,Latest News,Barack Obama jokes with Prince Harry in sneak preview,,2017-12-17
9411,xmMxtSwTwwQ,2017-12-31,22.0,10:14:09,9177.0,990.0,36.0,172.0,justkissmyfrog,Chuck out your clothes with me. (COUCWM?),,2017-12-30
9523,y-CvcTfcllk,2017-12-31,10.0,15:00:28,382054.0,14638.0,799.0,1010.0,,My Obsession,Pale Waves,2017-12-18
9417,yDo3Ketyb3w,2017-12-31,10.0,17:10:06,218019.0,5348.0,329.0,1239.0,,"Rockstar ft. T-Pain, Joey Bada$$ (Remix)",Post Malone,2017-12-28
9429,yJqsPBWbtjk,2017-12-31,24.0,18:28:32,1377564.0,28795.0,5299.0,12107.0,Doctor Who,SPOILERS! The Twelfth Doctor Regenerates – Peter Capaldi to Jodie Whittaker - Doctor Who - BBC,,2017-12-25
9487,ydPYNo8o-lI,2017-12-31,10.0,05:00:02,3088180.0,106250.0,2763.0,4705.0,,Thunder / Young Dumb & Broke (Medley/Audio),"Imagine Dragons, Khalid",2017-12-20
9511,yjV4PIDJVHg,2017-12-31,25.0,14:10:02,496180.0,3950.0,658.0,1785.0,CBS This Morning,Christian Bale talks Hostiles and his new look,,2017-12-18
9396,zUelEgXDHa8,2017-12-31,23.0,19:17:47,1033657.0,69087.0,507.0,34706.0,jacksfilms,THE WORST GIFTS OF 2017 (YIAY #389),,2017-12-29
9547,zXHUHx4R9kI,2017-12-31,10.0,05:00:05,3567394.0,141424.0,6090.0,8953.0,,George Jeff,Jaden Smith,2017-12-15
9407,zbyu6MOzpLE,2017-12-31,10.0,15:00:03,1615084.0,142338.0,2064.0,4985.0,,Us The Duo,Top Hits of 2017 in 4 minutes,2017-12-28
9472,zi_6oaQyckM,2017-12-31,10.0,03:00:02,7043078.0,356971.0,18858.0,22134.0,,TWICE Merry & Happy M/V,jypentertainment,2017-12-22
