id,video_id,trending_date,category_id,publish_time,views,likes,dislikes,comment_count,Author,Title,Artist,publish_date
1498,rvkm8DPbWgc,2017-11-21,23.0,14:43:47,313801.0,1892.0,558.0,1386.0,Listen to this also,Marc Maron on the Louis C.K Allegations (11/13/2017),,2017-11-13
1412,rx2qG_YMrDs,2017-11-21,17.0,18:39:01,52326.0,293.0,15.0,63.0,EmiratesTeamNZ,The America's Cup AC75 boat concept revealed.,,2017-11-20
1588,sECcOTO8Ij4,2017-11-21,20.0,22:00:01,1146409.0,38902.0,619.0,6794.0,GameGrumps,Sonic Forces: The New Chick - PART 1 - Game Grumps,,2017-11-07
1569,ssbOzbL1SJQ,2017-11-21,24.0,23:13:33,244828.0,1967.0,100.0,447.0,MovieAccessTrailers,JUSTICE LEAGUE Movie Clip Aquaman Island + Trailer NEW (2017) Batman Superman Superhero Movie HD,,2017-11-10
1442,svZScJMh4Pg,2017-11-21,10.0,17:02:13,666698.0,41693.0,697.0,2692.0,,Golden Slumbers,Dua Lipa,2017-11-16
1525,tjVJgR4OrgM,2017-11-21,25.0,07:05:37,151119.0,1422.0,60.0,271.0,President Trump,"President Trump ASEAN Summit SPEECH With Duterte in Manila, Philippines 11/13/2017",,2017-11-13
1494,uN9zBcweN4M,2017-11-21,17.0,03:16:52,135183.0,1108.0,44.0,421.0,ESPN,NBA Countdown debates if Ben Simmons is the best all-around rookie ever | NBA Countdown | ESPN,,2017-11-16
1517,uXNIeQjav80,2017-11-21,24.0,09:00:04,55825.0,1733.0,77.0,147.0,Giovannasworld,John Lewis Christmas Advert 2017 | Reaction with Tom,,2017-11-13
1592,vHCvmZlC5jQ,2017-11-21,24.0,21:45:08,751858.0,0.0,0.0,0.0,Difficult Psycho,Every Kevin Spacey Joke from Difficult People,,2017-11-01
1483,vIVaLtJmyPs,2017-11-21,24.0,03:12:45,481389.0,29073.0,292.0,3447.0,WOWPresents,UNHhhh Ep 68: Goodbye Barbara w/ Trixie Mattel & Katya Zamolodchikova,,2017-11-14
1468,ve3oQBjcAGI,2017-11-21,1.0,17:00:07,2098612.0,52336.0,2839.0,10848.0,CinemaSins,Everything Wrong With Wonder Woman In 14 Minutes Or Less,,2017-11-14
1422,vzyENzPa370,2017-11-21,22.0,18:06:38,51587.0,4965.0,29.0,164.0,Hazel Hayes,WOULD YOU RATHER (with Jack Howard),,2017-11-18
1594,wjy9Jgnjv6U,2017-11-21,17.0,16:59:44,163639.0,5967.0,44.0,557.0,Global Mountain Bike Network,Neil and Blake Push A Fat Bike To Its Limits,,2017-11-08
1449,wsXxfgJZ4E4,2017-11-21,26.0,16:00:10,374603.0,11020.0,406.0,298.0,Tanya Burr,"ASOS UNBOXING HAUL, LESSONS & SUSHI",,2017-11-15
1475,xVp2opnGrEA,2017-11-21,25.0,14:36:02,181992.0,1997.0,136.0,375.0,TODAY,Gal Gadot Talks About New Movie 'Justice League' And Sexual Harassment In Hollywood | TODAY,,2017-11-15
1545,xg9ebVTL9yE,2017-11-21,10.0,05:00:06,334969.0,13207.0,166.0,766.0,,Way To Go,Empire Of The Sun,2017-11-10
1501,xzpQSINtLkw,2017-11-21,10.0,03:23:13,1019716.0,26673.0,662.0,1553.0,,"De música ligera (de SODA STEREO) // Estadio Unico, La Plata, Argentina (14.11.2017)",COLDPLAY,2017-11-15
1436,yxfZBun1uBU,2017-11-21,24.0,14:04:01,2713024.0,29873.0,1519.0,1626.0,FilmSelect Trailer,DEADPOOL 2 Teaser Trailer (2018),,2017-11-15
1597,z4bLKt9k5dk,2017-11-21,24.0,12:00:04,1152016.0,25612.0,678.0,3920.0,BBC Three,Things Not To Say To Someone With Vitiligo,,2017-11-07
1549,z7VBtM7clT4,2017-11-21,24.0,15:05:03,172135.0,2089.0,49.0,228.0,MTV International,Justice League Movie Cast Reveal Funniest Moments Together | MTV Movies,,2017-11-09
1513,zpgn8U5Ug8M,2017-11-21,20.0,00:00:19,92768.0,1302.0,103.0,265.0,IGN,Sky: 6 Minutes of Journey Creator's New Game - IGN First,,2017-11-15
