id,video_id,trending_date,category_id,publish_time,views,likes,dislikes,comment_count,Author,Title,Artist,publish_date
11290,-3VBPAZPTQI,2018-01-09,22.0,15:11:23,384800.0,15584.0,303.0,850.0,Jamie Genevieve,NEW YEAR'S EVE MAKEUP TUTORIAL | JAMIE GENEVIEVE,,2017-12-29
11239,-xxfT301Ii8,2018-01-09,22.0,22:39:56,670693.0,7406.0,498.0,1751.0,PowerfulJRE,JRE MMA Show #9 with Jeff Novitzky,,2018-01-03
11321,-z2EqJTyAiU,2018-01-09,1.0,17:00:13,1669427.0,59998.0,830.0,2619.0,Dimitri Vegas & Like Mike,Dimitri Vegas & Like Mike vs Steve Aoki ft Abigail Breslin – We Are Legend,,2017-12-26
11351,0gv90B5DIPo,2018-01-09,24.0,22:20:03,130918.0,1636.0,365.0,1785.0,Hybrid Network,George Lucas Being Blamed for The Last Jedi Backlash,,2017-12-22
11254,12B8DNBoYRA,2018-01-09,10.0,17:07:18,97650.0,1974.0,111.0,931.0,,Murda Gram (Uncle Murda Diss),Mad Skillz,2018-01-03
11236,18thGW1YjRM,2018-01-09,24.0,20:10:31,240291.0,2187.0,188.0,0.0,Emmerdale,Emmerdale - The New Adam Barton,,2018-01-02
11338,1Wo6WEBhBBw,2018-01-09,25.0,14:08:40,37743.0,1007.0,40.0,230.0,South Front,"Syrian War Report – December 25, 2017: Army Cuts Off Key Militant Supply Line In Beit Jinn Pocket",,2017-12-25
11224,24-AhdoN_Nk,2018-01-09,1.0,16:31:18,1235269.0,17175.0,4156.0,5209.0,Movieclips Trailers,Slender Man Trailer #1 (2018) | Movieclips Trailers,,2018-01-03
11340,2cosj7UeQoY,2018-01-09,10.0,09:01:53,183679.0,1709.0,526.0,644.0,,Cardi B talks on how she wanted to quit rapping when a famous rapper took her verse off his song,Emcee Rapology,2017-12-19
11317,2dls8iCoQTI,2018-01-09,26.0,17:00:00,964431.0,49534.0,1316.0,3629.0,marshmello,Cooking with Marshmello: How To Make Strawberry Santas (Christmas Edition),,2017-12-26
11214,2eoEctPNGNw,2018-01-09,17.0,04:14:04,499437.0,2456.0,152.0,307.0,Yarotska,Jimmy Ma SP 2018 US Nationals,,2018-01-05
11393,2pVHOaT9CZ4,2018-01-09,24.0,20:00:24,487769.0,14788.0,164.0,1019.0,WIRED,Sesame Street Puppeteers Explain How They Control Their Puppets | WIRED,,2017-12-18
11223,2rp_8lf-kik,2018-01-09,22.0,16:42:52,17180.0,374.0,21.0,142.0,CHANNEL90seconds newscom,"President Trump arrives at the White House from Camp David. Jan 7, 2018.",,2018-01-07
11203,31mjfjIkWiM,2018-01-09,22.0,17:00:01,120889.0,4335.0,104.0,311.0,Estée Lalonde,2017 BEAUTY FAVOURITES!,,2018-01-07
11335,3ATQvgkXT9E,2018-01-09,10.0,23:00:01,24689827.0,502678.0,60752.0,34749.0,,"Krippy Kush (Remix) ft. Bad Bunny, Rvssian","Farruko, Nicki Minaj, Travis Scott",2017-12-22
11251,3pxyo7eSknc,2018-01-09,26.0,10:00:00,127010.0,4500.0,102.0,212.0,Samantha Maria,"THE BEST OF THE BEST 🙌🏽 2017 | FASHION, BEAUTY, NETFLIX etc",,2018-01-03
11319,4JGWxG-vE24,2018-01-09,24.0,15:59:05,1134435.0,38345.0,2482.0,11734.0,REVOLT TV,Charlamagne Tha God & Joe Budden Present: This Year Was Dope/Trash 2017 (Full Episode),,2017-12-26
11355,4OiHwMtKwis,2018-01-09,10.0,22:00:08,557993.0,16913.0,1117.0,1654.0,,Walk On Water (Official Video Teaser),EminemMusic,2017-12-20
11205,5KKszaZ4uOw,2018-01-09,26.0,09:00:00,237292.0,12703.0,177.0,1771.0,Sprinkleofglitter,CHANGES | The Weekly #1,,2018-01-07
11380,5QpnRjXtm1A,2018-01-09,22.0,12:41:33,21071.0,334.0,81.0,30.0,St Wilfrid's Catholic School,St Wilfrid's Actually,,2017-12-20
11261,5zP4yWzb24M,2018-01-09,10.0,10:00:03,293572.0,3355.0,187.0,329.0,,Ed Sheeran – Layla with Jools Holland & His Rhythm & Blues Orchestra,BBC Music,2018-01-01
11295,61SWGdZ2p2M,2018-01-09,10.0,07:45:12,1090589.0,37639.0,1312.0,1878.0,,"Walk off the Earth (Ft. Jocelyn Alice, KRNFX, Sexy Sax Man) Camila Cabello Cover",Havana,2017-12-28
11248,6EHbZKLkeMg,2018-01-09,24.0,15:28:01,198076.0,1286.0,272.0,637.0,Breakfast Club Power 105.1 FM,Laura Govan Addresses Rumors Of Pregnancy & Affair With Vincent Herbert: He's So Not My Type,,2018-01-03
11278,6F5x2ArbQKU,2018-01-09,17.0,10:00:00,376146.0,16853.0,196.0,880.0,Nile Wilson,MY MUM TRIED GYMNASTICS! {Wipeout},,2017-12-30
11326,6eB_iBslIfE,2018-01-09,22.0,18:10:25,222659.0,708.0,106.0,0.0,My Brother's Keeper Alliance,We Are The Ones (:60) | MBK Alliance,,2017-12-24
11225,7Khl8D9RVvw,2018-01-09,24.0,14:00:01,3886949.0,50548.0,1303.0,1935.0,TheEllenShow,Khloe Kardashian Talks 'Surreal' First Pregnancy and Possible Marriage,,2018-01-04
11371,7cql4KuraEo,2018-01-09,25.0,04:30:01,182597.0,4252.0,4301.0,3976.0,The Young Turks,Are SJW's Ruining Star Wars?,,2017-12-21
11216,7dhRpJ9ydiw,2018-01-09,17.0,21:26:35,183637.0,1452.0,256.0,653.0,TMZSports,Tyron Woodley Is Caught Between Conor McGregor vs Khabib | The Hollywood Beatdown,,2018-01-05
11242,8A3ILTZaswo,2018-01-09,24.0,10:56:20,15475.0,213.0,10.0,0.0,Good Morning Britain,Recovering From an Acid Attack - 5 Years on | Good Morning Britain,,2018-01-04
11382,8HvwNOSnveE,2018-01-09,27.0,21:50:04,228667.0,7418.0,143.0,1112.0,PBS Space Time,Extinction by Gamma-Ray Burst | Space Time,,2017-12-20
11247,8KgiaRPxRnQ,2018-01-09,20.0,18:00:01,1316002.0,50126.0,1866.0,12664.0,PlayOverwatch,Developer Update | Happy New Year | Overwatch,,2018-01-02
11350,8LPVjHxXvJM,2018-01-09,23.0,05:25:00,12147267.0,242938.0,12796.0,25200.0,The Tonight Show Starring Jimmy Fallon,Jimmy Interviews Cardi B,,2017-12-21
11348,94oSf_56ilU,2018-01-09,17.0,05:07:03,139381.0,441.0,136.0,249.0,GINOBILEEEH,Inside the NBA | Charles Barkley thanks trump for the tax cut and says he’s buying a new Rolex 😂😂,,2017-12-22
11200,9Vb8tOUh2C4,2018-01-09,26.0,19:02:00,70842.0,2669.0,103.0,306.0,Inthefrow,BEST OF BEAUTY 2017 AND EVERYTHING ELSE IN BETWEEN | Inthefrow,,2018-01-07
11301,AGbuiYvynhY,2018-01-09,22.0,13:00:01,57229.0,1781.0,79.0,119.0,Megan Ellaby,WHAT I GOT FOR CHRISTMAS 2017 | Megan Ellaby,,2017-12-29
11359,AN3vM-T-lm0,2018-01-09,24.0,15:43:12,85153.0,1692.0,181.0,324.0,Ami Horowitz,Bernia'acs get burned by Republican Tax Plan,,2017-12-22
11270,AfC2pHj0VZA,2018-01-09,10.0,06:18:25,1071891.0,47402.0,420.0,3032.0,,'MIC Drop' Performance On Dick Clark’s New Year's Rockin' Eve with Ryan Seacrest 2018,BTS (방탄소년단),2018-01-01
11387,Bzu4G8uZs-4,2018-01-09,10.0,05:00:00,1617680.0,109650.0,1300.0,3718.0,,Wolves,"Selena Gomez, Marshmello",2017-12-20
11197,C2-Fm2vpEKA,2018-01-09,24.0,16:14:49,50729.0,2722.0,37.0,199.0,Carrie Hope Fletcher,Rainbow Cupcakes! ♥ Three Cheers For New years ♥ 8,,2018-01-08
11385,CYebJBcLZHA,2018-01-09,29.0,15:56:46,81616.0,5035.0,28.0,231.0,TEDx Talks,In Disaster There is Opportunity - Finding a Path Through Paralysis | Martyn Ashton | TEDxBristol,,2017-12-19
11231,D0aAYfRBVik,2018-01-09,10.0,18:00:00,1516733.0,57080.0,2603.0,3617.0,,Making Of “Hey Hey Hey” Music Video,Katy Perry,2018-01-04
11328,DD2snaPATbI,2018-01-09,23.0,21:13:11,137286.0,7951.0,419.0,2570.0,randytaylor69,Presents from Father Christmas,,2017-12-25
11347,DfYRIN3U3SU,2018-01-09,10.0,14:33:45,840784.0,5502.0,260.0,199.0,,November Rain Guns N' Roses,odontoscar1986,2013-07-09
11259,Dg--VBBuWhk,2018-01-09,20.0,05:17:55,296810.0,1350.0,717.0,642.0,Julius Caesar,BRITNEY SPEARS TOXIC NEW YEARS EVE PERFORMANCE 2017,,2018-01-01
11329,DrApVH3afMI,2018-01-09,22.0,20:21:57,1035503.0,123705.0,230.0,13469.0,danisnotinteresting,some bloopers from phil is not on fire 9,,2017-12-25
11199,E0yPapgxIgo,2018-01-09,26.0,17:18:22,27404.0,1061.0,41.0,73.0,Amelia Liana,2017 BEAUTY FAVOURITES! | Amelia Liana,,2018-01-08
11366,E60w-0q8Y0Y,2018-01-09,24.0,01:25:59,3192494.0,181943.0,9475.0,30.0,boogie2988,"It's true, wife and I are getting a divorce.  Here's whats next for us.",,2017-12-20
11240,E7kUmvDKFLk,2018-01-09,25.0,16:30:04,109997.0,1640.0,191.0,651.0,The View,Yara Shahidi Speaks Out On Protests In Iran | The View,,2018-01-03
11373,Ei6AtHXJ9dg,2018-01-09,23.0,16:00:40,163348.0,3175.0,36.0,191.0,PlayFunGamesPictures,Letterkenny New Season - Back to Chirpin',,2017-12-22
11296,FVjXoM4DjTU,2018-01-09,22.0,20:29:58,292676.0,13025.0,214.0,684.0,SprinkleofChatter,Christmas Day 2017!,,2017-12-28
11334,Ff7wbSwTuEk,2018-01-09,23.0,02:33:48,1734955.0,15476.0,1174.0,3573.0,Mark Sales,Rocket in the Sky plus Accident.,,2017-12-23
11249,FtB3YSdLQR4,2018-01-09,24.0,05:30:01,163472.0,1383.0,227.0,319.0,Desus & Mero,ESPN's Katie Nolan (Extended Cut),,2018-01-04
11221,G4MtkhJehhk,2018-01-09,10.0,18:09:44,2385120.0,116643.0,10903.0,14196.0,,Both Of Em (Official Music Video) | Danielle Bregoli,BHAD BHABIE,2018-01-04
11389,GLZZn7lCtcI,2018-01-09,17.0,20:43:52,83958.0,323.0,51.0,443.0,FightHype.com,FLOYD MAYWEATHER KILLS UFC TALK; DENIES DANA WHITE CLAIM: I'M NOT DOING IT,,2017-12-20
11362,GRwmtpr79qE,2018-01-09,22.0,03:50:46,1210049.0,22905.0,5733.0,13756.0,Kevin Smith,THE LAST JEDI - KEVIN SMITH'S REVIEW,,2017-12-21
11219,GfCqMv--ncA,2018-01-09,10.0,13:00:03,5263337.0,192996.0,3357.0,10721.0,,All The Stars (Audio),"Kendrick Lamar, SZA",2018-01-04
11357,HHauPi8CS4k,2018-01-09,15.0,23:00:00,252463.0,4618.0,434.0,663.0,The Dodo,Girl Cries Over Dog's New Haircut | The Dodo,,2017-12-21
11235,HQYl0PBFI3M,2018-01-09,26.0,14:37:41,83572.0,1501.0,86.0,112.0,coach,Selena Gomez for Coach Spring 2018,,2018-01-03
11255,HRstc9yxjBg,2018-01-09,24.0,03:00:01,83896.0,11544.0,50.0,510.0,infinitehome,인피니트(INFINITE) Tell Me Teaser #D-5. SUNGYEOL,,2018-01-03
11309,HZzeieUGyA4,2018-01-09,24.0,22:34:58,2030337.0,14835.0,541.0,270.0,Proximity,G-Eazy & Halsey - Him & I (Audiovista Remix),,2017-12-26
11237,HzILu6yyA20,2018-01-09,1.0,13:59:51,3689210.0,1836.0,216.0,673.0,MGM,Death Wish | Official Trailer 2,,2018-01-03
11245,I2eSx0sGReM,2018-01-09,20.0,11:55:47,73631.0,1489.0,98.0,197.0,LS,Shedding some light on Selfie as a person/player/teammate,,2018-01-04
11298,IFE_dep7_zI,2018-01-09,26.0,18:24:02,78864.0,2328.0,146.0,145.0,HelloOctoberxo,WHAT I WORE THIS MONTH: DECEMBER | Hello October,,2017-12-29
11388,INRXOIgmNUU,2018-01-09,22.0,19:49:41,26951.0,2360.0,11.0,67.0,Daniel J. Layton,A Festive Effortless Chat with TimH - COLLABMAS DAY 10!,,2017-12-20
11268,IXNrHusLXoM,2018-01-09,10.0,11:00:07,3330651.0,98698.0,1947.0,3362.0,,Friend Of Mine (Original Video) ft. Vargas & Lagola,Avicii,2017-12-31
11217,IpjK885tG2c,2018-01-09,24.0,15:59:51,492450.0,4697.0,158.0,273.0,E! Entertainment,KUWTK | Kris Jenner Slips Tracking Device in Mom's Shoes | E!,,2018-01-05
11343,ItL6vcUrpUs,2018-01-09,10.0,17:00:20,6164967.0,160541.0,4038.0,4972.0,,CORNER STORE (Official Music Video),MACKLEMORE FEAT DAVE B & TRAVIS THOMPSON,2017-12-21
11283,KB_GCuJwPE4,2018-01-09,22.0,22:21:12,570480.0,13413.0,1951.0,1826.0,iJustine,"iMac Pro, New Apple Store and Star Wars!",,2017-12-29
11227,KQT32vW61eI,2018-01-09,10.0,15:00:48,375663.0,15122.0,343.0,952.0,,“Mystery of Love” by Sufjan Stevens from the Call Me By Your Name Soundtrack,Pitchfork,2018-01-04
11369,LPsRp7uUXUk,2018-01-09,25.0,19:27:36,768222.0,44493.0,4753.0,16642.0,Sargon of Akkad,Gender Wars: The Last Snowflake,,2017-12-20
11320,Lfy5Esue_ls,2018-01-09,22.0,00:45:37,106355.0,368.0,11.0,133.0,Voca Productions,Opening Cantina Scene [1080p],,2016-12-19
11339,LmOPXhFensg,2018-01-09,1.0,19:12:09,1820239.0,34597.0,571.0,2803.0,FXitinPost,STAR WARS - Sc.38 Reimagined (Unofficial Short Scene) Teaser Trailer,,2017-12-22
11210,LsoLEjrDogU,2018-01-09,10.0,04:49:43,43067983.0,1717176.0,61567.0,123379.0,,Finesse (Remix) [Feat. Cardi B] [Official Video],Bruno Mars,2018-01-04
11280,Lu7a7zKbJo0,2018-01-09,10.0,15:59:08,617440.0,24508.0,574.0,949.0,,Him & I (RMND Remix),G-Eazy & Halsey,2017-12-30
11220,LxIBv_XS3ls,2018-01-09,1.0,15:00:01,45291.0,2937.0,36.0,390.0,Jack's Movie Reviews,Blade Runner 2049 - The Evolution of Humanity,,2018-01-06
11376,MFWF9dU5Zc0,2018-01-09,24.0,12:00:02,10031591.0,94720.0,51602.0,33030.0,Warner Bros. Pictures,OCEAN'S 8 - Official 1st Trailer,,2017-12-19
11284,MnpB1X5VbOQ,2018-01-09,24.0,16:00:03,333263.0,5930.0,52.0,301.0,The Graham Norton Show,Gary Oldman as Winston Churchill Dancing as James Brown! | The Graham Norton Show,,2017-12-29
11386,NBkC83-vh9A,2018-01-09,24.0,14:16:34,434081.0,4163.0,146.0,697.0,FilmSelect Trailer,SICARIO 2: SOLDADO Trailer (2018),,2017-12-19
11213,NJAtY43vsl8,2018-01-09,24.0,05:39:51,2985521.0,37345.0,2946.0,2451.0,Jimmy Kimmel Live,Khloé Kardashian Reveals Pregnancy & Delivery Details,,2018-01-05
11232,NXNM0dTzHOE,2018-01-09,10.0,04:45:17,218519.0,1259.0,25.0,219.0,,Heavy D & the Boyz,In Living Color Main Title (Season 1 Theme),2011-11-09
11314,NsGrfU5buKc,2018-01-09,24.0,17:00:02,882735.0,21932.0,572.0,3303.0,VICE,The Story of 'Sandstorm' by Darude,,2017-12-26
11302,NzrQg6TMd6c,2018-01-09,10.0,08:00:03,543049.0,4924.0,144.0,77.0,,Written in the Sand,Old Dominion,2017-12-18
11209,OPtomB--3Ss,2018-01-09,15.0,23:03:40,306433.0,16330.0,194.0,1387.0,Cole and Marmalade,What Cat People Do When It's Cold Outside,,2018-01-05
11322,Oa9c9JBBGxM,2018-01-09,1.0,15:28:31,41438.0,635.0,3.0,259.0,Benatos,Blade Runner 2049 - Memory Facility Scene [HD],,2017-12-27
11208,PC1iHFQ0zEk,2018-01-09,24.0,16:43:14,382791.0,22881.0,680.0,3359.0,Daz Games,Daz Watches Worst Kickstarters #9,,2018-01-05
11293,PJ-b7o6RFCE,2018-01-09,15.0,10:00:01,45223.0,1223.0,29.0,80.0,BBC Earth,Silverback gorilla climbing fail - Gorilla Family and Me- BBC Earth,,2017-12-31
11273,PjqKPHZJgF0,2018-01-09,10.0,22:59:01,6869274.0,135687.0,7555.0,16778.0,,Family Feud feat. Drake (Official Audio) | Dedication 6,Lil Wayne,2017-12-29
11305,Q48VduIflPk,2018-01-09,10.0,09:00:02,3496948.0,394731.0,1031.0,24442.0,,[STATION] SMTOWN 'Dear My Family (Live Concert Ver.)' MV,SMTOWN,2017-12-29
11361,Q4nc8Ky94IA,2018-01-09,26.0,13:30:17,75449.0,1103.0,255.0,435.0,Electric Mountain Bike Network,EMBN: E Mountain Bike Channel Preview,,2017-12-22
11266,QRl9IO2ORGE,2018-01-09,22.0,07:31:05,104235.0,13220.0,70.0,671.0,CatCreature,The First Day of the Year.,,2018-01-02
11230,QwZT7T-TXT0,2018-01-09,24.0,16:42:21,37539570.0,1402579.0,1674420.0,1361580.0,Logan Paul Vlogs,So Sorry.,,2018-01-02
11345,R8QfoQYUsek,2018-01-09,24.0,14:00:02,86092.0,2525.0,45.0,604.0,VH1,Meet the Cast: Amara La Negra Reps for the Afro-Latinas | Love & Hip Hop: Miami,,2017-12-24
11318,REbjfHF0N0s,2018-01-09,10.0,12:00:01,1671033.0,94338.0,735.0,3020.0,,Meng Jia & Jackson Wang (孟佳 & 王嘉尔）- MOOD Official Music Video,Banana Culture Music,2017-12-27
11365,RHUxyXZBXY8,2018-01-09,10.0,11:00:01,4083066.0,87439.0,3308.0,6523.0,,Stir Fry (Audio),Migos,2017-12-20
11370,RlSzahonkTk,2018-01-09,10.0,16:00:03,2537478.0,157779.0,1807.0,7820.0,,Nothing Else Matters (Glory Days Tour),Little Mix,2017-12-20
11253,RzK4sqmgimk,2018-01-09,22.0,17:56:07,214676.0,10683.0,69.0,362.0,Hazel Hayes,"Tipsy Talk with Anna Kendrick, Anna Camp and Brittany Snow",,2018-01-02
11243,S10azlzvS_8,2018-01-09,10.0,09:00:05,1823701.0,133401.0,1670.0,11241.0,,[MV] MAMAMOO (마마무) _ Paint Me (칠해줘),1theK (원더케이),2018-01-04
11207,SGuSLRZgr5U,2018-01-09,25.0,11:20:02,294657.0,1618.0,181.0,981.0,euronews (en français),France Gall a rejoint le paradis blanc,,2018-01-07
11383,T0_M3t3UVao,2018-01-09,20.0,19:01:08,87171.0,3202.0,108.0,340.0,Sanadsk,Bloodborne Cut Content ►HIDDEN CUT BOSSES WITH NEW GAMEPLAY (Part 3),,2017-12-21
11202,TM-gCW45YHc,2018-01-09,24.0,09:00:02,1044272.0,156209.0,472.0,20926.0,woolliment,인피니트(INFINITE) Tell Me Official MV,,2018-01-08
11263,TVARgV7H4xw,2018-01-09,10.0,12:22:11,793252.0,19313.0,716.0,2575.0,,Official Audio),Uncle Murda Rap Up 2017 (WSHH Exclusive,2018-01-01
11292,TwUaijHsNF0,2018-01-09,22.0,18:00:02,161170.0,6417.0,264.0,259.0,SACCONEJOLYs,how to win any argument with your parents,,2017-12-29
11282,UfR5dKcKJvY,2018-01-09,23.0,18:30:20,5412650.0,202229.0,20109.0,11859.0,Spying on Your Boyfriend,Lele Pons & Hannah Stocking,,2017-12-29
11330,UgolB_YLQGs,2018-01-09,22.0,13:00:36,196052.0,5088.0,195.0,306.0,Vogue,One Woman Gets 15 Cosmetic Procedures in 12 Months | Vogue,,2017-12-26
11215,VONVWm2X4JI,2018-01-09,10.0,16:55:41,43929.0,2563.0,50.0,279.0,,Feel The Love Go (Official Audio),Franz Ferdinand,2018-01-08
11281,VQhIUzPJi8o,2018-01-09,10.0,17:50:58,2659581.0,206990.0,2819.0,13968.0,,Never Be The Same,Camila Cabello,2017-12-29
11234,W5eoXXO9a4U,2018-01-09,25.0,20:44:42,63257.0,1038.0,255.0,1241.0,The White House,1/4/18: White House Press Briefing,,2018-01-04
11272,WAuSHwVwvzk,2018-01-09,10.0,05:43:11,96711.0,1456.0,38.0,89.0,,Love So Soft LIVE on New Years Rockin' Eve 2018!,Kelly Clarkson,2018-01-01
11279,X-QSZhh_YWg,2018-01-09,27.0,16:56:51,2022537.0,41672.0,3020.0,6905.0,RealLifeLore,Why We May Not Be Able to Visit Space in the Future,,2017-12-29
11288,X3o3Vol7a1o,2018-01-09,17.0,05:51:42,141353.0,2845.0,42.0,531.0,NBA,"Stephen Curry Returns with 38 Pts and 10 Threes | December 30, 2017",,2017-12-31
11360,X8sSXU-J8fI,2018-01-09,10.0,19:00:31,60426299.0,861376.0,50469.0,37921.0,,La Modelo Ft Cardi B ( Video Oficial ),Ozuna,2017-12-19
11212,XJiCE88hOmM,2018-01-09,24.0,08:35:00,791920.0,14116.0,338.0,1197.0,The Late Show with Stephen Colbert,Curtis '50 Cent' Jackson Teaches Stephen How To Beef,,2018-01-05
11374,XQ0sKCp_NZA,2018-01-09,24.0,21:31:00,515277.0,11019.0,122.0,389.0,Vanity Fair,Pitch Perfect 3 Cast Recaps The First Two Pitch Perfect Movies in 7 Minutes | Vanity Fair,,2017-12-21
11346,XcSMdhfKga4,2018-01-09,24.0,08:30:22,4299666.0,49146.0,4274.0,4461.0,Universal Pictures,Mamma Mia! Here We Go Again - Trailer,,2017-12-21
11312,XvondF0gfro,2018-01-09,24.0,14:00:04,1153728.0,43478.0,2698.0,10031.0,Jeremy Jahns,Top 10 BEST Movies 2017,,2017-12-26
11265,YfWSMMPnTiI,2018-01-09,24.0,16:00:02,308097.0,8087.0,357.0,893.0,Complex,How Timbaland Revolutionized R&B + Hip-Hop and then Reinvented Himself After Addiction | Blueprint,,2018-01-01
11258,ZdtobM01EHM,2018-01-09,10.0,05:00:03,313192.0,4092.0,116.0,128.0,,Eye 2 Eye (Audio) ft. Takeoff,"HUNCHO JACK, Travis Scott, Quavo",2017-12-29
11287,ZzO3DCW4LXw,2018-01-09,22.0,21:46:18,409369.0,10775.0,747.0,3770.0,Red boy,All 50+ times Mark Hamill tried to subtly warn us about last jedi/force awakens and bashed Disney,,2017-12-28
11354,_t0LX_Of33U,2018-01-09,10.0,23:16:01,1948688.0,173694.0,4325.0,14535.0,,FLOBOTS RESPOND TO LOGAN PAUL NO HANDLEBARS,Flobots,2017-12-20
11228,a3Iaia_MYPc,2018-01-09,15.0,21:10:08,25232.0,974.0,7.0,282.0,Xiedubbel,"Timo the Cat refuse to leave the bed (vocal, talkative) funny video",,2018-01-05
11353,aeMv9uKpAZg,2018-01-09,23.0,11:00:00,465374.0,8458.0,203.0,626.0,Late Night with Seth Meyers,Bitcoin Commercial: What Is It and How Does It Work?,,2017-12-22
11325,agmPDVtPEc8,2018-01-09,17.0,04:18:22,123686.0,2384.0,166.0,294.0,WWE,"Hideo Itami vs. Gentleman Jack Gallagher: WWE 205 Live, Dec. 26, 2017",,2017-12-27
11364,alRtHXnZMOI,2018-01-09,10.0,17:02:12,954825.0,4433.0,195.0,303.0,,The Ginger Ed Man,Spotify,2017-12-20
11363,ao7JzzfIqVE,2018-01-09,24.0,20:14:49,1881374.0,131005.0,3157.0,13157.0,Bobby Burns,My Conversation With Theorist Shane Dawson,,2017-12-20
11331,bi1wcqsFoCs,2018-01-09,24.0,16:03:21,283424.0,8499.0,2869.0,925.0,Screen Team,"CHRISTMAS Rewind 2017 ft. Jake Paul, Taylor Swift Despacito Bruno Mars Katy Perry",,2017-12-24
11327,c7gO55FhKUQ,2018-01-09,10.0,21:34:54,326656.0,20180.0,200.0,982.0,,WONDERFUL CHRISTMAS TIME,MAC DEMARCO,2017-12-25
11372,cIQKKzZtWwQ,2018-01-09,10.0,05:00:00,799725.0,8316.0,834.0,438.0,,Still The Same,Sugarland,2017-12-21
11341,cMD63TwzB1o,2018-01-09,10.0,05:00:01,6547510.0,155775.0,21352.0,22030.0,,The Weekend (Official Video),SZA,2017-12-22
11294,cQp_C_Zrc3U,2018-01-09,24.0,21:22:08,2942573.0,165354.0,1661.0,8748.0,KBS World TV,BTS Special / 방탄소년단 스페셜 [2017 KBS Song Festival | 2017 KBS 가요대축제 / 2017.12.29],,2017-12-29
11238,ciaSosapI5Q,2018-01-09,28.0,13:08:27,380668.0,10963.0,630.0,2345.0,secureteam10,SECRET Satellite To Speak With Unknown Group,,2018-01-03
11384,cntsqw7XOF0,2018-01-09,10.0,15:00:35,216848.0,7913.0,465.0,508.0,,Dashboard Confessional: We Fight [OFFICIAL VIDEO],Fueled By Ramen,2017-12-20
11332,csCCdQLqcVY,2018-01-09,24.0,13:28:05,2251589.0,83838.0,1798.0,4120.0,SBS Entertainment,"블랙핑크, 뜨거운 에너지로 재해석한 원더걸스의 ‘So Hot’ @2017 SBS 가요대전 1부 20171225",,2017-12-25
11262,cvvgmjAaMnY,2018-01-09,27.0,12:33:33,35331.0,2188.0,60.0,615.0,ThuleanPerspective,Varg's 1991 World View,,2018-01-03
11342,dCROpIx2s0g,2018-01-09,23.0,19:55:06,108299.0,2068.0,91.0,257.0,Sunset Television,Reggaeggs,,2010-05-19
\n,,,,,,,,,,,,
\nfrom Sunset Television Episode 5: Tropical,,,,,,,,,,,,
\nmore at http://www.sunsettelevision.com,,,,,,,,,,,,
11252,dbMtuJ1tZnc,2018-01-09,24.0,01:05:59,900285.0,18257.0,973.0,1459.0,matt,Karl Pilkington predicts Black Mirror (spoilers),,2018-01-01
11381,diOhJMLSCNw,2018-01-09,24.0,19:13:00,68887.0,4349.0,801.0,2976.0,John Campea,We Need To Talk About The Dark Side Of The Last Jedi Backlash - The John Campea Show,,2017-12-21
11275,eKHUU2NHP5U,2018-01-09,20.0,23:13:26,428297.0,1487.0,60.0,158.0,Jonas Neubauer,Accidental 300k World Record,,2017-12-30
11377,ebzooSdAbGE,2018-01-09,25.0,15:38:24,74643.0,4919.0,68.0,311.0,Lord Buckethead,A Bucketful of Happiness,,2017-12-20
11241,f2rWMFf-pUM,2018-01-09,24.0,00:42:30,239021.0,1535.0,503.0,245.0,The Four,Sneak Peek: Fight To Defend Your Spot | Season 1 | THE FOUR,,2018-01-04
11285,f6Egj7ncOi8,2018-01-09,26.0,22:23:18,4137052.0,332117.0,2434.0,138816.0,NikkieTutorials,FULL FACE USING ONLY MY MOM'S MAKEUP Challenge | NikkieTutorials,,2017-12-29
11233,f7kPSYWU1JA,2018-01-09,24.0,12:40:32,129124.0,5077.0,100.0,128.0,FC Barcelona,[FULL STREAM] Open doors training session,,2018-01-05
11194,fN5HV79_8B8,2018-01-09,24.0,04:15:26,3189905.0,71364.0,7700.0,13578.0,NBC,Oprah Winfrey Receives Cecil B. de Mille Award at the 2018 Golden Globes,,2018-01-08
11206,gA-NDZb29I4,2018-01-09,10.0,05:00:01,14409910.0,247120.0,53803.0,30092.0,,Filthy (Official Video),Justin Timberlake,2018-01-05
11196,i6htP19PyEU,2018-01-09,22.0,00:18:35,56228.0,249.0,31.0,78.0,Broadcasting America,Sharon Stone 'interviews' Mariah Carey at 2018 Golden Globes Red Carpet,,2018-01-08
11269,iLZwZX39FXU,2018-01-09,17.0,08:09:48,4058954.0,9634.0,2284.0,3142.0,UFC ON FOX,Holly Holm vs Cris Cyborg | HIGHLIGHTS | UFC 219,,2017-12-31
11211,iRinktgcrcw,2018-01-09,24.0,14:06:29,468278.0,17994.0,299.0,3084.0,RedLetterMedia,Half in the Bag Episode 138: 2017 Movie Catch-up (part 1 of 2),,2018-01-06
11303,jTyx-Ep_LBg,2018-01-09,20.0,21:33:54,70303.0,1862.0,92.0,334.0,CryZENx,Unreal Engine 4 [4.18.1] Diddy Kong Racing 64 + Download link,,2017-12-30
11391,jbeEE0RaEeA,2018-01-09,20.0,08:34:27,25367.0,1068.0,101.0,850.0,Easy Allies,Spoiler Mode - Star Wars Episode VIII The Last Jedi,,2017-12-21
11222,k2NskGo6x40,2018-01-09,24.0,16:00:04,6062089.0,123467.0,26995.0,35574.0,TMZ,Danielle Bregoli Rejects Logan Paul's Apologies Over Suicide/Hanging Video | TMZ,,2018-01-03
11250,kQQZ2hje42E,2018-01-09,26.0,00:23:13,69048.0,295.0,378.0,255.0,Nathan C,Cooking With Your Mouth | Christmas Turkey,,2017-12-23
11379,k_JTFUEp7mw,2018-01-09,24.0,20:51:58,711324.0,9057.0,718.0,2012.0,Looper,The Reason Why Kylo Ren Was Shirtless In The Last Jedi,,2017-12-19
11226,kn073_61fpc,2018-01-09,26.0,21:27:50,237862.0,14859.0,317.0,1446.0,Patricia Bright,SOMETHING TO TELL YOU! TRUTHS I LEARNT IN 2017 ad,,2018-01-05
11299,lE2iJ7ftB_g,2018-01-09,17.0,22:43:14,59558.0,1844.0,21.0,303.0,NEW JAPAN PRO-WRESTLING,WRESTLE KINGDOM 12 Preview Show : Talking all about January 4th!,,2017-12-29
11286,lERhNXw6FaQ,2018-01-09,1.0,17:47:12,2095251.0,50584.0,1780.0,6467.0,CinemaSins,Everything Wrong With Despicable Me 3,,2017-12-28
11352,l_lblj8Cq0o,2018-01-09,10.0,20:00:05,71069947.0,895394.0,57096.0,49552.0,,"No Limit REMIX ft. A$AP Rocky, Cardi B, French Montana, Juicy J, Belly",G-Eazy,2017-12-19
11304,lojZXnH_978,2018-01-09,24.0,04:06:18,204417.0,10452.0,1093.0,2914.0,The Rageaholic,THE LAST JEDI Rant,,2017-12-28
11378,lwzfPL-rJqA,2018-01-09,24.0,03:31:17,1911317.0,55180.0,548.0,2208.0,The Voice,The Voice 2017 Brooke Simpson and Sia - Finale: Titanium,,2017-12-20
11218,mBrdEYW0Vno,2018-01-09,10.0,18:10:57,3976296.0,172739.0,2896.0,10518.0,,If You Leave Me Now (feat. Boyz II Men) [Official Audio],Charlie Puth,2018-01-04
11349,muYm5x8DyLA,2018-01-09,22.0,10:33:38,255936.0,11538.0,372.0,1656.0,Fah Q Bic,Cat Has War Flashbacks,,2017-07-09
11229,nFmSepfF48o,2018-01-09,24.0,16:36:58,19731524.0,1314421.0,83418.0,150716.0,PewDiePie,LOGAN PAUL,,2018-01-02
11297,nranUeNkXpM,2018-01-09,23.0,18:07:46,4136623.0,105250.0,6986.0,8600.0,Bad Lip Reading,CHRISTMAS IS HERE! — A Bad Lip Reading of Donald Trump,,2017-12-27
11392,nuKhpdLgR2U,2018-01-09,10.0,17:06:03,572015.0,10633.0,412.0,1406.0,,Once Upon A Time (Official Video),The Diplomats,2017-12-19
11276,nwv7rK2Zrx0,2018-01-09,24.0,05:09:04,19262.0,784.0,22.0,223.0,Swedish_Mate,Mister Metokur Asks a Dwarf Some Questions During Lauren Southerns Stream,,2017-11-28
11311,o31pGcwUmCM,2018-01-09,10.0,15:00:08,1514302.0,129686.0,429.0,8612.0,,HEAVEN,[SPECIAL VIDEO] NU'EST W(뉴이스트W) & SEVENTEEN(세븐틴),2017-12-28
11260,o3Fam8LqZjA,2018-01-09,17.0,18:00:05,52647.0,2627.0,33.0,498.0,Sam Pilgrim,THE FREE BIKE CHALLENGE - PART 3,,2018-01-02
11356,oGf4sf0yxI8,2018-01-09,27.0,06:28:51,77400.0,2441.0,73.0,200.0,SID M,Omae wa mo shinderu | The Last Jedi edition,,2017-12-19
11274,oj8JK6c5x3M,2018-01-09,24.0,01:41:45,120319.0,6246.0,129.0,1314.0,Red Carpet News TV,Anthony Mackie Explains Why Hollywood Movies Suck Now,,2017-10-31
11315,pYWUamYfN7c,2018-01-09,22.0,20:30:18,110172.0,9083.0,1047.0,2989.0,Alex Becker's Channel,Rian Johnson Destroyed Star Wars (Last Jedi Is Horrifying),,2017-12-27
11308,payPzC_QHRw,2018-01-09,17.0,00:50:24,711815.0,7692.0,319.0,3059.0,UFC - Ultimate Fighting Championship,UFC 219: Khabib Nurmagomedov - The Eagle is Hungry,,2017-12-28
11198,pwnsGOlcdvI,2018-01-09,26.0,17:00:04,116135.0,3685.0,127.0,198.0,Fleur DeForce,New In BEAUTY: January | Fleur De Force,,2018-01-07
11316,qZwEZOuSEI8,2018-01-09,10.0,21:00:02,218830.0,12418.0,94.0,554.0,,Something Foreign ft. ScHoolboy Q,SiR,2017-12-27
11336,qdSUlpc67YM,2018-01-09,27.0,18:31:03,55543.0,2429.0,126.0,962.0,IDR Labs,Is Daisy Ridley Right That Calling Rey a Mary Sue Is Sexist?,,2017-02-07
