id,video_id,trending_date,category_id,publish_time,views,likes,dislikes,comment_count,Artist,Title,Author,publish_date
16694,yKVAhDbSito,2018-02-07,26,17:48:13,3324416,209647,6466,48073,,BLOOD SUGAR ❤️ PALETTE & LOVE SICK COLLECTION REVEAL | Jeffree Star Cosmetics,jeffreestar,2018-01-26
16703,yN7N0P2TxHQ,2018-02-07,10,17:00:07,1651896,57118,2398,5351,Thirty Seconds To Mars,Dangerous Night (Audio),,2018-01-25
16684,yZhoHsgJlEo,2018-02-07,24,14:56:07,531421,27048,215,1853,,This is Amen by Rich Brian,88rising,2018-01-30
16763,yl2GaxVGUaI,2018-02-07,10,10:00:03,2621592,65880,963,1740,Axwell Λ Ingrosso,Dreamer (Official Video) feat. Trevor Guthrie,,2018-01-19
16734,ymrTNoGnP5Q,2018-02-07,24,14:07:34,196416,1850,92,203,,Gap Logo Remix Collection (:60) - Full,Gap,2018-01-24
16602,yzshoDMBkqE,2018-02-07,25,19:15:57,8476168,530021,21139,60126,,LOGAN PAUL RETURNS  📰 PEW NEWS📰,PewDiePie,2018-02-03
16773,z2GvJtzn41E,2018-02-07,10,17:00:05,3210484,58907,1028,835,"Cashmere Cat, Major Lazer, Tory Lanez",Miss You (Lyric Video),,2018-01-16
16592,zMV51hydg8E,2018-02-07,23,19:29:31,630917,42027,344,1133,,BEST FRIEND DOES MY ASOS SHOP,Mark Ferris,2018-02-05
16627,zUDcGDK_bRw,2018-02-07,15,19:09:26,668976,13062,1440,3542,,Black Cat Predicts Super Bowl 2018 WINNERS!,Cat Man Chris,2018-02-03
16691,zkG4Xpz6t68,2018-02-07,10,14:00:05,37927606,733053,137197,86897,Shakira,Trap (Official Video) ft. Maluma,,2018-01-26
