id,video_id,trending_date,category_id,publish_time,views,likes,dislikes,comment_count,Author,Title,Artist,publish_date
5431,qLVZiKDNxtw,2017-12-11,24.0,13:59:53,299564.0,2723.0,504.0,511.0,Watch What Happens Live with Andy Cohen,Is Sam Smith Team Kim Kardashian Or Team Taylor Swift? | Plead The Fifth | WWHL,,2017-12-06
5562,r5g85U5lJso,2017-12-11,10.0,11:00:08,1912518.0,39771.0,1626.0,1404.0,,Juice,Yo Gotti,2017-11-30
5541,r81egea0QPo,2017-12-11,1.0,18:30:38,10810.0,79.0,0.0,24.0,NanoO ARCHIVOS,Bohemian Rhapsody (2018) - Scene Bohemian Rhapsody Live AID,,2017-11-02
5410,r8FQ5wUYm9c,2017-12-11,23.0,06:00:01,2163052.0,80029.0,1171.0,4830.0,ExplosmEntertainment,Don't Talk - Cyanide & Happiness Shorts,,2017-12-07
5544,rCnU-IDcnnI,2017-12-11,24.0,15:01:47,6465509.0,296867.0,30579.0,36848.0,Baby Ariel,Baby Ariel - Aww [Official Video],,2017-12-01
5418,rEzEGto67Jw,2017-12-11,25.0,03:21:21,77040.0,906.0,267.0,386.0,Washington Post,Trump holds rally in Florida,,2017-12-09
5411,rXfnPGGfSh8,2017-12-11,10.0,08:00:05,47659.0,1299.0,48.0,239.0,,International Blue (Lyric Video),Manic Street Preachers,2017-12-08
5402,sZcuF1T4Vxw,2017-12-11,20.0,02:58:50,1170587.0,41167.0,681.0,5739.0,Fortnite,Fortnite Battle Royale - 50v50 Announce Trailer,,2017-12-08
5483,sjN-NGsRg9g,2017-12-11,10.0,15:00:48,2302545.0,129661.0,932.0,8213.0,,Linkin Park,Crawling (One More Light Live),2017-12-04
5538,tfaGleA4qYo,2017-12-11,25.0,21:17:17,1132918.0,8148.0,1675.0,1949.0,Inside Edition,See Meghan Markle on ‘90s Nickelodeon Show After Protesting Sexist Commercial,,2017-11-30
5407,tnCbI51JpAM,2017-12-11,20.0,07:55:02,573180.0,12563.0,2587.0,1038.0,PlayStation,PlayStation Presents - PSX 2017 Opening Celebration | English,,2017-12-09
5488,u5Jw7D-c3II,2017-12-11,10.0,14:00:49,149873.0,3374.0,85.0,201.0,,"Selena Gomez talks going on tour, Instagram plus more!",KISS FM UK,2017-12-05
5563,v1OhsiZjpww,2017-12-11,25.0,11:32:16,930351.0,2523.0,911.0,1.0,The Telegraph,'I have taken poison' claims war criminal,,2017-11-29
5555,vBuR-I4AT-o,2017-12-11,22.0,22:56:32,32109.0,194.0,18.0,49.0,WELLINGTON 51,"ENGLAND V BELGIUM - WORLD CUP 1990 - DAVID PLATT'S  GOAL - 26TH JUNE - BOLGNA, ITALY",,2015-12-15
5565,vPsic3dEndc,2017-12-11,22.0,11:34:30,1221.0,2.0,0.0,1.0,The 2Inch of Gnar,QUIZ : Name the Trail : A Christmas Cracker,,2017-12-01
5404,vW7H-DKivX8,2017-12-11,24.0,05:44:20,2424154.0,69744.0,1171.0,3310.0,The Late Late Show with James Corden,Take a Break: The Forum General Manager,,2017-12-08
5481,vgX5M1eVhyw,2017-12-11,26.0,17:01:10,34444.0,1143.0,28.0,93.0,Bon Appétit,Carla Makes Granola Cluster Cookies | From the Test Kitchen | Bon Appétit,,2017-12-06
5395,vn9mMeWcgoM,2017-12-11,24.0,01:44:25,29482615.0,502660.0,24723.0,64761.0,Universal Pictures,Jurassic World: Fallen Kingdom - Official Trailer [HD],,2017-12-08
5399,w4AImq08j9o,2017-12-11,23.0,17:18:56,11468018.0,721586.0,18756.0,74967.0,PewDiePie,Why I'm not in YouTube Rewind 2017,,2017-12-07
5449,wLZIWQnACjc,2017-12-11,23.0,06:09:48,147759.0,10787.0,56.0,521.0,The Tonight Show Starring Jimmy Fallon,Niall Horan: Too Much to Ask,,2017-12-08
5564,xXP9xBgTFv8,2017-12-11,10.0,07:07:51,3490163.0,92169.0,2375.0,7792.0,,YBN Nahmir x YBN Almighty Jay No Hook  (Prod by Hoodzone),Nahmir,2017-11-30
5570,y8dm1IbpMj4,2017-12-11,24.0,01:35:49,171744.0,646.0,583.0,40.0,Hasan Al-Jarrah,Jesse Lingard's INSANE solo Goal vs Watford,,2017-11-29
5478,zhbjf49Lv9o,2017-12-11,10.0,16:38:42,28480.0,1332.0,10.0,73.0,,Camila Cabello teases what to expect on her new album,SiriusXM,2017-12-07
5445,zslYmBRhdOM,2017-12-11,22.0,19:15:06,26787.0,2935.0,33.0,747.0,Jessica Kellgren-Fozard,It's Ok To Feel Sad At Christmas // Vlogmas Day 7,,2017-12-07
