id,video_id,trending_date,category_id,publish_time,views,likes,dislikes,comment_count,Artist,Title,Author,publish_date
16010,-BDImdAfodA,2018-02-04,10,08:59:34,694789,24490,897,2786,Kylie Minogue,Dancing (Official Video),,2018-02-01
16134,0GQmGOju6CE,2018-02-04,24,18:59:44,1138685,74715,846,12692,,THE GHOST IN MY HOUSE - Morgan Adams,Morgan Adams,2018-01-24
16007,0uJUW24505E,2018-02-04,10,20:30:00,567416,39951,368,3153,LIL SKIES,LETTUCE SANDWICH [OFFICIAL VIDEO] (Dir. by @NicholasJandora),,2018-02-01
16182,13434sOl4Zo,2018-02-04,15,11:31:32,77145,230,4,26,,Paul the pig clears his room,Nicolle von Eberkopf,2017-11-27
16150,1LWbRkt490A,2018-02-04,17,17:20:25,32095,314,22,41,,YEOVIL TOWN'S SONG - YEOVIL TRUE,Yeovil Town Football Club,2013-10-27
16116,3ChgRbqGi-E,2018-02-04,10,08:00:01,6323881,177999,2564,5021,Kygo,Stranger Things ft. OneRepublic,,2018-01-24
16103,3Haf2k6R8sI,2018-02-04,1,02:31:37,31112,500,30,67,,How Blockbuster Was Made #1: Blade Runner 2049 VFX by Dneg,CG Record,2018-01-29
16084,3QeRZj3LhS4,2018-02-04,24,13:44:59,156146,217,424,0,,The Coworker | #ThatsHarassment | Ad Council,Ad Council,2018-01-22
16096,48-pr5-G6Pw,2018-02-04,10,19:30:01,371658,11149,313,575,HAIM,Night So Long (Live At The Greek),,2018-01-26
16092,494VkPnSvJk,2018-02-04,26,18:30:01,535446,26305,244,3703,,BEST OF COLOURPOP | My Favorite Products - 2018,KathleenLights,2018-01-26
16167,4qOeuzeNfQ8,2018-02-04,10,00:15:48,106309,788,8,53,The FALL,'Rowche Rumble' - 1979 45rpm,,2011-03-01
16166,5-rHVxhQUJA,2018-02-04,10,08:42:59,9546,97,3,15,(R) The Fall,Bill is Dead,,2016-06-23
16098,51cbHTKdILA,2018-02-04,10,01:22:34,306136,24871,350,2049,DUA LIPA,NEW RULES (Leroy Sanchez LIVE Cover),,2018-01-27
16143,52L2HML5O1k,2018-02-04,24,20:00:01,330439,5111,371,949,,"The Last Jedi Novelization to Feature Deleted Scenes, Star Wars Day at Sea, and More!",Star Wars,2018-01-24
16186,5PI1xwT2-74,2018-02-04,24,00:04:19,31549,635,2,30,,Neil Gaiman presents lifetime achievement award to Ursula K. Le Guin at 2014 National Book Awards,NationalBook,2014-11-24
16140,5x-d3pabd5o,2018-02-04,10,00:20:02,5473359,136342,2668,4658,Jhené Aiko,Sativa ft. Rae Sremmurd,,2018-01-23
16054,61G3tDZQNhg,2018-02-04,17,04:58:52,2940988,28489,2545,6785,,"Ronda Rousey confronts Asuka, Alexa Bliss and Charlotte Flair: Royal Rumble 2018 (WWE Network)",WWE,2018-01-29
16132,6ZwXRnueOMg,2018-02-04,15,17:38:30,66434,3271,43,299,,9 SITUATIONS EVERY CAT OWNER WILL RECOGNIZE,smoothiethecat,2018-01-26
16013,80T59B2RVOo,2018-02-04,24,01:11:49,378314,21108,1026,3404,,The Nerd Crew - Solo: A Star Wars Story - Teaser Trailer Breakdown!!!,RedLetterMedia,2018-02-02
16111,8BAhwgjMvnM,2018-02-04,1,15:59:54,7531431,74942,6345,12959,,Pacific Rim Uprising - Official Trailer 2 [HD],Legendary,2018-01-24
16025,8_rTIAOohas,2018-02-04,24,13:55:41,8842980,284040,5096,24559,,Marvel Studios' Ant-Man and the Wasp - Official Trailer,Marvel Entertainment,2018-01-30
16028,8h7cnLWQKtM,2018-02-04,26,13:01:28,587429,10367,255,483,,My Houzz: Gordon Ramsay’s Surprise Renovation,HouzzTV,2018-01-30
16052,9StYOIBLanM,2018-02-04,24,07:34:36,61994,583,39,65,,Chris Stapleton Performs 'Drunkard's Prayer',The Late Show with Stephen Colbert,2018-01-31
16090,9f5zD7ZSNpQ,2018-02-04,10,16:00:01,3535079,172994,2442,7034,Kali Uchis,"After The Storm ft. Tyler, The Creator, Bootsy Collins",,2018-01-25
16135,9r6NI9m_IxM,2018-02-04,10,21:33:23,875339,2856,424,149,Elton John,Farewell Yellow Brick Road Tour: The Launch (VR180),,2018-01-24
16105,9vDdx1dba6c,2018-02-04,10,18:00:15,531424,61029,452,3990,dodie,Secret For The Mad,,2018-01-26
16177,ArVEH6KS6dA,2018-02-04,10,15:00:55,228361,12149,85,511,SZA: “Supermodel” Explained,The Process | GQ,,2018-01-23
16015,BJeCOo_CRyE,2018-02-04,10,17:30:02,1124612,90703,1006,5681,Charlie Puth (feat. Boyz II Men),If You Leave Me Now (Studio Session),,2018-02-01
16149,BVRvrvCQdmg,2018-02-04,20,19:00:01,283602,21064,181,1315,,SUPERMAN KID • Photoshop Battles,Cow Chop,2018-01-23
15992,C8dfiDeJeDU,2018-02-04,27,03:29:19,129804,13033,868,3374,,SOY BOYS: A MEASURED RESPONSE,hbomberguy,2018-02-03
16079,CWAX-tiepMo,2018-02-04,1,16:00:00,1411258,50544,2848,20421,,RWBY Volume 5: Chapter 14 - Haven's Fate | Rooster Teeth,Rooster Teeth,2018-01-27
16101,CZ7KRUYQyKE,2018-02-04,22,23:02:30,1622943,126564,2848,7598,,HE'S GONE....WE CANT BE WITHOUT HIM ANY LONGER 💔😔,The 2x Family,2018-01-26
16086,CfyMD5rSK50,2018-02-04,1,18:00:00,267928,16422,587,4220,,Why the Oscars Don't Get Animation - Especially Anime,Mother's Basement,2018-01-27
16088,D18e8aU-UWs,2018-02-04,10,14:44:02,5550812,131254,3021,7012,"Sia, David Guetta & Afrojack",Helium (Sia vs. David Guetta & Afrojack),,2018-01-25
16095,DlU4ZSU2xzg,2018-02-04,24,17:29:54,837483,2138,50,305,,READY PLAYER ONE - Change the World,Warner Bros. Pictures,2018-01-26
16057,E9za4QHGnqQ,2018-02-04,10,14:58:30,83696,3224,29,142,Diplo,Get It Right (Feat. Mø) (Behind The Scenes),,2018-01-30
15989,EFNeulNdfRI,2018-02-04,1,05:44:26,446705,4340,505,1978,,The Mooch | Real Time with Bill Maher (HBO),Real Time with Bill Maher,2018-02-03
16156,ERyfRmz0N-w,2018-02-04,23,03:52:25,526869,11453,1618,1731,,#ConanHaiti Preview: Haitians Roast Trump  - CONAN on TBS,Team Coco,2018-01-23
16041,EW3KD4kqqug,2018-02-04,29,16:39:00,236356,2366,482,1209,,Rose McGowan Talks Alleged Sexual Misconduct By Harvey Weinstein | The View,The View,2018-01-30
16004,EZOZ-XD5wmg,2018-02-04,22,19:00:03,279847,15615,183,2042,,SHOULD I HAVE A HOME BIRTH?,Jamie and Nikki,2018-02-01
16012,ElKPnh0Q8pU,2018-02-04,1,17:02:19,367491,18384,229,1094,,A Boogie Wit Da Hoodie - Somebody feat. Don Q [Official Music Video],A-Boogie Wit Da Hoodie,2018-02-01
16180,EsdjC5dsOTM,2018-02-04,17,13:02:49,909308,4683,190,1089,,Novak Djokovic v Hyeon Chung match highlights (4R) | Australian Open 2018,Australian Open TV,2018-01-22
16169,FB64ez0kf1c,2018-02-04,25,15:35:41,558002,2559,3015,1889,,Megyn Kelly: I Have No Regrets About My Question To Jane Fonda | Megyn Kelly TODAY,TODAY,2018-01-22
16030,FQUmz9QxtFc,2018-02-04,23,16:00:01,234252,10284,115,621,,Jack Whitehall Teaches His Dad About YouTube,Jack Whitehall,2018-01-30
16038,FTldNZ7V8ls,2018-02-04,23,03:55:27,169648,1231,435,244,,Jimmy Kimmel & Stormy Daniels Watch Trump’s State of the Union,Jimmy Kimmel Live,2018-01-31
16046,FtX7GY_iPok,2018-02-04,24,21:10:42,677161,8654,180,818,,The Voice 2018 - Never Underestimate the Power of Kelly Clarkson (Promo),The Voice,2018-01-29
16085,GJTtiYMdMtk,2018-02-04,10,08:00:00,1725477,36795,924,1194,"Mabel, Not3s",Fine Line (Official Video),,2018-01-25
16122,GWMKelv5Bmw,2018-02-04,23,20:00:02,2050532,70434,2635,5175,,MIRANDA vs. IPHONE X FACE ID,Colleen Ballinger,2018-01-24
16024,Gc71AmT_b2k,2018-02-04,10,14:00:01,771202,60728,388,4559,Bazzi,Mine (Official Video),,2018-01-31
16002,HEVonh8bjC0,2018-02-04,1,20:02:16,1054046,6662,1509,1571,,DISOBEDIENCE | Official Trailer | In theaters April 27,Bleecker Street,2018-02-01
16043,HI-mXMr8glQ,2018-02-04,10,04:00:00,8172920,233920,9573,21766,Migos,Stir Fry (Official),,2018-01-29
16110,HuJkBDBloa0,2018-02-04,24,01:00:01,444318,7022,1067,1819,,Jumanji! 1995 Vs 2017,WatchMojo.com,2018-01-25
16131,IIS1M7m9tw8,2018-02-04,22,22:10:48,645252,25582,2433,2730,,I have something to tell you..,Daisy Marquez,2018-01-25
16151,IVW7-k7pHE4,2018-02-04,10,16:14:29,74937,2218,45,161,Armin van Buuren,Armin VLOG #33: The Upside Down,,2018-01-25
16125,If75XsbYCZw,2018-02-04,1,01:42:01,175670,3831,1414,1918,,The LAST Last Jedi Debate - MOVIE FIGHTS!!,Screen Junkies,2018-01-26
16020,IkV5VpEROW0,2018-02-04,22,13:00:16,1162792,35515,770,2320,,73 Questions With Donatella Versace | Vogue,Vogue,2018-01-31
16011,JVDyowAzBrU,2018-02-04,10,17:25:58,4663475,428847,42094,55407,Pabllo Vittar,Então Vai (Feat. Diplo) (Videoclipe Oficial),,2018-02-02
16130,JWAvRIpuj1U,2018-02-04,17,20:30:17,141846,0,0,0,,Official XFL Announcement with Vince McMahon,Alpha Entertainment,2018-01-25
16108,JqIkzS2wSz8,2018-02-04,24,15:07:16,118911,4105,37,502,,'Call Me by Your Name' star Timothee Chalamet on the time he embarrassed himself with Saoirse Ronan,Popcorn with Peter Travers,2018-01-26
16183,JwfZqomlPsk,2018-02-04,20,18:02:51,54100,136,3780,745,,RollerCoaster Tycoon Start Engine Campaign,RollerCoaster Tycoon,2018-01-23
15991,K5xERXE7pxI,2018-02-04,10,05:00:01,4719578,237479,4230,17841,"The Weeknd, Kendrick Lamar",Pray For Me (Audio),,2018-02-02
16056,KBlmLfHSKFs,2018-02-04,15,07:00:01,289835,6373,293,653,,Inside the Mind of a Dog,Great Big Story,2018-01-29
16075,KIEVOMxKWxc,2018-02-04,20,16:00:52,421734,10863,387,1482,,Off Camera Secrets | Grand Theft Auto V - Boundary Break,Shesez,2018-01-28
16059,Kk4gQ3mVI4s,2018-02-04,25,19:38:53,61379,1126,170,888,,01/29/18: White House Press Briefing,The White House,2018-01-29
16055,L4KiF0gHpvU,2018-02-04,10,22:00:30,52994,4491,31,258,All Time Low,All Time Low: Drugs & Candy (LIVE),,2018-01-29
16021,LHUKKrcXfJs,2018-02-04,10,19:35:00,329012,9467,364,908,CHVRCHES,Get Out (Preview),,2018-01-31
16001,LxoGNkLpgZk,2018-02-04,10,05:00:01,1258116,75257,6685,9272,Iggy Azalea,Savior (Lyric Video) ft. Quavo,,2018-02-02
16051,M2zrC1QF7Zo,2018-02-04,10,03:00:02,933496,86752,313,4588,Jay Park (박재범) X Yultron (율트론),'Forget About Tomorrow'  [Official Music Video],,2018-01-30
16062,M3mJkSqZbX4,2018-02-04,10,03:07:01,5578495,62112,8151,4086,"Zedd, Maren Morris, Grey",The Middle (Official Music Video),,2018-01-29
16000,MEYmQlWBeAE,2018-02-04,10,17:29:13,2527820,107270,11404,16090,WORLDSTARHIPHOP,"Bhad Bhabie Hi Bich Remix Feat. Rich The Kid, Asian Doll & MadeinTYO (WSHH Exclusive)",,2018-02-01
16152,MUcBkpwnKcE,2018-02-04,24,15:00:01,2835507,20846,2375,5837,,"No Broken Bones, But Addicted To Wearing Casts! | My Strange Addiction",tlc uk,2018-01-22
16147,N0I2u6DKnwI,2018-02-04,10,13:57:57,76997,662,17,72,The Fall,Victoria,,2015-12-09
16170,NHrwcQQ38bA,2018-02-04,17,16:00:56,1933460,47440,544,2228,,Candide Thovex - quattro 2,Candide Thovex,2018-01-22
16082,NfFlVcAW_PA,2018-02-04,24,23:30:04,79882,637,39,188,,"Beyonce hangs out with Mariah Carey, Normani Kordei, and Justine Skye at Jay Z's ROC NATION Brunch",M.C.rush,2018-01-27
16109,NqH0kLCm1cI,2018-02-04,22,02:20:24,64209,43,12,21,,thefiftyonefiftyvault.com trailer,Ethan Gracie,2018-01-24
16006,OunFUkc2JeY,2018-02-04,24,13:00:08,273701,532,43,70,,Chrissy Teigen On Khloe Kardashian And Kylie Jenner’s Pregnancies | WWHL,Watch What Happens Live with Andy Cohen,2018-02-02
16174,P1nCVWBTays,2018-02-04,10,08:00:03,155219,4485,50,623,The Voidz,Leave It In My Dreams (Audio),,2018-01-23
16138,PNsUgvkjviY,2018-02-04,10,00:00:37,147975,4986,105,427,Franz Ferdinand,Lazy Boy (Official Audio),,2018-01-25
16029,PUqi2P0ry6Y,2018-02-04,24,16:16:38,290725,4887,183,391,,SNL Host Natalie Portman Will Not Be Rushed,Saturday Night Live,2018-01-31
16106,PpElRBQ-yGc,2018-02-04,20,16:52:25,622158,35098,442,3501,,Melix Plays: JUMPSTART First Grade | 90s Games,Marzia,2018-01-25
16031,QNzzJzdgUto,2018-02-04,24,15:10:43,1164519,19080,557,1132,,DORITOS BLAZE vs. MTN DEW ICE | Super Bowl Commercial with Peter Dinklage and Morgan Freeman,Doritos®,2018-01-30
16068,QcFZLREWnBU,2018-02-04,10,21:03:31,43816,380,23,34,Primavera Sound,Primavera Sound 2018 Line-Up,,2018-01-28
16107,Qf24J2Twws4,2018-02-04,10,18:35:20,234013,17496,211,904,Troye Sivan My My My! Official Lyrics & Meaning,Verified,,2018-01-26
16114,QopkF3p9nBk,2018-02-04,17,21:21:46,66389,514,63,237,,Tyron Woodley Says Eagles Fans Are Out of Control! | The Hollywood Beatdown,TMZSports,2018-01-26
16154,R-lhShtMfvQ,2018-02-04,10,03:35:53,31077,541,2,27,Lorde,Run Away With Me (Carly Rae Jepsen's cover) FULL,,2018-01-25
16014,Rhnp3tMFaS0,2018-02-04,22,21:00:03,126888,8550,178,634,,MY MAKEOVER (GOODBYE TATTOOS),Helen Anderson,2018-02-01
16018,S3VZxB_iNoA,2018-02-04,17,15:24:01,1307263,15871,858,7413,,Stephen A. Smith sends warning to LeBron James about possibly joining Warriors | First Take | ESPN,ESPN,2018-02-01
15997,SDGHRQyZKes,2018-02-04,23,13:00:08,555554,13836,258,530,,Sam Smith Will Only Do Karaoke to Fifth Harmony,The Tonight Show Starring Jimmy Fallon,2018-02-02
16120,SJsvPv5Q_oY,2018-02-04,15,13:30:00,745198,38179,241,2339,,KITTEN and CAT,CatPusic,2018-01-26
16042,SPNsGbjXVwY,2018-02-04,10,20:08:30,83524,6300,76,428,Sam Tsui,TRUST (Official Music Video),,2018-01-30
16121,S_1SwS7Jj-Y,2018-02-04,24,18:00:05,507461,7275,303,618,,Path To The NFL Draft! Workout With Du'Vonta Lampkin,Verne Troyer,2018-01-24
16179,Sp81sTev4cw,2018-02-04,10,03:01:31,46940,395,7,48,The Fall,The Classical,,2014-02-02
16128,UCCcvxvwNVo,2018-02-04,24,15:28:52,23490,164,13,0,,Sir Elton John Is Ready to Retire From Touring but He's Going Out With a Bang! | Lorraine,Lorraine,2018-01-25
16064,UCKC-QVcVn0,2018-02-04,28,12:00:02,223794,14328,67,887,,The Engineering of the Drinking Bird,engineerguy,2018-01-30
16003,UImlvzT2hHQ,2018-02-04,26,17:08:23,43661,2465,17,230,,CHATTY EVERYDAY WINTER MAKEUP ROUTINE | I Covet Thee,I Covet Thee,2018-02-02
16063,UNhI8F-C89o,2018-02-04,24,22:39:57,50601,587,30,64,,Secrios meets Baneblade,LeeroyPlambeck,2015-05-19
16050,V69XYIRjKww,2018-02-04,24,18:49:51,6136028,664,81,140,,Tom Clancy’s Jack Ryan – Super Bowl Commercial [HD] | Prime Video,Prime Video,2018-01-30
16027,V6wWKNij_1M,2018-02-04,1,13:59:54,2215999,15041,639,1418,,Hereditary | Official Trailer HD | A24,A24,2018-01-30
16035,VXvu5rtJNd4,2018-02-04,24,19:16:52,55754,950,43,74,,The Crown | Growing Up Royal | Netflix,Netflix,2018-01-31
16100,WB8ozD7l02w,2018-02-04,20,00:50:20,801840,19468,908,225,,FIFA 18 - FUT Champions Cup Barcelona - Day 1,EA SPORTS FIFA,2018-01-27
16016,Wg-HTE1WbeI,2018-02-04,24,18:34:33,61849,2447,329,1608,,Facebook Removes Black Panther Sabotage Event - Movie Talk,ColliderVideos,2018-02-02
16168,WrcwcMIYpQg,2018-02-04,27,15:33:36,1134311,70843,442,5126,,FLOWER BOY: a conversation,"Tyler, The Creator",2018-01-22
16124,XIZmIl9SsXk,2018-02-04,22,02:00:01,707840,10721,1324,1206,,People Try The New Diet Coke Flavors,BuzzFeedVideo,2018-01-25
16048,XY8QQmFswmA,2018-02-04,20,15:00:17,45622,344,63,169,,Tekken Mobile - iOS/Android - Rodeo's journey (Character Reveal Trailer),BANDAI NAMCO Entertainment Europe,2018-01-31
16102,Xz3GEsF-VKA,2018-02-04,24,14:01:11,1605516,40067,845,0,,Pharrell Meets Ellen's Favorite Kid Trainer Demarjay,TheEllenShow,2018-01-25
16178,YNpCXG66_PA,2018-02-04,15,00:00:03,83417,1569,41,170,,We Share Our Home With 14 Bears | BEAST BUDDIES,Barcroft Animals,2018-01-23
16118,YWVylysTNIA,2018-02-04,15,22:55:42,114079,818,28,55,,German Shepherd being a great attack dog,Pomegranate Sunshine,2018-01-23
16060,ZurW-Uc6Lc0,2018-02-04,26,09:00:03,564947,23238,476,2897,,HORMONES | The Weekly #4 | LIFESTYLE,Sprinkleofglitter,2018-01-28
16097,Zy6nbhUW_5E,2018-02-04,26,16:00:04,325784,14057,467,267,,Baking Snickers Salted Caramel Cookies | Tanya Burr,Tanya Burr,2018-01-26
15995,_J7dEhYttbQ,2018-02-04,26,18:02:13,772525,35911,803,4602,,My children don't exist.,Hobbie Stuart,2018-02-01
15996,_Oht6ZNXx7I,2018-02-04,24,06:30:19,455838,12539,198,516,,James Corden's Parents Take Over the GRAMMY Awards,The Late Late Show with James Corden,2018-02-02
16026,__1SjDrSMik,2018-02-04,22,22:00:15,1458382,148645,1934,9060,,maybe i could eat blades of grass,bill wurtz,2018-01-30
16119,_gRC4L6lNoc,2018-02-04,20,16:00:36,78601,4587,95,2821,,A Critique of Star Wars: The Last Jedi - Part 2,MauLer,2018-01-26
16153,a0_QIfAT9tA,2018-02-04,17,05:20:52,77043,1324,15,94,,Shareef O'Neal Hits GAME WINNER! Shaq's Son TAKES OVER On Jordan Brand Court!,Overtime,2018-01-26
16076,agGa4wRid2A,2018-02-04,17,04:40:53,80408,844,22,67,,Donald Glover is Still Retiring Childish Gambino,Variety,2018-01-29
16112,akNs04ef_Co,2018-02-04,26,20:46:40,830186,117494,631,9263,,I Read A Letter From My Younger Self,AmazingPhil,2018-01-25
16126,bYXM3uz1bjM,2018-02-04,10,00:00:01,572945,13836,908,1023,James Blake,If The Car Beside You Moves Ahead (Official video),,2018-01-26
15999,baj6llvgpWA,2018-02-04,10,05:00:00,3294622,95597,6581,7081,Justin Timberlake,Man of the Woods (Official Video),,2018-02-02
16061,c1cvDqM_CMg,2018-02-04,10,13:24:09,58889,2175,33,199,Chromeo,Bedroom Calling (feat. The-Dream),,2018-01-29
16077,c8ngetsBSGk,2018-02-04,24,21:13:39,130239,1936,66,340,,"Lil Uzi Vert Talks Kanye West, DJ Drama, & Seeing the ‘Old People’ At The Grammys | GRAMMYs 2018",MTV News,2018-01-29
16067,cZV6ebHoJ08,2018-02-04,23,01:19:40,48660,1126,49,192,,Old Spice,Red Sweater,2018-01-29
16142,caCdf94Blfw,2018-02-04,1,14:53:48,1644060,20366,5208,8756,,Oscars 2018: Nominations Announcement,Oscars,2018-01-23
16158,cdO78z5_jhQ,2018-02-04,26,10:00:05,98738,4299,157,403,,"GIRL TALK W/ TASHA GREEN | Racial Identity, Making friends & Music",Samantha Maria,2018-01-24
16144,ceyU5UBumLU,2018-02-04,22,21:53:45,5936220,208930,50863,29013,,"YouTube, Let’s Talk About Brother Logan Paul..",Jake Paul,2018-01-22
16171,d3h_uD-5d7A,2018-02-04,26,16:39:04,1086491,56728,1747,491,,Best of Beauty 2017 | Zoella,Zoella,2018-01-22
16136,d9aIHhsjupk,2018-02-04,22,22:43:50,48173,75,3,2,,"Devil's Advocate Milton, Craig, Kevin vs Eddie",Da Nabz,2014-11-18
16022,dfeEwt5_jsQ,2018-02-04,10,09:00:05,970997,149088,463,8237,SMTOWN,HENRY 헨리 'Monster' MV (English Ver.),,2018-02-02
16044,dtdT-ZHCBw0,2018-02-04,22,12:11:52,20567,64,13,10,,Father John Misty Belatedly Accepts Grammy at Sydney Show,t.price89,2018-01-31
16162,e2ExvdtmIyU,2018-02-04,24,13:48:31,424049,2811,6115,5368,,The Breakfast Club Addresses Backlash After Amara La Negra Interview,Breakfast Club Power 105.1 FM,2018-01-23
16104,eEDZuFw34YM,2018-02-04,28,17:00:04,1454742,32155,1107,2060,,What If Your Airplane Door Burst Open Mid-Flight?,AsapSCIENCE,2018-01-25
16184,eQPoVNrCZTk,2018-02-04,10,02:18:41,18543,173,1,26,The Fall,Blindness (2005),,2017-05-25
15998,ev2RHDUkE4M,2018-02-04,24,08:43:12,92394,2174,26,201,,Jenna Fischer Discusses Her 'Office' Chemistry with John Krasinski,theoffcamerashow,2018-02-03
16117,ewm0y9nL--Q,2018-02-04,10,01:01:48,429734,56231,148,3860,bitter content,original song feat. Dom Fera || dodie,,2018-01-26
16133,f1xIeTCgoFk,2018-02-04,22,11:23:21,4522365,172539,2233,13477,,BLACKPINK - INTRO +  ‘마지막처럼 (AS IF IT’S YOUR LAST)’ in 2018 Seoul Music Awards,BLACKPINK,2018-01-25
16159,fW_SW-EwVRI,2018-02-04,10,11:00:19,63911,2772,52,231,The Wombats,Cheetah Tongue (Official video),,2018-01-24
16091,f_jTeuajas0,2018-02-04,1,18:13:40,1350298,17662,276,1902,,Andre The Giant Official Trailer (2018) | HBO,HBO,2018-01-26
16005,g0xVbwXs9jo,2018-02-04,26,02:36:58,224361,27593,118,3329,,HOW TO: YOUTUBE BEAUTY LIGHTING SECRETS | DESI PERKINS,Desi Perkins,2018-02-03
16070,g4Go-VIweZY,2018-02-04,26,09:30:00,88997,3893,212,519,,BOOK COVER REVEAL + JANUARY FAVOURITES  | Lily Pebbles,Lily Pebbles,2018-01-28
15994,gLOxQxMnEz8,2018-02-04,24,06:37:54,293208,14825,852,3354,,Bright: The Apotheosis of Lazy Worldbuilding | Video Essay,Lindsay Ellis,2018-02-02
16081,hROYRchrJkU,2018-02-04,22,18:34:35,26935,508,23,118,,President Trump participates in the swearing in ceremony for the Secretary of the Department of Heal,CHANNEL90seconds newscom,2018-01-29
16137,hph2mamrzfE,2018-02-04,22,17:00:11,436045,4308,206,659,,Faded - Kim Petras ft. Lil Aaron (Official Music Video),Kim Petras,2018-01-25
16032,hwnDMahSwNI,2018-02-04,25,05:19:12,356542,5349,4840,7945,,Joe Kennedy criticizes Trump in Democratic response,CNN,2018-01-31
16034,i7FgneNlM14,2018-02-04,17,04:20:20,1422574,613,832,936,,WEEI: Alex Reimer calls Tom Brady’s daughter an “Annoying Little Pissant” 1/25/18,Nick Ramos,2018-01-27
16176,ip_r4y-23JM,2018-02-04,22,18:03:01,45175,255,3,51,,The Fall Hip Priest,P23BenBousquet,2008-12-19
16045,izyX4qtsVew,2018-02-04,1,14:51:44,2004537,23830,956,985,,"WHEN WE FIRST MET Official Trailer (2018) Alexandra Daddario, Netflix Movie HD",ONE Media,2018-01-29
16080,jm_mZqqL40M,2018-02-04,1,18:53:29,112278,13628,79,440,,83. You + Me,Will Darbyshire,2018-01-28
16165,jrkhLuroyzg,2018-02-04,20,02:46:48,141035,1753,75,154,,2 Card Slay the Spire Run - Consistent Turn 1 Infinite Combo,RiskyCB,2018-01-25
16074,kKk6vEqFFOA,2018-02-04,24,05:15:52,86960,992,130,397,,BLACK PANTHER Movie Clip Killmonger Vs T'Challa + Trailer NEW (2018) Superhero Movie HD,MovieAccessTrailers,2018-01-30
16053,kVWj8lgQvsE,2018-02-04,24,15:00:03,482388,9474,243,352,,Fifth Harmony’s Ally Brooke is Selena AND J-Lo | Lip Sync Battle Preview,Lip Sync Battle,2018-01-29
16145,lYATz3STgew,2018-02-04,10,01:00:01,2897417,69826,2398,9600,Lil Wayne,Big Bad Wolf (Official Audio) D6 Reloaded,,2018-01-24
16093,lfIhBu0TZBs,2018-02-04,22,14:58:16,2591967,77317,7743,7670,,Moving on from Beme,CaseyNeistat,2018-01-25
16066,li6f_0x0IGE,2018-02-04,26,17:00:07,674664,42368,700,7271,,Meet My BABY GIRL! | Fleur De Force,Fleur DeForce,2018-01-28
16069,lpzJNwur6Zk,2018-02-04,10,09:00:04,2225192,108202,2684,7022,jypentertainment,SUZY (수지) 'HOLIDAY (Feat. DPR LIVE)' M/V,,2018-01-29
16160,m0HN1TB-Jcw,2018-02-04,22,08:16:31,11428,608,19,105,,THERAPY Q&A: UNDERSTANDING TRAUMA & EATING ISSUES | GRACE,Grace F Victory,2018-01-24
16089,mXfyOYAdCUc,2018-02-04,1,22:03:43,81175,16712,74,1568,,WHAT AM I?,KickThePj,2018-01-27
16072,nIPt7dJrSXw,2018-02-04,26,19:00:04,20752,1623,26,102,,HOW TO FIND THE PERFECT SUIT,Jim Chapman,2018-01-28
16164,nQ7mhC5_Rys,2018-02-04,28,00:12:02,58366,0,0,0,,Altwork 1 Minute Video,altwork,2017-01-21
16173,nrB7aqfRzyE,2018-02-04,1,07:23:29,652153,818,39,148,,Eagles Fan Gets Wrecked by Pole,494ta,2018-01-22
16008,nwPQVagUfrU,2018-02-04,26,18:30:02,139350,10372,118,1313,,"Depression, Me & Make-up #timetotalk",pixiwoo,2018-02-01
16127,oEtEBOy0ys8,2018-02-04,24,20:41:17,137988,11835,147,2426,,THINGS WE ALL DID IN BRITISH SECONDARY SCHOOL,Luke Birch,2018-01-25
16094,oWjxSkJpxFU,2018-02-04,29,18:30:01,26139495,2046571,535170,697724,,Suicide: Be Here Tomorrow.,Logan Paul Vlogs,2018-01-24
16172,p5HH2UfZ2wE,2018-02-04,15,17:11:43,747684,16859,210,1265,,DOG TRIES TO WAKE UP SLEEPING PIG,Newsflare,2018-01-23
16058,p5N6tFob_Rw,2018-02-04,23,18:00:10,1405238,87707,600,4789,,MY SKIN STORY,ThatcherJoe,2018-01-28
16157,p9zTSvEpt_8,2018-02-04,10,06:50:45,98710,612,12,136,georgegargan,Bill is Dead The Fall,,2007-06-25
15990,pisY6J2Ky6U,2018-02-04,24,22:00:04,1497616,69250,3058,6599,,ADULTS REACT TO KARMA IS A BITCH CHALLENGE,FBE,2018-02-02
16019,pj6k-EFxqAI,2018-02-04,10,17:00:04,3253121,137995,1451,4798,"Hailee Steinfeld, BloodPop®",Capital Letters,,2018-01-31
16087,pjTj-_55WZ8,2018-02-04,10,12:00:16,7290664,126621,1900,2012,Rudimental,"These Days feat. Jess Glynne, Macklemore & Dan Caplen [Official Video]",,2018-01-25
16073,pvxIoue1Qpw,2018-02-04,24,19:33:08,817879,7646,340,543,,Henry Cavill Channels His Inner Superman Against Tom Cruise | The Graham Norton Show,The Graham Norton Show,2018-01-26
16039,q2_8cSXTtDY,2018-02-04,24,20:02:41,76088,150,26,103,,Leah Labelle-You Keep Me Hanging On,Domeju,2017-06-29
16036,q57eQqq9-IA,2018-02-04,20,18:25:09,179285,7806,119,1400,,The Legend of Zelda: Breath of the Wild DLC Dev. Talk - ft. Mr. Aonuma & Mr. Fujibayashi,Nintendo,2018-01-31
16065,qtTM2YV3bI8,2018-02-04,10,23:41:31,26152606,958621,331033,250574,Lucas Lucco e Pabllo Vittar,Paraíso,,2018-01-28
16181,qxXZF60EPdM,2018-02-04,10,14:09:15,285687,3082,56,344,Hugh Masekela,Grazing In The Grass,,2014-06-07
16033,r5JK6eEHwIQ,2018-02-04,24,18:33:21,206314,1252,182,1774,,Glee Star Mark Salling Dead of Apparent Suicide | TMZ News,TMZ,2018-01-30
16037,rNYduKIyEvA,2018-02-04,10,19:41:24,4435534,189016,3128,11098,Logic,"1-800-273-8255 (LIVE From The 60th GRAMMYs ®) ft. Alessia Cara, Khalid",,2018-01-29
16155,rWHrWuDnReM,2018-02-04,24,15:41:38,829010,38300,3011,5764,,I'm Poppy - Trailer,Poppy,2018-01-22
16047,rog8VV2A2bY,2018-02-04,23,18:00:08,790915,38336,3674,12832,,I'M SO DONE - The Last Jedi Comment Comeback,I Hate Everything,2018-01-30
16123,sD9_l3oDOag,2018-02-04,10,05:00:01,28226581,386942,6833,14641,Sebastián Yatra,No Hay Nadie Más,,2018-01-26
16017,sJGgV3p8JzY,2018-02-04,10,15:00:04,1373502,119851,1234,7874,Grace VanderWaal,City Song,,2018-01-31
15993,tEnCoocmPQM,2018-02-04,10,15:00:03,2418179,202897,3134,11674,Halsey,Sorry,,2018-02-02
16161,tP_Dk81f9fg,2018-02-04,10,16:23:55,80779,339,2,25,Dav hum,Jeffrey Lewis The Legend of The Fall,,2007-03-05
16049,uNOJaKrNhc8,2018-02-04,25,17:50:12,39188,408,86,514,,FBI deputy Andrew McCabe quits after Trump criticism - BBC News,BBC News,2018-01-29
16113,utsPTIL0ACE,2018-02-04,24,12:00:08,84515,2387,90,526,,Blade Runner 2049 Director Answers 9 WTF Questions,IGN,2018-01-26
16009,v0TiqC_C8wI,2018-02-04,23,05:35:00,439626,8302,309,774,,Seth and Kelly Clarkson Go Day Drinking,Late Night with Seth Meyers,2018-02-02
16115,vecSVX1QYbQ,2018-02-04,10,09:00:03,11770157,537346,5697,61549,iKON,‘사랑을 했다(LOVE SCENARIO)’ M/V,,2018-01-25
16141,wdQeKqYrhjU,2018-02-04,10,22:14:40,7788135,68797,1780,2412,De La Ghetto,Se Que Quieres [Official Video],,2018-01-25
16023,wfWkmURBNv8,2018-02-04,10,15:00:05,48556248,857456,55233,42855,Ozuna x Romeo Santos,El Farsante Remix,,2018-01-30
16139,wqS9QwOIH3s,2018-02-04,26,22:00:05,241161,12196,120,471,,Natural Defined Instagram Makeup | Jessica Clements,Jessica Clements,2018-01-24
16163,wrpeEitIEpA,2018-02-04,1,17:05:24,2084639,64046,3336,4402,,Last Week Tonight: Season 5 Official Trailer (HBO),LastWeekTonight,2018-01-22
16040,x8DegXNFOns,2018-02-04,15,15:00:10,111787,2420,29,456,,What's Your Cat's Petting Style?,Cat Lessons,2017-07-29
16185,xJ7A_o2Toog,2018-02-04,1,08:42:00,49447,2193,85,520,,Mike Stoklasa: A Star Wars Story,plumwax,2018-01-24
16175,xPsEiZAOb_I,2018-02-04,24,17:09:00,314718,43254,417,2951,,GIVING AWAY MY YOUTUBE ADSENSE,Caspar,2018-01-22
16129,xVhnfTwh1OA,2018-02-04,24,04:42:38,14080921,368945,7869,28537,,YBN Nahmir - Bounce Out With That (Dir. by @_ColeBennett_),Cole Bennett,2018-01-24
16083,yKVAhDbSito,2018-02-04,26,17:48:13,3262521,208022,6420,47891,,BLOOD SUGAR ❤️ PALETTE & LOVE SICK COLLECTION REVEAL | Jeffree Star Cosmetics,jeffreestar,2018-01-26
