id,video_id,trending_date,category_id,publish_time,views,likes,dislikes,comment_count,Artist,Title,Author,publish_date
16099,yN7N0P2TxHQ,2018-02-04,10,17:00:07,1409544,54479,2287,5247,Thirty Seconds To Mars,Dangerous Night (Audio),,2018-01-25
16071,yZhoHsgJlEo,2018-02-04,24,14:56:07,477148,26618,186,1850,,This is Amen by Rich Brian,88rising,2018-01-30
16148,ycPdNnpVE08,2018-02-04,10,01:36:50,25518,20,7,26,Jiro Czech,Elena Poulou makes excuses for Mark E Smith,,2011-11-04
16146,ymrTNoGnP5Q,2018-02-04,24,14:07:34,184624,1653,80,186,,Gap Logo Remix Collection (:60) - Full,Gap,2018-01-24
15988,yzshoDMBkqE,2018-02-04,25,19:15:57,4132424,338297,10248,43904,,LOGAN PAUL RETURNS  📰 PEW NEWS📰,PewDiePie,2018-02-03
16078,zkG4Xpz6t68,2018-02-04,10,14:00:05,29740374,692008,130093,84886,Shakira,Trap (Official Video) ft. Maluma,,2018-01-26
