id,video_id,trending_date,category_id,publish_time,views,likes,dislikes,comment_count,Author,Title,Artist,publish_date
9575,--uXQQ0h-yQ,2017-12-31,24.0,17:59:52,28251.0,250.0,3.0,12.0,PonteFractus,Paul McCartney - Pipes of Peace,,2008-11-24
9397,-3VBPAZPTQI,2017-12-31,22.0,15:11:23,209192.0,11119.0,153.0,740.0,Jamie Genevieve,NEW YEAR'S EVE MAKEUP TUTORIAL | JAMIE GENEVIEVE,,2017-12-29
9531,-mZZAvIHMvQ,2017-12-31,24.0,17:00:00,1737367.0,67803.0,3131.0,38784.0,Star Wars Theory,What REALLY Happened to SNOKE in The Last Jedi (SPOILERS) - Star Wars Theory Explained,,2017-12-17
9438,-z2EqJTyAiU,2017-12-31,1.0,17:00:13,673897.0,44374.0,583.0,2401.0,Dimitri Vegas & Like Mike,Dimitri Vegas & Like Mike vs Steve Aoki ft Abigail Breslin – We Are Legend,,2017-12-26
9538,0VsgQmCPgoI,2017-12-31,22.0,17:30:01,96845.0,4325.0,77.0,445.0,Estée Lalonde,SURPRISE TRIP TO FINLAND!!,,2017-12-17
9583,0gLsukihjVg,2017-12-31,20.0,02:31:47,156882.0,9724.0,837.0,4016.0,Dash Star,It's time for the Jedi to end (I'm sorry),,2017-12-15
9464,0gv90B5DIPo,2017-12-31,24.0,22:20:03,114043.0,1470.0,318.0,1620.0,Hybrid Network,George Lucas Being Blamed for The Last Jedi Backlash,,2017-12-22
9450,1Wo6WEBhBBw,2017-12-31,25.0,14:08:40,36097.0,990.0,39.0,222.0,South Front,"Syrian War Report – December 25, 2017: Army Cuts Off Key Militant Supply Line In Beit Jinn Pocket",,2017-12-25
9579,2-bTbRjqjoE,2017-12-31,24.0,06:31:52,97678.0,2658.0,300.0,1492.0,Tyrone Magnus,Star Wars: The Last Jedi SPOILER TALK!!!,,2017-12-15
9537,21jcP-1w4DA,2017-12-31,26.0,09:30:01,118313.0,4044.0,210.0,159.0,Lily Pebbles,WHAT I GOT FOR MY BIRTHDAY | Lily Pebbles,,2017-12-17
9454,2cosj7UeQoY,2017-12-31,10.0,09:01:53,181316.0,1677.0,525.0,645.0,,Cardi B talks on how she wanted to quit rapping when a famous rapper took her verse off his song,Emcee Rapology,2017-12-19
9430,2dls8iCoQTI,2017-12-31,26.0,17:00:00,706985.0,43242.0,1145.0,3322.0,marshmello,Cooking with Marshmello: Strawberry Santas (Christmas Edition),,2017-12-26
9434,2m2HLU5uVwg,2017-12-31,25.0,14:03:17,220716.0,6627.0,3066.0,2110.0,The White House,President Donald J. Trump and First Lady Melania Trump's 2017 Christmas Message,,2017-12-25
9517,2pVHOaT9CZ4,2017-12-31,24.0,20:00:24,378477.0,12261.0,139.0,848.0,WIRED,Sesame Street Puppeteers Explain How They Control Their Puppets | WIRED,,2017-12-18
9451,3ATQvgkXT9E,2017-12-31,10.0,23:00:01,14437232.0,395207.0,47260.0,28929.0,,"Krippy Kush (Remix) ft. Bad Bunny, Rvssian","Farruko, Nicki Minaj, Travis Scott",2017-12-22
9584,3_keXD1yV3E,2017-12-31,26.0,17:05:04,75418.0,2191.0,64.0,160.0,Amelia Liana,EVENING SKINCARE ROUTINE WITH ESTÉE! | Vlogmas Day 13,,2017-12-14
9566,3a3vMfOCb3Q,2017-12-31,17.0,02:41:42,104151.0,828.0,133.0,272.0,CliveNBAParody,Lonzo Ball RUNS AWAY FROM LEBRON JAMES DUNK - LeBron James vs Lonzo Ball - Cavaliers vs Lakers,,2017-12-15
9518,3mUtNE82ZV4,2017-12-31,24.0,22:25:08,6182.0,53.0,28.0,32.0,BUILD Series,Christian Bale: Division Is Not The Way To Go,,2017-12-18
9428,4JGWxG-vE24,2017-12-31,24.0,15:59:05,977785.0,35465.0,2283.0,10885.0,Revolt TV,Charlamagne Tha God & Joe Budden Present: This Year Was Dope/Trash 2017 (Full Episode),,2017-12-26
9465,4OiHwMtKwis,2017-12-31,10.0,22:00:08,542000.0,16714.0,1110.0,1655.0,,Walk On Water (Official Video Teaser),EminemMusic,2017-12-20
9571,4W_YgNW7gs0,2017-12-31,10.0,17:59:06,1218932.0,63081.0,515.0,3395.0,,Linkin Park,Sharp Edges (One More Light Live),2017-12-14
9586,4cucHc2vef4,2017-12-31,10.0,01:59:49,1521891.0,54633.0,1021.0,4410.0,,BROCKHAMPTON,BOOGIE,2017-12-13
9521,4pq_VGpPooM,2017-12-31,20.0,08:06:02,267591.0,13807.0,1134.0,2509.0,xQcOW,Suspended: My apology,,2017-12-19
9452,59yWucSYhO0,2017-12-31,22.0,23:08:04,147187.0,2352.0,336.0,808.0,CHANNEL90seconds newscom,President Trump and First Lady Melania Trump participates in NORAD Santa Tracker phone calls. Dec 24,,2017-12-24
9495,5QpnRjXtm1A,2017-12-31,22.0,12:41:33,20316.0,329.0,81.0,30.0,St Wilfrid's Catholic School,St Wilfrid's Actually,,2017-12-20
9533,5uXsCaakZD8,2017-12-31,24.0,20:00:37,4862526.0,394157.0,17991.0,38282.0,h3h3Productions,It's Time To Stop Ajit Pai,,2017-12-16
9415,61SWGdZ2p2M,2017-12-31,10.0,07:45:12,586950.0,24090.0,924.0,1274.0,,"Walk off the Earth (Ft. Jocelyn Alice, KRNFX, Sexy Sax Man) Camila Cabello Cover",Havana,2017-12-28
9402,6F5x2ArbQKU,2017-12-31,17.0,10:00:00,204263.0,12357.0,63.0,691.0,Nile Wilson,MY MUM TRIED GYMNASTICS! {Wipeout},,2017-12-30
9437,6eB_iBslIfE,2017-12-31,22.0,18:10:25,199946.0,594.0,95.0,0.0,My Brother's Keeper Alliance,We Are The Ones (:60) | MBK Alliance,,2017-12-24
9543,6l9go9X1EbE,2017-12-31,25.0,19:35:08,233686.0,9353.0,1630.0,4385.0,Stefan Molyneux,The Truth About Star Wars: The Last Jedi,,2017-12-17
9481,7cql4KuraEo,2017-12-31,25.0,04:30:01,174464.0,4164.0,4016.0,4060.0,The Young Turks,Are SJW's Ruining Star Wars?,,2017-12-21
9498,8HvwNOSnveE,2017-12-31,27.0,21:50:04,207266.0,7080.0,134.0,1015.0,PBS Space Time,Extinction by Gamma-Ray Burst | Space Time,,2017-12-20
9580,8I_NkJ8VTEI,2017-12-31,22.0,03:04:05,804559.0,4374.0,59684.0,0.0,Roy Moore for Senate,Judge Roy Moore Campaign Statement,,2017-12-14
9463,8LPVjHxXvJM,2017-12-31,23.0,05:25:00,9917230.0,206968.0,11472.0,22778.0,The Tonight Show Starring Jimmy Fallon,Jimmy Interviews Cardi B,,2017-12-21
9461,94oSf_56ilU,2017-12-31,17.0,05:07:03,137125.0,431.0,133.0,244.0,GINOBILEEEH,Inside the NBA | Charles Barkley thanks trump for the tax cut and says he’s buying a new Rolex 😂😂,,2017-12-22
9593,9YTQMPf3Z6o,2017-12-31,20.0,14:51:17,7565.0,77.0,1.0,7.0,Betway,"Noble, Antonio, Cresswell & Stevo play Supermarket Sweep! Part 1",,2017-12-14
9414,AGbuiYvynhY,2017-12-31,22.0,13:00:01,33828.0,1368.0,35.0,99.0,Megan Ellaby,WHAT I GOT FOR CHRISTMAS 2017 | Megan Ellaby,,2017-12-29
9470,AN3vM-T-lm0,2017-12-31,24.0,15:43:12,66698.0,1639.0,181.0,310.0,Ami Horowitz,Bernia'acs get burned by Republican Tax Plan,,2017-12-22
9555,AenmqoozqoA,2017-12-31,10.0,18:57:09,5161135.0,105954.0,3931.0,2488.0,,Dirty Sexy Money (Official Video),David Guetta & Afrojack ft Charli XCX & French Montana,2017-12-14
9516,B-t4bU3-lHA,2017-12-31,24.0,23:26:30,625178.0,18959.0,2775.0,8572.0,The Daily Wire,Ben Shapiro​ Reviews Star Wars: The Last Jedi (SPOILERS),,2017-12-18
9503,Bzu4G8uZs-4,2017-12-31,10.0,05:00:00,1473716.0,106570.0,1242.0,3654.0,,Wolves,"Selena Gomez, Marshmello",2017-12-20
9554,CHXD9k19q1Y,2017-12-31,10.0,18:00:38,699199.0,78037.0,1017.0,6208.0,,In The Middle,dodie,2017-12-15
9501,CYebJBcLZHA,2017-12-31,29.0,15:56:46,72685.0,4622.0,26.0,221.0,TEDx Talks,In Disaster There is Opportunity - Finding a Path Through Paralysis | Martyn Ashton | TEDxBristol,,2017-12-19
9439,DD2snaPATbI,2017-12-31,22.0,21:13:11,97460.0,6527.0,397.0,2158.0,randytaylor69,Presents from Father Christmas,,2017-12-25
9529,Ddt0k3yU9Q8,2017-12-31,20.0,22:31:45,120657.0,8041.0,1240.0,2306.0,LevelCapGaming,70 Plot Hole Questions For Star Wars The Last Jedi - Spoilers!,,2017-12-18
9443,DrApVH3afMI,2017-12-31,22.0,20:21:57,866694.0,115790.0,203.0,12870.0,danisnotinteresting,some bloopers from phil is not on fire 9,,2017-12-25
9480,E60w-0q8Y0Y,2017-12-31,24.0,01:25:59,2884469.0,173359.0,9054.0,3.0,boogie2988,"It's true, wife and I are getting a divorce.  Here's whats next for us.",,2017-12-20
9483,Ei6AtHXJ9dg,2017-12-31,23.0,16:00:40,141865.0,3022.0,32.0,183.0,PlayFunGamesPictures,Letterkenny New Season - Back to Chirpin',,2017-12-22
9412,FVjXoM4DjTU,2017-12-31,22.0,20:29:58,197781.0,10523.0,102.0,568.0,SprinkleofChatter,Christmas Day 2017!,,2017-12-28
9447,Ff7wbSwTuEk,2017-12-31,23.0,02:33:48,1292135.0,9417.0,670.0,2249.0,Mark Sales,Rocket in the Sky plus Accident.,,2017-12-23
9525,FntZKz9fXp8,2017-12-31,24.0,08:06:27,392815.0,8359.0,558.0,3709.0,SYLO: Star Wars,Mark Hamill NEVER Knew About Luke's Fate in The Last Jedi? (Spoilers) | Star Wars The Last Jedi,,2017-12-18
9591,G5V0rsKkMDo,2017-12-31,10.0,19:31:30,1026988.0,15796.0,489.0,360.0,,Pull Up N Wreck (feat. 21 Savage) [Prod. By SouthSide & Metro Boomin],Big Sean,2017-12-13
9505,GLZZn7lCtcI,2017-12-31,17.0,20:43:52,83464.0,321.0,50.0,443.0,FightHype.com,FLOYD MAYWEATHER KILLS UFC TALK; DENIES DANA WHITE CLAIM: I'M NOT DOING IT,,2017-12-20
9520,GRkHQ3RCW34,2017-12-31,1.0,03:11:04,32948.0,0.0,0.0,0.0,Noah Antwiler,Spoony & April Review Star Wars The Last Jedi (12-17-17),,2017-12-21
9476,GRwmtpr79qE,2017-12-31,22.0,03:50:46,922494.0,18937.0,4501.0,11639.0,Kevin Smith,THE LAST JEDI - KEVIN SMITH'S REVIEW,,2017-12-21
9468,HHauPi8CS4k,2017-12-31,15.0,23:00:00,214264.0,4294.0,399.0,579.0,The Dodo,Girl Cries Over Dog's New Haircut | The Dodo,,2017-12-21
9550,HL1LiSiBPMo,2017-12-31,10.0,15:39:24,482213.0,12389.0,179.0,830.0,,Walk On Water/Stan ft Skylar Grey on Radio 1,Eminem,2017-12-15
9556,I8S7ZH4-wIs,2017-12-31,17.0,07:58:53,456333.0,2096.0,185.0,366.0,Pro Wrestling Sheet,Macaulay Culkin Interferes In Wrestling Match Using ‘Home Alone’ Tactics,,2017-12-15
9409,IFE_dep7_zI,2017-12-31,26.0,18:24:02,46310.0,1719.0,82.0,126.0,HelloOctoberxo,WHAT I WORE THIS MONTH: DECEMBER | Hello October,,2017-12-29
9558,INHVfx05Sy8,2017-12-31,24.0,10:00:01,884493.0,8438.0,183.0,316.0,Jimmy Kimmel Live,Will Smith on His Competitive Friend Michael Jordan,,2017-12-15
9504,INRXOIgmNUU,2017-12-31,22.0,19:49:41,25994.0,2303.0,11.0,66.0,Daniel J. Layton,A Festive Effortless Chat with TimH - COLLABMAS DAY 10!,,2017-12-20
9460,ItL6vcUrpUs,2017-12-31,10.0,17:00:20,3630119.0,123954.0,3094.0,4445.0,,CORNER STORE (Official Music Video),MACKLEMORE FEAT DAVE B & TRAVIS THOMPSON,2017-12-21
9403,KB_GCuJwPE4,2017-12-31,22.0,22:21:12,305643.0,10386.0,813.0,1229.0,iJustine,"iMac Pro, New Apple Store and Star Wars!",,2017-12-29
9574,KjHan6D3O3g,2017-12-31,10.0,18:00:16,399291.0,6322.0,376.0,252.0,,Have Yourself A Merry Little Christmas in the Live Lounge,Sam Smith,2017-12-13
9507,Ku-WC1EaPXI,2017-12-31,10.0,16:33:22,9296135.0,329952.0,38327.0,42331.0,,Mama Don't Worry (Still Ain't Dirty) Official Music Video | Danielle Bregoli,BHAD BHABIE,2017-12-18
9421,Kx90AspFmEA,2017-12-31,26.0,19:03:32,116583.0,3903.0,119.0,227.0,Inthefrow,WHAT I GOT FOR CHRISTMAS 2017 | VLOGMAS 68,,2017-12-27
9576,LFhT6H6pRWg,2017-12-31,22.0,22:52:57,1336646.0,10501.0,255956.0,33816.0,Daily Caller,PSA from Chairman of the FCC Ajit Pai,,2017-12-13
9479,LPsRp7uUXUk,2017-12-31,25.0,19:27:36,669455.0,40756.0,4371.0,15459.0,Sargon of Akkad,Gender Wars: The Last Snowflake,,2017-12-20
9433,Lfy5Esue_ls,2017-12-31,22.0,00:45:37,98844.0,290.0,6.0,128.0,Voca Productions,Opening Cantina Scene [1080p],,2016-12-19
9401,LjNhW2mR1lM,2017-12-31,24.0,09:00:02,1004125.0,31123.0,723.0,1774.0,Netflix,Black Mirror | Happy New Year | Netflix,,2017-12-29
9449,LmOPXhFensg,2017-12-31,1.0,19:12:09,1516304.0,31676.0,510.0,2500.0,FXitinPost,STAR WARS - Sc.38 Reimagined (Unofficial Short Scene) Teaser Trailer,,2017-12-22
9484,M0X3jVSVzao,2017-12-31,10.0,14:00:06,1916726.0,74699.0,1914.0,2719.0,,You Be Love (Original Video) ft. Billy Raffoul,Avicii,2017-12-20
9488,MFWF9dU5Zc0,2017-12-31,24.0,12:00:02,9694860.0,93032.0,50310.0,32336.0,Warner Bros. Pictures,OCEAN'S 8 - Official 1st Trailer,,2017-12-19
9573,McenDl9NdYE,2017-12-31,20.0,16:01:37,242999.0,8268.0,205.0,912.0,Shesez,Off Camera Secrets | Final Fantasy VII - Boundary Break,,2017-12-15
9563,Mdm8rpv045U,2017-12-31,24.0,21:10:01,618437.0,25425.0,933.0,5921.0,Fundamental Disappointment,Mark Hamill Hurts,,2017-12-15
9567,MvIwx0JThsk,2017-12-31,10.0,16:00:02,4341793.0,202182.0,6201.0,10334.0,,…Ready For It? (BloodPop® Remix)(Lyric Video),"Taylor Swift, BloodPop®",2017-12-14
9502,NBkC83-vh9A,2017-12-31,24.0,14:16:34,401814.0,4006.0,140.0,682.0,FilmSelect Trailer,SICARIO 2: SOLDADO Trailer (2018),,2017-12-19
9590,NUjLi_tm-aM,2017-12-31,17.0,17:51:04,457732.0,4871.0,188.0,3130.0,ESPN,Stephen A. and Scottie Pippen intensely debate LeBron James vs. Michael Jordan | First Take | ESPN,,2017-12-14
9426,NsGrfU5buKc,2017-12-31,24.0,17:00:02,683789.0,18341.0,479.0,2881.0,VICE,The Story of 'Sandstorm' by Darude,,2017-12-26
9553,OPHbqY9LHCs,2017-12-31,28.0,16:35:18,1128510.0,21513.0,931.0,3194.0,SpaceX,CRS-13 Hosted Webcast,,2017-12-15
9587,OQ8v_KUS0Qg,2017-12-31,24.0,13:16:57,275945.0,1684.0,90.0,463.0,DAILY TVSHOWBIZ HOT NEWS,Holly Willoughby drops huge Star Wars: The Last Jedi spoiler,,2017-12-13
9589,OXf9D91wrIQ,2017-12-31,17.0,03:35:48,141653.0,1183.0,28.0,374.0,MLG Highlights,LeBron James & Lonzo Ball Talking After The Game / Cavaliers vs Lakers,,2017-12-15
9557,Oapebl0bADA,2017-12-31,10.0,15:00:01,3815305.0,138794.0,1935.0,5357.0,,Saved (Official Video),Khalid,2017-12-14
9418,PSqcvmLE0ek,2017-12-31,24.0,15:39:22,402667.0,15652.0,313.0,3994.0,RedLetterMedia,Best of the Worst: Merry Kick-mas!,,2017-12-28
9394,PjqKPHZJgF0,2017-12-31,10.0,22:59:01,2313884.0,80896.0,3102.0,11826.0,,Family Feud feat. Drake (Official Audio) | Dedication 6,Lil Wayne,2017-12-29
9473,Q4nc8Ky94IA,2017-12-31,26.0,13:30:17,68653.0,959.0,229.0,417.0,Electric Mountain Bike Network,EMBN: E Mountain Bike Channel Preview,,2017-12-22
9524,QODABIgXtCM,2017-12-31,26.0,12:17:32,574630.0,39225.0,642.0,3879.0,Sprinkleofglitter,My Babies | Name Reveal | MOTHERHOOD,,2017-12-18
9534,QfmgAmtGXwo,2017-12-31,1.0,16:50:15,106562.0,15547.0,78.0,4038.0,KickThePj,MY FAVOURITE FILMS THIS YEAR 🎬,,2017-12-18
9532,R0QPCS4a84k,2017-12-31,24.0,03:57:32,83609.0,7244.0,420.0,1453.0,Voxis Productions,Smack Talk: The Last Jedi Review,,2017-12-19
9458,R8QfoQYUsek,2017-12-31,24.0,14:00:02,57241.0,1602.0,37.0,412.0,VH1,Meet the Cast: Amara La Negra Reps for the Afro-Latinas | Love & Hip Hop: Miami,,2017-12-24
9431,REbjfHF0N0s,2017-12-31,10.0,12:00:01,822716.0,32645.0,260.0,1601.0,,Meng Jia & Jackson Wang (孟佳 & 王嘉尔）- MOOD Official Music Video,Banana Culture Music,2017-12-27
9482,RHUxyXZBXY8,2017-12-31,10.0,11:00:01,2544417.0,71318.0,2560.0,5765.0,,Stir Fry (Audio),Migos,2017-12-20
9485,RlSzahonkTk,2017-12-31,10.0,16:00:03,2075745.0,149989.0,1607.0,7460.0,,Nothing Else Matters (Glory Days Tour),Little Mix,2017-12-20
9499,T0_M3t3UVao,2017-12-31,20.0,19:01:08,78319.0,3087.0,103.0,332.0,Sanadsk,Bloodborne Cut Content ►HIDDEN CUT BOSSES WITH NEW GAMEPLAY (Part 3),,2017-12-21
9530,T3E6AKDbI2Y,2017-12-31,10.0,15:00:05,128343.0,4696.0,79.0,249.0,,Do You Really Want It? (Official Video),Nothing More,2017-12-19
9565,TPQqpxfm6BI,2017-12-31,24.0,20:00:00,121657.0,2409.0,193.0,379.0,Chelsea,Chelsea Records a Song with Diplo | Chelsea | Netflix,,2017-12-15
9549,TZSVf-yD7N8,2017-12-31,24.0,06:52:55,5146839.0,122688.0,2339.0,3608.0,The Late Late Show with James Corden,"Crosswalk the Musical on Broadway (w/ Hugh Jackman, Zendaya & Zac Efron)",,2017-12-15
9398,TwUaijHsNF0,2017-12-31,22.0,18:00:02,109254.0,5175.0,138.0,235.0,SACCONEJOLYs,how to win any argument with your parents,,2017-12-29
9519,UTNnhZqTY5c,2017-12-31,17.0,20:07:32,18452.0,172.0,27.0,171.0,TMZSports,Tyron Woodley Is All For Floyd Mayweather in the UFC | The Hollywood Beatdown,,2017-12-20
9400,UfR5dKcKJvY,2017-12-31,23.0,18:30:20,3334565.0,167596.0,8754.0,9296.0,Spying on Your Boyfriend,Lele Pons & Hannah Stocking,,2017-12-29
9408,VQhIUzPJi8o,2017-12-31,10.0,17:50:58,1002848.0,136926.0,1447.0,11628.0,,Never Be The Same,Camila Cabello,2017-12-29
9570,VnaOp89Ir48,2017-12-31,26.0,20:35:10,77542.0,3376.0,78.0,218.0,SamanthaMariaVlogs,I DONT WANNA GET S**T ON | VLOGMAS,,2017-12-15
9467,WS7f5xpGYn8,2017-12-31,10.0,20:00:02,29669903.0,790568.0,158437.0,79160.0,,Hey Hey Hey (Official),Katy Perry,2017-12-20
9448,WZEFya56qPw,2017-12-31,10.0,22:27:17,664450.0,23913.0,540.0,2368.0,,Official Music Video),Chief Keef Bust Feat. Paul Wall & C.Stone (WSHH Exclusive,2017-12-24
9399,X-QSZhh_YWg,2017-12-31,27.0,16:56:51,996729.0,30568.0,1779.0,4605.0,RealLifeLore,Why We May Not Be Able to Visit Space in the Future,,2017-12-29
9478,X8sSXU-J8fI,2017-12-31,10.0,19:00:31,38719438.0,703698.0,39569.0,32516.0,,La Modelo Ft Cardi B ( Video Oficial ),Ozuna,2017-12-19
9491,XQ0sKCp_NZA,2017-12-31,24.0,21:31:00,452209.0,9797.0,114.0,366.0,Vanity Fair,Pitch Perfect 3 Cast Recaps The First Two Pitch Perfect Movies in 7 Minutes | Vanity Fair,,2017-12-21
9459,XcSMdhfKga4,2017-12-31,24.0,08:30:22,3988692.0,47426.0,4148.0,4294.0,Universal Pictures,Mamma Mia! Here We Go Again - Trailer,,2017-12-21
9535,XdE5Psqh57I,2017-12-31,22.0,21:04:14,305208.0,185.0,14.0,56.0,Green Eagle,Video: The New York Times..U.S. Navy Jets Encounters UFO,,2017-12-16
9423,XvondF0gfro,2017-12-31,24.0,14:00:04,972591.0,40249.0,2295.0,9415.0,Jeremy Jahns,Top 10 BEST Movies 2017,,2017-12-26
9541,YKKE-LX5FPE,2017-12-31,24.0,17:16:26,1460867.0,19372.0,560.0,692.0,The Graham Norton Show,Daisy Ridley Couldn’t Handle It When She Got the Star Wars Part | The Graham Norton Show,,2017-12-15
9585,YfOHh5mt9SM,2017-12-31,24.0,00:27:19,617941.0,54258.0,726.0,5419.0,doddlevloggle,i have a condition that makes me feel like i'm dreaming all the time,,2017-12-14
9561,YgZiM_prrgo,2017-12-31,22.0,17:00:06,146883.0,4414.0,185.0,306.0,FleurDeVlog,Walking The RED CARPET with Mike! VLOGMAS Pt. 4,,2017-12-15
9494,Ymt4lpzv62g,2017-12-31,24.0,19:10:37,2464572.0,203109.0,14152.0,36419.0,PewDiePie,STAR WARS: THE LAST JEDI (spoilers),,2017-12-19
9522,ZQ8ir66M5XU,2017-12-31,24.0,20:42:02,374307.0,20684.0,1575.0,4940.0,ET Canada,Roz Rants Against 'The Last Jedi' | STAR WARS,,2017-12-18
9506,ZvdPvq4dX78,2017-12-31,24.0,05:30:01,68040.0,1022.0,42.0,88.0,Desus & Mero,Sports Journalist Bomani Jones (Extended Cut),,2017-12-21
9577,_YCGFLhrMkk,2017-12-31,24.0,17:07:45,727963.0,16282.0,1786.0,2384.0,Animation on FOX,Mueller Meets Trump | Season 29 | THE SIMPSONS,,2017-12-14
9466,_t0LX_Of33U,2017-12-31,10.0,23:16:01,1639926.0,157149.0,3817.0,13275.0,,FLOBOTS RESPOND TO LOGAN PAUL NO HANDLEBARS,Flobots,2017-12-20
9592,a7NJ6Gek9v4,2017-12-31,22.0,23:45:03,7994101.0,302644.0,8513.0,15376.0,CaseyNeistat,ALL TIME GREATEST AIRPLANE SEAT - Emirates First Class Suite,,2017-12-11
9509,aP0izmLk-Q8,2017-12-31,24.0,14:00:00,536052.0,23720.0,335.0,719.0,TheEllenShow,Ellen Is in Justin Bieber’s 'Mistletoe',,2017-12-19
9469,aeMv9uKpAZg,2017-12-31,23.0,11:00:00,353914.0,7187.0,154.0,548.0,Late Night with Seth Meyers,Bitcoin Commercial: What Is It and How Does It Work?,,2017-12-22
9436,agmPDVtPEc8,2017-12-31,17.0,04:18:22,113555.0,2285.0,156.0,307.0,WWE,"Hideo Itami vs. Gentleman Jack Gallagher: WWE 205 Live, Dec. 26, 2017",,2017-12-27
9477,alRtHXnZMOI,2017-12-31,10.0,17:02:12,877224.0,4147.0,188.0,286.0,,The Ginger Ed Man,Spotify,2017-12-20
9475,ao7JzzfIqVE,2017-12-31,24.0,20:14:49,1759745.0,126026.0,3023.0,12861.0,Bobby Burns,My Conversation With Theorist Shane Dawson,,2017-12-20
9405,aqzPj4WjO94,2017-12-31,26.0,10:00:01,77134.0,4197.0,56.0,279.0,Samantha Maria,WHAT I GOT FOR CHRISTMAS | 2017,,2017-12-30
9540,bUMWiiOlee4,2017-12-31,10.0,09:00:02,392724.0,49456.0,81.0,2582.0,,그놈의 크리스마스 (Lonely Christmas),[몬채널][S] 몬스타엑스(MONSTA X),2017-12-18
9444,bi1wcqsFoCs,2017-12-31,24.0,16:03:21,255004.0,8219.0,2786.0,885.0,Screen Team,"CHRISTMAS Rewind 2017 ft. Jake Paul, Taylor Swift Despacito Bruno Mars Katy Perry",,2017-12-24
9440,c7gO55FhKUQ,2017-12-31,10.0,21:34:54,273762.0,18510.0,153.0,945.0,,WONDERFUL CHRISTMAS TIME,MAC DEMARCO,2017-12-25
9486,cIQKKzZtWwQ,2017-12-31,10.0,05:00:00,577828.0,6771.0,637.0,394.0,,Still The Same,Sugarland,2017-12-21
9544,cL5oCP0VIEI,2017-12-31,20.0,19:47:53,1661802.0,66833.0,13049.0,30511.0,AngryJoeShow,Top 10 Reasons Why The Last Jedi Made Me ANGRY!,,2017-12-16
9456,cMD63TwzB1o,2017-12-31,10.0,05:00:01,4599327.0,137227.0,18769.0,20205.0,,The Weekend (Official Video),SZA,2017-12-22
9500,cntsqw7XOF0,2017-12-31,10.0,15:00:35,163708.0,7066.0,360.0,480.0,,Dashboard Confessional: We Fight [OFFICIAL VIDEO],Fueled By Ramen,2017-12-20
9445,csCCdQLqcVY,2017-12-31,24.0,13:28:05,1927397.0,80841.0,1700.0,3942.0,SBS Entertainment,"블랙핑크, 뜨거운 에너지로 재해석한 원더걸스의 ‘So Hot’ @2017 SBS 가요대전 1부 20171225",,2017-12-25
9514,d1hs-JI_yBE,2017-12-31,17.0,06:04:49,820655.0,15734.0,284.0,2111.0,NBA,Kobe Bryant No.8 & No.24 Jersey Retirement In Los Angeles,,2017-12-19
9513,d5w7iCkHvaU,2017-12-31,22.0,20:57:53,53398.0,35.0,80.0,46.0,Peter Parker Tube,Darya Folsom and caller LAUGH! at diddy move to buy Panthers..( He look like he just smoke a blunt),,2017-12-18
9457,dCROpIx2s0g,2017-12-31,23.0,19:55:06,107199.0,2058.0,91.0,254.0,Sunset Television,Reggaeggs,,2010-05-19
\n,,,,,,,,,,,,
\nfrom Sunset Television Episode 5: Tropical,,,,,,,,,,,,
\nmore at http://www.sunsettelevision.com,,,,,,,,,,,,
9552,dGaX8AuGiuk,2017-12-31,20.0,06:57:33,786275.0,7503.0,2167.0,54.0,FACEIT,"ECS CS:GO S4 Finals Day 2: Group Finals, Lower Bracket",,2017-12-17
9564,dRvKm__GrqU,2017-12-31,1.0,20:00:23,2824187.0,13516.0,965.0,1469.0,Orion Pictures,EVERY DAY Official Trailer (2018),,2017-12-14
9496,diOhJMLSCNw,2017-12-31,24.0,19:13:00,64099.0,4177.0,747.0,2894.0,John Campea,We Need To Talk About The Dark Side Of The Last Jedi Backlash - The John Campea Show,,2017-12-21
9578,dqkEniTFTH0,2017-12-31,1.0,23:19:07,163196.0,483.0,21.0,126.0,uhhuhhim,What Ever Happened to Baby Jane? - You're a Liar!,,2008-08-29
9492,ebzooSdAbGE,2017-12-31,25.0,15:38:24,70031.0,4702.0,66.0,301.0,Lord Buckethead,A Bucketful of Happiness,,2017-12-20
9404,ejlD0Sg-8ig,2017-12-31,26.0,22:11:30,630694.0,44813.0,908.0,5250.0,Patricia Bright,THIS HAS TO STOP! INSTAGRAM TRENDS I HATED IN 2017 AND NEED TO DIE,,2017-12-29
9395,f6Egj7ncOi8,2017-12-31,26.0,22:23:18,2822642.0,275632.0,1444.0,124082.0,NikkieTutorials,FULL FACE USING ONLY MY MOM'S MAKEUP Challenge | NikkieTutorials,,2017-12-29
9572,g2GbkH12xMg,2017-12-31,24.0,08:44:19,166535.0,5395.0,97.0,456.0,The Late Show with Stephen Colbert,Jon Batiste Performs Winter Wonderland,,2017-12-15
9474,h1-AXcb5j18,2017-12-31,1.0,17:31:20,239067.0,4294.0,524.0,364.0,Movieclips Trailers,Mamma Mia! Here We Go Again First Look (2018) | Movieclips Trailers,,2017-12-20
9539,hW9ScsV6QJ0,2017-12-31,10.0,21:59:25,217547.0,13242.0,102.0,600.0,,Flume X Greenpeace,FlumeAUS,2017-12-17
9536,hdyD3afxyxc,2017-12-31,20.0,17:00:05,94885.0,2223.0,149.0,559.0,Ubisoft US,For Honor: Season 4 - Frost Wind Festival Launch Trailer | Ubisoft [US],,2017-12-18
9528,hj44lITeFHk,2017-12-31,22.0,00:06:18,159672.0,7696.0,93.0,268.0,Hazel Hayes,Tipsy Talk with Daisy Ridley,,2017-12-18
9560,hu_4yAZVNsU,2017-12-31,24.0,13:12:53,2271378.0,30420.0,3753.0,11360.0,Breakfast Club Power 105.1 FM,Kevin Hart Lives His Truth And Opens Up About Being Irresponsible And More,,2017-12-14
9526,ibI5-k5sin8,2017-12-31,24.0,18:05:24,764309.0,10095.0,837.0,655.0,Saturday Night Live,Cut for Time: New Year’s Kiss - SNL,,2017-12-18
9546,ifkRhaEDzzo,2017-12-31,24.0,17:00:08,529964.0,27858.0,766.0,275.0,PointlessBlogVlogs,TRYING ON ENGAGEMENT RINGS (no proposal),,2017-12-16
9568,iiWm8AxvWtw,2017-12-31,24.0,13:00:54,417646.0,11727.0,249.0,836.0,Vogue,73 Questions With Sean “Diddy” Combs | Vogue,,2017-12-14
9508,jbeEE0RaEeA,2017-12-31,20.0,08:34:27,22961.0,1011.0,96.0,954.0,Easy Allies,Spoiler Mode - Star Wars Episode VIII The Last Jedi,,2017-12-21
9510,jyTqvjvj8sM,2017-12-31,24.0,00:32:47,93087.0,4482.0,38.0,218.0,Carrie Hope Fletcher,Home For Christma(saurus)!,,2017-12-20
9497,k_JTFUEp7mw,2017-12-31,24.0,20:51:58,571422.0,7581.0,634.0,1671.0,Looper,The Reason Why Kylo Ren Was Shirtless In The Last Jedi,,2017-12-19
9406,lERhNXw6FaQ,2017-12-31,1.0,17:47:12,1503610.0,42187.0,1284.0,5487.0,CinemaSins,Everything Wrong With Despicable Me 3,,2017-12-28
9471,l_lblj8Cq0o,2017-12-31,10.0,20:00:05,38902263.0,678809.0,38876.0,41543.0,,"No Limit REMIX ft. A$AP Rocky, Cardi B, French Montana, Juicy J, Belly",G-Eazy,2017-12-19
9435,leu-cTvMWTA,2017-12-31,10.0,09:00:04,7201892.0,833114.0,10990.0,94121.0,,EXO 엑소 'Universe' MV,SMTOWN,2017-12-26
9416,lojZXnH_978,2017-12-31,24.0,04:06:18,139897.0,8060.0,815.0,2338.0,The Rageaholic,THE LAST JEDI Rant,,2017-12-28
9493,lwzfPL-rJqA,2017-12-31,24.0,03:31:17,1590206.0,49277.0,476.0,1942.0,The Voice,The Voice 2017 Brooke Simpson and Sia - Finale: Titanium,,2017-12-20
9425,maAa7J3iEM8,2017-12-31,24.0,15:00:04,1037897.0,23542.0,1757.0,3694.0,Complex,Lauren London Goes Sneaker Shopping With Complex,,2017-12-26
9542,muAPJiMho2Y,2017-12-31,2.0,16:00:03,3547551.0,112040.0,1172.0,11897.0,CHRIS-RS,DELIT DE FUITE - le Justicier de Noël,,2017-12-15
9548,nSSXvOidHeg,2017-12-31,24.0,16:45:55,739384.0,10550.0,448.0,0.0,CBBC,Star Wars: The Last Jedi cast react to fan questions!,,2017-12-15
9410,nYykdHDv4N4,2017-12-31,22.0,11:05:18,39487.0,2601.0,38.0,350.0,Nasey Family,HUGE MOMENT FOR OUR BABY!!,,2017-12-30
9413,nranUeNkXpM,2017-12-31,23.0,18:07:46,3072371.0,90653.0,6119.0,7590.0,Bad Lip Reading,CHRISTMAS IS HERE! — A Bad Lip Reading of Donald Trump,,2017-12-27
9512,nuKhpdLgR2U,2017-12-31,10.0,17:06:03,413471.0,9375.0,354.0,1306.0,,Once Upon A Time (Official Video),The Diplomats,2017-12-19
9424,o31pGcwUmCM,2017-12-31,10.0,15:00:08,995747.0,115025.0,360.0,7703.0,,HEAVEN,[SPECIAL VIDEO] NU'EST W(뉴이스트W) & SEVENTEEN(세븐틴),2017-12-28
9582,oQxKEtoHygY,2017-12-31,10.0,17:05:43,932529.0,25871.0,2693.0,3411.0,,United State of Pop 2017 (How We Do It),DJ Earworm Mashup,2017-12-13
9545,p9RLCdyn_40,2017-12-31,22.0,16:00:07,1054789.0,55131.0,537.0,346.0,MoreZoella,ACCIDENTAL RING SHOPPING & PARTY TIME | VLOGMAS,,2017-12-16
9515,pNpsjMnO7mU,2017-12-31,17.0,23:42:53,41253.0,369.0,795.0,523.0,Speak For Yourself with Cowherd and Whitlock,Jason Whitlock weighs in on LaVar Ball's idea of starting a basketball league | SPEAK FOR YOURSELF,,2017-12-20
9588,pWqef6cbwzI,2017-12-31,22.0,23:05:56,3252960.0,315685.0,1923.0,65748.0,TheAngryGrandpaShow,ANGRY GRANDPA TRIBUTE VIDEO,,2017-12-12
9422,payPzC_QHRw,2017-12-31,17.0,00:50:24,497851.0,7077.0,260.0,2964.0,UFC - Ultimate Fighting Championship,UFC 219: Khabib Nurmagomedov - The Eagle is Hungry,,2017-12-28
9562,prmQgSpV3fA,2017-12-31,10.0,16:15:22,2277304.0,79786.0,844.0,13706.0,,#FREESTYLE087,BLACK THOUGHT FREESTYLES ON FLEX,2017-12-14
