id,video_id,trending_date,category_id,publish_time,views,likes,dislikes,comment_count,Author,Title,Artist,publish_date
960,sECcOTO8Ij4,2017-11-18,20.0,22:00:01,1121888.0,38483.0,613.0,6735.0,GameGrumps,Sonic Forces: The New Chick - PART 1 - Game Grumps,,2017-11-07
957,sF1l7v3XY6I,2017-11-18,26.0,19:09:56,109494.0,5219.0,105.0,272.0,Samantha Maria,MY WARDROBE TOUR | Samantha Maria,,2017-11-08
937,ssbOzbL1SJQ,2017-11-18,24.0,23:13:33,239883.0,1952.0,100.0,448.0,MovieAccessTrailers,JUSTICE LEAGUE Movie Clip Aquaman Island + Trailer NEW (2017) Batman Superman Superhero Movie HD,,2017-11-10
852,svZScJMh4Pg,2017-11-18,10.0,17:02:13,441164.0,36355.0,560.0,2482.0,,Golden Slumbers,Dua Lipa,2017-11-16
861,uN9zBcweN4M,2017-11-18,17.0,03:16:52,120991.0,1060.0,42.0,377.0,ESPN,NBA Countdown debates if Ben Simmons is the best all-around rookie ever | NBA Countdown | ESPN,,2017-11-16
886,uXNIeQjav80,2017-11-18,24.0,09:00:04,50205.0,1631.0,74.0,144.0,Giovannasworld,John Lewis Christmas Advert 2017 | Reaction with Tom,,2017-11-13
965,vHCvmZlC5jQ,2017-11-18,24.0,21:45:08,748307.0,0.0,0.0,0.0,Difficult Psycho,Every Kevin Spacey Joke from Difficult People,,2017-11-01
851,vIVaLtJmyPs,2017-11-18,24.0,03:12:45,411312.0,27388.0,276.0,3354.0,WOWPresents,UNHhhh Ep 68: Goodbye Barbara w/ Trixie Mattel & Katya Zamolodchikova,,2017-11-14
980,vLVSf_yI_r8,2017-11-18,24.0,08:59:54,1230602.0,49877.0,3579.0,7137.0,gugudan,gugudan(구구단) - 'Chococo' Official M/V,,2017-11-08
953,vd4zwINEcLY,2017-11-18,24.0,04:31:25,97772.0,910.0,52.0,188.0,poofables,Live in the now!,,2011-03-27
838,ve3oQBjcAGI,2017-11-18,1.0,17:00:07,1836995.0,48570.0,2523.0,10096.0,CinemaSins,Everything Wrong With Wonder Woman In 14 Minutes Or Less,,2017-11-14
967,wjy9Jgnjv6U,2017-11-18,17.0,16:59:44,157595.0,5843.0,42.0,554.0,Global Mountain Bike Network,Neil and Blake Push A Fat Bike To Its Limits,,2017-11-08
842,xVp2opnGrEA,2017-11-18,25.0,14:36:02,141137.0,1640.0,115.0,391.0,TODAY,Gal Gadot Talks About New Movie 'Justice League' And Sexual Harassment In Hollywood | TODAY,,2017-11-15
915,xg9ebVTL9yE,2017-11-18,10.0,05:00:06,254522.0,11190.0,133.0,675.0,,Way To Go,Empire Of The Sun,2017-11-10
869,xzpQSINtLkw,2017-11-18,10.0,03:23:13,804818.0,22669.0,546.0,1469.0,,"De música ligera (de SODA STEREO) // Estadio Unico, La Plata, Argentina (14.11.2017)",COLDPLAY,2017-11-15
805,yxfZBun1uBU,2017-11-18,24.0,14:04:01,1988921.0,24681.0,1182.0,1399.0,FilmSelect Trailer,DEADPOOL 2 Teaser Trailer (2018),,2017-11-15
971,z4bLKt9k5dk,2017-11-18,24.0,12:00:04,980280.0,22982.0,555.0,3432.0,BBC Three,Things Not To Say To Someone With Vitiligo,,2017-11-07
918,z7VBtM7clT4,2017-11-18,24.0,15:05:03,145915.0,1754.0,47.0,214.0,MTV International,Justice League Movie Cast Reveal Funniest Moments Together | MTV Movies,,2017-11-09
881,zpgn8U5Ug8M,2017-11-18,20.0,00:00:19,86108.0,1257.0,103.0,257.0,IGN,Sky: 6 Minutes of Journey Creator's New Game - IGN First,,2017-11-15
