id,video_id,trending_date,category_id,publish_time,views,likes,dislikes,comment_count,Author,Title,Artist,publish_date
11832,wQ_POfToaVY,2018-01-14,10,15:00:03,8667619,348379,22081,46403,,TWICE「Candy Pop」Music Video,TWICE JAPAN OFFICIAL YouTube Channel,2018-01-11
11902,wYQcU5VXde8,2018-01-14,24,15:10:25,966126,23183,7399,8122,We The Unicorns,Logan Paul Being Massively Disrespectful In Japan,,2018-01-05
11984,xmMxtSwTwwQ,2018-01-14,22,10:14:09,30239,1737,113,293,justkissmyfrog,Chuck out your clothes with me. (COUCWM?),,2017-12-30
11877,xvaCIbcM2-I,2018-01-14,24,02:14:26,83736,558,61,185,Steve TV Show,Keri Hilson Has Emotional Meeting with Psychic Medium Reginald Lewis,,2018-01-09
11869,ys2x8oOK7wE,2018-01-14,10,16:30:51,3832538,166173,6757,11792,,All Night (Official Video) Ultra Music,Steve Aoki x Lauren Jauregui,2018-01-08
11808,zQYarS9LYgk,2018-01-14,10,15:00:10,831491,39157,848,2283,,Mink Flow,"Future, Young Thug",2018-01-12
11970,zUelEgXDHa8,2018-01-14,23,19:17:47,1511070,82808,856,47347,jacksfilms,THE WORST GIFTS OF 2017 (YIAY #389),,2017-12-29
11823,zUrDUxh5xS0,2018-01-14,27,16:30:01,234481,13158,355,1620,austinmcconnell,10 Letters We Dropped From The Alphabet,,2018-01-11
11985,zbyu6MOzpLE,2018-01-14,10,15:00:03,3221423,215462,3268,6254,,Us The Duo,Top Hits of 2017 in 4 minutes,2017-12-28
11870,zcJ8BTAGqE0,2018-01-14,10,08:00:07,79032,1948,117,284,,International Blue (Official Video),Manic Street Preachers,2018-01-09
11892,zmcGIBpgG-Y,2018-01-14,19,03:25:57,283922,14156,154,2485,Simon and Martina,Nikuman - Magic Japanese Steam Buns,,2018-01-08
