id,video_id,trending_date,title,channel_title,category_id,publish_time,tags,views,likes,dislikes,comment_count,thumbnail_link,comments_disabled,ratings_disabled,video_error_or_removed,description
16220,-BDImdAfodA,2018-02-05,Kylie Minogue - Dancing (Official Video),KylieMinogueOnVEVO,10,2018-02-01 08:59:34+00:00,"Kylie Minogue|""Kylie""|""New Music""|""Pop""|""Girls Aloud""|""Spice Girls""|""Katy Perry""|""Sugababes""|""All Saints""|""Bananrama""|""RuPaul""|""Madonna""|""Diva""|""Taylor Swift""|""Country""|""Dua Lipa""|""Ariana Grande""|""Camila Cabello""|""Beyonce""|""Rita Ora""|""Pink""|""golden""|""dancing""|""album""|""official""|""can't get you out of my head""|""on a night like this""|""spinning around""|""fever""|""i should be so lucky""|""in your eyes""|""all the lovers""|""into the blue""|""loco-motion""|""locomotion""",855031,27709,1046,3104,https://i.ytimg.com/vi/-BDImdAfodA/default.jpg,False,False,False,"Official video for 'Dancing', taken from Kylie's upcoming album 'Golden', released 6/4/18. \nPre-order: https://kylie.lnk.to/goldenID\nStream/download: https://kylie.lnk.to/dancingID\nVisit the Official Store for deluxe and limited edition formats: https://kylie.lnk.to/goldenID/kylieminogue\n\nDirected by Sophie Müller\nProduced by Jacob Swan Hyam\n\nFollow Kylie:\nhttp://www.kylie.com\nhttps://www.facebook.com/kylieminogue\nhttps://www.instagram.com/kylieminogue\nhttps://twitter.com/kylieminogue\n\nhttp://vevo.ly/OgEAB3"
16346,0GQmGOju6CE,2018-02-05,THE GHOST IN MY HOUSE - Morgan Adams,Morgan Adams,24,2018-01-24 18:59:44+00:00,"shane dawson stanley|""morgan adams""|""morgan""|""ryland morgan""|""ryland sister""|""shane dawson sister""|""shane sister""|""ghost""|""storytime""|""ghost story""|""dear david""|""vlogger""|""lookout mountain""|""vicki adams""|""shane ghost""|""morgan ghost""|""morgan adams ryland""",1167242,75855,859,12874,https://i.ytimg.com/vi/0GQmGOju6CE/default.jpg,False,False,False,"The amount of orbs in this freaks me out haha\nSorry this is a bit lengthy. I wanted to explain to you all a little more about Angie. Also, I am not a medium or a ghost whisperer nor am I trying to be hahahahahah \nI will be back with somethin a little more light hearted again :)\n\nWATCH SHANES VIDEO ABOUT ANGIE: https://www.youtube.com/watch?v=Xw_RS1Ovpns&t=540s\n\nFollow me around I think I'm funny sometimes\nInstagram: https://www.instagram.com/morrganics/\nTwitter: https://twitter.com/_morganadams_\nSnapchat with me and ANG: @Morgan_adams33"
16216,0uJUW24505E,2018-02-05,LIL SKIES - LETTUCE SANDWICH [OFFICIAL VIDEO] (Dir. by @NicholasJandora),Jandora Media,10,2018-02-01 20:30:00+00:00,"lil skies|""lettuce sandwich""|""lil skies lettuce sandwich""|""skies music video""|""jandora media""|""xxl""|""nicholas jandora""|""skies""|""worldstarhiphop""|""AWG""",723815,45559,450,3477,https://i.ytimg.com/vi/0uJUW24505E/default.jpg,False,False,False,Lil Skies - Lettuce Sandwich (Official Music Video)\nProd. by Menoh Beats (@Menohbeats)\n\nDirected & Edited by Nicholas Jandora \nhttps://www.instagram.com/nicholasjandora/\n\nDirector of Photography & VFX by Bradley Atom\nhttps://www.instagram.com/bradleyatom/\n\nDrone Operator: Patrick Savocuh \nhttps://www.instagram.com/savocuh/\n\n\nDownload Life of a Dark Rose \nhttps://itunes.apple.com/us/album/life-of-a-dark-rose/1322605873
16361,1LWbRkt490A,2018-02-05,YEOVIL TOWN'S SONG - YEOVIL TRUE,Yeovil Town Football Club,17,2013-10-27 17:20:25+00:00,"Yeovil Town F.C. (Football Team)|""YEOVIL""|""YTFC""|""FOOTBALL""|""SONG""",32124,315,22,41,https://i.ytimg.com/vi/1LWbRkt490A/default.jpg,False,False,False,Hear Yeovil Town's song Yeovil True that made it to number 36 in the Official UK singles chart in 2004.
16191,2z3EUY1aXdY,2018-02-05,Justin Timberlake’s FULL Pepsi Super Bowl LII Halftime Show! | NFL Highlights,NFL,17,2018-02-05 01:51:53+00:00,"NFL|""Football""|""offense""|""defense""|""afc""|""nfc""|""American Football""|""highlight""|""highlights""|""sports""|""action""|""2017""|""2018""|""touchdown""|""td""|""AFC""|""NFC""|""champ""|""champion""|""championship""|""super bowl""|""super bowl 52""|""SB""|""new england""|""patriots""|""pats""|""eagles""|""philly""|""Justin Timberlake""|""halftime show""|""sexyback""|""sexy back""|""can’t stop the feeling""|""cry me a river""|""rock your body""|""filthy""|""singing""|""dancing""|""sp:dt=2018-02-04T18:30:00-05:00""|""sp:vl=en-US""|""sp:st=football""|""sp:li=nfl""|""sp:ti:home=NE""|""sp:ti:away=PHI""|""sp:ty=play""|""sp:or=9""",2027569,50251,15239,14413,https://i.ytimg.com/vi/2z3EUY1aXdY/default.jpg,False,False,False,"Justin Timberlake breaks it down during the Pepsi Super Bowl LII Halftime Show. The Philadelphia Eagles take on the New England Patriots during Super Bowl LII.\n\nWatch full games with NFL Game Pass: https://www.nfl.com/gamepass?campaign=sp-nf-gd-ot-yt-3000342\n\nSign up for Fantasy Football! http://www.nfl.com/fantasyfootball\n\nSubscribe to NFL: http://j.mp/1L0bVBu\n\nThe NFL YouTube channel is your home for immediate in-game highlights from your favorite teams and players, full NFL games, behind the scenes access and more!\n\nCheck out our other channels:\nNFL Network http://www.youtube.com/nflnetwork\nNFL Films http://www.youtube.com/nflfilms\n\nFor all things NFL, visit the league's official website at http://www.nfl.com/\n\nWatch NFL Now: https://www.nfl.com/now\nListen to NFL podcasts: http://www.nfl.com/podcasts\nWatch the NFL network: http://nflnonline.nfl.com/\nDownload the NFL mobile app: https://www.nfl.com/apps\n2017 NFL Schedule: http://www.nfl.com/schedules\nBuy tickets to watch your favorite team:  http://www.nfl.com/tickets\nShop NFL: http://www.nflshop.com/source/bm-nflcom-Header-Shop-Tab\n\nLike us on Facebook: https://www.facebook.com/NFL\nFollow us on Twitter: https://twitter.com/NFL\nFollow us on Instagram: https://instagram.com/nfl/\nFind us on Snapchat"
16329,3ChgRbqGi-E,2018-02-05,Kygo - Stranger Things ft. OneRepublic,KygoOfficialVEVO,10,2018-01-24 08:00:01+00:00,"Dance/House/Techno|""Kygo""|""Kygo feat. OneRepublic""|""Stranger Things""",6817611,183298,2652,5089,https://i.ytimg.com/vi/3ChgRbqGi-E/default.jpg,False,False,False,"Stranger Things - Kygo feat. OneRepublic | Official music video\nEP: Luga Podesta & Brandon Bonfiglio\nProducer: Jamee Ranta, Luga Podesta, Brandon Bonfiglio\nDirector: Tim Mattia\nEditor: Jen Kennedy \nVFX: GloriaFX\nColorist: Simone Grattarola\n \nListen at:\nSpotify: https://Kygo.lnk.to/spKygoST\nApple Music: https://Kygo.lnk.to/AKygoST\nMulti Retailer: https://Kygo.lnk.to/sKygoST\n\nKids In Love Album:\nSpotify: https://Kygo.lnk.to/sKygoKILa\nApple Music: https://Kygo.lnk.to/ApKygoKIL\nMulti Retailer: https://Kygo.lnk.to/KKILA\n\nhttps://www.facebook.com/kygoofficial/\nhttps://www.instagram.com/kygomusic/"
16299,3QeRZj3LhS4,2018-02-05,The Coworker | #ThatsHarassment | Ad Council,Ad Council,24,2018-01-22 13:44:59+00:00,"harassment|""sexual harassment prevention""|""sexual assault prevention""|""support""|""information""|""safety""|""prevention""|""emmy rossum""|""ad council""|""psa""|""workplace harassment""|""harassment in the workplace""|""preventing harassment""|""preventing sexual harassment""|""sex assault""|""Sigal Avi""|""David Schwimmer""|""Mazdack Rass""|""MILK Studios""|""RAINN""|""#ThatsHarassment""|""RAINN hotline""",158197,217,424,0,https://i.ytimg.com/vi/3QeRZj3LhS4/default.jpg,False,False,False,"One in four women face harassment in the workplace. These PSAs— written and directed by Israeli-American director Sigal Avin and executive produced by David Schwimmer, Mazdack Rassi of MILK Studios and Sigal Avin—are based on real events and depict scenarios of sexual harassment in workplaces. Visit https://www.RAINN.org/ThatsHarassment or call 800-656-HOPE for support or information.\nSubscribe for Ad Council’s latest PSAs: http://po.st/SubscribeAdCouncil\n\nSmokey Bear Says Stay Connected:\n\nVisit Ad Council’s Official Blog: http://po.st/BlogAdCouncil\nLIKE Ad Council On Facebook: http://po.st/LikeAdCouncil\nFollow Ad Council On Twitter: http://po.st/FollowAdCouncil\nFollow Ad Council On Tumblr: http://po.st/TumblrAdCouncil\nFollow Ad Council On G+: http://po.st/PlusAdCouncil\nFollow Ad Council On Pinterest: http://po.st/PinAdCouncil\nFollow Ad Council On Linked In: http://po.st/LinkedinAdCouncil\nSign Up For Newsletters From The Ad Council: http://po.st/SignUpAdCouncil\n\nAbout the Ad Council:\n\nOur mission is to identify a select number of significant public issues and stimulate action on those issues through communications programs that make a measurable difference in our society. Fore information, news, events, and more, please click here:\nhttp://po.st/AdCouncil"
16296,48-pr5-G6Pw,2018-02-05,HAIM - Night So Long (Live At The Greek),HaimVEVO,10,2018-01-26 19:30:01+00:00,"Alternative|""Columbia""|""HAIM""|""Night So Long""",390485,11417,330,581,https://i.ytimg.com/vi/48-pr5-G6Pw/default.jpg,False,False,False,"HAIM SISTER SISTER SISTER Tour on sale now: http://haimtheband.com\n\nNew album 'Something To Tell You' available now: http://haim.lnk.to/stty\n \nDirector: Paul Thomas Anderson\nRecording Produced, Engineered and Mixed by Ariel Rechtshaid\nProduction Supervisor: Karen Ramirez\nEditor: Andy Jurgenesen\nProduction Company: Ghoulardi Film Company\nFirst Assistant Director: Adam Somner\nCamera Operator: Ari Robbins \nFirst Assistant Camera: Chris Flurry, Matt Sanderson\nAssistant Camera: Aaron Tichenor\nAssistant Camera / Loader: Drey Singer\nAdditional Camera: Matthew Rivera\nGaffer: David Lee\nGrip: Kuba Bojsza\nAdditional Engineers: Chris Kasych, John DeBold, Scott Adamson, Nick Rowe\nProduction Assistants: Chelsea Davenport, Aida Saam\nPanavision Cameras: Lori Killiam, Dan Sasaki\nFotokem: Andrew Oran\nRoundabout: Carl Moore\n\nDanielle Haim: guitar/vocals\nEste Haim: bass guitar/backing vocals\nAlana Haim: backing vocals\nTommy King: synthesizers\nJody Giachello: percussion \n\nFilmed on location at The Greek Theater, Los Angeles, CA\nOctober 19, 2017\n\nFollow HAIM: \nhttp://facebook.com/haimtheband\nhttp://twitter.com/haimtheband\nhttp://instagram.com/haimtheband\nhttp://haimtheband.com"
16307,494VkPnSvJk,2018-02-05,BEST OF COLOURPOP | My Favorite Products - 2018,KathleenLights,26,2018-01-26 18:30:01+00:00,"best of colourpop|""must have""|""products""|""favorites""|""must haves""|""top""|""unique""|""cp""|""sale""|""beauty""|""guru""|""kathleenlights""",541500,26487,245,3710,https://i.ytimg.com/vi/494VkPnSvJk/default.jpg,False,False,False,"Hey, Guys! (WATCH IN HD)\nHere is a video where I walk you through Coloupops BEST PRODUCTS (WITH LIP SWATCHES TOO)I hope you enjoy! Thanks for watching! xoxo!\n\n\nGET MY FAVORITES FOR 20% OFF FOR THE NEXT 5 DAYS: http://bit.ly/KathleenFavorites\nCoupon code: Kathleen20 \n\n* I CUT OUT LIP LINERS FROM THIS VIDEO BECAUSE THE VIDEO WAS ALREADY TOO LONG BUT YOU CAN STILL GET MY FAV LIPPIE PENCILS FOR 20% OFF ASWELL!\nThey are: Aquarius, Bff, Bff2, Bff3, Lumiere, Taurus & Clique \n\n\nProduct I Mentioned: \nNo Filter Concealer (I use Light Neutral)\nSmall Fluff Brush \nSmall Shader Brush \nBrow Boss Gel \nPressed Powder Bronzer in Private Party\nPressed Powder Highlight in Here Kitty Kitty\nGimme More Highlight Palette (but specifically Bigger & Better)\nSuper Shock Cheek in Wisp & Flexitarian \nSupernova Shadows in Walk of Fame, Dragon, UF-Woah & Moon Lit\nIt Was All A Dream Empty Palette\nPressed Powder Eyeshadows in Play by Play, Paper Tiger, Save it for later, Team Captain, Sideline, Wake up Call, Come and Get it, Made to Last, Glass Bull & Cute Alert\nEyeshadow Palettes in Dream St, Yes Please, I Think I Love You, You had me at Hello, All I See is Magic & Semi- Precious \nCreme Gel Liners in Mr. Bing, Honeydude & Best O\nSuper Shock Shadows in Glow, Cornelious, Wattles, Elixr, Kennedy, Don't Leave, Mittens, Central Perk, Telepathy, Frog, Get Lucky, Coconuts, Issa, Lightning Bug, Weenie, Blaze, Kathleenlights & Game Face \nLippie Stix in Aquarius, Lumiere, Taurus, Grunge, Chi Chi & Frenchie \nUltra Glossy Lips in Fairy Floss, Moon Child, My Jam, Aquarius & Finders Keepers \nUltra Matte Lips in Aquarius 2, Chi, Lumiere 2, Mama & Love Bug\nUltra Satin Lips in Aquarius, Magic Wand, Strip, Alyssa, Dreamy, November, Frick n Frack, Point Zero, Cozy, Rêver & Lost \n\n\n\n\nWhat I'm Wearing:\nTop: Fashion Nova\nEarrings & Choker: Forever 21\nRing: Nordstrom \nNails: Future KLP stuff \nBrows: Anastasia Brow Wiz in Dark Brown \nFace: Hourglass Vanish Foundation Stick in Warm Ivory mixed with Giorgio Armani Luminous Silk in 4, Colourpop No Filter Concealer in Light Neutral, Colourpop Private Party Bronzer & Here Kitty Kitty Highlight\nEyes: Colourpop Dream St. Palette, Colourpop Flexitarian Highlight, Huda Beauty Camille Falsies\nLips: Colourpop Aquarius Lip Liner & Moon Child Ultra Glossy Lip \n\n\n\n\nI CREATED MY OWN NAIL POLISH LINE!!!!!!!!!!!!!!!\nKL POLISH :) :)\nGET THEM HERE:\nhttps://www.klpolish.com\n\n\n\n\n-MY LIQUID LIPSTICKS WITH OFRA\nMIAMI FEVER! GET IT HERE:\nhttp://www.ofracosmetics.com/products//long-lasting-liquid-lipstick?variant=9396569155\nHAVANA NIGHTS! GET IT HERE:\nhttp://www.ofracosmetics.com/products/long-lasting-liquid-lipstick?variant=11525913222\nUSE COUPON CODE: Kathleen30 TO GET 30% OFF!\n\n\nMY COLLABS WITH COLOURPOP! GET THEM HERE:\nhttp://bit.ly/kathleenlightsxcolourpop \n\n\n\nMAKEUPGEEK -My favorite affordable eyeshadows:\nhttp://www.makeupgeek.com/store?acc=6c9882bbac1c7093bd25041881277658\n\nGET 10% OFF ON MORPHE BRUSHES WITH MY COUPON CODE: Kathleenlights \nhttp://morphebrushes.com\n\n\n\n\n*If you are a business/company who would like to contact me about reviewing a product...please email me at kathleenlights@yahoo.com\n\n\n\n\nDon't forget to follow me on my social media sites!\nInstagram: Kathleenlights\nTwitter: Kathleenlights1\nSnapchat: Kathizzle11\nMY BLOG: http://kathleenlights.com\n\n\nMUSIC BY:\nPREMIUMBEAT.COM (Cymatix)\n\n\n\n\n\nFTC- This video is NOT sponsored.\n(MUG is an affiliate link - Morphe & Ofra code is an affiliate code)"
16234,4diqg8_3a-0,2018-02-05,Yvolution Y Fliker - Available at Toys R Us,Yvolution,26,2012-11-10 04:15:18+00:00,"YFliker|""Yvolution""|""Toys R Us""|""Toys \R\""|""Us""|""TV commercials""|""scooters""|""Fun""|""Playing""|""Kids""|""Commercial""|""toys""",235081,145,25,23,https://i.ytimg.com/vi/4diqg8_3a-0/default.jpg,False,False,False,"The YFliker kids scooter by Yvolution - No #1 scooter in the UK is now launching in the US! Ages 7+\n\nSit back and enjoy the video of our TV Commercial :-)\n\nWant to watch more of our videos then check out our Channel: http://bit.ly/yvolutionYoutube \nOr Subscribe here: http://bit.ly/yvolutionYoutube \n\nAbout the original Y Fliker 3 wheeled scooter:\n\nThe Yfliker Flow series is a range of innovative three-wheeled scooter that are built for fun. With the Y Fliker, there’s no more kicking the pavement like traditional two wheel scooters. Riders simply move their hips from side to side to get going, while continuing to use their own body power for self-propelling fun. The Y Fliker’s patented technology, light-weight and sleek design, combined with performance rated wheels, allows this free-style scooter to perform smooth carving and drifting action.  And the quick response hand brake offers kids increased control and ensures a safe, fun ride! And with its twist and stow folding system, it’s ready to go wherever you take it!\n\nWhat are you waiting for? Click right here to subscribe: http://bit.ly/yvolutionYoutube \n\nCheck out our Baby walkers/Ride-ons: http://bit.ly/Yvolution-Ride-Ons \nCheck out our Balance Bike Ranges: http://bit.ly/Yvolution-BalanceBikes \nCheck out Y Glider lean to steer scooter ranges: http://bit.ly/Yvolution-YGliders \nCheck out our Y Fliker 3 wheeled self-propelling scooter ranges: http://bit.ly/Yvolution-YFlikers \nCheck out our Yvolution Go Karts: http://bit.ly/Yvolution-Karts \nLooking for Yvolution spare parts: http://bit.ly/Yvolution-Spares \n\nAbout Yvolution:\n\nAt Yvolution, we were kids once, too. We remember it as a golden time of good, healthy, outdoor fun. Without a handset in sight. So, with our love of toys like go-karts that put smiles on kiddies’ faces and wind in their hair, we all ended up in the outdoor toys industry.\n\nWe imported toys and it was all going rather well. But, deep down, we had this crazy desire to develop our own. We wanted to control our own destiny and launch products our way. \n\nIn 2009, we were reborn with even more wind in our hair and a new dream of working with a design company to sell their new ‘balance’ bikes around the world. We started co-designing some nice products with them and feeding back on other product ideas.\n\nAt last, we had our little fingers firmly wrapped around the handlebars of the industry and, in 2011, we launched in over 40 countries and spanning the Globe from the US to Korea. In 2012, we came out with a shiny new brand and went global. Pull up a chair, put the kettle on and see how we get on. \n\nYvolution – Life Through Motion – Scooter that grow with your child and develop their motor, balance and co-ordination skills.\n\nConnect with us:\n\nYoutube Channel - http://bit.ly/yvolutionYoutube \nFacebook - http://bit.ly/YvolutionFB \nInstagram - http://bit.ly/YvolutionInstagram \nTwitter - http://bit.ly/YvolutionTwitter \n\nLeave us a comment below!"
16378,4qOeuzeNfQ8,2018-02-05,The FALL - 'Rowche Rumble' - 1979 45rpm,IndieAnnieJones,10,2011-03-01 00:15:48+00:00,"70's|""Indie""|""The""|""Fall""|""Rowche""|""Rumble""|""Mark""|""E.""|""Smith""|""1979""|""45rpm""",106581,793,8,53,https://i.ytimg.com/vi/4qOeuzeNfQ8/default.jpg,False,False,False,Early lo-fi gem from Mark E Smith & Co
16377,5-rHVxhQUJA,2018-02-05,(R) The Fall - Bill is Dead,Ian Daygold,10,2016-06-23 08:42:59+00:00,[none],9667,97,3,15,https://i.ytimg.com/vi/5-rHVxhQUJA/default.jpg,False,False,False,"Another standout track from The Fall's finest album to date. Virtually all the songs on 'Extricate' are standout actually, a rare thing by any standard. That is, of course, if you purchased the original release of this album that included only 10 tracks. The subsequent CD release including 4 extra tracks (save perhaps for 'British People in Hot Weather') are forgettable.\n\nOriginal Track list:\n\nSing! Harpy\nI'm Frank\nBill is Dead\nBlack Monk Theme pt 1\nPopcorn Double Feature\n\nTelephone Thing\nHilary\nChicago, Now!\nThe Littlest Rebel\nAnd Therein ...\n\nHooray! x:)"
16315,51cbHTKdILA,2018-02-05,DUA LIPA - NEW RULES (Leroy Sanchez LIVE Cover),Leroy Sanchez,10,2018-01-27 01:22:34+00:00,"leroy|""sanchez""|""cover""|""music""|""2017""|""pop""|""acoustic""|""guitar""|""dua lipa""|""new rules""|""dua lipa new rules""|""new rules dua lipa""|""IDGAF""|""dua lipa IDGAF""|""new rules cover""|""dua lipa cover""|""leroy sanchez""|""grammys""|""leroy sanchez new rules""|""new rules leroy sanchez""|""leroy sanchez official""|""leroy sanchez 2018""|""leroy sanchez music""|""leroy sanchez covers""|""new rules official""|""new rules 2018""|""dua lipa leroy sanchez""|""leroy sanchez dua lipa""",316044,25255,356,2070,https://i.ytimg.com/vi/51cbHTKdILA/default.jpg,False,False,False,DON'T FORGET TO CLICK THE 🔔 SO YOU DON'T MISS MY NEXT LIVESTREAM!\nChillin’ in my Hotel Room in New York singing some Dua Lipa “New Rules”. This is the very first LIVESTREAM on YouTube I've ever done so hope you guys enjoyed it! \nFollow me! \n\nINSTAGRAM: http://www.instagram.com/iamleroysanchez\nTWITTER: http://www.twitter.com/iamleroysanchez\nFACEBOOK: http://www.facebook.com/iamleroysanchez\nSOUNDCLOUD: http://www.soundcloud.com/iamleroysanchez\nWEBSITE: https://www.leroysanchez.com/
16352,5x-d3pabd5o,2018-02-05,Jhené Aiko - Sativa ft. Rae Sremmurd,JheneAikoVEVO,10,2018-01-23 00:20:02+00:00,"Jhené|""Aiko""|""Sativa""|""Def""|""Jam""|""Recordings""|""Jhene Aiko""|""Swae Lee""|""slim jimmy""|""slim jxmmi""|""Rae Sremmurd""|""complicated""|""Trip""",5930932,140889,2854,4769,https://i.ytimg.com/vi/5x-d3pabd5o/default.jpg,False,False,False,"Download or Stream “Sativa” here: https://JheneAiko.lnk.to/SativaRaeSremmurd\n\nMusic video by Jhené Aiko performing Sativa. (C) 2018 Def Jam Recordings, a division of UMG Recordings, Inc.\n\nhttp://vevo.ly/hkqJOD"
16268,61G3tDZQNhg,2018-02-05,"Ronda Rousey confronts Asuka, Alexa Bliss and Charlotte Flair: Royal Rumble 2018 (WWE Network)",WWE,17,2018-01-29 04:58:52+00:00,"wwe|""world wrestling entertainment""|""wrestling""|""wrestler""|""wrestle""|""superstars""|""कुश्ती""|""पहलवान""|""डब्लू डब्लू ई""|""मैच""|""सुपरस्टार""|""व्यावसायिक कुश्ती""|""مصارعه""|""Royal Rumble""|""Ronda Rousey""|""Asuka""|""Alexa Bliss""|""Charlotte Flair""|""Stephanie McMahon""|""sp:ty=high""|""sp:st=wrestling""|""sp:scp=athlete_in_match""|""sp:dt=2018-01-28T19:00:00-04:00""|""sp:ev=wwe-rumble""|""sp:ath=wwe-asuka""|""sp:ath=wwe-chfl""|""sp:ath=wwe-albl""|""sp:ath=wwe-stephm""|""women""|""charlotte""|""alexa""|""flair""|""royal""|""rumble""|""ronda""|""rousey""|""smackdown""|""bliss""|""womens royal rumble""",2983844,28635,2572,6779,https://i.ytimg.com/vi/61G3tDZQNhg/default.jpg,False,False,False,"Legendary mixed martial artist Ronda Rousey made a surprise appearance to stare down Women's Royal Rumble Match winner Asuka, SmackDown Women's Champion Charlotte Flair and Raw Women's Champion Alexa Bliss: Courtesy of the award-winning WWE Network.\nGet your first month of WWE Network for FREE: http://wwenetwork.com\nSubscribe to WWE on YouTube: http://bit.ly/1i64OdT\nVisit WWE.com: http://goo.gl/akf0J4\nMust-See WWE videos on YouTube: https://goo.gl/QmhBof"
16344,6ZwXRnueOMg,2018-02-05,9 SITUATIONS EVERY CAT OWNER WILL RECOGNIZE,smoothiethecat,15,2018-01-26 17:38:30+00:00,"9 Situations Every Cat Owner Will Recognize|""9 situations""|""situations""|""cat""|""cats""|""cat owner""|""owner""|""recognize""|""recognise""|""funny""|""funny cat video""|""cat video""|""longhair""|""longhair cats""|""smoothiethecat""|""smoothie the cat""|""smoothie""|""milkshake the cat""|""milkshake""|""gato""|""chat""|""katze""|""kat""|""funny video""|""fluffy""|""adorable""|""cute""|""sweet""|""animal""|""pet""|""pets""|""queen of fluff""|""photogenic""|""photogenic cat""|""beautiful cat""|""funny cat""",68307,3322,43,303,https://i.ytimg.com/vi/6ZwXRnueOMg/default.jpg,False,False,False,"Cats all have their own way of interacting with us, but I think they have one thing in common: they're all quite quirky. I think most cat owners will recognize the following 9 situations! You can watch this video in HD!\n\nSmoothie and Milkshake are two British Longhair cats living in The Netherlands, respectively three years and one year old. Since she was called “The Most Photogenic Cat In The World”, Smoothie rose to fame in 2016. She’s the Queen of Fluff, and always camera-ready.\n\nWant to send mail? :)\nSmoothie The Cat \nPostbus 4049\n5604 EA Eindhoven\nThe Netherlands\n\nSocial:\nFollow Smoothie on Instagram: http://www.instagram.com/smoothiethecat\nFollow Smoothie on Facebook: http://www.facebook.com/smoothiethecat\nFollow Milkshake on Instagram: \nhttp://www.instagram.com/milkshake.thecat"
16224,80T59B2RVOo,2018-02-05,The Nerd Crew - Solo: A Star Wars Story - Teaser Trailer Breakdown!!!,RedLetterMedia,24,2018-02-02 01:11:49+00:00,"redlettermedia|""red letter media""|""red""|""letter""|""media""|""plinkett""|""half in the bag""|""mike stoklasa""|""jay bauman""|""rich evans""|""star wars""|""solo""|""han solo""|""trailer""|""teaser""|""teaser trailer""|""breakdown""|""nerd crew""",442818,22164,1359,3669,https://i.ytimg.com/vi/80T59B2RVOo/default.jpg,False,False,False,"Okay Jay/Rich this is the rough edit. Insert the final trailer after it's uploaded this Sunday or Monday (You'll see the spot for it) This way we can have the reaction video out before everyone else. Our reactions will probably match up to the trailer as these SW trailers are pretty boilerplate and predictable at this point. Remember DO NOT POST THIS anytime before the official release of the trailer. We'll look really stupid. Also, Rich - a collection agency keeps calling my phone looking for you. They sounded pretty mad. Made some comments about breaking your legs - which seemed a little unusual for collections? Your gambling habit hasn't resurfaced again has it? If so we need to have a talk. DO NOT borrow money from Jimmy the leg breaker Malone anymore. Okay, talk with you guys soon. - Mike"
