id,video_id,trending_date,title,channel_title,category_id,publish_time,tags,views,likes,dislikes,comment_count,thumbnail_link,comments_disabled,ratings_disabled,video_error_or_removed,description
16206,SDGHRQyZKes,2018-02-05,Sam Smith Will Only Do Karaoke to Fifth Harmony,The Tonight Show Starring Jimmy Fallon,23,2018-02-02 13:00:08+00:00,"The Tonight Show|""Jimmy Fallon""|""Sam Smith""|""Karaoke""|""Fifth Harmony""|""NBC""|""NBC TV""|""Television""|""Funny""|""Talk Show""|""comedic""|""humor""|""snl""|""Fallon Stand-up""|""Fallon monologue""|""tonight""|""show""|""jokes""|""funny video""|""interview""|""variety""|""comedy sketches""|""talent""|""celebrities""|""video""|""clip""|""highlight""|""lay me down""|""stay with me""|""soul""|""pop""|""Writing's On The Wall""|""Spectre""|""The Thrill of It All""|""In the Lonely Hour""",669789,15530,311,592,https://i.ytimg.com/vi/SDGHRQyZKes/default.jpg,False,False,False,"Sam Smith chats about a wild night in Sydney, Australia, explains why karaoke doesn't work for him and admits Jimmy made him never want to sing Money on My Mind again.\n\nSubscribe NOW to The Tonight Show Starring Jimmy Fallon: http://bit.ly/1nwT1aN\n\nWatch The Tonight Show Starring Jimmy Fallon Weeknights 11:35/10:35c\nGet more Jimmy Fallon: \nFollow Jimmy: http://Twitter.com/JimmyFallon\nLike Jimmy: https://Facebook.com/JimmyFallon\n\nGet more The Tonight Show Starring Jimmy Fallon: \nFollow The Tonight Show: http://Twitter.com/FallonTonight\nLike The Tonight Show: https://Facebook.com/FallonTonight\nThe Tonight Show Tumblr: http://fallontonight.tumblr.com/\n\nGet more NBC: \nNBC YouTube: http://bit.ly/1dM1qBH\nLike NBC: http://Facebook.com/NBC\nFollow NBC: http://Twitter.com/NBC\nNBC Tumblr: http://nbctv.tumblr.com/\nNBC Google+: https://plus.google.com/+NBC/posts\n\nThe Tonight Show Starring Jimmy Fallon features hilarious highlights from the show including: comedy sketches, music parodies, celebrity interviews, ridiculous games, and, of course, Jimmy's Thank You Notes and hashtags! You'll also find behind the scenes videos and other great web exclusives.\n\nSam Smith Will Only Do Karaoke to Fifth Harmony\nhttp://www.youtube.com/fallontonight"
16334,SJsvPv5Q_oY,2018-02-05,KITTEN and CAT,CatPusic,15,2018-01-26 13:30:00+00:00,"catpusic|""cat""|""cat pusic""|""pusic""|""video cat""|""kitten ousic""|""kitten and cat""|""kitten cat""|""video clips kitten""|""video clips cat""",777774,39128,250,2392,https://i.ytimg.com/vi/SJsvPv5Q_oY/default.jpg,False,False,False,"A set of video clips comparing 3 months old Pusic and 3 years old Pusic\n\nSubscribe also to the new second channel CatPusic Academy - http://youtube.com/CatPusicAcademy\n\nOn the new channel, all useful information (tips, lessons, training, lifehacks)\n\nFor any questions, e-mail: catpusic@gmail.com\n\n► Instagram: http://instagram.com/catpusic\n► Facebook: http://facebook.com/catpusic\n► HOME and SHOP: http://catpusic.com\n\nMusic: Italian Afternoon by Twin Musicom is licensed under a Creative Commons Attribution license (https://creativecommons.org/licenses/by/4.0/)\nArtist: http://www.twinmusicom.org/"
16251,SPNsGbjXVwY,2018-02-05,Sam Tsui - TRUST (Official Music Video),TheSamTsui,10,2018-01-30 20:08:30+00:00,"Official music video|""Sam Tsui""|""dance""|""song""|""album""|""new album""|""music""|""remix""|""single""|""singer""|""spy""|""gay""|""mashup""|""medley""|""shadow""|""bring me the night""|""make it up""|""kurt""|""casey breves""|""charlie puth""|""ariana grande""|""demi lovato""|""sam smith""|""ed sheeran""|""cover""|""acoustic""|""vocals""|""original""|""Cameo""|""Michael Jackson""",88432,6483,81,437,https://i.ytimg.com/vi/SPNsGbjXVwY/default.jpg,False,False,False,"FULL ALBUM TRUST OUT NOW:  http://bit.ly/TrustAlbum\nSpotify: http://bit.ly/TrustAlbumSP\nGET TICKETS TO MY SHOWS in LA/SF: http://www.samtsui.com/tour\n\n**Let me know in the comments - what would your secret agent codename be??**\n\nUnbelievably grateful and proud to share this album with you - a lot of love, heart, and time has gone into its creation, and knowing you guys are enjoying it so far means the world to me.  And as the title track, I knew we had to do something super unexpected for the music video to accompany “TRUST” so I hope you enjoy this over-the-top spy fantasy Huge shout out to everyone who made this epic video possible!! \n\nStay connected - \nhttp://www.twitter.com/SamuelTsui\nhttp://www.facebook.com/SamTsuiMusic\nhttp://www.samtsui.com\n\nGoogle Play: http://bit.ly/TrustAlbumGP\nAmazon Music: http://hyperurl.co/amzCAMEO?IQid=youtube\nAmazon Music: http://bit.ly/TrustAlbumAM\n\ncast - \nSpy Counterpart - Struther White\nDinner guests 1 - Lizz Adams\nDinner guest 2 - Khalif Boyd\nDinner guest 3 - Janelle Blanford\nDinner guest 4 - Sam Krumrine\n\ndirector - Jade Ehlers, Sam Miller\nProducer - Jade Risser\n1st AD - Dustin Heveron\nDirector of Photography - Nathan Presely\nCamera Op - Cole Sprague\nGaffer - Johnny Valenzuela \nKeygrip - Jacob Pereira \nMakeup Artist - Stefania Koszti\nProduction Designer - Jonathan Denmark\nArt Assistant - Ross Fleming\nProduction Assistant  - Rainer Golden\nediting - Sam Miller, Jade Ehlers, Sam Tsui"
16335,S_1SwS7Jj-Y,2018-02-05,Path To The NFL Draft! Workout With Du'Vonta Lampkin,Verne Troyer,24,2018-01-24 18:00:05+00:00,"Verne|""Troyer""|""Verne Troyer""|""Mini Me""|""Vern""|""Vern Troyer""|""Mini Me Actor""|""Verne Troyer YouTube""|""YouTube Verne Troyer""|""Verne Troyer Video""|""Video Verne Troyer""|""nfl""|""draft""|""combine""|""workout""|""fitness""|""duvonta""|""lampkin""|""duvonta lampkin""|""oklahoma""|""sooners""|""sophomore""|""defensive tackle""",525061,7380,317,620,https://i.ytimg.com/vi/S_1SwS7Jj-Y/default.jpg,False,False,False,"Today I got invited by Du'Vonta Lampkin to come work out with him. He's a Redshirt Sophomore who played Defensive Tackle for the Oklahoma Sooners and is one of the biggest players in this upcoming 2018 NFL Draft. Think I can handle his workout? Let's go!  SUBSCRIBE for more!: http://bit.ly/2cbliJR\n\nFollow Du'Vonta on instagram! https://www.instagram.com/duvonta.lampkin\n\nFollow Lindsay McCormick on instagram\nhttps://www.instagram.com/lindsaymccormicksports\n\nThank you to Vayner Sports https://www.instagram.com/vaynersports\n\nand Sports Academy for letting us film\nhttps://www.instagram.com/sportsacademyhq\n\nSpecial thanks to NewRuleFX for the weights!\nhttps://www.instagram.com/newrulefx\n\nTalk to Me!:\nTwitter: http://bit.ly/2d0DGW2\nFacebook: http://bit.ly/2cnQiba\nInstagram: http://bit.ly/2cW6UGz\n \nWelcome to my channel! My name is Verne Troyer and you might recognize me from the big screen somewhere. However, on my YouTube channel, you will find all kinds of videos such as vlogs, cooking videos, my random adventures, challenges with different YouTubers and anything else I feel like uploading. Look for new uploads every Wednesday\n\nShot and edited by Jeff Skeirik (@rawtographer)"
16341,UCCcvxvwNVo,2018-02-05,Sir Elton John Is Ready to Retire From Touring but He's Going Out With a Bang! | Lorraine,Lorraine,24,2018-01-25 15:28:52+00:00,"lorraine|""lorraine kelly""|""lorraine itv""|""lorraine interview""|""interview on lorraine""|""chat show""|""talk show""|""dan wooton""|""elton john""|""elton john retire""|""elton john prince harry""|""elton john princess dianna""",23651,164,13,0,https://i.ytimg.com/vi/UCCcvxvwNVo/default.jpg,True,False,False,"Subscribe now for more! http://bit.ly/1KyA9sV\nSir Elton John chats about his plans to retire from touring, speaks about his recent health scare, and reveals how shaken he was by the unexpected death of his mother. \nBroadcast on 25/01/2018\n\nLike, follow and subscribe to Lorraine!\nWebsite: http://bit.ly/1E6BlKW\nYouTube: http://bit.ly/18cHdtx\nFacebook: http://on.fb.me/1E6Bhep\nTwitter: http://bit.ly/1wvn4dp\n\nLorraine brings you up-to-date topical stories, the biggest celebrity interviews and tasty recipes as well as finger-on-the-pulse fashion tips and health advice from Dr Hilary Jones.\n\nPresenter Lorraine Kelly welcomes guests in her warm and friendly studio setting, where the likes of Mark Heyes, Dan Wootton and John Whaite share knowledge in their expert fields.\n\nJoin Lorraine every weekday on ITV at 8.30am.\n\nhttp://www.itv.com"
16277,UCKC-QVcVn0,2018-02-05,The Engineering of the Drinking Bird,engineerguy,28,2018-01-30 12:00:02+00:00,"drinking bird toy|""engineering toys""|""thermodynamics""|""heat engine""|""Bill Hammack""|""University of Illinois - Urbana""|""engineerguy""",245060,14996,70,894,https://i.ytimg.com/vi/UCKC-QVcVn0/default.jpg,False,False,False,"Bill reveals the operation and engineering design underlying the famous drinking bird toy. In this video he explores the role played by the water the bird drinks, shows what is under the bird's hat and demonstrates that it can operate using heat from a light bulb or by drinking whiskey. You can find more of Bill's videos and his books at www.engineerguy.com."
16211,UImlvzT2hHQ,2018-02-05,CHATTY EVERYDAY WINTER MAKEUP ROUTINE | I Covet Thee,I Covet Thee,26,2018-02-02 17:08:23+00:00,"CHATTY EVERYDAY WINTER MAKEUP ROUTINE | I Covet Thee|""icovetthee""|""i covet thee""|""everyday makeup""|""everyday makeup tutorial""|""everyday makeup routine""|""winter makeup""|""chatty makeup tutorial""|""my everyday winter makeup""|""get ready with me""|""grwm""|""makeup""|""winter""|""chatty""|""beauty""|""tutorial""|""makeup tutorial""|""chatty tutorial""",53785,2812,34,277,https://i.ytimg.com/vi/UImlvzT2hHQ/default.jpg,False,False,False,Hey everyone.. I'm back! 👋🏻 Catch up & get ready with me with a chatty everyday Winter makeup routine! \n+ SUBSCRIBE HERE // http://bit.ly/1KIpZBE\n\nNew videos on Friday & Monday!\n\nWatch my last video HERE\n- https://www.youtube.com/watch?v=TbpPuoZqV8o&list=UUS-MXJHHsErj2EcGUVCIo8A\n\nWatch more get ready with me videos HERE\n- https://www.youtube.com/watch?v=cM_05owq9uk&list=PL89B2A480E1E97737\n\n______________________________\n\n+ IN THIS VIDEO\n\nSmashbox Photo Finish Primerizer\n- http://bit.ly/2EvjVkj\nCharlotte Tilbury Brightening Youth Glow\n- http://bit.ly/2DUUrvp\nNARS Pure Radiant Tinted Moisturiser (shade Alaska)\n- http://bit.ly/2DROX4Q\nReal Techniques B02 Soft Finishing Brush\n- http://bit.ly/2DTk57P\nNARS Natural Radiant Longwear Foundation (shade Gobi)\n- http://bit.ly/2DRRegc\nNARS Radiant Creamy Concealer (shade Vanilla)\n- http://bit.ly/2EuKrKA\nHourglass Ambient Lighting Bronzer in Diffused Bronze Light\n- http://bit.ly/2DU0v7v\nSephora PRO Stippling Brush #44\n- http://bit.ly/2DStoRC\nNARS Madly Blush\n- http://bit.ly/2EyKHZa\nCharlotte Tilbury Cheek to Chic Blush in Love Glow\n- http://bit.ly/2DVjChB\nNARS Man Ray Double Take Highlighter\n- http://bit.ly/2EwXqeH\nNARS Yachiyo Brush\n- http://bit.ly/2EsAsFv\nAnastasia Brow Wiz (shade Soft Brown)\n- http://bit.ly/2EwGPYI\nSigma E80 Brow & Lash Brush\n- http://bit.ly/2EsA9dP\nGlossier Boy Brow Clear // 10% off here - http://bff.glossier.com/hEZ-P\n- http://bit.ly/2EvlC12\nBareMinerals The Blender Brush\n- http://bit.ly/2DUCHAm\nChanel Ombre Première Cream Eyeshadow in 812 Noir Pétrole \n- http://bit.ly/2DU5rcL\nBareMinerals Ink Liner\n- http://bit.ly/2DS6VUQ\nKevyn Aucoin The Eye Lash Curler\n- http://bit.ly/2DStM2C\nMaybelline Lash Sensational Waterproof Mascara \n- http://bit.ly/2DW4MHq\nGlossier Coconut Balm Dotcom // 10% off here - http://bff.glossier.com/hEZ-P\n- http://bit.ly/2EsVa8d\nDior Addict Lip Glow in Coral\n- http://bit.ly/2Ex1ziW\nNYX Soft Matte Lip Cream in Stockholm\n- http://bit.ly/2DTEXI9\n\n______________________________\n\n+ PLACES TO FIND ME\n\nBLOG: http://www.icovetthee.com\nBLOGLOVIN': https://www.bloglovin.com/blog/2653362\nTWITTER: http://www.twitter.com/icovetthee\nINSTAGRAM: http://instagram.com/icovetthee\nFACEBOOK: http://www.facebook.com/icovetthee\nSNAPCHAT: 'icovetthee'\nDEPOP: https://www.depop.com/icovetthee\n\n______________________________\n\n+ WHAT I'M WEARING\n\nJumper\n- http://bit.ly/2AX3HgP\nNecklace\n- http://bit.ly/2rXreOV\nEarrings\n- http://bit.ly/2rXreOV\nBracelet\n- http://rstyle.me/n/cuw9ydk97w\n\n+ NAILS\n\nCND Rouge Rite\n\n______________________________\n\n+ F.A.Q.\n\nWHAT BREED IS MOON?\nShe's a long haired Chihuahua!\n\nSKINCARE ROUTINE:\n- https://youtu.be/FbbwBE8XdMY\n\nFILMING EQUIPMENT:\nCanon EOS 5D \n- http://bit.ly/29GhLhJ\nCanon EF 50mm f/1.4 USM Lens\n- http://bit.ly/29EPSun\n\n______________________________\n\n\n+ DISCLAIMER\n\nThis video is not sponsored. Most products that feature have been bought and paid for by myself however I am occasionally sent samples to review under no obligation. Opinions and views will always be completely honest and my own! Some of the above bit.ly links are affiliated.
16274,UNhI8F-C89o,2018-02-05,Secrios meets Baneblade,LeeroyPlambeck,24,2015-05-19 22:39:57+00:00,"SFM|""Source""|""Film""|""Maker""|""Baneblade""|""Warhammer""|""40k""|""Bad""|""Mad Max""|""War""|""Explosions""|""Secrios""|""Explode""|""Wars""|""Entertainment""|""Other""|""Stuff""|""Funny""|""Source 2""|""Vine""|""Strike""|""Counter""|""Counterstrike""|""Fireworks""",52199,608,30,63,https://i.ytimg.com/vi/UNhI8F-C89o/default.jpg,False,False,False,"Basically, this is my reaction to Secrios and his video\n\nSecrios Buys a Tank, i swear to god i still have nightmares from that video..."
16267,V69XYIRjKww,2018-02-05,Tom Clancy’s Jack Ryan – Super Bowl Commercial [HD] | Prime Video,Prime Video,24,2018-01-30 18:49:51+00:00,"Amazon|""amazon prime""|""amazon video""|""trailer""|""streaming""|""Amazon Original Series""|""Prime Video""|""jack ryan""|""jack ryan john krasinski""|""jack ryan amazon video""|""jack ryan amazon prime""|""jack ryan series""|""jack ryan trailer""|""john krasinski""|""tom clancy""|""13 hours""|""rainbow six""|""jack ryan prime""|""super bowl""|""super bowl ad""|""super bowl 2018""|""Super Bowl LII""|""super bowl 52""|""jack ryan super bowl""|""official trailer""|""jack ryan official trailer""|""jim office""|""jim halpert""|""Super Bowl Commercial""",9177109,934,115,198,https://i.ytimg.com/vi/V69XYIRjKww/default.jpg,False,False,False,"Follow the money, save the world. A first look at the much-anticipated CIA thriller centered on the famed and lauded Tom Clancy hero as he transforms from analyst to super-agent.\n» Stream Tom Clancy's Jack Ryan August 2018, exclusively with your Prime membership: http://bit.ly/TomClancysJackRyanPrimeVideo\n» SUBSCRIBE: http://bit.ly/PrimeVideoSubscribe\n\nAbout Tom Clancy's Jack Ryan:\nWhen CIA analyst Jack Ryan stumbles upon a suspicious series of bank transfers his search for answers pulls him from the safety of his desk job and catapults him into a deadly game of cat and mouse throughout Europe and the Middle East, with a rising terrorist figurehead preparing for a massive attack against the US and her allies.\n\nGet More Prime Video: \nStream Now: http://bit.ly/WatchMorePrimeVideo\nFacebook: http://bit.ly/PrimeVideoFB\nTwitter: http://bit.ly/PrimeVideoTW\nInstagram: http://bit.ly/PrimeVideoIG\n\nAbout Prime Video:\nWant to watch it now? We've got it. This week's newest movies, last night's TV shows, classic favorites, and more are available to stream instantly, plus all your videos are stored in Your Video Library. Over 150,000 movies and TV episodes, including thousands for Amazon Prime members at no additional cost.\n\nTom Clancy’s Jack Ryan – Super Bowl Commercial [HD] | Prime Video\nhttps://youtu.be/S3r7A2Evw2k\n\nPrime Video\nhttps://www.youtube.com/PrimeVideo"
16243,V6wWKNij_1M,2018-02-05,Hereditary | Official Trailer HD | A24,A24,1,2018-01-30 13:59:54+00:00,"a24|""a24 films""|""a24 trailers""|""independent films""|""trailer""|""official""|""movie""|""a24 movies""|""oscar winner""|""academy award winner""|""Hereditary""|""Hereditary trailer""|""Hereditary 2018""|""Hereditary A24""|""a24 horror films""|""horror trailers""|""2018 horror trailers""|""horror movies""|""a24 hereditary""|""Ari Aster""|""Toni Collette""|""Gabriel Byrne""|""Alex Wolff""|""Milly Shapiro""|""thriller trailer""|""thriller films""|""Official Trailer""|""Hereditary Official Trailer""|""a24 Official Trailer""|""8_rTIAOohas""|""u7KZrt_cHH0""",2383917,15659,685,1473,https://i.ytimg.com/vi/V6wWKNij_1M/default.jpg,False,False,False,"SUBSCRIBE: http://bit.ly/A24subscribe\n\nFrom Ari Aster and starring Toni Collette, Gabriel Byrne, Alex Wolff, and Milly Shapiro – Coming June 8, 2018.\n\nRELEASE DATE: June 8, 2018\nDIRECTOR: Ari Aster\nCAST: Toni Collette, Gabriel Byrne, Alex Wolff, and Milly Shapiro\n\nVisit Hereditary WEBSITE: http://bit.ly/HereditaryMovie\nLike Hereditary on FACEBOOK: http://bit.ly/HereditaryFB\nFollow Hereditary on TWITTER: http://bit.ly/HereditaryTW\nFollow Hereditary on INSTAGRAM: http://bit.ly/HereditaryIG\n\n------\n\nABOUT A24:\nOfficial YouTube channel for A24, the studio behind Ex Machina, Amy, Room, The Witch, The Lobster, Moonlight, 20th Century Women & more.\n\nComing Soon: A Prayer Before Dawn, Lean on Pete, Slice\n\nSubscribe to A24's NEWSLETTER: http://bit.ly/A24signup\nVisit A24 WEBSITE: http://bit.ly/A24filmsdotcom\nLike A24 on FACEBOOK: http://bit.ly/FBA24\nFollow A24 on TWITTER: http://bit.ly/TweetA24\nFollow A24 on INSTAGRAM: http://bit.ly/InstaA24"
16247,VXvu5rtJNd4,2018-02-05,The Crown | Growing Up Royal | Netflix,Netflix,24,2018-01-31 19:16:52+00:00,"Netflix|""Trailer""|""Netflix Original Series""|""Netflix Series""|""television""|""movies""|""streaming""|""movies online""|""television online""|""documentary""|""comedy""|""drama""|""08282016NtflxUSCAN""|""watch movies""|""The Crown""|""royal family""|""matt smith""|""netflix""|""claire foy""|""british""|""the queen""|""queen elizabeth""|""empire""|""british monarchy""|""princess margaret""|""season 2""|""winston churchill""|""prince philip""|""queen elizabeth ii""|""PLvahqwMqN4M1uQ5JITdkmNrxZnwtUG-DP""|""PLvahqwMqN4M1yf6iG-es1g_QqubL8N8do""",70686,1083,48,83,https://i.ytimg.com/vi/VXvu5rtJNd4/default.jpg,False,False,False,"Prince Charles followed in the footsteps of his father by attending the same school in Scotland, but life was far from easy for the young heir to the throne.\n\nWatch The Crown on Netflix: https://www.netflix.com/title/80025678\n\nSUBSCRIBE: http://bit.ly/29qBUt7\n\nAbout Netflix:\nNetflix is the world’s leading Internet television network with over 117 million members in over 190 countries enjoying more than 125 million hours of TV shows and movies per day, including original series, documentaries and feature films. Members can watch as much as they want, anytime, anywhere, on nearly any Internet-connected screen. Members can play, pause and resume watching, all without commercials or commitments.\n\nConnect with Netflix Online:\nVisit Netflix WEBSITE: http://nflx.it/29BcWb5\nLike Netflix Kids on FACEBOOK: http://bit.ly/NetflixFamily\nLike Netflix on FACEBOOK: http://bit.ly/29kkAtN\nFollow Netflix on TWITTER: http://bit.ly/29gswqd\nFollow Netflix on INSTAGRAM: http://bit.ly/29oO4UP\nFollow Netflix on TUMBLR: http://bit.ly/29kkemT\n\nThe Crown | Growing Up Royal | Netflix\nhttp://youtube.com/netflix"
16317,WB8ozD7l02w,2018-02-05,FIFA 18 - FUT Champions Cup Barcelona - Day 1,EA SPORTS FIFA,20,2018-01-27 00:50:20+00:00,"fifa|""fifa ultimate team""|""fut""|""fifa pack opening""|""fifa xbox""|""fifa ps4""|""fifaeas""|""FIFA 18""|""FIFA 18 Ultimate Team""|""FIFA 18 XBOX""|""FIFA 18 PS4""",803236,19479,908,225,https://i.ytimg.com/vi/WB8ozD7l02w/default.jpg,False,False,False,Day 1 of the FUT Champions Cup Barcelona featuring 128 player Swiss Group Play
16223,Wg-HTE1WbeI,2018-02-05,Facebook Removes Black Panther Sabotage Event - Movie Talk,ColliderVideos,24,2018-02-02 18:34:33+00:00,"tobeornottobethatisthequestion|""Black Panther""|""Facebook""|""Alt-Right""|""Black Panther Facebook""|""Black Panther Petition""|""Octavia Spencer""|""Super Mario Bros""|""Super Mario""|""Mario Brothers""|""Minions""|""Illumination Entertainment""|""F. Gary Gray""|""Men in Black""|""Will Smith""|""Men in Black Spinoff""|""MIB""|""Leonardo DiCaprio""|""Leonardo Da Vinci""|""John Logan""|""Da Vinci Movie""|""Biopic""|""The Week Of""|""Adam Sandler""|""Chris Rock""|""Netflix""|""Movie News""|""Movie Fans""|""Movie Talk""|""Entertainment News""",68777,2573,357,1654,https://i.ytimg.com/vi/Wg-HTE1WbeI/default.jpg,False,False,False,"On this episode of Collider Movie Talk (Friday, February 2nd, 2018) Mark Ellis, Dennis Tzeng, Perri Nemiroff, and John Rocha discuss the following:\n\n1) Facebook removes Black Panther sabotage event \n\n2) Octavia Spencer plans to buy out Mississippi screening of 'Black Panther' for underserved\n\n3) Animated Super Mario Bros. Movie in the Works at Illumination Entertainment\n\n4) F Gary Gray in Talks to Direct Men in Black Spin-off\n\n5) Leonardo DiCaprio Sets John Logan to Adapt Leonardo Da Vinci Biography\n\n6) ‘The Week Of’ Trailer Reveals Adam Sandler’s New Netflix Movie with Chris Rock\n\n7) Live Twitter Questions\n\nThe same Facebook group that took credit for rigging the Rotten Tomatoes audience score of Star Wars: The Last Jedi, set their sights on trying to sabotage the score of the upcoming Marvel film Black Panther – with threats that they were also planning on doing the same for Solo: A Star Wars Story and Avengers Infinity War. \n\nOctavia Spencer took to her Instagram account to announce that she’s planning to buy out a movie theatre in Mississippi to offer screenings of Black Panther to “underserved communities.”  The actress plans on being in Mississippi the weekend of February 16th.\n\nAGREE / DISAGREE\n\nNintendo announced yesterday that it is partnering up with Universal Pictures’ Illumination Entertainment to develop a Mario movie, confirming earlier reports that a movie was in the works. Details at this time are slim, but the film will be based on the world of Super Mario Bros. and will star Mario as the main character. \n\nDeadline reports that Straight Outta Compton and Fate of the Furious helmer F Gary Gray is in negotiations to direct a new Men In Black film that will relaunch the franchise for Sony and Amblin. The studio has been trying to crack a new series of films after the original pairing of Tommy Lee Jones and Will Smith ended its run after the 2012 third installment. \n\nDeadline reports that Leonardo DiCaprio and his Appian Way banner has tapped the Oscar-nominated screenwriter of Skyfall and The Aviator, John Logan, to write the script for a Da Vinci movie based on Walter Isaacson’s biography: Leonardo da Vinci. \n\nNetflix has released the first trailer for The Week Of, the latest collaboration between the streaming service and Adam Sandler. The film marks the feature directorial debut of Robert Smigel, best known as the voice of Triumph the Insult Comic Dog, who also co-wrote the movie with Sandler.  \n\nLIVE TWITTER QUESTIONS\n\nFollow us on Twitter: https://twitter.com/ColliderVideo\nFollow us on Instagram: https://instagram.com/ColliderVideo\nFollow us on Facebook: https://facebook.com/colliderdotcom\n \nAs the online source for movies, television, breaking news, incisive content, and imminent trends, Collider is more than an essential destination. Visit Collider: http://collider.com\n \nFollow the site on Twitter: https://twitter.com/Collider\n\nSubscribe to the SCHMOES KNOW channel: https://youtube.com/schmoesknow\n\nAnd for even more great Collider Video content, check out our weekly schedule below and follow the links to peruse episodes both old and new. We’re your go-to destination for all things fandom.\n\nCOLLIDER MOVIE TALK - Weekdays 12PM ET / 9AM PT\nEntertainment News, Roundtable discussion and debate\nhttp://bit.ly/29BRtOO\n\nCOLLIDER HEROES  - Mondays & Wednesdays 5PM ET / 2PM PT\nThe latest news and speculation in the world of comic book movies, television, and graphic novels\nhttp://bit.ly/29F4Job\n\nCOLLIDER JEDI COUNCIL - Thursdays 5PM ET / 2PM PT\nWhat's new in the Star Wars universe and what we can expect from all the upcoming movies, novels, comics and more\nhttp://bit.ly/29v5wVi\n\nMOVIE TRIVIA SCHMOEDOWN - Tuesdays & Fridays 5PM ET / 2PM PT\nHead-to-head game show that turns trivia into a fierce competition\nhttp://bit.ly/29C2iRV\n\nPlus MOVIE & TV REVIEWS, INTERVIEWS, EDITORIALS, MAILBAG, MOVIE COMMENTARIES, VR GAMING, COMIC BOOK SHOPPING, THE TOP 50 SUPERHERO MOVIES OF ALL TIME, and much more each week. Subscribe today! http://bit.ly/2z80n4O"
16379,WrcwcMIYpQg,2018-02-05,FLOWER BOY: a conversation,"Tyler, The Creator",27,2018-01-22 15:33:36+00:00,"tyler the creator|""jerrod carmichael""|""scum fuck flower boy""|""sffb""|""flower boy""|""interview""|""grammys""|""two furry chairs""|""send one your love""|""see you again""|""golf wang""|""911""|""i aint got time""|""musiq 143""|""cortex samba""|""justin senorita""|""pharrell smile""|""garden shed""|""boredom""",1145672,71291,443,5146,https://i.ytimg.com/vi/WrcwcMIYpQg/default.jpg,False,False,False,Jerrod Carmichael / Tyler Okonma\n\nDirected By: Wolf Haley\nDP: Luis Panch Perez\nProduction: Happy Place\nSet Design: GOLF* home\nBackdrop: Brendon Burton
