id,video_id,trending_date,title,channel_title,category_id,publish_time,tags,views,likes,dislikes,comment_count,thumbnail_link,comments_disabled,ratings_disabled,video_error_or_removed,description
16350,hph2mamrzfE,2018-02-05,Faded - Kim Petras ft. Lil Aaron (Official Music Video),Kim Petras,22,2018-01-25 17:00:11+00:00,"Faded|""Kim Petras""|""Lil Aaron""|""Music Video""|""Official Video""",490949,4403,215,655,https://i.ytimg.com/vi/hph2mamrzfE/default.jpg,False,False,False,"💚 Faded featuring Lil Aaron out now http://awal.lnk.to/h6a_Z 💚\n\nFOLLOW ME\nhttp://instagram.com/kimpetras\nhttp://twitter.com/kimpetras\nhttp://facebook.com/kimpetras\n\nFOLLOW LIL AARON\nhttp://twitter.com/lilaaron911\nhttp://instagram.com/lilaaron911\n\nLYRICS \n\nThey wanna squeeze you when you're warm\nWhen it's cold they ain't around\nThey crowd around you when you up\nThen disappear when you get stuck\n\nI stay faded every nigh-high-hight\nI stay faded every nigh-high-hight\nI stay faded, I ain't ly-high-hine\nI stay faded, I ain't ly-high-hine\nI stay faded every nigh-igh-igh-ight\nStay faded every nigh-igh-igh-ight\nFaded, I ain't ly-y-y-y-y-in'\nStay faded, I ain't ly-y-y-y-y-in'\n\nWhy they always want my time (Always want my time)\nAin't like we can rewind (Like we can rewind)\nAnd I ain't gonna lie (And I ain't gonna lie)\nI'm faded out my mind (Faded out my mind)\nFaded every night (Faded every night)\nI can touch the sky (I can touch the sky)\nI be too faded to drive (I be too faded to drive)\nEvery night I'm on a flight (Every night I'm on a flight)\nThis is all about us (All about us)\nSpend some money, live it up (Spend some money live it up)\nThey never saw when it was rough (Rough, rough, rough)\nDrop the top, then roll the windows up (Roll the windows up)\n \nThey wanna squeeze you when you're warm\nWhen it's cold they ain't around\nThey crowd around you when you up\nThen disappear when you get stuck\n\nI stay faded every nigh-high-hight\nI stay faded every nigh-high-hight\nI stay faded, I ain't ly-high-hine\nI stay faded, I ain't ly-high-hine\nI stay faded every nigh-igh-igh-ight\nStay faded every nigh-igh-igh-ight\nFaded, I ain't ly-y-y-y-y-in'\nStay faded, I ain't ly-y-y-y-y-in'\n\nStay faded every night-igh-ight\nFaded everyday (Faded everyday)\nThat's the only way (That's the only way)\nThat's the, that's the only way (That's the only way)\nIn and out of different places (Places, places)\nBut I can't see their faces (Face at all)\nThey wanna love me cause I'm famous (Famous-mous)\nCan't nobody blame us, no\nAnd this is all about us (This is all about us)\nSpend some money, live it up (Live it, live it, up, up)\nThey never saw when it was rough (When it was rough, when it was rough)\nDrop the top then roll the windows up (Drop it, roll the windows up)\n \nThey wanna squeeze you when you're warm\nWhen it's cold they ain't around\nThey crowd around you when you up\nThen disappear when you get stuck\n\n[Chorus: Kim Petras]\nI stay faded every nigh-high-hight\nI stay faded every nigh-high-hight\nI stay faded, I ain't ly-high-hine\nI stay faded, I ain't ly-high-hine\nI stay faded every nigh-igh-igh-ight\nStay faded every nigh-igh-igh-ight\nFaded, I ain't ly-y-y-y-y-in'\nStay faded, I ain't ly-y-y-y-y-in'\n\n[Lil Aaron]\nYeah, I stay faded only smoking A-graded\nEverybody fake as fuck so I been self medicatin'\nI'm the greatest that there was and still the most underrated\nThat shit ain't up for discussion or debatin' (know you hate it, yeah)\nStill I gotta get fucked up to have a good time\nIf there's something in my cup then it's a good night\nI'm hittin' up the plug, tell 'em I'ma double up\nI'ma need a couple blunts, make 'em double-stuffed\n \nThey wanna squeeze you when you're warm\nWhen it's cold they ain't around\nThey crowd around you when you up\nThen disappear when you get stuck\n\nI stay faded every nigh-high-hight\nI stay faded every nigh-high-hight\nI stay faded, I ain't ly-high-hine\nI stay faded, I ain't ly-high-hine (I stay faded)\nI stay faded every nigh-igh-igh-ight\nStay faded every nigh-igh-igh-ight\nFaded, I ain't ly-y-y-y-y-in'\nStay faded, I ain't ly-y-y-y-y-in'\n\nWoo!-Ahh!"
16242,hwnDMahSwNI,2018-02-05,Joe Kennedy criticizes Trump in Democratic response,CNN,25,2018-01-31 05:19:12+00:00,"latest News|""Happening Now""|""CNN""|""state of the union address""|""politics""|""joe kennedy""|""joseph kennedy III""",359839,5389,4895,8008,https://i.ytimg.com/vi/hwnDMahSwNI/default.jpg,False,False,False,"Rep. Joe Kennedy (D-MA) sharply criticized President Donald Trump and his administration, giving the Democratic party's response to the State of the Union with a speech that became a rallying cry around key causes that make up his party's coalition.\nKennedy, who spoke in front of a Mustang on a car lift in the autoshop at Diman Regional Technical School in Fall River, Massachusetts, pitched the Democratic Party as a party that helps Coal miners or single moms. Rural communities or inner cities. The coast or the heartland.\nSo here is the answer Democrats offer tonight: we choose both, he said. We fight for both. Because the strongest, richest, greatest nation in the world shouldn't leave any one behind.\nKennedy, who comes from one of the most prominent families in American politics, referenced helping immigrants, addressing those affected by the expiring Deferred Action for Childhood Arrivals program and at one point speaking to them in Spanish. \nHe indirectly referenced Trump as a bully during his response.\nBullies may land a punch. They might leave a mark, the Massachusetts Democrat said. But they have never, not once, in the history of our United States, managed to match the strength and spirit of a people united in defense of their future.\nHe also tied the turmoil of the past year to Trump's administration, saying, We all feel the fault lines of a fractured country ... We hear the voices of Americans who feel forgotten and forsaken.\nKennedy slammed Trump for targeting laws that protect Americans."
16260,i7FgneNlM14,2018-02-05,WEEI: Alex Reimer calls Tom Brady’s daughter an “Annoying Little Pissant” 1/25/18,Nick Ramos,17,2018-01-27 04:20:20+00:00,"WEEI|""Sports Radio""|""Alex Reimer""|""Mike Mutnansky""|""Mut""|""New England Patriots""|""Pats""|""Tom Brady""|""Facebook""|""Doc""|""Documentary""|""Tom vs. Time""|""Daughter""|""Pissant""|""Vulgar""|""Language""|""Idiot""|""Moron""|""Dumb""|""Stupid""|""Vivian""|""Kid""|""Child""|""Girl""|""Stupidity""|""Children""|""Family""|""Mut at Night""|""Boston""",1436387,614,834,939,https://i.ytimg.com/vi/i7FgneNlM14/default.jpg,False,False,False,"Here’s Alex Reimer on WEEI’s Mut at Night with Mike Mutnansky discussing Tom Brady’s Facebook documentary series that just came out called “Tom vs. Time” and coming out of a break, Alex decided to while describing a scene in the doc at Tom Brady’s house & decides to call his 5-year old daughter an “annoying little pissant”. SMH, what an idiot!!"
16255,izyX4qtsVew,2018-02-05,"WHEN WE FIRST MET Official Trailer (2018) Alexandra Daddario, Netflix Movie HD",ONE Media,1,2018-01-29 14:51:44+00:00,"Cinema|""Trailer""|""Official""|""Movie""|""Film""|""When We First Met""|""Alexandra Daddario""|""Netflix""",2080613,24282,968,1003,https://i.ytimg.com/vi/izyX4qtsVew/default.jpg,False,False,False,"WHEN WE FIRST MET Official Trailer (2018) Alexandra Daddario, Netflix Movie HD\n© 2018 - Netflix\n\nComedy, Kids, Family and Animated Film, Blockbuster,  Action Cinema, Blockbuster, Scifi Movie or Fantasy film, Drama...   We keep you in the know! \n\nSubscribe now to catch the best movie trailers 2017 and the latest official movie trailer, film clip, scene, review, interview."
16227,j3IYFeVwf5I,2018-02-05,President Trump Participates in a Customs and Border Protection Roundtable,The White House,25,2018-02-03 00:13:10+00:00,[none],48452,2104,109,870,https://i.ytimg.com/vi/j3IYFeVwf5I/default.jpg,False,False,False,"Sterling, VA"
16250,jcNwBdJd1aI,2018-02-05,Leah Labelle-I Have Nothing,Domeju,24,2017-06-29 20:02:42+00:00,"leah labelle|""i have nothing""|""american idol""|""leah labelle i have nothing""",167441,332,20,100,https://i.ytimg.com/vi/jcNwBdJd1aI/default.jpg,False,False,False,American Idol Season 3\nI DO NOT OWN ANY OF THE CONTENT CONTAINED IN THIS VIDEO NO COPYRIGHT INFRINGEMENT INTENDED
16293,jm_mZqqL40M,2018-02-05,83. You + Me,Will Darbyshire,1,2018-01-28 18:53:29+00:00,"willdarbyshire|""film""|""will darbyshire""|""william darbyshire""|""Brussels""|""Belgium""",115562,13953,82,449,https://i.ytimg.com/vi/jm_mZqqL40M/default.jpg,False,False,False,"With thanks to the Brussels Tourism Board, \nGo visit guys, it was lovely.\n\nMusic by the wonderful Flatsound:\nhttps://www.flatsound.org\n\nFind me here:\nhttp://twitter.com/willdarbyshire\nhttp://willdarbyshire.tumblr.com\nhttp://instagram.com/willdarbyshire"
16376,jrkhLuroyzg,2018-02-05,2 Card Slay the Spire Run - Consistent Turn 1 Infinite Combo,RiskyCB,20,2018-01-25 02:46:48+00:00,"Slay the Spire|""RiskyCB""|""2 card deck""|""infinite""|""combo""|""ironclad""|""dual wield""|""flash of steel""|""slay""|""the""|""spire""|""silent""|""run""",161668,1954,79,163,https://i.ytimg.com/vi/jrkhLuroyzg/default.jpg,False,False,False,"This run was sweet. I could have optimized the fights a bit more, like Thunderclap on Champ etc, but I didn't want to lose the run to a silly mistake like miscounting cards. Everything went right... got every remove we could want, the Panache+ to save us from the event before the end. GG\n\n1 card deck next!\n\nfull vod of run: https://www.twitch.tv/videos/218790468\nclips taken from my stream: https://www.twitch.tv/RiskyCB\ntwitter: https://www.twitter.com/RiskyCB"
16288,kKk6vEqFFOA,2018-02-05,BLACK PANTHER Movie Clip Killmonger Vs T'Challa + Trailer NEW (2018) Superhero Movie HD,MovieAccessTrailers,24,2018-01-30 05:15:52+00:00,"black panther trailer|""black panther""|""trailer""|""2018""|""new""|""new trailer""|""official""|""official trailer""|""hd trailer""|""superhero""|""movie""|""film""|""hd""",88434,1004,131,399,https://i.ytimg.com/vi/kKk6vEqFFOA/default.jpg,False,False,False,"BLACK PANTHER Movie Clip Killmonger Vs T'Challa + Trailer NEW (2018) Superhero Movie HD\n\nSubscribe To MovieAccessTrailers To Catch Up All The New Movie Trailer, Movie Clips, TV Spots & Trailer Compilation Just For You. Subscribe Now and Turn The Notification On To Never Miss Any Official 2018 Movie Trailer From Us."
16262,kVWj8lgQvsE,2018-02-05,Fifth Harmony’s Ally Brooke is Selena AND J-Lo | Lip Sync Battle Preview,Lip Sync Battle,24,2018-01-29 15:00:03+00:00,"Singing|""Lip Sync Battle""|""Dancing""|""Lip Syncing""|""LL""|""Cool""|""Chrissy Teigen""|""Music""|""Comedy""|""lip sync""|""battle""|""dance""|""Lip Sync Show""|""lsb""|""ally brooke""|""fifth harmony""|""como la flor""|""on the floor""|""latina""|""latino""|""women""|""support""|""pays tribute""|""j-lo""|""j lo""|""selena""|""latina music""|""tribute""|""combo""|""Como la Flor""|""On the Floor""",500676,9780,251,375,https://i.ytimg.com/vi/kVWj8lgQvsE/default.jpg,False,False,False,"Ally Brooke of Fifth Harmony has us soaring with a breathtaking combo sync of Selena’s “Como la Flor” and J-Lo’s “On the Floor.” Lip Sync Battle, Thursdays at 10/9c on Paramount Network.\n\n#ParamountNetwork #LipSyncBattle #LSB #FifthHarmony #Selena #JLo\n\nSubscribe to Lip Sync Battle: http://bit.ly/17wiz6n\n\nFollow Lip Sync Battle!\nFacebook: https://www.facebook.com/lipsyncbattle\nTwitter: @LSB https://twitter.com/LSB \nInstagram: @LipSyncBattle https://instagram.com/LipSyncBattle\nOfficial Playlist on Spotify: http://spoti.fi/1EvIXgh\nGiphy: http://giphy.com/lipsyncbattle\nTumblr: http://lipsyncbattle.tumblr.com\n\nFollow Paramount Network!\nWebsite: http://www.paramountnetwork.com\nYouTube: http://bit.ly/2G3Bo3w\nFacebook: @ParamountNetwork\nInstagram: @ParamountNetwork\nTwitter: @ParamountNet\n\nLip Sync Battle is back for another season of epic performances from the hottest stars on the planet! Each week, A-list celebrities go toe to toe, syncing contemporary hits and classic tracks, all for the ultimate bragging rights: the title of Lip Sync Battle Champion. Hosted by LL Cool J and Chrissy Teigen."
16300,kb1qAO9KB3k,2018-02-05,Lil Uzi Vert Super Awkward Red Carpet Interview at The 2018 Grammy's,HipHopSupply,10,2018-01-28 23:39:07+00:00,"lil uzi vert interview|""awkward""|""funny""|""grammys""|""lil uzi vert grammy""|""hiphopsupply""|""lil uzi vert red carpet interview""|""lil uzi interview""|""awkward interview""|""lil uzi vert interview grammys""|""2018""|""2018 grammys""|""funny interview""|""red""|""carpet""|""interview""|""lil uzi vert""|""lil uzi""|""poptarts""|""lil uzi vert at red carpet""|""lil uzi at red carpet""|""lil uzi at grammys""|""red carpet grammys""",40395,254,10,65,https://i.ytimg.com/vi/kb1qAO9KB3k/default.jpg,False,False,False,Title: Lil Uzi Vert Red Carpet Interview at The 2018 Grammy's\n🎥Instagram: HipHopSupply1\n🐦 Twitter: HipHopSupply1 \n💻 Website: hiphopsupply.net
16310,lfIhBu0TZBs,2018-02-05,Moving on from Beme,CaseyNeistat,22,2018-01-25 14:58:16+00:00,[none],2608146,77587,7758,7693,https://i.ytimg.com/vi/lfIhBu0TZBs/default.jpg,False,False,False,this is hard for me.  i rerecorded this video a dozen times.  there is a lot to say.  this is a huge chapter in my life coming to a close.  please give Matt's blog post a read.  He says it better than i ever could. https://medium.com/@mhkt/d275c15ff702
16276,li6f_0x0IGE,2018-02-05,Meet My BABY GIRL! | Fleur De Force,Fleur DeForce,26,2018-01-28 17:00:07+00:00,"fleurdeforce|""fleur de force""|""fleurdevlog""|""fleur de vlog""|""baby""|""name""|""reveal""|""baby name reveal""|""meet my baby""|""fleur de force baby""|""mother""|""parent""|""post partum""|""pregnancy""|""mum vlogger""|""baby girl""|""baby name""",696967,43049,721,7311,https://i.ytimg.com/vi/li6f_0x0IGE/default.jpg,False,False,False,"Im so excited for you guys to meet my little girl ❤️ Thanks so much for all your lovely comments and your support during my pregnancy and over the past few weeks of being a new mum ❤️ EXPAND this little box for more info, links etc xo \n \nALSO Find Me Here…\nVLOG Channel: http://www.youtube.com/fleurdevlog \nTwitter: @fleurdeforce\nBlog: http://www.fleurdeforce.com\nInstagram: @FleurDeForce\nFacebook: https://www.facebook.com/fleurdeforce\n\nMy eyelash range for Eylure: http://po.st/VoQGZG\nMy BROW range for Eylure: http://bit.ly/2n9HBk7\nOrder my BOOK here: http://bit.ly/FDFTheLuxeLife\nMY MAKEUP LINE! http://www.feelunique.com/brands/fleu...\n\nOTHER VIDEOS YOU MIGHT LIKE\nNursery Tour: https://www.youtube.com/watch?v=yI2k6OKsSVw \nProduct Empties: https://www.youtube.com/watch?v=J4DKqWlk8DE \nWhat’s In My Hospital Bag: https://www.youtube.com/watch?v=MLfDK7Ot3x4 \n\nThis video is not sponsored. All proceeds from the views on this video will be donated charity. The funds will be split equally between Tommy’s (in aid of research into stillbirth, miscarriage and premature birth - https://www.tommys.org) and the Stand Up Foundation (an anti-bullying charity - http://www.standupfoundation-uk.org)"
16198,lp_bsz_4e3U,2018-02-05,Gotham Season 4 See Your Own Darkness Extended Trailer (HD),TV Promos,24,2018-02-03 19:54:40+00:00,"gotham season 4|""gotham season 4 trailer""|""gotham season 4 official trailer""|""gotham season 4 promo""|""gotham fox""|""gotham tv series""|""trailer""|""official trailer""|""official""|""promo""|""teaser""|""series""|""season 4""|""fox""|""fox series""|""fox tv series""|""ben mckeznie""|""david mazouz""|""bruce wayne""|""catwoman""|""the penguin""|""the joker""|""edward nygma""|""gotham trailer""|""tvpromosdb""|""gotham""|""4x12""|""season""|""episode""|""see your own darkness""",83301,2516,94,389,https://i.ytimg.com/vi/lp_bsz_4e3U/default.jpg,False,False,False,"Check out this extended trailer and sneak peek for Gotham Season 4 Episode 12 Pieces of a Broken Mirror airing Thursday March 1st on FOX. Subscribe to tvpromosdb on Youtube for more Gotham season 4 promos in HD!\n\nGotham official website: http://www.fox.com/gotham/\nWatch more Gotham Season 4 videos: https://www.youtube.com/playlist?list=PLfrisy2KXzkcO_gq4sDVTn6w4Q2ZhuVFw\nLike Gotham on Facebook: https://www.facebook.com/GOTHAMonFOX\nFollow Gotham on Twitter: https://twitter.com/Gotham\nFollow Gotham on Instagram: https://www.instagram.com/gothamonfox\n\n» Watch Gotham Thursdays at 8:00pm on FOX\n» Starring: Ben McKeznie, Donal Logue, David Mazouz"
16282,lpzJNwur6Zk,2018-02-05,SUZY (수지) 'HOLIDAY (Feat. DPR LIVE)' M/V,jypentertainment,10,2018-01-29 09:00:04+00:00,"JYP Entertainment|""JYP""",2378224,109784,2755,7057,https://i.ytimg.com/vi/lpzJNwur6Zk/default.jpg,False,False,False,SUZY (수지) 'HOLIDAY (Feat. DPR LIVE)' M/V\n\n1.29 MON 6PM HOLIDAY (Feat. DPR LIVE) : https://melon.do/IkaJIbs2J\n1.22 MON 6PM 다른사람을 사랑하고 있어 : https://melon.do/ybJQM96sJ\n\nSuzy Official Twitter: https://twitter.com/jypesuzy\nSuzy Official Facebook: http://www.facebook.com/JYPESuzy\nSuzy Official Fan's: http://fans.jype.com/Suzy\nSuzy Official Homepage: http://suzy.jype.com\nJYPnation Official Twitter: http://www.twitter.com/jypnation\n\nCopyrights 2018 ⓒ JYP Entertainment. All Rights Reserved.
16371,m0HN1TB-Jcw,2018-02-05,THERAPY Q&A: UNDERSTANDING TRAUMA & EATING ISSUES | GRACE,Grace F Victory,22,2018-01-24 08:16:31+00:00,"grace|""victory""|""gracie francesca""|""mixed race beauty fashion guru""|""plus size""|""curly hair""|""therapy""|""q&a""|""eating disorder""|""trauma""|""mental health""",11511,612,19,105,https://i.ytimg.com/vi/m0HN1TB-Jcw/default.jpg,False,False,False,"Buy my book - http://amzn.to/2nRy6tn\n\nI answer your Instagram questions about therapy. Enjoy x\n\n🎥 LAST VIDEO\n- - - - - - - - - - - - - - - - - - - - \nhttps://www.youtube.com/watch?v=OJoR1qElA0Q&t=1138s\n\n📷 NEWEST POST\n- - - - - - - - - - - - - - - - - - - - \nhttp://www.graciefrancesca.com/2018/01/pitch-brands-collaborations.html\n\n📝 OTHER LINKS MENTIONED\n- - - - - - - - - - - - - - - - - - - - \nThe Recover Clinic @RecoverClinic\ntherecoverclinic.co.uk\nhttp://www.therecoverclinic.co.uk/category/blog/\nBeat @BeatED\nbeateatingdisorders.co.uk\nhttps://www.nhs.uk/conditions/eating-disorders/\nhttps://www.mind.org.uk\n\n🎥 FILMING EQUIPMENT\n- - - - - - - - - - - - - - - - - - - - \nMain Videos Camera - http://bit.ly/29btOXL\nLens - http://bit.ly/1FTCg56\nVlogging Camera - http://bit.ly/2c4jiRG\nLighting - Ring Light http://fave.co/1KOW3bZ\nEditing - FCPX 10\n\n💜 FOLLOW ME\n- - - - - - - - - - - - - - - - - - - - \n💻 BLOG: www.graciefrancesca.com\n🐤 TWITTER: gracefvictory\n📷 INSTAGRAM: gracefvictory\n\n🌍 CONTACT\n- - - - - - - - - - - - - - - - - - - - \n💌 SPONSORSHIP & COLLABS: james@freefocus.co.uk\n💌 OTHER BUSINESS: enquiries@graciefrancesca.com\n\n🙈 DISCLAIMER\n- - - - - - - - - - - - - - - - - - - - \nAll opinions and views are my own. As of August 2013 all items that have been sent to me for an interest in a review, as a gift, or with discount specifically for me only will be marked with an asterix (*) This video is not sponsored. Some of the above links may be affiliate links and if they are, I will earn a small amount of commission when something is purchased through them. This is a great way to support me as so that I can make more fashion content for you on here & my blog. If you're not comfortable with that, then its cool babes."
16305,mXfyOYAdCUc,2018-02-05,WHAT AM I?,KickThePj,1,2018-01-27 22:03:43+00:00,"kickthepj|""pjthekick""|""robot""|""short film""|""short story""|""story""|""steampunk""",82117,16840,75,1580,https://i.ytimg.com/vi/mXfyOYAdCUc/default.jpg,False,False,False,"the story of a confused robot whose primary purpose has lead it to feel something.\nsupport the patreon! https://patreon.com/kickthePJ\ntwitter! http://twitter.com/kickthepj \ninstagram! http://instagram.com/kickthepj\n\nmusic by http://disasterpeace.com/\n\nmy shop! buy sum stuff! http://kickthepjshop.com/\nside channel! http://youtube.com/pjthekick\n\ntumblr! http://kickthepj.tumblr.com\nfacebook, yo! http://facebook.com/kickthepj\n\nother places to get my music! \nhttp://kickthepj.bandcamp.com\nhttps://itunes.apple.com/gb/album/stories-from-somewhere/id471198058"
16287,nIPt7dJrSXw,2018-02-05,HOW TO FIND THE PERFECT SUIT,Jim Chapman,26,2018-01-28 19:00:04+00:00,"jim chapman|""vlog""|""fun""|""funny""|""british""|""youtuber""|""vlogger""|""United Kingdom (Country)""|""Video Blog (Website Category)""|""jim""|""chapman""|""daily""|""main channel""|""main""|""channel""|""daily vlog""|""fashion""|""style""|""men""|""baking""",21183,1651,28,102,https://i.ytimg.com/vi/nIPt7dJrSXw/default.jpg,False,False,False,HOW TO FIND THE PERFECT SUIT\nLINK TO BUY MY BOOK: http://amzn.to/2oGqw1I\n\n•Please leave me a comment and give a thumbs up. It means a lot\n•SUBSCRIBE http://bit.ly/1kV3htg\n\n•WEBSITE http://jimchapman.co.uk\n•TWITTER https://twitter.com/jimchapman\n•INSTAGRAM https://instagram.com/JimChapman\n•SNAPCHAT JimChapman\n•FACEBOOK http://facebook.com/OfficialJimChapman\n\n•ADDRESS\nGleam Futures\n6th Floor\n60 Charlotte Street\nLondon W1T 2NU\n\n•BUSINESS ENQUIRIES millie@gleamfutures.com
16375,nQ7mhC5_Rys,2018-02-05,Altwork 1 Minute Video,altwork,28,2017-01-21 00:12:02+00:00,[none],58488,0,0,0,https://i.ytimg.com/vi/nQ7mhC5_Rys/default.jpg,True,True,False,
16385,nrB7aqfRzyE,2018-02-05,Eagles Fan Gets Wrecked by Pole,494ta,1,2018-01-22 07:23:29+00:00,[none],656836,828,39,150,https://i.ytimg.com/vi/nrB7aqfRzyE/default.jpg,False,False,False,"ORIGINAL POST! I shot this video. \n\nEagles fan runs into pole.\nWhat a hit. Someone invite that pillar to training camp. \n\nEagles game on 1/21/18.\n\n* Jukin Media Verified *\nFind this video and others like it by visiting https://www.jukinmedia.com/licensing/view/982532\nFor licensing / permission to use, please email licensing(at)jukinmedia(dot)com."
16218,nwPQVagUfrU,2018-02-05,"Depression, Me & Make-up #timetotalk",pixiwoo,26,2018-02-01 18:30:02+00:00,"pixiwoo|""fashion""|""beauty""|""mental health""|""depression""|""anxiety""",161049,11281,139,1359,https://i.ytimg.com/vi/nwPQVagUfrU/default.jpg,False,False,False,Instagram http://www.instagram.com/pixiwoos
16338,oEtEBOy0ys8,2018-02-05,THINGS WE ALL DID IN BRITISH SECONDARY SCHOOL,Luke Birch,24,2018-01-25 20:41:17+00:00,"British Secondary School|""Things we all did in Secondary School""|""Things we all did in British Secondary School""|""Things we all did in High School""|""Things everyone does in Secondary School""|""Secondary School""|""British secondary school exposed""|""Secondary School memories""|""Day In The Life British Secondary School""|""British vs American High School""|""Types of British Secondary Schools""|""British school fights""|""Things that happen in British schools""|""British public vs Private school""",156322,13339,181,2774,https://i.ytimg.com/vi/oEtEBOy0ys8/default.jpg,False,False,False,A few relatable things that we all do in British Secondary School/British High School... \n• All My Social Media Links •\nTWITTER: https://twitter.com/LukeBirch_   \nINSTAGRAM: http://instagram.com/lukebirch_\nSNAPCHAT: lukebirch.26 \nFACEBOOK: https://www.facebook.com/TheLukeBirch\n\nBusiness Enquires: thelukebirch@outlook.com  \n------------------------------------------------------------------------------------------------\nWatch my short film 'The Not Bucket List' here: https://www.youtube.com/watch?v=GY1Gcv7wRig&t=501s\n\nCOMING OUT TO MY PARENTS: https://www.youtube.com/watch?v=jlv7O6AYNJM\n\nDAY IN THE LIFE OF A UNIVERSITY STUDENT: https://www.youtube.com/watch?v=K8wsBcYvu1E&t=28s \n\nMY COMING OUT STORY: https://www.youtube.com/watch?v=x2kX8mbxwj4&t=766s\n\nPACIFIC SUN by Nicolai Heidlas Music https://soundcloud.com/nicolai-heidlas\nCreative Commons — Attribution 3.0 Unported— CC BY 3.0 \nhttp://creativecommons.org/licenses/b...\nMusic promoted by Audio Library https://youtu.be/kbqmEJTr3nU
16311,oWjxSkJpxFU,2018-02-05,Suicide: Be Here Tomorrow.,Logan Paul Vlogs,29,2018-01-24 18:30:01+00:00,"logan paul vlog|""logan paul""|""logan""|""paul""|""logan paul youtube""|""logan paul suicide""|""suicide prevention awareness""|""suicide prevention""|""5 steps""|""suicide hotline""|""suicide lifeline""|""national""|""kevin hines""|""golden gate bridge""|""survival""|""be here tomorrow""",26703269,2061275,545595,704824,https://i.ytimg.com/vi/oWjxSkJpxFU/default.jpg,False,False,False,"National Suicide Prevention Lifeline\nCall 1-800-273-8255\nCrisis Textline, Free 24/7 Support: Text 741741\n\nLearn how you can #BeThe1To save a life. Help someone in crisis at:\nhttp://bit.ly/2FbwLU6\n\nSpecial Thanks to Kevin Hines. Learn about his story: http://bit.ly/2GevTiw\nFollow Kevin on IG: http://bit.ly/2F6oLUb\nFollow Kevin on Twitter: http://bit.ly/2n6UJt0\nCheck out his movie “Suicide: The Ripple Effect”: http://bit.ly/2n8DOW9\n17th and Montgomery Productions: http://bit.ly/2Dv7fZf\n\nSpecial Thanks to Bob Forrest:\nLearn about Alo House Recovery Centers: http://bit.ly/2n94ZA3\nLearn more about Bob: http://bit.ly/2DIAjzZ\n\nSpecial Thanks to Dr. John Draper:\nLearn more about the Suicide Prevention Lifeline: http://bit.ly/2Braxe9\n\nSpencer Taylor:\nhttps://www.instagram.com/vybesource/"
