id,video_id,trending_date,title,channel_title,category_id,publish_time,tags,views,likes,dislikes,comment_count,thumbnail_link,comments_disabled,ratings_disabled,video_error_or_removed,description
16269,E9za4QHGnqQ,2018-02-05,Diplo - Get It Right (Feat. Mø) (Behind The Scenes),Diplo,10,2018-01-30 14:58:30+00:00,"Get It Right Diplo feat. Mø|""Get it Right""|""Get It Right Song""|""Get It Right Mø""|""Get it right momomoyouth""|""Get It Right Diplo""|""Diplo""|""Momomoyouth""|""Diplo new song""|""Mayor lazor""|""Mayor lasor""|""mØ""|""moe""|""official lyric video diplo""|""mØ official lyric video""|""get it right lyric video""|""diplo get it right""|""diplo""|""mo""|""get it right music video""|""Diplo - Get It Right (Feat. Mø) (Official Video)""|""Get it right music video mø""|""major lazer""|""get it right behind the scenes""",85068,3260,29,142,https://i.ytimg.com/vi/E9za4QHGnqQ/default.jpg,False,False,False,"Behind the Scenes Video | Diplo - Get It Right (Feat. Mø)\n\nWatch the Get It Right Music Video - \nhttp://diplo.fm/GetItRightVideo\n\nWatch the give me future documentary, only on apple music | http://majorlazer.fm/GiveMeFuture\n\n“Get It Right” from the Give Me Future Soundtrack\n\nStream the Give Me Future Soundtrack\nSTREAM - http://majorlazer.fm/GMFST\nSPOTIFY - http://majorlazer.fm/GMFSTSP\nDOWNLOAD - http://majorlazer.fm/GMFSTDL\nAPPLE MUSIC - http://majorlazer.fm/GMFSTAM\nSOUNDCLOUD - http://majorlazer.fm/GMFSTSC\nGOOGLE PLAY - http://majorlazer.fm/GMFSTGP\n\nDirector: Brantley Gutierrez\nDP: Eric Ulbrich\nEditor: Ryan Adams\nProducer: Kyle Schember, Renée George\nVideographer: Aashish Gandhi \nExecutive Producer: Nina Soriano\nProduction Company: Anonymous Content / Subtractive\nChoreography: Sara Bivens, Calvit Jr\nStyling: Kristin Ferandez\nHair and Makeup: Sami Knight & Amy Chance\n\nLyrics:\nI am walking down that road\nWhere did all the flowers go?\nThey say we're supposed to grow\nLearning from the highs and low\nAll eyes lying on me, oh\nBegging me to play the role\n'Cause I'm gonna get it right\nI'm gonna get it right\nThey can try to hold me down, but I am\nI'm gonna get it right\nWhen the sky is filled with smoke and fire\nI'm gonna get it right\nAll I want is something better in the purple light\nThey can try to hold me down, but I am\nI'm gonna get it right\nAll my dreams are running wild\nI'm gonna chase them down\nThey said, you can't lose your mind, hurry up, you're out of time\nI said, I will rise and shine, even in the coldest night\n'Cause I'm gonna get it right\nI'm gonna get it right\nYou can try to hold me down, but I am\nI'm gonna get it right\nWhen the sky is filled with smoke and fire\nI'm gonna get it right\nAll I want is something better in the purple light\nThey can try to hold me down, but I am\nI'm gonna get it right\nI'm gonna get it right\nI'm gonna get it right"
16197,EFNeulNdfRI,2018-02-05,The Mooch | Real Time with Bill Maher (HBO),Real Time with Bill Maher,1,2018-02-03 05:44:26+00:00,"Council on Foreign Relations|""Richard Haass""|""A World in Disarray""|""American Foreign Policy and the Crisis of the Old Order""|""Anthony Scaramucci""|""White House Communications Director""|""President Trump""|""David Frum""|""The Atlantic""|""Trumpocracy""|""The Corruption of the American Public""|""Donna Brazile""|""Chairwoman""|""Democratic National Committee""|""Hacks""",584326,4999,616,2347,https://i.ytimg.com/vi/EFNeulNdfRI/default.jpg,False,False,False,Subscribe to the Real Time YouTube: http://itsh.bo/10r5A1B\n\nFormer White House Communications director Anthony Scaramucci joins Bill Maher and panelists David Frum and Donna Brazile to discuss the 2016 election and the president's first year in office.\n\nConnect with Real Time Online:\nFind Real Time on Facebook: https://www.facebook.com/Maher\nFind Real Time on Twitter: https://twitter.com/RealTimers\nFind Real Time with Bill Maher Official Site: http://itsh.bo/HttKcM.\nFind Real Time with Bill Maher on HBO GO® http://itsh.bo/iioY87.\nFind Real Time with Bill Maher on Connect: http://connect.hbo.com/real-time-bill-maher\nFind Real Time on Instagram: http://instagram.com/realtimers\nThe Real Time blog: http://www.real-time-with-bill-maher-blog.com/\n\nIt's HBO.\n\nConnect with HBO Online\nFind HBO on Facebook: http://Facebook.com/HBO\nFollow @HBO on Twitter: http://Twitter.com/HBO\nFind HBO on Youtube: http://Youtube.com/HBO\nFind HBO Official Site: http://HBO.com\nFind HBO Connect: http://Connect.hbo.com\nFind HBO GO: http://HBOGO.com\nFind HBO on Instagram: http://Instagram.com/hbo\nFind HBO on Foursquare: http://Foursquare.com/hbo\n\nCheck out other HBO Channels\nHBO: http://www.youtube.com/hbo\nGame of Thrones: http://www.youtube.com/GameofThrones \nTrue Blood: http://www.youtube.com/trueblood \nHBO Sports: http://www.youtube.com/HBOsports \nHBO Documentary Films: http://www.youtube.com/HBODocs \nCinemax: http://www.youtube.com/Cinemax \nHBO Latino: http://www.youtube.com/HBOLatino
16367,ERyfRmz0N-w,2018-02-05,#ConanHaiti Preview: Haitians Roast Trump  - CONAN on TBS,Team Coco,23,2018-01-23 03:52:25+00:00,[none],528163,11467,1619,1731,https://i.ytimg.com/vi/ERyfRmz0N-w/default.jpg,False,False,False,"President Trump recently made some disparaging remarks about Haiti. Conan gave the people of Haiti a chance to respond in kind. #ConanHaiti premieres Saturday, January 27th on TBS.\n\nMore CONAN @ http://teamcoco.com/video\n\nTeam Coco is the official YouTube channel of late night host Conan O'Brien, CONAN on TBS & TeamCoco.com. Subscribe now to be updated on the latest videos: http://bit.ly/W5wt5D\n\nFor Full Episodes of CONAN on TBS, visit http://teamcoco.com/video\n\nGet Social With Team Coco:\nOn Facebook: ‪https://www.facebook.com/TeamCoco‬\nOn Google+: https://plus.google.com/+TeamCoco/\nOn Twitter: http://twitter.com/TeamCoco\nOn Tumblr: http://teamcoco.tumblr.com\nOn YouTube: http://youtube.com/teamcoco\n\nFollow Conan O'Brien on Twitter: http://twitter.com/ConanOBrien"
16252,EW3KD4kqqug,2018-02-05,Rose McGowan Talks Alleged Sexual Misconduct By Harvey Weinstein | The View,The View,29,2018-01-30 16:39:00+00:00,"Rose McGowan|""Rose's Army""|""MeToo""|""Time's Up""|""The View""|""feminism""|""women's rights""|""hot topics""|""Harvey Weinstein""|""Hollywood""",246092,2441,503,1249,https://i.ytimg.com/vi/EW3KD4kqqug/default.jpg,False,False,False,
16217,EZOZ-XD5wmg,2018-02-05,SHOULD I HAVE A HOME BIRTH?,Jamie and Nikki,22,2018-02-01 19:00:03+00:00,"jamie and nikki|""family vlog""|""daily vlog""|""beauty guru""|""pregnancy""|""make up""|""toddler""|""black""|""african american""|""interracial""|""cute""|""sacconejolys""|""ace family""|""daily bumps""|""ellie and jared""|""gender reveal""|""home birth""|""birth video""|""labor video""|""vlogger""|""reality tv""|""real life""|""daddy daughter""|""home rennovation""|""diy""|""kitchen make over""|""house tour""|""mom""|""baby""|""newborn""|""patricia bright""",305734,16457,217,1973,https://i.ytimg.com/vi/EZOZ-XD5wmg/default.jpg,False,False,False,"Video gear we use to film our Vlogs : \n\nDJI Phantom 4 Pro - http://amzn.to/2qfRJNK\nDJI Mavic Drone - http://click.dji.com/AGRyErOhE67yTZ3v9Kk?pm=link\nSony A7R ii - http://amzn.to/2nA5MwM\nSony 24-70 lens - http://amzn.to/2o2DaIY\nSony 24-240 lens - http://amzn.to/2nYFOi2\nCanon G7X ii - http://amzn.to/2nYHc43\nCanon G&X i - http://amzn.to/2oVspZj\nRode Stereo Videomic Pro - http://amzn.to/2o2vdne\nJoby Gorilla Pod Focus - http://joby.com/gorillapod/gorillapod-focus\nJoby Gorilla Pod Micro Hybrid - http://joby.com/gorillapod/micro-hybrid\nGoPro Hero 5 - http://amzn.to/2nYBrDC\nGoPro Suction Mount -http://amzn.to/2pow15W\n\nFollow Us - \n\nNikki :\n\nHttp://www.instagram.com/jamieandniks\nhttp://www.facebook.com/jamieandniks\nSnapchat - NikkiPerkinsXO\n\nJamie :\n\nHttp://www.instagram.com/jaypfilm\nTwitter @jamieandniks\nSnapchat - Jamieandniks\n\nMusic in this Vlog :\n\nEpidemic Sound ( Great source of copyright free music for youtubers ) - https://goo.gl/VpkPq3 \n\n\nWe are always looking for great music to feature in our vlogs. If your a musician and you've got some cool tracks for us to consider using please e-mail us at beatsforjamie@hotmail.com . We love Soul, Jazz, Hip Hop (especially trap and boom bap instrumentals!) Funk, Folk and especially instrumentals. We are also currently looking for acoustic music as well\n\nINTRO MUSIC PRODUCED AND WRITTEN BY 'MATT HALL'\nCheck out more of his music here https://soundcloud.com/see-outside-inn\n\nHave a question for us? We may just have answered it in our most recent Q&A video : https://www.youtube.com/watch?v=AggVUk1_5yw\n\nFOR ALL BUSINESS, SPONSORSHIP OR FEATURED PRODUCT ENQUIRIES PLEASE CONTACT US AT:\njamieandniks@hotmail.com"
16225,ElKPnh0Q8pU,2018-02-05,A Boogie Wit Da Hoodie - Somebody feat. Don Q [Official Music Video],A-Boogie Wit Da Hoodie,1,2018-02-01 17:02:19+00:00,"A Boogie|""A Boogie Wit Da hoodie""|""Somebody""|""Don Q""|""The Bigger Artist""|""Artist""|""TBA""|""Highbridge""|""Highbridge The Label""|""Atlantic Records""|""Hip Hop""|""Rap""|""New York""|""Bronx""",415778,19390,254,1125,https://i.ytimg.com/vi/ElKPnh0Q8pU/default.jpg,False,False,False,A Boogie Wit Da Hoodie – Somebody (feat. Don Q)\nDownload/Stream: https://Atlantic.lnk.to/TheBiggerArtistID \n \nFollow A Boogie\nInstagram - https://www.instagram.com/ArtistHBTL/\nTwitter - http://twitter.com/ArtistHBTL\nFacebook - https://www.facebook.com/ArtistHBTL\nSpotify - https://open.spotify.com/artist/31W5EY0aAly4Qieq6OFu6I\nSoundcloud - https://soundcloud.com/a-boogie-wit-da-hoodie\n\nFollow High Bridge\nFacebook: https://www.facebook.com/HighBridgeOfficial\nTwitter: https://twitter.com/Highbridgelabel\nInstagram: https://www.instagram.com/highbridgethelabel/\nSoundcloud: https://soundcloud.com/user-939666509
16380,FB64ez0kf1c,2018-02-05,Megyn Kelly: I Have No Regrets About My Question To Jane Fonda | Megyn Kelly TODAY,TODAY,25,2018-01-22 15:35:41+00:00,"The TODAY Show|""TODAY Show""|""TODAY""|""NBC""|""NBC News""|""Celebrity Interviews""|""TODAY Show Recipes""|""Fitness""|""Lifestyle""|""TODAY Show Interview""|""Ambush Makeover""|""Kathie Lee and Hoda""|""KLG and Hoda""|""megyn kelly today""|""megyn kelly""|""megyn kelly jane fonda""|""jane fonda plastic surgery""|""plastic surgery""|""megyn kelly jane fonda plastic surgery""|""jane fonda""|""under the knife""|""work done""|""wrinkles""|""aging""|""botox""|""jane fonda megyn kelly""|""robert redford""|""our souls at night""|""megyn kelly on jane fonda""",558689,2559,3019,1892,https://i.ytimg.com/vi/FB64ez0kf1c/default.jpg,False,False,False,"TODAY’s Megyn Kelly responds to Jane Fonda’s recent issues with her questions about plastic surgery while appearing on Megyn Kelly TODAY. Kelly explains why she has no “regrets asking the question.”\n\n» Subscribe to TODAY: http://on.today.com/SubscribeToTODAY\n» Watch the latest from TODAY: http://bit.ly/LatestTODAY\n\nAbout: TODAY brings you the latest headlines and expert tips on money, health and parenting. We wake up every morning to give you and your family all you need to start your day. If it matters to you, it matters to us. We are in the people business. Subscribe to our channel for exclusive TODAY archival footage & our original web series.  \n\nConnect with TODAY Online!\nVisit TODAY's Website: http://on.today.com/ReadTODAY\nFind TODAY on Facebook: http://on.today.com/LikeTODAY\nFollow TODAY on Twitter: http://on.today.com/FollowTODAY\nFollow TODAY on Google+: http://on.today.com/PlusTODAY\nFollow TODAY on Instagram: http://on.today.com/InstaTODAY\nFollow TODAY on Pinterest: http://on.today.com/PinTODAY\n\nMegyn Kelly: I Have No Regrets About My Question To Jane Fonda | Megyn Kelly TODAY"
16347,FOLQlEh1D20,2018-02-05,Lil Wayne - Bloody Mary feat. Juelz Santana (Official Audio) D6 Reloaded,Lil Wayne,10,2018-01-25 01:00:03+00:00,"hollyweezy|""cash money""|""juelz santana""|""birdman""|""bloody mary""|""young money""|""d6""|""weezy wednesday""|""wayne""|""dwayne carter""|""hollygrove""|""hiphop""|""lil wayne dedication""|""dedication""|""dedication 6 reloaded""|""In Tune We Trust""|""hot boys""|""lil wayne 2017""|""dedication 6""|""reloaded""|""d6 reloaded""|""jul""|""2 chainz""|""lil wayne dedication 6""|""tha carter""|""ymcmb""|""dedication reloaded""|""lil wayne bloody mary""|""lil wayne""|""lil wayne dedication 6 reloaded""|""weezy""|""lil wayne juelz santana""|""wayne carter""",1127620,27879,665,5129,https://i.ytimg.com/vi/FOLQlEh1D20/default.jpg,False,False,False,"Bloody Mary by Lil Wayne feat. Juelz Santana, off the Dedication 6 Reloaded mixtape.\n\nListen to the full mixtape: https://www.youtube.com/playlist?list=PLXcRV4ZzG8t1wspbC5dnpD0JPf99BdVLp\n\nClick to subscribe to Lil Wayne's YouTube channel for exclusive footage! http://bit.ly/WayneYTSub\n\nWatch Lil Wayne's Exclusive Series and Footage:\nWeezy Wednesdays: http://bit.ly/WeezyWeds\nLil Wayne Exclusive Tracks: http://bit.ly/WayneExclusives\nLil Wayne Official Music Videos: http://bit.ly/WayneVideos\n\nLil Wayne on Twitter: http://www.twitter.com/LilTunechi\nLil Wayne on Facebook: http://www.facebook.com/LilWayne\nYoung Money on Facebook: http://www.facebook.com/youngmoneyent"
16245,FQUmz9QxtFc,2018-02-05,Jack Whitehall Teaches His Dad About YouTube,Jack Whitehall,23,2018-01-30 16:00:01+00:00,"jack whitehall the o2|""jack whitehall o2""|""jack whitehall stand up""|""king of comedy""|""comedy awards""|""Jack Whitehall live""|""jack whitehall show""|""jack whitehall comedy""|""jack whitehall standup""|""jack whitehall comedian""|""jack whitehall gets around""|""comedy""|""jack whitehall fresh meat""|""stand up comedian""|""comedy videos""|""jack whitehall videos""|""funny videos""|""jack whitehall king of comedy""|""subscribe""|""how to subscribe""|""michael whitehall""|""jack whitehall dad""|""dad""",243137,10582,118,540,https://i.ytimg.com/vi/FQUmz9QxtFc/default.jpg,False,False,False,"Worth noting, this was all recorded pre-Sidemen (or PS, as we now refer to it).\nJack Whitehall has a tough time trying to teach his dad how to subscribe to this YouTube channel...\nSUBSCRIBE: http://bit.ly/1iKGKjq\nFOLLOW JACK ON TWITTER: https://twitter.com/jackwhitehall"
16248,FTldNZ7V8ls,2018-02-05,Jimmy Kimmel & Stormy Daniels Watch Trump’s State of the Union,Jimmy Kimmel Live,23,2018-01-31 03:55:27+00:00,"jimmy|""jimmy kimmel""|""jimmy kimmel live""|""late night""|""talk show""|""funny""|""comedic""|""comedy""|""clip""|""comedian""|""mean tweets""|""stormy daniels""|""donald trump""|""porn star""|""adult film star""|""state of the union""|""#SOTU""|""cold open""|""sex scandal""",171422,1237,437,245,https://i.ytimg.com/vi/FTldNZ7V8ls/default.jpg,False,False,False,"Jimmy and Stormy Daniels watch Donald Trump’s State of the Union address together before the show.\n\nTrump and Jay-Z Feud https://youtu.be/Yl3B4wZMwoA \n \nSUBSCRIBE to get the latest #KIMMEL: http://bit.ly/JKLSubscribe\n \nWatch Mean Tweets: http://bit.ly/KimmelMT10\n \nConnect with Jimmy Kimmel Live Online:\n \nVisit the Jimmy Kimmel Live WEBSITE: http://bit.ly/JKLWebsite\nLike Jimmy Kimmel on FACEBOOK: http://bit.ly/KimmelFB\nLike Jimmy Kimmel Live on FACEBOOK: http://bit.ly/JKLFacebook\nFollow @JimmyKimmel on TWITTER: http://bit.ly/KimmelTW\nFollow Jimmy Kimmel Live on TWITTER: http://bit.ly/JKLTwitter\nFollow Jimmy Kimmel Live on INSTAGRAM: http://bit.ly/JKLInstagram\n \nAbout Jimmy Kimmel Live:\n \nJimmy Kimmel serves as host and executive producer of Emmy-winning Jimmy Kimmel Live, ABC's late-night talk show.\n\nJimmy Kimmel Live is well known for its huge viral video successes with 5.6 billion views on YouTube alone.\nSome of Kimmel's most popular comedy bits include - Mean Tweets, Lie Witness News, Jimmy's Twerk Fail Prank, Unnecessary Censorship, YouTube Challenge, The Baby Bachelor, Movie: The Movie, Handsome Men's Club, Jimmy Kimmel Lie Detective and music videos like I (Wanna) Channing All Over Your Tatum and a Blurred Lines parody with Robin Thicke, Pharrell, Jimmy and his security guard Guillermo.\nNow in its sixteenth season, Kimmel's guests have included: Johnny Depp, Meryl Streep, Tom Cruise, Halle Berry, Harrison Ford, Jennifer Aniston, Will Ferrell, Katy Perry, Tom Hanks, Scarlett Johansson, Channing Tatum, George Clooney, Larry David, Charlize Theron, Mark Wahlberg, Kobe Bryant, Steve Carell, Hugh Jackman, Kristen Wiig, Jeff Bridges, Jennifer Garner, Ryan Gosling, Bryan Cranston, Jamie Foxx, Amy Poehler, Ben Affleck, Robert Downey Jr., Jake Gyllenhaal, Oprah, and unfortunately Matt Damon.\n\nJimmy Kimmel & Stormy Daniels Watch Trump’s State of the Union\nhttps://youtu.be/FTldNZ7V8ls"
16263,FtX7GY_iPok,2018-02-05,The Voice 2018 - Never Underestimate the Power of Kelly Clarkson (Promo),The Voice,24,2018-01-29 21:10:42+00:00,"nbc the voice|""watch the voice video""|""the voice season 14""|""the voice 2018""|""kelly clarkson coach""|""alicia keys coach""|""adam levine coach""|""blake shelton coach""|""never underestimate kelly clar""|""the voice season premiere""|""the voice feb 26""|""the voice season 14 premiere""|""the voice""|""the voice nbc""|""the voice new season""|""The Voice 2018""|""The Voice USA""|""The voice winners""|""adam levine""|""Alicia Keys""|""Kelly Clarkson""|""blake shelton""|""carson daly""|""the voice auditions""",748748,9194,195,824,https://i.ytimg.com/vi/FtX7GY_iPok/default.jpg,False,False,False,"Three-time Grammy winner Kelly Clarkson joins Coaches Alicia Keys, Adam Levine and Blake Shelton when The Voice returns to NBC for Season 14 on Monday, February 26 at 8/7c.\n» Get The Voice Official App: http://bit.ly/TheVoiceOfficialApp\n» Subscribe for More: http://bit.ly/TheVoiceSub\n» The Voice Returns Monday February 26 8/7c on NBC!\n» Watch Full Episodes: http://bit.ly/TheVoiceFullEpisodes\n\nTHE VOICE ON SOCIAL:\nLike The Voice: http://Facebook.com/NBCTheVoice\nFollow The Voice: https://Twitter.com/NBCTheVoice\nThe Voice Tumblr: http://nbcTheVoice.Tumblr.com/\nFollow The Voice on Instagram: https://instagram.com/nbcthevoice/\n\nNBC’s The Voice follows the strongest vocalists from across the country and invites them to compete in this season's blockbuster vocal competition.\n\nFind The Voice trailers, full episode highlights, previews, promos, clips, and digital exclusives here.\n\nNBC ON SOCIAL:\nNBC YouTube: http://www.youtube.com/nbc\nLike NBC: http://Facebook.com/NBC\nFollow NBC: http://Twitter.com/NBC\nNBC Tumblr: http://nbctv.tumblr.com/\nNBC Google+: https://plus.google.com/+NBC/posts\nNBC Instagram: http://instagram.com/nbc\n\nABOUT THE VOICE\nThe Voice 2018 USA YouTube channel features exclusive content with The Voice coaches, highlights from The Voice auditions, interviews with The Voice winners, as well as The Voice recaps and results. Learn more about The Voice contestants, The Voice tour, the eliminations, and follow your favorite performers all the way to the finale. In season 14, Kelly Clarkson joins returning coaches Adam Levine, Blake Shelton, and welcomes back Alicia Keys as celebrity musician coaches, while Carson Daly continues to serve as host. The show’s innovative format features five stages of competition: the first begins with the blind auditions, followed by the battle rounds, the knockouts, the live playoffs and finally, the live performance shows.\n\nThe Voice 2018 - Never Underestimate the Power of Kelly Clarkson (Promo)\nhttps://youtu.be/FtX7GY_iPok\n\nThe Voice\nhttp://www.youtube.com/user/nbcthevoice"
16304,GJTtiYMdMtk,2018-02-05,"Mabel, Not3s - Fine Line (Official Video)",MabelVEVO,10,2018-01-25 08:00:00+00:00,"Mabel|""Not3s""|""Fine""|""Line""|""Polydor""",1906962,38219,958,1222,https://i.ytimg.com/vi/GJTtiYMdMtk/default.jpg,False,False,False,"Stream / Download Fine Line: https://Mabel.lnk.to/FineLineID \n\nGet tickets to Mabel's 2018 tour: http://www.mabelofficial.com/live \n\nFollow Mabel:\nInstagram http://po.st/MabelIG\nFacebook http://po.st/MabelFB\nTwitter http://po.st/TWMabel\nSpotify http://po.st/MabelSP\nWebsite http://po.st/MabelWS\n\nSign up to the mailing list http://po.st/MabelSignUp\n\nDirected by Adriaan Louw \nProduced by The Swank Group \n\nMusic video by Mabel, Not3s performing Fine Line. (C) 2018 Polydor Records, a division of Universal Music Operations Limited\n\nhttp://vevo.ly/NzIIbM"
16336,GWMKelv5Bmw,2018-02-05,MIRANDA vs. IPHONE X FACE ID,Colleen Ballinger,23,2018-01-24 20:00:02+00:00,"colleen ballinger|""colleen""|""ballinger""|""psychosoprano""|""miranda sings""|""no lipstick""|""vlog""|""vlogging""|""singing""|""without lipstick""|""comedy""|""how to""|""tutorial""|""silly""|""funny""",2074542,71012,2646,5192,https://i.ytimg.com/vi/GWMKelv5Bmw/default.jpg,False,False,False,Come see me on tour!\nhttp://www.mirandasings.com\n\nFollow me on all the things! \nTwitter - http://www.twitter.com/ColleenB123\nFacebook - https://www.facebook.com/ColleenB1234\nyoutube - http://www.youtube.com/psychosoprano\nInstagram - http://instagram.com/colleen\nSnapchat - ColleenB123\n\nBusiness inquiries - msingsbranding@gmail.com
16235,Gc71AmT_b2k,2018-02-05,Bazzi - Mine (Official Video),Bazzi,10,2018-01-31 14:00:01+00:00,"Bazzi|""MIne""|""Beautiful""|""Bazzi Music""|""Andrew Bazzi""|""You So Fucking Precious When You Smile""|""You So Fucking Precious""|""Bazzi Official""|""Atlantic Records""|""ZZZEntertainment""|""Warner Music Group""|""Official Audio""|""Bazzi Official Audio""|""Official Video""|""Bazzi Mine""|""Bazzi ALone""|""Hands On Your Body""|""Mine""|""Pop""|""love galore""|""You So Precious""|""Memes""|""Wholesome Memes""|""Justin Beiber""|""Post Malone Music""|""Justin Beiber Music""|""Precious When You""|""Funny Memes""|""nkhnni7xgJk""",1024525,73506,503,5339,https://i.ytimg.com/vi/Gc71AmT_b2k/default.jpg,False,False,False,Stream + download Mine: https://Bazzi.lnk.to/MineID\n\nFollow B A Z Z I: \nhttps://www.instagram.com/bazzi\nhttps://twitter.com/bazzi\nhttps://www.facebook.com/BazziWorldwide\n\nSubscribe to my channel: https://goo.gl/C6KC1m
16212,HEVonh8bjC0,2018-02-05,DISOBEDIENCE | Official Trailer | In theaters April 27,Bleecker Street,1,2018-02-01 20:02:16+00:00,"bleecker street|""bleecker street media""|""bleecker street films""|""bleecker street movies""|""movies""|""film""|""entertainment""|""bleeker street""",1368621,7715,1721,1647,https://i.ytimg.com/vi/HEVonh8bjC0/default.jpg,False,False,False,"Official Site: http://www.Disobedience.Movie\nLIKE us on Facebook: http://www.facebook.com/DisobedienceMovie\nFOLLOW us on Twitter: http://www.twitter.com/BleeckerStFilms\nFOLLOW us on Instagram: http://www.instagram.com/BleeckerStFilms\n--\n\nLove is an act of defiance.\nWatch the official trailer for DISOBEDIENCE, starring Rachel Weisz and Rachel McAdams. In select theaters April 27."
16253,HI-mXMr8glQ,2018-02-05,Migos - Stir Fry (Official),MigosVEVO,10,2018-01-29 04:00:00+00:00,"Migos|""Culture""|""Culture 2""|""Culture II""|""Stir Fry""|""Quavo""|""Takeoff""|""Offset""|""Pharrell""|""Pharrell Williams""|""Video""|""Official Video""|""Official""",9305101,246520,10312,22296,https://i.ytimg.com/vi/HI-mXMr8glQ/default.jpg,False,False,False,"Listen to Culture II everywhere now: https://Migos.lnk.to/Culture2YD\n\nPurchase exclusive Migos merch featured from their official store: https://Migos.lnk.to/StoreYD\n\nFollow Migos:\nhttps://facebook.com/THEMigosAtl\nhttps://twitter.com/migos\nhttps://instagram.com/migos\n\nMusic video by Migos performing Stir Fry. (C) 2017 Quality Control Music, LLC and UMG Recordings, Inc.\n\nhttp://vevo.ly/KKHf5B"
16323,HuJkBDBloa0,2018-02-05,Jumanji! 1995 Vs 2017,WatchMojo.com,24,2018-01-25 01:00:01+00:00,"Top 10|""List""|""Movies""|""Film""|""Jumanji""|""Jumanji: Welcome to the Jungle""|""Game""|""Robin Williams""|""Dwayne Johnson""|""Kevin Hart""|""Jack Black""|""Karen Gillan""|""Nick Jonas""|""game""|""play""|""funny""|""action""|""scene""|""hilarious""|""versus""|""vs""|""better""|""worse""|""WatchMojo""",452470,7119,1084,1841,https://i.ytimg.com/vi/HuJkBDBloa0/default.jpg,False,False,False,"Jumanji! 1995 Vs 2017\nSubscribe: http://goo.gl/Q2kKrD // \nHave a Top 10 idea? Submit it to us here! http://watchmojo.com/my/suggest.php\n\nJumanji: Welcome to the Jungle is a certified hit at the box office, but how does it compare to the original Robin Williams led romp from 1995? WatchMojo puts the two movies head to head to find out which one is best? But which film will claim victory? Watch to find out!\n\nWatch on WatchMojo: http://www.WatchMojo.com\n\nHave an idea for our next video? Submit your suggestion here: http://www.watchmojo.com/my/suggest.php\n\nOur Magazine!! Learn the inner workings of WatchMojo and meet the voices behind the videos, articles by our specialists from gaming, film, tv, anime and more. VIEW INSTANTLY: http://goo.gl/SivjcX\n\nWatchMojo's Social Media Pages\nhttp://www.Facebook.com/WatchMojo\nhttp://www.Twitter.com/WatchMojo \nhttp://instagram.com/watchmojo \n\nGet WatchMojo merchandise at shop.watchmojo.com\n\nWatchMojo’s ten thousand videos on Top 10 lists, Origins, Biographies, Tips, How To’s, Reviews, Commentary and more on Pop Culture, Celebrity, Movies, Music, TV, Film, Video Games, Politics, News, Comics, Superheroes. Your trusted authority on ranking Pop Culture."
