id,video_id,trending_date,title,channel_title,category_id,publish_time,tags,views,likes,dislikes,comment_count,thumbnail_link,comments_disabled,ratings_disabled,video_error_or_removed,description
38706,7PmUtmfTmbg,2018-06-14,Anderson .Paak - Bubblin (Official Video),Anderson Paak,10,2018-05-17 21:00:40+00:00,"breezy lovejoy|""lovejoy""|""O.B.E.""|""S.C.R.A.M.""|""Am I Wrong""|""Til It's Over""|""Come Down""|""Malibu""|""Glowed Up""|""Anderson .Paak""|""Adnerson""|""Andy""|""andersn""|""pack""|""paack""|""kendrick lamar""|""schoolboy q""|""kaytranada""|""bubblin""|""bubbling""|""bubblin'""|""official music video""|""calmatic""|""hip hop""|""r&b""|""black panther album""",7089685,164149,4305,6218,https://i.ytimg.com/vi/7PmUtmfTmbg/default.jpg,False,False,False,"Bubblin out now! http://smarturl.it/BubblinDirected by CalmaticFollow Anderson here:Instagram: https://www.instagram.com/anderson._paak/Twitter: https://twitter.com/AndersonPaakFacebook: https://www.facebook.com/AndersonPaak/Lyrics:Look at you go, okay, you bubblin'Look, go, go, Look at you goOkay you bubblin', lookYeah, one in the hand, one in the bag, bubblin'Look at the cash, look at the cash comin' inCome get your man, this lil' nigga buggin' meDid you see the bag? Quit all that jaw-jackeryDon't vevnn pass me that, I don't want none of it (yeah)These niggas mad about it, they had enough of itWoah, watch what you're sayin', how they're poppin' and shakin'Got me hot as a laser, my posse deep and irateAnd we act a fool for the paper, had a dream and I made itEl Camino on Dayton's, Vintage Guess over BapePut the bread on me bitch, bitch, you bet I'ma bake itPiggy flat in a blanket, I might just roll out todayI might just roll out to Vegas, head back to my old waysCop a room full of Asian hoes and do blow all dayLook at me, baby, look at me, babyDon't I look like a million? I'm 'bout to clean out the safeD-don't I look like somebody that just be bodyin' everythingAll that talkin' is great but I don't be talkin' I air it outAll the problems have gotten easy to buryI'd rather drown in them Hendrick's, I'd rather kiss on my MaryI been broker way longer than I been rich so until it levels outImma take your mama to the Marriott and wear it outTook me so long to get it, gonna spread it outLet 'em know all about me when I'm dead and goneOne in the hand, one in the bag, bubblin' (look at you go)One in the hand, one in the bag, bubblin' (look at you go)Look at the cash, look at the cash bubblin' (okay you bubblin')Look at the cash (look)Bubblin' (go)One in the hand (look)One in the hand (go)One in the hand, one in the bag, bubblin' (look at you go)Look at the cash, look at the cash, bubblin' (okay you bubblin')Look at the cash (look)Bubblin'I'ma need all the fries you can give meAll the hot sauce, all the pie you can give meBetter be all or nothin', don't have me in the middleYou better be all you can, get higher than the limitSimplify for the Dumbos, plenty slides, I could shuffleHit the cadence with my young bitch, Isaac Hayes, Billy OceanBut the old hoe with the cane stickLeft my slippers at the function, it's hard to run in Gucci slidesChick I thought you said you didn't have a husbandI'ma stud, no cuckold, Jackie Chan, no troubleCan't kill up with the beat, blood drippin' from the cutthroatsNo Lord, not me, I can never be the one you wanna stunt forMoney, money, the machine, guns, freak the Ferragamo storeR.I.P. to times that I was broke, hopped in like the 911 PorscheMatte black, lookin' clean, dead prezi's in an envelopeCookin up kanat, waitin' for the antidote, runnin' outta townPatience thinner than her pantyhoseGet over here and empty your pockets.I don't do that.You're my prisoner—you do what I tell you to do—get over here.Haha, he's gonna get nasty about it!Fuckin' bitch!Frank! Cool it, huh?Stay the fuck outta this!One in the hand, one in the bag, bubblin' (look at you go)One in the hand, one in the bag, bubblin' (look at you go)Look at the cash, look at the cash bubblin' (okay you bubblin')Look at the cash (look)Bubblin' (go)One in the hand (look)One in the hand (go)One in the hand, one in the bag, bubblin' (look at you go)Look at the cash, look at the cash, bubblin' (okay you bubblin')Look at the cash (look)Bubblin'"
38616,7YoMGxBa0bw,2018-06-14,Hereditary Angry Movie Review,AngryJoeShow,20,2018-06-08 18:17:44+00:00,"angryjoe|""ngryjoeshow""|""movie review""|""film review""|""hereditary""|""horror film""|""scary movie""|""thriller""",268492,6040,572,1552,https://i.ytimg.com/vi/7YoMGxBa0bw/default.jpg,False,False,False,"AngryJoe, OtherJoe & Alex review the latest Horror Film Hereditary, billed as this generations Exorcist, is this film truly that scary? Find out!Shirts/Stuff ► http://kottonzoo.com/angryjoe/Twitch ► http://twitch.tv/angryjoeshowTwitter ► http://twitter.com/AJSADelrithTwitter ► http://twitter.com/otherjoe_AJSAAJSA Community ► http://ajsagaming.com"
38603,7uzjz51S--M,2018-06-14,Camila Cabello - ‘Havana’ (live at Capital’s Summertime Ball 2018),Capital FM,10,2018-06-09 15:20:02+00:00,"capitalfmofficial|""capital""|""capital fm""|""capital radio""|""radio""|""official""|""remix""|""lyrics""|""official video""|""live""|""capital tv""|""interview""|""summertime ball""|""stb""|""capital summertime ball 2018""|""capital stb""|""camila cabello live""|""camila summertime ball""|""camila cabello summertime ball""|""fifth harmony""|""fifth harmony live""|""camila fifth harmony""|""harmonisers""|""harmonizers""",764771,24031,453,1065,https://i.ytimg.com/vi/7uzjz51S--M/default.jpg,False,False,False,Subscribe: http://bit.ly/SubscribeToCapitalFMGet involved with the UK's No. 1 Hit Music Station! Subscribe: http://bit.ly/SubscribeToCapitalFMWebsite: Instagram: http://www.instagram.com/CapitalOfficialFacebook: http://www.facebook.com/CapitalFMTwitter: http://twitter.com/CapitalOfficial
38696,7zLzYiw1wdQ,2018-06-14,Animal sounds on violin,Sebastiaan Kulwanowski,23,2018-05-12 09:41:52+00:00,"animal sounds|""violin""|""funny""|""Animal sounds on violin""",1098041,86894,891,3095,https://i.ytimg.com/vi/7zLzYiw1wdQ/default.jpg,False,False,False,9 funny animal sounds to do on a violin! 🎻Subscribe for more weird funny videos! :)
38658,8JnfIa84TnU,2018-06-14,Clean Bandit - Solo feat. Demi Lovato [Official Video],Clean Bandit,10,2018-05-31 09:00:13+00:00,"clean bandit|""solo""|""demi lovato""|""I do it solo""|""Official Video""|""I Miss You""|""Julia Michaels""|""Symphony""|""Zara Larsson""|""Rockabye""|""Anne-Marie""|""Sean Paul""|""Tears""|""Louisa Johnson""|""Rather Be""|""Jess Glynne""|""Real Love""|""Extraordinary""|""Stronger""|""Come Over""|""New Eyes""",21250349,454441,10532,13881,https://i.ytimg.com/vi/8JnfIa84TnU/default.jpg,False,False,False,Our new single Solo feat. Demi Lovato is out now https://atlanti.cr/soloWARNING: THIS VIDEO CONTAINS FLASHING LIGHTS WHICH MAY NOT BE SUITABLE FOR PHOTOSENSITIVE EPILEPSY. Click here to subscribe: http://bit.ly/SubscribeToCleanBanditFollow us:Website: http://cleanbandit.co.uk/Facebook: http://www.facebook.com/cleanbandit Twitter: http://www.twitter.com/cleanbandit Instagram: http://instagram.com/cleanbanditSoundcloud: http://www.soundcloud.com/cleanbanditSpotify: http://www.atlre.co.uk/CleanBanditSpotify
38732,8h--kFui1JA,2018-06-14,Sam Smith - Pray (Official Video) ft. Logic,SamSmithWorldVEVO,10,2018-05-09 17:00:00+00:00,"Sam|""Smith""|""Pray""|""Capitol""|""Pop""",22999573,370027,9680,12724,https://i.ytimg.com/vi/8h--kFui1JA/default.jpg,False,False,False,"Stream, Download and Listen to Pray feat. Logic now: http://samsmith.world/LogicPrayID They never knew my struggleRose above the rubbleRather live inside their bubble Than go through the troubleOf having their double double vision correctedThey just neglect it and I’ve been thinking latelyWill the Devil take me?Or will God protect me?I know I ain’t perfectBut you should respect meThey don’t want me happyThey don’t wanna let me live I’m young and I’m foolishI make bad decisionsI block out the newsTurn my back on religionDon’t have no degreeI’m somewhat naïveI have made it this far on my own But lately that shit ain’t been getting me higherI lift up my head and the world is on fireThere’s dread in my heartAnd fear in my bonesI just don’t know what to say Maybe I’ll prayPrayMaybe I’ll prayI have never believed in you, noBut I’m gonna pray I am meI’m a manI’m a sinnerBut understandAren’t we all?So when it comes to passing judgementsI don’t think that you’re the one to make the callHeaven want to cast me out for being me I know theres others like me there to break the fall I know you hater Motherfuckers just can’t relate at  If I’m the first one to the line that’s fineI’ll take it allBut Logic he gon’ let ‘em knowI ain’t perfectBut I’m worth itI’m aliveI deserve itI’ve been praying I ain’t playingI don’t think you hear the words that I’m saying I don’t think you know the weight on my shouldersThat gets heavier as I get olderCalling anybodyCalling anybodyCan you hear me?I pray that you hear meI pray that you hear me Maybe I’ll prayPrayMaybe I’ll prayI’ve never believed in you, noBut I’m gonna Won’t you call me?Can we have a one on one please?Let’s talk about freedomEveryone prays in the endEveryone prays in the endOh, won’t you call me?Can we have a one on one please?Let’s talk about freedomEveryone prays in the endEveryone prays in the end Oh, I’m gonnaPrayI’m gonnaPrayI’m gonnaPrayPray for a glimmer of hopeMaybe I’ll prayPrayMaybe I’ll prayI’ve never believed in you, noBut I’m gonna pray Follow Sam Smith:http://samsmithworld.com http://facebook.com/samsmithworld http://instagram.com/samsmithworld http://twitter.com/samsmithworld Director : Joe ConnorProducer : Colin OfflandItaly Production : Dom MergiaPM : Georgie WinterDOP : Patrick MellorEdit : Ian McLaughlin @ The OutpostGrade : George K @ MPCAgent : Alexa Haywood"
38701,8nWw8q3zEpw,2018-06-14,GIANT 15 POUND LOBSTER MUKBANG! 먹방 (EATING SHOW!),Kim Thai,22,2018-05-20 22:42:02+00:00,"kim thai|""mukbang""|""seafood boil""|""15 pound lobster""|""15 lb lobster""|""eating show""|""korean eating show""|""bloveslife""|""먹방""|""kim thai mukbang""|""vietnamese food""|""speaking vietnamese""",369844,8343,749,1857,https://i.ytimg.com/vi/8nWw8q3zEpw/default.jpg,False,False,False,"WHERE I BOUGHT THIS 15 POUND LOBSTER: https://www.mainelobsternow.com/giant-lobsters/10-lb-15-lb-north-atlantic-live-lobsterMY SEAFOOD DIPPING SAUCE:1. SALT - 1 TABLE SPOON 2. SUGAR - 1 TABLE SPOON3. KNORR CHICKEN FLAVORED BROTH MIX POWDER - TO YOUR LIKING 4. HUY FONG CHILI GARLIC SAUCE - TO YOUR LIKING/DEPENDS ON LEVEL OF SPICY 5. 1-2 LEMONS - DEPENDS ON YOU This sauce really depends a lot on your personal preference, so add as much or as little as you want and mix it to accommodate to your taste buds! _ _ _ _ _ _ _ _ _ _ BUY MY LION-HEARTED + AUDACIOUS LASHES HERE: https://www.cakefacebeauty.comMORPHE BRUSHES » http://morphebrushes.comDiscount Code: KIMTHAI This discount code does NOT expire. It can be used online and in their Burbank, California store. Make sure you use all CAPS at check out. JOUER COSMETICS » https://www.jouercosmetics.com15% Discount Code: KIMTHAIThis discount code does NOT expire. _ _ _ _ _ _ _ _ _ _ BUSINESS INQUIRIES » kkimthai@yahoo.comINSTAGRAM » https://www.instagram.com/kkimthaiTWITTER » https://twitter.com/kkimthaiPOSHMARK » @kkimthaiMY ADDRESS »Kim Thai Nguyen P.O. Box 11810Westminster CA 92685_ _ _ _ _ _ _ _ _ _"
38731,9_LIP7qguYw,2018-06-14,Hidden Meanings Behind Childish Gambino's 'This Is America' Video Explained,INSIDER,24,2018-05-09 16:19:16+00:00,"INSIDER|""this is america""|""childish gambino""|""music video""|""music video analysis""|""black lives matter""|""charleston shooting""",14261473,234355,22315,23450,https://i.ytimg.com/vi/9_LIP7qguYw/default.jpg,False,False,False,Childish Gambino's 'This Is America' has become an overnight cultural phenomenon. The internet was quick to point out tons of hidden messages throughout the piece. Here's some you've might have missed.Read more analysis on 'This Is America': http://www.thisisinsider.com/this-is-america-music-video-meaning-references-childish-gambino-donald-glover-2018-5The INSIDER team believes that life is an adventure! Subscribe to our channel and visit us at: https://thisisinsider.comINSIDER on Facebook: https://www.facebook.com/thisisinsider/INSIDER on Instagram: https://www.instagram.com/thisisinsider/INSIDER on Twitter: https://twitter.com/thisisinsiderProduced by: Alana Yzola
38598,9iM7W1Dvl6Q,2018-06-14,GLOW: Season 2 | Main Trailer [HD] | Netflix,Netflix,24,2018-06-11 14:30:11+00:00,"Netflix|""Trailer""|""movies""|""streaming""|""movies online""|""comedy""|""glow2main""|""glow""|""s1recap""|""season 1""|""season 2""|""glow netflix""|""netflix originals""|""80s""|""wrestling""|""female wrestling""|""alison brie""|""betty giplin""|""marc maron""|""wtf with marc maron""|""kate nash""|""sydelle noel""|""britney young""|""kia stevens""|""britt baron""|""marianna palka""|""feminist""|""girl power""|""girl gang""|""jenji kohan""|""orange is the new black""|""PLvahqwMqN4M0MGkARAHH7sCVVEepIBVYe""|""Netflix Original Series""|""womens wrestling""|""betty gilpin""|""Recap #2""",151807,3021,57,201,https://i.ytimg.com/vi/9iM7W1Dvl6Q/default.jpg,False,False,False,"GLOW big or GLOW home. The girls are back in town June 29th.Revisit GLOW Season 1 ahead of new episodes.Watch GLOW on Netflix:https://www.netflix.com/title/80114988Follow for a GLOW up:GLOW on the 'gram: http://www.instagram.com/glownetflixGLOW on Twitter: http://twitter.com/glownetflixGLOW on Facebook: http://www.facebook.com/GlowNetflixSUBSCRIBE: http://bit.ly/29qBUt7About Netflix:Netflix is the world's leading internet entertainment service with 125 million members in over 190 countries enjoying more than 140 million hours of TV shows and movies per day, including original series, documentaries and feature films. Members can watch as much as they want, anytime, anywhere, on nearly any internet-connected screen. Members can play, pause and resume watching, all without commercials or commitments.Connect with Netflix Online:Visit Netflix WEBSITE: http://nflx.it/29BcWb5Like Netflix Kids on FACEBOOK: http://bit.ly/NetflixFamilyLike Netflix on FACEBOOK: http://bit.ly/29kkAtNFollow Netflix on TWITTER: http://bit.ly/29gswqdFollow Netflix on INSTAGRAM: http://bit.ly/29oO4UPFollow Netflix on TUMBLR: http://bit.ly/29kkemTGLOW: Season 2 | Main Trailer [HD] | Netflixhttp://youtube.com/netflix"
38692,AbEHRrq7xwU,2018-06-14,Drake & Lil Baby - Yes Indeed (Lyrics),FutureHype,10,2018-05-18 17:35:05+00:00,"music|""hiphop""|""hip""|""hop""|""rap""|""mix""|""remix""|""free""|""download""|""mixtape""|""album""|""leak""|""drake""|""drake lyrics""|""lil baby lyrics""|""lil baby""|""yes indeed""|""yes indeed lyrics""|""drake lil baby""|""drake yes ineed""|""lil baby yes indeed""|""freestyle""|""southside""",6230350,60003,2337,2030,https://i.ytimg.com/vi/AbEHRrq7xwU/default.jpg,False,False,False,"• Download Drake & Lil Baby - Yes Indeed (Lyrics): https://lilbaby.lnk.to/harderthanever• Hit the 'Like' and 'Subscribe' button if you enjoyed the song, it helps the artist and I out.• Follow Lil Baby:https://www.instagram.com/lilbaby_1https://twitter.com/lilbaby4pf• Follow Drake:https://drakeofficial.com/https://www.instagram.com/champagnepapi/https://twitter.com/drake• Follow FutureHype:coming soon...Business Inquiries: erik@syrebralvibes.com"
38639,AcjX4z2_Z5c,2018-06-14,Hayley Kiyoko - What I Need (feat. Kehlani) [Behind The Scenes],Hayley Kiyoko,10,2018-06-07 16:06:57+00:00,"hayley kiyoko|""kehlani""|""what i need""|""girls like girls""|""pride""|""lgbt""",458444,40112,119,1104,https://i.ytimg.com/vi/AcjX4z2_Z5c/default.jpg,False,False,False,Expectations Available Now! Download/Stream: https://Atlantic.lnk.to/ExpectationsID
38632,AyiRO0_Ta7o,2018-06-14,"CM Punk Talks Winning WWE Lawsuit, UFC 225, Possible Return To Wrestling And More",MMAFightingonSBN,17,2018-06-07 01:01:24+00:00,"mma fighting|""mixed martial arts""|""martial arts""|""ultimate fighting championship""|""combat sports""|""combat tv""|""ufc""|""mma""|""cm punk""|""ufc 225""|""ariel helwani""|""mike jackson""|""cm punk vs mike jackson""|""ufc chicago""|""wwe""|""wwe lawsuit""|""phil brooks""",366765,6216,252,1738,https://i.ytimg.com/vi/AyiRO0_Ta7o/default.jpg,False,False,False,"CM Punk discusses his UFC 225 return against Mike Jackson, winning his defamation lawsuit against WWE doctor Dr. Christopher Amann, making a potential return to pro wrestling, and more.Subscribe: http://goo.gl/dYpsgHCheck out our full video catalog: http://goo.gl/u8VvLiVisit our playlists: http://goo.gl/eFhsvMLike MMAF on Facebook: http://goo.gl/uhdg7ZFollow on Twitter: http://goo.gl/nOATUIRead More: http://www.mmafighting.comMMA Fighting is your home for exclusive interviews, live shows, and more for one of the world's fastest-growing sports. Get latest news and more here: http://www.mmafighting.com"
38666,B663R7kgxEA,2018-06-14,Sergio Ramos y Demarco Flamenco - Otra estrella en tu corazón (Videoclip Oficial) #VAMOSESPAÑA,La Roja,22,2018-06-01 08:00:01+00:00,"sergio ramos|""demarco flamenco""|""otra estrella en tu corazon""|""videoclip oficial""|""video oficial""|""la roja""|""himno""|""seleccion""|""vamos españa""|""alza tu voz""|""grita con fuerza""|""grita ese gol""|""sergio ramos salah""|""himno oficial""|""federacion española""|""sergo ramos""|""iniesta""|""pique""|""isco""|""jordi alba""|""asensio""|""teaser""",6558768,123094,14985,7892,https://i.ytimg.com/vi/B663R7kgxEA/default.jpg,False,False,False,"¡Nueva canción de La Selección Española! Sergio Ramos y Demarco Flamenco - Otra estrella en tu corazón (Videoclip Oficial) #VAMOSESPAÑA #otraestrellaentucorazónYa disponible en: https://WarnerMusicSpain.lnk.to/otraestrellaentucorazon[LETRA]Nunca olvidemos lo que pudimos sentirAquel camino a la victoria fue vivir“No rendirnos jamás”, siempre nos guiaráAbre tus alas y prepárate a volarCierra los ojos y recuerda ese lugarY él te llevará, tu corazón te llevará (Estribillo)Vamos España, alza tu vozGrita con fuerza, grita ese golJuntos podemos poner corazón Todos soñamos con esa ilusión Vamos España, alza tu vozGrita con fuerza, grita ese golEn nuestra piel reside el valorPon otra estrella en tu corazón Pensando en grande alcanzaremos lo mejorLuchando juntos hacia la estrella con honorTenemos que intentar que la roja brille más. (Puente)(Estribillo)(Coda)Mirando al cielo te quiero escucharY que tu alma nos lleve a ganar… y a ganarA cantar Otra estrella en tu corazón con nuestra versión KaraokeMúsica: Demarco FlamencoLetra: Sergio Ramos & DemarcoSigue a Sergio Ramos en:https://www.facebook.com/SergioRamosOficial/https://www.instagram.com/sergioramos/?hl=enhttps://twitter.com/SergioRamos?ref_src=twsrc%5Egoogle%7Ctwcamp%5Eserp%7Ctwgr%5EauthorSigue a Demarco Flamenco en: https://www.facebook.com/DemarcoFlamencoOficial/https://www.instagram.com/demarco_flamenco/?hl=eshttps://twitter.com/Demarcoflamenco?ref_src=twsrc%5Egoogle%7Ctwcamp%5Eserp%7Ctwgr%5EauthorProducción musical: Gustavo OlmedoProducción artística: J.A. Velasco ‘Maki’ (Piter Music Spain)Guitarra Flamenca: Sergio GallardoGuitarras acústicas y eléctricas: Daniel CortésCoros: Laura Marchena y José PalmaGrabado en Estudios Selene (Sevilla)  por Gustavo Olmedo y en Black Betty Studios (Madrid) por Jose Nortes"
38620,BOhylL90UVQ,2018-06-14,The Chainsmokers - Somebody ft. Drew Love (Rory Kramer Vision),The Chainsmokers,10,2018-06-09 16:00:00+00:00,"The Chainsmokers Somebody|""Chainsmokers Somebody""|""Somedy Drew Love""|""The Chainsmokers Somebody Drew Love""|""The Chainsmokers""|""Rory Kramer""|""Rory Kramer Vision""|""Somebody Rory Kramer""|""Rory Kramer Somebody""|""The Chainsmokers Rory Kramer""|""Somebody Chainsmokers Rory""|""The Chainsmokers Somebody official video""|""official video""|""Lil Dicky""|""G-Eazy""|""Halsey""|""Andrew Watt""",402345,32126,427,1895,https://i.ytimg.com/vi/BOhylL90UVQ/default.jpg,False,False,False,The Chainsmokers - Somebody ft. Drew Love (A Rory Kramer Vision)Somebody ft. Drew Love Out Now: http://smarturl.it/TCSsomebody Video by Rory KramerFollow The Chainsmokers: http://www.youtube.com/thechainsmokers http://www.twitter.com/thechainsmokers http://www.facebook.com/thechainsmokers http://www.instagram.com/thechainsmokers http://www.soundcloud.com/thechainsmokers
38704,BZt0qjTWNhw,2018-06-14,The Cat Who Caught the Laser,AaronsAnimals,15,2018-05-18 13:00:04+00:00,"aarons animals|""aarons""|""animals""|""cat""|""cats""|""kitten""|""kittens""|""prince michael""|""prince""|""michael""|""laser""|""olympics""|""red""|""dream""",1685609,38160,1385,2657,https://i.ytimg.com/vi/BZt0qjTWNhw/default.jpg,False,False,False,The Cat Who Caught the Laser - Aaron's Animals
38720,BgR_HJ7aGDY,2018-06-14,[MV]SEVENTEEN - CALL CALL CALL! MV,SEVENTEEN Japan official Youtube,22,2018-05-16 08:00:00+00:00,"SEVENTEEN|""セブンティーン""|""세븐틴""|""SVT""|""セブチ""|""せぶち""",7724919,334549,1648,27343,https://i.ytimg.com/vi/BgR_HJ7aGDY/default.jpg,False,False,False,SEVENTEEN JAPAN 1ST MINI ALBUM 'WE MAKE YOU'2018.05.30 Release#SEVENTEEN #CALLCALLCALL! #WE_MAKE_YOU #20180530
38619,BmLSua7LPR8,2018-06-14,Chris Brown - Hope You Do (Official Video),ChrisBrownVEVO,10,2018-06-06 16:00:01+00:00,"Chris Brown|""Hope You Do""|""R&B""|""RCA Records Label""",4613299,194040,3155,13189,https://i.ytimg.com/vi/BmLSua7LPR8/default.jpg,False,False,False,Get “Heartbreak On A Full Moon: http://smarturl.it/HeartbreakFullMoonFollow Chris Brown:http://www.chrisbrownworld.com/https://www.facebook.com/chrisbrownhttps://twitter.com/chrisbrownhttp://instagram.com/chrisbrownofficialhttp://smarturl.it/CBSpotify?IQid=yt
38728,BspHjvU11y4,2018-06-14,Kelly Clarkson - Meaning of Life [Official Video],Kelly Clarkson,10,2018-05-13 13:00:41+00:00,"Kelly Clarkson|""Meaning of Life""|""mol""|""Official Video""|""love so soft""|""i dont think about you""|""idtay""|""kelly""|""clarkson""|""the voice""|""atlantic""|""atlantic records""|""pop music""",2543999,50144,1192,2518,https://i.ytimg.com/vi/BspHjvU11y4/default.jpg,False,False,False,MEANING OF LIFE available now: https://Atlantic.lnk.to/MeaningoflifeIDShop “I Don’t Think About You” Merch: http://smarturl.it/IDTAYMerchFollow Kelly Clarkson: https://kellyclarkson.com/https://www.facebook.com/kellyclarksonhttps://twitter.com/kelly_clarksonhttps://www.instagram.com/kellyclarkson/
38672,CE7SkcoyVAI,2018-06-14,The Last Jedi and the 7 Basic Questions of Narrative Drama,Just Write,1,2018-05-31 12:25:24+00:00,"4-4-18|""Star Wars""|""The Last Jedi""|""Rey""|""Finn""|""Poe""|""Kylo Ren""|""Ben Solo""|""Luke Skywalker""|""The First Order""|""Canto Bight""|""Fan Service""|""Character Arcs""|""Film Crit Hulk""|""Film""|""Film Criticism""|""Storytelling""|""Writing""|""Phasma""|""Hux""|""Snoke""|""Wants""|""Needs""|""Conflict""|""The Force""|""Lightsabers""|""May the force be with you""",195665,15467,4160,4578,https://i.ytimg.com/vi/CE7SkcoyVAI/default.jpg,False,False,False,"Use my link http://vrv.co/justwrite to get a 30-day ad-free trial of VRV Premium!Help me make more videos: https://www.patreon.com/justwriteFar from being the “worst movie ever” Star Wars: The Last Jedi has some solid character work, even in its weaker plotlines. In this video, I take a look at Film Crit Hulk’s 7 Basic Questions of Narrative Drama as a way to examine the character arcs of Rey, Finn and Poe. Film Crit Hulk’s essay: https://birthmoviesdeath.com/2013/07/03/film-crit-hulk-man-of-steelWebsite ▶ https://www.justwritemedia.comTwitter ▶ https://www.twitter.com/SageHydenFacebook ▶ http://ow.ly/6u9Z30iyp8JBooks: Creating Character Arcs, by K.M. Weiland: https://amzn.to/2slqAISThe Anatomy of Story: https://amzn.to/2xAO9COMusic: “I’m Going for a Coffee” by Lee ROsevere. Music For Podcasts 3. http://freemusicarchive.org/music/Lee_Rosevere/Music_For_Podcasts_3/02_Im_Going_for_a_CoffeeThe Seven Questions:WHAT DOES THIS CHARACTER WANT?WHAT DOES THIS CHARACTER NEED?HOW DO THOSE WANTS AND NEEDS CONFLICT WITH EACH OTHER WITHIN THE CHARACTER?HOW DO THEY CONFLICT WITH THE OUTSIDE WORLD?HOW DO THEY CONFLICT WITH OTHER CHARACTERS?HOW DOES THE CHARACTER CHANGE THROUGH THOSE CONFLICTS AND HOW DOES THE RESOLUTION AFFECT THEM?WHAT IMPACT DOES THAT CHANGE HAVE ON EVERYONE ELSE?"
38636,CWSYOdxx8Tg,2018-06-14,How To Make a Hit Football Anthem,Brett Domino,23,2018-06-07 07:30:00+00:00,"brett domino|""Umbro""|""England Anthem""|""World Cup""|""Football""|""Song""|""England""|""Anthem""|""How To""|""How To Make a Hit Pop Song""|""Guide""|""Ad""|""Soccer""|""Russia""|""2018""|""Brett Domino Trio""",56138,2814,73,170,https://i.ytimg.com/vi/CWSYOdxx8Tg/default.jpg,False,False,False,Brett Domino and Umbro’s guide to writing a hit football anthem. #EnglandAnthemSUBSCRIBE FOR MORE MUSIC / VIDEOS: http://goo.gl/IRF6nwBECOME A FACEBOOK FAN:https://www.facebook.com/thebrettdominotrioFOLLOW BRETT & STEVEN ON TWITTER:http://www.twitter.com/brettdominohttp://www.twitter.com/stevenpeavis
