id,video_id,trending_date,title,channel_title,category_id,publish_time,tags,views,likes,dislikes,comment_count,thumbnail_link,comments_disabled,ratings_disabled,video_error_or_removed,description
38741,-DRsfNObKIQ,2018-06-14,Eleni Foureira - Fuego - Cyprus - LIVE - First Semi-Final - Eurovision 2018,Eurovision Song Contest,24,2018-05-08 20:32:32+00:00,"Eurovision Song Contest|""2018""|""Lisbon""|""Cyprus""|""Eleni Foureira""|""Fuego""|""live""|""First Semi-Final""",14317515,151870,45875,26766,https://i.ytimg.com/vi/-DRsfNObKIQ/default.jpg,False,False,False,Eleni Foureira represented Cyprus at the first Semi-Final of the 2018 Eurovision Song Contest with the song Fuego. Read more about Eleni Foureira: https://eurovision.tv/participant/eleni-foureira
38579,-QPdRfqTnt4,2018-06-14,Dumbo Official Teaser Trailer,Disney Movie Trailers,1,2018-06-13 07:00:00+00:00,"Disney|""Walt Disney Studios""|""Dumbo""|""Flying Elephant""|""Tim Burton""|""Colin Farrell""|""Eva Green""|""Movie""|""Film""|""Preview""|""Trailer""|""Official""|""HD""|""Cute""|""Adorable""|""Amazing""|""Alice""|""Michael Keaton""|""Dan DeVito""|""Jumbo""|""Baby Mine""|""Aurora""|""Song""|""Singing""",4427381,96391,5508,12726,https://i.ytimg.com/vi/-QPdRfqTnt4/default.jpg,False,False,False,"Watch the teaser trailer for Tim Burton’s all-new live-action Dumbo, coming to theatres March 2019.   From Disney and visionary director Tim Burton, the all-new grand live-action adventure “Dumbo” expands on the beloved classic story where differences are celebrated, family is cherished and dreams take flight. Circus owner Max Medici (Danny DeVito) enlists former star Holt Farrier (Colin Farrell) and his children Milly (Nico Parker) and Joe (Finley Hobbins) to care for a newborn elephant whose oversized ears make him a laughingstock in an already struggling circus. But when they discover that Dumbo can fly, the circus makes an incredible comeback, attracting persuasive entrepreneur V.A. Vandevere (Michael Keaton), who recruits the peculiar pachyderm for his newest, larger-than-life entertainment venture, Dreamland. Dumbo soars to new heights alongside a charming and spectacular aerial artist, Colette Marchant (Eva Green), until Holt learns that beneath its shiny veneer, Dreamland is full of dark secrets.Facebook: https://www.facebook.com/DisneyDumbo/Twitter: https://twitter.com/dumboInstagram: https://www.instagram.com/dumbo/"
38694,-bx_vG94LSo,2018-06-14,Bazzi - Beautiful (Official Video),Bazzi,10,2018-05-23 12:00:00+00:00,"Bazzi|""Bautiful""|""Mine""|""Cosmic""|""Official Audio""|""Official Video""|""Bazzi Music""|""Beautiful Angel""|""gucci looks on you amazing""|""you so fucking precious when you smile""|""Bazzi Mine""|""Bazzi Beautiful""|""Bazi""|""andrew bazzi""|""bazzi""|""myself""|""snapchat""|""bazzi beautiful""|""bazzi mine""|""bazi""|""cosmic""|""mine""|""bazzi cosmic""|""bazzi fantasy""|""bazzi myself""|""bazzi mine meme""|""mine meme""|""bazzi music""|""bazzi why""|""lyrics""|""beautiful lyrics""|""bazzi beautiful lyrics""|""lyric video""|""beautiful""|""music video""|""official music video""",3177766,92573,1301,4276,https://i.ytimg.com/vi/-bx_vG94LSo/default.jpg,False,False,False,"Beautiful by Bazzi - Official Music VideoStream + Download COSMIC: https://Bazzi.lnk.to/COSMICIDSubscribe to my channel: https://goo.gl/C6KC1mFollow Bazzi:https://www.instagram.com/bazzihttps://twitter.com/bazzihttps://www.facebook.com/BazziWorldwidehttp://bazziofficial.comDirector/VFX/Edit: Sherif HigazyProducers: Nick Ruff and Cailin LowryStarring: Renee HerbertDP: Zac Adams1st AC:  Gordon Yould2nd AC: Tristan Walczak Gaffer: Hiram BorgesProduction Designer: Jill BencsitsSet Decorator: Krista Thomas-ScottLeadman: Owen Cook 1st AD: Shelby MaloneProduction Assistant: Anthony RuffBazzi's Stylist: Andrew AndradeStylist: Melynda ChoothesaMake Up Artist: Kristine Urzua Production Company: Thermonuclear, Nova FilmsExecutive Producer: Sherif Higazy Director's Rep: Emily Sanders Video Commissioner: Shadeh Smith"
38661,-kxPDAiuijo,2018-06-14,Beer Yoga with Chance the Rapper | Kevin Hart: What The Fit Episode 13 | Laugh Out Loud Network,LOL Network,23,2018-05-31 17:00:04+00:00,"What the Fit|""Kevin Hart What the Fit""|""Kevin Hart""|""YouTube Originals""|""YouTube Originals Series""|""Series""|""Conan O’Brien""|""James Corden""|""Tiffany Haddish""|""Khloe Kardashian""|""Leslie Jones""|""Bill Hader""|""Rhett and Link""|""Ken Jeong""|""Jack Black""|""Chance the Rapper""|""WTF""|""Evander Holyfield""|""Joel McHale""|""Terry Crews""|""Niecy Nash""|""Rhett & Link""|""DJ Khaled""|""LOL""|""LA Rams""|""Rams""|""Chance""|""Los Angeles Rams""|""Laugh Out Loud Network""|""Fitness""|""Fun""|""Funny""|""Comedy""|""Laugh""|""Yoga""|""Basketball""",2265310,57277,843,4707,https://i.ytimg.com/vi/-kxPDAiuijo/default.jpg,False,False,False,"Kevin Hart and Chance the Rapper drink beers, FaceTime celebrities and find their inner yogi at the bar.Kevin Hart: What The Fit is a brand new unscripted comedy starring Kevin Hart and celebrity guests. In each episode, Kevin invites his friends to join him in taking on a different whacky workout from sumo wrestling with Conan O'Brien to goat yoga with Khloé Kardashian and cowboy rodeo-ing with Leslie Jones. New episode every Thursday and bonus footage every Monday!FOLLOW THE FUNNY:Facebook▶ http://bit.ly/LOLNetwork-FBTwitter▶ http://bit.ly/LOLNetwork-TWInstagram▶ http://bit.ly/LOLNetwork-IGYouTube▶ http://bit.ly/LOLNetwork-YTSnapchat▶ LOLNetworkOfficial Website▶ http://www.laughoutloud.comKevin Hart’s Laugh Out Loud Network YouTube channel is a specially-curated global platform for the NOW generation of comedians and original comedic content. It’s the ultimate destination for fans of funny. Subscribe for exclusive behind the scenes, live commentary by Kevin Hart, pranks, skits, and everything fun. Laugh Out Loud Network is a joint venture brainchild of Kevin Hart and Lionsgate.© MMXVII LIONS GATE TELEVISION, INC.ALL RIGHTS RESERVED.Executive ProducersMATT KUNITZPIP WELLSREBECCA SHUMSKY QUINNDAVID SHUMSKYMARK HARRISJEFF CLANAGANKEVIN HARTCo-Executive ProducersMATT KAYED. MAX PORISHosted ByKEVIN HARTGuest StarringCHANCE THE RAPPERDirected ByALEX VAN WAGNERSupervising ProducerDOMINIC CICCODICOLALine ProducerRACHEL KIELBORNProducersNICK ALARCONKRISTINA GOROLEVICHAMBER MIKEMARIE MITCHELLCANDICE C. WILSONEditorsJOSH BELSONJOE CAULEYComedy ProducerHARRY RATCHFORDAssociate ProducersJADA BATESSCOTT MARTINKEVIN WILSONAssociate DirectorJASON EDWARDSStage ManagerWOLFGANG DELGADODirector of PhotographyTIM MURPHYAudio SupervisorCURTIS ROHMProduction DesignerRYAN FAUGHTTalent Casting ByJB TALENTProduction ManagerMCKENZIE HANSONPost Production SupervisorLINDSAY HEMPELCamera OperatorsRUBEN AVENDANOIVAN DURANRICHARD “RICKY” MARTINEZMALCOLM SERRETTEMARQUES SMITHLead Camera AssistantJEREMIAH THORNECamera AssistantsDEANDRE GREENDAVE HAWESTERRANCE LOFTON JR.Tech SupervisorED DANIELIANTech DepartmentMIKE DELLAMONICAWALLACE DIXONDAN FERRISStill PhotographerMIKE WEAVERMedia ManagerANDREW CURTISAudio MixersANGELO CAVUOTOROBERT MATTHEWSFRANK MONTESNATE NADELLGafferAJ TAYLORBest BoyDANNY VINCENTKey GripROLAND MARTINEZElectriciansDOMINICK ADAMEERIK GONZALESJIM KIMURAGripMARVIN MEJIALead ManKEVIN MINCINSet DressersRILEY CRAPPER MARSHALL KINGProduction ManagerSTEVEN PONCEProduction AccountantSHARON PACKProduction AssociateMICHAEL A. ROWETalent ProducerASHLEY RHORERTalent ManagerDOMINICK MERONETalent AssociateMARLENA HALLERWardrobeASHLEY NORTHDARI SETTELMakeupMICHELLE DEMILTLocation ManagerCARLYN COUCHKey Assistant Location ManagerCLAY DODDERAssistant Location ManagerSHERRY ROLDANDriversJONATHAN ANDERSONCHRIS CLARK Set MedicJOHN AUSTINCraft ServicesANTONIO MARCOSLead Assistant EditorCHRIS HICKSAssistant EditorALEX GILBERTMusic SupervisorRICK KRIMBELColoristTAL, C.S.I.Online EditorJOSIAH COHENRe-Recording MixerTERRANCE DWYER, C.A.S.Music ByANDREW APPLEPIE MUSICBEAR & OWLKILLER TRACKSSIGNATURE TRACKSGraphics ByMIDNIGHT SHERPAProduction AssistantsAARON BELLCAP CREDLEKEVYN DELGADOJEFF DODSONEKKO GAHASTEPHEN GARONEJOHNNY GOMEZDAVE KERNEVAN NELSONSTEPHANIE SINGERSCOTT WHITEMANProduction LegalRAYMOND LEGAL, P.C.Special ThanksBLUEPRINT POST PRODUCTIONBRUCE’S CATERINGC-MOUNT INDSUTRIESILLUMINARLYFTMIXERS POST SOUND SERVICESTHE BOSCHETTI GROUPVER EQUIPMENT RENTALS"
38617,-uuq9V38Akw,2018-06-14,Brian Windhorst on LeBron's free agency: 'Everything is on the table' | The Jump | ESPN,ESPN,17,2018-06-08 20:27:23+00:00,"espn|""espn live""|""brian""|""windhorst""|""on""|""lebron""|""free""|""agency""|""everything""|""is""|""the""|""table""|""lebron free agency""|""brian windhorst on lebron james""|""james""|""lebron james""|""brian windhorst lebron james free agency""|""brian windhorst lebron free agency""|""brian windhorst the jump""|""brian windhorst lebron""|""the jump""|""espn the jump""|""the jump nba""|""nba the jump""|""rachel nichols""|""rachel""|""nichols""|""nba discussion""|""playoffs""|""finals""|""east""|""west""|""east vs west""|""western conference""|""eastern conference""|""nba analysis""",420228,2319,166,1019,https://i.ytimg.com/vi/-uuq9V38Akw/default.jpg,False,False,False,"Brian Windhorst says that everything is on the table for Cleveland Cavaliers star LeBron James in free agency.✔ Subscribe to ESPN on YouTube: http://es.pn/SUBSCRIBEtoYOUTUBE✔ Watch Latest Episodes on WatchESPN: http://es.pn/LatestEpisodes✔ Watch ESPN on YouTube TV: http://es.pn/YouTubeTVGet more ESPN on YouTube:► First Take: http://es.pn/FirstTakeonYouTube► SportsCenter with SVP: http://es.pn/SVPonYouTubeESPN on Social Media:► Follow on Twitter: http://www.twitter.com/espn► Like on Facebook: http://www.facebook.com/espn► Follow on Instagram: http://www.instagram.com/espnVisit ESPN on YouTube to get up-to-the-minute sports news coverage, scores, highlights and commentary for NFL, NHL, MLB, NBA, College Football, NCAA Basketball, soccer and more. More on ESPN.com: http://www.espn.com"
38587,0-VAnh7r-_8,2018-06-14,Destiny 2: Forsaken - E3 Story Reveal Trailer,destinygame,20,2018-06-12 01:30:02+00:00,"Destiny|""Destiny 2""|""Activision""|""Forsaken""|""Bungie""|""Video Game""|""Game""|""Trailer""|""E3""|""Cayde-6""|""Uldren""|""Cayde""|""Scorn""|""Barons""|""Story""|""Reveal""|""Awoken""|""Destiny the Game""|""Prison of Elders""|""September 4""|""Dreaming City""|""Tangled Shore""|""Gambit""",1392609,38471,2932,21316,https://i.ytimg.com/vi/0-VAnh7r-_8/default.jpg,False,False,False,"Take justice into your own hands as you venture into a new frontier filled with enemies, allies, and untold mysteries and treasures waiting to be uncovered. The hunt is on.Destiny 2: Forsaken arrives September 4. Pre-Order and get Cayde’s Exotic Stash.The Reef has fallen to lawlessness, and now the most-wanted criminals in the galaxy – the Barons & Uldren Sov – have organized a jailbreak at the Prison of Elders. You and Cayde-6 have been sent in to bring law and order back to the embattled facility, but things do not go to plan. Facing insurmountable odds, Cayde-6 ends up paying the ultimate price. Beyond the Vanguard’s authority, you’ll venture into the Reef alone and take justice into your own hands. Explore new regions, awaken new powers, earn a wealth of new weapons, and uncover lost Awoken secrets. The hunt is on.• Hunt Down the 8 Barons and their Crew• Two New Destinations: The Tangled Shore and The Dreaming City• A Brand-New Raid• Introducing Gambit, a 4v4 Competitive PvE Mode• Wield New Powers with Nine Additional Supers• Collect New Exotic Weapons, Armor, and Gear• All-New Weapon Archetype, Legendary Bow• New Story Missions, Adventures, Destination Activities, and moreFOLLOW DESTINY:Facebook: https://www.facebook.com/DestinyTheGameTwitter: https://www.twitter.com/destinythegameInstagram: https://www.instagram.com/destinythegameFOLLOW BUNGIE:Facebook: https://www.facebook.com/Bungie/Twitter: https://www.twitter.com/bungieInstagram: https://www.instagram.com/bungie/"
38634,11K013qpRR4,2018-06-14,The LEGO Movie 2 Trailer (2019),FilmSelect Trailer,24,2018-06-05 12:50:30+00:00,"trailer|""movie""|""filmselect""|""The LEGO Movie 2""|""The LEGO Movie 2 Trailer""|""2019""|""lego""",3128325,38937,1198,6580,https://i.ytimg.com/vi/11K013qpRR4/default.jpg,False,False,False,The LEGO Movie 2 Trailer
38714,14G7Qw5DC9M,2018-06-14,17 FUN LIFE HACKS YOU WILL WANT TO TRY YOURSELF,5-Minute Crafts,26,2018-05-18 07:30:00+00:00,"5-Minute Crafts|""DIY""|""Do it yourself""|""crafts""|""trucos""|""trucos de belliza""|""proyectos faciles""|""useful things""|""lifehacks""|""tricks""|""tips""|""DIY projects""|""DIY activities""|""Handcraft""|""Tutorial""|""balloon""|""balloons""|""confettis""|""how to""|""make""|""create""|""design""|""invent""|""festive event""|""birthday party""|""gifts""|""presents""|""gift""|""present""|""gift wrapping""|""toothy pictures""|""drawing""|""painting""|""pull tab""|""rubber band""|""straw hand""",772049,7135,659,508,https://i.ytimg.com/vi/14G7Qw5DC9M/default.jpg,False,False,False,"So here are some incredibly fun life hacks you will want to try yourself!You should totally check out these great ideas for the best party ever!Learn 7 sick dance moves for beginners, find out how to make incredible confetti balloons, floral numbers and letters for room decoration, phone speakers and your own disco ball!It's a perfect chance to spend some quality time with your friends or family and have fun together! Learn how to make soda machine right at home and inflate balloons correctly in a very creative way!Let the fun begin! :)----------------------------------------------------------------------------------------Our Social Media:Facebook: https://www.facebook.com/5min.crafts/Instagram: https://www.instagram.com/5.min.crafts/Twitter: https://twitter.com/5m_craftsSubscribe to 5-Minute Crafts GIRLY: https://goo.gl/fWbJqzSubscribe to 5-Minute Workouts: https://goo.gl/67owiQSubscribe 5-Minute Crafts KIDS: https://goo.gl/PEuLVtThe Bright Side of Youtube: https://goo.gl/rQTJZz----------------------------------------------------------------------------------------For more videos and articles visit:http://www.brightside.me/"
38712,1gSu12JpKP8,2018-06-14,HoodCelebrityy - Walking Trophy,HoodCelebrityyVEVO,10,2018-05-15 10:00:00+00:00,"hoodcelebrityy|""hood celebrityy""|""walking trophy""|""walking trophy official video""|""walking trophy music video""|""hoodcelebrity""|""hood celebrity""|""island girls""|""vybez""|""sit down""|""the takeover""|""famous""|""french montana""|""mc ig""|""yung baby tate""|""shenseea""|""vershon""|""j capri""|""saweetie""|""nailah blackman""|""mc lais""|""dy dy""|""reggae""|""bronx""|""hip hop reggae""|""jamaica""|""cardi b""|""wine pon it""|""can't believe it's just a girl""|""Vybz Kartel""|""dancehall""|""Popcaan""|""Alkaline""|""jamaican""",2463668,47639,2778,1846,https://i.ytimg.com/vi/1gSu12JpKP8/default.jpg,False,False,False,"Walking Trophy available at http://smarturl.it/WalkingTrophy      Directed by Sam LeccaHoodCelebrityy online: https://twitter.com/hoodcelebrityy https://www.instagram.com/hoodcelebrityy https://soundcloud.com/hoodcelebrityy https://www.facebook.com/Hoodcelebrity/ https://hoodcelebrityy.com(C) 2018 Epic Records, a division of Sony Music Entertainment"
38588,1zNr8Pf1QkY,2018-06-14,Robert de Niro's 'Fuck Trump' speech at Tony awards,Guardian News,25,2018-06-11 09:14:15+00:00,"film|""gdnpfpculturefilm""|""Robert de Niro""|""Donald Trump""|""Tony Awards""|""New York""|""news""|""Robert de Niro comments on Donald Trump""|""Robert de Niro Trump""|""Robert de Niro Tony Awards""|""Tony Awards 2018""|""culture""|""gdnpfpculture""|""fuck trump""|""de niro fuck trump""|""de niro trump""|""robert de niro trump""|""robert de niro fuck trump""|""2018""|""us""|""gdnpfpnewsus""|""politics""|""gdnpfpnewspolitics""|""de niro tony awards""|""de niro trump speech""|""president trump""|""trump""|""fuck trump de niro""|""down with trump""|""uncensored""|""unbleeped""",2198480,23920,13221,19227,https://i.ytimg.com/vi/1zNr8Pf1QkY/default.jpg,False,False,False,The actor and long-time critic of Donald Trump receives a standing ovation at Sunday night’s Tony awards in New York after attacking the US president on stage at Radio City Music Hall Subscribe to Guardian News ► http://bit.ly/guardianwiressub• De Niro receives ovation for speech at Tony awards ► https://www.theguardian.com/film/2018/jun/11/robert-de-niro-wins-ovation-fuck-trump-speech-tony-awardsSupport the Guardian ► https://theguardian.com/supportusThe Guardian ► https://www.theguardian.comThe Guardian YouTube network:The Guardian ► www.youtube.com/theguardianOwen Jones talks ► http://bit.ly/subsowenjonesGuardian Football ► http://is.gd/guardianfootballGuardian Sport ► http://bit.ly/GDNsportGuardian Culture ► http://is.gd/guardiancultureGuardian Science and Tech ► http://is.gd/guardiantech
38650,2MiQonPvlVM,2018-06-14,Yubin 숙녀 (淑女) M/V,jypentertainment,10,2018-06-05 09:00:01+00:00,"JYP Entertainment|""JYP""|""Yubin""|""유빈""|""First Solo""|""유빈 솔로""|""숙녀""|""Lady""|""도시여자""|""도시애""|""시티팝""|""music video""|""mv""|""choreography""|""choreography video""|""teaser""|""티저""|""뮤비 티저""|""MV teaser""|""유빈 티저""|""yubin teaser""|""yubin solo""|""yubin lady""|""유빈 숙녀""|""yubin debut""|""유빈 음원""|""유빈 뮤비""|""yubin mv""|""유빈 mv""|""유빈 뮤직비디오""|""숙녀 뮤직비디오""|""숙녀 뮤비""|""lady mv""|""yubin lady mv""|""#유빈""|""#Yubin""|""#都市女子""|""#도시여자""|""#숙녀""|""#淑女""|""#JYP""|""#김유빈""|""#안무연습영상""|""#안무""|""#군무""|""#춤선""|""#춤""|""#하우헤브유빈""|""#인천공항""|""#LA""|""#걸그러쉬""|""#첫방""|""#비글""|""#랜선데이트""|""#라이브""|""#댄스""|""#네이버""|""#브이""|""#생중계""|""#음원""|""#뮤직비디오""",2361405,90036,3970,10271,https://i.ytimg.com/vi/2MiQonPvlVM/default.jpg,False,False,False,Yubin 숙녀 (淑女) M/VSpotify https://goo.gl/4FqgtyiTunes & Apple Music https://goo.gl/7fUFz2Google Play Music https://goo.gl/peqL31[Yubin Official] http://yubin.jype.comhttps://www.youtube.com/c/YubinOfficialhttp://www.facebook.com/YubinOfficialhttp://www.twitter.com/YubinOfficialhttp://fans.jype.com/YubinCopyrights 2018 ⓒ JYP Entertainment. All Rights Reserved
38733,2PH7dK6SLC8,2018-06-14,John Mayer - New Light,johnmayerVEVO,10,2018-05-10 17:00:01+00:00,"John|""Mayer""|""New""|""Light""|""Snack""|""Money""|""Pop""|""boy in your other phone""|""Pushin 40 in the friend zone""|""I want a take two""|""I wanna break through""|""I wanna know the real thing about you""|""give me just one night""",3839019,79766,1662,5639,https://i.ytimg.com/vi/2PH7dK6SLC8/default.jpg,False,False,False,"Spotify: http://radi.al/NewLightSpotifyApple: http://radi.al/NewLightAppleAmazon: http://radi.al/NewLightAMZJohn Mayer“New Light”I’m the boy in your other phoneLighting up inside your drawer at home all alonePushin 40 in the friend zoneWe talk and then you walk away every dayOh you don’t think twice bout meAnd maybe you’re right to doubt me butBut if you give me just one nightYou’re gonna see me in a new lightYeah if you give me just one nightTo meet you underneath the moonlightOh I want a take twoI wanna break throughI wanna know the real thing about youSo I can see you in a new lightTake a ride up to MalibuI just wanna sit and look at you, look at youWhat would it matter if your friends knewWho cares what other people say anywayOh we can go far from hereAnd make a new world together babe‘Cause if you give me just one nightYou’re gonna see me in a new lightYeah, if you give me just one nightTo meet you underneath the moonlightOh I want a take twoI wanna break throughI wanna know the real thing about youSo I can see you in a new lightYeah if you give me just one nightYou’re gonna see me in a new lightYeah if you give me just one nightTo meet you underneath the moonlightWhat do I do with all this, what do I do with all thisLove that's runnin through my veins for youWhat do I do with all this, what do I do with all thisLove that's runnin through my veins for youWhat do I do with all this, what do I do with all thisLove that's runnin through my veins for youWhat do I do with all this, what do I do with all this"
38665,2SJ0hgdciNE,2018-06-14,Marshmello x Juicy J - You Can Cry (Ft. James Arthur) (Official Video),Marshmello,10,2018-05-30 14:00:00+00:00,"you can cry|""you can cry music video""|""you can cry lyrics""|""you can cry lyric video""|""marshmello""|""juicy j""|""james arthur""|""marshmello you can cry""|""james arthur you can cry""|""juicy j you can cry""|""marshmello juicy j""|""marshmallow""|""pop""|""pop music""|""hip hop""|""r&b""|""hip-hop""|""marshmello wolves""|""marshmello friends""|""marshmello silence""|""anne-marie""|""selena gomez""|""columbia""|""joytime collective""|""canciones en ingles""|""musica""|""music""|""vevo""|""drake""|""childish gambino""|""diplo""|""x-factor""|""migos""|""danger""|""everyday""|""ye""|""kanye""",7877471,251597,6820,12339,https://i.ytimg.com/vi/2SJ0hgdciNE/default.jpg,False,False,False,Marshmello x Juicy J - You Can Cry (Ft. James Arthur)Download/Stream Here  ▶ http://smarturl.it/YouCanCrySubscribe Here ▶ http://youtube.com/marshmellomusic?sub_confirmation=1Get your NEW Mello™️ by Marshmello gear HERE ▶ http://shop.marshmellomusic.comWatch Cooking with Marshmello HERE ▶ http://youtube.com/playlist?list=PLcYK4PlHbZQtXROf5fnrr4dO4ruWiv7tsWATCH EVERYDAY MUSIC VIDEO ▶ https://youtu.be/bEdcJY8Emm8WATCH FLY MUSIC VIDEO ▶ https://youtu.be/oRArmtMA9AIWATCH FRIENDS MUSIC VIDEO ▶ https://youtu.be/jzD_yyEcp0MWATCH SPOTLIGHT MUSIC VIDEO ▶ https://youtu.be/7R1N-8SoqcMWATCH LOVE U MUSIC VIDEO ▶ https://youtu.be/D-pKeb6Wf4UWATCH TAKE IT BACK MUSIC VIDEO ▶ https://youtu.be/P9Ijqa_2eu0WATCH SILENCE MUSIC VIDEO ▶ https://youtu.be/Tx1sqYc3qasWATCH BLOCKS MUSIC VIDEO ▶ https://youtu.be/5E4ZBSInqUUWATCH YOU & ME MUSIC VIDEO ▶ https://youtu.be/fiusxyygqGkWATCH FIND ME MUSIC VIDEO ▶ https://youtu.be/ymq1WdGUcw8WATCH MOVING ON MUSIC VIDEO ▶ https://youtu.be/yU0tnrEk8H4WATCH SUMMER MUSIC VIDEO ▶ https://youtu.be/2vMH8lITTCEWATCH ALONE MUSIC VIDEO ▶ https://youtu.be/ALZHF5UqnU4WATCH KEEP IT MELLO MUSIC VIDEO ▶ https://youtu.be/_J_VpmXAzqgMARSHMELLO: Spotify | http://spoti.fi/MarshmelloSoundCloud | http://soundcloud.com/marshmellomusicInstagram | http://instagram.com/marshmellomusicTwitter | http://twitter.com/marshmellomusicFacebook | http://facebook.com/marshmellomusicMerch | http://shop.marshmellomusic.com/JUICY J:http://thejuicyj.comhttp://www.facebook.com/juicyjmusichttp://twitter.com/therealjuicyjhttp://instagram.com/juicyjJAMES ARTHUR:https://www.facebook.com/jamesarthurhttps://www.twitter.com/jamesarthur23https://www.instagram.com/jamesarthurinsta23/Best of James Arthur: https://goo.gl/PcpVdQSubscribe here: https://goo.gl/yM9xqjCredits:Agency: MGX CreativeDirector: Daniel MalikyarExecutive Producer: Karam GillSenior Producer: Ryan HuffmanProducer: Brian BellDP: Michael StineProduction Designer: Tyler JensenStylist: Lisa MadonnaEditor: Troy CharbonnetColorist: Kinan ChabaniCasting Director: Jake van Zyll#YouCanCry
38646,2h_TxIxx-Kg,2018-06-14,"Diddy & King Combs on The Four, Rap Beef, NFL & A Lot More",BigBoyTV,24,2018-06-07 13:00:01+00:00,"puff daddy|""diddy""|""king combs""|""bad boy""|""biggie smalls""|""notorious b.i.g.""|""90's""|""drake""|""pusha t""|""kanye west""|""kendrick lamar""|""the four""|""fox""|""BigBoyTV""|""Big Boy TV""|""Hip Hop""|""Big Boys Neighborhood""|""Interview""|""Full Interview""|""Radio Big Boy""|""Big Boy DJ""|""Real 92.3""|""Real 923""|""Big Boy Radio""|""Big Boy YouTube""",93749,1208,62,250,https://i.ytimg.com/vi/2h_TxIxx-Kg/default.jpg,False,False,False,————————————SUBSCRIBE————————————► https://bit.ly/2DNKRdd————————————CONNECT - BIG BOY————————————► Instagram: https://bit.ly/2G7GT0E► Facebook: https://bit.ly/2DPuD2W► Twitter: https://bit.ly/1NBKwYw————————————CONNECT - NEIGHBORHOOD————————————► Instagram: https://bit.ly/2G1LYaZ► Facebook: https://bit.ly/2DPkCTs► Twitter: https://bit.ly/2pxUHvi► Listen Live: https://ihr.fm/2pA6jNH► Blog: https://www.radiobigboy.com/————————————Credits————————————Executive Producer: Jason Ryan - @JayRyLAProduced/Shot/Edited/Published by: Daniel B. - @YaBoySLPhotography by: Joel M. - @FlashpointGRAFX
38670,35aEjj8C4Cg,2018-06-14,Fans Vs Disney Star Wars: The Current State Of Things,Jeremy Jahns,24,2018-05-31 01:26:05+00:00,"Star Wars|""fans""|""fans vs star wars""|""kathleen kennedy""|""disney star wars""|""movie""|""review""|""Awesometacular""|""jeremy jahns""",640971,43481,1880,14678,https://i.ytimg.com/vi/35aEjj8C4Cg/default.jpg,False,False,False,"Solo has under-performed, the fans have been split since The Last Jedi, and people wonder why. Here are my thoughts and observations as to how and why Star Wars fans are unhappy, and calling for change."
38645,36DAv_m8Mlw,2018-06-14,MNEK - Colour (Lyric Video) ft. Hailee Steinfeld,MNEKVEVO,10,2018-06-01 13:48:48+00:00,"MNEK|""Colour""|""Virgin""|""EMI""|""Pop""",933283,30992,552,1224,https://i.ytimg.com/vi/36DAv_m8Mlw/default.jpg,False,False,False,MNEK – Colour (ft Hailee Steinfeld) is available to stream or download here now: https://MNEK.lnk.to/Colour
