id,video_id,trending_date,title,channel_title,category_id,publish_time,tags,views,likes,dislikes,comment_count,thumbnail_link,comments_disabled,ratings_disabled,video_error_or_removed,description
38651,JvVYL7s-HMc,2018-06-14,Rich The Kid Feat. Pusha T Can't Afford It (WSHH Exclusive - Official Audio),WORLDSTARHIPHOP,10,2018-06-05 20:38:16+00:00,"world star hip hop|""worldstarhiphop""|""worldstar""|""world star""|""worldstar youtube""|""youtube worldstar""|""worldstarhiphop youtube""|""youtube worldstarhiphop""|""worldstarhiphop channel""|""wshh""|""hip hop""|""hip hop music""|""rap""|""rap music""|""music""|""music video""|""exclusive""|""WSHH exclusive""",846012,24718,849,3460,https://i.ytimg.com/vi/JvVYL7s-HMc/default.jpg,False,False,False,"Listen to the official audio for Can't Afford It by Rich The Kid Feat. Pusha T.SUBSCRIBE for more: http://bit.ly/subWSHH More WorldstarHipHop: http://worldstarhiphop.com https://twitter.com/worldstarhttps://facebook.com/worldstarhiphophttp://instagram.com/worldstar Shop WorldStar:http://shop.worldstarhiphop.comWorldstarHipHop is home to everything entertainment & hip hop. The #1 urban outlet responsible for breaking the latest premiere music videos, exclusive artist content, entertainment stories, celebrity rumors, sports highlights, interviews, comedy skits, rap freestyles, crazy fights, eye candy models, the best viral videos & more.Since 2005, WorldstarHipHop has worked with some of our generation's most groundbreaking artists, athletes & musicians - all who have helped continue to define our unique identity and attitude.We plan on continuing to work with only the best, so keep an eye out for all the exciting new projects / collaborations we plan on dropping in the very near future."
38626,Kbj2Zss-5GY,2018-06-14,A$AP Rocky - Praise The Lord (Da Shine) (Official Video) ft. Skepta,LIVELOVEASAPVEVO,10,2018-06-05 22:00:01+00:00,"A$AP Rocky feat. Skepta|""A$AP Worldwide/Polo Grounds Music/RCA Records""|""Praise The Lord (Da Shine)""|""Rap""",8139750,266690,3179,11230,https://i.ytimg.com/vi/Kbj2Zss-5GY/default.jpg,False,False,False,PRAISE THE LORD (DA SHINE) - OFFICIAL VIDEOTESTING OUT NOW - LISTEN HERE http://smarturl.it/zTESTINGHTTPS://TSTNG.COTESTING APP: http://smarturl.it/TESTINGAPP FOLLOW ROCKY:https://www.instagram.com/asaprocky/https://www.facebook.com/asaprockyhttps://www.twitter.com/asvpxrockyhttp://www.asvpxrocky.com/http://www.awgeshit.com/
38628,Klfho60budI,2018-06-14,Niecy Nash Has A Prince Story,The Late Show with Stephen Colbert,24,2018-06-08 07:35:00+00:00,"The Late Show|""Late Show""|""Stephen Colbert""|""Steven Colbert""|""Colbert""|""celebrity""|""celeb""|""celebrities""|""late night""|""talk show""|""comedian""|""comedy""|""CBS""|""joke""|""jokes""|""funny""|""funny video""|""funny videos""|""humor""|""hollywood""|""famous""|""interviews""|""Niecy Nash""|""Interview""|""Entertainment""|""Nonrecurring""|""Evergreen""",142194,1450,85,332,https://i.ytimg.com/vi/Klfho60budI/default.jpg,False,False,False,"'Claws' star Niecy Nash's story about Prince has everything. Even a Leo DiCaprio cameo.Subscribe To The Late Show Channel HERE: http://bit.ly/ColbertYouTubeFor more content from The Late Show with Stephen Colbert, click HERE: http://bit.ly/1AKISnRWatch full episodes of The Late Show HERE: http://bit.ly/1Puei40Like The Late Show on Facebook HERE: http://on.fb.me/1df139YFollow The Late Show on Twitter HERE: http://bit.ly/1dMzZzGFollow The Late Show on Google+ HERE: http://bit.ly/1JlGgzwFollow The Late Show on Instagram HERE: http://bit.ly/29wfREjFollow The Late Show on Tumblr HERE: http://bit.ly/29DVvtRWatch The Late Show with Stephen Colbert weeknights at 11:35 PM ET/10:35 PM CT. Only on CBS.Get the CBS app for iPhone & iPad! Click HERE: http://bit.ly/12rLxgeGet new episodes of shows you love across devices the next day, stream live TV, and watch full seasons of CBS fan favorites anytime, anywhere with CBS All Access. Try it free! http://bit.ly/1OQA29B---The Late Show with Stephen Colbert is the premier late night talk show on CBS, airing at 11:35pm EST, streaming online via CBS All Access, and delivered to the International Space Station on a USB drive taped to a weather balloon. Every night, viewers can expect: Comedy, humor, funny moments, witty interviews, celebrities, famous people, movie stars, bits, humorous celebrities doing bits, funny celebs, big group photos of every star from Hollywood, even the reclusive ones, plus also jokes."
38643,L9FA9U4s3Tg,2018-06-14,Josh Groban - Granted (Official Lyric Video),Josh Groban,10,2018-06-08 04:00:20+00:00,"josh groban|""granted""|""new song""|""new single""|""lyric video""|""bridges tour""|""the tony awards""|""CBS""|""latest song""|""new video""|""josh groban video""|""josh groban new""",189038,8607,133,497,https://i.ytimg.com/vi/L9FA9U4s3Tg/default.jpg,False,False,False,"The Official Lyric Video for Josh Groban's new single Granted - get it now at:  https://wbr.ec/grantedDirector: Laura MendeShot by: Aaron HymesGraphics by: Black Balloon Media, LLCSpecial thanks to LACHSA & the Find Your Light Foundation.Connect with Josh:Facebook: http://www.facebook.com/joshgrobanTwitter: http://www.twitter.com/joshgrobanWebsite: http://www.joshgroban.comInstagram: http://instagram.com/JoshGroban"
38685,LftOOM6qlJ4,2018-06-14,Liam Gallagher - I've All I Need (Official Video),Liam Gallagher,22,2018-05-25 13:57:47+00:00,"liam gallagher|""i've all i need""|""as you were""|""oasis""|""As You Were""|""Liam""|""Gallagher""|""LGx""|""Debut Album""|""Official Video""|""Noel Gallagher""|""Manchester""|""Live""|""Gig""|""Liam Gallagher Live""|""Liam Glastonbury""|""As U were""|""Paper Crown""|""Rock Music""|""Electric Guitar""|""Gallager""|""Studio Time""|""Liam Gallagher Studio""|""Live Forever""|""Live Forever Brits""|""Lyrics""|""Song Lyrics""|""New Album""|""New Video""|""LG New Video""|""Liam New Video""|""Beady Eye""",381741,12108,204,1216,https://i.ytimg.com/vi/LftOOM6qlJ4/default.jpg,False,False,False,Liam Gallagher - I've All I Need (Official Video)Liam Gallagher's solo album 'As You Were' is out now https://l-gx.com/lg_asyouwereSubscribe to Liam Gallagher’s Youtube channel: https://l-gx.com/yt_subscribeWatch Liam Gallagher’s videos: https://l-gx.com/asyouwere_ytplaylistFollow Liam Gallagher on Twitter: https://l-gx.com/twitterFacebook: https://l-gx.com/facebookInstagram: https://l-gx.com/instagramSpotify: https://wbr.ec/lgx_spotifyLyrics:I’ve all I need and moreYou hold the key for sureIf all I have is youThen darling please be trueThere’s no time for looking backThanks for all your supportSlow down all things must passTake your timeKnow the scoreTomorrow never knowsThe winds of change must blowI hibernate and singWhile gathering my wingsThere’s no time for looking backThanks for all your supportSlow down all things must passTake your timeKnow the scoreI’ve all I need and moreYou hold the keyIt’s not goodbyeSo dry your eyesCome rain or shineI’ve all I need and moreThere’s no time for looking backThanks for all your supportSlow down all things must passTake your timeKnow the scoreIt’s not goodbyeSo dry your eyesCome rain or shineI’ve all I need and moreWe hold the key for sureLightening FilmsFilmed and directed byCharlie Lightening
38623,MOP50VQBdCg,2018-06-14,Camila Cabello & Pharrell - Sangria Wine (Dance Challenge),Camila Cabello,10,2018-06-07 14:43:22+00:00,"sangria wine|""pharrell""|""camila""|""camila cabello""|""havana""|""never be the same""|""dance challenge""|""dance tutorial""|""dance""|""sangria""|""wine""|""cabello""|""camilla""|""dance video""|""pharrell williams""",2968478,163531,2311,5148,https://i.ytimg.com/vi/MOP50VQBdCg/default.jpg,False,False,False,learn to do the 'sangria wine' with me 💃🏻🍷 https://smarturl.it/sangriawineFollow Camila online:Facebook: https://www.facebook.com/camilacabello Instagram: https://www.instagram.com/camila_cabe... Twitter: https://twitter.com/camila_cabelloWebsite: http://camilacabello.com/Follow Pharrell online:Facebook: https://www.facebook.com/Pharrell/Instagram: https://instagram.com/pharrell Twitter: https://twitter.com/pharrellWebsite: http://pharrellwilliams.com/
38675,MmPPxQnaGDY,2018-06-14,Half in the Bag: Solo: A Star Wars Story,RedLetterMedia,24,2018-05-29 13:42:59+00:00,"redlettermedia|""red letter media""|""red""|""letter""|""media""|""plinkett""|""half in the bag""|""mike stoklasa""|""jay bauman""|""rich evans""|""Solo""|""A Star Wars Story""|""Review""",884415,28642,1246,9213,https://i.ytimg.com/vi/MmPPxQnaGDY/default.jpg,False,False,False,"Mike, Jay, and Mike's drug induced hallucination name Rick Evans talk about the most unanticipated anticipation of a movie called Solo: A Solo Wars Star Wars Solo Story"
38699,N1HAMUAXzbs,2018-06-14,Kris Wu – Like That (Official Music Video),Kris Wu,10,2018-05-22 15:05:18+00:00,"Kris Wu|""Wu Yi Fan""|""吴亦凡""|""fan shi""|""wuyifan""|""kw""|""kris""|""like that""|""likethat""",13799079,123856,0,10903,https://i.ytimg.com/vi/N1HAMUAXzbs/default.jpg,False,False,False,"Special thanks to Stella Maxwell.Get “Like That”, out now: http://smarturl.it/LikeThatKWFor more:https://www.facebook.com/kriswugalaxyhttps://www.instagram.com/kriswu https://twitter.com/kriswu For updates:http://www.kriswuofficial.com"
38721,N7HFXgyTya0,2018-06-14,My Dinosaur Is a Service Animal (with Chris Pratt and Bryce Dallas Howard!) | CH Shorts,CollegeHumor,23,2018-05-15 17:30:00+00:00,"Collegehumor|""CH originals""|""comedy""|""sketch comedy""|""internet""|""humor""|""funny""|""sketch""|""chris pratt""|""bryce dallas howard""|""appearances""|""celebrities""|""Jurassic World""|""pets""|""animals""|""flying""|""dinosaurs""|""feels""|""anxiety""|""action movies""|""customer service""|""raphael chestang""|""CH Shorts""|""jurassic park""|""jurassic""|""service animals""|""service animal""|""chris pratt jurassic park""|""chris pratt jurassic park world""|""bryce dallas howard kiss""|""bryce dallas howard movies""|""chris bryce service dinosaur""|""latest""",1928358,83723,1327,3749,https://i.ytimg.com/vi/N7HFXgyTya0/default.jpg,False,False,False,"Just because it’s a Velociraptor with knives for teeth doesn’t mean it’s not my best friend.CH Shorts - Original sketches, music videos, and pop culture parodies spanning the last CollegeHumor decade.FOLLOW THE CAST:ALLY: http://www.twitter.com/lilbeardsleyGRANT: http://www.twitter.com/grantobKATIE: http://www.twitter.com/katiemarovitchTRAPP: http://www.twitter.com/mikewtrappRAPH: http://www.twitter.com/chestangraphaelREKHA: http://www.twitter.com/rekhalshankarBRENNAN: https://twitter.com/brennanlmSAM: http://www.twitter.com/samreichSee more http://www.collegehumor.comLIKE us on: http://www.facebook.com/collegehumorFOLLOW us on: http://www.twitter.com/collegehumorFOLLOW us on: http://www.collegehumor.tumblr.comSIGN UP for our emails: http://bit.ly/2E6svorCASTChris PrattBryce Dallas HowardRaphael ChestangBlue - Nick CelentanoAirport Travelers - Ellie PangerRorrie TravisAntonio SalgadoDanice PageSteven LeeAndrea ClemonsJames KarroumLaura JohnstonIan SollenbergerKillian SobelCREWDirector - Ryan Anthony MartinWriter - Raphael ChestangProducer - Shane CrownProduction Coordinator - Francesca McLafferty Editor - Sam Geer"
38580,Nw-BMNnr1Ko,2018-06-14,Trump Meets Kim Jong-un: A Closer Look,Late Night with Seth Meyers,23,2018-06-13 01:00:02+00:00,"Late|""Night""|""with""|""Seth""|""Meyers""|""seth meyers""|""late night with seth meyers""|""dietland""|""tom king""|""Closer Look""|""trump""|""kim jon un""|""NBC""|""NBC TV""|""television""|""funny""|""talk show""|""comedy""|""humor""|""stand-up""|""parody""|""snl seth meyers""|""host""|""promo""|""seth""|""meyers""|""weekend update""|""news satire""|""satire""|""G7 Summit""|""Singapore""|""meeting""|""2016 election""|""Hillary Clinton""|""debates""",1315966,17258,1239,3162,https://i.ytimg.com/vi/Nw-BMNnr1Ko/default.jpg,False,False,False,"Seth takes a closer look at the historic meeting between President Trump and North Korea's Kim Jong-un.» Subscribe to Late Night: http://bit.ly/LateNightSeth» Get more Late Night with Seth Meyers: http://www.nbc.com/late-night-with-seth-meyers/» Watch Late Night with Seth Meyers Weeknights 12:35/11:35c on NBC.LATE NIGHT ON SOCIALFollow Late Night on Twitter: https://twitter.com/LateNightSethLike Late Night on Facebook: https://www.facebook.com/LateNightSethFind Late Night on Tumblr: http://latenightseth.tumblr.com/Connect with Late Night on Google+: https://plus.google.com/+LateNightSeth/videosLate Night with Seth Meyers on YouTube features A-list celebrity guests, memorable comedy, and topical monologue jokes.NBC ON SOCIAL Like NBC: http://Facebook.com/NBCFollow NBC: http://Twitter.com/NBCNBC Tumblr: http://NBCtv.tumblr.com/NBC Pinterest: http://Pinterest.com/NBCtv/NBC Google+: https://plus.google.com/+NBCYouTube: http://www.youtube.com/nbcNBC Instagram: http://instagram.com/nbctvTrump Meets Kim Jong-un: A Closer Look- Late Night with Seth Meyershttps://youtu.be/Nw-BMNnr1KoLate Night with Seth Meyershttp://www.youtube.com/user/latenightseth"
38595,PDELaG1YreU,2018-06-14,For Honor: E3 2018 Marching Fire Cinematic Trailer | Ubisoft [NA],Ubisoft North America,20,2018-06-11 21:09:03+00:00,"for honor|""for honor trailer""|""for honor campaign""|""trailer""|""ps4""|""xbox one""|""pc""|""ubisoft""|""Japanese Katana""|""European Longsword""|""Samurai sword""|""Knight Broadsword""|""faction war""|""for honor new heroes""|""for honor arena""|""breach""|""Ubisoft 2018""|""E3""|""E3 2018""|""E3 2018 new games""|""ubisoft e3 2018""|""E3 Reveal""|""e3 for honor trailer""|""conference presentation""|""for honor presentation""|""ubie3""|""ubie3 2018""|""Marching Fire""|""Chinese heroes""|""for honor chinese warriors""|""for honor chinese""|""for honor china""",345395,8005,249,1979,https://i.ytimg.com/vi/PDELaG1YreU/default.jpg,False,False,False,"Celebrate Marching Fire: Get the For Honor Starter Edition on PC Free: ForHonorGame.com/FreeStarterWatch to see the reveal of For Honor: Marching Fire, a major update that will see new heroes, a new PvP mode called Breach, an unlimited single player mode, and major graphical enhancements. Marching Fire is coming October 16th.#ForHonorSUBSCRIBE! http://bit.ly/UbisoftYouTubeChannelWebsite: https://forhonor.ubisoft.com/game/en-...YouTube: https://www.youtube.com/c/ubisoftusFacebook: https://www.facebook.com/ForHonorGameUSTwitter: https://twitter.com/ForHonorGameABOUT FOR HONOR MARCHING FIRECarve a path of destruction through an intense, believable battlefield fighting for guts, glory, and survival in For Honor, the acclaimed melee action game developed by Ubisoft Montreal in collaboration with other Ubisoft studios.Enter the chaos of a raging war as a bold Knight, brutal Viking, or deadly Samurai, three of the greatest warrior factions of legend. For Honor is a fast-paced and immersive experience, mixing skill with visceral, never-before-seen melee combat. Storm castles in massive battles and confront deadly bosses in the memorable story campaign and support your allies while slaughtering enemies in the groundbreaking multiplayer modes where your combat skills will make the difference between life and death.Since its release in 2017, For Honor has continued to expand its world with new heroes, modes, and features. Six seasons of content, including regular in-game events, have kept the faction war fresh and exciting. Responding to community feedback, the team worked diligently to build dedicated servers for all multiplayer modes. Since the release of these servers, For Honor has reached best-in-class match completion and eliminated host migration. The recently launched training mode teaches players to master the Art of Battle, For Honor’s completely unique combat system.For Honor: Marching Fire, coming October 16 2018, is a major update encompassing new heroes, new a PVP mode, unlimited PVE content and a comprehensive graphical update.FeaturesNEW HEROES FROM THE FAR EAST – Four warriors from the Wu Lin faction are traveling west after civil war, betrayal and personal tragedies strike close to home. The Jiang Jun, once a feared general, now uses his guandao to wreak havoc on the West. The Nuxia, a bodyguard betrayed by allies, uses her hook swords to slay anyone who stands in her way. The Shaolin, a warrior monk forced to watch his monastery burn, now spreads the gospel with his staff. The Tiandi once sat fourth in line for the throne but was consumed by madness and killed his brothers, ultimately leading to the defeat of his empire. Now, he atones by seeking out the wicked with his broadsword.BREACH THE CASTLE – Attack and defend a castle in Breach, For Honor’s new strategic 4v4 PvP mode. Attackers must work together to storm the castle gates and kill the Lord of the castle, while defenders must either take down the battering ram or kill all attackers to protect the Lord.UNLIMITED SINGLE PLAYER CONTENT – A new mode, yet to be revealed, offering unlimited single player and 2-person co-op PVE content.GRAPHICALLY ENHANCED – Significant graphical enhancements bring you closer to the action than ever before.For Honor: E3 2018 Marching Fire Cinematic Trailer | Ubisoft [NA]© 2016 Ubisoft Entertainment. All Rights Reserved. The For Honor logo, Ubisoft, and the Ubisoft logo are trademarks of Ubisoft Entertainment in the US and/or other countries."
38644,QKn9yiLVlMM,2018-06-14,The History of Bethesda Game Studios - Elder Scrolls / Fallout Documentary,Noclip,20,2018-06-05 17:45:39+00:00,"fallout|""the elder scrolls""|""documentary""|""noclip""|""todd howard""|""the elder scrolls arena""|""daggerfall""|""morrowind""|""skyrim""|""oblivion""|""fallout 3""|""fallout 4""|""fallout new vegas""",660849,32175,267,3115,https://i.ytimg.com/vi/QKn9yiLVlMM/default.jpg,False,False,False,"Embark on a quest through the history of The Elder Scrolls and Fallout. With insight into the development of everything from Arena to Fallout 4, Noclip takes you on a journey through the creative process of one of the most prolific RPG designers in gaming history.Noclip's work is 100% crowdfunded. Consider supporting us on Patreon: https://www.patreon.com/noclipCheck out our new website here: https://www.noclip.videoBuy merch here: https://store.noclip.videoChapter Markers by Game06:37 - Arena & Daggerfall15:15 - Morrowind21:38 - Oblivion33:30 - Fallout 355:43 - Skyrim01:09:02 - Fallout 4Licenced Music UsedCorn Fieldshttps://www.audionetwork.com/browse/m/track/corn-fields_105350Fracture 3https://www.audionetwork.com/browse/m/track/fracture-3_132509Game Music UsedFallout 4 Theme: https://www.youtube.com/watch?v=kzvZE4BY0hYOblivion OST - Peace Of Akatosh:https://www.youtube.com/watch?v=crkx0nYaaNkMorrowind Theme Song:https://www.youtube.com/watch?v=nJD-Ufi1jGkMorrowind OST - Shed Your Travels:https://www.youtube.com/watch?v=rvrYFN2sS1wOblivion OST - Glory of Cyrodiilhttps://www.youtube.com/watch?v=c2EbsfqhI2kOblivion OST - Als is Wellhttps://www.youtube.com/watch?v=7qHinJ7C2P0Oblivion OST - Dusk at the Markethttps://www.youtube.com/watch?v=zetK1Rp2Vh8Fallout 3 OST - Explore 1 https://www.youtube.com/watch?v=59JxrMgO208Fallout 3 OST - Explore 2https://www.youtube.com/watch?v=FMs7BgvYO_sFallout 3 OST - Explore 3https://www.youtube.com/watch?v=gmndCCpYnZMSkyrim OST - Distant Horizonshttps://www.youtube.com/watch?v=1eF2gOBC848Skyrim OST - Journey's End https://www.youtube.com/watch?v=GiHEX_xSL8ASkyrim OST - Around The Firehttps://www.youtube.com/watch?v=gQGFGGptiAgSkyrim OST -  Secundahttps://www.youtube.com/watch?v=qC9Ri2hZsosSkyrim OST -  Dawnhttps://www.youtube.com/watch?v=SnqPJv0UqKoFallout 4 OST - Of the People, for the Peoplehttps://www.youtube.com/watch?v=ob_eK3e4520Fallout 4 OST - Deeper and Darkerhttps://www.youtube.com/watch?v=nN13kUeFcuMFallout 4 OST - Darkness Fallshttps://www.youtube.com/watch?v=uL5xYiwHYj4Fallout 4 OST - Imagine Utopiahttps://www.youtube.com/watch?v=njUYNDbWrao"
38604,QRyzwPzxpcs,2018-06-14,Sea of Thieves - E3 2018 - Cursed Sails and Forsaken Shores Announce,Xbox,20,2018-06-10 20:29:46+00:00,"Xbox|""Xbox360""|""xbox 360""|""Xbox One""|""Rare""|""Sea of Thieves""|""pirate""|""pirates""|""4K""|""Windows 10""|""Xbox One X""|""Cursed""|""Sails""|""Forsaken""|""Shores""|""Mixer""|""SoT""|""2018""|""Ship""|""Ships""|""Island""|""Cave""|""volcano""|""volcanoes""|""island""|""islands""|""treasure""|""hunt""|""treasure hunt""|""battle""|""cannon""|""skeletons""|""skeleton""|""buried""|""dig""|""shark""|""sharks""|""ghost ship""|""ghost""|""crew""|""multiplayer""|""streaming""|""cannons""|""fire""|""storm""|""twitch""",1152245,2810,247,520,https://i.ytimg.com/vi/QRyzwPzxpcs/default.jpg,False,False,False,"Sea of Thieves' world continues to evolve in the wake of The Hungering Deep. Over the next few months, Cursed Sails and Forsaken Shores will deliver new features, declare new challenges and demonstrate new threats. At E3 2018, we ask what details the Order of Souls can sift from the latest omens... Coming summer 2018. Xbox One and Windows 10 exclusive. Available on Xbox Game Pass.Sea of Thieves is a 4K UHD, HDR, Xbox One X Enhanced, Xbox Play Anywhere title."
38727,QW8whgmyTNU,2018-06-14,This Is America: Women's Edit,Nicole Arbour,24,2018-05-12 22:42:24+00:00,"Nicole Arbour|""World's Sexiest Comedian""|""funny""|""comedian""|""#GOTEAM""|""This Is America""|""Childish Gambino""|""Girl Power""|""#MeToo""|""Feminists""",3158685,0,0,0,https://i.ytimg.com/vi/QW8whgmyTNU/default.jpg,True,True,False,"About This Is America: Women’s EditI thought it best to respond to the misinterpretation of my video here to clarify openly.  (click show more)The purpose of my rendition was to honour the spirit of the video which absolutely moved me, by adding my and many women’s life experiences and truths to the brave and brutal truths expressed in the original. It was created with every intention of bringing a light to women’s experiences such as the shaming of mothers breast feeding, common place date rape drugging, the labels put on us of “prude or hoe,” pressures to create a family, workplace harassment, the glass ceiling, drug dependency, effects of social media on modern relationships and self, and included a nod to the cheerleaders who have come forward demanding at least min wage from the multi million dollar corporations they work for. It was a tongue in cheek way to give additional glory to what I believe is the most impactful piece of art in recent years.In retrospect, due to the sensitive nature of the original, I understand why some people are wrongly portraying this as white vs black. However, this was not the intent or theme at all. We had a very diverse cast and creative team working on project from start to finish, who signed on to honour the original while adding more truth from another perspective. I also understand my cheeky responses to hateful comments have been taken out of context, and I take full responsibility for responding to trolls in a way that could be so easily manipulated and become hurtful when reposted without context. I firmly believe the best thing that can happen in America and North America right now is for everyone to create their own version of this video and show what life is like from their side. Through this honesty, I believe we can discover a new level of empathy and understanding for each other that will ultimately and finally lead us to healing and unity that is desperately needed in society. What can we agree on? What do we have in common? Where are we hurting? Start there, then rebuild. Thanks so much for the continued support while I discover how to best express my ideas, comedy and art, and I appreciate your patience when I fumble while learning to maneuver within the awesome blessing that is having such a large voice. Love for everybody, #GOTEAM 🤘🏻Nicole"
38700,Qcj15vHJTtk,2018-06-14,Royal Wedding - SNL,Saturday Night Live,24,2018-05-20 04:58:51+00:00,"SNL|""Saturday Night Live""|""SNL Season 43""|""SNL Episode 1746""|""Tina Fey""|""Prince Harry""|""Mikey Day""|""Meghan Markle""|""Royal Wedding""|""Kate Middleton""|""Cecily Strong""|""Prince Charles""|""Beck Bennett""|""Queen Elizabeth""|""Kate McKinnon""|""Prince William""|""Alex Moffat""|""Chris Redd""|""Heidi Gardner""|""Kenan Thompson""|""Russell Brand""|""Pete Davidson""|""Elton John""|""Aidy Bryant""|""Leslie Jones""|""s43""|""s43e21""|""episode 21""|""live""|""new york""|""comedy""|""sketch""|""funny""|""hilarious""|""late night""|""host""|""music""|""guest""|""laugh""",8607264,66559,14179,8382,https://i.ytimg.com/vi/Qcj15vHJTtk/default.jpg,False,False,False,"Footage from Prince Harry's (Mikey Day) wedding reception features Kate Middleton (Cecily Strong), Prince Charles (Beck Bennett), Queen Elizabeth (Kate McKinnon), Prince William (Alex Moffat), Auntie Creepy (Tina Fey) and more.#SNL #SNL43Get more SNL: http://www.nbc.com/saturday-night-liveFull Episodes: http://www.nbc.com/saturday-night-liv...Like SNL: https://www.facebook.com/snlFollow SNL: https://twitter.com/nbcsnlSNL Tumblr: http://nbcsnl.tumblr.com/SNL Instagram: http://instagram.com/nbcsnl SNL Pinterest: http://www.pinterest.com/nbcsnl/"
