id,video_id,trending_date,title,channel_title,category_id,publish_time,tags,views,likes,dislikes,comment_count,thumbnail_link,comments_disabled,ratings_disabled,video_error_or_removed,description
38641,fAIX12F6958,2018-06-14,Bumblebee (2018) - Official Teaser Trailer - Paramount Pictures,Paramount Pictures,1,2018-06-05 07:00:01+00:00,[none],19864779,228670,16420,46318,https://i.ytimg.com/vi/fAIX12F6958/default.jpg,False,False,False,"Every adventure has a beginning. Watch the official teaser trailer for Bumblebee, starring Hailee Steinfeld and John Cena. Directed by Travis Knight. #BumblebeeMovie hits theatres this Christmas.Facebook: https://www.facebook.com/BumblebeeMovieTwitter: https://twitter.com/BumblebeeMovieInstagram: https://www.instagram.com/BumblebeeMovieParamount Pictures Corporation (PPC), a major global producer and distributor of filmed entertainment, is a unit of Viacom (NASDAQ: VIAB, VIA), home to premier global media brands that create compelling television programs, motion pictures, short-form content, apps, games, consumer products, social media experiences, and other entertainment content for audiences in more than 180 countries.Connect with Paramount Pictures Online:Official Site: http://www.paramount.com/Facebook: https://www.facebook.com/ParamountInstagram: http://www.instagram.com/ParamountPicsTwitter: https://twitter.com/paramountpicsYouTube: https://www.youtube.com/user/Paramount"
38622,fs_eQQZEZRY,2018-06-14,Can the Emmys be Hacked?,nathanfielder,27,2018-06-08 02:43:22+00:00,"nathan fielder|""emmys""|""hacking""|""voting""|""elections""",302344,13391,155,969,https://i.ytimg.com/vi/fs_eQQZEZRY/default.jpg,False,False,False,Nathan Fielder reveals potential vulnerabilities in the Emmy online voting system with election security expert Carsten Schürmann.
38631,g4ELX7LyXDw,2018-06-14,A.C.E(에이스) - TAKE ME HIGHER MV,official A.C.E,10,2018-06-07 09:00:11+00:00,"A.C.E|""ACE""|""에이스""|""준""|""동훈""|""와우""|""김병관""|""찬""|""JUN""|""DONGHUN""|""WOW""|""KIMBYEONGKWAN""|""CHAN""|""박준희""|""이동훈""|""김세윤""|""강유찬""|""선인장""|""CACTUS""|""콜린""|""CALLIN""|""TAKEMEHIGHER""|""텍미하이어""|""남자아이돌""|""KPOP""|""케이팝""|""idol""|""boygroup""|""컴백""|""COMEBACK""|""Official MV""|""MV""|""Music Videio""|""뮤직비디오""",696271,92955,359,15524,https://i.ytimg.com/vi/g4ELX7LyXDw/default.jpg,False,False,False,▶ OFFICIAL SITE Homepage : http://stayge.net/aceInstagram : http://www.instagram.com/official_a.c.e7 Twitter : https://twitter.com/official_ACE7DaumCafe : http://cafe.daum.net/A.C.E-0523Weibo : http://www.weibo.com/officialACEFacebook : http://www.facebook.com/officialA.C.E7 NaverPost : http://post.naver.com/officialace
38614,g4Hbz2jLxvQ,2018-06-14,SPIDER-MAN: INTO THE SPIDER-VERSE - Official Trailer (HD),Sony Pictures Entertainment,24,2018-06-06 13:00:04+00:00,"Shameik Moore|""Hailee Steinfeld""|""Mahershala Ali""|""Jake Johnson""|""Liev Schreiber""|""SONY PICTURES""|""SPIDER-MAN""|""SPIDER-MAN: INTO THE SPIDER-VERSE""|""Phil Lord""|""Chris Miller""|""Miles Morales""|""Peter Parker""|""Spider-man: Homecoming""|""Spider-man animated""|""Spiderman""|""Marvel Cinematic Universe""|""Marvel""|""Stan Lee""|""Ultimate Spider-man""|""Spiderverse""|""Spider-man sequel""|""Spider Gwen""|""Official Trailer""|""Spider-verse Trailer""|""Lily Tomlin""|""Brian Tyree Henry""",22713067,450315,21428,45545,https://i.ytimg.com/vi/g4Hbz2jLxvQ/default.jpg,False,False,False,"What makes you different is what makes you Spider-Man. Watch the new Spider-Man: Into The #SpiderVerse trailer now - in theaters this Christmas.Subscribe to Sony Pictures for exclusive content: http://bit.ly/SonyPicsSubscribe  Follow us on Social:https://www.facebook.com/SpiderVerseMovie https://www.twitter.com/SpiderVersehttps://www.instagram.com/SpiderVerseMoviePhil Lord and Christopher Miller, the creative minds behind The Lego Movie and 21 Jump Street, bring their unique talents to a fresh vision of a different Spider-Man Universe, with a groundbreaking visual style that’s the first of its kind.  Spider-Man™: Into the Spider-Verse introduces Brooklyn teen Miles Morales, and the limitless possibilities of the Spider-Verse, where more than one can wear the mask. Cast:                                                                   Shameik MooreHailee SteinfeldMahershala AliJake JohnsonLiev SchreiberBrian Tyree HenryLuna Lauren VelezLily Tomlin"
38586,g4txv3A9ICQ,2018-06-14,5 Seconds of Summer - No Roots (Alice Merton Cover) in the Live Lounge,BBCRadio1VEVO,10,2018-06-12 15:50:25+00:00,"5SOS|""5 Seconds of Summer""|""No Roots""|""Cover""|""BBC""|""Radio 1""|""Live Lounge""|""Alice Merton""",92541,12867,39,986,https://i.ytimg.com/vi/g4txv3A9ICQ/default.jpg,False,False,False,5SOS cover Alice Merton's No Roots in the BBC Radio 1 Live Loungehttp://vevo.ly/ro9zTH
38578,gPHVLxm8U-0,2018-06-14,Courtney Hadwin: 13-Year-Old Golden Buzzer Winning Performance - America's Got Talent 2018,America's Got Talent,24,2018-06-13 02:04:30+00:00,"America's Got Talent 2018|""america's got talent""|""america's got talent fails""|""america's got talent best""|""america's got talent auditions""|""AGT""|""AGT 2018 Auditions""|""AGT best auditions""|""NBC""|""TV""|""TV Shows""|""Highlights""|""Previews""|""Simon Cowell""|""Howie Mandel""|""Tyra Banks""|""Heidi Klum""|""Mel B""|""season 13""|""America's""|""Got""|""Talent""|""funny""|""judge""|""vote""|""clips""|""talent""|""entertainment""|""competition""|""biggest talent show""|""talent show""",5829270,87323,3668,11933,https://i.ytimg.com/vi/gPHVLxm8U-0/default.jpg,False,False,False,"We did not see that coming! You won't believe the performance from this eccentric teenager. Courtney earns Howie Mandel's Golden Buzzer sending her straight to the live shows.» Get The America's Got Talent App: http://bit.ly/AGTAppDownload» Subscribe for More: http://bit.ly/AGTSub» Watch America's Got Talent Tuesdays 8/7c on NBC!» Watch Full Episodes Free: http://bit.ly/AGTFullEpisodesAMERICA'S GOT TALENT ON SOCIALLike AGT: https://www.facebook.com/agtFollow AGT: https://twitter.com/agtAGT Tumblr: http://nbcagt.tumblr.com/AGT Instagram: http://instagram.com/agtIn season 13, NBC's America's Got Talent follows Simon Cowell, Heidi Klum, Mel B, Howie Mandel, and host Tyra Banks in their talent search, showcasing unique performers from across the country.Find America's Got Talent trailers, full episode highlights, previews, promos, clips, and digital exclusives here.NBC ON SOCIALLike NBC: http://Facebook.com/NBCFollow NBC: http://Twitter.com/NBCNBC Tumblr: http://NBCtv.tumblr.com/NBC Pinterest: http://Pinterest.com/NBCtv/NBC Google+: https://plus.google.com/+NBCYouTube: http://www.youtube.com/nbcNBC Instagram: http://instagram.com/nbcABOUT AMERICA'S GOT TALENTWith the talent search open to acts of all ages, America's Got Talent has brought the variety format back to the forefront of American culture by showcasing unique performers from across the country. The series is a true celebration of the American spirit, featuring a colorful array of singers, dancers, comedians, contortionists, impressionists, jugglers, magicians, ventriloquists and hopeful stars, all vying for their chance to win America's hearts and the $1 million prize. Follow judges Simon Cowell, Heidi Klum, Mel B, Howie Mandel, and host Tyra Banks in their talent search!Courtney Hadwin: 13-Year-Old Sings Golden Buzzer Winning Performance - America's Got Talent 2018https://youtu.be/gPHVLxm8U-0America's Got Talenthttp://www.youtube.com/user/americasgottalent"
38725,gf7FV1i7lb8,2018-06-14,"Roman Reigns unleashes an all-out assault on Jinder Mahal: Raw, May 14, 2018",WWE,17,2018-05-15 02:50:16+00:00,"wwe|""world wrestling entertainment""|""wrestling""|""wrestler""|""wrestle""|""superstars""|""कुश्ती""|""पहलवान""|""डब्लू डब्लू ई""|""मैच""|""सुपरस्टार""|""व्यावसायिक कुश्ती""|""مصارعه""|""Raw""|""Roman Reigns""|""Sunil Singh""|""Jinder Mahal""|""sp:ty=high""|""sp:st=wrestling""|""sp:scp=athlete_in_match""|""sp:dt=2018-05-14T20:00:00-04:00""|""sp:ev=wwe-raw""|""sp:ath=wwe-roman""|""sp:ath=wwe-jinma""|""wwe raw 7 may 2018""|""jinder mahal attacks roman reigns""|""wwe raw 5/7/2018 highlights""|""wwe raw 7th may 2018 highlights""|""wwe raw""|""roman reigns raw 7th may 2018""",7472536,60804,4303,6848,https://i.ytimg.com/vi/gf7FV1i7lb8/default.jpg,False,False,False,"One week after Jinder Mahal cost Roman Reigns a Triple Threat Money in the Bank Qualifying Match, The Big Dog goes hunting for The Modern Day Maharaja.Get your first month of WWE Network for FREE: http://wwenetwork.comSubscribe to WWE on YouTube: http://bit.ly/1i64OdTVisit WWE.com: http://goo.gl/akf0J4Must-See WWE videos on YouTube: https://goo.gl/QmhBof"
38669,hHaUQh6Gx-Q,2018-06-14,"Mustard, Nick Jonas - Anywhere",MustardVEVO,10,2018-05-22 12:00:02+00:00,"Mustard|""Nick""|""Jonas""|""Anywhere""|""10""|""Summers""|""Interscope""|""PS""|""Pop""",2653229,48889,890,1181,https://i.ytimg.com/vi/hHaUQh6Gx-Q/default.jpg,False,False,False,"Anywhere Out Now! http://smarturl.it/AnywhereMustardxNJFollow Mustard:https://www.instagram.com/Mustardhttps://www.twitter.com/Mustardhttps://www.facebook.com/DJMustardOnTheBeatMusic video by Mustard, Nick Jonas performing Anywhere. © 2018 10 Summers Records LLC/Interscope Recordshttp://vevo.ly/S9fFms"
38682,hq1ijbMabsM,2018-06-14,Monét X Change - Soak It Up (feat. Bob The Drag Queen),Monét X Change,10,2018-05-25 01:15:00+00:00,"soak it up|""dance""|""rpdr""|""rupaul's drag race""|""pop""|""gay""|""lgbt""|""drag""|""drag queen""",774849,31987,1336,3529,https://i.ytimg.com/vi/hq1ijbMabsM/default.jpg,False,False,False,Buy Monét X Change's 'SOAK IT UP' now! Monét X Change feat. Bob The Drag Queen performing Soak It Up© 2018 Monét X ChangeDirector:  Assaad YacoubProducer: Alex Lampsos Director of Photography:  Ilya ChegodarEditors:  Nick Landa & Coco Jeanquier1st AC:  Adriana Ledesma2nd AC:  Jonathan WongGaffer:  Steven TalentsKey Grip:  David Grother IIGrip:  Alejandro RojasDIT:  Charlie ClarkSound:  Cory Baker CAST Monique Heart Boomer BanksThe Kiss BoysMONET X CHANGE / SOAK IT UPNEW SINGLE / OUT NOWiTunes:  https://itunes.apple.com/us/album/soak-it-up-single/1386981975Apple Music:  https://itunes.apple.com/us/album/soak-it-up-single/1386981975Spotify:  https://open.spotify.com/album/2pJbUeVzXT2f7HGB8H0H2FGoogle Play:  https://play.google.com/store/music/album/Mon%C3%A9t_X_Change_Soak_It_Up?id=Bf437sn637ggkvginfwcn47jr7iAmazon:  https://www.amazon.com/dp/B07D5QKV57Tidal:  https://tidal.com/album/89122338FOLLOW MONET X CHANGE:http://www.facebook.com/likemonetxchangehttp://www.twitter.com/monetxchangehttp://www.instagram.com/monetxchangehttp://www.monetxchange.com
38594,i63jWjoAWHE,2018-06-14,Семён Слепаков: Олé-Олé-Олé!,Семен Слепаков,23,2018-06-11 17:13:08+00:00,"Семен Слепаков|""гитара""|""бард-десятник""|""Comedy Club""|""песни""|""юмор""|""под гитару""|""Semen Slepakov""|""Оле оле оле""|""Оле""|""Семен Слепаков Оле Оле Оле""|""сенен слепаков новая песня""|""Чемпионат мира по футболу""|""ЧМ2018""|""футбол""",6597033,301185,14448,16505,https://i.ytimg.com/vi/i63jWjoAWHE/default.jpg,False,False,False,Семен в социальных сетях:FACEBOOK https://www.facebook.com/semen.slepakov.tnt INSTAGRAM http://instagram.com/slepakovsemyonАвторы текста Семен Слепаков и Джавид Курбанов
38713,iaL3EEWspLo,2018-06-14,Joe Rogan Experience #1117 - Tim Kennedy,PowerfulJRE,22,2018-05-17 23:11:42+00:00,"Joe Rogan Experience|""Joe Rogan""|""JRE""|""JRE MMA Show""|""#27""|""Tim Kennedy""|""Special Forces""|""UFC""|""mma""|""Ultimate Fighting Championship""|""comedy""|""comedian""|""jokes""|""stand up""|""funny""",1261570,16441,2514,6217,https://i.ytimg.com/vi/iaL3EEWspLo/default.jpg,False,False,False,"Tim Kennedy is a Ranger, sniper, Special Forces Operator, and recently retired UFC Fighter."
38730,igT1QKKm2GE,2018-06-14,James Bay - Slide (Live),JamesBayVEVO,10,2018-05-10 16:00:02+00:00,"James|""Bay""|""Slide""|""Republic""|""Records""|""Alternative""",7916368,47122,1648,875,https://i.ytimg.com/vi/igT1QKKm2GE/default.jpg,False,False,False,"Slide (Live Video)Song Available on the new album Electric Light (Pre-Order Today)https://JamesBay.lnk.to/ElectricLightYD Connect With James Bay:http://jamesbay.com https://www.facebook.com/jamesbaymusic https://instagram.com/jamesbaymusic https://soundcloud.com/jamesbaymusic https://twitter.com/JamesBayMusic Directed & Produced by Jackson DucasseMusic video by James Bay performing Slide. © 2018 Republic Records, a division of UMG Recordings, Inc.http://vevo.ly/GgOBsv"
38599,iztt-GoNv18,2018-06-14,(DAAAMN!) MIKE TYSON THROWS WATER ON DON KING; EXPLAINS WHY BAD BLOOD STILL: HE REALLY DID ME IN,FightHype.com,17,2018-06-11 03:14:53+00:00,"Mike Tyson|""Don King""|""Boxing""|""FightHype""",406742,2228,93,1008,https://i.ytimg.com/vi/iztt-GoNv18/default.jpg,False,False,False,"😳😳😳 @miketyson throws drink at Don king at the BHOF event when don tried to touch him as if they were friends, wrote Akin Ak Reyes, sports radio personality on SiriusXM rush 93 and host of The Sweet Scientists on thisis50.com, who recently took to social media and posted a video of heavyweight legend Mike Tyson throwing water on his former promoter Don King. Check it out!Video courtesy @boxingwithak, @phriedmans_phitness, @randy.c.gordon & @gerryacooney"
38600,l25AL0BdD6w,2018-06-14,Sugarland - Babe ft. Taylor Swift,SugarlandVEVO,10,2018-06-10 01:00:03+00:00,"Sugarland|""Babe""|""Big""|""Machine""|""Records""|""LLC""|""Country""",3877234,163281,4337,11961,https://i.ytimg.com/vi/l25AL0BdD6w/default.jpg,False,False,False,"Music video by Sugarland performing Babe. © 2018 UMG Recordings, Inc.http://vevo.ly/9Sdo0D"
38738,l884wKofd54,2018-06-14,Enrique Iglesias - MOVE TO MIAMI (Official Video) ft. Pitbull,EnriqueIglesiasVEVO,10,2018-05-09 07:00:01+00:00,"Enrique Iglesias feat. Pitbull|""MOVE TO MIAMI""|""Pop""|""RCA Records/Sony Music International/Sony Music Latin""",25066952,268088,12783,9933,https://i.ytimg.com/vi/l884wKofd54/default.jpg,False,False,False,NEW SONG - MOVE TO MIAMI feat. Pitbull (Click SHOW MORE below)Watch on YouTube: http://smarturl.it/MTMvEnrique?iQid=yt  - Shazam to Unlock an exclusive video!Listen on Spotify: http://smarturl.it/EnriqueMTM/spotify?iQid=yt  Apple Music: http://smarturl.it/EnriqueMTM/applemusic?iQid=yt  iTunes: http://smarturl.it/EnriqueMTM/itunes?iQid=yt  Google Play: http://smarturl.it/EnriqueMTM/googleplay?iQid=yt  Amazon: http://smarturl.it/EnriqueMTM/az?iQid=yt  Deezer: http://smarturl.it/EnriqueMTM/deezer?iQid=yt  Choose Your Platform!: http://smarturl.it/EnriqueMTM?iQid=yt  ENRIQUE ON TOUR (Tickets): https://enriqueiglesias.com/events  FOLLOW ENRIQUE: Instagram: http://www.instagram.com/enriqueiglesias Facebook: http://www.facebook.com/enriqueiglesias Twitter: http://www.twitter.com/enriqueiglesias Snapchat: enriqueSign up to http://www.enriqueiglesias.com for exclusive access and offers.
38722,m6lY1GXTu5M,2018-06-14,"Ariana Grande, Jimmy & The Roots Sing No Tears Left to Cry w/ Nintendo Labo Instruments",The Tonight Show Starring Jimmy Fallon,23,2018-05-15 03:44:48+00:00,"Jimmy Fallon|""Tonight Show Starring Jimmy Fallon""|""The Tonight Show""|""NBC""|""NBC TV""|""Television""|""Funny""|""Talk Show""|""comedic""|""humor""|""stand-up""|""snl""|""Fallon Stand-up""|""Fallon monologue""|""tonight""|""show""|""jokes""|""funny video""|""interview""|""variety""|""comedy sketches""|""talent""|""celebrities""|""music""|""musical performance""|""The Roots""|""video""|""clip""|""highlight""|""talking""|""youtube""|""sketch comedy""|""music comedy""|""Sweetener""|""Nintendo LABO""|""Sam & Cat""|""No Tears Left To Cry""|""Dangerous Woman""|""Victorious""|""pop""",4846885,270682,1945,9530,https://i.ytimg.com/vi/m6lY1GXTu5M/default.jpg,False,False,False,"Ariana Grande joins Jimmy and The Roots to perform No Tears Left to Cry with Nintendo Labo instruments. Each instrument is made from only cardboard and a Nintendo Switch and is being played live. Full instrument list below.Ariana Grande - VocalsJimmy Fallon - Guitar, Piano StudioQuestlove - Robot Kit Black Thought - Electric Guitar Fishing RodKamal Gray - Toy-Con Piano x2 (Organ)James Poyser - Toy-Con Piano x2Captain Kirk - Acoustic GuitarMark Kelley - Bass GuitarStro - Toy-Con Garage Drum MachineSubscribe NOW to The Tonight Show Starring Jimmy Fallon: http://bit.ly/1nwT1aNWatch The Tonight Show Starring Jimmy Fallon Weeknights 11:35/10:35cGet more Jimmy Fallon: Follow Jimmy: http://Twitter.com/JimmyFallonLike Jimmy: https://Facebook.com/JimmyFallonGet more The Tonight Show Starring Jimmy Fallon: Follow The Tonight Show: http://Twitter.com/FallonTonightLike The Tonight Show: https://Facebook.com/FallonTonightThe Tonight Show Tumblr: http://fallontonight.tumblr.com/Get more NBC: NBC YouTube: http://bit.ly/1dM1qBHLike NBC: http://Facebook.com/NBCFollow NBC: http://Twitter.com/NBCNBC Tumblr: http://nbctv.tumblr.com/NBC Google+: https://plus.google.com/+NBC/postsThe Tonight Show Starring Jimmy Fallon features hilarious highlights from the show including: comedy sketches, music parodies, celebrity interviews, ridiculous games, and, of course, Jimmy's Thank You Notes and hashtags! You'll also find behind the scenes videos and other great web exclusives.Ariana Grande, Jimmy & The Roots Sing No Tears Left to Cry w/ Nintendo Labo Instrumentshttp://www.youtube.com/fallontonight"
38684,mQ055hHdxbE,2018-06-14,John Mayer - New Light (Premium Content!),John Mayer,10,2018-05-24 13:42:02+00:00,"John Mayer|""New Light""|""Music Video""|""Official""|""Premium Content""|""Funny""|""Comedy""",5948415,181069,3711,14394,https://i.ytimg.com/vi/mQ055hHdxbE/default.jpg,False,False,False,“New Light” available now: http://johnmayer.com(C) 2018 Snack Money
38608,mUYsp5baMXo,2018-06-14,Maroon 5 - Three Little Birds,Maroon5VEVO,10,2018-06-09 07:01:01+00:00,"Maroon 5|""Adam Levine""|""3 Little Birds""|""Girls Like You""|""Bob Marley""|""Hyundai""",5517903,243696,12874,16841,https://i.ytimg.com/vi/mUYsp5baMXo/default.jpg,False,False,False,"3 Little Birds” is out now.http://smarturl.it/3LittleBirds For more, visit:https://www.facebook.com/maroon5https://twitter.com/maroon5https://www.instagram.com/maroon5 Sign up for updates: http://smarturl.it/Maroon5.News“Three Little Birds” – a Bob Marley song as performed by Maroon 5. http://vevo.ly/hvdJE9"
38729,mzB1VGEGcSU,2018-06-14,Juice Wrld - Lucid Dreams (Dir. by @_ColeBennett_),Cole Bennett - Lyrical Lemonade,24,2018-05-11 02:05:33+00:00,"Juice Wrld|""Lucid Dreams""|""Music Video""|""Hip Hop""|""Rap""|""All Girls Are The Same""|""Lyrical Lemonade""|""Cole Bennett""|""lucid dreams juice wrld""|""lucid dreams cole bennett""|""lucid dreams lyrical lemonade""|""cole bennett lucid dreams""|""lucid dreams official""|""lucid dreams 2018""|""lucid dreams official music video""|""lucid dreams music video""|""juice wrld official""|""juice wrld 2018""|""juice wrld music""|""cole bennett official""|""lyrical lemonades official""",20981880,437224,8516,37560,https://i.ytimg.com/vi/mzB1VGEGcSU/default.jpg,False,False,False,"Juice Wrld - Lucid DreamsJuice WRLD's Channel: http://bit.ly/Juice_WRLDhttp://smarturl.it/LucidDreamsJWSong Produced by Nick MiraDirected + Edited by Cole BennettDirector of Photography: Cole SchwartzSteadicam by Bayley Pokorney--Official Channel of Cole Bennett / Lyrical LemonadeSubscribe for updates on music videos, interviews, performance videos, etc.Cole Bennetthttp://www.twitter.com/_colebennett_http://www.instagram.com/_colebennett_Lyrical Lemonadehttp://www.twitter.com/lyricalemonadehttp://www.instagram.com/lyricalemonadehttp://www.lyricallemonade.com"
38627,nSbzyEJ8X9E,2018-06-14,A STAR IS BORN - Official Trailer 1,Warner Bros. Pictures,24,2018-06-06 16:00:23+00:00,"A Star Is Born|""Warner Bros.""|""WB Pics.""|""Lady Gaga""|""Bradley Cooper""|""Eddie Griffin""|""Greg Grunberg""|""Dave Chappelle""|""DJ Shangela Pierce""|""William Belli""|""Anthony Ramos""|""Andrew Dice Clay""|""Michael Harney""|""Bonnie Somerville""|""Rafi Gavron""|""Rebecca Field""|""Lukas Nelson""|""Brandi Carlile""|""Halsey""|""WB""|""Metro Goldwyn Mayer""|""MGM""",4653335,62663,1911,8269,https://i.ytimg.com/vi/nSbzyEJ8X9E/default.jpg,False,False,False,"Follow #AStarIsBorn on social media:www.astarisbornmovie.com https://www.facebook.com/StarIsBornMovie/ https://www.twitter.com/starisbornmoviehttps://www.instagram.com/starisbornmovie        “A Star is Born” stars four-time Oscar nominee Bradley Cooper (“American Sniper,” “American Hustle,” “Silver Linings Playbook”) and multiple award-winning, Oscar-nominated music superstar Lady Gaga, in her first leading role in a major motion picture. Cooper helms the drama, marking his directorial debut.  In this new take on the tragic love story, he plays seasoned musician Jackson Maine, who discovers—and falls in love with—struggling artist Ally (Gaga). She has just about given up on her dream to make it big as a singer... until Jack coaxes her into the spotlight. But even as Ally’s career takes off, the personal side of their relationship is breaking down, as Jack fights an ongoing battle with his own internal demons.  The cast of “A Star is Born” also includes Andrew Dice Clay, with Dave Chappelle and Sam Elliott.  In addition to playing Ally, Gaga, who earned her Oscar nod for the song “Til It Happens to You” from “The Hunting Ground,” performs original songs in the film, which she wrote with Cooper and a handful of artists, including Lukas Nelson, Jason Isbell and Mark Ronson. All the music is original and was recorded live.  “A Star is Born” is produced by Bill Gerber, Jon Peters, Bradley Cooper, Todd Phillips and Lynette Howell Taylor. Ravi Mehta, Basil Iwanyk, Niija Kuykendall, Sue Kroll, Michael Rapino and Heather Parry serve as executive producers. The screenplay is by Eric Roth and Bradley Cooper & Will Fetters.  Collaborating with Cooper behind the scenes are Oscar-nominated director of photography Matthew Libatique (“Black Swan”), production designer Karen Murphy, three-time Oscar-nominated editor Jay Cassidy (“American Hustle,” “Silver Linings Playbook,” “Into the Wild”), and costume designer Erin Benach.  Warner Bros. Pictures Presents, in Association with Live Nation Productions, in Association with Metro Goldwyn Mayer Pictures, A Jon Peters/Bill Gerber/Joint Effort Production, “A Star is Born.” Slated for release on October 5, 2018, the film will be distributed worldwide by Warner Bros. Pictures, a Warner Bros. Entertainment Company. It is rated R."
38718,niviooakBLs,2018-06-14,Years & Years - If You're Over Me (Official video),YearsAndYearsVEVO,10,2018-05-14 23:01:00+00:00,"Years|""If""|""You're""|""Over""|""Me""|""Polydor""|""Records""|""Electronic""",4207558,78634,2681,2158,https://i.ytimg.com/vi/niviooakBLs/default.jpg,False,False,False,"Stream/Download: https://YearsandYears.lnk.to/IYOMIDPalo Santo. The new album, out 6th July 2018. Pre-order via the official store for exclusive ticket access to forthcoming UK and US shows: https://YearsandYears.lnk.to/PaloSantoIDStandby for Incoming Transmissions: https://YearsandYears.lnk.to/PSENsIDConnect with Years & Years:http://www.facebook.com/YearsAndYears/http://www.instagram.com/yearsandyears/ http://twitter.com/yearsandyearshttp://yearsandyears.comMusic video by Years & Years performing If You're Over Me. © 2018 Universal Music Operations Limitedhttp://vevo.ly/OaLRH6"
38716,nkWn5vKCZj4,2018-06-14,Joe Rogan Shuts Down Steven Tyler's Conspiracy Theories,Joe Rogan Fan Page,22,2018-05-17 00:56:43+00:00,"joe rogan|""steven tyler""|""joe rogan conspiracy theories""|""joe rogan aliens""|""joe rogan ufos""|""aliens""|""bigfoot""|""ufo""|""steven tyler interview""|""steven tyler aliens""|""joe rogan bigfoot""|""joe rogan experience""|""joe rogan podcast""|""jre""|""jre 1116""|""joe""|""rogan""|""joe rogan comedy""|""joe rogan stand up""|""joe rogan funny""|""joe rogan ufc""|""joe rogan comedian""|""comedy""|""funny""|""conspiracy theories joe rogan""|""joe rogan steven tyler""",1463583,10835,2597,12799,https://i.ytimg.com/vi/nkWn5vKCZj4/default.jpg,False,False,False,"Joe Rogan and Steven Tyler talk about conspiracy theories, aliens, ancient humans, bigfoot etc. From The Joe Rogan Experience Podcast, JRE #1116. Full podcast - https://www.youtube.com/watch?v=0HqLk_ZbHmIJoe Rogan Shuts Down Steven Tyler's Conspiracy Theorieshttps://www.youtube.com/watch?v=nkWn5vKCZj4"
